Nom,Description,Photo
Samuel P. Huntington,"Un pavé dans la mare. Les propos de Samuel Huntington ont souvent été controversés, critiqués : il est vrai que son interprétation de l'évolution de la politique mondiale et des relations internationales est percutante.
Les chocs entre civilisations représentent la principale menace pour la paix dans le monde, mais ils sont aussi, au sein d'un ordre international désormais fondé sur les civilisations, le garde-fou le plus sûr contre une guerre mondiale.
D'après l'auteur, la géopolitique mondiale ne se lit plus dans l'opposition idéologique - comme ce fut le cas entre les deux blocs de la guerre froide -, mais dans des conflits et des oppositions entre grandes civilisations, regroupées par affinités culturelles.
Les mots peuvent choquer : l'auteur questionne le possible déclin de l'Occident face à la montée en puissance économique et démographique des pays d'Asie (Chine et Inde) et face à l'islam. Mais le raisonnement se fait plus profond, plus convaincant : la mondialisation n'entraîne pas une uniformisation des civilisations, mais renforce des pôles majeurs, suscite des nouvelles concurrences, alliances et oppositions. Il propose à un public averti un cadre général à la compréhension de la politique globale à l'aube du XXIe siècle. --Mattieu Reno",https://m.media-amazon.com/images/I/01Kv-W2ysOL._SY600_.png
Gregoire Chamayou,"Grégoire Chamayou est agrégé de philosophie, chercheur au CNRS Cerphi ENS Lyon. Derniers livres parus : Théorie du drone (2013), Les chasses à l'homme (2010).",https://m.media-amazon.com/images/I/01Kv-W2ysOL._SY600_.png
Jérôme Fourquet,"Jérôme Fourquet est analyste politique, expert en géographie électorale, directeur du département Opinion à l'IFOP. Sylvain Manternach est géographe et cartographe, issu de l'Institut français de géopolitique.",https://m.media-amazon.com/images/I/01Kv-W2ysOL._SY600_.png
Yves Cochet,"Pablo Servigne Ingénieur agronome et docteur en biologie. Spécialiste des questions d'effondrement, de transition, d'agroécologie, il a publié récemment L'Entraide (LLL, 2017). Raphaël Stevens Eco-conseiller, expert en résilience des systèmes socioécologiques, il est cofondateur du bureau de consultance Greenloop.",
Max Weber,,https://m.media-amazon.com/images/I/01Kv-W2ysOL._SY600_.png
Giuliano da Empoli,,https://m.media-amazon.com/images/I/01Kv-W2ysOL._SY600_.png
Alain Deneault,"Alain Deneault, docteur en philosophie de l'Université Paris-VIII, est notamment l'auteur de Noir Canada (Ecosociété, 2008), Offshore (Ecosociété/La Fabrique, 2010), Paradis sous terre (Ecosociété/Rue de l'Echiquier, 2012), ""Gouvernance"" (Lux, 2013) et Paradis fiscaux (Ecosociété, 2014).",https://m.media-amazon.com/images/I/31-KQPlCwKL._SY600_.jpg
Cristina de Robertis,"Depuis 35 ans, par une approche globale qui prend en compte les dimensions individuelle, familiale et de groupe, ce manuel demeure la référence pour la formation aux méthodes du travail social. Traduit en plusieurs langues, il représente une contribution fondamentale à la construction internationale du travail social. Cette nouvelle édition a été révisée et actualisée en tenant compte des évolutions récentes des problématiques et des terminologies.
Parce qu'une profession n'existe pas sans un ensemble de connaissances transmissibles et un cadre conceptuel général intégrant la diversité des approches et des modèles, ce livre contient les éléments de base indispensables pour le savoir-faire professionnel (processus historique de construction de la méthodologie, liens entre travail social et sciences sociales, concepts et élaboration de la méthodologie d'intervention et étapes du processus d'intervention), tout en contribuant à la construction d'une professionnalité créative et impliquée.
Les étudiants et praticiens du travail social (re)découvriront ici un véritable manuel de formation professionnelle, initialement destiné aux futurs assistants de service social, mais dont l'audience s'est depuis élargie à d'autres formations en travail social. Ils y trouveront un outil d'analyse et de réflexion proposant des repères pour une plus grande aisance pratique, et un cadre conceptuel général pour penser leur savoir-faire professionnel.",https://m.media-amazon.com/images/I/01Kv-W2ysOL._SY600_.png
Emmanuel Dockès,"Emmanuel Dockès est professeur de droit du travail à l’université Paris Ouest Nanterre. Il réfléchit et écrit également au-delà du domaine juridique, et notamment sur les rapports de pouvoir en démocratie. Il collabore à plusieurs expérimentations misarchiques. Il a ainsi participé à l’exposition Lieux infinis à la Biennale d’architecture de Venise en 2018 sur le thème de friches, avec le collectif rennais de l’Hôtel Pasteur.",https://m.media-amazon.com/images/I/01Kv-W2ysOL._SY600_.png
Zygmunt Bauman,"Zygmunt Bauman est né en Pologne en 1925. Il a enseigné la sociologie à l'université de Leeds, où il est professeur émérite. Sociologue de réputation mondiale il a publié de nombreux ouvrages, dont, dans la collection ""Pluriel"", Le coût humain de la mondialisation, La vie en miettes, L'amour liquide, La société assiégée.",https://m.media-amazon.com/images/I/61HXlwF3LuL._SY600_.jpg
Mahnaz Shirali,"En novembre 2019, en réaction à une révolte populaire, les dirigeants de la République islamique coupent la connexion Internet du pays. Ils massacrent à huis clos, en trois jours, au moins 1 500 manifestants pacifiques. Depuis 1979, l'Iran est devenu l'un des pays les plus fermés au monde, et son régime l'un des plus dictatoriaux. L'économie est exsangue, les désastres écologiques accablent la population, par ailleurs ravagée par la Covid-19. La plupart des journalistes iraniens sont en prison et les femmes qui résistent à la domination religieuse sont réprimées. Privés de leurs droits fondamentaux, et en l'absence de libertés politiques, les Iraniens ont pour seul espace d'expression les réseaux sociaux. Le contrôle d'Internet est ainsi devenu un enjeu majeur pour les responsables politiques, obligés de s'en réapproprier les codes pour diviser la société. La mobilisation virtuelle annoncerait-elle un soulèvement populaire ? Mahnaz Shirali a mené l'enquête au cœur de ces réseaux sociaux. À la lumière de l'histoire et de la culture iraniennes, son analyse des réactions et des comportements des internautes révèle un peuple iranien bien différent de celui habituellement représenté dans les médias, et dont les récits semblent être autant d'appels à l'aide. Arrivée en France en 1994, Mahnaz Shirali est docteure en sociologie et HDR en sciences politiques. Elle a notamment publié La jeunesse iranienne : une génération en crise (PUF, 2001), La malédiction du religieux. La défaite de la pensée démocratique en Iran (François Bourin, 2012) et The Mystery of Contemporary Iran (Transaction Publishers, 2014).",https://m.media-amazon.com/images/I/01Kv-W2ysOL._SY600_.png
Fabien Hein,"Fabien Hein est sociologue à l'Université de Lorraine (2L2S / LIEC) et dirige actuellement l'Observatoire Hommes-Milieux "" Pays de Bitche "" (CNRS / INEE). Ancien bassiste, manager et roadie, il a enregistré plusieurs disques et effectué des centaines de concerts en Europe et aux Etats-unis. Critique musical, il a longuement collaboré avec plusieurs fanzines européens (Kérosène, Vincebus Eruptum, Desert-rock.) et écrit aujourd'hui dans Versus Magazine. Il a publié Rock & Religion. Dieu(x) et la musique du diable (Autour du Livre, 2006), Ma petite entreprise punk. Sociologie du système D (Kicking Books, 2011) et Do it yourself ! Autodétermination et culture punk (Le passager clandestin, 2012). Dom Blake est éditeur au passager clandestin.",
Michel Clouscard,,https://m.media-amazon.com/images/I/01Kv-W2ysOL._SY600_.png
Fillieule O.,"Olivier Fillieule, 28 ans. Politologue, rattaché au Centre d'Etude de la Vie Politique Française (CNRS). Il poursuit ses recherches sur les mobilisations des années quatre-vingt en France. Il est par ailleurs moniteur d'enseignement supérieur d l'Institut d'Etudes Politiques de Paris. Cécile Péchu, 24 ans. Politologue, rattachée au Centre de Recherches Administratives (CNRS). Ses recherches portent actuellement sur l'action collective en faveur du droit au logement. Elle a par ailleurs travaillé sur le Front national et le sida comme enjeu politique.",
Jeremy Locke,"C.C. Atman est un auteur français né en région parisienne qui a grandi auprès des forêts du Vexin durant la majeure partie de son enfance. C'est là qu'il a effectué, sans le savoir, ses premiers pas de découverte de la Nature et de toute la liberté et l'indépendance qu'elle peut procurer, en particulier pour qui sait l'approcher. Issu d'un milieu familial modeste et commun, il a suivi une scolarité traditionnelle, mais s'est néanmoins interrogé très tôt sur le sens de l'existence telle qu'elle lui était proposée, au point de rompre à plusieurs reprises avec la vie aisée dont il disposait. La naissance de ses deux enfants, la vie routinière dans laquelle il s'enlisait, et peut-être aussi la mort prématurée de sa mère après un long cancer alors qu'elle venait tout juste d'être retraitée, l'ont poussé instinctivement à opérer le plus grand des « sauts de foi » comme il aime les appeler. Il vendit sa voiture, sa maison, quitta sa profession de cadre ainsi que le confort et la sécurité acquis, et partit ainsi à la découverte du plus grand terrain de jeu qui puisse attendre un humain : la planète Terre. Accompagné seulement de son fils et de sa fille, alors âgés respectivement de dix et de huit ans, il se lança dans la quête ultime de renouer avec le plus haut état de bonheur qui puisse être vécu par un être humain. Ce long voyage guida ses pas à travers tous les continents et de nombreux pays. De l'Inde aux Amériques, en passant par l'Asie et l'Océanie, des déserts arides d'Australie aux jungles tropicales humides de Bornéo et ses dernières forêts primaires, des barrières de corail du Pacifique jusqu'aux plus hauts plateaux et montagnes des Andes et de l'Himalaya, chacun de ses pas l'a mené vers une multitude de rencontres et d'expériences uniques, mais aussi vers des enseignements millénaires venant de la Nature ou de l'Humanité. Il partage cette richesse immatérielle depuis 2015 en consacrant sa vie à l'écriture d'essais, d'enseignements et de romans inspirants.",https://m.media-amazon.com/images/I/01Kv-W2ysOL._SY600_.png
Olivier Abel,"Quel rapport entre les crimes abjects des djihadistes, le danger que représentent à certains égards les « réseaux sociaux » pour la démocratie et la civilité, la question de la liberté d’expression et du blasphème, le durcissement quasi-guerrier de la laïcité, les gilets jaunes, les majorités dangereuses qui ont porté Trump ou Erdogan au pouvoir, et qui poussent à nos portes ? Nous ne comprenons pas ce qui nous arrive, ces colères qui montent en miroir sans plus rien chercher à comprendre, nous ne savons et sentons plus ce que nous faisons. Je voudrais proposer ici une hypothèse. Nous avons globalement fait fausse route. Nous nous sommes enfoncés dans le déni de l’humiliation, de son importance, de sa gravité, de son existence même.

L’humiliation est partout dans nos sociétés, et nous ne la voyons pas. C’est qu’elle est difficile à mesurer, et semble subjective : ce qui humiliera l’un laissera l’autre indifférent. Elle est même souvent instrumentalisée par le machiavélisme politique, ou pire, le fanatisme religieux, quand elle n’est pas tout simplement une technique managériale. Et cela, d’autant plus que nous nous sommes enfoncés dans le déni de l’humiliation, de sa gravité, de son existence même. Nos sociétés sont sensibles aux violences et aux inégalités, mais insensibles à l’humiliation qui les empoisonne, et il nous faudrait enquêter sur les racines de cette insensibilité. Et pourtant l’humiliation est là : si les violences s’attaquent au corps de l’autre, l’humiliation s’attaque à son visage. L’humiliation fait taire le sujet parlant, elle lui fait honte de son expression, de ses croyances et de ses goûts, elle ruine sa confiance en soi, elle dévaste pour longtemps les circuits de la reconnaissance, et laisse derrière elle une parole dérisoire ou fanatique. Elle peut également atteindre des minorités langagières, sexuelles, raciales, religieuses, sociales, etc. Il arrive même qu’une majorité soit humiliée par une minorité dominante, et devienne une majorité « dangereuse ». L’humiliation du Traité de Versailles prépare la venue de Hitler au pouvoir. Beaucoup de nos sociétés jadis démocratiques sont rongées par ces manipulations de la peur et ces politiques du ressentiment, qu’attisent les « réseaux sociaux » et les médias où s’affichent librement les haines et les mépris. La barbarie pousse à nouveau aux portes de notre Histoire. C’est pourquoi il est urgent d’imaginer ce que serait une société dont les institutions (police, préfectures, administrations, prisons, hôpitaux, écoles, etc.) seraient exemplairement non-humiliantes. Dans l’état actuel de nos économies, il faudra un énorme effort pour obtenir une société plus juste, mais pourquoi ne pas essayer de mettre en œuvre une société moins humiliante ? C’est possible et urgent, faisons-le.",https://m.media-amazon.com/images/I/01Kv-W2ysOL._SY600_.png
Felwine Sarr,Repenser notre présence au monde est le défi de notre époque. Cet essai de politique relationnelle invite à renouveler les imaginaires de la relation que nous établissons avec nos semblables et le vivant. L'auteur y appelle à une réinvention du politique et du langage afin d'habiter l'infini du monde.,
Jacques Rancière,,https://m.media-amazon.com/images/I/41OMVkzDLgL._SY600_.jpg
David Graeber,Après le succès de “Dette : 5000 ans d’histoire” – vendu à près de 25 000 exemplaires – David Graeber revient avec un texte passionnant sur l’invasion de la bureaucratie dans notre quotidien qu'il voit comme un efficace bras armé du capitalisme financier.,https://m.media-amazon.com/images/S/amzn-author-media-prod/bip217dmm2n9abnsifoupq0a45._SY600_.jpg
Pierre-André Taguieff,"Philosophe, politiste et historien des idées, Pierre-André Taguieff est directeur de recherche au CNRS. Il est l'auteur de plus d'une quarantaine d'ouvrages, dont, à l'Observatoire, Macron : miracle ou mirage ? et, dans la collection ""Et après ? "", La Pandémie par-delà les peurs : réinventer l'Etat-nation ?",https://m.media-amazon.com/images/I/01Kv-W2ysOL._SY600_.png
Carl Schmitt,"Professeur de droit public sous la république de Weimar, Carl Schmitt (1888-1985) soutint le régime nazi, antisémitisme compris, pendant les premières années de celui-ci, avant de prendre ses distances à partir de 1936.",https://m.media-amazon.com/images/I/01Kv-W2ysOL._SY600_.png
Jérôme Fourquet,"Directeur du Département Opinion et Stratégies d'Entreprise de l'IFOP, Jérôme Fourquet est l'auteur de nombreux livres sur l'état de la société française, dont le bestseller, L'Archipel français.",https://m.media-amazon.com/images/I/01Kv-W2ysOL._SY600_.png
Gérald Bronner,"Gérald Bronner est professeur de sociologie à l'université Paris-Diderot et membre de l'Académie des technologies. Il est l'auteur de plusieurs ouvrages sur les croyances collectives, dont La démocratie des crédules, qui a obtenu de nombreuses distinctions.",https://m.media-amazon.com/images/I/01Kv-W2ysOL._SY600_.png
Pascal de Sutter,Pascal de Sutter est professeur de psychologie et chercheur à l'université de Louvain-la-Neuve. Il est également expert auprès de l'OTAN pour les questions de psychologie politique.,https://m.media-amazon.com/images/I/01Kv-W2ysOL._SY600_.png
BADIE,"Professeur des universités à Sciences Po Paris, Bertrand Badie s'est imposé comme l'un des meilleurs experts en relations internationales. Il est l'auteur d'une trentaine d'ouvrages qui font référence, dont La Diplomatie de connivence, L'Impuissance de la puissance et Le Temps des humiliés. Il codirige L'État du monde depuis douze ans.",https://m.media-amazon.com/images/I/01Kv-W2ysOL._SY600_.png
Pierre-Antoine Plaquevent,"Une enquête sur les rouages et la philosophie politique de l'entreprise de décomposition des nations que réalise George Soros. Elle dévoile sa méthode, notamment basée sur son ensemble de fondations, l'Open Society Foundations, ses réseaux, ses militants et ses moyens financiers. Pour l’auteur, ce projet prend racine dans les courants les plus puissants de la subversion politique contemporaine. --- Electre

L’étude menée par Pierre-Antoine Plaquevent dépasse la seule exposition des menées subversives de George Soros et de ses réseaux. Par l’exploration philosophique et historique des racines profondes du projet globaliste, son livre pose les fondations d’une pensée paléo-conservatrice française contemporaine. --- Xavier Moreau (Géopoliticien, écrivain)

« Le livre de Pierre-Antoine Plaquevent présente une synthèse des origines intellectuelles du « phénomène Soros », des instruments qui lui ont permis d'accumuler des ressources financières astronomiques et d'étendre ses tentacules à l'échelle mondiale. » ---- Iurie Rosca (Ancien Vice-premier ministre moldave, journaliste, auteur, éditeur)",https://m.media-amazon.com/images/I/711TPO3zPZL._SY600_.jpg
Jean-Claude Kaufmann,"L’auteur plonge dans l’histoire des derniers siècles pour démontrer comment tout cela a commencé, comment le piège terrible s’est formé. Il souligne notamment la contradiction grandissante entre République et démocratie, devenue aujourd’hui explosive. Et de quelle manière les instruments de régulation censés nous sauver (le modèle de l’homo economicus ou le langage numérique) se sont transformés en remèdes pires que le mal.
Depuis quelques années, des observateurs et lanceurs d’alerte pointent les nuages noirs à l’horizon. Sur la catastrophe climatique à venir. Sur les dérives écœurantes de l’économie financiarisée. Sur la montée des populismes, des nationalismes et des enfermements communautaires. Sur l’emprise grandissante des GAFA manipulant nos données personnelles. Mais ces divers problèmes apparaissent séparés les uns des autres, leur genèse reste inexpliquée, surtout dans son mouvement d’ensemble. Dans cet essai informé et solidement argumenté, Jean-Claude Kaufmann relie ces éléments à première vue disparates et dresse un tableau impressionnant de ce qui nous entraîne vers l’abîme. Catastrophisme exagéré ? Lisez sa démonstration, et vous verrez peut-être que nous nous refusons à regarder la situation en face. Car il explique aussi pourquoi nous dénions les dangers qui nous guettent ; nous sommes illusionnés par une exubérance démocratique qui n’est en fait que chant du cygne…",https://m.media-amazon.com/images/I/01Kv-W2ysOL._SY600_.png
Jacques Testart,"Biologiste, directeur de recherches honoraire à l'INSERM, auteur connu pour son analyse critique de la science et des technosciences, Jacques Testart s'appuie sur son expérience des conventions citoyennes jusqu'ici cantonnées aux questions soulevées par les nouvelles technologies.",
Paul Veyne,""" Cette folie, qui lançait les riches dans une surenchère de dons à la collectivité (chacun voulant se montrer plus magnifique que le voisin), porte un nom savant - l'évergétisme - et vient de trouver son historien. Paul Veyne a quelque chose de la prodigalité de ses héros, les évergètes. Il déverse sur ses lecteurs médusés les trésors de son information, les souvenirs de ses campagnes à travers l'érudition germanique et la sociologie anglo-saxonne, dépense en quelques pages la matière de vingt thèses et mobilise toutes les ressources d'un esprit follement ingénieux pour comprendre et faire comprendre ce que ces cadeaux en cascade étaient chargés d'entretenir. """,https://m.media-amazon.com/images/I/01Kv-W2ysOL._SY600_.png
Djamila Ribeiro,"Djamila Ribeiro, chercheuse en philosophie politique, est la référence du mouvement féministe noir, antiraciste, pro-LGBT et antimachiste au Brésil. Chroniqueuse pour la presse et la TV, elle donne des conférences dans le monde entier. Avec un demi-million de suiveurs sur les réseaux sociaux, c'est une activiste de poids. Préface de Françoise Vergès, militante féministe décoloniale et politologue.",https://m.media-amazon.com/images/I/01Kv-W2ysOL._SY600_.png
François Burgat,"François Burgat, politologue, est directeur de recherches au CNRS (IREMAM, Aix-en-Provence), a été directeur de l'Ifpo de mai 2008 à avril 2013. Il est notamment l'auteur de L'Islamisme au Maghreb : la voix du Sud (Karthala, 1988 ; Payot, 1995, 2008), de L'Islamisme en face (La Découverte, 1995, 2002, 2007) et de L'Islamisme à l'heure d'Al-Qaida (La Découverte, Paris, 2005, 2010).",https://m.media-amazon.com/images/I/01Kv-W2ysOL._SY600_.png
Jacques Ellul,"Dans la société occidentale, le verbalisme politique exprime une double illusion, en même temps qu'il lui donne naissance. Nous assistons au développement de l'illusion de l'homme politique qui croit maîtriser la machine de l'État, qui croit prendre des décisions politiques toujours efficaces, alors qu'il se trouve de plus en plus impuissant en face de la rigueur croissante des appareils étatiques. Or, cette impuissance de l'homme politique est voilée précisément par la puissance et l'efficacité des moyens d'action de l'État qui interviennent toujours plus profondément et exactement dans la vie de la nation, et dans celle des citoyens. Mais l'homme politique, fût-il dictateur, n'a finalement aucune maîtrise de ces moyens. Réciproquement, paraît l'illusion du citoyen, qui, vivant encore sur l'idéologie de la souveraineté populaire et des constitutions démocratiques, croit pouvoir contrôler la politique, l'orienter, participer à la fonction politique, alors que tout au plus il peut contrôler des hommes politiques sans pouvoir réel - et s'engage, sur cette double illusion, un dialogue d'impuissants. Dans cette difficile situation, n'y a-t-il aucun remède ? S'il en existait un, il serait, en tout cas, à la fois humble et héroïque.",https://m.media-amazon.com/images/I/01Kv-W2ysOL._SY600_.png
Amartya Sen,"La notion de démocratie est si bien enracinée dans la culture européenne et nord-américaine, qu'elle est généralement considérée comme un concept purement occidental ; ainsi, la démocratie serait une valeur que l'Occident aurait pour mission de faire prévaloir et d'introduire dans des pays qui en auraient été jusque-là privés. Mais des difficultés inattendues, d'ordre militaire et politique, rencontrées par la coalition menée par les États-Unis durant la deuxième après-guerre irakienne, ont soulevé une vague de scepticisme sur les possibilités de faire adopter dans le pays, dans des délais relativement courts, un gouvernement démocratique. L'originalité de la pensée d' Amartya Sen, économiste et humaniste, est de démontrer la complexité du problème de la démocratie.",https://m.media-amazon.com/images/S/amzn-author-media-prod/itpn9smc131ql0tf7a31ettnhs._SY600_.jpg
Murray Bookchin,"Murray Bookchin (1921–2006) est connu pour ses travaux sur l’écologie sociale et son modèle d’organisation politique démocratique, le municipalisme libertaire. D’abord ouvrier, cet autodidacte a enseigné la sociologie au Ramapo College (New Jersey).",
Mohamed Sifaoui,"Journaliste spécialiste de l'islam politique et du terrorisme, directeur de la publication de la chaîne islamoscope.tv, Mohamed Sifaoui est notamment l'auteur de La France malade de l'islamisme (2002), Combattre le terrorisme islamiste (2007) et Tagiyya ! (2019).",https://m.media-amazon.com/images/I/01Kv-W2ysOL._SY600_.png
Michel Clouscard,,https://m.media-amazon.com/images/I/01Kv-W2ysOL._SY600_.png
Theodore Kaczynski,,
Theodore Kaczynski,"Mathématicien de talent, Theodore J Kaczynski a terrorisé l'Amérique par ses colis piégés visant à faire publier ses mises en garde contre le développement industriel. Arrêté en 1996, au terme de la plus longue traque de l'histoire du FBI, il purge une peine de réclusion à vie dans le quartier de haute sécurité de la prison de Florence (Colorado). Médecin spécialiste en anesthésie, réanimation et toxicologie, le Dr Patrick Barriot (né en 1955) a été médecin-colonel et médecin-chef de la Sécurité civile française. Expert en matière de risques nucléaires, radiologiques, biologiques et chimiques, il se consacre désormais à l'étude des dangers liés aux nouvelles technologies (bio et nano). Il est le coauteur de l'ouvrage de référence Les Armes de destruction massive et leurs victimes (Flammarion), traduit en américain chez Wiley and Sons. Depuis plusieurs années, le Dr Barriot entretient une intense correspondance avec Theodore J Kaczynski. Le présent ouvrage est en grande partie le fruit de ces échanges. David Skrbina est maître de conférences en philosophie à l'Université du Michigan à Dearborn, où il a institué le premier cours de philosophie de la technologie jamais enseigné dans cette université. Il a également enseigné à l'Université de Michigan-Est ainsi qu'à l'Université de Gand. Outre la technologie, ses domaines de recherche comprennent la philosophie de l'esprit, la métaphysique et l'éthique environnementale. Il est l'auteur de deux ouvrages de philosophie ainsi que de nombreux articles. Il prépare actuellement une anthologie de textes de critique antitechnologique destinée à servir de manuel universitaire.",
