Nom,Description,Photo
Olivier Lafay,,
DIDIER REISS,"Pascal PRÉVOST est docteur en neurophysiologie et biomécanique de la performance motrice. Il a été parmi les premiers diplômés en 1992 en France en préparation physique (Master 2 créé par Georges Cazorla). Sur le terrain depuis plus de 30 ans, il partage son temps entre formation, préparation physique et conférences, en France et à l'international, dans les secteurs public, privé et universitaire. • Son objectif : lutter contre les idées reçues en sport, santé, nutrition et proposer des méthodes ou outils efficients pour optimiser le suivi de tout•e pratiquant•e. • Sa motivation première : respecter l'intégrité physique, neurophysiologique et cognitive de la personne dans tous ses accompagnements individualisés. • Sa quête : faire évoluer les pratiques en proposant (souvent) des méthodes et outils avant-gardistes, la plupart du temps confirmés plusieurs années après leur utilisation sur le terrain par les sportif(ve)s les plus curieux(euses).

Didier REISS est diplômé d'État et ingénieur dans le domaine de l'entraînement. Pratiquant actif de sports de combat dès l'âge de 14 ans, ceinture noire et compétiteur de niveau national, l'encadrement a pris le pas sur sa pratique. De l'empirisme à la connaissance scientifique, se former est devenu une priorité. Formateur international dans plusieurs diplômes et intervenant universitaire (DEUST et MASTER 2), il évolue toujours dans la préparation physique de haut niveau ainsi qu'auprès de personnalités. Il possède également ses propres écoles de formation en collaboration avec Pascal Prévost. Chroniqueur ponctuel pour des magazines et coauteur d'ouvrages, il est un véritable passionné de la préparation physique.",
OLIVIER LAFAY,"Philosophe de formation, Olivier Lafay a été enseignant, chef d'entreprise et responsable de la salle de musculation de l'Université Lyon III où il a côtoyé de nombreux sportifs. Constatant que les résultats dépendaient souvent moins des techniques employées que de questions motivationnelles, il a approfondi ses études en sciences humaines (psychologie, sociologie) afin de comprendre ce qui pouvait fonder un entraînement réussi.",https://m.media-amazon.com/images/I/713cXupAYAL._SY600_.jpg
Frédéric Delavier,"Collaborateur de journaux de sport et de musculation en France, États-Unis et Allemagne (en 2007)",
Frédéric Delavier,"Frédéric Delavier est un artiste de talent possédant une connaissance exceptionnelle de l'anatomie humaine. Il a étudié la morphologie et l'anatomie pendant cinq ans à l'Ecole des Beaux-Arts de Paris et la dissection pendant trois ans à la Faculté de Médecine de Paris. Ancien rédacteur en chef du magazine PowerMag, Frédéric Delavier a écrit pour plusieurs publications sur le conditionnement physique, comme Le Monde du Muscle, Men's Health en Allemagne, et Iron Man. Il est l'auteur de best-sellers, dont Le Guide des mouvements de musculation, Exercices pour une belle ligne et La Méthode Delavier de musculation, volumes 1, 2 et 3. Frédéric Delavier a remporté le titre de champion de France de powerlifting en 1988 ; il donne des conférences dans le monde entier concernant les applications sportives de la biomécanique. Ses efforts d'enseignement lui ont valu le Grand Prix de Techniques et de Pédagogie Sportive. Michael Gundill a écrit de nombreux livres sur la force, la musculation, la nutrition sportive et la santé. Il est notamment le coauteur de La Méthode Delavier de musculation, volumes 1, 2 et 3. Ses livres ont été traduits dans de nombreuses langues, et il a écrit plus de 500 articles de musculation et de fitness pour des magazines tels que Iron Man et Dirty Dieting. En 1998, il a remporté le prix de l'article de l'année lors du quatrième Academy of Bodybuilding Fitness & Sports Awards en Californie. Michael Gundill a commencé la musculation en 1983 afin d'améliorer ses performances en aviron. La plupart de ses années de musculation ont été consacrées à l'établissement de programmes spécifiques de musculation à domicile. Pour gagner en muscle et pour améliorer ses programmes, il a commencé à étudier la physiologie, l'anatomie et la biomécanique grâce à la lecture des périodiques médicaux spécialisés. Depuis 1995, il partage ses découvertes dans divers magazines de musculation et de conditionnement physique dans le monde entier.",
DELAVIER FREDERIC/GUNDILL MICHAEL,"Frédéric Delavier est l'auteur du best-seller international Guide des mouvements de musculation (paru aux Etats-Unis sous le titre Strength Training Anatomy), le livre de musculation numéro 1 au monde, vendu à plus de 2 millions d'exemplaires et traduit dans plus de 25 langues. Un livre qui s'est rapidement imposé comme la référence dans les universités et les écoles de formation pour coachs sportifs, entraîneurs, kinésithérapeutes,... Cet ouvrage dévoile enfin La Méthode D'entraînement Delavier, la plus efficace pour gagner rapidement en force, puissance et masse musculaire.",
Christophe Geoffroy,Kinésithérapeute dans le sport de haut niveau Chargé d'enseignement universitaire Spécialisé en formation et conseils,https://m.media-amazon.com/images/I/01Kv-W2ysOL._SY600_.png
Collectif,,
Aide BPJEPS Officiel,,
FitForce Publishing,,https://m.media-amazon.com/images/I/01Kv-W2ysOL._SY600_.png
Frédéric Delavier,"Collaborateur de journaux de sport et de musculation en France, États-Unis et Allemagne (en 2007)",
Marie-Caroline Savelieff,"Diététicienne nutritionniste diplômée d'Etat et spécialisée en nutrition du sportif, Marie-Caroline Savelieff accompagne les sportifs débutants et confirmées qui souhaitent réaliser l'objectif de leurs rêves (remise en forme, marathon, raid, trails, triathlon, ironman,...). Elle-même sportive de haut-niveau, elle participe aux championnats de France de 10 km, semi-marathon, course en montagne et crosscountry, pratique le trail court et long, le VTT et le duathlon. Elle habite à Montrouge (92). Préface de Christelle du Daunnay, une sportive de haut niveau. Actuelle recordwoman de France du Marathon à Paris, du semimarathon à Reims, du 10000 mètres à Bilbao, multiple Championne de France d'athlétisme sur 10 000m et cross-country, championne d'Europe du marathon en 2014 à Zurich, 9 participations aux Championnats du Monde cross-country, semi-marathon, marathon. Elle a participé aux Jeux Olympiques de Pékin (2008) et de Rio (2016).",https://m.media-amazon.com/images/I/01Kv-W2ysOL._SY600_.png
Frédéric Delavier,,
SEBASTIEN RATEL,"Sébastien RATEL – Clermont-Ferrand (63) Sébastien Ratel est maître de Conférences et HDR (habilité à diriger des recherches) en Sciences et Techniques des Activités Physiques et Sportives (STAPS) à l'Université Clermont Auvergne (UCA) et membre du Laboratoire des Adaptations Métaboliques à l'Exercice en conditions Physiologiques et Pathologiques (AME2P). Il est également expert en physiologie de l'exercice musculaire chez l'enfant et responsable du Diplôme Universitaire "" Enfant et Activité Physique : Santé et Performance "" à l'UFR STAPS de Clermont-Ferrand.",https://m.media-amazon.com/images/I/01Kv-W2ysOL._SY600_.png
Christophe Carrio,"""Pas besoin de matériel coûteux ou de médicaments, grâce au programme
de Christophe, évoluer dans un corps sans douleur est à la portée de tout
un chacun, même de ceux qui souffrent depuis des années !"" --Dr Thierry Selz, chirurgien orthopédiste à Genève",https://m.media-amazon.com/images/I/717DwauefZL._SY600_.jpg
Jay Dawes,,https://m.media-amazon.com/images/I/51PPeEo0uvL._SY600_.jpg
Anthony Mette,"Psychologue, docteur en psychologie.",https://m.media-amazon.com/images/I/01Kv-W2ysOL._SY600_.png
Denis Tribaudeau,,https://m.media-amazon.com/images/I/B1t07n0sa+S._SY600_.jpg
ANNE-FLORE JAULNEAU,"Anne-Flore Jaulneau a d'abord été éducatrice spécialisée, investie pendant dix ans dans les champs du handicap, de l'urgence sociale et de la formation socioprofessionnelle. A partir de 2005, elle se forme aux sciences du Sport avec un DEUST Métiers de la forme et de nombreuses formations en massage de confort. Instructrice de la Pilates Method Alliance, elle a validé un Master 1 Préparation Physique et Mentale (PPM) avant de fonder un Centre Sport/Santé/Bien-être dans la Drôme en 2008. Elle a ensuite poursuivi sa formation par un Master Recherche en Sciences du Mouvement. Elle est aujourd'hui coach, masseuse et gérante du Centre Flore&senS. Elle est aussi l'auteur du livre Automassage avec petit matériel, pour lequel elle a gagné l'édition 2014 du concours ""Deviens auteur chez Amphora !"" réservé aux étudiants en STAPS.",https://m.media-amazon.com/images/I/61HxR1-qZKL._SY600_.jpg
Julien Venesson,"Rudy Coia est vice-champion de France junior de culturisme et de force athlétique et fondateur du site SuperPhysique. Il a coaché à ce jour des milliers de pratiquants de musculation hommes et femmes. Il est le chef de file de la musculation au naturel en France.
Julien Venesson est journaliste scientifique spécialisé dans le domaine de la nutrition et de la musculation, auteur entre autres de Nutrition de la force et Paléo Nutrition, qui sont aujourd'hui des livres de référence sur l'alimentation du sportif de force.",
CHRISTIAN TARGET,"Christian Target – Alpes-Marimes (Nice) : Diplômé de l'INSEP, Christian Target se consacre depuis plus de 30 ans à la recherche sur la performance mentale. Ses expériences d'athlète, de formateur,d'entraîneur, d'enseignant et coach mental lui ont permis d'élaborer et valider son propre modèle et sa méthode. On lui doit notamment des travaux sur la notion de fluidité. En tant que préparateur mental, il a accompagné de très nombreux athlètes vers des titres ou records mondiaux et olympiques, aussi bien en sport individuel (natation, golf, sport de glace, cyclisme sur piste…) que collectif (voile, parachutisme, basket-ball…). Ingrid Petitjean – Provence-Alpes-Côte d'Azur (Marseille) :Ingrid Petitjean est une ancienne sportive de haut niveau en voile et a remporté plusieurs titres mondiaux en dériveur double olympique. Elle est diplômée du DU de coaching et performance de Dijon, d'un Master entraînement et management du sport, et certifiée Coach and Team (Ecole de coaching Vincent Lenhardt). Elle exerce comme coach, préparatrice mental, formatrice, et s'intéresse particulièrement aux problématiques communes rencontrées par les champions,les managers, commerciaux ou dirigeants.",
Kelly Starrett,"Coach, kinésithérapeute et auteur du besteller Ready to Run, le Dr. Kelly Starrett a révolutionné la performance pour les entraîneurs, les athlètes mais aussi le grand public. Une approche innovante du mouvement, de la mécanique et de la mobilité qui lui a permis de collaborer avec l'armée, des athlètes de NFL, de NBA, de NHL, de la MLB, des équipes olympiques et les universités les plus prestigieuses. Ancien combattant professionnel de MMA et de Muay Thai, auteur d une vingtaine d ouvrages, Glen Cordoza est, pour sa part, l un des auteurs les plus publiés aux États-Unis sur le MMA, le jiu-jitsu brésilien, le Muay Thai et la musculation.",
Phil Team,,https://m.media-amazon.com/images/I/01Kv-W2ysOL._SY600_.png
Christophe Carrio,"Christophe Carrio, coach sportif, est diplômé de l'Académie américaine de médecine sportive. Athlète de haut niveau, il a été cinq fois champion du monde de karaté artistique, une discipline dont les qualités physiques maîtresses sont l'explosivité et la souplesse.",https://m.media-amazon.com/images/I/717DwauefZL._SY600_.jpg
Willy Trussardi,"Ingénieur agronome spécialisé dans la nutrition du sportif, Big Will est devenue une star sur les réseaux sociaux, et notamment Instagram où il rassemble plus d'1 million de followers avec des programmes de nutrition spécialisés. Et petite particularité : il aime proposer de la junk food – burgers, pizzas... – mais avec des produits sains et bien équilibrés.",https://m.media-amazon.com/images/I/01Kv-W2ysOL._SY600_.png
Mr Stéphane Dauvergne,,
Body Smiths,,https://m.media-amazon.com/images/S/amzn-author-media-prod/l7n6ophddbjkkf7b8r1t68nukb._SY600_.jpg
Aurelien Broussal-Derval,"Diplômé en Master de Préparation Physique, Mentale et Réathlétisation, en Master d'Ingénierie de la Performance, titulaire d'une Maîtrise entraînement option Entraînement de Haut Niveau à l'INSEP, Professeur de Sport, Aurélien Broussal-Derval n'est pas seulement l'universitaire auteur des livres références en langue Française sur la préparation physique que sont La préparation physique moderne et Les tests de terrain, ou l'enseignant dans de nombreuses universités Européennes. C'est surtout un préparateur physique de terrain, qui a préparé, entre autres, les équipes de France d'Haltérophilie, les équipes Russe et Britannique de Judo et l'équipe de France de Boxe Anglaise. Designer de profession spécialisé dans la parfumerie et la cosmétique, Stéphane Ganneau est aussi l'auteur de nombreuses productions marketing liées au sport. Pratiquant assidu et éclairé, il utilise ses compétences de dessinateur pour illustrer le sport depuis plusieurs années.",https://m.media-amazon.com/images/I/71Q7kR0fQmL._SY600_.jpg
Christophe Bonnefont,"Christophe BONNEFONT est un ancien champion de karaté, aujourd'hui athlète culturiste et depuis toujours grand amateur de cuisine. Il partage ses deux passions, le sport et la nutrition, sur Instagram et TikTok.",https://m.media-amazon.com/images/S/amzn-author-media-prod/idl8ohae2v3etbui91sldtffn1._SY600_.jpg
Clotilde Morgaut,,
Olivier Lafay,,
Fabrice Kuhn,"Fabrice Kuhn est médecin du sport, ancien médecin de l'équipe de France d'haltérophilie. Il est aussi triathlète. Il est l'auteur de Nutrition de l'endurance et de Paléofit.",https://m.media-amazon.com/images/S/amzn-author-media-prod/uv3ibdqit5pt5on3g04gmdc9tf._SY600_.jpg
Yvan Cam,"Yvan Cam est Docteur en biologie spécialisé dans l'étude du métabolisme et entrepreneur dans le domaine des biotechnologies. Il est également pratiquant et enseignant d'arts martiaux depuis plus de 25 ans. Son parcours martial l'amènera au Systema, un art martial russe basé sur le contrôle et l'utilisation du souffle tandis que son parcours professionnel l'amènera également à s'intéresser à la respiration par le prisme de l'étude du métabolisme cellulaire.",
Frédéric Delavier,"Frédéric Delavier est l'auteur du best-seller Guide des mouvements de musculation, le livre de musculation numéro 1 au monde, vendu à plus de 2 millions d'exemplaires et traduit dans plus de 25 langues. Un manuel qui s'est rapidement imposé comme la référence dans les universités et les écoles de formation pour coaches sportifs, entraîneurs, kinésithérapeutes... Michael Gundill s'intéresse à la forme physique depuis plus de 25 ans, à travers des milliers d'heures de recherches dans les plus grandes bibliothèques de médecine du monde. Collaborateur de journaux de sport et de musculation tels que Iron Man ou Mind & Muscle aux Etats-Unis, il pratique la musculation depuis un quart de siècle. Ensemble, ils sont déjà les auteurs, aux éditions Vigot, de La Méthode Delavier de musculation, volumes 1 et 2, du Guide des compléments alimentaires pour sportifs, de Abdos : musculation et gainage et du Guide de musculation des bras. Ils ont aussi coécrit avec Jean-Pierre Clémenceau un Guide du stretching.",
OLIVIER LAFAY,"Philosophe de formation, Olivier Lafay a été enseignant, chef d'entreprise et responsable de la salle de musculation de l'Université Lyon III où il a côtoyé de nombreux sportifs. Constatant que les résultats dépendaient souvent moins des techniques employées que de questions motivationnelles, il a approfondi ses études en sciences humaines (psychologie, sociologie) afin de comprendre ce qui pouvait fonder un entraînement réussi.",https://m.media-amazon.com/images/I/713cXupAYAL._SY600_.jpg
Solarberg Séhel,Solarberg Séhel est un ancien triathlète qui étudie l'univers de la course à pied (et celui de la natation) depuis 25 ans. Il a créé un blog en 2010 qui est devenu une référence sur la foulée médio-pied. Il est l'auteur du Guide du crawl (2013).,https://m.media-amazon.com/images/I/01Kv-W2ysOL._SY600_.png
Mory Doli,,
JONATHAN BEL LEGROUX,"Educateur sportif, diplômé des STAPS, Jonathan Bel Legroux est praticien et formateur en hypnose depuis plus de dix ans. Thérapeute, il est une référence dans le coaching mental de sportifs de haut niveau. Il accompagne ainsi de nombreux athlètes dans leur préparation pour les Jeux Olympiques depuis les Jeux de 2012, et les compétitions sur le circuit international. Également formateur, il transmet des outils pour que le corps et le mental s'accordent à n'importe quel moment de la vie. Il est le créateur et l'organisateur des stages ""Mental Camp"" destinés aux sportifs et entraîneurs désireux d'optimiser leur mental pour gagner en performance et prendre toujours plus de plaisir dans la pratique.",https://m.media-amazon.com/images/S/amzn-author-media-prod/r4r21nbe4sn225mp67rnnkl388._SY600_.jpg
Fabrice Kuhn,"Fabrice Kuhn est médecin du sport, rédacteur pour Jogging International, auteur et conférencier. Il est aussi trailer, triathlète, finisher des championnats du monde Ironman à Hawaii et finisher du marathon des sables. Il enseigne au DU expertise en course à pied de l’université de Poitiers. Il a été le médecin de l’équipe de France d’haltérophilie pendant plusieurs années. Il a publié Nutrition de l’endurance, 101 recettes pour les sports d’endurance, Ultra performance, Le régime cétogène pour les sportifs et Paléofit pour les sports d’endurance chez Thierry Souccar Editions.",
CHRISTOPHE POURCELOT,"Policier depuis 20 ans et instructeur en « Tir et Sport » depuis 2005, Christophe Pourcelot est également éducateur sportif diplômé d'État et préparateur physique.",https://m.media-amazon.com/images/I/01Kv-W2ysOL._SY600_.png
Andrea Raimondi,,https://m.media-amazon.com/images/S/amzn-author-media-prod/v8qgq2vfihmj6km090bvm9a5cj._SY600_.jpg
MICHAEL BOYLE,"Michael Boyle est l'un des plus grands experts dans les domaines de la musculation fonctionnelle et du conditionnement physique. Il est notamment le fondateur d'un centre d'entraînement où il guide de nombreux athlètes vers le haut niveau. Boyle a été préparateur physique à l'Université de Boston pendant 15 ans et assure les mêmes fonctions au sein de l'équipe de hockey BU depuis 25 ans. Il est considéré comme l'un des professionnels les plus en vue dans l'industrie de la forme et donne régulièrement des conférences à travers des séminaires, des vidéos et des cours en ligne.",https://m.media-amazon.com/images/I/51-ThlSogmL._SY600_.jpg
Fabrice Abgrall,"Patrick Mouratoglou, coach de Serena Williams, commentateur sportif pour Eurosport et de nombreuses chaînes internationales, dirige en France, depuis près de vingt ans, une académie de tennis mondialement reconnue. Dans cet ouvrage très personnel, il revient sur son amour du tennis, ses engagements et ses rencontres avec les plus grands joueurs. En s'appuyant sur son expérience personnelle, Patrick Mouratoglou livre les principes de sa méthode pour permettre à chacun d'entre nous d'exploiter pleinement son potentiel. « Patrick est un coach phénoménal. Pour quiconque, affronter un adversaire coaché par Mouratoglou est une perspective effrayante. » Serena Williams",
Joelle Bildstein,"Joëlle Bildstein est mère, coach sportive et fondatrice de ""THE BELLY LAB"", une entreprise qui a conquis le coeur et le ventre de plus de 55 000 femmes. Inspirée de la gym hypopressive, la méthode TBL offre aux femmes des trucs et des exercices pour prendre soin de leur ventre.",https://m.media-amazon.com/images/I/01Kv-W2ysOL._SY600_.png
DAVID COSTA,"Coach sportif expert en musculation et alimentation le plus diplômé de France avec plus de 10 années d'expérience, rédacteur pour de nombreux magazines (Fitness Mag, Men's Fitness, Coach...) et auteur de plusieurs best-sellers de musculation et nutrition chez Amphora.",https://m.media-amazon.com/images/I/81iYM1Tx3SL._SY600_.jpg
OLIVIER LAFAY,"Philosophe de formation, Olivier Lafay a été enseignant, chef d'entreprise et responsable de la salle de musculation de l'Université Lyon III où il a côtoyé de nombreux sportifs. Constatant que les résultats dépendaient souvent moins des techniques employées que de questions motivationnelles, il a approfondi ses études en sciences humaines (psychologie, sociologie) afin de comprendre ce qui pouvait fonder un entraînement réussi.",https://m.media-amazon.com/images/I/713cXupAYAL._SY600_.jpg
Daniel P Bove,,
Siegbert Tempelhof,"Le docteur Siegbert Tempelhof est médecin, spécialiste d'orthopédie. Son cursus est complété par une formation d'ostéopathe aux États-Unis. Il est aujourd'hui directeur médical du Centre de médecine complémentaire de Munich. Il est de plus membre du conseil d'administration de l'Académie germano-américaine pour l'ostéopathie (DAAO) ainsi que du Conseil scientifique de la MWE (Association des médecins pour les thérapies manuelles de la colonne vertébrale
et des extrémités).

Daniel Weiss est titulaire d'un diplôme de physiothérapeute et de naturopathe reconnu par l'État en Allemagne, il est également ostéopathe et a suivi des formations complémentaires en thérapies manuelles, en acupuncture antidouleur, ostéopathie crânienne et traitement des fascias. Il possède deux cabinets à Munich et à Gilching.

Anna Cavelius a travaillé après ses études pour un éditeur de magazines états-unien à Munich, Sienne et Salamanque. Depuis 1995, elle est auteure indépendante, lectrice spécialisée dans le domaine médical et psychologique. Elle a déjà publié un certain nombre d'ouvrages spécialisés.",https://m.media-amazon.com/images/S/amzn-author-media-prod/b632ff873e6g6c42uavp6137p9._SY600_.jpg
Frédéric Delavier,"Collaborateur de journaux de sport et de musculation en France, États-Unis et Allemagne (en 2007)",https://m.media-amazon.com/images/I/71uvgE6relL._SY600_.jpg
Alessandro Villanucci,,https://m.media-amazon.com/images/S/amzn-author-media-prod/v30lvbqs16uibcpvkeji0r44mo._SY600_.jpg
Frédéric Delavier,"Frédéric Delavier est l'auteur du best-seller Guide des mouvements de musculation, le livre de musculation n°1 au monde, vendu à plus de 2 millions d'exemplaires et traduit dans plus de 25 langues. Un manuel qui s'est rapidement imposé comme la référence dans les universités et les écoles de formation pour coaches sportifs, entraîneurs, kinésithérapeutes. Michael Gundill s'intéresse à la forme physique depuis plus de 25 ans, à travers des milliers d'heures de s recherches dans les plus grandes bibliothèques de médecine du monde. Collaborateur de journaux de sport et de musculation tels que Iran Man ou s Mind & Muscle aux Etats-Unis, il pratique la musculation depuis un quart de siècle.",
Julien Venesson,"Préface de Michael Gundill : L'alimentation a un impact important sur notre santé. Chez le sportif, la nutrition joue un rôle encore plus conséquent car elle va moduler la force et l'endurance avant un entraînement ainsi que les capacités de récupération après l'effort.

Faire le bon choix en matière alimentaire n'est pas simple : où trouver les protéines, qu'elles sont les bonnes et les mauvaises, combien faut-il en prendre, quand, combinées avec quels autres nutriments...
Ces mêmes questions se posent pour les glucides et les graisses.

Les réponses à ces interrogations légitimes vont varier suivant votre génétique ainsi que vos objectifs (prendre du muscle ou de la force, perdre de la graisse...). Julien vous les apporte toutes dans ce livre avec beaucoup de précisions et une grande rigueur. Son propos se compose d'une partie théorique et d'une partie pratique, l'occasion pour lui de donner de nombreux exemples concrets qui vous serviront de modèle afin de façonner, vous-même, votre propre régime alimentaire.

Les compléments alimentaires représentant une part grandissante de la stratégie des sportifs pour la performance, ceux-ci sont passés en revue afin de mieux en cerner l'utilité et l'efficacité et de comprendre comment bien les utiliser.

Contrairement à de nombreux livres sur le marché qui ne sont que des compilations de vieilles idées erronées, ce livre se base sur les recherches les plus récentes pour aider les sportifs, de la manière la plus précise et concrète possible. --Préface du livre",
WIM HOF,"David Manise est anthropologue et journaliste de formation. Pionnier de la survie depuis 2003, fondateur du CEETS et cofondateur du cercle de survivologie, il enseigne la survie en France, Suisse et Belgique à des civils comme aux instructeurs d'unités d'élite européennes. Il est déjà l'auteur de plusieurs livres aux éditions Amphora, dont les Manuels de survie en milieu naturel, montagnard, forestier et grand froid). Son site : davidmanise.com",
