Nom,Description,Photo
Jose Silva,"1. Using More of Your Mind in Special Ways 1 Using More of Your Mind in Special Ways
Imagine coming into direct, working contact with an all-pervading higher intelligence and learning in a moment of numinous joy that it is on your side. Imagine too that you made this contact in such simple ways that for the rest of your life you need never again feel helplessly out of touch with something you always suspected was there but could never quite reach—a helpful wisdom, a flash of insight when you need it, the feeling of a loving, powerful presence. How would it feel?

It would be a peak experience not too different—perhaps not different at all—from spiritual awe.

This is what it feels like after four days of Silva Mind Control training. So far, more than a half-million people know; they have been through it. And as they become more accustomed to using the methods that produce this feeling they settle down into a calm, self-confident use of new powers and energies, their lives richer, healthier, freer of problems.

Shortly José Silva will explain some of these methods so that you will be able to start using them yourself. First let’s look in on the beginning of a Mind Control class and see what takes place.

To start off, there is an introductory lecture of about an hour and twenty minutes. The lecturer defines Mind Control and outlines the two decades of research that led to its development. Then, briefly, he describes ways the students will be able to apply what they learn in improving health, solving everyday problems, learning more easily, and deepening spiritual awareness. A twenty-minute break follows.

Over coffee the students become acquainted. They are from widely varying backgrounds. Physicians, secretaries, teachers, taxi drivers, housewives, high-school and college students, psychiatrists, religious leaders, retired people—this is a typical mix.

After the break there is another hour-and-twenty-minute session beginning with some questions and answers, then down to business with the first training exercise, which will lead to a meditative level of mind. The lecturer explains that this is a state of deep relaxation, deeper than in sleep itself but accompanied by a special kind of awareness. It is in fact an altered state of consciousness used in virtually every meditative discipline and in intensive prayer.

No drugs or biofeedback machines are used. Mind Control lecturers speak of entering this state as “going to your level,” or sometimes “going into Alpha.” In a thirty-minute exercise they lead the student there gently, giving instructions in plain English. In fact all of Mind Control is in plain English: no scientific jargon or Far Eastern words.

Several of the students may already have learned to meditate before coming to class, some using methods that take a few weeks to learn, others after months of determined effort. They are amazed at a simple exercise that takes only thirty minutes.

One of the first things students hear is, “You are learning to use more of your mind and to use it in a special manner.”

This is a simple sentence they hear and internalize at the outset. The full meaning of it is nothing less than stupefying. Everyone—no exceptions—everyone has a mind that can easily be trained to exercise powers that beginners openly doubt they have. Only when they actually experience these powers do they come to believe.

Another thing that students are told is, “Project yourself mentally to your ideal place of relaxation”—a pleasant, calming, remarkably vivid exercise, which both strengthens the imagination and leads to deeper relaxation.

A word about meditation: In everyday speech it means thinking things over. If you set this book aside for a moment and consider what to have for dinner tomorrow, you are meditating.

But in the various meditative disciplines the word has a more specific meaning, referring to a special level of mind. In some disciplines, reaching this level is an end in itself, clearing the mind of all conscious thought. This produces a pleasant calm and goes a long way toward relieving and preventing illnesses caused by tension, as countless studies have proved.

But this is passive meditation. Mind Control goes far beyond this. It teaches the student to use this level of mind for solving problems, little nagging ones as well as larger, burdensome ones. This is dynamic meditation; the power of it is truly spectacular.

We hear more and more about Alpha nowadays. It is one of the brain-wave patterns, a kind of electrical energy produced by the brain, and can be measured by an electroencephalograph (EEG). The rhythms of this energy are measured in cycles per second (CPS). Generally, about fourteen CPS and up are called Beta waves; about seven to fourteen are Alpha; four to seven Theta; and four and below are Delta.

When you are wide awake, doing and achieving in the workaday world, you are in Beta, or “outer consciousness,” to use Mind Control terminology. When you are daydreaming, or just going to sleep but not quite there yet, or just awakening but not yet awake, you are in Alpha. Mind Control people call this “inner consciousness.” When you are asleep you are in Alpha, Theta, or Delta, not just Alpha alone, as many believe. With Mind Control training you can enter the Alpha level at will and still remain fully alert.

You may wonder what it feels like to be in these different levels of mind.

Being in Beta, or wide awake, does not produce any one particular feeling. You might feel confident or fearful, busy or idle, engrossed or bored—the possibilities in Beta are endless.

In the deeper levels the possibilities are limited for most people. Life has taught them to function in Beta, not Alpha or Theta. At these deeper levels they are pretty much limited to daydreaming, the edges of sleep, or sleep itself. But with Mind Control training, useful possibilities begin to multiply with no end in sight. As Harry McKnight, Associate Director of Silva Mind Control, wrote, “The Alpha dimension has a complete set of sensing faculties, like the Beta.” In other words, we can do different things in Alpha than we can do in Beta.

This is a key concept in Mind Control. Once you become acquainted with these sensing faculties and learn to use them, you will be using more of your mind in a special manner. You will actually operate psychically whenever you want to, tapping in on Higher Intelligence.

Most people seek out Mind Control as a way to relax, to end insomnia, to find relief from headaches, or to learn to do things that cost great efforts of will, such as stopping smoking, losing weight, improving memory, studying more effectively. This is what most of them come for; they learn much, much more.

They learn that the five senses—touching, tasting, smelling, hearing, and seeing—are only a part of the senses they were born with. There are others, call them powers or senses, once known only to a gifted few and to mystics who developed them over lifetimes removed from the active world. The mission of Mind Control is to train us to awaken these powers.

What this awakening can mean was well put by Mademoiselle’s beauty editor, Nadine Bertin, in the March 1972 issue:

“The drug culture can have its mind-expanding pills, powders and shots. I’ll take mine straight. Mind Control does expand your mind. It teaches you HOW to expand it. It is aptly named because, unlike drugs or hypnosis, you are in control. Mind expansion, self-knowledge and helping others through Mind Control are only limited by your own limitations. ANYTHING is possible. You hear about it happening to others. And suddenly, you see it happening to you.”",
Tanmaya Honervogt,"Tanmaya Honervogt, Maître Enseignant de Reiki Usui, anime régulièrement des séances de formation en Europe, au Japon et aux États-Unis. Elle est l'auteure de nombreux ouvrages.",https://m.media-amazon.com/images/I/01Kv-W2ysOL._SY600_.png
Christophe André,"Médecin psychiatre à l'hôpital Sainte Anne (Paris), Christophe André est l'auteur de nombreux best-sellers : L'estime de soi ; Vivre heureux ; Imparfaits, libres et heureux, (prix Psychologies Magazine 2006). Christophe AndréChristophe André est né à Montpellier d'un père marin et d'une mère institutrice. D'où, peut-être, son goût pour la pédagogie et la psychologie des profondeurs. Il lit très tôt l'oeuvre de Freud et décide de faire médecine pour devenir psychiatre. Il pratique pendant 15 ans psychiatrie et rugby à Toulouse. Après son mariage, il monte à Paris, remplace alors la pratique du rugby par celle de l'écriture, la visite des mêlées par celle des musées, et ne marque plus d'essais, mais en publie de nombreux. Il exerce à l'hôpital Sainte-Anne à Paris, au sein d'une Unité de Psychothérapie Comportementale et Cognitive, spécialisée dans le traitement des troubles émotionnels, anxieux et dépressifs. Beaucoup de ses ouvrages ont connu un très grand succès en France et à l'étranger, mais il considère cependant que ses véritables chefs d'oeuvre sont ses trois filles.",https://m.media-amazon.com/images/I/01Kv-W2ysOL._SY600_.png
Viola Di Russo,,https://m.media-amazon.com/images/S/amzn-author-media-prod/c63ejrtr6tat5ac5rg97r2oira._SY600_.jpg
Gwen Vernier,,https://m.media-amazon.com/images/I/01Kv-W2ysOL._SY600_.png
Michel Lambert,,https://m.media-amazon.com/images/I/01Kv-W2ysOL._SY600_.png
Robert Greene,"January 4th – It Is Already Within You
Sooner or later something seems to call us onto a particular path.
You may remember this something as a signal calling in childhood when an urge out of nowhere, a fascination, a peculiar turn of events struck like an annunciation: This is what I must do, this is what I've got to have. This is who I am. --James Hillman
As you become more sophisticated, you often lose touch with these signals from your primal core. They can be buried beneath all of the other subjects you have studied. Your power and future can depend on reconnecting with this core and returning to your origins. You must dig for signs of such inclinations in your earliest years. Look for its traces in visceral reactions to something simple; a desire to repeat an activity that you never tired of; a subject that stimulated an unusual degree of curiosity; feelings of power attached to particular actions. It is already there within you. You have nothing to create; you merely need to dig and refine what has been buried inside of you all along. If you reconnect with this core at any age, some element of that primitive attraction will spark back to life, indicating a path that can ultimately become your Life's Task.
Daily Law: Ask someone who recalls your childhood what they remember about your interests. Get reacquainted with those early passions. (Mastery, I: Discover Your Calling-The Life's Task)

April 30th – Never Appear Too Perfect

It takes great talent and skill to conceal one’s talent and skill. --François De La Rochefoucauld
 
Sir Walter Raleigh was one of the most brilliant men at the court of Queen Elizabeth of England. He had skills as a scientist, wrote poetry still recognized as among the most beautiful writing of the time, was a proven leader of men, an enterprising entrepreneur, a great sea captain, and on top of all this was a handsome, dashing courtier charmed his way into becoming one of the queen’s favorites. Wherever he went, however, people blocked his path. Eventually he suffered a terrific fall from grace, leading even to prison and finally the executioner’s axe. Raleigh could not understand the stubborn opposition he faced from the other courtiers. He did not see that he had not only made no attempt to disguise the degree of his skills and qualities, but he had imposed them on one and all, making a show of his versatility, thinking it impressed people and won him friends. In fact it made him silent enemies, people who felt inferior to him and did all they could to ruin him the moment he tripped up or made the slightest mistake. In the end, the reason he was executed was treason, but envy will use any cover it finds to mask its destructiveness.
 
Daily Law: Appearing better than others is always dangerous, but most dangerous of all is to appear to have no faults or weaknesses. Envy creates silent enemies. Defuse it by occasionally downplaying your virtues. (The 48 Laws of Power, Law 46: Never Appear Too Perfect)


June 19th – Make Others Come To You

Filippo Brunelleschi, the great Renaissance artist and architect, was a great practitioner of the art of making others come to him as a sign of his power. On one occasion he had been engaged to repair the dome of the Santa Maria del Fiore cathedral in Florence. The commission was important and prestigious. But when the city officials hired a second man, Lorenzo Ghiberti, to work with Brunelleschi, the great artist brooded in secret. He knew that Ghiberti had gotten the job through his connections, and that he would do none of the work and get half the credit. At a critical moment of the construction, then, Brunelleschi suddenly developed a mysterious illness. He had to stop work, but pointed out to city officials that they had hired Ghiberti, who should have been able to continue the work on his own. Soon it became clear that Ghiberti was useless and the officials came begging to Brunelleschi. He ignored them, insisting that Ghiberti should finish the project, until finally they realized the problem: they fired Ghiberti. By some miracle, Brunelleschi recovered within days. He did not have to throw a tantrum or make a fool of himself; he simply practiced the art of making others come to you.

Daily Law: If on one occasion you make it a point of dignity that others must come to you and you succeed, they will continue to do so even after you stop trying.  (The 48 Laws of Power, Law 8: Make Other People Come to You—Use Bait if Necessary)


October 11 – Beware the Fragile Ego

Of all the human emotions, none is uglier or more elusive than envy, the sensation that others have more of what we want— possessions, attention, respect. We deserve to have as much as they do yet feel somewhat helpless to get such things. But paradoxically, envy entails the admission to ourselves that we are inferior to another person in something we value. Not only is it painful to admit this inferiority, but it is even worse for others to see that we are feeling this. And so almost as soon as we feel the initial pangs of envy, we are motivated to disguise it to ourselves—it is not envy we feel but unfairness at the distribution of goods or attention, resentment at this unfairness, even anger. The underlying sense of inferiority is too strong, leading to hostility that cannot be vented by a comment or put-down. Sitting with one’s envy over a long period of time can be painful and frustrating. Feeling righteous indignation against the envied person, however, can be invigorating. Acting on envy, doing something to harm the other person, brings satisfaction, although the satisfaction is short lived because enviers always find something new to envy.

Daily Law: Envy is perhaps the ugliest human emotion. Destroy it before it destroys you. Develop your sense of self- worth from internal standards and not incessant comparisons. (The Laws of Human Nature, 10: Beware the Fragile Ego—The Law of Envy)


December 1st – The Infinite and the Awesome
 
“Whereas all the other animals have their heads low, eyes fixed upon the ground, the gods desired to give to man a sublime face, a face that could raise its eyes to the heavens above, contemplating  the very stars in the sky.” --Ovid
 
We can define the Cosmic Sublime in the following way: it is an encounter with any physical object that embodies or implies a sense of the infinite,  in  space  or  time.  In  the  ancient  world,  our  ancestors  understood  this  deep  human  need.  In  cultures  all  around  the  world,  they  created  rituals, often rites of initiation, that triggered an awareness of the magnificent  forces  that  transcend  the  human.  Shamans  or  wise  elders  often  served as guides. In our culture we do not easily find such guides or accepted means for encountering the Cosmic Sublime. In fact, we find the opposite: the media that dominates our minds gluts us on trivia and the exaggerated  dramas  of  the  moment.  If  we  seek  the  expansion  that  will  pull us out of our mental ruts, we are largely on our own. Fortunately, however, this is not as difficult as we might imagine: we are surrounded by embodiments of the infinite and the awesome. The infinite comes in many  forms—silence, seemingly endless horizons, blank spaces, et cetera. What matters is our level of attunement to these places—our desire to expand and transcend our usual limits, and our willingness to let go of any  distractions  and  open  ourselves  to  the  elements.  We  are  after  an   experience—not  more  talk.
 
Daily Law: Pull your mind away from the dramas of the moment and seek the expansion. (Law of the Sublime, 1: Expand the Mind to Its Furthest Reaches—The Cosmic Sublime)",https://m.media-amazon.com/images/S/amzn-author-media-prod/eaepvmifn1s1moomieu0q7pia7._SY600_.jpg
David O'Hare,Le Dr David O'Hare est médecin et spécialiste international de cohérence cardiaque. Il forme des thérapeutes au sein de l'institut de formation David O'Hare en Europe francophone et au Québec. Il est l'auteur du best-seller Cohérence cardiaque 3.6.5.,https://m.media-amazon.com/images/I/41DdivTFqIL._SY600_.jpg
Dr James Doty,"Our happiness in many ways is related to our ability to manifest. Dr Doty explains how intention is manifested in the brain and offers six steps each of us can use to create the life we want. Powerful and profound. ― Arianna Huffington, #1 New York Times bestselling author of Thrive

Dr Doty's book Mind Magic has given us a concrete program, based on neuroscience, on how to manifest our intentions the right way, and how by doing so we are empowered to live a life of meaning and purpose. ― Jon Hamm

Mind Magic is a book we need now! Dr James Doty offers powerful, neuroscience-based techniques for manifestation that can change our lives and change our world. ― Marci Shimoff, New York Times bestselling author of Happy for No Reason

Dr Doty is to be congratulated for offering a practical guide based in neuroscience on the mechanics of how personal reality is created in consciousness. ― Deepak Chopra, MD, bestselling author of The Seven Spiritual Laws of Success

This book is about the mind but it's also about magic . . . for in truly understanding one, we understand the other. ― Marianne Williamson, bestselling author of A Return to Love

Brilliant, passionate, and effective, this could be the best guide ever written to making your dreams come true. Integrating brain science, wisdom traditions, and practical psychology, it brings readers along a proven, step-by-step path toward fulfilling their goals. A beautiful gem of a book. ― Rick Hanson, PhD, bestselling author of Buddha’s Brain",https://m.media-amazon.com/images/S/amzn-author-media-prod/tffmubtcg5aqcvlcjkas2mtlo1._SY600_.jpg
Stéphane LE COLAS,,https://m.media-amazon.com/images/S/amzn-author-media-prod/rqbik6midqj5alb66cgshrgdr4._SY600_.jpg
Dr John F. Demartini,,https://m.media-amazon.com/images/S/amzn-author-media-prod/cpgbnuu55dbbnnbu23i07ner2c._SY600_.jpg
Viola Di Russo,,https://m.media-amazon.com/images/S/amzn-author-media-prod/c63ejrtr6tat5ac5rg97r2oira._SY600_.jpg
Viola Di Russo,,https://m.media-amazon.com/images/S/amzn-author-media-prod/c63ejrtr6tat5ac5rg97r2oira._SY600_.jpg
Aurore Esclauze,,
Matthieu Ricard,"Docteur en génétique cellulaire, moine bouddhiste, interprète du Dalaï-Lama, photographe, Matthieu Ricard est l'auteur de nombreux ouvrages, parmi lesquels Plaidoyer pour le bonheur, L'Art de la méditation, Plaidoyer pour l'altruisme (NiL, 2003, 2008, 2013), Plaidoyer pour les animaux, Cerveau et méditation, et Pouvoir et altruisme (Allary Éditions, 2014, 2017, 2018), tous repris chez Pocket et traduits dans plus de vingt langues. Il vit au Népal où il se consacre aux projets humanitaires de l'association Karuna-Shechen. Méditant chevronné, il est régulièrement sollicité par les universités du monde entier pour se prêter à des expériences sur le cerveau.",
Emilie Pernet,"Émilie Pernet est sophrologue et hypnothérapeute. Chez First, elle est également l'auteur du Petit Livre du lâcher-prise et du Petit Livre de l'intuition.",https://m.media-amazon.com/images/S/amzn-author-media-prod/78ts660diokn8pqtf3601bdprk._SY600_.jpg
David Berceli,David Berceli (Ph.D.) est un expert international de la gestion des stress post-traumatiques. Il a vécu et travaillé pendant plus de 25 ans dans des pays déchirés par la guerre ou frappés par des catastrophes naturelles. Il a élaboré des programmes spéciaux d'aide post-traumatique pour l'armée américaine. Actuellement il enseigne la méthode TRE dans une trentaine de pays.,https://m.media-amazon.com/images/I/01Kv-W2ysOL._SY600_.png
Fabrice Midal,"Fabrice Midal est un philosophe français spécialiste du bouddhisme. Il est l'auteur de nombreux ouvrages sur le sujet dont Mille merveilles de la sagesse bouddhiste (Ed. de l'œuvre), ABCD du bouddhisme (Grancher) et À la source de la parole du Bouddha (Pocket).",https://m.media-amazon.com/images/S/amzn-author-media-prod/6koufnr2ot71apvuet93s7bcbf._SY600_.jpg
Michel Lambert,,https://m.media-amazon.com/images/I/01Kv-W2ysOL._SY600_.png
Nicole Prieur,"Nicole Prieur est philosophe et psychanalyste, spécialisée dans les relations familiales. Directrice du Conseil scientifique du Ceccof, le Centre d'études cliniques des communications familiales, elle est notamment l'auteure de Grandir avec ses enfants et de Petits règlements de comptes en famille.",
David O'Hare,Le Dr David O’Hare est l’un des spécialistes internationaux de la cohérence cardiaque. Il a proposé cette méthode à des patients pendant plusieurs années. Il l’enseigne aux thérapeutes en Europe et en Amérique du Nord depuis sept ans. Il est l’auteur de Cohérence cardiaque 365.,https://m.media-amazon.com/images/I/41DdivTFqIL._SY600_.jpg
Viola Di Russo,,https://m.media-amazon.com/images/S/amzn-author-media-prod/c63ejrtr6tat5ac5rg97r2oira._SY600_.jpg
Michael A. Singer,"""East is East and West is West, but Michael Singer bridges these two great traditions in a radiant treatise on how to succeed in life from our spiritual quest to our everyday tribulations. Freud said that life was composed of love and work. With great eloquence, wit, and compelling logic, Singer s brilliant book completes this thought by showing them to be two poles of the same selfless devotion."" --Ray Kurzweil, inventor, National Medal of Technology recipient and author of The Age of Spiritual Machines.

In the book, The Untethered Soul, Michael Singer takes you step-by-step through the process of Gyana, the Yoga of the Intellect, to the Source. Moreover, he does it with elegant simplicity. Read this book carefully and you will get more than a glimpse of eternity. --Deepak Chopra

In lucid, unadorned prose, Michael Singer delivers the essence of the great spiritual teachings of the Ages. Each chapter of The Untethered Soul is an instructive meditation on the binds of the human condition and how each and every knot can be gracefully untied so that our souls may fly. The accuracy and simplicity of this work is a measure of its pure mastery. --James O Dea, President of the Institute of Noetic Sciences (IONS)",https://m.media-amazon.com/images/S/amzn-author-media-prod/j4fta3hreq108temnja7pg3n6i._SY600_.jpg
Neven Paar,,https://m.media-amazon.com/images/S/amzn-author-media-prod/g1bcjkjkfhfv9v9i8ljmu72u27._SY600_.jpg
Jack Kornfield,"Né en 1945, Jack Kornfield est titulaire d'un doctorat de psychologie clinique de l'université de Dartmouth. Il est également le fondateur de l'Insight Meditation Society et du centre bouddhique de Spirit Rock en Californie, où il enseigne et vit. Jack Kornfield est l'auteur de plusieurs ouvrages, parmi lesquels Après l'extase, la lessive (La Table ronde, 2001), Bouddha (2011), Une lueur dans l'obscurité (2013) ou La Sagesse du cœur (2015), publiés chez Belfond. Tous ces titres sont repris chez Pocket.
En 2019 paraît Libre et heureux, ici et maintenant chez le même éditeur.

Retrouvez toute l'actualité de l'auteur sur : www.jackkornfield.com

Chirurgien devenu psychothérapeute, Thierry Janssen est l'auteur de plusieurs livres consacrés à une approche globale de l'être humain, au développement de ce que l'on appelle la "" médecine intégrative "" et à une vision plus spirituelle de la société. Ses ouvrages – Le Travail d'une vie (2001), Vivre en paix (2003), La Solution intérieure (2006), La maladie a-t-elle un sens ? (2008), Le Défi positif (2011) et Confidences d'un homme en quête de cohérence (2012) – rencontrent un succès grandissant auprès du public. Considéré comme un guide ou un ami spirituel par beaucoup, il est le fondateur de l'École de la Présence thérapeutique, à Bruxelles.
En 2018, Écouter le silence à l'intérieur, a paru aux éditions de l'Iconoclaste.

Retrouvez toute l'actualité de l'auteur sur : www.thierryjanssen.com",https://m.media-amazon.com/images/I/81T98KowJJL._SY600_.jpg
