Nom,Description,Photo
Viola Di Russo,,https://m.media-amazon.com/images/S/amzn-author-media-prod/c63ejrtr6tat5ac5rg97r2oira._SY600_.jpg
Viola Di Russo,,https://m.media-amazon.com/images/S/amzn-author-media-prod/c63ejrtr6tat5ac5rg97r2oira._SY600_.jpg
Patrick Drouot,"PATRICK DROUOT est physicien, diplômé de l'université Columbia à New York, spécialiste mondialement reconnu des sciences cognitives, de l'expérimentation des états d'expansion de conscience, et des thérapies quantiques. Il a développé une synthèse des nouvelles découvertes de la physique post-quantique et de leurs liens avec les grandes traditions de l'humanité. Il est auteur de nombreux ouvrages dont les bestsellers Nous sommes tous immortels, et Guérison spirituelle et immortalité (Éditions du Rocher), et Le Guide pratique de la cohérence cardiaque, paru chez Guy Trédaniel édite

MARIE BORREL est journaliste et auteure. Elle a dirigé pendant une dizaine d'années la rubrique santé du magazine Psychologies, avant de devenir rédactrice en chef du magazine Médecine douce.
Pendant plus de vingt ans, elle a exploré les chemins du bien-être, découvrant peu à peu comment les petites améliorations de notre hygiène de vie et de notre équilibre psycho-émotionnel se combinent pour nous permettre de mieux vivre. Elle a signé de multiples ouvrages et collabore avec de nombreux médecins et chercheurs.",https://m.media-amazon.com/images/I/51XJma0ndXL._SY600_.jpg
Serge Boutboul,"Enseignant spirituel ayant inspiré des milliers de personnes de par ses perceptions et sa connaissance extraordinairement fines des mondes subtils, Serge Boutboul fut élève et ami de Raymond Réant, l'un des plus célèbres clairvoyants français. Éveilleur de conscience, il transmet ses techniques d'éveil psychique et spirituel depuis plus de vingt-cinq ans à travers des cours, séminaires, conférences et émissions qui ont su sensibiliser un vaste public. Il est l'auteur de nombreux livres et coffrets best-sellers, chez le même éditeur.

Site Internet : https://sergeboutboul.com/
Facebook : Serge Boutboul
Youtube Serge Boutboul
Instagram serge_boutboul",https://m.media-amazon.com/images/I/B1n+1Z9Z0oS._SY600_.jpg
Thibaut Meurisse,,https://m.media-amazon.com/images/S/amzn-author-media-prod/dodgjj92binq4366fb33l1m2jg._SY600_.jpg
Khalil Gibran,"Durant toutes ces années, le prophète a côtoyé les collines, conversé avec les vents et murmuré au creux des arbres. Étranger au peuple d'Orphalese, il a pourtant appris à le connaître et à l'aimer. Or, à l'heure de repartir vers sa terre natale, il éprouve une grande tristesse. Car c'est au sein de ce peuple, grâce à tout ce que lui a insufflé ce lieu, qu'il a pu mûrir la sagesse qu'il va désormais dispenser. Et c'est à Orphalese qu'à l'heure de l'adieu, dans un ultime échange, il s'accomplit comme prophète. On l'interroge sur les grandes préoccupations humaines et, inlassablement, il chuchote sa réponse avec tendresse et compréhension, sans dogmatisme. Long poème en prose, Le Prophète nous livre une conception de la religion qui est une conception de la vie. Étonnamment moderne, le panthéisme de Khalil Gibran conduit le divin vers des régions accessibles à tous. Nul besoin d'être chrétien du Liban, comme son auteur, pour se laisser bercer par le doux balancement des phrases. D'une grande indulgence envers les faiblesses de l'homme, mais aussi d'une grande confiance dans ses possibilités, cette modulation de L'Ecclésiastique, publiée en 1925, est sans doute le texte auquel Gibran a consacré le plus d'efforts. --Sana Tang-Léopold Wauters",
Bessel van der Kolk,"Revue de presse
An astonishing and important book. The trauma Bible. I cannot recommend it enough for anyone struggling with...well...anything -- Tara Westover

Fascinating, hard to put down, and filled with powerful case histories. . . . the most important series of breakthroughs in mental health in the last thirty years -- Norman Doidge, author of The Brain That Changes Itself

A gripping bestseller about where trauma goes, and its disastrous effects on both individuals and societies. Deeply interesting. ― The Times

Nobody can stop talking about this book right now . . . you might want to listen -- Maddie Bender ― Men's Health

Dr. van der Kolk's masterpiece combines the boundless curiosity of the scientist, the erudition of the scholar, and the passion of the truth teller -- Judith Herman, M.D., author of Trauma and Recovery

Everyone should read this book -- Nigella Lawson

A seminal book that outlines the author's pioneering work -- Thea Jane May ― Vogue

Draws on 30 years of experience to argue powerfully that trauma is one of the West's most urgent public health issues... Packed with science and human stories ... van der Kolk has a lot to say, and the struggle and resilience of his patients is very moving ― New Scientist

Fundamental in understanding how our physical self is connected to all the things we go through and beyond -- Gemma Cairney

A masterpiece of powerful understanding and brave heartedness, one of the most intelligent and helpful works on trauma I have ever read. . . a brilliant synthesis of clinical cases, neuroscience, powerful tools and caring humanity, offering a whole new level of healing -- Jack Kornfied, author of A Path With Heart

Incredible -- William Leith, 'Books of the Year' ― Evening Standard
Quatrième de couverture
The effects of trauma can be devastating for sufferers, their families and future generations. Here one of the world's experts on traumatic stress offers a bold new paradigm for treatment, moving away from standard talking and drug therapies and towards an alternative approach that heals mind, brain and body.
En lire plus",
Frédéric Lenoir,"Frédéric Lenoir est philosophe, sociologue, historien des religions et chercheur associé à l'École des Hautes Études en Sciences Sociales (EHESS). Il produit l'émission hebdomadaire "" Les Racines du ciel "" sur France Culture. Auteur d'une quarantaine d'ouvrages (essais, encyclopédies, romans), traduits dans une vingtaine de langues et vendus à plus de quatre millions d'exemplaires, Frédéric Lenoir écrit aussi pour le cinéma, le théâtre et la bande dessinée.

Retrouvez toute l'actualité de l'auteur sur :
www.fredericlenoir.com
www.facebook.com/pages/Frédéric-Lenoir",https://m.media-amazon.com/images/S/amzn-author-media-prod/loaeehprlvjk6tdmam3kjibm2o._SY600_.jpg
Samuel Ganes,"Samuel Ganes est instructeur de yoga, en méditation, thérapeute ayurvédique, spirothérapeute, sophrologue et formateur. Au fil de ses nombreux voyages en Inde, il s'est spécialisé dans les méthodes de respirations ancestrales (pranayamas) auprès des plus grands à Varanasi ou Mumbai, avant de créer la spirothérapie, thérapie par le souffle, à laquelle il forme chaque année de nombreuses personnes.
Il est l'auteur d'ouvrages de bien-être dont Mon coach ayurvéda et 50 exercices de yoga (éd. Eyrolles).",https://m.media-amazon.com/images/S/amzn-author-media-prod/23gh1khu86uffjrmb2cc0gba3k._SY600_.jpg
Luc Bodin,"Luc Bodin est docteur en médecine, diplômé en cancérologie clinique et spécialiste en médecines naturelles. Il est aussi conférencier, formateur et auteur de nombreux livres à succès, dont Le Grand Manuel des soins énergétiques, Soignez avec l'énergie, ROHR au quotidien, La médecine spirituelle, et Découvrir le sens caché des maladies, parus chez le même éditeur.",
Christophe André,"Médecin psychiatre, Christophe André est l'un des meilleurs spécialistes français de la psychologie des émotions. Ses ouvrages de vulgarisation scientifique – dont Méditer jour après jour ou Imparfaits, libres et heureux – connaissent un immense succès et ont aidé de nombreux lecteurs.",https://m.media-amazon.com/images/I/01Kv-W2ysOL._SY600_.png
David O'Hare,"Le Dr David O'Hare est médecin et spécialiste international de la cohérence cardiaque. Il forme des thérapeutes, des intervenants professionnels et des coachs au sein de l'institut de formation Equilibios David O'Hare (IFEDO) en Europe francophone et au Québec.",
Héctor García,"Revue de presse
Ikigai urges individuals to simplify their lives by pursuing what sparks joy for them ― Marie 'KonMari' Kondo

I love [this] book… I read it and it’s bewitched me ever since. I’m spellbound

A refreshingly simple recipe for happiness... According to the Japanese, everyone has an ikigai. It means your purpose – the reason you get up in the morning. The thing that fires you up and keeps you busy. Your raison d'être. ― Stylist

Curl up on the sofa with this and enjoy an insight into Japanese culture while picking up some self-care tips you may not have considered before... Ikigai offers an insight into a gentle yet focused way of life built around a sense of purpose. ― Independent

Ikigaigently unlocks simple secrets we can all use to live long, meaningful, happy lives. Science-based studies weave beautifully into honest, straight-talking conversation you won’t be able to put down. Warm, patient, and kind, this book pulls you gently along your own journey rather than pushing you from behind.

[The] Japanese art of ikigai ...Its basic message is about ""authentic living"". Practitioners must fill in overlapping circles that cover motivation, fulfilment, what they earn and what improves their life. The answer at the centre will be the key to a happy and long life. ― Guardian

If hygge is the art of doing nothing, ikigai is the art of doing something - and doing it with supreme focus and joy. ― New York Post
Quatrième de couverture
Bring meaning and joy to your every day with the internationally bestselling guide to ikigai.

The people of Japan believe that everyone has an ikigai – a reason for being; the thing that gets you out of bed each morning. And according to the residents of the Japanese island of Okinawa – the world’s longest-living people – finding it is the key to a longer and more fulfilled life.

Inspiring and comforting, this book will bring you closer to these centenarians’ secrets: how they leave urgency behind; keep doing what they love for as long as possible; nurture friendships; live in the moment; participate in their communities and throw themselves into their passions. And it provides practical tools to help you discover your own personal ikigai.

Because who doesn’t want to find happiness in every day?








En lire plus",
Christophe André,"Il y a d'abord cette lumière jaune, intense, d'un soleil d'hiver qui brille au-dehors. Un soleil qui éblouit sans réchauffer. Puis on découvre le vieil homme immobile. II s'est détourné de sa table de travail et du livre qu'il étudiait : pour réfléchir ? Se reposer ? Méditer ? Notre regard glisse ensuite vers la droite et remarque la porte basse de la cave. Puis il est attiré par l'escalier en colimaçon. Au moment où il s'apprête à gravir les premières marches, il découvre le feu qui crépite dans l'âtre et une femme attisant la braise. Il revient vers l'envol des marches : mais elles ne conduisent qu'à de l'obscurité.
Le tableau est petit, le lieu qu'il dépeint est sombre, mais on a le sentiment d'un vaste espace. C'est le génie de Rembrandt, qui fait voyager notre regard dans toutes les dimensions. En largeur, depuis la gauche, d'où irradie la lumière du jour, vers la droite, où celle du feu est fragile, presque dérisoire; le dialogue d'un soleil qui éclaire sans réchauffer et d'un feu qui réchauffe sans éclairer ; soleil de la raison et feu de la passion, deux ingrédients pour philosopher ? En hauteur, avec cet escalier en colimaçon qui relie profondeurs secrètes de la cave et mystères obscurs de l'étage. En profondeur, depuis le fond du tableau où siège le philosophe jusqu'au cercle de ténèbres qui l'entoure. Mais le sentiment d'espace vient aussi du jeu subtil entre le dévoilé et le caché. Ce qui importe, c'est ce qu'on imagine : de l'autre côté de la fenêtre, derrière la porte de la cave, en haut de l'escalier. Et le plus vaste de ces univers cachés à nos yeux qui sont passés trop vite : l'esprit du philosophe, son monde intérieur. Ténèbres et pénombres, un peu de lumière, un peu de chaleur. Et un esprit en marche. Est-ce à cela que ressemble notre intériorité ?

Méditer c'est s'arrêter

S'arrêter de faire, de remuer, de s'agiter. Se mettre un peu en retrait, se tenir à l'écart du monde.
Au début, ce qu'on éprouve semble bizarre : il y a du vide (d'action, de distraction) et du plein (tumulte des pensées et des sensations dont on prend soudainement conscience). Il y a ce qui nous manque : nos repères et des choses à faire ; et, au bout d'un moment, il y a l'apaisement qui provient de ce manque. Les choses ne se passent pas comme à «l'extérieur», où notre esprit est toujours accroché à quelque objet ou projet : agir, réfléchir sur un sujet précis, avoir son attention captée par une distraction.
Dans cette apparente non-action de l'expérience méditative, on met du temps à s'habituer, à voir un peu plus clair. Comme dans le tableau. Comme lorsqu'on passe de la lumière à l'ombre. Nous sommes entrés en nous-mêmes, pour de vrai. C'était tout près de nous, mais nous n'y allions jamais. Nous traînions plutôt dehors : à notre époque de sollicitations effrénées et de connexions forcenées, notre lien à nous-mêmes reste souvent en friche. Intériorités abandonnées... les extériorités sont plus faciles, et plus balisées. Alors que l'expérience méditative est souvent une terre sans sentiers. Dans la pièce où médite le philosophe, il y a moins de lumière, alors il faut ouvrir les yeux plus grand. En nous-mêmes aussi : il y a moins d'évidences et de réassurances, alors nous avons à ouvrir plus grand les yeux de notre esprit.
On pensait, on espérait trouver le calme, le vide. On tombe souvent sur un grand bazar, du tapage, du chaos. On aspirait à la clarté, on a trouvé la confusion. Parfois, méditer nous expose à l'angoisse, à la souffrance, à ce qui nous fait souffrir et qu'on évitait en pensant à autre chose, en s'agitant ailleurs. --Extrait

http://www.editions-iconoclaste.fr/spip.php?article1549 --Revue de presse",https://m.media-amazon.com/images/I/01Kv-W2ysOL._SY600_.png
Isabel S Churchill,,https://m.media-amazon.com/images/S/amzn-author-media-prod/qvog9obcugf9adqo3qd7mf5og._SY600_.jpg
Séverine Carqueville,,
Catherine Satra Le Bris,,
Eline Snel,"Eline Snel est thérapeute. Elle a mis au point une méthode de méditation pour les enfants qui a fait le tour du monde. Son Académie pour l'enseignement de la pleine conscience forme de nombreux parents et professionnels de la petite enfance aux Pays-Bas, en France, en Espagne, en Amérique latine et dans bien d'autres pays. Son livre Calme et attentif comme une grenouille est devenu le livre n°1 de méditation pour les enfants dans le monde entier. Aujourd'hui, de plus en plus d'écoles découvrent les bienfaits de la pleine conscience.",
Viola Di Russo,,https://m.media-amazon.com/images/S/amzn-author-media-prod/c63ejrtr6tat5ac5rg97r2oira._SY600_.jpg
Viola Di Russo,,https://m.media-amazon.com/images/S/amzn-author-media-prod/c63ejrtr6tat5ac5rg97r2oira._SY600_.jpg
Frédéric Lenoir,"Frédéric Lenoir est philosophe, sociologue, historien des religions et chercheur associé à l'École des Hautes Études en Sciences Sociales (EHESS). Il produit l'émission hebdomadaire "" Les Racines du ciel "" sur France Culture. Auteur d'une quarantaine d'ouvrages (essais, encyclopédies, romans), traduits dans une vingtaine de langues et vendus à plus de quatre millions d'exemplaires, Frédéric Lenoir écrit aussi pour le cinéma, le théâtre et la bande dessinée.

Retrouvez toute l'actualité de l'auteur sur :
www.fredericlenoir.com
www.facebook.com/pages/Frédéric-Lenoir",https://m.media-amazon.com/images/S/amzn-author-media-prod/loaeehprlvjk6tdmam3kjibm2o._SY600_.jpg
Thich Nhat Hanh,"La Pleine Conscience est le miracle grâce auquel nous pouvons vivre pleinement chaque instant de la vie, que ce soit en mangeant une mandarine, en jouant avec des enfants ou en faisant la vaisselle. Les principes simples et directs qu'énonce le célèbre maître zen Thich Nhat Hanh sont universels et chacun peut y découvrir des trésors. Par cet enseignement, où méditation et action ne sont pas séparées, nous sommes invités à redécouvrir la véritable beauté de la vie au fil de notre quotidien, à apprécier chaque minute, chaque seconde du miracle de la réalité. Le miracle de la Pleine Conscience nous apprend à retrouver l'émerveillement de l'enfant devant le monde et à nous reposer dans le calme et la paix de notre nature profonde.",https://m.media-amazon.com/images/S/amzn-author-media-prod/91o0mh6hjt44j5c7g77853fef8._SY600_.jpg
Luc Bodin,"Luc Bodin est docteur en médecine, diplômé en cancérologie clinique et spécialiste en médecines naturelles. Il est de plus, conférencier et auteur de nombreux livres dont le Ho'oponopono, le secret des guérisseurs hawaïens, Soignez avec l'énergie, Manuel de soins énergétiques et Les trois secrets de l'Univers.",https://m.media-amazon.com/images/I/01Kv-W2ysOL._SY600_.png
Ryan Holiday,"If Stoicism is becoming trendy, you can credit, or blame, Mr. Holiday. ― New York Times

The Daily Stoic follows up on the success of [The Obstacle Is The Way] by providing a year of quotations and life lessons drawn from the three great Stoic sages. ― Wall Street Journal

A generous gift of guidance on modern living culled from a canon of wisdom hatched long ago. -- Maria Popova, editor of Brain Pickings

A richly rewarding spring of practical wisdom to help you focus on what's in your control, eliminate false and limiting beliefs, and take more effective action. Make The Daily Stoic your guide and you will grow in clarity, effectiveness, and serenity each day! -- Jack Canfield, co-author of 'The Success Principles'™ and the 'Chicken Soup for the Soul'® series

A treasure for managing our choices, overcoming self-deception, and learning to act according to the true worth of things -- Joseph A. Maciariello, author of 'The Daily Drucker'

Whether you're a lowly cubicle slave or a US Senator, this book will help you find your still center. -- Gregory Hays, translator of The Modern Library's edition of Marcus Aurelius' 'Meditations'; Professor of Classics and Director of Undergraduate Studies at the University of Virginia

The Daily Stoic is a treasure for managing our choices, overcoming self-deception, and learning to act according to the true worth of things while keeping the common good always in view. Caring for the soul in this way makes not only better people, but a stronger society too. -- Joseph A. Maciariello, Professor Emeritus at Drucker and Ito Graduate Management School; author of The Daily Drucker, The Effective Executive in Action, and A Year with Peter Drucker

Really digging this. -- Debra Messing, actress

Praise for The Obstacle is the Way:
'A book for the bedside of every future - and current - leader in the world.
-- Robert Greene, author of The 48 Laws of Power and Mastery

[The book that's] turning the entrepreneurs and the moguls into hard-wired stoics ― The Times

Ryan Holiday is part Machiavelli, part Ogilvy ... this whiz kid is the secret weapon you've never heard of. -- Tim Ferriss, author of The 4-Hour Work Week",
