Nom,Description,Photo
Alain Desrosières,"Alain Desrosières (1940-2013), a été administrateur de l'INSEE et membre du département Recherche de cet institut, participe au Groupe de sociologie politique et morale (École des hautes études en sciences sociales et CNRS). Il a été au cœur des travaux d'élaboration de la nouvelle nomenclature des catégories socioprofessionnelles. Il est l'auteur d'un ouvrage de référence jamais dépassé : La politique des grands nombres. Histoire de la raison statistique (La Découverte, 1993, poche 2000 et 2010). Emmanuel Didier est chargé de recherche au CNRS (rattaché au Groupe de sociologie politique et morale /EHESS). Il est l'auteur de En quoi consiste l’Amérique ? Les statistiques, le New Deal et la démocratie (La Découverte, 2009) et le co-auteur de Benchmarking. L'État sous pression statistique (Zones 2013) et de Statactivisme. Comment lutter avec des nombres (Zones, 2014).",https://m.media-amazon.com/images/I/01Kv-W2ysOL._SY600_.png
Jean-Paul Devos,"Né à Toulon en 1949, Jean-Paul Devos est un spécialiste en aéro- et hydroacoustique, ainsi qu'en thermodynamique. Il a passé les 20 dernières années de sa carrière au sein de la division Recherche & Développement d'EDF, sur des problématiques liées à la sûreté des centrales nucléaires. Il s'interroge sur le fonctionnement du système économique actuel et sur le lien entre thermodynamique et économie.",
Jean-François Bayart,"Jean-François Bayart, spécialiste de sociologie historique du politique, est titulaire de la chaire Yves Oltramare ""Religion et politique dans le monde contemporain"" , à l'IHEID de Genève.",https://m.media-amazon.com/images/I/01Kv-W2ysOL._SY600_.png
Paul Bacot,Paul Bacot est professeur des universités émérite en science politique à Sciences Po Lyon et au laboratoire Triangle.,
Byung-Chul Han,"Byung-Chut Han est né à Séoul. Après des études de philosophie à Fribourg, il a enseigné à Université de Bâle, à Karlsruhe et depuis trois ans à l'Ecole des Beaux Arts de Berlin.",
Pierre Manent,"La cité est la source première du développement occidental. Avant cette invention, les hommes vivaient selon l'ordre relativement immobile des familles. Avec la cité, l'humanité s'engage dans ce nouvel élément qu'est le politique entendu comme gouvernement de la chose commune, et l'histoire de l'Occident devient alors celle de ses quatre grandes formes politiques : la cité donc, puis l'empire, l'Église et la nation, chaque nouvelle forme résultant de la précédente qui, parvenant au bout de ses possibilités, suscite la suivante. Pendant une grande partie de son histoire, l'Occident restera incertain de sa forme politique, hésitant entre la cité, l'empire et l'Église, jusqu'à ce que soit élaborée la forme politique qui permettra aux Européens de se gouverner enfin de manière rationnelle : la nation. Cependant cette forme à son tour s'est détruite elle-même dans les guerres «hyperboliques» du XXe siècle, et nous sommes aujourd'hui à la recherche d'une nouvelle forme politique. Cette étude s'efforce de retracer l'histoire politique, mais aussi intellectuelle et religieuse de l'Occident en la rattachant sans cesse à la question politique centrale : comment nous gouverner nous-mêmes ?",https://m.media-amazon.com/images/I/01Kv-W2ysOL._SY600_.png
Comité invisible,,
Collectifs,"Est-il encore permis de penser tout haut, ou de penser tout court, dans un pays qui fait tant parler de lui sans qu'il soit possible d'y prendre la parole librement ? Comment, dans la furieuse déferlante de nouvelles qui nous arrivent quotidiennement de et sur la Chine, distinguer d'autres voix que celles des médias et des puissants de ce monde ? À quel moment avons-nous pu entendre les analyses de connaisseurs de la Chine dans la durée et, a fortiori, les discours quasi inaudibles des intellectuels chinois eux-mêmes ?Le but de cet ouvrage collectif est de nous situer par rapport à une Chine qui a envahi notre horizon du fait de sa vertigineuse montée en puissance économique, mais aussi géopolitique et militaire, accréditant ainsi la thèse, devenue un thème central de la propagande officielle, d'un retour en force de son passé impérial.Après des décennies de régime maoïste, nul n'imaginait la Chine être un jour en mesure de se projeter à l'échelle de la planète. Or, force est de constater qu'aujourd'hui les élites intellectuelles chinoises se sentent assez sûres d'elles-mêmes pour se proclamer sans ambages détentrices de valeurs universelles qui ne doivent rien à celles des Lumières européennes. Mais qu'en est-il en réalité ?Contributions de Séverine Arsène, Chu Xiaoquan, Magnus Fiskesjö, Ruth Gamble, Ge Zhaoguang, Ji Zhe, Frédéric Keck, Anne Kerlan, John Makeham, Damien Morier-Genoud, David Ownby, Qin Hui, Marshall Sahlins, Nathan Sperber, Isabelle Thireau, Sebastian Veg.",
Daniel Lindenberg,"Daniel Lindenberg est historien des idées, professeur de sciences politiques à l'université Paris VIII. Il a notamment publié Les Années souterraines, 1937-1947 (La Découverte, 1990), Destins marranes (Hachette, 2005) et Le Procès des Lumières (Seuil, 2009).",https://m.media-amazon.com/images/I/01Kv-W2ysOL._SY600_.png
Agnès Rabagny-Lagoa,"Agnès Rabagny-Lagoa, docteur en droit est martre de conférences à l'université Jean Monnet de Saint-Etienne.",https://m.media-amazon.com/images/I/01Kv-W2ysOL._SY600_.png
Laetitia Strauch-Bonart,Laetitia Strauch-Bonart a été chercheuse dans un think tank français. Elle vit à Londres où elle prépare un PhD en histoire sur les penseurs conservateurs et les questions morales après 1945. Elle collabore aussi au magazine Le Point. Vous avez dit conservateur est son premier essai.,https://m.media-amazon.com/images/I/01Kv-W2ysOL._SY600_.png
Belinda Cannone,"Belinda Cannone est romancière et essayiste. Elle a publié sept romans (le dernier, Nu intérieur aux éditions de L’Olivier, 2015), ainsi que plusieurs essais dont L’Ecriture du désir (MAISON, Prix de l’essai de l’Académie française 2001), Le Sentiment d’imposture (MAISON, Grand Prix de l’essai de la Société des Gens de Lettres 2005), La Tentation de Pénélope (Stock, 2010), S’émerveiller (Stock, 2017) et Le nouveau nom de l’amour (Stock, 2020).",https://m.media-amazon.com/images/I/01Kv-W2ysOL._SY600_.png
Jenny Wheeler,,https://m.media-amazon.com/images/I/01Kv-W2ysOL._SY600_.png
Alexis de Tocqueville,"«J'avoue que dans l'Amérique j'ai vu plus que l'Amérique ; j'y ai cherché une image de la démocratie elle-même, de ses penchants, de son caractère, de ses préjugés, de ses passions». La gloire de Tocqueville n'est pas seulement celle d'un analyste politique exceptionnel ; c'est aussi, depuis la récente redécouverte de son oeuvre, celle d'un philosophe politique qui serait en même temps un classique de la sociologie, et qui pourrait aider à comprendre les problèmes qui se posent constamment dans les démocraties modernes. L'égalité des conditions, l'individualisme, le despotisme démocratique, les relations entre maîtres et serviteurs, l'esprit de liberté et l'esprit de religion, autant de notions qui dessinent aujourd'hui encore les contours d'une philosophie de la démocratie.",
Jean-Claude Michéa,"« Au rythme où progresse le brave new world libéral, si aucun mouvement populaire autonome (j'entends par là : non soumis à l'hégémonie de ces mouvements ""progressistes"" qui ne défendent plus que les seuls intérêts culturels des nouvelles classes moyennes des grandes métropoles du globe, soit un peu moins de 15 % de l'humanité), capable d'agir collectivement à l'échelle mondiale, ne se dessine rapidement à l'horizon, alors le jour n'est malheureusement plus très éloigné où il ne restera presque rien à protéger des griffes du loup dans la vieille bergerie humaine. Mais n'est-ce pas, au fond, ce que Marx lui-même soulignait déjà dans le célèbre chapitre du Capital consacré à la journée de travail ? ""Dans sa pulsion aveugle et démesurée, écrivait-il, dans sa fringale de surtravail digne d'un loup-garou, le Capital ne doit pas seulement transgresser toutes les limites morales, mais également les limites naturelles les plus extrêmes."" Les intellectuels de gauche n'ont désormais plus aucune excuse. »",https://m.media-amazon.com/images/I/01Kv-W2ysOL._SY600_.png
BERTRAND MEHEUST,Bertand Méheust est philosophe. Il est spécialiste de l'histoire de la psychologie.,https://m.media-amazon.com/images/I/01Kv-W2ysOL._SY600_.png
Christophe Jaffrelot,"Christophe Jaffrelot est diplômé de l'Institut d'études politiques de Paris, de l'université Paris I-Sorbonne et de l'Institut national des langues et civilisations orientales. Il est titulaire d'un doctorat en sciences politiques, et est habilité à diriger des recherches à l'Institut d'études politiques de Paris où il enseigne la politique de l'Asie du sud. Directeur du CERI (Centre d'études et de recherches internationales), Christophe Jaffrelot est l'un des meilleurs spécialistes de l'Asie du Sud en France.   Christophe Jaffrelot est l'auteur de plusieurs ouvrages et essais - pour la plupart traduits dans plusieurs pays. Il a notamment publié La Démocratie en Inde (Fayard, 1998), Le Pakistan (Fayard, 2000), Inde : la démocratie par la caste (2005) et L'Inde contemporaine (Fayard, 2006).Photo : D.R.",https://m.media-amazon.com/images/I/01Kv-W2ysOL._SY600_.png
Anne-Cécile Robert,"Spécialiste de l'Afrique et des institutions européennes, Anne-Cécile Robert est journaliste au Monde diplomatique et professeur associé à l'Université Paris 8. Elle est l'auteur de La stratégie de l'émotion, paru chez Lux en 2018.",https://m.media-amazon.com/images/I/01Kv-W2ysOL._SY600_.png
Felwine Sarr,"Né en 1972 au Sénégal, Felwine Sarr est écrivain et universitaire. Agrégé d'économie, il enseigne à l'Université Gaston Berger de Saint-Louis du Sénégal. Il a publié Dahij (Gallimard, 2009), 105 rue Carnot et Méditations africaines (tous deux chez Mémoire d'encrier, Canada).",https://m.media-amazon.com/images/I/01Kv-W2ysOL._SY600_.png
Alain Gresh,"Ancien rédacteur en chef du Monde Diplomatique, spécialiste du Proche-Orient, Alain Gresh a notamment publié en ""Pluriel"" Israël, Palestine (2003) et, en collaboration avec Dominique Vidal, Les 100 clés du Proche-Orient.",https://m.media-amazon.com/images/I/01Kv-W2ysOL._SY600_.png
Sylvie Laurent,"Sylvie Laurent est américaniste. Chercheur associée à Harvard et Stanford, elle enseigne à Sciences Po. Elle a notamment publié, au Seuil, Homérique Amérique (2008) et Martin Luther King (2015 ; rééd. Points, 2016).",https://m.media-amazon.com/images/I/01Kv-W2ysOL._SY600_.png
Vanessa Jérome,"Amélie Lachapelle est chercheuse senior au CRIDS/NaDI et chargée d'enseignement à l'UNamur. Elle a défendu sa thèse de doctorat en sciences juridiques le 29 juin 2020 à l'UNamur. Elle est également, depuis septembre 2020, coordinatrice pédagogique du baccalauréat en droit à horaire décalé à l'UNamur.",https://m.media-amazon.com/images/I/01Kv-W2ysOL._SY600_.png
Cédric Biagini,"Cédric Biagini anime les éditions l'échappée. Il écrit dans les journaux la Décroissance et Offensive. Il est coauteur de La Tyrannie technologique. Critique de la société numérique (l'échappée, 2007) et auteur de L'Emprise numérique. Comment Internet et les nouvelles technologies ont colonisé nos vies (L'échappée, 2012). Guillaume Carnino, ancien ingénieur informaticien, est aujourd'hui historien. Il enseigne les sciences humaines, participe au collectif Livres de papier, et a cofondé les éditions L'échappée - où il a publié Pour en finir avec le sexisme (2005), et coécrit La Tyrannie technologique. Critique de la société numérique (2007) ainsi que Les Luddites en France : Résistance à l'industrialisation et à l'informatisation (2011). Patrick Marcolini, après avoir enseigné la philosophie à l'université pendant plusieurs années, exerce aujourd'hui la profession de conservateur de bibliothèque. Il a publié aux éditions L'échappée Le Mouvement situationniste. Une histoire intellectuelle (2012), et poursuit ses recherches sur les relations entre culture et politique du uxe siècle à nos jours.",https://m.media-amazon.com/images/I/01Kv-W2ysOL._SY600_.png
Érik Neveu,"Erik Neveu est professeur émérite de science politique dans l'équipe rennaise d'ARÈNES. Ses travaux portent sur le journalisme et la télévision, les mouvements sociaux et les circulations internationales de théories dont les "" Cultural Studies "". Il est l'auteur ou le co-auteur de Repères sur ces sujets. Il a co-dirigé en 2017 un collectif sur les pratiques d'enquête intensive en journalisme et sciences sociales (avec P. Leroux, En immersion, PUR, 2017). Ses travaux actuels se recentrent sur les mobilisations avec une recherche collective sur les conséquences biographiques des engagements militants (Activists Forever ? Avec Olivier Fillieule, Cambridge University Press, 2019) et un travail en cours sur les trajectoires de "" Soixante-huitards ordinaires "".",https://m.media-amazon.com/images/I/01Kv-W2ysOL._SY600_.png
