Nom,Description,Photo
Joëlle Maurel,"Joëlle Maurel est docteure en sciences de l'éducation, psychothérapeute-analyste jungienne, spécialiste des états modifiés de la conscience, diplômée de l'Institut de psychologie transpersonnelle à Paris et formée aux approches psycho- corporelles et psycho-spirituelles.
Professeure diplômée de yoga et de Qi Gong, elle est également auteure de plusieurs CD de relaxations et de méditations guidées, de DVD de yoga et de Qi Gong, ainsi que de plusieurs ouvrages dont Pleinement vivant et Guérir : un chemin d'amour et de conscience, parus chez le même éditeur",
Khalil Gibran,"Né en 1954, Didier Sénécal a enseigné l'histoire en région parisienne ainsi qu'à Milan et à New York avant d'entrer dans l'édition en 1983. Il a été journaliste pour le magazine LIRE pendant 17 ans. Il est maintenant lecteur et traducteur pour plusieurs maisons d'édition et a publié une dizaine d'ouvrages. La série du commissaire Lediacre est publiée au Fleuve Noir : Les Intouchables (2006), Les deux amis (2007) et Les Voitures vides (2008). Une nouvelle aventure, Les petites filles et les petits garçon, est parue en janvier 2009, toujours au Fleuve Noir.",
Melissa Gomes,,https://m.media-amazon.com/images/S/amzn-author-media-prod/6uabfdqru7vvl7kjv5t92bjant._SY600_.jpg
Shannon Lee,"Shannon Lee est le PDG de Bruce Lee Family Companies et la présidente de la Bruce Lee Foundation. Elle se consacre à la diffusion de la philosophie et la vie de son père par l'éducation et le divertissement. Elle est la conceptrice de Camp Bruce Lee à travers la Bruce Lee Foundation et a donné entre autres des conférences pour TED, TEDx et Creative Mornings. Elle vit avec sa fille Wren en Californie, où elle co-anime le Bruce Lee Podcast et est la productrice exécutive de Warrior pour Cinemax.",https://m.media-amazon.com/images/I/A10rv3wK8HL._SY600_.jpg
Élisabeth Couzon,"Elisabeth Couzon est psychologue clinicienne et formatrice en développement personnel et pleine conscience. Elle relie les approches de communication, de psychothérapie et de psychologie bouddhiste avec la pleine conscience. Elle est notamment la co-auteure de Soyez un stressé heureux et de S'estimer pour réussir sa vie parus chez ESF.",https://m.media-amazon.com/images/I/01Kv-W2ysOL._SY600_.png
Serge Boutboul,"Serge Boutboul fut élève et ami de Raymond Réant, un des plus célèbres clairvoyants français. Il enseigne et diffuse les techniques d’éveil psychique et spirituel depuis plus de quinze ans, par le biais de cours, séminaires, conférences, qui ont su sensibiliser un vaste public. Il est auteur des best-sellers Développez vos facultés psychiques et spirituelles et Comment percevoir et agir sur les mondes subtils qui nous entourent.",https://m.media-amazon.com/images/I/B1n+1Z9Z0oS._SY600_.jpg
Luc Bodin,"Luc Bodin est docteur en médecine, diplômé en cancérologie clinique et spécialiste en médecines naturelles. Il est conseiller scientifique auprès de revues de santé et auteur de plusieurs best-sellers comme Ho'oponopono, le secret des guérisseurs hawaïens, AORA au quotidien, Soigner avec l'énergie, Le manuel de soins énergétiques, Les trois secrets de l'univers, etc.",https://m.media-amazon.com/images/I/01Kv-W2ysOL._SY600_.png
Khalil Gibran,"Publié pour la première fois en 1923, Le Prophète a séduit des millions de personnes à travers le monde. Fable explorant notamment les thèmes universels de l'amour, de l'amitié, de la beauté et de la mort, cet hymne à la liberté et à l'épanouissement de soi est une référence spirituelle incontournable. Le chef d'oeuvre de Khalil Gibran renaît ici dans une édition augmentée de textes inédits découverts par l'éditeur Dalton Hilu Einhorn dans les archives privées Gibran/Haskell et illustrée par la main même de l'auteur.",https://m.media-amazon.com/images/S/amzn-author-media-prod/b61g45vrb7u1g1rbso6rd26qpd._SY600_.jpg
yung pueblo,"Diego Perez was born in Ecuador and immigrated to the United States as a child. He grew up in Boston and attended Wesleyan University. During a silent Vipassana meditation course in 2012, he saw that real healing and liberation were possible. He became more committed to his meditation practice while living in New York City. The results he witnessed firsthand moved him to describe his experiences in writing.  

The penname yung pueblo means “young people” and is meant to convey that humanity is entering an era of remarkable growth and healing, when many will expand their self-awareness and release old burdens.  

Diego’s online presence as yung pueblo, as well as his books, are meant to serve those undertaking their own journey of personal transformation. 

Today, Diego resides in Western Massachusetts with his wife, where they live quietly and meditate daily. ",https://m.media-amazon.com/images/S/amzn-author-media-prod/ucmiv9au2943qumf6rkircq90q._SY600_.jpg
le petit créatif,,https://m.media-amazon.com/images/S/amzn-author-media-prod/jpbnslsjld2q0djt9hou1e1ird._SY600_.jpg
Jiddu Krishnamurti,"Amazon.fr
Ce modèle est livré par le fabricant sous forme d'un assortiment aléatoire de plusieurs modèles et/ou coloris. Il nous est donc impossible de vous proposer un modèle et/ou un coloris en particulier. En validant votre commande, vous recevrez donc un des modèles figurant sur l'image en fonction du stock disponible. Nous vous remercions pour votre compréhension.
Quatrième de couverture
Voici le traité de la seule révolution qui vaille : la libération intérieure. L'homme en cage, prisonnier des dogmatismes et des conformismes de pensée, est une ombre illusoire. De l'exigence spirituelle présente de façon plus ou moins confuse dans chaque être humain, jusqu'à cette authentique libération, nous sommes conviés ici à parcourir toutes les étapes : se connaître soi-même, surmonter la peur, découvrir peu à peu le silence et la plénitude. Réalisé à partir des conférences du grand philosophe indien, ce livre constitue une initiation accessible et brève à une philosophie dont la renommée et l'influence, au fil des générations, n'ont fait que grandir.
En lire plus",https://m.media-amazon.com/images/S/amzn-author-media-prod/clsgsjlge0r4nqkqou210irtgf._SY600_.jpg
Maitri Baraz,"Diplômée d'histoire de l'art en 2008 à l'École du Louvre à Paris, c'est depuis 2010 que Maitri se dédie à l'apprentissage théorique et pratique de la science du yoga, du Tantra et de la sagesse spirituelle des Vedas. Elle étudie les enseignements de Sanātana Dharma lors de ses longs séjours spirituels en Inde (Himalaya, Bénarès, Kerala). Depuis plusieurs années, Maitri est aspirante spirituelle de Mātā Amritānandamayī (Amma), (Amritapuri/Kerala) qui la nourrit avec les vibrations sacrées de toute sorte (bhajans, kirtans, chants védiques, mantras tantriques). Maitri a été formée auprès des maîtres indiens authentiques en tant que professeur du Yoga Intégral (YTT500/Himalaya/Ashram Anand Prakash) et en tant que yoga-thérapeute (YTT300/Kerala/Vasishta Yoga Research Foundation). Ensuite, en ressentant le pouvoir de la vibration, elle se dévoue tout particulièrement à l'apprentissage du Sanskrit et de la science du Mantra yoga auprès de Swami Sharadananda Sarasvatī, notamment lors de son année d'apprentissage résidentiel à l'université spirituelle Chinmaya Vishwa Vidyapeeth (Mission Chinmayananda/Kerala), à travers le programme "" Vedanta Sadhaka Course "". Depuis 2012, Maitri partage sa vie entre la France et l'Inde, en faisant le pont pour les yogis et yoginis qui souhaitent découvrir la tradition authentique, notamment celle du son sacré.",
Vianna Stibal,"Vianna Stibal est artiste, écrivaine, enseignante et ""lectrice psychique"". Créatrice de la méthode ThetaHealing, elle s'est engagée à répandre son paradigme de guérison dans le monde entier, et a formé des enseignants et des pratiquants dans plus de vingt-cinq pays.",https://m.media-amazon.com/images/I/01Kv-W2ysOL._SY600_.png
Christophe André,"Médecin psychiatre à l'hôpital Sainte Anne (Paris), Christophe André est l'auteur de nombreux best-sellers : L'estime de soi ; Vivre heureux ; Imparfaits, libres et heureux, (prix Psychologies Magazine 2006). Christophe AndréChristophe André est né à Montpellier d'un père marin et d'une mère institutrice. D'où, peut-être, son goût pour la pédagogie et la psychologie des profondeurs. Il lit très tôt l'oeuvre de Freud et décide de faire médecine pour devenir psychiatre. Il pratique pendant 15 ans psychiatrie et rugby à Toulouse. Après son mariage, il monte à Paris, remplace alors la pratique du rugby par celle de l'écriture, la visite des mêlées par celle des musées, et ne marque plus d'essais, mais en publie de nombreux. Il exerce à l'hôpital Sainte-Anne à Paris, au sein d'une Unité de Psychothérapie Comportementale et Cognitive, spécialisée dans le traitement des troubles émotionnels, anxieux et dépressifs. Beaucoup de ses ouvrages ont connu un très grand succès en France et à l'étranger, mais il considère cependant que ses véritables chefs d'oeuvre sont ses trois filles.",
Colette Poggi,"Colette Poggi, philosophe, indianiste et sanskritiste, enseigne la pensée indienne dans de nombreux centres universitaires et écoles de formation en yoga. Elle est spécialiste du Shivaïsme du Cachemire. Elle a notamment publié : Les Œuvres de vie selon Maître Eckhart et Abhinavagupta (réédition 2016) ; Le Sanskrit, souffle et lumière (réédition 2017) et L'Aventure de la calligraphie, geste, trait, résonance, 2014. Emilie Poggi est illustratrice et graphiste, inspirée notamment par l'univers de Moebius.",https://m.media-amazon.com/images/I/01Kv-W2ysOL._SY600_.png
Shamash Alidina,"Elisabeth Couzon est psychologue clinicienne et formatrice en développement personnel et pleine conscience. Elle relie les approches de communication, de psychothérapie et de psychologie bouddhiste avec la pleine conscience. Elle est notamment la co-auteure de Soyez un stressé heureux et de S'estimer pour réussir sa vie parus chez ESF.",https://m.media-amazon.com/images/S/amzn-author-media-prod/qjq92kki7at3epa0b5s9tl22k._SY600_.jpg
Marie Eve,,
Barry Long,"BARRY LONG was the most radical and pioneering spiritual teacher of the twentieth century, though his contribution to contemporary spirituality is often overlooked. He was the first to introduce to the western world a teaching of practical self-knowledge and immense wisdom without reference to eastern or occult traditions. 'Right Meditation - Five Steps to Reality' was written just before he died in 2003 and concluded his life's work.",https://m.media-amazon.com/images/S/amzn-author-media-prod/co3gpo65fb1tq0uu0m2nbn4k9d._SY600_.jpg
