Nom,Prix,Description,Isbn,Photo,Editeur,Auteur
Buck Danny Classic - Tome 11 - L'ombre rouge,15.5,"947. Buck Danny et ses amis, engagés sur un film d'Howard Hughes, voient débarquer la CIA sur le tournage. Car les nombreux incidents qui l'émaillent seraient provoqués par un maître-espion soviétique : l'Ombre rouge... À la poursuite de cet insaisissable ennemi, Buck va rapidement comprendre que la partie s'annonce compliquée. Très compliquée, même.

Après le cycle Dans les griffes du SMERSH, cet album est la première partie du nouveau diptyque de Buck Danny ? Classic !",978-2361183585,https://m.media-amazon.com/images/I/610ERGDsI0L._SY522_.jpg,ZEPHYR; Illustrated édition (19 avril 2024),Zumbiehl Frédéric
"Sherlock Holmes et Moriarty, associés - La BD dont vous êtes le héros",20.0,"Sherlock Holmes est engagé par le comte de Morcar pour l'escorter lors de son voyage en train. L'implacable logique du détective sera bientôt mise à rude épreuve : diamants volés, mort mystérieuse et enlèvement d'une princesse. Heureusement, il est accompagné par son fidèle acolyte, le docteur Watson. Mais son ennemi de toujours, Moriarty, est aussi du voyage...",978-2917371688,https://m.media-amazon.com/images/I/81AVPztG7GL._SY522_.jpg,Makaka; Illustrated édition (26 novembre 2014),Boutanox
"Sherlock Holmes et Moriarty, associés - La BD dont vous êtes le héros",20.0,"Sherlock Holmes est engagé par le comte de Morcar pour l'escorter lors de son voyage en train. L'implacable logique du détective sera bientôt mise à rude épreuve : diamants volés, mort mystérieuse et enlèvement d'une princesse. Heureusement, il est accompagné par son fidèle acolyte, le docteur Watson. Mais son ennemi de toujours, Moriarty, est aussi du voyage...",978-2917371688,https://m.media-amazon.com/images/I/81AVPztG7GL._SY522_.jpg,Makaka; Illustrated édition (26 novembre 2014),Boutanox
Tango - Tome 5 - Le dernier Condor,15.95,"Tango et Mario se sont installés en Argentine où ils coulent des jours paisibles. Mais cette fois c'est le passé de flic de Mario qui refait surface. Il est enlevé par d'anciens criminels de guerre résolus à se venger. Tango le sait, il n'a que quelques heures devant lui pour retrouver son ami...",978-2803676859,https://m.media-amazon.com/images/I/91jmxQVV+8L._SY522_.jpg,LOMBARD; Illustrated édition (30 octobre 2020),Matz
Tango - Tome 5 - Le dernier Condor,15.95,"Tango et Mario se sont installés en Argentine où ils coulent des jours paisibles. Mais cette fois c'est le passé de flic de Mario qui refait surface. Il est enlevé par d'anciens criminels de guerre résolus à se venger. Tango le sait, il n'a que quelques heures devant lui pour retrouver son ami...",978-2803676859,https://m.media-amazon.com/images/I/91jmxQVV+8L._SY522_.jpg,LOMBARD; Illustrated édition (30 octobre 2020),Matz
La Différence invisible,23.95,"Marguerite a 27 ans, en apparence rien ne la distingue des autres. Elle est jolie, vive et intelligente. Elle travaille dans une grande entreprise et vit en couple. Pourtant, elle est différente.Marguerite se sent décalée et lutte chaque jour pour préserver les apparences. Ses gestes sont immuables, proches de la manie. Son environnement doit être un cocon. Elle se sent agressée par le bruit et les bavardages incessants de ses collègues. Lassée de cet état, elle va partir à la rencontre d'elle-même et découvrir qu'elle est autiste Asperger. Sa vie va s'en trouver profondément modifiée.",978-2756072678,https://m.media-amazon.com/images/I/71VxB3sS1lL._SY522_.jpg,Delcourt; Illustrated édition (30 août 2016),Julie Dachez
Astérix - L'Iris blanc - n°40,10.9,"« Pour éclairer la forêt, la floraison d’un seul iris suffit »
L’Iris blanc est le nom d’une nouvelle école de pensée positive, venue de Rome qui commence à se propager dans les grandes villes, de Rome à Lutèce. César décide que cette méthode peut avoir un effet bénéfique sur les camps qui se trouvent autour du célèbre village gaulois. Mais les préceptes de cette école exercent aussi une influence sur les villageois qui croisent son chemin…",978-2014001334,https://m.media-amazon.com/images/I/81-9ynE8omL._SY522_.jpg,Hachette Asterix; Illustrated édition (26 octobre 2023),René Goscinny
Les Sisters - tome 03: C'est elle qu'a commencé,11.9,"Wendy et Marine sont envoyées en colonie. Loin de leurs parents, elles doivent se soutenir. Elles n'hésitent pas à en faire voir de toutes les couleurs à leurs moniteurs.",978-2350786568,https://m.media-amazon.com/images/I/710NBkro8RL._SY522_.jpg,Bamboo (6 mai 2009),Christophe Cazenove
Le voyage de Shuna,25.0,"Shuna, le prince d'une contrée pauvre, regarde impuissant ses sujets souffrir en permanence de la faim et se tuer à la tâche pour tenter de faire pousser des céréales que leur terre, stérile, leur refuse. Un beau jour, un voyageur lui parle d'une graine dorée miraculeuse qui fait onduler les plaines en vagues fertiles. Elle provient d'un pays, loin à l'Ouest, peuplé d'esprits et hostile à l'homme, dont nul n'est jamais revenu. En dépit des soupirs des anciens et des larmes de ses parents, Shuna empacte ses affaires et se lance, sur son fidèle yakuru, vers cet Eldorado dans l'espoir d'y trouver de quoi sauver son peuple. Sur le chemin, il libère une jeune esclave, Théa, et sa petite soeur, retenues prisonnières par des trafiquants d'hommes. Poursuivis par leurs ennemis, Shuna confie les deux filles à son yakuru qui les emmène vite vers le Nord, tandis qu'il continue, à pied, vers l'Ouest. Quand il atteint enfin la terre des êtres divins, ce qu'il y voit le changera à tout jamais. Théa reverra-t-elle un jour Shuna ? Ramènera-t-il chez lui la précieuse céréale ?",979-1040804444,https://m.media-amazon.com/images/I/81wq+C+P6XL._SY522_.jpg,SARBACANE; Illustrated édition (1 novembre 2023),Hayao Miyazaki
Tant pis pour l'amour. Ou comment j'ai survécu à un manipulateur,23.95,"Quand Sophie rencontre Marcus, elle tombe amoureuse en 48h. Elle qui était si cynique en amour, cette fois, elle y croit. Sauf qu'il se révèle vite étrange. Sophie a alors besoin de comprendre ce qui ne va pas. Confronté à ses mensonges et ses incohérences, il a des réactions violentes, des excuses pour tout et arrive à se sortir de chaque impasse. Mais jusqu'à quand ? Sophie aime un manipulateur narcissique.",978-2413019862,https://m.media-amazon.com/images/I/81xA5Im-+AL._SY522_.jpg,Delcourt; Illustrated édition (25 septembre 2019),Sophie Lambda
La Naissance en BD - Tome 3: Propagez vos super pouvoirs !,11.95,"Ce tome 3 de La Naissance en BD vous donne les clés pour amplifier les super pouvoirs des mères, les partager avec le bébé, et les propager à la famille entière.

Enfin, bébé arrive ! Après neuf mois d’attente et des heures de contractions, voici la phase d’expulsion. Un nouveau-né sera bientôt dans vos bras.
Ce passage ultime vous fait peur ? Pas de panique, c’est normal. Et ce livre est là, pour ne rien vous apprendre mais vous faire comprendre ce que votre corps sait déjà.
Ici, pas de «Poussez, Madame, poussez ! », parce qu’il ne faut pas pousser. Vous n’avez pas besoin qu’on vous parle à l’impératif, vous êtes puissante et souveraine. Bien informée, que vous ayez une péridurale ou pas, un petit bébé ou un gros, que vous soyez noire, blanche, jaune, dorée, rouge (parfois on est un peu rouge à la fin d’un accouchement, il faut l’avouer) ne change rien. Ce qui change tout, c’est la connaissance !",978-2845942882,https://m.media-amazon.com/images/I/71m20kUVDgL._SY522_.jpg,MAMA; 1er édition (2 novembre 2022),Lucile Gomez
Carlo Acutis: Un saint pour la jeunesse,15.9,"Carlo c'est un garçon d'apparence ordinaire né en Italie. Il aime le foot, les animaux, ses amis et c'est un mordu d'informatique... Mais il n'est pas tout à fait comme les autres : il est fasciné par les églises, par la Vierge Marie et son plus grand désir est de recevoir l'eucharistie ! Il est passionné de Dieu et met son talent à son service. Il monte des sites internet pour les paroisses, travaille deux ans durant à la plus grande exposition jamais réalisée sur les miracles eucharistiques qui sera montrée dans plus de 10 000 paroisses et fourmille d'idées missionnaires.
À 15 ans il est frappé par une leucémie foudroyante. Il ne se plaint de rien. « Le bonheur, c'est d'avoir le regard tourné vers Dieu. La tristesse, c'est d'avoir le regard tourné vers soi-même. » Il meurt le 12 octobre 2006. Sa popularité est instantanée surtout auprès des jeunes générations. Un miracle lui est attribué en 2018 et le pape François prononce sa béatification en 2020. Beaucoup de jeunes trouvent en lui une lumière dans le monde actuel.",978-2492547560,https://m.media-amazon.com/images/I/81XUIXOMnuL._SY522_.jpg,Plein Vent; Illustrated édition (19 octobre 2022),Fabrizio Russo
Durango la jeunesse T03: Captain Owens,12.0,"Texas 1882. Témoin de l'assassinat de trois cowboys, un jeune vagabond échappe lui-même de justesse au tueur, un professionnel armé d'une carabine équipée d'une lunette. Le jeune homme est engagé par le propriétaire du plus grand ranch de la région pour qui travaillaient les trois victimes mais ignore qu'en acceptant cet emploi, il deviendra témoin actif d'une sanglante guerre entre éleveurs.",978-2302099418,https://m.media-amazon.com/images/I/81Q2bGdNMXL._SY522_.jpg,Soleil (29 mai 2024),Roman Surzhenko
Tango - Tome 5 - Le dernier Condor,15.95,"Tango et Mario se sont installés en Argentine où ils coulent des jours paisibles. Mais cette fois c'est le passé de flic de Mario qui refait surface. Il est enlevé par d'anciens criminels de guerre résolus à se venger. Tango le sait, il n'a que quelques heures devant lui pour retrouver son ami...",978-2803676859,https://m.media-amazon.com/images/I/91jmxQVV+8L._SY522_.jpg,LOMBARD; Illustrated édition (30 octobre 2020),Matz
Tango - Tome 5 - Le dernier Condor,15.95,"Tango et Mario se sont installés en Argentine où ils coulent des jours paisibles. Mais cette fois c'est le passé de flic de Mario qui refait surface. Il est enlevé par d'anciens criminels de guerre résolus à se venger. Tango le sait, il n'a que quelques heures devant lui pour retrouver son ami...",978-2803676859,https://m.media-amazon.com/images/I/91jmxQVV+8L._SY522_.jpg,LOMBARD; Illustrated édition (30 octobre 2020),Matz
"BD Ajax, Tome 01: Chat va bien !",10.5,"« Moi, chat va drôlement bien. Et vous ?
Pendant qu'Adèle est occupée par ses expériences farfelues, on doit bien trouver un moyen de s'occuper, Fizz le hamster-grizzli et moi.
Et vous allez voir, tous les deux on vit des aventures au poil ! »

Vous pensez qu'une vie de chat fait rêver ?
Qu'elle est remplie de siestes près du radiateur, de panier douillet, de lait frais et de papouilles à longueur de journée ?
Détrompez-vous ! Quand vous vivez dans la même famille qu'une adorable petite pestouille, votre quotidien peut vite ressembler au jeu du chat et de la souris !
Sauf que la souris... c'est vous. COUREZ !


© Mr Tan et Diane Le Feyer d'après l'oeuvre créée par Mr Tan et Miss Prickly",979-1027601080,https://m.media-amazon.com/images/I/61PRFSSeHxL._SY522_.jpg,Bayard Jeunesse; Illustrated édition (22 mars 2017),Mr Tan
"Les Aventures de Tintin, Intégrale : coffert 8 volumes",16.23,"Ce coffret rassemble la totalité des 24 aventures du célèbre héros, depuis Tintin au pays des Soviets jusqu'à Tintin et l'Alph-Art. Ce coffret est l'occasion de redécouvrir et d'apprécier cette oeuvre totalement intemporelle.",978-2203198920,https://m.media-amazon.com/images/I/81hjG7u4wqL._SY522_.jpg,CASTERMAN (6 novembre 2019),Hergé
Astérix - Le Domaine des dieux n°17 - édition luxe - 65 ans Astérix,42.0,"A l'occasion des 65 ans d'Astérix, redécouvrez l'édition Luxe du Domaine des dieux avec une nouvelle couverture ! Cette édition regroupe les 44 planches originales en noir et blanc encrées par Albert Uderzo, accompagnées d’un dossier exclusif de 32 pages sur les coulisses de la création de l’album.
Indispensable pour tous les fans du personnage !

Jules César n’en démord pas : il faut mettre au pas les Irréductibles Gaulois ! Et puisque ces guerriers impénitents refusent d’adhérer à la civilisation romaine, elle s’imposera à eux, de gré ou de force.

C’est dans cette optique que l’architecte Anglaigus est chargé de bâtir autour du village gaulois une ville romaine nouvelle, « Le Domaine des dieux ». Isolant les Gaulois, elle ne leur laissera plus d’autre choix que s’intégrer ou disparaître. Pas sûr que les habitants de cette cité nouvelle apprécient le voisinage du « Village des fous »…",978-2014001389,https://m.media-amazon.com/images/I/81DW-nTAQOL._SY522_.jpg,Hachette Asterix; Edition spéciale (5 juin 2024),René Goscinny
"Je t’aime pour toujours, mon Petit Loup: Livre pour les enfants de 3 à 6 ans pour développer la confiance en soi et la complicité | Histoire du soir sur l’amour et la tendresse d’une famille",9.99,"Je t’aime pour toujours, mon Petit Loup

Vous cherchez un livre avec une histoire apaisante avant le coucher ? Une histoire remplie d’amour et de joie ? Un récit pour développer la confiance en soi ?
Alors le livre « Je t’aime pour toujours, mon Petit Loup » est fait pour vous !

Accompagnez Léo, un jeune loup attachant, dans sa charmante aventure au sein de la forêt. Vivez un récit émouvant et poétique, où l'affection et la chaleur familiale égayent chaque instant de sa vie, apportant sourires et bonheur. Plongez dans cette épopée pleine de tendresse et laissez-vous transporter par la féérie de l'amour familial qui rayonne à travers les pages.",979-8875533389,https://m.media-amazon.com/images/I/71e5a582YHL._SY522_.jpg,Independently published (9 janvier 2024),Cindy Nasca
Lightfall: L'Ombre de l'Oiseau (2),19.9,"À l'issue d'une bataille épique, l'Oiseau Kest, Destructeur du Soleil, s'est emparé de la dernière flamme. D'un jour à l'autre, les lumières menacent de disparaître de la surface d'Irpa... Cherchant désespérément une solution pour sauver la planète, la jeune Béa et son ami Galdurien, Cad, partent à la recherche de l'esprit des eaux, censé leur donner des réponses... Mais ce sont de nouvelles questions qui les attendent. Dans l'impasse, ils devront faire un choix : arrêter l'oiseau mythique ou découvrir la vérité. La quête lumineuse et fantastique continue... Un nouveau voyage à couper le souffle dans le monde magique d'Irpa !",978-2075156318,https://m.media-amazon.com/images/I/81p0tf8ZVZL._SY522_.jpg,GALLIMARD BD; Illustrated édition (17 août 2022),Tim Probert
"BD Ajax, Tome 02: Chat s'arrange pas !",10.5,"«  À la maison, chat s'arrange pas  ! Adèle a toujours de bonnes idées d'expériences, mais je finis souvent avec des bosses... et quand Adèle n'est pas là, elle me manque  ! Heureusement, Fizz et ma nouvelle amie Snow sont là pour me tenir compagnie  ! »  Lorsqu'il n'est pas en train de dormir, roupiller ou faire la sieste, Ajax n'a pas une vie facile  ! Lorsqu'Adèle, son horrible maîtresse adorée, n'est pas à la maison, il doit protéger son territoire au péril de sa vie  ! Mais, quand elle rentre, c'est sa vie qu'il doit protéger... SAUVE QUI PEUT  !

© Mr Tan et Diane Le Feyer d'après l'oeuvre créée par Mr Tan et Miss Prickly",979-1027604371,https://m.media-amazon.com/images/I/61QYPtMoN0L._SY522_.jpg,Bayard Jeunesse; Illustrated édition (18 avril 2018),Mr Tan
Oradour 1944 . L innocence assassinée: Linnocence assassinée,20.0,"10 juin 1944. Remontant vers le front de Normandie, la division SS Das Reich détruit Oradour-sur-Glane, un paisible bourg de la Haute-Vienne, et y assassine 643 civils innocents. Seule une poignée d'entre eux parvient à s'extirper du village encerclé par les nazis. Parmi ces survivants, le jeune Robert Hébras. Ce crime de guerre marque à jamais sa vie comme celle des autres victimes, leurs familles et leurs proches. 
Au fil des ans, M. Hébras s'y est mué en témoin de l'Histoire, en symbole de la lente réconciliation des peuples : ainsi, en 2013, sa rencontre avec les présidents allemands et français dans les ruines même marque la mémoire collective. L'ultime survivant du massacre aspire ainsi à ce que cette tragédie collective soit portée par bande dessinée afin de sensibiliser davantage encore à la récurrente menace de néfastes idéologies comme du révisionnisme. ",978-2931105245,https://m.media-amazon.com/images/I/71FhfBbsCqL._SY522_.jpg,ANSPACH (24 mai 2024),Bruno Marivain
XIII Trilogy : Jones - Tome 2 - Rouge Alcatraz,13.0,"Le lieutenant Jones poursuit sa formation de pilote à l'école de la Navy de Patuxent River, où elle continue à prouver son expertise des techniques de close-combat et plus encore du maniement de divers appareils volants. Si certains sont nés avec une cuillère en argent dans la bouche, c'est sûr qu'elle est née avec des petites ailes dorées dans le dos. Pendant ce temps-là, les deux dangereux activistes amérindiens Karkajou et Crow Dog, qui se sont emparés de l'îlot d'Alcatraz, défient le gouvernement américain afin d'obtenir l'application des nombreux traités signés et l'obtention de droits civiques. Après son évasion, Marcus, le frère aîné de Jones, a rejoint leurs rangs. Le président Dixon charge le général Ben Carrington de régler par tous les moyens la crise à Alcatraz : les Red Warriors retiennent une centaine d'otages, dont une douzaine de femmes et enfants. Le général a besoin d'un officier pour le seconder, et qui d'autre que Jones pourrait s'acquitter de cette tâche ? Les Red Warriors acceptent de recevoir la délégation du général Carrington. La maire de San Francisco et le président ont été bien clairs : tout doit être réglé sans bain de sang. C'est donc sans armes qu'ils accosteront à l'îlot... Mais si tout ceci n'était qu'un piège ? Et surtout, Marcus pardonnera-t-il à sa soeur de l'avoir dénoncé et envoyé au pénitencier, même si c'était pour lui sauver la vie ? Ce deuxième volet de la trilogie signée Yann et TaDuc qui paraît l'année où l'on fête les 40 ans de la série mère XIII, continue à explorer le passé et la jeunesse de Jones. Un passé qui réserve décidément bien des surprises...",978-2505124771,https://m.media-amazon.com/images/I/71Z+8xWUozL._SY522_.jpg,DARGAUD; Illustrated édition (7 juin 2024),Yann
Tango - Tome 5 - Le dernier Condor,15.95,"Tango et Mario se sont installés en Argentine où ils coulent des jours paisibles. Mais cette fois c'est le passé de flic de Mario qui refait surface. Il est enlevé par d'anciens criminels de guerre résolus à se venger. Tango le sait, il n'a que quelques heures devant lui pour retrouver son ami...",978-2803676859,https://m.media-amazon.com/images/I/91jmxQVV+8L._SY522_.jpg,LOMBARD; Illustrated édition (30 octobre 2020),Matz
Tango - Tome 5 - Le dernier Condor,15.95,"Tango et Mario se sont installés en Argentine où ils coulent des jours paisibles. Mais cette fois c'est le passé de flic de Mario qui refait surface. Il est enlevé par d'anciens criminels de guerre résolus à se venger. Tango le sait, il n'a que quelques heures devant lui pour retrouver son ami...",978-2803676859,https://m.media-amazon.com/images/I/91jmxQVV+8L._SY522_.jpg,LOMBARD; Illustrated édition (30 octobre 2020),Matz
