Nom,Prix,Description,Isbn,Photo,Editeur,Auteur
Le management dans le secteur associatif: Les effets des nouvelles pratiques sur les systèmes de valeurs des bénévoles,9.36,"Dans un contexte d'évolution des modalités de recrutement des bénévoles, le secteur associatif se dote de nouveaux outils de gestion. Ceux-ci conduisent à introduire la notion de « management du bénévolat ». Cet ouvrage interroge ce qui se cache sous ce terme et les effets des nouvelles pratiques sur les systèmes de valeurs des bénévoles. Il s'attache à comprendre en profondeur les représentations, les perceptions et les vécus des acteurs du monde des associations bénévoles à travers les discours de cinq bénévoles. Cette étude révèle également une évolution des modalités d'engagement et les enseignements issus de la crise sanitaire. En effet, cette dernière a conduit, en situation exceptionnelle, à initier des expérimentations innovantes à faire perdurer pour remobiliser les bénévoles. Les résultats font émerger des constats et des pistes d'action à explorer pour permettre au secteur associatif de s'adapter aux attentes des bénévoles.",978-2140282881,https://m.media-amazon.com/images/I/619vJ-ce42L._SY522_.jpg,Editions L'Harmattan (4 octobre 2022),Marie Marsal
Impact des microagressions et de la discrimination raciale sur la santé mentale des personnes racisées: L'exemple de femmes noires en France,7.68,"Un grand nombre d'études américaines traite des conséquences du racisme sur la santé physique et mentale des personnes. Les effets du racisme sur la santé globale sont bien connus aux Etats-Unis ; maladies cardiovasculaires, ulcères, anxiété, dépression, hypertension, etc. Cet ouvrage mène une recherche exploratoire sur l'impact des microagressions et de la discrimination raciale sur la santé mentale auprès de cinq femmes noires ayant grandi et habité en France. Il s'appuie sur le concept de trauma racial, et sur le syndrome d'invisibilité étudié chez les hommes afro-américains. Les résultats de cette recherche montrent une grande fréquence de microagressions racistes dans la vie quotidienne, ce qui suscite différentes émotions négatives et concourt à une fragilisation de l'estime de soi, le tout pouvant déboucher sur des troubles manifestes. C'est pourquoi, il est important de considérer les microagressions à caractère racial dans le suivi psychologique de personnes noires et racisées en général, et de développer une clinique adaptée aux problématiques engendrées par le racisme.",978-2343253053,https://m.media-amazon.com/images/I/71JPIbeSE+L._SY522_.jpg,Editions L'Harmattan (16 mai 2022),Yaotcha D'Almeida
Beyond the Craft,27.46,"Beyond the Craft has been one of Lewis Masonic's best-selling titles since it was first published in 1980. Since then author Keith Jackson has updated the book through five editions, most recently in 2005 but there is now scope for a major revision of this book to bring in all the newly founded orders that have not been included up to now and to reflect the expansion in membership of many of these orders in recent years. To accommodate this extra material the book will be produced in a slightly larger paperback format. This fully revised edition, fully illustrated in colour will be an indispensible guide to Masonic Orders practised in the UK, giving invaluable in-depth information about the history of each Order, as well as detailing the joing qualifications, hierarchy, important rituals, teachings, regalia and much more. The book is recognised as one of the most relevant books a Freemason can acquire and the updates will allow it to continue to keep its position as an indispensible guide for all those Freemasons wishing to explore other degrees within the Masonic structure",978-0853184058,https://m.media-amazon.com/images/I/71FM3CqoLVL._SY522_.jpg,Lewis Masonic Pub Ltd; 6e édition (18 décembre 2012),Keith B. Jackson
À la recherche de la décision: Études de cas en sciences sociales,9.63,"Médecins, DRH, juges, dirigeants d’entreprises, préfets (hommes et femmes) présentent souvent leur activité autour de la prise de décision. Une décision jugée solitaire, voire douloureuse, ce que confirment certains travaux en vogue inspirés par la psychologie. À partir d’études de cas, dans des organisations variées (hôpitaux, entreprises, administrations), le livre questionne cette conception dominante et propose une lecture nourrie des méthodes des sciences sociales. Les différentes contributions mettent l’accent sur le caractère collectif des décisions, l’importance de l’entourage et des instances où les décisions se prennent. Elles montrent aussi que le processus décisionnel est complexe et souvent insaisissable.",978-2757440926,https://m.media-amazon.com/images/I/91yQevdz+JL._SY522_.jpg,PU SEPTENTRION (7 mars 2024),Patrick Castel
COACHING Magazine n°22 - Coaching d'organisation (partie 1): Coaching d'organisation dans les environnements complexes et interculturels,19.76,"❇️ Après plus de 20 numéros de COACHING, nous sommes ravis de vous faire découvrir un pan essentiel du coaching et pourtant non abordé en profondeur jusque-là : je veux parler du coaching d’organisation.
Il a cette particularité de permettre à nos accompagnements d’impacter à (très) grande échelle le monde professionnel.

❇️ Dire que toutes les organisations sont confrontées à des enjeux de plus en plus exigeants, dans un environnement complexe et incertain est un doux euphémisme. Pour les entreprises internationales, s’ajoute l’aspect multiculturel qui en fait la richesse et complexifie dans le même temps la problématique.

❇️ C’est sous cet angle que nous aborderons la première partie du coaching d’organisation au sein de COACHING : la complexité et le multiculturel. Il y avait tant à dire qu’un deuxième numéro complétera cette thématique du coaching d’organisation avec des axes complémentaires.

❇️ Ce mois-ci, pour nous en parler, nous avons la chance et l’honneur d’avoir la contribution",979-8859426911,https://m.media-amazon.com/images/I/61rfcCJ9k9L._SY522_.jpg,Independently published (28 août 2023),Jérémy RENARD
COACHING Magazine n°23 - Coaching d'organisation: Partie 2 - coaching d'organisation,19.89,"Quand nous avons décidé d’aborder le coaching d’organisation, nous nous sommes très vite rendus compte qu’un seul numéro de COACHING ne suffirait pas tant cette branche du coaching ouvre de nombreuses pratiques pour les coachs et de possibilités pour les entreprises. Nous consacrons donc une deuxième partie ce mois-ci sans prétendre à l’exhaustivité pour autant. C’est avec deux nouveaux points de vue que nous adresserons le sujet dans le présent numéro : l’accompagnement du changement en mode projet et en situation de crise.

Il est intéressant de constater que tous les articles que vous lirez sont rédigés en partant de situations réelles, vécues par des coachs professionnels. Ces derniers nous livrant, de plus, des clés particulièrement concrètes que les coachs pourront exploiter dans leur accompagnement. Les Dirigeants, DRHs et managers pourront de leur côté mettre à profit ces apports pour leur organisation pour initier la démarche en interne, identifier et clarifier les éléments indispensables pour relever leurs défis.

C’est lors d’un événement organisé par le réseau TRESSER, auquel j’ai eu l’opportunité d’assister, que ces sujets ont été illustrés par Jean-Charles CASTELLANO, Pascal DAGO, et Astrid BENOIT-DELANOUE. Ce que nous partageons ici en substance et complétons par un article d’Anne-Géraldine LAVIELLE. Un grand merci à eux quatre pour leur contribution généreuse et un apport exceptionnel du fait d’une double expérience unique et qui se compte en décennies à chaque fois. Je suis donc convaincu que leurs enseignements vous seront précieux.",979-8862387131,https://m.media-amazon.com/images/I/61IcdZQjWFL._SY522_.jpg,Independently published (24 septembre 2023),Jérémy RENARD
