Nom,Prix,Description,Isbn,Photo,Editeur,Auteur
"HISTOIRE INSPIRANTE POUR ENFANT, Les Aventures d'Eli: confiance en soi, créativité, persévérance, encourage l'empathie, le courage, la curiosité et ... parent-enfant / 6-8 ans lecture seul.e",7.83,"""Offrez à votre enfant une aventure extraordinaire avec Les Aventures d'Eli !
Ce livre inspirant encourage la créativité, la persévérance et l'empathie, tout en montrant aux petits lecteurs que leurs talents peuvent changer le monde. Une histoire captivante qui éveillera la curiosité et les valeurs positives de votre enfant, faisant de chaque page une source d'inspiration pour grandir avec courage et générosité.""
Mathilda
Plongez votre enfant dans une histoire nourrissant l'imagination avec des leçons de vie précieuses.",979-8875703294,https://m.media-amazon.com/images/I/61JHn6kzA6L._SY522_.jpg,Independently published (10 janvier 2024),Mathilda PB
"HISTOIRE INSPIRANTE POUR ENFANT, Les Aventures d'Eli: confiance en soi, créativité, persévérance, encourage l'empathie, le courage, la curiosité et ... parent-enfant / 6-8 ans lecture seul.e",6.67,"""Offrez à votre enfant une aventure extraordinaire avec Les Aventures d'Eli !
Ce livre inspirant encourage la créativité, la persévérance et l'empathie, tout en montrant aux petits lecteurs que leurs talents peuvent changer le monde. Une histoire captivante qui éveillera la curiosité et les valeurs positives de votre enfant, faisant de chaque page une source d'inspiration pour grandir avec courage et générosité.""
Mathilda
Plongez votre enfant dans une histoire nourrissant l'imagination avec des leçons de vie précieuses.",979-8875703294,https://m.media-amazon.com/images/I/61JHn6kzA6L._SY522_.jpg,Independently published (10 janvier 2024),Mathilda PB
BD Mortelle Adèle - Tome 21 RécréACTION GÉNÉRALE !,11.5,"Mortelle Adèle revient dans le 21e tome de ses aventures, publié chez Mr Tan & Co !
""Au secours, mes parents sont d'un ennui... Pourtant, à une époque, ils faisaient autant de bêtises que moi, c'est mamie qui me l'a dit ! Je dois faire quelque chose pour les aider, et vite ! Une petite cure de mortellitude s'impose !""

Mortelle Adèle en est convaincue : grandir est la pire idée que les enfants puissent avoir ! Il n'y a qu'à regarder les adultes autour, ces derniers n'ont plus l'énergie de faire la moindre bêtise ! Ni une, ni deux, Mortelle Adèle décide d'offrir à tout son entourage une récréACTION générale !",978-2494678262,https://m.media-amazon.com/images/I/61wjgYrozaL._SY522_.jpg,Mr Tan & Co; Illustrated édition (23 mai 2024),Mr Tan
Solo Leveling T13,14.95,"Lorsque d'étranges portails sont apparus aux quatre coins du monde, l'humanité a dû trouver une parade pour ne pas finir massacrée par les griffes des monstres des monstres qui en sortent. Dans le même temps, certaines personnes ont développé des capacités permettant de les chasser. Ces combattants intrépides n'hésitent pas à foncer au coeur des donjons pour combattre les créatures qu'ils abritent.",978-2382882559,https://m.media-amazon.com/images/I/71xz1dp2rOL._SY522_.jpg,Kbooks; Illustrated édition (29 mai 2024),DUBU(REDICE STUDIO)
La route,7.14,"L'apocalypse a eu lieu. Le monde est dévasté, couvert de cendres et de cadavres. Parmi les survivants, un père et son fils errent sur une route, poussant un caddie rempli d'objets hétéroclites, censés les aider dans leur voyage. Sous la pluie, la neige et le froid, ils avancent vers les côtes du sud, la peur au ventre : des hordes de sauvages cannibales terrorisent ce qui reste de l'humanité. Survivront-ils à leur périple ? Après ""Le Rapport de Brodeck"", Manu Larcenet adapte de nouveau une oeuvre majeure de la littérature. Couronnée par le prix Pulitzer en 2007, ""La Route"" a connu un grand succès et a été adaptée au cinéma en 2009 avec Vigo Mortensen dans le rôle principal. Avec cet album, Manu Larcenet réussit une adaptation d'une originalité absolue et pourtant d'une totale fidélité. En posant son trait sous les mots du romancier, en illustrant les silences du récit, l'artiste s'est approprié l'univers sombre et fascinant du roman de Cormac McCarthy. D'un roman-culte il a fait un album d'une beauté saisissante, à la fois puissant et poignant. Incontestablement un des chefs-d'oeuvre de la bande dessinée moderne. Cormac McCarthy a signé plusieurs romans phares dont ""La Route"" mais aussi ""No Country for old men"", également adapté par les frères Coen au cinéma. Son oeuvre est essentiellement disponible aux éditions de L'Olivier (et Points), associées à Dargaud sur ce projet. L'écrivain est décédé le 13 juin 2023. Son roman, publié aux Éditions de l'Olivier et chez Points pour la version poche, a été vendu à près de 800 000 exemplaires.",978-2205208153,https://m.media-amazon.com/images/I/91WdXAUge1L._SY522_.jpg,DARGAUD; Illustrated édition (29 mars 2024),Larcenet Manu
"Le Monde sans fin, miracle énergétique et dérive climatique",11.55,"La rencontre entre un auteur majeur de la bande dessinée et un éminent spécialiste des questions énergétiques et de l’impact sur le climat a abouti à ce projet, comme une évidence, une nécessité de témoigner sur des sujets qui nous concernent tous. Intelligent, limpide, non dénué d’humour, cet ouvrage explique sous forme de chapitres les changements profonds que notre planète vit actuellement et quelles conséquences, déjà observées, ces changements parfois radicaux signifient. Jean-Marc Jancovici étaye sa vision remarquablement argumentée en plaçant la question de l’énergie et du changement climatique au coeur de sa réflexion tout en évoquant les enjeux économiques (la course à la croissance à tout prix est-elle un leurre ?), écologiques et sociétaux. Ce témoignage éclairé s’avère précieux, passionnant et invite à la réflexion sur des sujets parfois clivants, notamment celui de la transition énergétique. Christophe Blain se place dans le rôle du candide, à la façon de son livre ""En cuisine avec Alain Passard"" et de ""Quai d’Orsay"" signé avec l’expertise d’un coauteur : un pavé de 120 pages indispensable pour mieux comprendre notre monde, tout simplement !",978-2205088168,https://m.media-amazon.com/images/I/91ERPyvcONL._SY522_.jpg,DARGAUD; Illustrated édition (29 octobre 2021),Blain Christophe
"HISTOIRE INSPIRANTE POUR ENFANT, Les Aventures d'Eli: confiance en soi, créativité, persévérance, encourage l'empathie, le courage, la curiosité et ... parent-enfant / 6-8 ans lecture seul.e",5.02,"""Offrez à votre enfant une aventure extraordinaire avec Les Aventures d'Eli !
Ce livre inspirant encourage la créativité, la persévérance et l'empathie, tout en montrant aux petits lecteurs que leurs talents peuvent changer le monde. Une histoire captivante qui éveillera la curiosité et les valeurs positives de votre enfant, faisant de chaque page une source d'inspiration pour grandir avec courage et générosité.""
Mathilda
Plongez votre enfant dans une histoire nourrissant l'imagination avec des leçons de vie précieuses.",979-8875703294,https://m.media-amazon.com/images/I/61JHn6kzA6L._SY522_.jpg,Independently published (10 janvier 2024),Mathilda PB
Histoire de Jérusalem,13.87,"4 000 ans d'une histoire universelle pour la première fois racontés dans une BD exceptionnelle.
Il y a 4 000 ans, Jérusalem était une petite bourgade isolée, perchée sur une ligne de crête entre la Méditerranée et le désert. Aujourd'hui, c'est une agglomération de presque un million d'habitants, qui focalise les regards et attire les visiteurs du monde entier.
Entre-temps, les monothéismes y ont été inventés, les plus grands conquérants s'en sont emparé, les plus grands empires s'y sont affrontés. Tour à tour égyptienne, perse, juive, grecque, romaine, byzantine, arabe, croisée, mamelouke, ottomane, anglaise, jordanienne, israélienne et palestinienne, Jérusalem est au coeur des intérêts et des passions du monde. Berceau du judaïsme, du christianisme et de l'islam, elle est aujourd'hui une capitale spirituelle pour plus de la moitié de l'humanité.
En 10 chapitres, acteurs et témoins, célèbres ou anonymes, toutes celles et ceux qui ont arpenté Jérusalem au fi l des siècles racontent ce mille-feuille d'influences composites. Rien n'est inventé : scènes et dialogues proviennent de plus de 200 sources publiées et d'archives inédites, pour donner chair à ce récit choral.",979-1037507150,https://m.media-amazon.com/images/I/71e4IuxKLoL._SY522_.jpg,Les Arènes; Illustrated édition (27 octobre 2022),Vincent Lemire
La petite grande Chaventure d'Ajax,9.26,"Ajax est de retour dans sa première Petite Grande Chaventure !

Alors que toute la famille rentre de vacances, Ajax se perd en chemin !
Egaré dans la ville, le matou le plus mignon du monde voit alors ses pires craintes se réaliser : le voilà séparé de sa précieuse et adorée Mortelle Adèle ! Hors de question pour lui de laisser sa maîtresse privée de câlins et de ronronnements, il décide de tout mettre en oeuvre pour la retrouver !

Mais pour un chat qui n'a jamais quitté le salon douillet de sa maison, ce périple devient une aventure à part entière. L'occasion pour le petit félin de faire la connaissance d'un monde qui lui était jusque-là inconnu, et de se faire de",978-2494678224,https://m.media-amazon.com/images/I/6167QcEBRNL._SY522_.jpg,Mr Tan & Co; Illustrated édition (4 avril 2024),ChrisPop
BD Mortelle Adèle - Tome 20 J'apocalypse grave !,12.64,"La nouvelle aventure de Mortelle Adèle qui apocalypse grave !
""Oh là là, et dire que c'était sous vos yeux depuis tout ce temps et que vous n'avez rien vu...C'est un secret que j'ai décidé de partager avec
vous aujourd'hui ! Oui, maintenant, tout de suite ! Après vous n'aurez plus aucun doute : Moi, j'apocalypse grave !""

Mortelle Adèle, reine incontestée des bêtises, ne manque pas d'imagination quand il s'agit d'étendre les limites de l'impossible ! Et pourquoi s'accommoder d'une seule réalité, quand on peut être l'héroïne la plus mortelle de toutes les dimensions ?
Alors accrochez-vous et embarquez avec votre Bizarre préférée, c'est LE décollage que vous ne voudriez pas rater !",978-2494678095,https://m.media-amazon.com/images/I/71p3qjiIk4L._SY522_.jpg,Mr Tan & Co; Illustrated édition (5 octobre 2023),Mr Tan
Yoko Tsuno - Tome 31 - L'aigle des Highlands,14.4,"Il se passe de drôles de choses dans les vestiges de l'abbaye de Loch Castle : des moines fouillent les ruines à la recherche de traces d'une diablesse et de son animal satanique. Mais ces moines sont surpris par Emilia et viennent s'expliquer auprès de Yoko. Ils racontent que la diablesse en question, une adolescente aveugle qui voyait à travers les yeux d'un aigle mécanique, aurait disparu dans une spirale de lumière !

À l'aide de Monya et de son translateur, Yoko part pour le XIIIe siècle découvrir ce qui s'est réellement passé dans l'abbaye calcinée.

Roger Leloup a pris l'habitude d'alterner histoires dans l'espace et histoires « terrestres ». Que ce soit sur (ou sous) Terre ou dans l'espace, ses histoires sont toujours passionnantes et empreintes d'humanisme.",978-2808504942,https://m.media-amazon.com/images/I/81MhAi8enlL._SY522_.jpg,DUPUIS; Illustrated édition (17 mai 2024),Leloup
"HISTOIRE INSPIRANTE POUR ENFANT, Les Aventures d'Eli: confiance en soi, créativité, persévérance, encourage l'empathie, le courage, la curiosité et ... parent-enfant / 6-8 ans lecture seul.e",19.8,"""Offrez à votre enfant une aventure extraordinaire avec Les Aventures d'Eli !
Ce livre inspirant encourage la créativité, la persévérance et l'empathie, tout en montrant aux petits lecteurs que leurs talents peuvent changer le monde. Une histoire captivante qui éveillera la curiosité et les valeurs positives de votre enfant, faisant de chaque page une source d'inspiration pour grandir avec courage et générosité.""
Mathilda
Plongez votre enfant dans une histoire nourrissant l'imagination avec des leçons de vie précieuses.",979-8875703294,https://m.media-amazon.com/images/I/61JHn6kzA6L._SY522_.jpg,Independently published (10 janvier 2024),Mathilda PB
Mortelle Adèle et les Reliques du Chat-Lune - Les Grandes Aventures - Tome 04,14.24,"La nouvelle Grande Aventure de Mortelle Adèle !

Connais-tu le Chat-Lune ?
Cette divinité aux dons incroyables a la capacité de conférer de puissants pouvoirs aux félins qui se présentent à elle. Mais pour avoir cette chance, il faut d'abord réunir les trois légendaires reliques que
le Chat-Lune a cachées aux quatre coins du monde...

Et ça tombe bien ! Car Mortelle Adèle est prête à relever le défi, l'occasion rêvée de réussir à enfin transformer Ajax !

Alors qu'un étrange ennemi se lance lui aussi à la recherche des reliques, Mortelle Adèle, aidée par Charlie et Magnus, va devoir redoubler d'ingéniosité pour venir à bout des énigmes et des obstacles qui la séparent de l'apparition du Chat-Lune ! Alors accroche ta ceinture et lance-toi avec elle dans ce tour du monde périlleux et plein de rebondissements qui te conduira aux confins de la Bizarrerie !",978-2494678101,https://m.media-amazon.com/images/I/71UvoCI9jEL._SY522_.jpg,Mr Tan & Co; Illustrated édition (2 novembre 2023),Mr Tan
"BD Mortelle Adèle, Tome 14: Prout atomique",11.5,"«  Je ne sais pas pourquoi, mais les adultes ont l'air de penser que les bébés sont toujours mignons et innocents. C'est faux  ! Ce n'est pas parce qu'ils bavent partout et qu'ils ne savent pas tenir assis qu'il faut les sous-estimer  ! La preuve, moi, quand j'étais bébé, j'avais déjà des idées mortelles  !  » 
Comment Adèle est-elle devenue une adorable peste  ? Facile  : elle est née comme ça  ! Couches puantes, attaque de vomi, regards tueurs  : bébé Adèle ne laisse aucun répit à ses parents, ni à ses camarades de bac à sable. Qui a dit que les bébés étaient tous des anges  ?

© Mr Tan et Diane Le Feyer d'après l'oeuvre créée par Mr Tan et Miss Prickly",978-1027604365,https://m.media-amazon.com/images/I/71umoGL6TCL._SY522_.jpg,Bayard Jeunesse; Illustrated édition (23 mai 2018),Mr Tan
Ma soeur & mon beau-frère - Sellig & Co. - tome 01,13.63,"L'humoriste nous présente sa drôle de famille... pas si éloignée de la nôtre ! Sellig nous entraîne dans l'exploration de son quotidien (et du nôtre par la même occasion), riche en situations à la fois agaçantes et drôles. Accompagné de sa soeur, un Schwarzy en jupon, de son beau-frère Bernard, agent EDF complètement éteint, et de son neveu Jürgen, Sellig partage ses souvenirs de vacances, de déménagement, de réveillons, de sports d'hiver... Des aventures qui font, depuis trente ans, toute la saveur de la saga humoristique de Sellig.",978-2818999318,https://m.media-amazon.com/images/I/718YTo0uuNL._SY522_.jpg,Bamboo; Illustrated édition (29 mai 2024),Erroc
Solo Leveling T13 + Solo Leveling Roman T01,29.9,"Lorsque d'étranges portails sont apparus aux quatre coins du monde, l'humanité a dû trouver une parade pour ne pas finir massacrée par les griffes des monstres des monstres qui en sortent. Dans le même temps, certaines personnes ont développé des capacités permettant de les chasser. Ces combattants intrépides n'hésitent pas à foncer au coeur des donjons pour combattre les créatures qu'ils abritent.",978-2382882672,https://m.media-amazon.com/images/I/71kmSUwTHlL._SY522_.jpg,Kbooks; Illustrated édition (29 mai 2024),DUBU(REDICE STUDIO)
"HISTOIRE INSPIRANTE POUR ENFANT, Les Aventures d'Eli: confiance en soi, créativité, persévérance, encourage l'empathie, le courage, la curiosité et ... parent-enfant / 6-8 ans lecture seul.e",15.2,"""Offrez à votre enfant une aventure extraordinaire avec Les Aventures d'Eli !
Ce livre inspirant encourage la créativité, la persévérance et l'empathie, tout en montrant aux petits lecteurs que leurs talents peuvent changer le monde. Une histoire captivante qui éveillera la curiosité et les valeurs positives de votre enfant, faisant de chaque page une source d'inspiration pour grandir avec courage et générosité.""
Mathilda
Plongez votre enfant dans une histoire nourrissant l'imagination avec des leçons de vie précieuses.",979-8875703294,https://m.media-amazon.com/images/I/61JHn6kzA6L._SY522_.jpg,Independently published (10 janvier 2024),Mathilda PB
Invincible - Intégrale T12,29.95,Le récit final des aventures de Mark Grayson - alias Invincible - et d'Atom Eve s'étend d'un bout à l'autre de l'univers de la série. Chacune des histoires développées depuis plus de 15 ans mène à ce moment : la fin de toutes choses...,978-2413048695,https://m.media-amazon.com/images/I/81Ov93PXoNL._SY522_.jpg,Delcourt (29 mai 2024),Ryan Ottley
Solo Leveling T12,12.02,"Lorsque d'étranges portails sont apparus aux quatre coins du monde, l'humanité a dû trouver une parade pour ne pas finir massacrée par les griffes des monstres des monstres qui en sortent. Dans le même temps, certaines personnes ont développé des capacités permettant de les chasser. Ces combattants intrépides n'hésitent pas à foncer au coeur des donjons pour combattre les créatures qu'ils abritent.",978-2382882542,https://m.media-amazon.com/images/I/7160CtzNFVL._SY522_.jpg,Kbooks; Illustrated édition (10 janvier 2024),DUBU(REDICE STUDIO)
Le coffre aux bisous: Une aventure féérique au royaume des merveilles pour les enfants de 3 à 6 ans,14.84,"Louni le lutin câlin invite les petits explorateurs âgés de 3 à 6 ans à la recherche du coffre aux bisous. C'est une quête fascinante et interactive au cœur du royaume des merveilles. Dans cette histoire haute en couleurs, les jeunes lecteurs partiront à la rencontre de personnages attachants et uniques comme Lolo le crocodile le plus sympathique des marais, Timy le ouistiti espiègle et Jonathan l'éléphant aux démangeaisons incessantes.
Cette quête extraordinaire conduite par notre lutin au grand cœur mènera les enfants à relever des défis, à aider de nouveaux amis et à traverser des moments magiques et inoubliables.
Ce récit interactif et joyeux, plein de rires et de rebondissements, est une véritable invitation à l'imaginaire. Ce livre pour enfants est idéal pour développer la créativité, l'empathie et le sens du rire. Embarquez, petits et grands, dans cette aventure féerique et laissez-vous transporter jusqu'au pays des doux rêves et des tendres bisous !",979-8854389266,https://m.media-amazon.com/images/I/51voUk4vJ4L._SY522_.jpg,Independently published (31 juillet 2023),Thomas Boxus
Lightfall: Le Temps des Ténèbres (3),17.96,"Les lumières se sont éteintes sur Irpa. Alors que les rescapés de la bataille de Rinn entament une longue marche pour trouver refuge à Baihle, Béa et Cad font route vers la Citadelle des Savoirs, accompagnés du Cochon-Sorcier et de leur ami arsaï. Les menaces se multiplient au fil du voyage, qu'elles proviennent des ombres ou de cette boue hostile qu'on appelle la Fange. Mais la rencontre avec une alliée inattendue va lever le voile sur un secret immémorial... et apporter une nouvelle lueur d'espoir.",978-2075194549,https://m.media-amazon.com/images/I/71VqD4dmhfL._SY522_.jpg,GALLIMARD BD; Illustrated édition (24 avril 2024),Tim Probert
"HISTOIRE INSPIRANTE POUR ENFANT, Les Aventures d'Eli: confiance en soi, créativité, persévérance, encourage l'empathie, le courage, la curiosité et ... parent-enfant / 6-8 ans lecture seul.e",18.83,"""Offrez à votre enfant une aventure extraordinaire avec Les Aventures d'Eli !
Ce livre inspirant encourage la créativité, la persévérance et l'empathie, tout en montrant aux petits lecteurs que leurs talents peuvent changer le monde. Une histoire captivante qui éveillera la curiosité et les valeurs positives de votre enfant, faisant de chaque page une source d'inspiration pour grandir avec courage et générosité.""
Mathilda
Plongez votre enfant dans une histoire nourrissant l'imagination avec des leçons de vie précieuses.",979-8875703294,https://m.media-amazon.com/images/I/61JHn6kzA6L._SY522_.jpg,Independently published (10 janvier 2024),Mathilda PB
"Sherlock Holmes et Moriarty, associés - La BD dont vous êtes le héros",20.0,"Sherlock Holmes est engagé par le comte de Morcar pour l'escorter lors de son voyage en train. L'implacable logique du détective sera bientôt mise à rude épreuve : diamants volés, mort mystérieuse et enlèvement d'une princesse. Heureusement, il est accompagné par son fidèle acolyte, le docteur Watson. Mais son ennemi de toujours, Moriarty, est aussi du voyage...",978-2917371688,https://m.media-amazon.com/images/I/81AVPztG7GL._SY522_.jpg,Makaka; Illustrated édition (26 novembre 2014),Boutanox
"Sherlock Holmes et Moriarty, associés - La BD dont vous êtes le héros",20.0,"Sherlock Holmes est engagé par le comte de Morcar pour l'escorter lors de son voyage en train. L'implacable logique du détective sera bientôt mise à rude épreuve : diamants volés, mort mystérieuse et enlèvement d'une princesse. Heureusement, il est accompagné par son fidèle acolyte, le docteur Watson. Mais son ennemi de toujours, Moriarty, est aussi du voyage...",978-2917371688,https://m.media-amazon.com/images/I/81AVPztG7GL._SY522_.jpg,Makaka; Illustrated édition (26 novembre 2014),Boutanox
"BD Mortelle Adèle, Tome 13: Big bisous baveux",11.5,© Mr Tan et Diane Le Feyer d'après l'oeuvre créée par Mr Tan et Miss Prickly,978-1027603603,https://m.media-amazon.com/images/I/71Kp5fvbIIL._SY522_.jpg,Bayard Jeunesse; Illustrated édition (25 octobre 2017),Mr Tan
La Vie secrète des arbres en BD,7.45,"Peter Wohlleben est le forestier le plus célèbre du monde, auteur du best-seller La Vie secrète des arbres, traduit dans plus de quarante langues. Ce livre est son histoire.
Avec un formidable talent de conteur, il nous plonge dans l'intimité des arbres, jusqu'à leurs racines. Au fil des pages, il nous entraîne à la découverte de l'extraordinaire fonctionnement de la forêt : comment les arbres interagissent, communiquent, se déplacent et se défendent.
La Vie secrète des arbres nous donne accès à un monde merveilleux mais fragile.
Protéger les arbres, c'est protéger l'humanité tout entière.",979-1037507273,https://m.media-amazon.com/images/I/71pDiyLZTAL._SY522_.jpg,Les Arènes BD; Illustrated édition (28 septembre 2023),Peter Wohlleben
Solo Leveling T14,14.95,"Lorsque d'étranges portails sont apparus aux quatre coins du monde, l'humanité a dû trouver une parade pour ne pas finir massacrée par les griffes des monstres des monstres qui en sortent. Dans le même temps, certaines personnes ont développé des capacités permettant de les chasser. Ces combattants intrépides n'hésitent pas à foncer au coeur des donjons pour combattre les créatures qu'ils abritent.",978-2382882917,https://m.media-amazon.com/images/I/71JGcnah6TL._SY522_.jpg,Kbooks (21 août 2024),DUBU(REDICE STUDIO)
LES GUERRES DE LUCAS,17.42,"Scrupuleusement fidèle à la réalité historique, méticuleusement documenté, Les Guerres de Lucas met en scène l’invraisemblable épopée de George Lucas, enfant rebelle passé à côté de la mort, prodige du nouvel Hollywood et visionnaire indomptable.

Une exploration inédite des coulisses de Star Wars, de l’enfer du casting au tournage cauchemardesque, où querelles entre acteurs, histoire d’amour secrète et désastres en pagaille jalonnent le quotidien. Un bourbier gigantesque dont sortira pourtant une œuvre majeure qui changera à jamais le cinéma.

Les Guerres de Lucas est une plongée en apnée dans les affres de la création, intense et poignante, mais drôle malgré tout.",978-2493184993,https://m.media-amazon.com/images/I/61rBTv-QkZL._SY522_.jpg,Editions Deman; Illustrated édition (4 octobre 2023),Laurent Hopman
Les Cahiers d'Esther - Tome 9 Histoires de mes 18 ans,17.9,"Le dernier tome de la série culte !
Esther est en terminale, ça y est !
C'est l'année du bac (cette horreur), des choix d'orientation qu'on ne veut pas faire, de Parcoursup, cette bénédiction (rires), des illusions qui se brisent, de l'enfance qui s'évapore, et des Cahiers d'Esther qui s'arrêtent... Mais c'est aussi l'année des 18 ans, de la liberté de pouvoir enfin faire ce qu'on veut ! Tout ce qu'on veut ! Et peut-être aussi l'année de la fin du célibat éternel, qui sait ?

D'où venons, où allons-nous, et surtout ça sert à quoi la vie en vrai ? Y a-t-il seulement une réponse à cette question qu'en pensez-vous vous avez 4 heures MDR... Esther philosophe et a un peu le vertige au moment du grand envol, mais ça va bien se passer, hein, on y croit...",978-2370734952,https://m.media-amazon.com/images/I/61SwJEb82CL._SY522_.jpg,Allary (6 juin 2024),Riad Sattouf
