Nom,Prix,Description,Isbn,Photo,Editeur,Auteur
"L'Odyssée du Templier, tome 1",14.91,"Beauvais, 1294. Barthel, capitaine des gardes de l'Inquisition, a toujours procédé avec méthode et sang-froid aux arrestations des hérétiques ordonnées par son bienfaiteur, l'inquisiteur dominicain Robert de Konrad. Pourtant, alors qu'il est missionné pour punir le forgeron Jehan et sa famille, Barthel est en proie au doute. Pourquoi l'inquisiteur tient-il tant à mener ce cruel assaut contre une forge aussi réputée ? Lorsque la fuite inattendue du fils de Jehan provoque la colère de l'évêque, Barthel est alors sûr d'une chose : cette mission recèle des enjeux qui dépassent sa tâche initiale. Tiraillé entre une lourde dette envers l'inquisiteur et son envie de remettre en cause l'autorité, le capitaine est malgré tout déterminé à faire la lumière sur les secrets de Robert de Konrad. Montségur, 1294. Hugo, ancien templier condamné pour avoir aimé une princesse sarrasine, est alerté de la disparition de son neveu. Pour le sauver, le chevalier arpente les terres de Philippe le Bel. Du pays d'Oc à Beauvais, en passant par les Vosges, Hugo est confronté à un royaume corrompu par les manigances politiques des inquisiteurs, des hommes d'Église, du roi de France et de sa cour. Déchiré entre son désir de vengeance et son devoir familial, l'ex-templier devra faire un choix... Prendrez-vous le parti du roi de France ou des Templiers ? Philippe IV parviendra-t-il à s'approprier le fabuleux trésor du Temple ? Résurrection, le premier tome d'une épopée passionnante !",979-1040514664,https://m.media-amazon.com/images/I/81n9MprXuSL._SY522_.jpg,Librinova (22 mars 2023),Henri Strinati
"L'Odyssée du Templier, tome 1",17.23,"Beauvais, 1294. Barthel, capitaine des gardes de l'Inquisition, a toujours procédé avec méthode et sang-froid aux arrestations des hérétiques ordonnées par son bienfaiteur, l'inquisiteur dominicain Robert de Konrad. Pourtant, alors qu'il est missionné pour punir le forgeron Jehan et sa famille, Barthel est en proie au doute. Pourquoi l'inquisiteur tient-il tant à mener ce cruel assaut contre une forge aussi réputée ? Lorsque la fuite inattendue du fils de Jehan provoque la colère de l'évêque, Barthel est alors sûr d'une chose : cette mission recèle des enjeux qui dépassent sa tâche initiale. Tiraillé entre une lourde dette envers l'inquisiteur et son envie de remettre en cause l'autorité, le capitaine est malgré tout déterminé à faire la lumière sur les secrets de Robert de Konrad. Montségur, 1294. Hugo, ancien templier condamné pour avoir aimé une princesse sarrasine, est alerté de la disparition de son neveu. Pour le sauver, le chevalier arpente les terres de Philippe le Bel. Du pays d'Oc à Beauvais, en passant par les Vosges, Hugo est confronté à un royaume corrompu par les manigances politiques des inquisiteurs, des hommes d'Église, du roi de France et de sa cour. Déchiré entre son désir de vengeance et son devoir familial, l'ex-templier devra faire un choix... Prendrez-vous le parti du roi de France ou des Templiers ? Philippe IV parviendra-t-il à s'approprier le fabuleux trésor du Temple ? Résurrection, le premier tome d'une épopée passionnante !",979-1040514664,https://m.media-amazon.com/images/I/81n9MprXuSL._SY522_.jpg,Librinova (22 mars 2023),Henri Strinati
La sage-femme d'Auschwitz,9.59,"Lorsqu'elle arrive à Auschwitz, sous un ciel bas et gris, Ana est persuadée qu'elle ne survivra pas à l'enfer du camp. Mais elle possède une compétence que les nazis recherchent : elle est sage-femme. Son travail sera de donner naissance aux enfants des autres prisonnières. Une mission terrible car, dès qu'ils ont poussé leur premier cri, les nouveau-nés sont emmenés et donnés à des familles allemandes. Malgré la détresse de ces femmes à qui on vole leurs bébés, Ana essaie d'apporter un peu de réconfort autour d'elle. Et puis un jour, elle réalise qu'elle peut faire plus. Secrètement, elle tatoue les petits avec les numéros de déportées de leurs mères. C'est une lueur d'espoir dans ce monde d'une infinie noirceur : et si, après l'horreur de la guerre, grâce à ce petit geste, ces enfants et leurs mères pouvaient se retrouver ?",978-2290396391,https://m.media-amazon.com/images/I/71ubMzTUUfL._SY522_.jpg,J'AI LU (6 mars 2024),Anna Stuart
Le Barman du Ritz,21.9,""" Ce livre raconte la France occupée et c'est brillant."" Le Parisien
"" Dans ce premier roman, historique evidemment, P.Collin trouve le ton et mieux encore."" La Tribune du Dimanche
"" P.Collin nous embarque, avec un indeniable talent de conteur, dans le quotidien d'un théâtre de masques."" Le Figaro
Juin 1940. Les Allemands entrent dans Paris. Partout, le couvre-feu est de rigueur, sauf au grand hôtel Ritz. Avides de découvrir l'art de vivre à la française, les occupants y côtoient l'élite parisienne, tandis que derrière le bar oeuvre Frank Meier, le plus grand barman du monde.",978-2226479938,https://m.media-amazon.com/images/I/71mgi1nPtbL._SY522_.jpg,Albin Michel (24 avril 2024),Philippe Collin
"Albane, T2 - Au nom de la liberté",23.9,"Juin 1940. L’armistice a été signé, marquant le début de l’occupation allemande. Si l’avenir semble incertain, Albane est toute à la joie de retrouver Raphaël Wendling, qui lui a redonné goût à la vie et à l’amour.
Elle chérit d’autant plus ces moments qu’elle sait qu’ils ne dureront pas, Raphaël ayant décidé de rejoindre les Forces françaises libres dirigées par le général de Gaulle.
Mais les gens de Brantôme ne voient pas d’un bon œil l’idylle naissante de la jeune institutrice, veuve de guerre de surcroît, et les jeunes amants sont contraints de s’aimer en secret.
La vie reprend dans une France divisée par la ligne de démarcation. Brantôme étant en zone libre, la résistance s’organise en Dordogne. Grâce au laissez-passer auquel lui donne droit son statut de médecin, le docteur Géraud commence à faire passer clandestinement des familles juives en zone libre.
Débutent alors pour la courageuse jeune femme des mois marqués par un engagement sans faille, mais aussi par la peur constante de perdre ceux qu’elle aime.",978-2702182352,https://m.media-amazon.com/images/I/819zEH6P8rL._SY522_.jpg,Calmann-Lévy (5 juin 2024),Marie-Bernadette Dupuy
Le Code Rose (Grand Prix du Roman Historique 2023),11.42,"Des milliers de personnes ont fait leur choix ! Kate Quinn remporte le Grand Prix du Roman Historique 2023 avec Le Code rose.
«  Tour à tour bouleversant, fascinant et mystérieux, le dernier roman historique de Kate Quinn est un des best-sellers de 2021.  » Booklist
« Il y avait un traître à Bletchley Park, qui vendait des informations pendant la guerre. Vous me haïssez peut-être, mais vous avez toutes les deux prêté le même serment que moi : protéger la Grande-Bretagne. Faites-moi sortir de cet asile et aidez-moi à attraper le traître. Vous avez une dette envers moi. »
1940. Alors que l'Angleterre se prépare à combattre les nazis, trois femmes très différentes répondent à l'appel d'un mystérieux domaine, Bletchley Park, où les cerveaux les plus brillants de Grande-Bretagne sont formés à casser les codes de l'armée allemande. La pétulante et belle débutante, Osla  ; l'impérieuse et autodidacte Mab, et enfin, la vieille fille du village, Beth. Mais la guerre, le deuil et une sombre trahison sépareront les trois amies désormais ennemies... jusqu'à ce qu'elles soient de nouveau réunies, quelques années plus tard, par une mystérieuse lettre codée. Un traître émerge des ombres de leur passé, forçant les trois jeunes femmes à renouer leur vieille alliance pour casser un dernier code. Mais chaque pétale qu'elles effeuillent du Code Rose les rapproche du danger et de leur véritable ennemi...",978-2381225036,https://m.media-amazon.com/images/I/81OlzMicQLL._SY522_.jpg,Hauteville; Illustrated édition (4 octobre 2023),Kate Quinn
"L'Odyssée du Templier, tome 1",6.8,"Beauvais, 1294. Barthel, capitaine des gardes de l'Inquisition, a toujours procédé avec méthode et sang-froid aux arrestations des hérétiques ordonnées par son bienfaiteur, l'inquisiteur dominicain Robert de Konrad. Pourtant, alors qu'il est missionné pour punir le forgeron Jehan et sa famille, Barthel est en proie au doute. Pourquoi l'inquisiteur tient-il tant à mener ce cruel assaut contre une forge aussi réputée ? Lorsque la fuite inattendue du fils de Jehan provoque la colère de l'évêque, Barthel est alors sûr d'une chose : cette mission recèle des enjeux qui dépassent sa tâche initiale. Tiraillé entre une lourde dette envers l'inquisiteur et son envie de remettre en cause l'autorité, le capitaine est malgré tout déterminé à faire la lumière sur les secrets de Robert de Konrad. Montségur, 1294. Hugo, ancien templier condamné pour avoir aimé une princesse sarrasine, est alerté de la disparition de son neveu. Pour le sauver, le chevalier arpente les terres de Philippe le Bel. Du pays d'Oc à Beauvais, en passant par les Vosges, Hugo est confronté à un royaume corrompu par les manigances politiques des inquisiteurs, des hommes d'Église, du roi de France et de sa cour. Déchiré entre son désir de vengeance et son devoir familial, l'ex-templier devra faire un choix... Prendrez-vous le parti du roi de France ou des Templiers ? Philippe IV parviendra-t-il à s'approprier le fabuleux trésor du Temple ? Résurrection, le premier tome d'une épopée passionnante !",979-1040514664,https://m.media-amazon.com/images/I/81n9MprXuSL._SY522_.jpg,Librinova (22 mars 2023),Henri Strinati
Les adieux à la villa aux étoffes - Volume 6,10.1,"Augsbourg, 1939. La guerre est aux portes de l'Europe et les résidents de la villa aux étoffes savent que leur vie va radicalement changer... La conclusion tant attendue de la saga phénomène !
Augsbourg, 1939. Depuis l'arrivée de Hitler au pouvoir, Marie s'est exilée avec son fils à New York, et l'usine textile de Paul fait l'objet de convoitises nazies. Sans sa femme, qu'il soupçonne d'avoir refait sa vie aux États- Unis, Paul doit affronter seul ses inquiétudes et ses doutes, et prendre des décisions qui mettent en péril tout ce qu'ils ont bâti ensemble. De l'autre côté de l'Atlantique, Marie est effrayée par les récits d'horreur qu'elle découvre chaque jour dans les journaux. Quand elle rentre à Augsbourg en 1945, après avoir perdu contact avec ses proches pendant la guerre, elle ignore tout de ce qui l'attend. À l'image du conflit qui a dévasté son pays, les neuf années de séparation avec Paul ont laissé bien des traces. Alors que tout est à reconstruire dans une ville en ruines, parviendront-ils à se retrouver ?
Entre espoirs brisés et rêves de lendemains, le dénouement saisissant de destins emportés par le tourbillon de l'histoire.

Traduit de l'allemand par Corinna Gepner",978-2264083937,https://m.media-amazon.com/images/I/71l0uQm9qGL._SY522_.jpg,10 X 18 (2 mai 2024),Anne Jacobs
La sage-femme de Berlin,13.12,"Dans l'enfer d'Auschwitz, Ester caresse doucement les cheveux de Pippa, son bébé. C'est un miracle que sa petite fille soit blonde, car grâce à ce détail l'enfant pourra rester en vie. Bientôt, les nazis viendront prendre son bébé pour le donner à une famille allemande. Mais Ester veut croire qu'un jour, après la guerre, elle retrouvera sa Pippa... Secrètement, la jeune femme a tatoué son numéro de déportée sous l'aisselle de sa fille. Un geste qui lui donne de l'espoir et la volonté de survivre malgré l'horreur. Des années plus tard, Ester est enfin libre. Dans chaque orphelinat et hôpital qu'elle visite, elle scrute les visages des enfants. Mais les mois passent et l'espoir de revoir Pippa s'amenuise. Parviendra-t-elle un jour à retrouver l'enfant dont le tatouage correspond au sien ? Ou bien est-il déjà trop tard ?",978-2824623320,https://m.media-amazon.com/images/I/81AV-56xyXL._SY522_.jpg,City Edition (21 février 2024),Anna Stuart
L'enfant du train,10.12,"Au coeur de l'Occupation, à Paris, Sarah vient d'être arrêtée. Parce qu'elle est Juive. Juste avant de monter dans le train pour Auschwitz et les camps de la mort, la jeune femme prend une terrible décision : elle donne Samuel, son bébé, à un inconnu.. L'homme n'hésite pas une seconde et décide de tout faire pour sauver et prendre soin de cet enfant. Avec sa fiancée et le petit Samuel, ils fuient Paris pour les États-Unis, pays où l'on peut encore être libre et en sécurité. Ensemble, ils vont former une belle famille. Au fil du temps, ils oublient les traumatismes de la guerre. Jusqu'à ce que, neuf ans plus tard, une femme frappe à leur porte. Une femme qui a survécu à l'enfer par amour pour son fils. Mais ce retour va déclencher une tempête dont personne ne pourra sortir indemne...",978-2824620718,https://m.media-amazon.com/images/I/71pTCZAitWL._SY522_.jpg,City Edition (22 juin 2022),Ruth Druart
L'or maudit,20.9,"Au cœur de l'ancien pays cathare, un thriller médiéval palpitant et bouleversant
Mars 1313, vallée du Razès. Six ans déjà que les Templiers ont été arrêtés en masse par le roi de France Philippe le Bel. L'Ordre a été dissous sans que personne sache où a été dissimulée l'immense fortune du Temple. Mais des rumeurs circulent. Et si cet or maudit servait, dans l'ombre, à protéger les hérétiques ? Alors, quand l'enquête est confiée au grand inquisiteur de Carcassonne, Margaux de Dente frissonne d'angoisse.

La jeune châtelaine détient un lourd secret. Et la menace avance sur ses terres : une main coupée est retrouvée sur un monticule de pièces d'or ; un loup blanc rôde dans la nuit ; une femme mystérieuse rallume les feux au sommet des anciennes tours cathares.

Tandis que le roi, pour retrouver le trésor, dépêche dans la région le rusé Guillaume de Nogaret, une implacable machination se met en place autour de Margaux. Saura-t-elle protéger les siens et déjouer les pièges qui lui sont tendus ? Ici quiconque sort de la norme est suspecté de commerce avec le diable. On ne le revoit jamais...",978-2374486567,https://m.media-amazon.com/images/I/71jKOlZzeWL._SY522_.jpg,XO (23 mai 2024),Mireille Calmel
"L'Odyssée du Templier, tome 1",13.05,"Beauvais, 1294. Barthel, capitaine des gardes de l'Inquisition, a toujours procédé avec méthode et sang-froid aux arrestations des hérétiques ordonnées par son bienfaiteur, l'inquisiteur dominicain Robert de Konrad. Pourtant, alors qu'il est missionné pour punir le forgeron Jehan et sa famille, Barthel est en proie au doute. Pourquoi l'inquisiteur tient-il tant à mener ce cruel assaut contre une forge aussi réputée ? Lorsque la fuite inattendue du fils de Jehan provoque la colère de l'évêque, Barthel est alors sûr d'une chose : cette mission recèle des enjeux qui dépassent sa tâche initiale. Tiraillé entre une lourde dette envers l'inquisiteur et son envie de remettre en cause l'autorité, le capitaine est malgré tout déterminé à faire la lumière sur les secrets de Robert de Konrad. Montségur, 1294. Hugo, ancien templier condamné pour avoir aimé une princesse sarrasine, est alerté de la disparition de son neveu. Pour le sauver, le chevalier arpente les terres de Philippe le Bel. Du pays d'Oc à Beauvais, en passant par les Vosges, Hugo est confronté à un royaume corrompu par les manigances politiques des inquisiteurs, des hommes d'Église, du roi de France et de sa cour. Déchiré entre son désir de vengeance et son devoir familial, l'ex-templier devra faire un choix... Prendrez-vous le parti du roi de France ou des Templiers ? Philippe IV parviendra-t-il à s'approprier le fabuleux trésor du Temple ? Résurrection, le premier tome d'une épopée passionnante !",979-1040514664,https://m.media-amazon.com/images/I/81n9MprXuSL._SY522_.jpg,Librinova (22 mars 2023),Henri Strinati
Le Grand Soulèvement,19.34,"« Le Grand Soulèvement » est une bombe littéraire prévue pour réveiller les morts et faire vaciller le pouvoir. Il est question dans ce roman d’avortement de masse, de grand remplacement, de théories du complot et de contre-révolution. Sa lecture vous marquera au fer rouge. Il y aura un avant et un après.

Quatrième de couverture

Vidar sirotait le verre de rhum que le vieux loup de mer lui avait, comme à son habitude, servi à son insu. Les vapeurs de l'eau-de-vie lui montaient progressivement à la tête et réorganisaient avec bonheur le chantier de ses idées. Il fixa le plafond. Il riait intérieurement en pensant qu'au-dessus de son ravissant salon, il n'y avait qu'un tas de pierres qui faisait fuir les corbeaux. Au delà du crime atroce de l'avortement de masse, il considéra cet immonde et immense gâchis. Son esprit, bercé par les molécules câlines de l'alcool, se plut à imaginer ce qu'il ferait lui, s'il pouvait arracher tous ces petits êtres à leur funeste sort. Il réconcilierait Sparte et Athènes… des corps d’hoplite… des âmes de poète… tout à coup, Vidar se leva avec fracas. Sa chaise tomba à la renverse et son verre vide se brisa sur le sol. Il fit signe à Rocaboy de se mettre en route pour l'aéroport et partit sans un bagage pour New-York.",978-2959321603,https://m.media-amazon.com/images/I/511-7R78PkL._SY522_.jpg,Presses d'Ipogépolis (31 mars 2024),Romain Guérin
Le tatoueur d'Auschwitz,7.9,"L'histoire vraie d'un homme et d'une femme qui ont trouvé l'amour au coeur de l'enfer.Sous un ciel de plomb, des prisonniers défilent à l'entrée du camp d'Auschwitz. Bientôt, ils ne seront plus que des numéros tatoués sur le bras. C'est Lale, un déporté, qui est chargé de cette sinistre tâche. Il travaille le regard rivé au sol pour éviter de voir la douleur dans les yeux de ceux qu'il marque à jamais.Un jour, pourtant, il lève les yeux sur Gita, et la jeune femme devient sa lumière dans ce monde d'une noirceur infinie. Ils savent d'emblée qu'ils sont faits l'un pour l'autre. Dans cette prison où l'on se bat pour un morceau de pain et pour sauver sa vie, il n'y a pas de place pour l'amour.Ils doivent se contenter de minuscules moments de joie, qui leur font oublier le cauchemar du quotidien. Mais Lale fait une promesse à Gita : un jour, ils seront libres et heureux de vivre ensemble.",978-2290233795,https://m.media-amazon.com/images/I/61XK9sX-7WL._SY522_.jpg,J'ai lu (6 janvier 2021),Morris Heather
"L'Odyssée du Templier, tome 1",11.31,"Beauvais, 1294. Barthel, capitaine des gardes de l'Inquisition, a toujours procédé avec méthode et sang-froid aux arrestations des hérétiques ordonnées par son bienfaiteur, l'inquisiteur dominicain Robert de Konrad. Pourtant, alors qu'il est missionné pour punir le forgeron Jehan et sa famille, Barthel est en proie au doute. Pourquoi l'inquisiteur tient-il tant à mener ce cruel assaut contre une forge aussi réputée ? Lorsque la fuite inattendue du fils de Jehan provoque la colère de l'évêque, Barthel est alors sûr d'une chose : cette mission recèle des enjeux qui dépassent sa tâche initiale. Tiraillé entre une lourde dette envers l'inquisiteur et son envie de remettre en cause l'autorité, le capitaine est malgré tout déterminé à faire la lumière sur les secrets de Robert de Konrad. Montségur, 1294. Hugo, ancien templier condamné pour avoir aimé une princesse sarrasine, est alerté de la disparition de son neveu. Pour le sauver, le chevalier arpente les terres de Philippe le Bel. Du pays d'Oc à Beauvais, en passant par les Vosges, Hugo est confronté à un royaume corrompu par les manigances politiques des inquisiteurs, des hommes d'Église, du roi de France et de sa cour. Déchiré entre son désir de vengeance et son devoir familial, l'ex-templier devra faire un choix... Prendrez-vous le parti du roi de France ou des Templiers ? Philippe IV parviendra-t-il à s'approprier le fabuleux trésor du Temple ? Résurrection, le premier tome d'une épopée passionnante !",979-1040514664,https://m.media-amazon.com/images/I/81n9MprXuSL._SY522_.jpg,Librinova (22 mars 2023),Henri Strinati
La Tatoueuse de Jaipur (Grand prix du roman historique 2022),5.52,"Des milliers de personnes ont fait leur choix ! Alka Joshi remporte le Grand Prix du Roman Historique 2022 avec La Tatoueuse de Jaipur  !

« Mes motifs étaient plus élaborés, racontaient les histoires de celles que je servais. Plus le henné était sombre, plus une femme était aimée de son mari - c'était du moins ce qu'elles croyaient. Au fil du temps, mes habituées en étaient venues à croire que mes tatouages avaient certains pouvoirs. »
Fuyant un mariage abusif, Lakshmi, dix-sept ans, quitte son village rural des années 1950 pour se rendre dans la ville rose et animée de Jaïpur. Là, elle devient la tatoueuse au henné - et la confidente - la plus demandée des femmes de la haute société. Connue pour ses motifs originaux et ses conseils avisés, Lakshmi doit veiller à ne pas alimenter des rumeurs jalouses susceptibles de nuire à sa réputation. Alors qu'elle poursuit son rêve d'indépendance, elle est, un jour, stupéfaite de revoir son mari, qui a réussi à la retrouver. Il est accompagné d'une jeune fille fougueuse, une soeur dont Lakshmi ignorait l'existence. Soudain, sa vie tranquille en est bouleversée. Dans une société qui oscille sans cesse entre le traditionnel et le moderne, Lakshmi doit trouver sa place tout en poursuivant sa quête de liberté.",978-2381223360,https://m.media-amazon.com/images/I/81Kq+YpyPZL._SY522_.jpg,Hauteville (5 octobre 2022),Alka Joshi
La ronde des saisons: Tomes 1 & 2-Édition brochée,16.9,"Quatre jeunes femmes scellent un pacte pour s'aider mutuellement à trouver un mari... quel qu'en soit le prix. Fière et belle, Annabelle Peyton pourrait avoir le choix, si seulement elle avait une dot. Sa famille est au bord du désastre, et le seul moyen pour Annabelle de la sauver est d'épouser un homme riche. Malheureusement, son admirateur le plus tenace est l'effronté Simon Hunt, un entrepreneur séduisant et ambitieux qui veut faire d'elle sa maîtresse. Shocking ! Lillian Bowman, héritière américaine au caractère bien trempé, est venue en Angleterre pour trouver un mari aristocrate. Las ! aucun homme ne semble apprécier la volonté farouche de cette beauté obstinée. Sauf peut-être le puissant et arrogant comte de Westcliff, un homme que Lillian méprise plus que quiconque.",978-2290398159,https://m.media-amazon.com/images/I/61Z1vk1AvhL._SY522_.jpg,J'AI LU (7 février 2024),Lisa Kleypas
Le Secret de Margaux,13.33,"Mars 1313

Six ans après le drame qui prive Margaux de Dente de Lucia, l’une de ses jumelles, de sombres événements s’abattent sur le Haut Razès.
Les attaques répétées d’un mystérieux loup blanc, l’arrestation de quatre anciens templiers et l’arrivée d’un groupe d’inquisiteurs déterminés à retrouver l’or caché du Temple, menacent le secret de Margaux.
Une fois de plus, la jeune femme va devoir défier sa peur et son courage pour protéger les siens.

Bien que pouvant se lire de manière indépendante, cette histoire sert de lien entre LE TEMPLIER DE L’OMBRE et L’OR MAUDIT, les deux séries best-seller de Mireille CALMEL.",979-8884875456,https://m.media-amazon.com/images/I/61xNYxcb0aL._SY522_.jpg,Independently published (30 mars 2024),Mireille Calmel
"L'Odyssée du Templier, tome 1",6.56,"Beauvais, 1294. Barthel, capitaine des gardes de l'Inquisition, a toujours procédé avec méthode et sang-froid aux arrestations des hérétiques ordonnées par son bienfaiteur, l'inquisiteur dominicain Robert de Konrad. Pourtant, alors qu'il est missionné pour punir le forgeron Jehan et sa famille, Barthel est en proie au doute. Pourquoi l'inquisiteur tient-il tant à mener ce cruel assaut contre une forge aussi réputée ? Lorsque la fuite inattendue du fils de Jehan provoque la colère de l'évêque, Barthel est alors sûr d'une chose : cette mission recèle des enjeux qui dépassent sa tâche initiale. Tiraillé entre une lourde dette envers l'inquisiteur et son envie de remettre en cause l'autorité, le capitaine est malgré tout déterminé à faire la lumière sur les secrets de Robert de Konrad. Montségur, 1294. Hugo, ancien templier condamné pour avoir aimé une princesse sarrasine, est alerté de la disparition de son neveu. Pour le sauver, le chevalier arpente les terres de Philippe le Bel. Du pays d'Oc à Beauvais, en passant par les Vosges, Hugo est confronté à un royaume corrompu par les manigances politiques des inquisiteurs, des hommes d'Église, du roi de France et de sa cour. Déchiré entre son désir de vengeance et son devoir familial, l'ex-templier devra faire un choix... Prendrez-vous le parti du roi de France ou des Templiers ? Philippe IV parviendra-t-il à s'approprier le fabuleux trésor du Temple ? Résurrection, le premier tome d'une épopée passionnante !",979-1040514664,https://m.media-amazon.com/images/I/81n9MprXuSL._SY522_.jpg,Librinova (22 mars 2023),Henri Strinati
