Nom,Prix,Description,Isbn,Photo,Editeur,Auteur
Spinoza - L'homme qui a tué Dieu,22.5,"Comment Spinoza a inventé le monde moderne.
Amsterdam, 1640.
Un homme est excommunié de la communauté juive portugaise à Amsterdam pour avoir remis en question les Écritures. Le jeune Benoît de Espinosa assiste à la scène et l'épisode fait germer en lui un doute.
Et si ce que raconte la Bible était faux ?
Le soupçon va lancer Bento dans la plus grande quête intellectuelle qui soit. Qui a vraiment écrit les textes sacrés ? Quelle est la vérité sur Dieu ? Qu'est-ce que la nature ?
Toutes ces questions sont interdites et le jeune Spinoza va bientôt en payer le prix. Rabbins et prédicateurs chrétiens commencent à le persécuter et l'accusent d'hérésie.
Inspiré par la vie prodigieuse du plus grand philosophe portugais de tous les temps, J.R. dos Santos nous raconte comment Spinoza a mis fin à l'âge des ténèbres et inventé le monde moderne. Comment il est devenu "" L'homme qui a tué Dieu "".",978-2357207141,https://m.media-amazon.com/images/I/615HpDlzMtL._SY522_.jpg,Hervé Chopin Éditions (19 octobre 2023),José Rodrigues Dos Santos
Tempête sur la villa aux étoffes - 5,10.1,"Au cœur des heures les plus sombres de l'histoire allemande, raison et passion se heurtent à l'impitoyable réalité dans ce nouveau tome captivant du Downton Abbey allemand.
Augsbourg, 1935.
Le bonheur semble enfin de retour à la villa aux étoffes : l'usine textile des Melzer a surmonté la crise économique et les enfants de Marie et Paul quittent peu à peu le nid. Mais l'idéologie nazie qui se propage dans le pays vient mettre en péril le fragile équilibre que la famille Melzer a mis tant de temps à trouver.

Quand des rumeurs sur son origine juive se répandent en ville, Marie est contrainte de céder son prospère atelier de couture. Quant à Paul, il n'arrive plus à dormir sous la pression constante de ses amis qui lui conseillent de divorcer d'urgence. Pour protéger ses proches, Marie doit prendre une décision douloureuse, mais nécessaire, qui bouleversera la vie de tous pour toujours...",978-2264082053,https://m.media-amazon.com/images/I/71XZd9TQUVL._SY522_.jpg,10 X 18 (25 mai 2023),Anne Jacobs
"Berceuse d'Auschwitz: La véritable histoire d'Helen Hannemann, une mère qui s'est battue pour sa famille.",13.7,"Plus de trois cent mille lecteurs pour ce roman traduit en treize langues.

L’histoire d’Hélène Hannemann qui, grâce à son héroïsme, a rendu sa dignité à tout son village.

Ce roman est inspiré de la véritable histoire d’une courageuse infirmière allemande chargée de prendre soin des prisonniers les plus jeunes d’Auschwitz. Berceuse d’Auschwitz rend hommage à Hélène Hannemann, une femme qui a tout sacrifié pour sa famille et farouchement lutté pour les enfants qu’elle espérait sauver.
Par une matinée ordinaire de 1943, Hélène Hannemann prépare ses cinq enfants pour le jour où la police allemande débarquera chez elle. Les pires craintes d’Hélène se concrétisent lorsque la police, sous les ordres implacables des SS, exige que ses enfants et son mari, tous d’origine roumaine, soient interpellés. Bien qu’Hélène soit Allemande et, par conséquent, protégée des forces de l’ordre qui envahissent son foyer, elle refuse d’abandonner sa famille, scellant ainsi son destin d’une façon qu’elle n’aurait jamais pu imaginer.
Après un épouvantable voyage à travers le continent, Hélène et sa famille arrivent à Auschwitz et se trouvent plongés au cœur du chaos du camp. Son époux, Johann, est séparé de sa famille mais Hélène continue à protéger bec et ongles ses enfants et tous ceux qui l’entourent. Lorsque les dirigeants du camp découvrent qu’Hélène n’est pas seulement Allemande mais également infirmière diplômée, ils la contraignent à travailler dans l'hôpital du camp, sous la direction du Docteur Mengele en personne.
Hélène ne se berce pas d’illusions quant aux intentions du Docteur Mengele, mais elle accepte de coopérer lorsqu’il lui demande d’organiser une garderie et une école pour les enfants roumains du camp. Brutalisée physiquement et émotionnellement par la situation à Auschwitz, Hélène parvient à rassembler ses forces pour protéger coûte que coûte les enfants dont elle a la garde. Grâce à sa seule volonté, Hélène offre un refuge aux enfants d’Auschwitz, un acte de bonté et d’altruisme si grand qu’il illumine à lui seul la nuit la plus sombre de l'histoire de l'Humanité.
Basé sur des faits réels, Berceuse d’Auschwitz de Mario Escobar apporte la preuve du pouvoir du sacrifice et de la force de la dignité humaine, même lorsque tout espoir semble perdu.
Eloges :
« Berceuse d’Auschwitz m’a saisi au cœur et m’a captivé. Un roman de choix pour les amateurs de fiction historique » - Irma Joubert, auteur de La fille du train",979-8854723817,https://m.media-amazon.com/images/I/61eaG-AOKIL._SY522_.jpg,Independently published (2 août 2023),Mario Escobar
"Shogun, tome 1",24.0,"TOME 1
Dirigé par le capitaine John Blackthorne, l’Érasme s’est perdu en mer à la recherche des côtés japonaises. Son équipage est épuisé, malade, et le scorbut commence à se propager dans ses rangs. Après s’être échoués, ils sont faits prisonniers par des samouraïs locaux. Bien vite, Blackthorne va devoir se familiariser avec des mœurs et des visions très différentes des siennes. Il ne tarde pas à croiser la route du puissant Toranaga, un daimyô dont la soif de pouvoir risque d’aboutir à une guerre civile. Ainsi que celle de Mariko, une samouraï aux compétences inestimables, mais aux liens familiaux déshonorants.
Dans cette saga historique, James Clavell nous plonge au cœur de la culture nippone du xviie siècle, qu’il retranscrit avec brio. Regorgeant de détails historiques, son roman devient dès sa parution en 1975 un best-seller international. Véritable",978-2901207252,https://m.media-amazon.com/images/I/81UoUXkKayL._SY522_.jpg,CALLIDOR (1 mars 2024),James Clavell
Un enfant sans ombre,18.38,"Shaul Harel, alias Charlie Hilsberg, a perdu son ombre à l’âge de cinq ans, à la fin de 1942, lorsqu'il est séparé de sa famille, de son entourage et de sa langue maternelle.

Grâce au courage de la résistance belge, il échappe aux fours crématoires car aucun enfant de moins de treize ans envoyé à Auschwitz à partir du camp de concentration de Malines en Belgique n’en est revenu. Le petit Charlie passe de cachette en cachette, solitaire, sans pouvoir révéler sa véritable identité. Il apprend à se taire, à pleurer sans larmes et surtout à survivre. À la fin de la guerre, il se retrouve sans parents, sans son frère et sa sœur, et doit continuer à lutter pour sa survie.

Ce livre décrit son parcours dans les orphelinats de Belgique, son émigration en Israël, son séjour dans les maisons d’enfants de l’Aliyat Hanoar, son service militaire -au cours duquel il est grièvement blessé- et comment il a su se créer une nouvelle ombre et une nouvelle vie. En reconnaissance à celles et ceux qui lui ont sauvé la vie, il entreprend de consacrer la sienne à soigner les enfants. Il étudie la médecine à l’Université Hébraïque de Jérusalem et aux États-Unis, puis s’adonne à la création et à la consolidation d’une nouvelle discipline en Israël: la neuropédiatrie et le développement de l’enfant.

Le parcours de Shaul Harel est une saga belgo-israélienne recouvrant la période de la Shoah et celle des premières années de l’existence de l’État d’Israël. C'est l’histoire d'un enfant qui a su surmonter un traumatisme grave et réaliser, contre toute attente, une carrière professionnelle et personnelle hors du commun.

C’est un message universel de survie, d’optimisme et d’espoir.",979-8547546846,https://m.media-amazon.com/images/I/71Z1h-GFbWL._SY522_.jpg,Independently published (1 août 2021),Prof. Shaul Harel
La pouponnière d'Himmler,21.5,"Heim Hochland, en Bavière, 1944. Dans la première maternité nazie, les rumeurs de la guerre arrivent à peine ; tout est fait pour offrir aux nouveau-nés de l'ordre SS et à leurs mères ""de sang pur"" un cadre harmonieux. La jeune Renée, une Française abandonnée des siens après s'être éprise d'un soldat allemand, trouve là un refuge dans l'attente d'une naissance non désirée. Helga, infirmière modèle chargée de veiller sur les femmes enceintes et les nourrissons, voit défiler des pensionnaires aux destins parfois tragiques et des enfants évincés lorsqu'ils ne correspondent pas aux critères exigés : face à cette cruauté, ses certitudes quelquefois vacillent. Alors que les Alliés se rapprochent, l'organisation bien réglée des foyers Lebensborn se détraque, et l'abri devient piège. Que deviendront-ils lorsque les soldats américains arriveront jusqu'à eux ? Et quel choix leur restera-t-il ? Reconstituant dans sa réalité historique ce gynécée inquiétant, ce roman propose une immersion dans un des Lebensborn patronnés par Himmler, visant à développer la race aryenne et à fabriquer les futurs seigneurs de guerre. Une plongée saisissante dans l'Allemagne nazie envisagée du point de vue des femmes.",978-2073035455,https://m.media-amazon.com/images/I/81j+G11bLNL._SY522_.jpg,GALLIMARD (7 mars 2024),Caroline De Mulder
"Shogun, tome 2",25.0,,978-2901207269,https://m.media-amazon.com/images/I/71LrRDsx9XL._SY522_.jpg,CALLIDOR (19 avril 2024),James Clavell
Retour à la villa aux étoffes (4),10.1,"Un manoir et une famille puissante dans la tourmente de la Grande Dépression : pourront-ils faire face ?
Un vent de bonheur souffle sur la villa aux étoffes : le troisième enfant de Marie et Paul Melzer vient de fêter ses quatre ans et le couple file le parfait amour. Mais la crise économique qui se répand en Europe met bientôt en péril l'usine textile familiale. Croulant sous des dettes qu'il ne peut rembourser, Paul est confronté à un choix déchirant : afin de préserver le sort de la famille, mais aussi des ouvriers et des domestiques, doit-il se résoudre à vendre la demeure qui abrite les joies et les peines des Melzer depuis tant de générations ?
Au coeur du tumulte des années 1930, passions individuelles et questions sociales se mêlent dans un nouveau tome haletant de cette fascinante saga digne de Downton Abbey.

Traduit de l'allemand par Corina Gepner.",978-2264080646,https://m.media-amazon.com/images/I/71ICI+KL4uL._SY522_.jpg,10 X 18 (1 septembre 2022),Anne Jacobs
Les Filles de la villa aux étoffes (2),10.1,"Augsbourg, hiver 1916. La villa aux étoffes est devenu un hôpital militaire et la Première Guerre mondiale s'apprête à bouleverser les vies de la famille Melzer...
Augsbourg, hiver 1916.
Trois ans se sont écoulés depuis le jour où Marie a frappé pour la première fois à la porte des Melzer. Seulement trois ans... et pourtant tout a changé. Si la jeune femme est à présent l'épouse de Paul et la maîtresse des lieux, l'heure n'est plus à la fête dans la somptueuse demeure transformée en hôpital militaire. Les hommes ont rejoint le front, femmes et domestiques oeuvrent jour et nuit aux côtés des blessés et Marie se consacre à la gestion de l'usine familiale, dont elle découvre avec stupeur la situation critique.
Alors que s'éloigne un peu plus chaque jour l'espoir de voir Paul revenir rapidement de cette guerre terrible et que le destin de toute la famille repose sur ses seules épaules, Marie se sent vaciller. Qu'est-ce qui la retient alors d'accepter l'aide du séduisant Ernst von Klippstein, qui n'a jamais dissimulé l'intérêt qu'il lui porte ?

Au coeur des tumultes de l'Histoire, une saga familiale au souffle romanesque puissant, digne de Downton Abbey.

"" Un roman historique qui saisit magnifiquement l'esprit de ce début de XXe siècle. ""
Fränkische Nachrichten",978-2264078148,https://m.media-amazon.com/images/I/61W0bkARBwS._SY522_.jpg,10 X 18 (4 novembre 2021),Anne Jacobs
L'Héritage de la villa aux étoffes (3),10.1,"Un manoir, une famille puissante, un après-guerre difficile...
Augsbourg, 1920.
La guerre est finie et, après les difficultés et les privations, le bonheur a refait son apparition à la villa aux étoffes. Rentré de captivité, Paul Melzer a repris la tête de l'usine familiale. Avec l'aide de son associé Ernst von Klippstein, il la remet à flot et l'engage sur la voie de la modernité. Marie, de son côté, peut enfin se consacrer à sa véritable vocation et ouvrir un petit atelier de haute couture. Il ne faut pas longtemps pour que ses merveilleuses créations connaissent un grand succès. Mais alors que son activité se développe, son mariage avec Paul commence à battre de l'aile. Après une ultime dispute, Marie quitte la villa avec leurs deux enfants. Le destin est en marche...
Entre secrets de famille et non-dits, une saga captivante où petite et grande histoire se mêlent, digne de Downton Abbey.

"" Une formidable saga familiale. """,978-2264079084,https://m.media-amazon.com/images/I/71-C7fOXhxL._SY522_.jpg,10 X 18 (3 février 2022),Anne Jacobs
Le Manoir aux roses,9.5,"Dans les quartiers les plus huppés de Londres, chaque maison a son secret.
Londres, 1895. Dame de compagnie d'Abigail Finch ! Pour Mabs Daley, habituée à trimer chaque jour aux canaux où elle décharge les barges pour nourrir ses frères et sœurs, un emploi de domestique dans le quartier huppé de Hampstead est une opportunité de rêve.
Mais derrière les lourdes portes de la somptueuse demeure, la jeune femme découvre un univers inquiétant, dominé par les accès de colère de sa nouvelle patronne, atteinte d'une obscure maladie, et les rumeurs du scandale qui aurait forcé les Finch à quitter Durham précipitamment. Peu à peu, elle se prend pourtant d'affection pour la cadette de la maisonnée et se lie d'amitié avec une jeune bourgeoise du voisinage éprise de liberté. Jusqu'au jour où elle devra choisir entre conserver la sécurité offerte par sa nouvelle condition et tenter de sauver la famille Finch des secrets qui la rongent de l'intérieur...",978-2266329125,https://m.media-amazon.com/images/I/71nYKoA4qXL._SY522_.jpg,Pocket (13 avril 2023),Tracy Rees
Les soeurs d'Auschwitz,8.8,"""Je veux que vous me promettiez et que vous promettiez chacune à vos deux soeurs de toujours veiller les unes sur les autres. Que vous ne laisserez rien vous séparer. Compris ?"" Slovaquie, 1942. Les années ont passé depuis que Livia, Cibi et Magda Meller ont fait ce serment à leur père. Car dans une Europe désormais à feu et à sang, chaque jour est un sursis pour les trois adolescentes juives. Pourtant, quand Livia est arrêtée par les nazis, Cibi tient sa promesse et suit sa soeur dans l'enfer d'Auschwitz, où elles seront bientôt rejointes par Magda. Confrontées à l'horreur et à la cruauté du camp, les trois soeurs vont formuler un nouveau voeu. Celui de survivre. Ensemble. Après son best-seller Le tatoueur d'Auschwitz, Heather Morris nous livre un nouveau roman bouleversant tiré de témoignages exceptionnels.",978-2290377963,https://m.media-amazon.com/images/I/61IsXNuS3yL._SY522_.jpg,J'AI LU (4 janvier 2023),Heather Morris
Les Piliers de la Terre,12.9,"Dans l’Angleterre du XIIe siècle ravagée par la guerre et la famine, des êtres luttent pour s’assurer le pouvoir, la gloire, la sainteté, l’amour, ou simplement de quoi survivre. Les batailles sont féroces, les hasards prodigieux, la nature cruelle. Les fresques se peignent à coups d’épée, les destins se taillent à coups de hache et les cathédrales se bâtissent à coups de miracles… et de saintes ruses. La haine règne, mais l’amour aussi, malmené constamment, blessé parfois, mais vainqueur enfin quand un Dieu, à la vérité souvent trop distrait, consent à se laisser toucher par la foi des hommes.
Abandonnant le monde de l’espionnage, Ken Follett, le maître du suspense, nous livre avec Les Piliers de la Terre une œuvre monumentale dont l’intrigue, aux rebonds incessants, s’appuie sur un extraordinaire travail d’historien. Promené de pendaisons en meurtres, des forêts anglaises au cœur de l’Andalousie, de Tours à Saint-Denis, le lecteur se trouve irrésistiblement happé dans le tourbillon d’une superbe épopée romanesque dont il aimerait qu’elle n’eût pas de fin.",978-2130428114,https://m.media-amazon.com/images/I/81x1cQQKuxL._SY522_.jpg,Le Livre de Poche (15 avril 1992),Ken Follett
"L'Odyssée du Templier, tome 1",8.78,"Beauvais, 1294. Barthel, capitaine des gardes de l'Inquisition, a toujours procédé avec méthode et sang-froid aux arrestations des hérétiques ordonnées par son bienfaiteur, l'inquisiteur dominicain Robert de Konrad. Pourtant, alors qu'il est missionné pour punir le forgeron Jehan et sa famille, Barthel est en proie au doute. Pourquoi l'inquisiteur tient-il tant à mener ce cruel assaut contre une forge aussi réputée ? Lorsque la fuite inattendue du fils de Jehan provoque la colère de l'évêque, Barthel est alors sûr d'une chose : cette mission recèle des enjeux qui dépassent sa tâche initiale. Tiraillé entre une lourde dette envers l'inquisiteur et son envie de remettre en cause l'autorité, le capitaine est malgré tout déterminé à faire la lumière sur les secrets de Robert de Konrad. Montségur, 1294. Hugo, ancien templier condamné pour avoir aimé une princesse sarrasine, est alerté de la disparition de son neveu. Pour le sauver, le chevalier arpente les terres de Philippe le Bel. Du pays d'Oc à Beauvais, en passant par les Vosges, Hugo est confronté à un royaume corrompu par les manigances politiques des inquisiteurs, des hommes d'Église, du roi de France et de sa cour. Déchiré entre son désir de vengeance et son devoir familial, l'ex-templier devra faire un choix... Prendrez-vous le parti du roi de France ou des Templiers ? Philippe IV parviendra-t-il à s'approprier le fabuleux trésor du Temple ? Résurrection, le premier tome d'une épopée passionnante !",979-1040514664,https://m.media-amazon.com/images/I/81n9MprXuSL._SY522_.jpg,Librinova (22 mars 2023),Henri Strinati
"L'Odyssée du Templier, tome 1",16.19,"Beauvais, 1294. Barthel, capitaine des gardes de l'Inquisition, a toujours procédé avec méthode et sang-froid aux arrestations des hérétiques ordonnées par son bienfaiteur, l'inquisiteur dominicain Robert de Konrad. Pourtant, alors qu'il est missionné pour punir le forgeron Jehan et sa famille, Barthel est en proie au doute. Pourquoi l'inquisiteur tient-il tant à mener ce cruel assaut contre une forge aussi réputée ? Lorsque la fuite inattendue du fils de Jehan provoque la colère de l'évêque, Barthel est alors sûr d'une chose : cette mission recèle des enjeux qui dépassent sa tâche initiale. Tiraillé entre une lourde dette envers l'inquisiteur et son envie de remettre en cause l'autorité, le capitaine est malgré tout déterminé à faire la lumière sur les secrets de Robert de Konrad. Montségur, 1294. Hugo, ancien templier condamné pour avoir aimé une princesse sarrasine, est alerté de la disparition de son neveu. Pour le sauver, le chevalier arpente les terres de Philippe le Bel. Du pays d'Oc à Beauvais, en passant par les Vosges, Hugo est confronté à un royaume corrompu par les manigances politiques des inquisiteurs, des hommes d'Église, du roi de France et de sa cour. Déchiré entre son désir de vengeance et son devoir familial, l'ex-templier devra faire un choix... Prendrez-vous le parti du roi de France ou des Templiers ? Philippe IV parviendra-t-il à s'approprier le fabuleux trésor du Temple ? Résurrection, le premier tome d'une épopée passionnante !",979-1040514664,https://m.media-amazon.com/images/I/81n9MprXuSL._SY522_.jpg,Librinova (22 mars 2023),Henri Strinati
La villa aux étoffes (1),10.1,"Un manoir, une famille puissante, un sombre secret...
À Augsburg, près de Munich, en 1913, la jeune Marie est embauchée en cuisine à la Villa aux étoffes, la résidence des Melzer, propriétaires d'une imposante usine de textile. Alors que la jeune orpheline tente de tailler sa place parmi les serviteurs, les maîtres anticipent le début de la saison des bals hivernaux qui permettra à la belle Katharina, la cadette de la famille, de briller de tous ses feux en société. Paul, l'héritier principal, se tient loin de ce genre de mondanités, car il préfère de loin sa vie d'étudiant à Munich. Du moins jusqu'à ce qu'il croise Marie... Lorsque la Première Guerre mondiale déchire l'Europe et le reste du monde, la Villa et ses habitants seront aux premières loges du conflit et subiront des bouleversements dont les effets feront trembler toute la maisonnée, l'usine ainsi que ses employés. De quoi l'avenir de Marie et de tous ces gens qui sont devenus sa famille sera-t-il fait ?",978-2264078049,https://m.media-amazon.com/images/I/71EQZKT9urL._SY522_.jpg,10 X 18 (3 juin 2021),Anne Jacobs
Le Courage des Lâches,16.22,"Destins croisés et tragiques de 5 enfants, des années trente à l’occupation Allemande : Une histoire d’amitiés, d’amours, de dons et de sacrifices, de courage et de lâcheté…",978-2487261020,https://m.media-amazon.com/images/I/41NALIXqLAL.jpg,LA TRACE; 1er édition (3 avril 2024),Wendall Utroi
Le Bal des folles,7.9,"1885 : comme chaque année, à la Salpêtrière, se tient le très mondain « bal des folles ». Le temps d’une soirée, le Tout-Paris s’encanaille sur des airs de valse et de polka en compagnie de femmes déguisées en colombines, gitanes, zouaves et autres mousquetaires. Cette scène joyeuse cache une réalité sordide : ce bal « costumé et dansant » n’est rien d’autre qu’une des dernières expérimentations de Charcot, adepte de l’exposition des fous.
Dans ce livre terrible et puissant, Victoria Mas choisit de suivre le destin de ces femmes victimes d’une société masculine qui leur interdit toute déviance et les emprisonne. Parmi elles, Geneviève, dévouée corps et âme au célèbre neurologue ; Louise, abusée par son oncle ; Thérèse, une prostituée au grand cœur qui a eu le tort de pousser son souteneur dans la Seine ; Eugénie enfin qui, parce qu’elle dialogue avec les morts, est envoyée par son propre père croupir entre les murs de ce qu’il faut bien appeler une prison.",978-2253103622,https://m.media-amazon.com/images/I/61N4LcdtMuL._SY522_.jpg,Le Livre de Poche (31 mars 2021),Victoria Mas
Les Héritières de Löwenhof - La promesse de Solveig (Tome 3),17.28,"Stockholm, 1967.
Solveig Lejongård termine ses études de médecine vétérinaire et s’apprête à épouser l’homme qu’elle aime lorsqu’un terrible accident vient briser tous ses rêves. C’est à Löwenhof, auprès de sa mère Mathilda et de sa grand-mère Agneta, qu’elle trouve refuge pour surmonter sa douleur.
Hélas, le haras familial est au bord de la faillite. Les années 1960 ont apporté leur lot de véhicules motorisés, et les chevaux sont des vestiges de l’ancien temps. La vente du domaine semble être la seule issue, mais Solveig a promis à Agneta de ne jamais se séparer de ces terres chargées de souvenirs.
Pour redonner à la propriété sa splendeur d’antan et sauver Löwenhof, Solveig devra bousculer des codes ancestraux et se lancer dans la grande aventure de la modernité.",978-2385290757,https://m.media-amazon.com/images/I/81kZErPmFTL._SY522_.jpg,CHARLESTON; 1er édition (10 janvier 2024),Corina Bomann
"L'Odyssée du Templier, tome 1",8.2,"Beauvais, 1294. Barthel, capitaine des gardes de l'Inquisition, a toujours procédé avec méthode et sang-froid aux arrestations des hérétiques ordonnées par son bienfaiteur, l'inquisiteur dominicain Robert de Konrad. Pourtant, alors qu'il est missionné pour punir le forgeron Jehan et sa famille, Barthel est en proie au doute. Pourquoi l'inquisiteur tient-il tant à mener ce cruel assaut contre une forge aussi réputée ? Lorsque la fuite inattendue du fils de Jehan provoque la colère de l'évêque, Barthel est alors sûr d'une chose : cette mission recèle des enjeux qui dépassent sa tâche initiale. Tiraillé entre une lourde dette envers l'inquisiteur et son envie de remettre en cause l'autorité, le capitaine est malgré tout déterminé à faire la lumière sur les secrets de Robert de Konrad. Montségur, 1294. Hugo, ancien templier condamné pour avoir aimé une princesse sarrasine, est alerté de la disparition de son neveu. Pour le sauver, le chevalier arpente les terres de Philippe le Bel. Du pays d'Oc à Beauvais, en passant par les Vosges, Hugo est confronté à un royaume corrompu par les manigances politiques des inquisiteurs, des hommes d'Église, du roi de France et de sa cour. Déchiré entre son désir de vengeance et son devoir familial, l'ex-templier devra faire un choix... Prendrez-vous le parti du roi de France ou des Templiers ? Philippe IV parviendra-t-il à s'approprier le fabuleux trésor du Temple ? Résurrection, le premier tome d'une épopée passionnante !",979-1040514664,https://m.media-amazon.com/images/I/81n9MprXuSL._SY522_.jpg,Librinova (22 mars 2023),Henri Strinati
