Nom,Prix,Description,Isbn,Photo,Editeur,Auteur
"L'Odyssée du Templier, tome 1",17.69,"Beauvais, 1294. Barthel, capitaine des gardes de l'Inquisition, a toujours procédé avec méthode et sang-froid aux arrestations des hérétiques ordonnées par son bienfaiteur, l'inquisiteur dominicain Robert de Konrad. Pourtant, alors qu'il est missionné pour punir le forgeron Jehan et sa famille, Barthel est en proie au doute. Pourquoi l'inquisiteur tient-il tant à mener ce cruel assaut contre une forge aussi réputée ? Lorsque la fuite inattendue du fils de Jehan provoque la colère de l'évêque, Barthel est alors sûr d'une chose : cette mission recèle des enjeux qui dépassent sa tâche initiale. Tiraillé entre une lourde dette envers l'inquisiteur et son envie de remettre en cause l'autorité, le capitaine est malgré tout déterminé à faire la lumière sur les secrets de Robert de Konrad. Montségur, 1294. Hugo, ancien templier condamné pour avoir aimé une princesse sarrasine, est alerté de la disparition de son neveu. Pour le sauver, le chevalier arpente les terres de Philippe le Bel. Du pays d'Oc à Beauvais, en passant par les Vosges, Hugo est confronté à un royaume corrompu par les manigances politiques des inquisiteurs, des hommes d'Église, du roi de France et de sa cour. Déchiré entre son désir de vengeance et son devoir familial, l'ex-templier devra faire un choix... Prendrez-vous le parti du roi de France ou des Templiers ? Philippe IV parviendra-t-il à s'approprier le fabuleux trésor du Temple ? Résurrection, le premier tome d'une épopée passionnante !",979-1040514664,https://m.media-amazon.com/images/I/81n9MprXuSL._SY522_.jpg,Librinova (22 mars 2023),Henri Strinati
Crète 5ed,17.0,"Un guide entièrement repensé pour découvrir la Crète, en phase avec les nouvelles tendances du monde du voyage : abondamment illustré pour offrir un avant-goût de la destination, clair et synthétique pour construire facilement son itinéraire, riche en conseils et astuces pour des expériences au plus près des habitants.

Les sites incontournables et les meilleures expériences d'un voyage en Crète : le top des plages et des petites îles, le palais de Cnossos, la vieille ville de La Canée et ses maisons vénitiennes, l'îlot d'Elafonissi, les gorges de Samaria, l'île de Spinalonga et son superbe itinéraire de randonnée, le monastère et la plage de Preveli, le plateau du Lassithi...
Une sélection inspirante et très pratique d'itinéraires régionaux pour découvrir le meilleur de la Crète, en toute saison, quel que soit le temps ou le budget disponible.
Les activités de plein air avec des focus sur la randonnée et les sports nautiques.
La cuisine crétoise et ses célèbres vertus.
L'histoire de la Crète retracée de manière originale à travers 15 lieux emblématiques.
Un chapitre pratique qui va à l'essentiel.
Des cartes claires pour se repérer facilement, situer les sites en un coup d'œil, imaginer ses itinéraires et organiser ses déplacements.",978-2384921416,https://m.media-amazon.com/images/I/81iamjm1yTL._SY522_.jpg,Lonely Planet; 5e édition (8 juin 2023),Lonely Planet
Les Aventures de Gilles Belmonte - Tome 6 L'Escadre au bout du monde,9.9,"Le sixième tome de la série à succès des aventures de Gilles Belmonte embarque les lecteurs des quais de Rochefort aux îles de la mer de Chine.



Septembre 1806. Après l'épique bataille de Trafalgar, la France a remis les clés des océans aux Anglais. Mais Napoléon n'a que faire de cette défaite ; auréolé de ses victoires à Austerlitz et Iéna, il ne renonce pas à faire rayonner le pavillon tricolore jusqu'aux confins du monde. Gilles Belmonte coule des jours heureux dans la campagne saintongeaise lorsqu'il reçoit le commandement d'un vaisseau de ligne flambant neuf, le Suffren. Missionné pour une expédition en mer de Chine, notre héros va au-devant de civilisations qui lui sont totalement étrangères, de mers infestées de pirates dans lesquelles l'Union Jack louvoie avec perfidie. Une fois de plus, les marins de France s'embarquent pour une expédition périlleuse avec la fraternité, le panache et la mort pour horizon...
Avec ce nouvel opus, Fabien Clauw nous livre un formidable voyage dans l'espace et le temps.",978-2375023501,https://m.media-amazon.com/images/I/71qH47qHmqL._SY522_.jpg,Paulsen; Illustrated édition (2 mai 2024),Fabien Clauw
Le Réseau Alice,8.2,"« Un remarquable roman historique... À lire absolument ! » Historical Novel Society
« Une histoire puissante, débordant d'audace, d'intrigues, Le Réseau Alice accrochera le lecteur dès la première page et l'entraînera dans un voyage inoubliable. » Chanel Cleeton
L'histoire oubliée du plus grand réseau d'espionnes de la Première Guerre mondiale.
Un an après le début de la Grande Guerre, Eve Gardiner brûle de prendre part à la lutte contre les Allemands et est recrutée comme espionne. Envoyée dans la France occupée, elle est formée par Lili, nom de code : Alice, qui dirige un vaste réseau d'agents secrets pour lutter contre l'ennemi. Trente ans plus tard, hantée par la trahison qui a provoqué le démantèlement du réseau Alice, Eve, devenue alcoolique, vit recluse. Jusqu'au jour où Charlie, une jeune étudiante qui souhaite retrouver sa cousine disparue en France pendant la dernière guerre, déboule chez elle en prononçant un nom qu'elle n'a pas entendu depuis des décennies. Leur rencontre les entraînera dans une mission visant à découvrir une vérité trop longtemps enterrée. ",978-2381220888,https://m.media-amazon.com/images/I/81ibQebkKCL._SY522_.jpg,Hauteville (7 avril 2021),Kate Quinn
Bridgerton: The Duke and I (Bridgertons Book 1): The Sunday Times bestselling inspiration for the Netflix Original Series Bridgerton,11.13,"THE SUNDAY TIMES BESTSELLER

'A veritable treat' Daily Mail

The first novel in Julia Quinn's worldwide bestselling Bridgerton novels, now a series created by Shondaland for Netflix. This is the story of Daphne Bridgerton and the Duke: welcome to the ballrooms of Regency London . . .
________________________________________

Can there be any greater challenge to London's Ambitious Mamas than an unmarried duke? Lady Whistledown's Society Papers, April 1813",978-0349429212,https://m.media-amazon.com/images/I/81kWMnXMjdL._SY522_.jpg,Piatkus; 1er édition (1 décembre 2020),Julia Quinn
Elle s'appelait Sarah,9.2,"Paris, juillet 1942 : Sarah, une fillette de dix ans qui porte l'étoile jaune, est arrêtée avec ses parents par la police française, au milieu de la nuit.
Paniquée, elle met son petit frère à l'abri en lui promettant de revenir le libérer dès que possible. Paris, mai 2002 : Julia Jarmond, une journaliste américaine mariée à un Français, doit couvrir la commémoration de la rafle du Vél d'Hiv. Soixante ans après, son chemin va croiser celui de Sarah, et sa vie va changer à jamais. Elle s'appelait Sarah, c'est l'histoire de deux familles que lie un terrible secret, c'est aussi l'évocation d'une des pages les plus sombres de l'Occupation.
Un roman bouleversant sur la culpabilité et le devoir de mémoire, qui connaît un succès international, avec des traductions dans trente-quatre pays.",978-2253157526,https://m.media-amazon.com/images/I/81t6U6pNQNL._SY522_.jpg,Le Livre de Poche; 1er édition (22 septembre 2010),Tatiana de Rosnay
"Bridgerton: To Sir Phillip, With Love (Bridgertons Book 5): Inspiration for the Netflix Original Series Bridgerton: Eloise's story",18.55,"The fifth novel in Julia Quinn’s globally beloved and bestselling Bridgerton Family series, set in Regency times and now a series created by Shonda Rhimes for Netflix. This is Eloise’s story.",978-0349429465,https://m.media-amazon.com/images/I/81MNBpd7HYL._SY522_.jpg,Piatkus; 1er édition (4 février 2021),Julia Quinn
Les heures sauvages: La saga des désobéissantes (tome 3),19.5,"Septembre 1940. Après une longue séparation, Pauline et son mari sont enfin réunis à Paris : Hans a obtenu un poste clé à l'Institut allemand. Mais la jeune femme supporte mal son statut d'épouse d'Allemand dans une France dont les conditions d'occupation deviennent brutales. L'exemple de son amie Carine, engagée dans la lutte active contre l'occupant, finit par lui donner des idées dangereuses. Nathalie, à présent veuve et mère d'un petit garçon, retrouve son indépendance. Mais elle peine à joindre les deux bouts, et elle ne résiste pas à la proposition de travail du marchand d'art Gabriel Cléoménidès. Devenue son assistante, elle plonge dans l'univers feutré des salles de vente, où les collections d'art aux origines parfois douteuses se vendent à coups de millions. Bientôt, un inquiétant SS, acheteur personnel du maréchal Goering, se dresse sur leur chemin. Autant de nouveaux obstacles à surmonter pour nos deux héroïnes...",978-2416013331,https://m.media-amazon.com/images/I/81pVnVJ97-L._SY522_.jpg,EYROLLES (23 mai 2024),Carole Declercq
"L'Odyssée du Templier, tome 1",13.3,"Beauvais, 1294. Barthel, capitaine des gardes de l'Inquisition, a toujours procédé avec méthode et sang-froid aux arrestations des hérétiques ordonnées par son bienfaiteur, l'inquisiteur dominicain Robert de Konrad. Pourtant, alors qu'il est missionné pour punir le forgeron Jehan et sa famille, Barthel est en proie au doute. Pourquoi l'inquisiteur tient-il tant à mener ce cruel assaut contre une forge aussi réputée ? Lorsque la fuite inattendue du fils de Jehan provoque la colère de l'évêque, Barthel est alors sûr d'une chose : cette mission recèle des enjeux qui dépassent sa tâche initiale. Tiraillé entre une lourde dette envers l'inquisiteur et son envie de remettre en cause l'autorité, le capitaine est malgré tout déterminé à faire la lumière sur les secrets de Robert de Konrad. Montségur, 1294. Hugo, ancien templier condamné pour avoir aimé une princesse sarrasine, est alerté de la disparition de son neveu. Pour le sauver, le chevalier arpente les terres de Philippe le Bel. Du pays d'Oc à Beauvais, en passant par les Vosges, Hugo est confronté à un royaume corrompu par les manigances politiques des inquisiteurs, des hommes d'Église, du roi de France et de sa cour. Déchiré entre son désir de vengeance et son devoir familial, l'ex-templier devra faire un choix... Prendrez-vous le parti du roi de France ou des Templiers ? Philippe IV parviendra-t-il à s'approprier le fabuleux trésor du Temple ? Résurrection, le premier tome d'une épopée passionnante !",979-1040514664,https://m.media-amazon.com/images/I/81n9MprXuSL._SY522_.jpg,Librinova (22 mars 2023),Henri Strinati
"L'Odyssée du Templier, tome 1",5.82,"Beauvais, 1294. Barthel, capitaine des gardes de l'Inquisition, a toujours procédé avec méthode et sang-froid aux arrestations des hérétiques ordonnées par son bienfaiteur, l'inquisiteur dominicain Robert de Konrad. Pourtant, alors qu'il est missionné pour punir le forgeron Jehan et sa famille, Barthel est en proie au doute. Pourquoi l'inquisiteur tient-il tant à mener ce cruel assaut contre une forge aussi réputée ? Lorsque la fuite inattendue du fils de Jehan provoque la colère de l'évêque, Barthel est alors sûr d'une chose : cette mission recèle des enjeux qui dépassent sa tâche initiale. Tiraillé entre une lourde dette envers l'inquisiteur et son envie de remettre en cause l'autorité, le capitaine est malgré tout déterminé à faire la lumière sur les secrets de Robert de Konrad. Montségur, 1294. Hugo, ancien templier condamné pour avoir aimé une princesse sarrasine, est alerté de la disparition de son neveu. Pour le sauver, le chevalier arpente les terres de Philippe le Bel. Du pays d'Oc à Beauvais, en passant par les Vosges, Hugo est confronté à un royaume corrompu par les manigances politiques des inquisiteurs, des hommes d'Église, du roi de France et de sa cour. Déchiré entre son désir de vengeance et son devoir familial, l'ex-templier devra faire un choix... Prendrez-vous le parti du roi de France ou des Templiers ? Philippe IV parviendra-t-il à s'approprier le fabuleux trésor du Temple ? Résurrection, le premier tome d'une épopée passionnante !",979-1040514664,https://m.media-amazon.com/images/I/81n9MprXuSL._SY522_.jpg,Librinova (22 mars 2023),Henri Strinati
"L'Odyssée du Templier, tome 1",17.84,"Beauvais, 1294. Barthel, capitaine des gardes de l'Inquisition, a toujours procédé avec méthode et sang-froid aux arrestations des hérétiques ordonnées par son bienfaiteur, l'inquisiteur dominicain Robert de Konrad. Pourtant, alors qu'il est missionné pour punir le forgeron Jehan et sa famille, Barthel est en proie au doute. Pourquoi l'inquisiteur tient-il tant à mener ce cruel assaut contre une forge aussi réputée ? Lorsque la fuite inattendue du fils de Jehan provoque la colère de l'évêque, Barthel est alors sûr d'une chose : cette mission recèle des enjeux qui dépassent sa tâche initiale. Tiraillé entre une lourde dette envers l'inquisiteur et son envie de remettre en cause l'autorité, le capitaine est malgré tout déterminé à faire la lumière sur les secrets de Robert de Konrad. Montségur, 1294. Hugo, ancien templier condamné pour avoir aimé une princesse sarrasine, est alerté de la disparition de son neveu. Pour le sauver, le chevalier arpente les terres de Philippe le Bel. Du pays d'Oc à Beauvais, en passant par les Vosges, Hugo est confronté à un royaume corrompu par les manigances politiques des inquisiteurs, des hommes d'Église, du roi de France et de sa cour. Déchiré entre son désir de vengeance et son devoir familial, l'ex-templier devra faire un choix... Prendrez-vous le parti du roi de France ou des Templiers ? Philippe IV parviendra-t-il à s'approprier le fabuleux trésor du Temple ? Résurrection, le premier tome d'une épopée passionnante !",979-1040514664,https://m.media-amazon.com/images/I/81n9MprXuSL._SY522_.jpg,Librinova (22 mars 2023),Henri Strinati
"L'Odyssée du Templier, tome 1",13.9,"Beauvais, 1294. Barthel, capitaine des gardes de l'Inquisition, a toujours procédé avec méthode et sang-froid aux arrestations des hérétiques ordonnées par son bienfaiteur, l'inquisiteur dominicain Robert de Konrad. Pourtant, alors qu'il est missionné pour punir le forgeron Jehan et sa famille, Barthel est en proie au doute. Pourquoi l'inquisiteur tient-il tant à mener ce cruel assaut contre une forge aussi réputée ? Lorsque la fuite inattendue du fils de Jehan provoque la colère de l'évêque, Barthel est alors sûr d'une chose : cette mission recèle des enjeux qui dépassent sa tâche initiale. Tiraillé entre une lourde dette envers l'inquisiteur et son envie de remettre en cause l'autorité, le capitaine est malgré tout déterminé à faire la lumière sur les secrets de Robert de Konrad. Montségur, 1294. Hugo, ancien templier condamné pour avoir aimé une princesse sarrasine, est alerté de la disparition de son neveu. Pour le sauver, le chevalier arpente les terres de Philippe le Bel. Du pays d'Oc à Beauvais, en passant par les Vosges, Hugo est confronté à un royaume corrompu par les manigances politiques des inquisiteurs, des hommes d'Église, du roi de France et de sa cour. Déchiré entre son désir de vengeance et son devoir familial, l'ex-templier devra faire un choix... Prendrez-vous le parti du roi de France ou des Templiers ? Philippe IV parviendra-t-il à s'approprier le fabuleux trésor du Temple ? Résurrection, le premier tome d'une épopée passionnante !",979-1040514664,https://m.media-amazon.com/images/I/81n9MprXuSL._SY522_.jpg,Librinova (22 mars 2023),Henri Strinati
Kairos: Winner of the International Booker Prize,17.64,"Longlisted for the International Booker Prize

Berlin. 11 July 1986. They meet by chance on a bus. She is a young student, he is older and married. Theirs is an intense and sudden attraction, fuelled by a shared passion for music and art, and heightened by the secrecy they must maintain. But when she strays for a single night he cannot forgive her and a dangerous crack forms between them, opening up a space for cruelty, punishment and the exertion of power. And the world around them is changing too: as the GDR begins to crumble, so too do all the old certainties and the old loyalties, ushering in a new era whose great gains also involve profound loss.

From a prize-winning German writer, this is the intimate and devastating story of the path of two lovers through the ruins of a relationship, set against the backdrop of a seismic period in European history.",978-1783786138,https://m.media-amazon.com/images/I/819n9tgFLOL._SY522_.jpg,Granta Books; 1er édition (11 avril 2024),Jenny Erpenbeck
Bridgerton: Romancing Mr Bridgerton: Tie-in for Penelope and Colin's story - the inspiration for Bridgerton series three,12.38,"'A veritable treat' Daily Mail

The fourth book in Julia Quinn's globally bestselling, Regency-set, Bridgerton Family series, now the inspiration for the Netflix series Bridgerton created by Shondaland. Welcome to Colin and Penelope's long-awaited story . . .
................................

Everyone knows that Colin Bridgerton is the most charming man in London . . .

Penelope Featherington has secretly adored her best friend's brother for . . . well, it feels like forever. After half a lifetime of watching Colin Bridgerton from afar, she thinks she knows everything about him, until she stumbles across his deepest secret . . . and fears she doesn't know him at all.

Colin Bridgerton is tired of being thought of as nothing but an empty-headed charmer, tired of the notorious gossip columnist Lady Whistledown, who can't seem to publish an edition without mentioning him. But when Colin returns to London from a trip abroad, he discovers nothing in his life is quite the same - especially Penelope Featherington! The girl who was always simply",978-0349438467,https://m.media-amazon.com/images/I/81x3Mlw50bL._SY522_.jpg,Piatkus; 1er édition (9 mai 2024),Julia Quinn
Les Héritières de Löwenhof : le secret de Mathilda,10.5,"tockholm, 1931.
Depuis la mort de son père, Mathilda Wallin vit seule avec sa mère. Quand cette dernière décède brutalement, Agneta Lejongård, une mystérieuse comtesse, lui annonce qu’elle est désormais sa tutrice et l’emmène dans sa majestueuse propriété de Löwenhof. Rongée par la peur et le doute, la jeune orpheline est alors projetée dans un monde intimidant de luxe et de raffinement.
Prise dans le carcan d’un milieu qui n’est pas le sien, Mathilda décide de tout faire pour découvrir le secret qui entremêle son destin à celui des Lejongård. Mais ses recherches sont rapidement entravées par la nouvelle guerre qui menace l’Europe...",978-2385290283,https://m.media-amazon.com/images/I/81NRrjA6sJL._SY522_.jpg,CHARLESTON; 1er édition (16 août 2023),Corina Bomann
Héroïnes,20.9,"À la vie, à la mort...
La vie d'Audrey Parker change à jamais quand son frère est tué lors de l'attaque de Pearl Harbor. Fraîchement sorties de l'école d'infirmière, la jeune femme et son amie Lizzie s'engagent dans l'armée américaine pour contribuer à l'effort de guerre. Elles y font la connaissance d'Alex, fille d'un grand banquier new-yorkais, et de Louise, qui se bat depuis toujours contre les préjugés raciaux.
Bientôt envoyées en Angleterre, où elles rapatrient par avion les soldats alliés blessés sur le front, ces héroïnes de l'ombre risquent leur vie à chaque mission. Entre rires et larmes, des amitiés indéfectibles se nouent, on échange même des serments d'amour. Mais la mort rôde et frappe souvent là où on s'y attend le moins...",978-2258203464,https://m.media-amazon.com/images/I/61gvn2hRWRL._SY522_.jpg,Presses de la Cité (4 janvier 2024),Danielle Steel
La Flèche brisée: Le roman de Cochise,19.11,"Fruit de recherches minutieuses d'informations de premier plan, Elliott Arnold s'est attaché, dans cette grande fresque à la fois épique, littéraire et historique, à mettre en relief la figure du personnage le plus emblématique d'une des tribus indiennes les plus puissantes et redoutées de la seconde moitié du XIXe, celui qui fut loyal, craint et respecté autant par les Apaches que par les Américains : Cochise.
En 1848, les Apaches chiricahuas, qui vivent dans le futur État de l'Arizona, ont à leur tête ce chef vénéré et puissant. En guerre depuis plus d'un siècle avec le Mexique, les Apaches s'inquiètent de l'arrivée en nombre des Américains. Pris entre deux armées, de deux grands pays, Cochise parvient à contenir la fougue de ses jeunes guerriers pour maintenir à bout de bras une paix qui épargne des vies apaches. Mais quand, en 1861, les Chiricahuas sont accusés à tort du rapt d'un enfant, le feu est mis aux poudres et provoque la célèbre guerre de Cochise qui durera onze ans. Sa rencontre avec Thomas J. Jeffords et les liens d'amitié qu'ils noueront, permettront à Cochise de changer le cours de l'Histoire et, à nouveau, de sauver de nombreuses vies apaches grâce au traité de paix de 1872.",978-2268110301,https://m.media-amazon.com/images/I/81dqTvYbN6L._SY522_.jpg,Editions du Rocher (17 avril 2024),Elliot Arnold
Un monde sans fin,13.9,"1327. Quatre enfants sont les témoins d’une poursuite meurtrière dans les bois : un chevalier tue deux soldats au service de la reine, avant d’enfouir dans le sol une lettre mystérieuse, dont la teneur pourrait mettre en danger la couronne d’Angleterre. Ce jour lie à jamais leurs sorts... L’architecte de génie, la voleuse éprise de liberté, la femme idéaliste, le guerrier dévoré par l’ambition : mû par la foi, l’amour et la haine, le goût du pouvoir ou la soif de vengeance, chacun d’eux se bat pour accomplir sa destinée dans un monde en pleine mutation – secoué par les guerres, terrassé par les famines, et ravagé par la Peste noire. Avec Un monde sans fin, Ken Follett nous offre une nouvelle fresque historique aussi séduisante et captivante que Les Piliers de la Terre, cette superbe épopée romanesque qui avait pour cadre l’Angleterre du xiie siècle.",978-2253125761,https://m.media-amazon.com/images/I/71eIZLVK08L._SY522_.jpg,Le Livre de Poche (6 janvier 2010),Ken Follett
La fille qui s'échappa d'Auschwitz,8.9,"En franchissant les portes d'Auschwitz, Mala comprend que personne ne quitte jamais le camp vivant. Profitant de sa position d'interprète pour grapiller ce qu'elle peut, elle refuse de laisser la mort triompher et tente d'aider ses codétenues. Mais c'est en rencontrant Edward, ancien combattant et prisonnier politique, que son espoir renaît réellement. Selon lui, malgré les barbelés, les projecteurs et les mitraillettes, il y a une issue. Ils se font alors une promesse : ils s'enfuiront ensemble, ou ils mourront ensemble. L'histoire vraie de Mala Zimetbaum et Edward Galinski est l'une des plus grandes histoires d'amour du XXᵉ siècle.",978-2290375020,https://m.media-amazon.com/images/I/61-Fh8t3GrL._SY522_.jpg,J'AI LU (20 septembre 2023),Ellie Midwood
"L'Odyssée du Templier, tome 1",19.51,"Beauvais, 1294. Barthel, capitaine des gardes de l'Inquisition, a toujours procédé avec méthode et sang-froid aux arrestations des hérétiques ordonnées par son bienfaiteur, l'inquisiteur dominicain Robert de Konrad. Pourtant, alors qu'il est missionné pour punir le forgeron Jehan et sa famille, Barthel est en proie au doute. Pourquoi l'inquisiteur tient-il tant à mener ce cruel assaut contre une forge aussi réputée ? Lorsque la fuite inattendue du fils de Jehan provoque la colère de l'évêque, Barthel est alors sûr d'une chose : cette mission recèle des enjeux qui dépassent sa tâche initiale. Tiraillé entre une lourde dette envers l'inquisiteur et son envie de remettre en cause l'autorité, le capitaine est malgré tout déterminé à faire la lumière sur les secrets de Robert de Konrad. Montségur, 1294. Hugo, ancien templier condamné pour avoir aimé une princesse sarrasine, est alerté de la disparition de son neveu. Pour le sauver, le chevalier arpente les terres de Philippe le Bel. Du pays d'Oc à Beauvais, en passant par les Vosges, Hugo est confronté à un royaume corrompu par les manigances politiques des inquisiteurs, des hommes d'Église, du roi de France et de sa cour. Déchiré entre son désir de vengeance et son devoir familial, l'ex-templier devra faire un choix... Prendrez-vous le parti du roi de France ou des Templiers ? Philippe IV parviendra-t-il à s'approprier le fabuleux trésor du Temple ? Résurrection, le premier tome d'une épopée passionnante !",979-1040514664,https://m.media-amazon.com/images/I/81n9MprXuSL._SY522_.jpg,Librinova (22 mars 2023),Henri Strinati
