Nom,Prix,Description,Isbn,Photo,Editeur,Auteur
Expérience sur l'obéissance et la désobéissance à l'autorité,6.16,"La célébrissime "" expérience de Milgram "" a fait couler beaucoup d'encre, inspirant critiques, militants, cinéastes ou romanciers. En complément à ce bref texte fondateur, l'un des premiers comptes rendus de l'expérience publié en 1965 par son concepteur, cette édition propose de revenir de façon critique, plus de quarante ans plus tard, sur sa longue histoire.
Le savant, en blouse blanche, vous ordonne d'appuyer à nouveau sur le bouton, d'augmenter encore le voltage. Face à vous, vous pouvez voir l'homme se tordre de douleur et crier à chaque nouvelle décharge électrique. De plus en plus fort. On vous a dit que c'était une expérience scientifique. Que le cobaye était consentant. Vous êtes payé. "" Vous devez continuer "", répète la voix.
Allez-vous obtempérer ? Irez-vous jusqu'à la décharge maximale ?
Mais le cobaye n'est pas celui qu'on croit. L'homme là-bas était un acteur. Il n'y avait pas de courant dans les électrodes. C'était vous, et non lui, qui faisiez l'objet de l'expérience.
Ce dispositif était celui que le psychologue américain Stanley Milgram avait imaginé, en 1961, alors que le procès retentissant du criminel nazi Adolf Eichmann faisait la "" une "" des journaux, pour conduire une série d'expériences sur les "" conditions de l'obéissance et de la désobéissance à l'autorité "".
Pourquoi obéit-on ? Pourquoi se soumet-on à l'autorité ? Et surtout : comment désobéir ?
La célèbre "" expérience de Milgram "" a fait couler beaucoup d'encre. En complément à ce texte fondateur, publié en 1965, cette édition met en perspective la longue histoire des débats qui ont accompagné sa réception.",978-2707194732,https://m.media-amazon.com/images/I/61Yo3fDNJZL._SY522_.jpg,La Découverte (4 mai 2017),Stanley Milgram
La vie sociale des poètes,9.03,"« La poésie est une île qui se détache du continent », écrit le prix Nobel de littérature Derek Walcott. Mais alors, qui sont les habitants de cette île et comment vivent-ils, s’interroge Sébastien Dubois ?

Malgré les nombreux discours de déploration sur la poésie, qui irait de crise en crise depuis 1945, jamais cet art n’a connu une telle vitalité : livres, lectures, performances, festivals, marchés foisonnent ; des auteurs sont publiés de leur vivant dans la Pléiade ou en livre de poche, d’autres sont étudiés à l’université, entrent dans les programmes scolaires, etc.

L’ouvrage porte un regard de sociologue sur la condition, relativement organisée, des poètes contemporains, qui mêlent activités littéraires et « seconds métiers » comme modes d’existence. Surtout, parce que la poésie est à la source de toute littérature et demeure un art « pur », gouverné par le prestige, il s’attache à saisir la vie esthétique de ses auteurs.

Sébastien Dubois est professeur à NEOMA Business School et chercheur associé au Centre de sociologie des organisations (Sciences Po/CNRS).",978-2724640656,https://m.media-amazon.com/images/I/611f8B-s89L._SY522_.jpg,Les Presses de Sciences Po (3 mars 2023),Sébastien Dubois
Repenser les organisations à l’ère de l’intelligence artificielle : Quel avenir pour nos PME-PMI ?,22.0,"A l’aube d’une révolution technologique majeure portée par le développement de l’intelligence artificielle, les stratégies mises en œuvre aujourd’hui par les entreprises vont conditionner les cinquante prochaines années. Sans une vision à long terme, nos PME-PMI risquent de se faire engloutir par une stratégie unique, celle des GAFAM. Certes, les géants du numérique n’ont jamais créé autant de richesses, mais de quelle richesse parlons-nous ? Car la finalité d’une entreprise n’est pas tant de s’équiper de technologies digitales, que de faire perdurer son savoir-faire, ses valeurs et son originalité, pour créer une richesse partagée. Dans cet environnement mouvant et difficile, l’humain devient la principale ressource des entreprises. Cet essai propose des pistes de réflexion et des outils pour préparer l’entreprise à l’avènement de l’Intelligence Artificielle, tout en soutenant un progrès humaniste.",978-2363925176,https://m.media-amazon.com/images/I/51sw+T9MXqL._SY522_.jpg,Les éditions Ovadia (15 avril 2023),Didier Ait
Le management: Voyage au centre des organisations - Poche,13.6,"J'ai écrit ce livre en pensant qu'il existait un réel besoin d'une meilleure compréhension des organisations, et ce, autant dans la société prise dans son ensemble, que parmi les managers qui essayent de faire fonctionner ces organisations.
Henry MINTZBERG
Un incontournable du management, accessible à tous en version poche.
Ce livre présente l'essentiel des travaux de Mintzberg, l'un des plus grands spécialistes mondiaux des organisations. Destiné aux étudiants comme aux professionnels, il donne une vue complète du management.",978-2708130937,https://m.media-amazon.com/images/I/619Vn8KdZ-L._SY522_.jpg,Editions d'Organisation; 2e édition (1 avril 2004),Henry Mintzberg
Conspirators Hierarchy: The Story of the Committee of 300,6.05,"Can you imagine an all powerful group, that knows no national boundaries, above the laws of all countries, one that controls every aspect of politics, religion, commerce and industry, banking, insurance, mining, the drug trade, the petroleum industry, a group answerable to no one but its members? To the vast majority of us, such a group would appear to be beyond the realms of possibilities and capabilities of any given organization. If that is what you believe, then you are in the majority. The conception of a secret, elite group exercising control of every aspect of our lives is beyond our comprehension. Americans are prone to say, ""It can't happen here, our Constitution forbids it."" That there is such a body, called ""The committee of 300,"" is graphically told in this book. When most people attempt to address our problems, they speak or write about ""they""; this book tells precisely who ""they"" are, and what ""TheY"" have planned for our future, how ""they"" have been at war with the American nation for 50 years, a war which we are on the brink of losing, what methods ""They"" use and exactly how ""they"" have brainwashed us. If you are Puzzled and perplexed as to why things are occurring that we as a nation don't like yet seem powerless to prevent, why it is that the United States always seems to back the wrong horse, Why the united states is in a depression from which it will not emerge, why our former social and moral values have been turned aside and seemingly buried; if you are confused by the many conspiracy theories, the conSPirators' hierarchy: the committee of 300 will clearly establish that these conditions have been deliberately created to bring us to our knees. Once you have read the applying truths contained in this book, understanding past and present political, economic, social and religious events will no longer be a problem. This powerful account of the forces ranged against the United States, and indeed the entire free world, cannot be ignored.",978-0922356577,https://m.media-amazon.com/images/I/61u4UDBNbhL._SY522_.jpg,"America West Publishers,U.S. (13 mai 2016)",Joan Coleman
Le médiateur dans l'arène: Réflexion sur l'art de la médiation,23.5,"Contrairement aux apparences, la médiation est une activité très complexe qui nécessite une formation spécifique. Le médiateur est toujours confronté à l'inconnu, au doute et au chaos relationnel des personnes en conflit qui le voient souvent comme leur dernier recours. La posture de médiateur est extrêmement délicate à acquérir et à respecter quelle que soit la nature des conflits traités. La bonne volonté et l'improvisation ont des limites. Pour être efficace, le médiateur a besoin de réfléchir à son éthique et à son rôle ; de connaître ses réactions personnelles face au conflit et au pouvoir. Il doit s'entraîner à être à la fois acteur et observateur. Cet ouvrage constitue un précieux outil de formation pour tous les médiateurs qui, au fil de leur activité, se trouvent confrontés à leurs propres limites et à leurs doutes. Les paradoxes, les métaphores et les nombreux cas exposés ici facilitent la compréhension et la réflexion du lecteur. Universitaire et médiateur, Thomas Fiutak a fondé le Centre de gestion des conflits et de médiation, à l'université de Minneapolis (Minnesota) aux Etats-Unis. Cet ouvrage a été écrit en collaboration avec Yvette Colin et Gabrielle Planès.",978-2749210292,https://m.media-amazon.com/images/I/71Ap2oGiX3L._SY522_.jpg,ERES (12 février 2009),FIUTAK THOMAS
La Frustration salariale: A quoi servent les primes ?,11.45,"Cet ouvrage part à la découverte du phénomène de la frustration salariale. Aujourd’hui, des éléments de plus en plus variés sont adjoints au salaire pour rétribuer le travail et les salariés sont en demande d’une plus grande transparence.

 Dans les trente dernières années, les points de repère pour apprécier la rémunération du travail se sont peu à peu effacés. L’individualisation récente des rémunérations brouille les perceptions individuelle et collective des salaires dont les usages sont finalement plus complexes qu’il n’y paraît (ceux-ci ont aussi pour fonction d’attirer, de fidéliser, de contrôler, voire de punir...). En conséquence, les salariés sont en demande d’une plus grande transparence.",979-1023107739,https://m.media-amazon.com/images/I/811tPBh2q6L._SY522_.jpg,SUP; 1er édition (26 mars 2024),Elise Penalva - Icher
Le Soi : les fondamentaux,16.14,"Qui suis-je ? Où vais-je ? Dans quelle « étagère » ? demandait Coluche. Au-delà de l'humour, la formule renvoie à des questions existentielles qui consument régulièrement l'esprit de chacun d'entre nous et qui ont trouvé au travers du temps autant de réponses que de penseurs. Le présent ouvrage répond aux deux premières questions dans les deux parties qui le structurent. «Dans quelle étagère» cet ouvrage sur le soi devrait-il se percher ? Bien qu'il ne réponde pas à cette dernière question, il mérite toute sa place bien en vue dans la bibliothèque de tout lecteur qui veut savoir comment, en l'état des connaissances actuelles, la psychologie répond aux deux premières questions. Il aborde donc le thème du soi du point de vue de la psychologie scientifique, avec un accent marqué en psychologie sociale et psychologie de la motivation.",978-2706153044,https://m.media-amazon.com/images/I/61ED8KcjqyL._SY522_.jpg,PU GRENOBLE (6 octobre 2022),Alain QUIAMZADE
Autonomie dans le travail,8.23,"Les recherches présentées portent sur la (re)constitution du système social dans l'entreprise. Elles visent, dans des contextes automatisés (chimie, cimenterie, électricité, presse), à analyser d'une part la manière dont ces ensembles humains s'organisent réellement pour sortir la production et d'autre part le processus de création de règles effectives. On montre, dans une première partie, que les règles imposées par l'encadrement ne se réduisent pas aux prescriptions, mais que, pour être obéi, l'encadrement a recours à un système d'obligations implicites. Face au déclin du prescriptif et à l'émergence des obligations de production, le groupe d'exécution produit des règles non écrites, ce qui témoigne de son autonomie : ces solutions d'organisation, objet de la deuxième partie, sont élaborées pour sortir la production ; néanmoins elles fondent le collectif de travail et l'aident à élaborer sa logique d'action commune, son projet. Enfin, dans une troisième partie, on s'interroge sur la nouvelle étape de la rationalisation : celle-ci tente d'exploiter ce gisement d'efficacité par de nouvelles formes de codification du travail conduisant à des modèles d'organisation non déterministes. Par une analyse minutieuse des pratiques réelles de travail, ces recherches tentent de cerner les régulations sociales qui se développent dans le travail, c'est-à-dire les confrontations, les compromis ou les conflits qui jalonnent le face-à-face entre un encadrement dont les règles formelles ne suffisent plus pour obtenir la production, et un groupe d'exécution de plus en plus sollicité pour apporter sa contribution active à la continuité de la production. Au total, ce travail tente de renouveler la réflexion sociologique sur le problème de la division du travail, en montrant que les pratiques de travail informelles ne constituent pas un résidu, mais une zone clé de régulations sociales où se combinent les règles formelles et les règles tacites, par une confrontation entre exécutants et décideurs. Dans ce contexte, l'autonomie et l'initiative apparaissent comme des conditions de l'efficacité des ensembles techniques, bref comme une caractéristique essentielle de toute réalité organisationnelle.",978-2130441168,https://m.media-amazon.com/images/I/41SPmmUDg6L.jpg,Presses Universitaires de France - PUF (1 janvier 1992),Gilbert de Terssac
ANIMER 25 JEUX autour des CARTES DES VALEURS: Cartes des valeurs incluses à télécharger et à imprimer | Tout public,7.07,"""Animer 25 jeux autour des cartes des valeurs"" est un guide indispensable pour tous ceux qui cherchent à enrichir leurs ateliers, formations, ou moments familiaux avec des activités profondes et engageantes. À travers ce livre, vous découvrirez une collection soigneusement élaborée de 25 jeux, chacun conçu pour explorer, partager et réfléchir sur les valeurs qui nous guident dans la vie.

Que vous soyez animateur, formateur, éducateur, enseignant, parent, ou simplement intéressé par le développement personnel et collectif, ce livre vous offre les outils nécessaires pour créer des moments de partage mémorables. Les activités proposées sont variées, allant de l'exploration de la communication et de la coopération, à la stimulation de la créativité et de l'empathie, en passant par la promotion de la citoyenneté et du vivre-ensemble.

Ce n'est pas tout : pour faciliter la mise en pratique de ces jeux, le livre inclut un accès exclusif pour",979-8879729412,https://m.media-amazon.com/images/I/51NiwC-y4cL._SY522_.jpg,Independently published (15 février 2024),Christophe BOUSQUET
Croyances et savoirs d'enseignants allemands et français: (Re)penser l'interculturel à l'école,25.5,"L'ouvrage se place délibérément du côté des enseignants. Des discours d'enseignants du primaire ont été recueillis par le biais de focus groups, organisés en Allemagne et en France. L'ouvrage témoigne des problèmes qui se posent aux professionnels quand ils s'engagent dans des projets interculturels avec les élèves. Il révèle également les intérêts éducatifs que les praticiens voient dans une éducation interculturelle. Enfin, l'ouvrage montre comment trois grandes croyances des enseignants, individuelles ou partagées, donnent du sens à leurs expériences et à leurs choix pédagogiques. Cet ouvrage s'adresse à tous ceux qui veulent sortir d'une vision caricaturale et exotique de l'interculturel.",978-2343232423,https://m.media-amazon.com/images/I/81yXKKvYSuL._SY522_.jpg,Editions L'Harmattan (23 juillet 2021),Veronique Lemoine-Bresson
"Soins palliatifs, la vraie alternative à l euthanasie: Personne ne doit mourir seul",17.0,"Une réflexion incontournable sur les soins palliatifs pour éclairer les débats actuels sur la fin de vie.

Parce qu'il a toujours été difficile de faire leur juste place aux mourants, ce livre retrace l'histoire des soins palliatifs, de leur références éthiques et religieuses. Il rappelle la médecine à ses obligations d'origine et la science à sa modestie au nom du formidable trésor d'humanité qui se dévoile dans l'accompagnement des mourants. Un livre essentiel pour que tous puissent prendre part à la défense et la promotion des soins palliatifs comme une des plus belles preuves de fraternité.

Jean-Frédéric Poisson, très actif dans le débat politique sur la fin de vie, titulaire d'un doctorat de philosophie sur la bioéthique et d'un master en droit social, signe ici un essai clair et grand public pour comprendre et découvrir le sens et la valeur des soins palliatifs pour notre société.",978-2728934096,https://m.media-amazon.com/images/I/71t3zMVMDzL._SY522_.jpg,MAME (22 février 2023),Jean-Frédéric Poisson
Construire la RSE: Perspectives théoriques et pratiques innovantes,18.0,"Que fait notre organisation pour répondre aux enjeux sociétaux ? Pourquoi et comment créer des partenariats (entreprises-association-collectivité) pour initier des innovations environnementales, sociales et/ou territoriales ? Pourquoi et comment formaliser et sécuriser juridiquement nos pratiques responsables ? Comment sommes-nous engagés dans notre organisation ? Pourquoi et comment insuffler une culture de management de l'erreur, prendre en compte la vulnérabilité des salariés et encourager leur engagement responsable ? Pourquoi notre organisation existe-t-elle ? Comment définir et partager la raison d'être de notre organisation ? Enrichir la réflexion stratégique et les actions concrètes en entreprise pour renforcer les démarches innovantes et responsables des PME et TPE, parfois moins bien outillées compte tenu de leur taille, tel est l'objectif de cet ouvrage.",978-2367179544,https://m.media-amazon.com/images/I/71q7uhMlDzL._SY522_.jpg,CHRONIQUE SOCIA (18 janvier 2024),Cartier virginie
Biomimétisme et stratégies d'entreprise: 9 principes pour réconcilier l'entreprise et le vivant,25.0,,978-2374254531,https://m.media-amazon.com/images/I/01PkLIhTX3L.gif,RUE ECHIQUIER (30 août 2024),Paul Boulanger
"Quand déclencher l'accouchement, c'est confisquer la maternité aux femmes: Une analyse psychosociologique du travail des femmes",8.81,"Sous prétexte de science médicale, une étude en cours, French Arrive, venue des États-Unis, veut déclencher l'accouchement, à 39 semaines, toutes les femmes en bonne santé, enceintes de leur premier enfant. Cette mécanisation du corps des femmes relève d'une idéologie patriarcale. Elle déshumanise la naissance et normalise la mise monde autant que le travail des soignants. Ce que démontrent les auteures du présent essai. Par la psychosociologie du travail, et l'approche interactionniste, elles valorisent la co-construction des soins, au service des femmes, de leurs ressources propres, dans le respect et le soutien de la construction de leur maternité.",978-2140296970,https://m.media-amazon.com/images/I/61aFydpk-0L._SY522_.jpg,Editions L'Harmattan; Bilingual édition (6 octobre 2022),Raymonde Gagnon
LOGIN MANAGER: Revenir au management authentique,7.93,"✔ La bienveillance est pour vous une valeur ambigüe qu’on combine à toutes les sauces ?
✔ Vous préférez les mots de sincérité et d’authenticité que jouer un rôle ?
✔ Vous préférez dire les choses que noyer le poisson ?
👉 Quinze situations courantes de management sont illustrées dans LOGIN MANAGER avec des situations et anecdotes terrain pour agir en manager authentique.",979-8354861231,https://m.media-amazon.com/images/I/719TzIzgPML._SY522_.jpg,Independently published (29 septembre 2022),BERTRAND LASSERRE
Against the Gods: The Remarkable Story of Risk,17.95,"Der Bestseller zur Risikobewertung jetzt als Broschurausgabe. Das ganze Leben ist ein einziges Risiko. Menschen in allen Bereichen des Lebens - Politiker, Wissenschaftler, Geschäftsleute, sogar Familien - müssen regelmäßig Entscheidungen treffen, die in irgendeiner Form Risiken bergen. Die Fähigkeit, das Ausmaß des Risikos solcher Entscheidungen zu bewerten und einzugrenzen gehört zu den Grundprinzipien der modernen Gesellschaft. 'Against the Gods' erzählt die Abenteuer einer Gruppe kühner Denker, die sich auf eine intellektuelle Entdeckungsreise begeben haben und den urzeitlichen Aberglauben verwandelt haben in leistungsstarke Methoden zur Risikokontrolle, wie sie heute Anwendung finden. Interessant und spannend geschrieben und ohne den sonst themabedingten technischen und mathematischen Ballast. (10/98)",978-0471295631,https://m.media-amazon.com/images/I/71MykJzsAaL._SY522_.jpg,John Wiley & Sons Inc (29 septembre 1998),Peter L. Bernstein
,5.22,,,,,
Sociologie des émotions,11.57,"Approche novatrice en sociologie d'une dimension réservée jusqu'ici à la psychologie autour d'une problématique très contemporaine: les émotions.
Les émotions, traditionnellement étudiées en psychologie, s’imposent progressivement dans la sociologie contemporaine.
Penser une grammaire sociologique de l’émotion, c’est avant tout admettre que les émotions traversent les expériences sociales et qu’il existe une forme d’historicité de l’émotion. Aujourd’hui, plus qu’hier encore, penser les émotions s’avère relever d’un devoir théorique, épistémologique et méthodologique de la sociologie.
Ce livre rassemble les contributions de 12 spécialistes qui font émerger la question émotionnelle dans la discipline sociologique et montrent comment les transformations sociales contemporaines affectent les acteurs sociaux, mais aussi le travail sociologique.",978-2807337855,https://m.media-amazon.com/images/I/41qKVL7vowL.jpg,DE BOECK SUP; 1er édition (21 juin 2022),Nathalie Burnay
"Développement du travail et des organisations: Changement technologique, leadership, et régulation émotionelle",15.5,"Cet ouvrage est consacré au développement du travail et des organisations qui constitue un constant domaine de recherche et d'intervention pour la psychologie du travail. Si les changements économiques et technologiques sont vecteurs de développement, ils apportent aussi leur lot d'incertitudes. L'ouvrage analyse ces changements afin de contribuer à ce qu'ils soient profitables aux personnes. Pour rendre compte des avancées de la recherche en ce domaine, ce volume réunit deux ensembles de contributions. La première partie aborde la question du changement technologique.La seconde partie traite essentiellement de l'exercice du leadership. Elle se conclut sur le rôle de la régulation émotionnelle dans l'équilibre vie professionnelle-vie privée.",978-2343236414,https://m.media-amazon.com/images/I/71QtuxSYBCL._SY522_.jpg,Editions L'Harmattan (19 octobre 2021),Patrick Gilbert
Introduction à la sociologie économique: Analyse critique des organisations et des marchés,23.9,"Face au défi écologique, ce livre offre une analyse approfondie et pratique des phénomènes économiques.

Àl’ère de l’Anthropocène, ce manuel propose de réfléchir aux bases relationnelles des phénomène économiques, c’est-à-dire à l’ensemble des relations qui sous-tendent le fonctionnement concret des organisations et des marchés.
Son originalité tient en quatre points :
• Les auteurs développent une analyse socio-économique des organisations et des marchés et dépassent, de ce fait, la spécialisation disciplinaire.
• Ils en proposent une lecture plurielle, à travers les quatre paradigmes suivants : utilitarisme et critique sociale, systèmes et structures, régulations et conventions, savoirs et identités.",978-2807345263,https://m.media-amazon.com/images/I/71xQKbdZADL._SY522_.jpg,DE BOECK SUP; 1er édition (11 octobre 2022),Thierry Amougou
Monde associatif et néolibéralisme,10.0,"La configuration néolibérale du capitalisme détruit-elle le modèle associatif ? Si la réponse est plus complexe qu'il n'y paraît, force est de constater l'existence d'antagonismes structurels entre ces deux entités. Depuis le xixe siècle en France, les associations sont parées de nombreuses vertus, politiques comme économiques. Tocqueville les considère comme des « écoles de la démocratie ». Actrice majeure de l'« économie sociale », l'association incarne ainsi un autre mode de production et de consommation, à rebours de celui que promeut l'économie politique. Or, les associations sont tout à la fois des organisations politiques, des entreprises produisant des services et des opérateurs de politiques publiques. C'est par la prise en compte de ces trois dimensions que l'on peut saisir toute la complexité du monde associatif contem-porain, les relations d'interdépendance qu'il établit avec les institutions marchandes et les collectivités publiques, ainsi que l'affaiblissement actuel du modèle historique sur lequel il s'est construit. Cet ouvrage dresse l'état des lieux du monde associatif, à l'heure des transformations de l'économie engendrées par le néolibéralisme.",978-2130844365,https://m.media-amazon.com/images/I/51p-+ngiiFL._SY522_.jpg,PUF (15 novembre 2023),Matthieu Hély
