Nom,Prix,Description,Isbn,Photo,Editeur,Auteur
"L'Odyssée du Templier, tome 1",8.83,"Beauvais, 1294. Barthel, capitaine des gardes de l'Inquisition, a toujours procédé avec méthode et sang-froid aux arrestations des hérétiques ordonnées par son bienfaiteur, l'inquisiteur dominicain Robert de Konrad. Pourtant, alors qu'il est missionné pour punir le forgeron Jehan et sa famille, Barthel est en proie au doute. Pourquoi l'inquisiteur tient-il tant à mener ce cruel assaut contre une forge aussi réputée ? Lorsque la fuite inattendue du fils de Jehan provoque la colère de l'évêque, Barthel est alors sûr d'une chose : cette mission recèle des enjeux qui dépassent sa tâche initiale. Tiraillé entre une lourde dette envers l'inquisiteur et son envie de remettre en cause l'autorité, le capitaine est malgré tout déterminé à faire la lumière sur les secrets de Robert de Konrad. Montségur, 1294. Hugo, ancien templier condamné pour avoir aimé une princesse sarrasine, est alerté de la disparition de son neveu. Pour le sauver, le chevalier arpente les terres de Philippe le Bel. Du pays d'Oc à Beauvais, en passant par les Vosges, Hugo est confronté à un royaume corrompu par les manigances politiques des inquisiteurs, des hommes d'Église, du roi de France et de sa cour. Déchiré entre son désir de vengeance et son devoir familial, l'ex-templier devra faire un choix... Prendrez-vous le parti du roi de France ou des Templiers ? Philippe IV parviendra-t-il à s'approprier le fabuleux trésor du Temple ? Résurrection, le premier tome d'une épopée passionnante !",979-1040514664,https://m.media-amazon.com/images/I/81n9MprXuSL._SY522_.jpg,Librinova (22 mars 2023),Henri Strinati
Le voyage de Cilka,8.5,"Cilka Klein n'a que 16 ans lorsqu'elle est déportée. Très vite remarquée pour sa beauté par le commandant du camp de Birkenau, elle est mise à l'écart des autres prisonnières. Mais à la libération du camp par les Russes, elle est condamnée pour collaboration et envoyée en Sibérie. Un deuxième enfer commence alors pour elle. Au goulag, où elle doit purger une peine de quinze ans, elle se lie d'amitié avec une femme médecin et apprend à s'occuper des malades à l'hôpital. C'est ainsi qu'elle rencontre Alexandr, et qu'elle découvre que l'amour peut naître même dans les situations les plus dramatiques. Comme pour Le tatoueur d'Auschwitz, Heather Morris a recueilli de nombreux témoignages qu'elle met en scène dans ce nouveau roman très attendu.",978-2290361276,https://m.media-amazon.com/images/I/61-kUd9d0IL._SY522_.jpg,J'AI LU (9 février 2022),Heather Morris
Le templier de l'ombre - Tome 2,20.9,""" Je voulais croire que cet homme souffrirait mille morts. Je voulais le croire, oui, à l'aube de ce 21 janvier de l'an de grâce 1308, pour la quiétude de cet enfant qui allait naître... ""

Depuis que le roi de France, Philippe le Bel, a décrété l'arrestation des Templiers, Margaux ne craint plus celui qui a signé la perte de son frère et de sa châtellenie. Le Templier de l'ombre, qu'on appelle l'"" alchimiste "", doit croupir dans quelque geôle...

Réfugiée dans une ancienne tour wisigothe, Margaux s'apprête à mettre au monde son enfant et à l'élever dans la chaleur de son nouveau foyer avec Michel, sa tante et Théophraste.

Mais l'hiver gronde aux portes du Razès. Et des profondeurs de la montagne, les vieux secrets remontent, réveillant l'implacable mécanique mise en place par le Templier de l'ombre. Margaux n'a d'autre choix que de reprendre les armes...",978-2374485737,https://m.media-amazon.com/images/I/610t4kLV-iL._SY522_.jpg,XO (26 octobre 2023),Mireille Calmel
"L'Odyssée du Templier, tome 1",8.86,"Beauvais, 1294. Barthel, capitaine des gardes de l'Inquisition, a toujours procédé avec méthode et sang-froid aux arrestations des hérétiques ordonnées par son bienfaiteur, l'inquisiteur dominicain Robert de Konrad. Pourtant, alors qu'il est missionné pour punir le forgeron Jehan et sa famille, Barthel est en proie au doute. Pourquoi l'inquisiteur tient-il tant à mener ce cruel assaut contre une forge aussi réputée ? Lorsque la fuite inattendue du fils de Jehan provoque la colère de l'évêque, Barthel est alors sûr d'une chose : cette mission recèle des enjeux qui dépassent sa tâche initiale. Tiraillé entre une lourde dette envers l'inquisiteur et son envie de remettre en cause l'autorité, le capitaine est malgré tout déterminé à faire la lumière sur les secrets de Robert de Konrad. Montségur, 1294. Hugo, ancien templier condamné pour avoir aimé une princesse sarrasine, est alerté de la disparition de son neveu. Pour le sauver, le chevalier arpente les terres de Philippe le Bel. Du pays d'Oc à Beauvais, en passant par les Vosges, Hugo est confronté à un royaume corrompu par les manigances politiques des inquisiteurs, des hommes d'Église, du roi de France et de sa cour. Déchiré entre son désir de vengeance et son devoir familial, l'ex-templier devra faire un choix... Prendrez-vous le parti du roi de France ou des Templiers ? Philippe IV parviendra-t-il à s'approprier le fabuleux trésor du Temple ? Résurrection, le premier tome d'une épopée passionnante !",979-1040514664,https://m.media-amazon.com/images/I/81n9MprXuSL._SY522_.jpg,Librinova (22 mars 2023),Henri Strinati
"L'Odyssée du Templier, tome 1",12.8,"Beauvais, 1294. Barthel, capitaine des gardes de l'Inquisition, a toujours procédé avec méthode et sang-froid aux arrestations des hérétiques ordonnées par son bienfaiteur, l'inquisiteur dominicain Robert de Konrad. Pourtant, alors qu'il est missionné pour punir le forgeron Jehan et sa famille, Barthel est en proie au doute. Pourquoi l'inquisiteur tient-il tant à mener ce cruel assaut contre une forge aussi réputée ? Lorsque la fuite inattendue du fils de Jehan provoque la colère de l'évêque, Barthel est alors sûr d'une chose : cette mission recèle des enjeux qui dépassent sa tâche initiale. Tiraillé entre une lourde dette envers l'inquisiteur et son envie de remettre en cause l'autorité, le capitaine est malgré tout déterminé à faire la lumière sur les secrets de Robert de Konrad. Montségur, 1294. Hugo, ancien templier condamné pour avoir aimé une princesse sarrasine, est alerté de la disparition de son neveu. Pour le sauver, le chevalier arpente les terres de Philippe le Bel. Du pays d'Oc à Beauvais, en passant par les Vosges, Hugo est confronté à un royaume corrompu par les manigances politiques des inquisiteurs, des hommes d'Église, du roi de France et de sa cour. Déchiré entre son désir de vengeance et son devoir familial, l'ex-templier devra faire un choix... Prendrez-vous le parti du roi de France ou des Templiers ? Philippe IV parviendra-t-il à s'approprier le fabuleux trésor du Temple ? Résurrection, le premier tome d'une épopée passionnante !",979-1040514664,https://m.media-amazon.com/images/I/81n9MprXuSL._SY522_.jpg,Librinova (22 mars 2023),Henri Strinati
