Nom,Description,Photo
Marina van Zuylen,"Franco-américaine, Marina van Zuylen est professeure de littérature comparée à Bard College (État de New York). Elle trouve dans l&#39ennui, l&#39oisiveté, le manque d&#39ambition, des qualités philosophiques à exploiter. Elle a publié Éloge des vertus minuscules en 2023, livre coup de coeur des libraires, qui a reçu un excellent accueil critique.",https://m.media-amazon.com/images/I/01Kv-W2ysOL._SY600_.png
Stefan Zweig,"Il s&#39agit de son plus dense document au plan des idées, rédigé à soixante ans, loin de son Europe aimée en pleine désagrégation.
Source: parutions.com Published On: 2013-05-07

Un Monde d&#39hier qui trouve son effroyable écho dans celui d&#39aujourd&#39hui.
Source: Jerusalem Post Published On: 2013-08-14

Stefan Zweig [...] dresse le tableau ensoleillé de la Vienne cultivée, tout entière adonnée à la musique, à l&#39art, aux choses de l&#39esprit, mais avant tout apaisée et sereine. Source: Le Figaro Histoire Published On: 2017-10-01",https://m.media-amazon.com/images/I/51OMDPJQ5oL._SY600_.jpg
Lonely Planet,,https://m.media-amazon.com/images/I/41wavvV5lpL._SY600_.jpg
Robert Neuburger,"Trop aimé.e ? Pas assez ? Comment survivre à une mère insuffisamment bonne ? Des écrivains ont trouvé la solution. Annie Ernaux, Nancy Huston, Delphine le Vigan, Marguerite Duras, Pascal Quignard, Hervé Bazin, Simenon, Colette, Albert Cohen, Romain Gary, Saint- Exupéry, Amélie Nothomb, Eric-Emmanuel Schmitt, etc. : pour elles et eux, l’amour maternel n’a jamais été à la bonne place et ce fut un peu ""l’amour en moins"" ou ""l’amour en trop""... La lecture et l&#39écriture ont été leur bouée de sauvetage. Fait curieux, après la mort de leur mère, ils ont tous écrit une autobiographie, comme la tombe où ils pouvaient placer leur mère, se réconcilier avec l’image maternelle. À défaut d’avoir eu une mère aimante, ils ont créé une mère aimable.",https://m.media-amazon.com/images/I/01Kv-W2ysOL._SY600_.png
Collectif,Sophie Binet est l&#39actuelle secrétaire générale de la CGT.,
Albert Camus,"""Je me souviens du moins d&#39une grande fille magnifique qui avait dansé tout l&#39après-midi. Elle portait un collier de jasmin sur sa robe bleue collante, que la sueur mouillait depuis les reins jusqu&#39aux jambes. Elle riait en dansant et renversait la tête. Quand elle passait près des tables, elle laissait après elle une odeur mêlée de fleurs et de chair.""",https://m.media-amazon.com/images/I/71jqyXVmw0L._SY600_.jpg
Mériam Korichi,"Agrégée, docteure de philosophie, dramaturge et metteuse en scène, Mériam Korichi a écrit et publié plusieurs ouvrages - essais, biographie, traductions- chez Gallimard, Flammarion, Albin Michel. Elle est l’autrice d’une cinquantaine d’articles, en philosophie et en art contemporain notamment",https://m.media-amazon.com/images/I/01Kv-W2ysOL._SY600_.png
Léa Veinstein,"Spécialiste de l&#39oeuvre de Kafka à laquelle elle a consacré une thèse, Léa Veinstein réalise des émissions pour France Culture et Arte Radio. Elle est l&#39autrice d&#39un premier livre remarqué, Isaac (Grasset, 2019).",https://m.media-amazon.com/images/I/01Kv-W2ysOL._SY600_.png
Karl Marx,,
Ed Yong,"Voici un ouvrage évènement, bestseller du New York Times au succès mondial. Le lauréat du prix Pulitzer Ed Yong propose une immersion passionnante dans une nouvelle dimension : le monde tel qu&#39il est réellement perçu par les animaux. Un ouvrage qui émerveille et modifiera à jamais votre point de vue sur ce monde immense qui nous entoure.",https://m.media-amazon.com/images/I/A1zVSADpJUL._SY600_.jpg
Domingos PAÏVA de ALMEIDA,,
Camille Kouchner,Camille Kouchner est née en 1975. Elle est maître de conférences en droit. La Familia grande est son premier livre.,https://m.media-amazon.com/images/I/01Kv-W2ysOL._SY600_.png
Jean Baudrillard,,https://m.media-amazon.com/images/I/61u5hFI35pL._SY600_.jpg
