Nom,Description,Photo
Romain Huët,"Romain Huët est maître de conférences en sciences de la communication à l&#39université Rennes 2. Ethnographe spécialiste des formes contemporaines de la violence, il s&#39est intéressé au suicide et à l&#39émeute urbaine. Cette enquête forme ainsi le troisième volet d&#39un triptyque commencé avec Le Vertige de l&#39émeute. De la Zad aux Gilets jaunes (Puf, 2019) et poursuivi avec De si violentes fatigues. L&#39épuisement quotidien et ses devenirs politiques (Puf, 2021).",
Florent Vargas,,
Claude Moniquet,,
Anna Sergi,"Anna Sergi is Professor of Criminology in the Department of Sociology, University of Essex, UK.
Alberto Vannucci is Professor of Political Science at the Department of Political Science of the University of Pisa, Italy.",https://m.media-amazon.com/images/I/01Kv-W2ysOL._SY600_.png
Judith L. Herman,"""One of the most important psychiatric works to be published since Freud.""―New York Times

""A landmark.""―Gloria Steinem

""A stunning achievement ... a classic for our generation.""―Bessel van der Kolk, M.D., author of The Body Keeps the Score

""A book of luminous intelligence. You must read it as soon as possible.""―Sophie Freud

""Astute, accessible, and beautifully documented. Bridging the worlds of war veterans, prisoners of war, battered women, and incest victims, Herman presents a compelling analysis of trauma and the process of healing. A triumph.""―Laura Davis, coauthor of The Courage to Heal

""Brilliant.""―Boston Globe

""This book will surely become a landmark work on the social impact of psychological trauma and on its treatments.... A magnificent gift to survivors.""―Women&#39s Review of Books

""Herman&#39s brilliant insights into the nature of trauma and the process of healing shine through in every page of this rich and compassionate book.""―Lenore Walker, ED.D., Director, Domestic Violence Institute, and author of Terrifying Love

""Herman links the public traumas of society to those of domestic life in this provocative work of psychiatric theory.""―Publishers Weekly",
MetaMind Edition,,https://m.media-amazon.com/images/S/amzn-author-media-prod/79s0od0bvjc847mi32v4p9jbq._SY600_.jpg
Violaine De filippis-abate,"En France, l’écrasante majorité des violences faites aux femmes reste impunie et ignorée : ce scandale doit cesser.

« Classée sans suite » : trois mots qui signifient qu’aucun procès ne se tiendra jamais. Aujourd’hui, seul 1 % des viols aboutissent à une condamnation et 80 % des plaintes des femmes pour violences dans le cadre conjugal sont classées sans suite par manque d’investigations. Le système judiciaire se montre donc incapable de garantir aux femmes, non pas seulement un procès équitable, mais un procès tout court – leur refusant la reconnaissance de leur statut de victimes et épargnant aux hommes leur statut d’agresseurs.
Si la parole des femmes s’est indiscutablement libérée ces dernières années, les oreilles de la justice sont quant à elles encore sourdes à leurs plaintes. Après un état des lieux édifiant du tunnel infernal que constitue le parcours des femmes victimes de violences, du dépôt de plainte jusqu’au classement, Violaine De Filippis-Abate propose une lecture systémique des blocages expliquant cette situation catastrophique – héritage d’une justice férocement patriarcale et d’un sexisme fermement ancré dans notre culture –, ainsi que des pistes d’amélioration à mettre en œuvre urgemment pour lutter contre la maltraitance physique, psychologique et judiciaire des femmes dans notre pays – pour qu’enfin, justice soit faite.

Violaine De Filippis-Abate est avocate, engagée pour les droits des femmes, porte-parole d’Osez le féminisme et chroniqueuse à L’Huma.",https://m.media-amazon.com/images/I/01Kv-W2ysOL._SY600_.png
Angela Rivoli,,https://m.media-amazon.com/images/S/amzn-author-media-prod/gv1d91te3rd2r02pd4iabdnl4o._SY600_.jpg
William Ury,"“For fifty years, Bill Ury has traveled the world, devoting his one-of-a-kind life to helping people with the deepest differences find peace where none seemed possible. In this landmark book, he brings together what he’s learned into one breathtaking volume that is at once highly practical and deeply emotional. I raced through Possible with pleasure and awe and will be returning to its wisdom year after year as I try to live up to his vision that we be not optimists or pessimists—but possibilists!” — Bruce Feiler, New York Times bestselling author of Life Is in the Transitions
“If I were going to war (or to Congress), and I could bring only one book, this would be it. Ury has collected all his hard-earned secrets and most riveting stories in one place. A master class in what is possible, even at the worst of times.” — Amanda Ripley, journalist and author of High Conflict
“Hope is not a strategy, which is why we need William Ury in the world to help us get to yes when others hear only no and find opportunity when others see nothing but conflict. If you want to renew your sense that good is possible, let Possible be your guide.” — Simon Sinek, optimist and New York Times bestselling author of Start with Why and The Infinite Game
“The guru of win-win negotiations shows us how to use the impossible—our seemingly intractable conflicts—to create the possible. Like me, Ury is a great believer in our potential to transform ourselves, our relationships, and our world. And he provides the tools for us to do so.” — Carol Dweck, author of Mindset
“If you care about the divides that are tearing our country apart, this is the book you must read to solve the thorny issues we face today — in every area of our lives. Highly recommended!” — Van Jones, Social Entrepreneur, Author, and CNN Host
“After reading Possible, I understood much better why William Ury’s advice was so useful in my negotiations and why we managed to make possible what everybody thought was impossible. This book is a must for anyone who wants to learn about something so fundamental in life: the art of negotiating and finding solutions.” — Juan Manuel Santos, former president of Colombia and Nobel Peace laureate",https://m.media-amazon.com/images/S/amzn-author-media-prod/ueinoq45l5dfs9u8q1t9ttnddj._SY600_.jpg
Douglas Thomas,"Douglas Thomas has a private Jungian-based psychotherapy practice in Pasadena, California, where he specializes in work with dreams, LGBTQ+ issues, and alternative sexualities. He also teaches as adjunct faculty at Pacifica Graduate Institute in Santa Barbara, California. Dr. Thomas has written articles for the Journal of Jungian Scholarly Studies and International Journal of Jungian Studies. His essay ""My Kinky Shadow: The poetics of the sadomasochistic Other"" was published last year in Routledge&#39s The Spectre of the Other in Jungian Psychoanalysis. For more information, visit Dr. Thomas&#39 website at Drdouglasthomas.com.",https://m.media-amazon.com/images/I/01Kv-W2ysOL._SY600_.png
Philippe De Vos,,https://m.media-amazon.com/images/I/01Kv-W2ysOL._SY600_.png
Laurent Mucchielli,Laurent Mucchielli est directeur de recherche au CNRS (Laboratoire méditerranéen de Sociologie) et enseigne la sociologie de la délinquance à l’université d’Aix-Marseille. Il est l’un des meilleurs spécialistes des questions de sécurité et de prévention en France.,
Dexter Dias,"Dexter Dias is on the side of the angels, who turn out to be us, the people. He writes like an angel too. Uplifting and indispensable. -- Howard Cunnell, author of Fathers and Sons

In defining and describing his human types, he draws on lab experiments, the animal kingdom, and all the literature you might expect from a modern behaviourist. Yet the main body of the book, the bits that transfixed and stayed with me, stopped me sleeping but got me up in the morning, were the human stories that Dias has travelled the world to find. His interviewees are always people, the most vivid flesh and blood, never case studies. And yet that’s not what’s so extraordinary about it: storytellers are rare, but not vanishingly so... Dias’s work as a human rights lawyer gives him this instinctive, urgent belief that all injustices, all catastrophes, exploitations, acts of violence, all human misery can be taken on and overcome, somehow, if the right people try and there are enough of them. His combination of rigour, idealism and pragmatism makes fertile terrain out of the most appalling battlefields... I emerged from this book feeling better about almost everything. The ideas in The Ten Types of Human are a layperson’s opening into a fascinating academic field: but more than that, a mosaic of faces building into this extraordinary portrait of our species. -- Zoe Williams ― Guardian

The Ten Types of Human is a fantastic piece of non-fiction, mixing astonishing real-life cases with the latest scientific research to provide a guide to who we really are. It’s inspiring and essential. -- Charles Duhigg

This book is the one. Dexter Dias has written a game changer. Think Sapiens and triple it. -- Julia Hobsbawm, author of Fully Connected",https://m.media-amazon.com/images/I/01Kv-W2ysOL._SY600_.png
Marieke Liem,"Het regent liquidaties, femicide neemt toe, daders worden ‘steeds jonger’, ‘harder’ en ‘verwarder’. Die verhalen vertellen de media vaak, maar kloppen ze wel? In Mythen over moord schetsen de Leidse hoogleraar Geweld en Interventies Marieke Liem en misdaadjournalist Gerlof Leistra een verrassend ander beeld van dodelijke agressie in Nederland.

Op basis van een grondige analyse van ruim vijfduizend gevallen van moord en doodslag sinds 1992 komen ze tot de conclusie dat het aantal moorden per jaar de aflopen decennia niet is gestegen, maar juist gestaag is gedaald. Daarbij deden zich allerlei trends voor op het gebied van bijvoorbeeld partnerdoding, kinderdoding, ouderdoding, moorden bij ruzies en binnen het criminele circuit, roof- en seksuele moorden.

Hoe weerspiegelen deze vormen van fataal geweld sociaal-maatschappelijke ontwikkelingen in Nederland? Is de emancipatie van vrouwen bijvoorbeeld terug te zien in de cijfers? Welke rol speelt internet? Is de angst voor ‘verwarde’ mensen terecht? Is Nederland wel het nieuwe Mexico aan de Maas? Mythen over moord – vol heldere overzichten en boeiende reconstructies – is onontbeerlijk om met een objectieve blik naar dit hoogst emotionele onderwerp te kijken.",
