Nom,Description,Photo
The ""abracadabra"" of the magic invocation, for example, bears a curious similarity to the password employed to access a computer. In some respects, high-speed computation has already made it possible to mimic the magic of the genie. Early generations of ""digital servants"" already obey the commands of those who control the computers in which they are sealed much as genies were sealed in magic lamps. The virtual reality of information technology will widen the realm of human wishes to make almost anything that can be imagined seem real Telepresence will give living individuals the same capacity to span distance at supernatural speed and monitor events from afar that the Greeks supposed was enjoyed by Hermes and Apollo. The Sovereign Individuals of the Information Age, like the gods of ancient and primitive myths, will in due course enjoy a kind of ""diplomatic immunity"" from most of the political woes that have beset mortal human beings in most times and places.

The new Sovereign Individual will operate like the gods of myth in the same physical environment as the ordinary, subject citizen, but in a separate realm politically. Commanding vastly greater resources and beyond the reach of many forms of compulsion, the Sovereign Individual will redesign governments and reconfigure economies in the new millennium. The full implications of this change are all but unimaginable.

Genius and Nemesis

For anyone who loves human aspiration and success, the Information Age will provide a bounty. That is surely the best news in many generations. But it is bad news as well. The new organization of society implied by the triumph of individual autonomy and the true equalization of opportunity based upon merit will lead to very great rewards for merit and great individual autonomy. This will leave individuals far more responsible for themselves than they have been accustomed to being during the industrial period. It will also precipitate transition crises, including a possibly severe economic depression that will reduce the unearned advantage in living standards that has been enjoyed by residents of advanced industrial societies throughout the twentieth century. As we write, the top 15 percent of the world&#39s population have an average per-capita income of $21,000 annually. The remaining 85 percent of the world have an average income of just $1,000. That huge, hoarded advantage from the past is bound to dissipate under the new conditions of the Information Age.

As it does, the capacity of nation-states to redistribute income on a large scale will collapse. Information technology facilitates dramatically increased competition between jurisdictions. When technology is mobile, and transactions occur in cyberspace, as they increasingly will do, governments will no longer be able to charge more for their services than they are worth to the people who pay for them. Anyone with a portable computer and a satellite link will be able to conduct almost any information business anywhere, and that includes almost the whole of the world&#39s multitrillion-dollar financial transactions.

This means that you will no longer be obliged to live in a high-tax jurisdiction in order to earn high income. In the future, when most wealth can he earned anywhere, and even spent anywhere, governments that attempt to charge too much as the price of domicile will merely drive away their best customers. If our reasoning is correct, and we believe it is, the nation-state as we know it will not endure in anything like its present form.

The End of Nations

Changes that diminish the power of predominant institutions are both unsettling and dangerous. Just as monarchs, lords, popes, and potentates fought ruthlessly to preserve their accustomed privileges in the early stages of the modern period, so today&#39s governments will employ violence, often of a covert and arbitrary kind, in the attempt to hold back the clock. Weakened by the challenge from technology, the state will treat increasingly autonomous individuals, its former citizens, with the same range of ruthlessness and diplomacy it has heretofore displayed in its dealing with other governments. The advent of this new stage in history was punctuated with a bang on August 20, 1998, when the United States fired about $200 million worth of Tomahawk BGM-109 sea-launched cruise missiles at targets allegedly associated with an exiled Saudi millionaire, Osama bin Laden. Bin Laden became the first person in history to have his satellite phone targeted for attack by cruise missiles. Simultaneously, the United States destroyed a pharmaceutical plant in Khartoum, Sudan, in Bin Laden&#39s honor. The emergence of Bin Laden as the enemy-in-chief of the United States reflects a momentous change in the nature of warfare. A single individual, albeit one with hundreds of millions of dollars, can now be depicted as a plausible threat to the greatest military power of the Industrial era. In statements reminiscent of propaganda employed during the Cold War about the Soviet Union, the United States president and his national security aides portrayed Bin Laden, a private individual, as a transnational terrorist and leading enemy of the United States.

The same military logic that has seen Osama bin Laden elevated to a position as the chief enemy of the United States will assert itself in governments&#39 internal relations with their subjects. Increasingly harsh techniques of exaction will be a logical corollary of the emergence of a new type of bargaining between governments and individuals. Technology will make individuals more nearly sovereign than ever before. And they will be treated that way. Sometimes violently, as enemies, sometimes as equal parties in negotiation, sometimes as allies. But however ruthlessly governments behave, particularly in the transition period, wedding the IRS with the CIA will avail them little. They will be increasingly required by the press of necessity to bargain with autonomous individuals whose resources will no longer be so easily controlled.

The changes implied by the Information Revolution will not only create a fiscal crisis for governments, they will tend to disintegrate all large structures. Fourteen empires have disappeared already in the twentieth century. The breakdown of empires is part of a process that will dissolve the nation-state itself. Government will have to adapt to the growing autonomy of the individual. Taxing capacity will plunge by 50-70 percent. This will tend to make smaller jurisdictions more successful. The challenge of setting competitive terms to attract able individuals and their capital will be more easily undertaken in enclaves than across continents.

We believe that as the modern nation-state decomposes, latter-day barbarians will increasingly come to exercise power behind the scenes. Groups like the Russian mafiya, which picks the bones of the former Soviet Union, other ethnic criminal gangs, nomenklaturas, drug lords, and renegade covert agencies will be laws unto themselves. They already are. Far more than is widely understood, the modern barbarians have already infiltrated the forms of the nation-state without greatly changing its appearances. They are microparasites feeding on a dying system. As violent and unscrupulous as a state at war, these groups employ the techniques of the state on a smaller scale. Their growing influence and power are part of the downsizing of politics. Microprocessing reduces the size that groups must attain in order to be effective in the use and control of violence. As this technological revolution unfolds, predatory violence will be organized more and more outside of central control. Efforts to contain violence will also devolve in ways that depend more upon efficiency than magnitude of power.

History in Reverse

The process by which the nation-state grew over the past five centuries will be put into reverse by the new logic of the Information Age. Local centers of power will reassert themselves as the state devolves into fragmented, overlapping sovereignties. The growing power of organized crime is merely one reflection of this tendency. Multinational companies are already having to subcontract all but essential work. Some conglomerates, such as AT&T, Unisys, and ITT, have split themselves into several firms in order to function more profitably. The nation-state will devolve like an unwieldy conglomerate, but probably not before it is forced to do so by financial crises.

Not only is power in the world changing, but the work of the world is changing as well. This means that the way business operates will inevitably change. The ""virtual corporation"" is evidence of a sweeping transformation in the nature of the firm, facilitated by the drop in information and transaction costs. We explore the implications of the Information Revolution for dissolving corporations and doing away with the ""good job."" In the Information Age, a ""job"" will be a task to do, not a position you ""have."" Microprocessing has created entirely new horizons of economic activity that transcend territorial boundaries. This transcendence of frontiers and territories is perhaps the most revolutionary development since Adam and Eve straggled out of paradise under the sentence of their Maker: ""In the sweat of thy face shalt thou eat bread."" As technology revolutionizes the tools we use, it also antiquates our laws, reshapes our morals, and alters our perceptions. This book explains how.

Microprocessing and rapidly improving communications already make it possible for the individual to choose where to work. Transactions on the Internet or the World Wide Web can be encrypted and will soon be almost impossible for tax collectors to capture. Tax-free money already compounds far faster offshore than onshore funds still subject to the high tax burden imposed by the twentieth-century nation-state. After the turn of the millennium, much of the world&#39s commerce will migrate into the new realm of cyberspace, a region where governments will have no more dominion than they exercise over the bottom of the sea or the outer planets. In cyberspace, the threats of physical violence that have been the alpha and omega of politics since time immemorial will vanish. In cyberspace, the meek and the mighty will meet on equal terms. Cyberspace is the ultimate offshore jurisdiction. An economy with no taxes. Bermuda in the sky with diamonds.

When this greatest tax haven of them all is fully open for business, all funds will essentially be offshore funds at the discretion of their owner. This will have cascading consequences. The state has grown used to treating its taxpayers as a farmer treats his cows, keeping them in a field to be milked. Soon, the cows will have wings.

The Revenge of Nations

Like an angry farmer, the state will no doubt take desperate measures at first to tether and hobble its escaping herd. It will employ covert and even violent means to restrict access to liberating technologies. Such expedients will work only temporarily, if at all. The twentieth-century nation-state, with all its pretensions, will starve to death as its tax revenues decline.

When the state finds itself unable to meet its committed expenditure by raising tax revenues, it will resort to other, more desperate measures. Among them is printing money. Governments have grown used to enjoying a monopoly over currency that they could depreciate at will. This arbitrary inflation has been a prominent feature of the monetary policy of all twentieth-century states. Even the best national currency of the postwar period, the German mark, lost 71 percent of its value from January 1, 1949, through the end of June 1995. In the same period, the U.S. dollar lost 84 percent of its value. This inflation had the same effect as a tax on alt who hold the currency. As we explore later, inflation as revenue option will be largely foreclosed by the emergence of cybermoney. New technologies will allow the holders of wealth to bypass the national monopolies that have issued and regulated money in the modern period. Indeed, the credit crises that swept through Asia, Russia, and other emerging economies in 1997 and 1998 attest to the fact that national currencies and national credit ratings are anachronisms inimical to the smooth operation of the global economy. It is precisely the fact that the demands of sovereignty require all transactions within a jurisdiction to be denominated in a national currency that creates the vulnerability to mistakes by central bankers and attacks by speculators which precipitated deflationary crises in one jurisdiction after another. In the Information Age, individuals will be able to use cybercurrencies and thus declare their monetary independence. When individuals can conduct their own monetary policies over the World Wide Web it will matter less or not at all that the state continues to control the industrial-era printing presses. Their importance for controlling the world&#39s wealth will be transcended by mathematical algorithms that have no physical existence. In the new millennium, cybermoney controlled by private markets will supersede fiat money issued by governments. Only the poor will be victims of inflation and ensuing collapses into deflation that are consequences of the artificial leverage which fiat money injects into the economy.

Lacking their accustomed scope to tax and inflate, governments, even in traditionally civil countries, will turn nasty. As income tax becomes uncollectible, older and more arbitrary methods of exaction will resurface. The ultimate form of withholding tax -- de facto or even overt hostage-taking will be introduced by governments desperate to prevent wealth from escaping beyond their reach. Unlucky individuals will find themselves singled out and held to ransom in an almost medieval fashion. Businesses that offer services that facilitate the realization of autonomy by individuals will be subject to infiltration, sabotage, and disruption. Arbitrary forfeiture of property, already commonplace in the United States, where it occurs five thousand times-a week, will become even more pervasive. Governments will violate human rights, censor the free flow of information, sabotage useful technologies, and worse. For the same reasons that the late, departed Soviet Union tried in vain to suppress access to personal computers and Xerox machines, Western governments will seek to suppress the cybereconomy by totalitarian means.

Return of the Luddites

Such methods may prove popular among some population segments. The good news about individual liberation and autonomy will seem to be bad news to many who are frightened by the transition crisis and do not expect to be winners in the new configuration of society. The apparent popularity of the draconian capital controls imposed in 1998 by Malaysian prime minister Mahathir Mohamad in the wake of the Asian meltdown testifies to residual enthusiasm among many for the old-fashioned closed economy dominated by the nation-state. This nostalgia for the past will be fed by resentments inflamed by the inevitable transition crisis. The greatest resentment is likely to be centered among those of middle talent in currently rich countries. They particularly may come to feel that information technology poses a threat to their way of life. The beneficiaries of organized compulsion, including millions receiving income redistributed by governments, may resent the new freedom realized by Sovereign Individuals. Their upset will illustrate the truism that ""where you stand is determined by where you sit.""

""Sometimes I wondered how I could experience such deep misery over the fate of a handful of men I did not know, playing a game against another group of strangers in a ballpark hundreds of miles away. The answer is simple. I loved my teams. Although risky, caring was worth its price. Sports fired up my blood, excited me, made my heart pound. I liked having something at stake. Life was more vivid during a contest.""

Craig Lambert

It would be misleading, however, to attribute all the bad feelings that will be generated in the coming transition crisis to the bald desire to live at someone else&#39s expense. More will be involved. The very character of human society suggests that there is bound to be a misguided moral dimension to the coming Luddite reaction. Think of it as a bald desire fitted with a moral toupee. We explore the moral and moralistic dimensions of the transition crisis. Self-interested grasping of a conscious kind has far less power to motivate actions than does self-righteous fury. While adherence to the civic myths of the twentieth century is rapidly falling away, they are not without their true believers. Many humans, as the passage quoted from Craig Lambert attests, are belongers, who place importance on being members of a group. The same need to identify that motivates fans of organized sports makes some partisans of nations. Everyone who came of age in the twentieth century has been inculcated in the duties and obligations of the twentieth-century citizen. The residual moral imperatives from industrial society will stimulate at least some neo-Luddite attacks on information technologies.

In this sense, this violence to come will be at least partially an expression of what we call ""moral anachronism,"" the application of moral strictures drawn from one stage of economic life to the circumstances of another. Every stage of society requires its own moral rules to help individuals overcome incentive traps peculiar to the choices they face in that particular way of life. Just as a farming society could not live by the moral rules of a migratory Eskimo band, so the Information Society cannot satisfy moral imperatives that emerged to facilitate the success of a militant twentieth-century industrial state. We explain why.

In the next few years, moral anachronism will be in evidence at the core countries of the West in much the way that it has been witnessed at the periphery over the past five centuries. Western colonists and military expeditions stimulated such crises when they encountered indigenous hunting-and-gathering bands, as well as peoples whose societies were still organized for farming. The introduction of new technologies into anachronistic settings caused confusion and moral crises. The success of Christian missionaries in converting millions of indigenous peoples can be laid in large measure to the local crises caused by the sudden introduction of new power arrangements from the outside. Such encounters recurred over and over, from the sixteenth century through the early decades of the twentieth century. We expect similar clashes early in the new millennium as Information Societies supplant those organized along industrial lines.

The Nostalgia for Compulsion

The rise of the Information Society will not be wholly welcomed as a promising new phase of history, even among those who benefit from it most. Everyone will feel some misgivings. And many will despise innovations that undermine the territorial nation-state. It is a fact of human nature that radical change of any kind is almost always seen as a dramatic turn for the worse. Five hundred years ago, the courtiers gathered around the duke of Burgundy would have said that unfolding innovations that undermined feudalism were evil. They thought the world was rapidly spiraling downhill at the very time that later historians saw an explosion of human potential in the Renaissance. Likewise, what may someday be seen as a new Renaissance from the perspective of the next millennium will look frightening to tired twentieth-century eyes.

There is a high probability that some who are offended by the new ways, as well as many who are disadvantaged by them, will react unpleasantly. Their nostalgia for compulsion will probably turn violent. Encounters with these new ""Luddites"" will make the transition to radical new forms of social organization at least a measure of bad news for everyone. Get ready to duck. With the speed of change outracing the moral and economic capacity of many in living generations to adapt, you can expect to see a fierce and indignant resistance to the Information Revolution, notwithstanding its great promise to liberate the future.

You must understand and prepare for such unpleasantness. A series of transition crises lies ahead. Deflationary tribulations, such as the Asian contagion that swept through the Far East to Russia and other emerging economies in 1997 and 1998, will erupt sporadically as the dated national and international institutions left over from the Industrial Era prove inadequate to the challenges of the new, dispersed, transnational economy. The new information and communication technologies are more subversive of the modern state than any political threat to its predominance since Columbus sailed. This is important because those in power have seldom reacted peacefully to developments that undermined their authority. They are not likely to now.

The clash between the new and the old will shape the early years of the new millennium. We expect it to be a time of great danger and great reward, and a time of much diminished civility in some realms and unprecedented scope in others. Increasingly autonomous individuals and bankrupt, desperate governments will confront one another across a new divide. We expect to see a radical restructuring of the nature of sovereignty and the virtual death of politics before the transition is over. Instead of state domination and control of resources, you are destined to see the privatization of almost all services governments now provide. For inescapable reasons that we explore in this book, information technology will destroy the capacity of the state to charge more for its services than they are worth to you and other people who pay for them.

""Governments will have to deal with what sovereignty means.""

Robert Martin, chief technology officer, Lucent Technologies

Sovereignty Through Markets

To an extent that few would have imagined only a decade ago, individuals will achieve increasing autonomy over territorial nation-states through market mechanisms. All nation-states face bankruptcy and the rapid erosion of their authority. Mighty as they are, the power they retain is the power to obliterate, not to command. Their intercontinental missiles and aircraft carriers are already artifacts, as imposing and useless as the last warhorse of feudalism.

Information technology makes possible a dramatic extension of markets by altering the way that assets are created and protected. This is revolutionary. Indeed, it promises to be more revolutionary for industrial society than the advent of gunpowder proved to be for feudal agriculture. The transformation of the year 2000 implies the commercialization of sovereignty and the death of politics, no less than guns implied the demise of oath-based feudalism. Citizenship will go the way of chivalry.

We believe that the age of individual economic sovereignty is coming. Just as steel mills, telephone companies, mines, and railways that were once ""nationalized"" have been rapidly privatized throughout the world, you will soon see the ultimate form of privatization -- the sweeping denationalization of the individual. The Sovereign Individual of the new millennium will no longer be an asset of the state, a de facto item on the treasury&#39s balance sheet. After the transition of the year 2000, denationalized citizens will no longer be citizens as we know them, but customers.

Bandwidth Trumps Borders

The commercialization of sovereignty will make the terms and conditions of citizenship in the nation-state as dated as chivalric oaths seemed after the collapse of feudalism. Instead of relating to a powerful state as citizens to be taxed, the Sovereign Individuals of the twenty-first century will be customers of governments operating from a ""new logical space."" They will bargain for whatever minimal government they need and pay for it according to contract. The governments of the Information Age will be organized along different principles than those which the world has come to expect over the past several centuries. Some jurisdictions and sovereignty services will be formed through ""assortive matching,"" a system by which affinities, including commercial affinities, are the basis upon which virtual jurisdictions earn allegiance. In rare cases, the new sovereignties may be holdovers of medieval organizations, like the 900-year-old Sovereign Military Hospitaller Order of St. John of Jerusalem, of Rhodes and of Malta. More commonly known as the Knights of Malta, the order is an affinity group for rich Catholics, with 10,000 current members and an annual income of several billions. The Knights of Malta issues its own passports, stamps, and money, and carries on full diplomatic relations with seventy countries. As we write it is negotiating with the Republic of Malta to reassume possession of Fort St. Angelo. Taking possession of the castle would give the Knights the missing ingredient of territoriality that will enable it to be recognized as a sovereignty. The Knights of Malta could once again become a sovereign microstate, instantly legitimized by a long history. It was from Fort St. Angelo that the Knights of Malta turned back the Turks in the Great Siege of 1565. Indeed, they ruled Malta for many years thereafter, until they were expelled by Napoleon in 1798. If the Knights of Malta were to return in the next few years, there could be no clearer evidence that the modern nation-state system, ushered in after the French Revolution, was merely an interlude in the longer sweep of history in which it has been the norm for many kinds of sovereignties to exist at the same time.

