Nom,Description,Photo
René Goscinny,"Faire la fête et laminer ses adversaires : voilà bien ce que les gaulois préfèrent. Et lorsqu’ils apprennent que les Romains du camp d’Aquarium s’entraînent pour représenter Rome aux prochains jeux olympiques, ils n’ont qu’une envie : y participer eux aussi !
Astérix et ses amis se voient déjà vainqueurs, mais leur affaire se complique : la potion magique relève du dopage et est par conséquent formellement interdite. La palme du vainqueur s’éloigne. A moins que…",
Ryan Ottley,"Dessinateur de bandes dessinées.

Scénariste de bandes dessinées. Scénariste et producteur.",https://m.media-amazon.com/images/I/31KdZr+hO5L._SY600_.jpg
Tim Probert,"Tim Probert est un artiste aux multiples casquettes : illustrateur, coloriste, scénariste, il est également directeur artistique d&#39un studio d&#39animation indépendant (Aardman Nathan Love), où il travaille sur des projets pour Nickelodeon, Kellogg&#39s, Coca-Cola ou Candy Crush... Il vit à New-York et Lightfall est sa première bande dessinée.",https://m.media-amazon.com/images/I/01Kv-W2ysOL._SY600_.png
Tui T. Sutherland,"Tui T. Sutherland a écrit une trentaine de romans pour tous les âges, sous différents noms de plume. Elle a aussi participé à la conception de la série best-seller ""La Guerre des clans"" en tant qu&#39éditrice et coauteur, et fait ainsi partie des six auteurs qui signent sous le pseudonyme Erin Hunter. Ces dernières années, Tui T. Sutherland s&#39est investie, seule, dans la création des ""Royaumes de Feu"", un univers de fantasy original et merveilleux, qui renouvelle le genre. Retrouvez Tui T. Sutherland sur son site Internet : www.tuibooks.com",https://m.media-amazon.com/images/I/41DlbQwMy5L._SY600_.jpg
Tim Probert,"Tim Probert est un artiste aux multiples casquettes : illustrateur, coloriste, scénariste, il est également directeur artistique d&#39un studio d&#39animation indépendant (Aardman Nathan Love), où il travaille sur des projets pour Nickelodeon, Kellogg&#39s, Coca-Cola ou Candy Crush... Il vit à New-York et Lightfall est sa première bande dessinée.",https://m.media-amazon.com/images/I/01Kv-W2ysOL._SY600_.png
René Goscinny,"Dans le camp fortifié romain Petibonum, on se pose des questions : comment les Irréductibles Gaulois du village d’Astérix font-ils pour ridiculiser encore et toujours la puissance romaine ? Décidé à percer à jour le mystère de la force surhumaine de nos héros, le centurion Caius Bonus envoie un espion déguisé en Gaulois.
C’est Caligula Minus qui s’y colle, et découvre bien vite l’existence de la potion magique préparée par Panoramix. Sans attendre, le centurion Caius Bonus fait enlever le druide pour s’emparer de la recette du fameux breuvage histoire, qui sait, de devenir César à la place de Jules ! Une première occasion pour Astérix de démontrer son courage et ses talents de stratège.",
Benjamin Percy,"Nouvelliste. Professeur d&#39anglais et d&#39écriture créative, Iowa state university, Ames (en 2008).

Dessinateur de bandes dessinées.",
John Byrne,"Dessinateur et scénariste de bandes dessinées. Écrirait aussi sous le pseudonyme ""Lieberman, A. J."".

Scénariste de bandes dessinées.",
TAYLOR Tom,"Tom TAYLOR est entré dans le monde du comics en 2009, et y a insufflé une fraîcheur qui ne l&#39a depuis jamais quitté. Présent dans le comics indé et la jeunesse, c&#39est véritablement chez DC Comics qu&#39il dévoile la diversité de son talent, utilisant les personnages de l&#39écurie comme autant de jouets à sa disposition pour les placer dans des univers alternatifs variés, et n&#39hésitant pas à les sacrifier pour les besoins du récit... D&#39un naturel optimiste, il a également à coeur de transmettre des valeurs bienveillantes et progressistes dans ses séries. Le mois de septembre est l&#39occasion d&#39explorer ses différentes facettes et de mettre en avant sa carrière, son style et son talent.",https://m.media-amazon.com/images/S/amzn-author-media-prod/au4m2lthon9eqh1hkdtjgb1lio._SY600_.jpg
Sylvia Douyé,"Sylvia Douyé, née en 1973, devient journaliste à Sciences & Vie Découvertes, E=M6, Mon Quotidien, Wapiti, après ses études de biologie. Elle débute la BD avec Malice et Azimut parue dans Sciences & Vie Découvertes, écrit des scénarios pour le multimédia (Adi, Les Petits Débrouillards), puis signe chez Casterman la série Les Zinzinventeurs qui compte aujourd&#39hui cinq volumes et a reçu le prix Jeunesse à Angoulême. Elle coscénarise également Les Guides en BD Junior et Les Guides au Féminin avec Jacky Goupil. Elle scénarise aussi la série Marie-Lune, dessinée par Yllya et récompensée par le prix Canal J en 2010. En 2015, elle reprend les rênes d&#39une mythique série d&#39heroic fantasy de Goupil et Crisse en lançant en compagnie de Fabio Lai Les Mondes de l&#39Épée de cristal. En 2018, elle lance une nouvelle série jeunesse, Sorceline. Récompensée par le prix des lecteurs du Journal de Mickey est acclamée par le public comme la critique.Réside en Île-de-France.


Paola Antista est une dessinatrice italienne. Diplômée de l’académie Disney, elle commence comme illustratrice pour des magazines, des livres scolaires ou des agences de pub. Elle donne régulièrement des cours de BD en école élémentaire et collège. En France, elle publie la série Chats !, dont six tomes sont parus. Elle a également dessiné deux tomes de la série Alix et Arsénou chez Clair de lune. À partir de 2018, elle travaille avec Sylvia Douyé sur la série Sorceline. Réside en Italie.",https://m.media-amazon.com/images/S/amzn-author-media-prod/ko2kq8k68qi3g327vbu8srsh0s._SY600_.jpg
Jed MacKay,"Dessinateur de bandes dessinées.

Scénariste de bandes dessinées.

Dessinateur de bandes dessinées. Prénom complet : Edward.",
Jérôme Pélissier,"Jérôme Pélissier est diplômé de l&#39école Estienne en illustration éditoriale et illustration didactique. Il a commencé sa carrière professionnelle dans le jeu vidéo en tant qu&#39artiste 2D-3D et scénariste. Il aura l’occasion de créer ses propres jeux (Metropolis crimes, Red Johnson Chronicles, Taxi Journey) et sera l’auteur d’une application en partenariat avec France TV sur l’univers de Corto Maltese, Corto maltese, secrets de Venise (Auteur, co-scénariste et directeur artistique). Il restera dans cette industrie pendant 15 ans où il occupera notamment un poste de directeur artistique à Ubisoft. Il quitte finalement le monde du jeu vidéo en 2018 pour se consacrer pleinement à l&#39illustration d’albums jeunesse en freelance. En 2023, il s’associe à Marlène Jobert pour En route pour les étoiles, une nouvelle édition de ce conte magnifique. La même année, sa série jeunesse Brume remporte Le Prix BD Jeunesse Ville de Saint-Malo. Pour consulter son travail :
https://www.instagram.com/jerome_pelissier_arts/?hl=fr


Carine Hinder est une autrice et illustratrice française. Elle travaille principalement pour la jeunesse, en édition, jeu, et communication visuelle. Elle est également co-auteure de Pffirates, série animée diffusée sur TF1. Coloré, dynamique, doux et joyeux, son travail été de nombreuses fois récompensées, notamment par le prix Renaudot en 2013 (Anatole Bristol, le gang des farceurs – Éditions Auzou). Elle a notamment illustré les premières histoires pour la jeunesse de Katherine Pancol et Marc Levy aux éditions hachette. Talentueuse, elle a de multiples passions qu&#39elle partage sur les réseaux (céramique, vannerie, culture) et qui font d&#39elle une artiste atypique et touche à tout ! En 2023, elle s’illustre chez Glénat avec la série Brume qui remporte Le Prix BD Jeunesse Ville de Saint-Malo. Réside en Bretagne. Pour consulter ses travaux :
https://www.instagram.com/carine.jardine/
-
https://www.instagram.com/carinehinder/",https://m.media-amazon.com/images/S/amzn-author-media-prod/h1c7ip5dahkqvquaj0c35mes22._SY600_.jpg
Dugomier,"A? l&#39instar de toute une génération d&#39auteurs bruxellois, Vincent Dugomier suit les cours d&#39Eddy Paape a? Saint-Gilles, au milieu des années 1980. Il fait ses débuts en signant des scénarios pour le journal Spirou. Dugomier est doué pour ajouter une petite touche de surnaturel au monde de l&#39enfance, comme en attestent les sagas Muriel et Boulon (Le Lombard) ou, plus tard, Les De?mons d&#39Alexia (Dupuis), toutes deux e?crites pour son ami Benoît Ers. Il n&#39oublie pas pour autant son sens de l&#39humour, avec la série Les Campeurs, qu&#39il publie chez Bamboo entre 2006 et 2010. Il s&#39essaie également au thriller pour adolescents avec Hell School (Le Lombard). Avec la collection de prestige dédiée à Franquin lancée chez Marsu Productions, Vincent Dugomier se découvre une nouvelle passion pour le travail de recherches à partir d&#39archives rares. En 2015, il signe Les Enfants de la Re?sistance au Lombard, une série historique destinée au jeune public. Par la suite, toujours chez l&#39éditeur bruxellois, il lance Les Omniscients, avec Renata Castellani, puis Urbex, une série ado-adulte dessinée par Clarke, qui a reçu le Prix des Collèges au Festival International de la Bande Dessinée d&#39Angoulême 2022.

Renata Castellani est née le 8 février 1992, à Savone, en Italie. Elle est diplômée en art dans l&#39école de sa ville « A. Martini » puis à l&#39International Comics School de Turin. En 2015, elle commence à travailler en tant qu&#39auteure de BD pour Panini Comics, pour l&#39hebdomadaire de Mickey Mouse « Topolino ». Son travail y fut publié, ainsi que dans plusieurs magazines Disney. Les Omniscients est sa première collaboration avec Le Lombard.",https://m.media-amazon.com/images/I/01Kv-W2ysOL._SY600_.png
Gerry Duggan,"Scénariste de bandes dessinées.

Nouvelliste. Professeur d&#39anglais et d&#39écriture créative, Iowa state university, Ames (en 2008).

Dessinateur de bandes dessinées.

Dessinateur de bandes dessinées. Pseudonyme de Juan José Rodriguez Prieto.",
Torunn Gronbekk,"Scénariste de bandes dessinées. Romancier.

Auteur de bandes dessinées.

Dessinateur de bandes dessinées.",
Collectif,"Cette ""abréviation"" apparaît lorsqu&#39un livre a été réalisé par plusieurs auteurs.",
René Goscinny,"Pour célébrer l’anniversaire de la bataille de Gergovie, les Gaulois accueillent leurs nombreux amis et s’offrent en apéritif les malheureux légionnaires du camp fortifié de Babaorum. Là, ils libèrent Ocatarinetabelatchitchix, chef de clan corse prisonnier des Romains.
Ce dernier, plus fier encore qu’un Gaulois, prétend alors que les Corses sont le « cauchemar des romains ». Curieux de découvrir comment les Corses pratiquent le latin au quotidien, Astérix et Obélix décident de s’embarquer pour l’Ile de beauté, histoire de prouver qu’ils sont les seuls à donner d’authentiques sueurs froides aux Romains. Et ce sont encore ces derniers qui, malgré eux, vont arbitrer les débats…",
René Goscinny,"Jules César, décidé à repousser un peu plus loin les limites de son empire, prépare une véritable armada de légionnaires surentraînés pour envahir la Bretagne (aujourd’hui Grande-Bretagne).
Pour aider son cousin breton Jolitorax dans sa lutte contre les légions romaines, Astérix traverse la Mare Britannicum (Manche) accompagné d’Obélix et d’un tonneau rempli de « magique potion ».
Commence alors pour les deux amis un périple au pays où on parle à l’envers, on boit la cervoise chaude, on sert le sanglier bouilli et on joue au rugby (pour le plus grand plaisir d’Obélix) !
Heureusement, nos héros sauront résister à toutes ces épreuves, n’est-il pas ?",
Tui T. Sutherland,"Tui T. Sutherland a écrit une trentaine de romans pour tous les âges, sous différents noms de plume. Elle a aussi participé à la conception de la série best-seller ""La Guerre des clans"" en tant qu&#39éditrice et coauteur, et fait ainsi partie des six auteurs qui signent sous le pseudonyme Erin Hunter. Ces dernières années, Tui T. Sutherland s&#39est investie, seule, dans la création des ""Royaumes de Feu"", un univers de fantasy original et merveilleux, qui renouvelle le genre. Retrouvez Tui T. Sutherland sur son site Internet : www.tuibooks.com",https://m.media-amazon.com/images/I/41DlbQwMy5L._SY600_.jpg
Sylvia Douyé,"Sylvia Douyé, née en 1973, devient journaliste à Sciences & Vie Découvertes, E=M6, Mon Quotidien, Wapiti, après ses études de biologie. Elle débute la BD avec Malice et Azimut parue dans Sciences & Vie Découvertes, écrit des scénarios pour le multimédia (Adi, Les Petits Débrouillards), puis signe chez Casterman la série Les Zinzinventeurs qui compte aujourd&#39hui cinq volumes et a reçu le prix Jeunesse à Angoulême. Elle coscénarise également Les Guides en BD Junior et Les Guides au Féminin avec Jacky Goupil. Elle scénarise aussi la série Marie-Lune, dessinée par Yllya et récompensée par le prix Canal J en 2010. En 2015, elle reprend les rênes d&#39une mythique série d&#39heroic fantasy de Goupil et Crisse en lançant en compagnie de Fabio Lai Les Mondes de l&#39Épée de cristal. En 2018, elle lance une nouvelle série jeunesse, Sorceline. Récompensée par le prix des lecteurs du Journal de Mickey est acclamée par le public comme la critique.Réside en Île-de-France.


Paola Antista est une dessinatrice italienne. Diplômée de l’académie Disney, elle commence comme illustratrice pour des magazines, des livres scolaires ou des agences de pub. Elle donne régulièrement des cours de BD en école élémentaire et collège. En France, elle publie la série Chats !, dont six tomes sont parus. Elle a également dessiné deux tomes de la série Alix et Arsénou chez Clair de lune. À partir de 2018, elle travaille avec Sylvia Douyé sur la série Sorceline. Réside en Italie.",https://m.media-amazon.com/images/S/amzn-author-media-prod/ko2kq8k68qi3g327vbu8srsh0s._SY600_.jpg
SOBRAL-P,,https://m.media-amazon.com/images/I/01Kv-W2ysOL._SY600_.png
Tui T. Sutherland,"Tui T. Sutherland a écrit une trentaine de romans pour tous les âges, sous différents noms de plume. Elle a aussi participé à la conception de la série best-seller ""La Guerre des clans"" en tant qu&#39éditrice et coauteur, et fait ainsi partie des six auteurs qui signent sous le pseudonyme Erin Hunter. Ces dernières années, Tui T. Sutherland s&#39est investie, seule, dans la création des ""Royaumes de Feu"", un univers de fantasy original et merveilleux, qui renouvelle le genre. Retrouvez Tui T. Sutherland sur son site Internet : www.tuibooks.com",https://m.media-amazon.com/images/I/41DlbQwMy5L._SY600_.jpg
Lylian,"Scénariste et conteur, Lylian naît le 12 avril 1975. Enfant, il grandit vite au sein d’une réalité qui lui est à la fois étrange et étrangère. Alors Lylian l’enjolive, la réinvente pour se l’approprier entièrement et parvient à créer un univers qui lui ressemble, racé et empreint d’une sensible humanité. En 2004, les éditions Les Humanoïdes Associés s’intéressent à son travail et publient L’Éveil du Kurran, dessiné par Dune, one shot que Lylian coécrit avec Nori. En 2011, les éditions Clair de Lune publient sa nouvelle série jeunesse : Les Aventures débridées de Kenji le ninja créée avec un jeune dessinateur, Loïc Chevallier. En 2012, Lylian publie le tome 1 d’un western dur et classique, première pierre d&#39un diptyque dessiné par Augustin Lebon et mis en couleurs par Hugo Poupelin. Le premier tome du Révérend se voit complété d&#39un second en avril 2015, aux éditions Emmanuel Proust. Lorsqu’il est approché pour écrire l’adaptation de La Quête d’Ewilan, Lylian plonge littéralement dans l’univers sensible et grandiose de Pierre Bottero. Pour se faire, il collabore avec Laurence Baldetti et Loïc Chevallier. Le premier tome est publié aux éditions Glénat en 2013 et connaît un beau succès critique et public. L&#39aventure Ewilan est lancée. Depuis, il a investi cet univers à travers l&#39écriture d&#39une dizaine de tomes. Il est aussi à l&#39origine des séries La Famille Fantastique (2016), L&#39Aventure Fantastique (2018), Méto (2018) et plus récemment de Les Géants. Réside à Montreal.


Ingrid Chabbert est une autrice née en 1978 à qui l’on doit un roman jeunesse et de nombreux scénarios d&#39albums jeunesse et de bande dessinée. À ce jour, elle a publié plus d&#39une cinquantaine d&#39ouvrages. Capable de manier une grande palette de styles, elle parvient à s&#39adresser aux tout-petits (Un Crocodiles sur mon toit édité chez Kilowatt et dessiné par Lisa Blumen, Elma, une vie d&#39ours édité chez Dargaud, dessiné par Léa Mazet), aux adolescents (Les amis de Papiers édité chez Bamboo dessiné par Cécile) et aux adultes (Écumes et En attendant Bojangles, édités chez Steinkis et dessinés par Carol Maurel). Dans Larkia, son premier ouvrage publié chez Glénat, elle livre un récit post-apocalyptique libérateur et jubilatoire.


Paul Drouin fait sa première percée dans la bande dessinée en remportant le prix Arte-Glénat pour l’album Le Moustiquaire de Berlin, en 2006. Suivent trois albums : On the road (prix littéraire d’Annemasse), Blood Circus et Le fantôme de Canterville. Il participe à des collectifs, tels que Summer of the 80’s, Cicatrice de guerre et Brume. Il revient chez Glénat avec La Famille Fantastique, suivie en 2018 par L&#39Aventure Fantastique, deux aventures scénarisées par Lylian et colorisées par Lorien. Réside à Bordeaux.


Née en 1991, Charline Forns est diplômée de l&#39École supérieure d&#39arts appliqués Pivaut de Nantes. Elle a travaillé avec Fanny Ruelle, illustratrice de la série de romans Mes amis les chevaux, écrite par Sophie Thalmann pour la « Bibliothèque rose ». En 2017 elle assite Nicolas Bègue pour la mise en couleurs du tome 4 de la série Les Arcanes de la lune noire, chez Dargaud. En 2021, elle se consacre chez Dupuis à la série La Sentinelle du Petit Peuple, avec Véronique Barrau et Carbone où elle met en images les aventures d&#39Élina, jeune fille chargée d&#39être la protectrice de tous les êtres féeriques, garants de l&#39équilibre de notre Terre !


Lorien Aureyre est un coloriste qui a travaillé sur des séries comme Les Blagues de Toto,Aspic, détectives de l’étrange, La Mort de Staline et Zappa & Tika.",https://m.media-amazon.com/images/I/71gVOrNcTqL._SY600_.jpg
Albert Uderzo,"A l’occasion des célébrations du cinquantenaire d’Astérix, né le 29 octobre 1959 dans les pages du premier numéro de l’hebdomadaire Pilote, Albert Uderzo a imaginé un cadeau exceptionnel pour fêter ses héros et leurs millions de lecteurs à travers le monde !
Fidèle à l’esprit de caricature et d’autodérision des années Pilote, il a créé un album d’histoires courtes d’Astérix sur le thème de l’anniversaire, réunissant 56 pages de bandes dessinées inédites ! Tandis qu’Astérix et Obélix sont parti à la chasse aux sangliers dans la forêt entourant le Village, un grand nombre des 400 personnages des albums d’Astérix sont réunis par Abraracourcix pour préparer l’anniversaire des deux compères.
Au fil des pages, on découvre Astérix et leurs amis vieillis de 50 ans, un hilarant défilé de mode avec Obélix, des messages d’anniversaire signés de Numérobis, Falbala ou encore des pirates, un guide de voyage conçu à partir d’un texte de René Goscinny inédit en album, des parodies de pochettes de disques célèbres avec Assurancetourix, et même un incroyable Musée Gaulois imaginé par le devin Prolix.
Un bel album qui se conclut, une fois n’est pas coutume, non sur un banquet mais sur une magistrale ronde de plus de 60 personnages démontrant s’il en était besoin toute la virtuosité et la jeunesse du trait d’Albert Uderzo.",
PRIEST Christopher,,
René Goscinny,"Suite à une terrible crise de foie, Abraracourcix, le chef du village, se voit condamné à la plus cruelle des punitions pour un Irréductible Gaulois : la diète ! Mais Panoramix est catégorique, une cure dans la ville d’Aquae Calidae (Vichy) s’impose.
Pour Astérix et Obélix c’est une bonne occasion de faire un peu de tourisme dans le pays arverne. Mais César n’est pas loin, et recherche dans ces lieux historiques le bouclier de Vercingétorix pour défiler en triomphe devant des arvernes soumis. Pour Astérix, c’est une affaire d’honneur : il faut retrouver ce bouclier avant les troupes de Jules César !",
Kid Toussaint,"Bruxellois d&#39origine et journaliste de formation, Kid est un auteur prolifique qui ne cesse de se réinventer. Il a publié aujourd&#39hui pas moins de onze séries et plusieurs one-shots dont À l&#39ombre du convoi et Holly Ann (Casterman), 40 éléphants (Bamboo), Magic 7, Télémaque, Animal Jack, Absolument Normal ou encore Love Love Love (Dupuis). Au Lombard, après une première apparition dans la collection Signé avec Brûlez Moscou, il signe plusieurs séries jeunesses comme Elles, Masques ou plus récemment Les Héricornes. Ses séries mettent en évidence sa faculté de dépeindre la complexité des personnalités et la période compli­quée de l&#39adolescence, tout en laissant de la place à l&#39aventure et aux intrigues.

Bercée par les films d&#39animation et les mangas, la jeune Espagnole a choisi la voie de l&#39illustration en étudiant à l&#39ESDIP de Madrid où elle a été l&#39élève de Kenny Ruiz. Sa première bande dessinée, ¡Super Jaime!, créée avec Daniel Martínez de Leiva, a été appréciée du jeune public au vu de ses rééditions. Ensuite, pendant huit ans, Verónica a travaillé comme coloriste et développeuse visuelle dans des productions telles que Mortadelo y Filemón, Wonder Park, Luck, Spellbound (Skydance) et enfin dans le film Netflix My Little Pony, où elle a créé une partie du monde de Sunny et Izzy, point de départ de son amour pour les licornes, évidemment !",https://m.media-amazon.com/images/S/amzn-author-media-prod/ralkfa0k68b9gc2u55kqjbi7l8._SY600_.jpg
Tui T. Sutherland,"Tui T. Sutherland a écrit une trentaine de romans pour tous les âges, sous différents noms de plume. Elle a aussi participé à la conception de la série best-seller ""La Guerre des clans"" en tant qu&#39éditrice et coauteur, et fait ainsi partie des six auteurs qui signent sous le pseudonyme Erin Hunter. Ces dernières années, Tui T. Sutherland s&#39est investie, seule, dans la création des ""Royaumes de Feu"", un univers de fantasy original et merveilleux, qui renouvelle le genre. Retrouvez Tui T. Sutherland sur son site Internet : www.tuibooks.com",https://m.media-amazon.com/images/I/01Kv-W2ysOL._SY600_.png
Patrick Sobral,"Sujet : Les cinq membres de l&#39équipe des Légendaires, Danaël, Gryf, Razzia, Jadira et Shimy, doivent secourir le peuple elfique sur ordre du roi de Larbos. Mais ils sont en concurrence avec une autre équipe : les Fabuleux. Le roi des elfes décide d&#39organiser un bal pour accueillir les Légendaires et les Fabuleux...
Commentaire : Si l&#39histoire peut être lue indépendamment des tomes précédents, la fin n&#39est pas complète et le tome 4 est prévu pour octobre 2005.
Les illustrations et les personnages, très colorés, s&#39inspirent des dessins japonais (grands yeux, coiffures mangas, couleurs vives). Le langage, familier, est peu recherché. L&#39intrigue semble s&#39essouffler lorsque les Légendaires arrivent chez les elfes, c&#39est à dire assez rapidement dans l&#39album, il n&#39est alors question que du bal et des tenues à y porter. Quant à la collaboration entre les deux équipes, elle s&#39avère difficile et s&#39achève sur un air de trahison. -- www.choisirunlivre.com",https://m.media-amazon.com/images/I/01Kv-W2ysOL._SY600_.png
Paolo Campinoti,Dessinateur de bandes dessinées.,https://m.media-amazon.com/images/I/01Kv-W2ysOL._SY600_.png
Robert Kirkman,"Dessinateur de bandes dessinées.

Scénariste de bandes dessinées. Scénariste et producteur.",https://m.media-amazon.com/images/I/31KdZr+hO5L._SY600_.jpg
KING Tom,"Tom KING est un scénariste lauréat des prix Eisner, Harvey et Ringo. Il est connu pour son travail sur BATMAN REBIRTH, The Vision, OMEGA MEN, MISTER MIRACLE et SHERIFF OF BABYLON. Avant de devenir scénariste, KING a travaillé pour la CIA en tant qu&#39officier du centre de contre-terrorisme et a servi en Irak et en Afghanistan. Il vit actuellement à Washington D.C. avec sa femme et ses trois enfants. D&#39abord membre de la CIA, Tom KING fait en 2012 un virage inattendu dans sa carrière pour se lancer dans le monde des comics. Il en devient vite l&#39un des jeunes scénaristes les plus renommés, auréolé de sept Eisner Awards pour ses différents travaux. Très marqué par ses précédentes expériences professionnelles, il n&#39hésite pas à critiquer dans ses oeuvres l&#39idéologie américaine, tout en creusant la psychologie de ses personnages. Qu&#39il s&#39empare de Mister Miracle, de Supergirl, d&#39Adam Strange ou même de Batman, il apporte une dimension quasi psychanalytique, les poussant à l&#39introspection pour souligner les failles de ces héros aux pieds d&#39argile.",
