Nom,Description,Photo
Alan W. Watts,"""J&#39ai toujours été fasciné par la loi de l&#39effort inverse : quand vous essayez de rester à la surface de l&#39eau, vous coulez ; mais quand vous essayez de couler, vous flottez…"" (Watts)



Comment peut-on vivre dans un monde en perpétuel changement, où l&#39on ne se sent pas en sécurité et où la religion n’apporte plus de réconfort ? En comprenant que le bonheur réside justement dans cette impermanence et cette insécurité. En étant conscient de la vie, de l&#39expérience telle quelle est ici et maintenant, sans lui associer aucune idée ni jugement.

Un livre revigorant, par l&#39un des ""pères"" de la contre-culture américaine, qui figure en bonne place dans «Les Livres de ma vie» de Henry Miller.",https://m.media-amazon.com/images/I/01Kv-W2ysOL._SY600_.png
Robert Mercier,,https://m.media-amazon.com/images/S/amzn-author-media-prod/oda0i7087u40e9co9guij2r4fu._SY600_.jpg
Ariane Calvo,"Ariane Calvo est psychologue et psychothérapeute spécialisée en psychotraumatisme, résilience, autonomie émotionnelle et transitions de vie.",https://m.media-amazon.com/images/S/amzn-author-media-prod/i5voj5anhbsak34dnb9gn8eges._SY600_.jpg
Marie-France Hirigoyen,"Le harcèlement moral au travail est une des violences les plus destructrices qui soient. Le succès du premier ouvrage de Marie-France Hirigoyen, paru en 1998, démontre que chacun d&#39entre trous est un jour l&#39acteur ou le témoin de ce phénomène social dont on ignorait jusque-là l&#39ampleur. Depuis, les témoignages se sont accumulés, de multiples affaires ont éclaté, dans le public ou le privé, un débat permanent s&#39est instauré dans les médias entre psychologues, chef, d&#39entreprises, syndicalistes, parties prenantes de ce fléau ordinaire. Riche de quatre années d&#39expériences et de réflexions nouvelles, Marie-France Hirigoyen, dans ce second ouvrage paru sous le titre original ""Malaise dans le travail, harcèlement moral - Démêler le vrai du faux"", affine son analyse, poursuit son combat, afin de mieux comprendre et prévenir.",https://m.media-amazon.com/images/I/01Kv-W2ysOL._SY600_.png
Adrian Langenscheid,,https://m.media-amazon.com/images/S/amzn-author-media-prod/lie5lk65guc367au3df9k3e6bh._SY600_.jpg
