Nom,Description,Photo
Why? Because the nation-state is faltering and can no longer control economic forces.

In our view, this assumption verges on the absurd. To suppose that some specific new form of governance will emerge simply because another has failed is a fallacy. By that reasoning, Haiti and the Congo would long ago have had better government simply because what they had was so luminously inadequate.

Colchester&#39s point of view, widely shared among the few who think about such things in North America and Europe, utterly fails to take into account the larger megapolitical forces that determine what types of political systems are actually viable. That is the focus of this book. When the technologies that are shaping the new millennium are considered, it is far more likely that we will see not one world government, but microgovernment, or even conditions approaching anarchy.

For every serious analysis of the role of violence in determining thews by which everyone operates, dozens of books have been written about the intricacies of wheat subsidies, and hundreds more about arcane aspects of monetary policy. Much of this shortfall in thinking about the crucial issues that actually determine the course of history probably reflects the relative stability of the power configuration over the past several centuries. The bird that falls asleep on the back of a hippopotamus does not think about losing its perch until the hippo actually moves. Dreams, myths, and fantasies play a much larger role in informing the supposed social sciences than we commonly think.

This is particularly evident in the abundant literature of economic justice. Millions of words have been uttered and written about economic justice and injustice for each page devoted to careful analysis of how violence shapes society, and thus sets the boundaries within which economies must function. Yet formulations of economic justice in the modern context presuppose that society is dominated by an instrument of compulsion so powerful that it can take away and redistribute life&#39s good things. Such power has existed for only a few generations of the modern period. Now it is fading away.

Big Brother on Social Security

Industrial technology gave governments greater instruments of control in the twentieth century than ever before. For a time, it seemed inevitable that governments would become so effective at monopolizing violence as to leave little room for individual autonomy. Nobody at mid-century was looking forward to the triumph of the Sovereign Individual.

Some of the shrewdest observers of the mid-twentieth century became convinced on the evidence of the day that the tendency of the nation-state to centralize power would lead to totalitarian domination over all aspects of life. In George Orwell&#39s 1984 (1949), Big Brother was watching the individual vainly struggle to maintain a margin of autonomy and self-respect. It appeared to be a losing cause. Friedrich yon Hayek&#39s The Road to Serfdom (1944) took a more scholarly view in arguing that freedom was being lost to a new form of economic control that left the state as the master of everything. These works were written before the advent of microprocessing, which has incubated a whole range of technologies that enhance the capacity of small groups and even individuals to function independently of central authority.

As shrewd as observers like Hayek and Orwell were, they were unduly pessimistic. History has unfolded its surprises. Totalitarian Communism barely outlasted the year 1984. A new form of serfdom may yet emerge in the next millennium if governments succeed in suppressing the liberating aspects of microtechnology. But it is far more likely that we will see unprecedented opportunity and autonomy for the individual. What our parents worried about may prove to be no problem at all. What they took for granted as fixed and permanent features of social life now seem destined to disappear. Wherever necessity sets boundaries to human choice, we adjust, and reorganize our lives accordingly.

The Hazards of Forecasting

No doubt we put our small measure of dignity at risk in attempting to foresee and explain profound changes in the organization of life and the culture that binds it together. Most forecasts are doomed to make silly reading in the fullness of time. And the more dramatic the change they envision, the more embarrassingly wrong they tend to be. The world doesn&#39t end. The ozone doesn&#39t vanish. The coming Ice Age dissolves into global warming. Notwithstanding all the alarms to the contrary, there is still oil in the tank. Mr. Antrobus, the everyman of The Skin of Our Teeth, avoids freezing, survives wars and threatened economic calamities, and grows old ignoring the studied alarms of experts.

Most attempts to ""unveil"" the future soon turn out to be comic. Even where self-interest provides a strong incentive to clear thinking, forward vision is often myopic. In 1903, the Mercedes company said that ""there would never be as many as 1 million automobiles worldwide. The reason was that it was implausible that as many as 1 million artisans worldwide would be trainable as chauffeurs.""

Recognizing this should stop our mouths. It doesn&#39t. We are not afraid to stand in line for a due share of ridicule. If we mistake matters greatly, future generations may laugh as heartily as they please, presuming anyone remembers what we said. To dare a thought is to risk being wrong. We are hardly so stiff and useless that we are afraid to err. Far from it. We would rather venture thoughts that might prove useful to you than suppress them out of apprehension that they might prove overblown or embarrassing in retrospect.

As Arthur C. Clarke shrewdly noted, the two overriding reasons why attempts to anticipate the future usually fall flat are ""Failure of Nerve and Failure of Imagination."" Of the two, he wrote, ""Failure of Nerve seems to be the more common; it occurs when even given all the relevant facts the would-be prophet cannot see that they point to an inescapable conclusion. Some of these failures are so ludicrous as to be almost unbelievable.""

Where our exploration of the Information Revolution falls short, as it inevitably will, the cause will be due more to a lack of imagination than to a lack of nerve. Forecasting the future has always been a bold enterprise, one which properly excites skepticism. Perhaps time will prove that our deductions are wildly off the mark. Unlike Nostradamus, we do not pretend to be prophetic personalities. We do not foretell the future by stirring a wand in a bowl of water or by casting horoscopes. Nor do we write in cryptic verse. Our purpose is to provide you with a sober, detached analysis of issues that could prove to be of great importance to you.

We feel an obligation to set out our views, even where they seem heretical, precisely because they may not otherwise be heard. In the closed mental atmosphere of late industrial society, ideas do not traffic as freely as they should through the established media.

This book is written in a constructive spirit. It is the third we have written together, analyzing various stages of the great change now under way. Like Blood in the Streets and The Great Reckoning, it is a thought exercise. It explores the death of industrial society and its reconfiguration in new forms. We expect to see amazing paradoxes in the years to come. On the one hand, you will witness the realization of a new form of freedom, with the emergence of the Sovereign Individual. You can expect to see almost the complete liberation of productivity. At the same time, we expect to see the death of the modern nation-state. Many of the assurances of equality that Western people have grown to take for granted in the twentieth century are destined to die with it. We expect that representative democracy as it is now known will fade away, to be replaced by the new democracy of choice in the cybermarketplace. If our deductions are correct, the politics of the next century will be much more varied and less important than that to which we have become accustomed.

We are confident that our argument will be easy to follow, notwithstanding the fact that it leads through some territory that is the intellectual equivalent of the backwoods and bad neighborhoods. If our meaning is not entirely intelligible in places, that is not because we are being cute, or using the time-honored equivocation of those who pretend to foretell the future by making cryptic pronouncements. We are not equivocators. If our arguments are unclear, it is because we have failed the task of writing in a way that makes compelling ideas accessible. Unlike many forecasters, we want you to understand and even duplicate our line of thinking. It is based not upon psychic reveries or the gyrations of planets, but upon old-fashioned, ugly logic. For quite logical reasons, we believe that microprocessing will inevitably subvert and destroy the nation-state, creating new forms of social organization in the process. It is both necessary and possible for you to foresee at least some details of the new way of life that may be here sooner than you think.

Ironies of a Future Foretold

For centuries, the end of this millennium has been seen as a pregnant moment in history. More than 850 years ago, St. Malachy fixed 2000 as the date of the Last Judgment. American psychic Edgar Cayce said in 1934 that the earth would shift on its axis in the year 2000, causing California to split in two and inundating New York City and Japan. A Japanese rocket scientist, Hideo Itokawa, announced in 1980 that the alignment of the planets in a ""Grand Cross"" on August 18, 1999, would cause widespread environmental devastation, leading to the end of human life on earth.

Such visions of apocalypse make a plump target for ridicule. After all, the year 2000, while an imposing round number, would appear to be only an arbitrary artifact of the Christian calendar as adopted in the West. Other calendars and dating systems calculate centuries and millennia from different starting points. By the reckoning of the Islamic calendar, for example, A.D. 2000 will be the year 1378. As ordinary-sounding as a year can be. According to the Chinese calendar, which repeats itself every sixty years, A.D. 2000 is just another year of the dragon. It is part of a continuous cycle that extends millennia into the past. Yet there is more than theological investment in the year 2000. Its importance is undergirded not only by Christian tradition, but by the limitations of mid-century information technology. The so-called Y2K or year 2000 computer problem, a potentially devastating logic flaw in billions of lines of computer code, could approximate apocalyptic conditions by closing down essential elements of industrial society on the millennial midnight. Many computers and microprocessors use software preserved and recycled from the earliest days of computers, when memory space, at $600,000 per megabyte, was more valuable than gold. To save expensive space, the early programmers tracked dates with only the last two numbers of the year. This convention of employing two-digit date fields was carried over into most software employed in mainframe computers, and even found wide use in personal computers and so-called embedded chips, microprocessors that are used to control almost everything, from VCRs to car ignition systems, security systems, telephones, the switching systems that control the telephone network, process and control systems in factories, power plants, oil refineries, chemical plants, pipelines and much more. Thus, abbreviated into a two-digit field, the year 1999 would be ""99."" The trouble is what happens when 00 comes up for the year 2000. Many computers will read this as 1900. This may make it impossible for many unremediated computers and other digital devices to recognize the year 2000 in date fields.

The result will be a massive problem of data corruption that will provide an accidental illustration of a new potential for information warfare. In the Information Age, potential adversaries will be able to wreak havoc by detonating ""logic bombs"" that sabotage the functions of essential systems by corrupting the data upon which their functioning depends. As a military exercise, for example, you would not need to shoot down an airplane, if you could corrupt data crucial to its safe operation. Data corruption can do almost as much as physical weapons can to thwart the function of a modern society. That this has potentially far-reaching consequences should be obvious on reflection. For example, the Mail of London reported on December 14, 1997, that airlines around the globe were planning to cancel hundreds of flights on January 1, 2000 out of fear that air traffic control systems could fail. Potential problems include not only the air traffic systems, but also date-sensitive functions built into the airplanes themselves. According to Boeing, many airplanes will require Y2K remediation. Many devices may have a problem if they try to log an event on an invalid date. The fly-by-wire computer-controlled systems that operate airplanes may malfunction if they are programmed to conclude that crucial maintenance was last performed in the year 1900. They many even go into an error loop and shut down.

The potentially lethal feedback effects of a logic time bomb that closes down noncompliant control systems could make the turn of the millennium a memorable date for unpleasant reasons. Remember, you can be affected by many devices that go into an error loop and shut down even if you are lucky enough not to find yourself in midair when the new millennium begins.

You would be well advised to avoid an accident arising from non-Y2K-compliant pacemakers, or simply inebriated millennial revelers, because if the pacemakers shut down, the phone system might also, so the ambulance might never come. Unless you live in Brazil or Ukraine, you are used to picking up the telephone or turning on the car phone and automatically getting a dial tone. Happily, you seldom have to concern yourself with the technical details of how the telephone system operates. But it turns out that phone network switches and routers are highly date dependent. All connections are logged to a date and time, which is crucial to calculating call duration for billing. If you happen to make a one-minute call at 11:59:30 on December 31, 1999, and at 12:00:00 the system reads your call as having had a negative duration of more than 99 years, error loops and shutdown are possible. While long-distance companies are spending great sums to upgrade their switches to make them year 2000 compliant, and local service providers presumably are too, if even a few smaller companies fail to comply and go down, the whole network could be affected. You will be lucky to get a dial tone on January 1, 2000.

In the words of the Y2K expert Peter de Jager, ""If we lose the ability to make a phone call, then we lose everything. We lose electronic fund transfers, we lose trading, we lose branch banking."" And the follow-on consequences of Y2K failures could come to more than that.

Today, no one knows how pervasively crucial systems will crash because of the year 2000 problem. Embedded systems that cannot be reprogrammed but must be replaced if nonfunctional on a date-sensitive basis are found in cars, trucks, and buses built after 1976. (Perhaps you won&#39t be in an accident with vehicles driven by persons with noncompliant pacemakers, because their vehicles might not start.) Embedded systems are also widespread in all types of power plants, water and sewage systems, medical devices, military equipment, aircraft, offshore oil platforms, oil tankers, alarm systems, and elevators. While many assemblies of microprocessors perform no date-sensitive functions, they may nonetheless depend upon a clock, which may be Y2K sensitive, for their internal operations.

Mainframes and the Y2K Time Bomb

The large-scale command and control systems of government and major corporations that involve high transaction volumes on mainframe computers were the original focus of Y2K concern. Because they operate on big machines for which most software is decades old and mostly noncompliant, the original alarms about Y2K, first sounded by Peter de Jager early in the 1990s, have focused mainly on the need to upgrade operating systems for big, multiprocessing mainframes. Mr. de Jager voiced concern that there might not be enough programmers conversant with COBOL, the old mainframe language, to complete the necessary patches and repairs to date-sensitive code, even if every company and government agency with a vulnerable system had begun a crash program several years ago. Since this has not happened, and many operators of date-sensitive information systems have only just begun to assess their vulnerability, you can predict with a high degree of confidence that many mainframe systems will not be prepared to operate smoothly into the year 2000.

This is certainly a major concern because there is really no alternative to computer processing as the economy is now structured. Most businesses that are large enough to require a mainframe to handle their transactions are dependent upon transaction volumes that could not be managed with old-fashioned nineteenth-century paperwork systems. If such businesses were forced to revert to shuffling paper they could expect to complete only a fraction of their normal transaction volume. The revenue shock from such a drop-off in business would endanger the survival of all but the most highly capitalized companies.

Almost everything related to money -- invoicing, purchasing, and payroll systems, plus inventory controls and regulatory compliance -- would be fouled up. Huge quantities of data would be lost as computers crash or spew out false data in response to the Y2K problem. In some cases, it would actually prove a blessing if systems crash immediately rather than corrupting their data on a compounding basis until massive malfunction draws attention to the problem. What happens to files when a backup utility copies files originating on 07/04/99 to an update on 01/04/00? Who knows? Will the computer interpret a payment made on January 4, ""1900,"" for an insurance policy as a signal that the policy has been in default for a century, resulting in a canceled policy that is stricken from the file? Will banks and finance company computers seek to assess a hundred years of interest on loans that span the shift to the new millennium? Will your banks and brokerage firms retain accurate records of your account balances and give you timely access to your funds? These are just some of the interesting quandaries that you will confront because of the Y2K problem.

""This is potentially the most destructive part of the year 2000 problem. This isn&#39t the inconvenience part where your paycheck comes a few days late. This is the blood-in-the-streets part.""

Dr. Leon Kappelman, co-chair, Society for Information Management&#39s Year 2000 Working Group

Also high on your list of concerns should be what happens if the electricity goes off because of Y2K-related malfunctions. Without electricity, even most systems that are not Y2K-impaired will not function: your refrigerator, your freezer, perhaps even your source of heat. Y2K compliance issues could effect safety-related access and control functions at nuclear power plants. For example, personnel at nuclear facilities wear dosimetry devices that measure the amount of radiation exposure they receive while in the plant. These devices are analyzed regularly, with the data on exposure amounts maintained on a computer system that controls personnel access to the facility. Obviously, if the controlling computers fail, they will make a hash of all the elaborate controls designed to insure safe operation and guarantee proper maintenance. But, more importantly, a Nuclear Regulatory Commission memo notes that many ""non-safety-related, but important computer-based systems, primarily databases and data collection necessary for plant operations,"" are date sensitive.

The conventional generating plants are not less vulnerable to Y2K disruption. For one thing, coal-powered plants are susceptible to disruptions in the surface transportation system that brings the coal to the boilers. In the 1997-1998 winter heating season, operators of coal-fired electricity generation found themselves forced to reduce output in some instances because of a slowdown in rail deliveries of Western coal arising from the merger of the Southern Pacific and Union Pacific railway systems. The problem arose because of incompatibilities between the computer control and dispatch systems employed by the two railroads. According to a Union Pacific spokesman, integrating the two systems became a ""nightmare,"" in spite of the fact that Union Pacific Technologies has been considered an industry leader in developing computerized transportation control systems. As a result of the programming difficulties, the railroad was unable to accurately track the movements of its freight cars. The failure of Union Pacific to master the assimilation of Southern Pacific is a bad omen about what could happen when Y2K logic time bombs disrupt transportation, power generation, and other aspects of the economy.

The biggest worry about the electric grid, however, arises from the fact that the whole system is subject to sensitive monitoring and computer control to transfer electricity from areas of surplus generation to those with a deficit. This process must be carefully monitored by computer to prevent power surges and system failures. All the transfers of electricity are logged to time and date for duration, much like a telephone connection. While heavy-duty mechanical relays are used to make the connections, they are controlled by computer systems. These computer controls, essential for load balancing, may fail for the same reasons as the phone networks. In fact, the power load distribution-control systems in North America are networked together through T-1 lines and telephone microwave links. So if the phone network fails, you can expect the electricity to go down as well. And remember, as the experience in Canada in January 1998 confirms, once the electricity shuts down over a wide area, getting the system running again is a challenge. A blackout may last for an inconveniently long time.

Y2K and the Nuclear Arsenal

For modern economies to have the electricity turn off in the dead of winter would be disruptive and potentially health threatening, especially for those who depend upon electric heat and medical equipment. Yet the worst case scenario is even worse. According to John Koskinen, who heads President Clinton&#39s Y2K Conversion Council, U.S. military arsenals may cease to function on the stroke of midnight, December 31, 1999. While indicating that he does not wish to touch off undue alarm, Koskinen adds, ""It needs to be worried about."" One concern about nuclear missiles ""is if the data doesn&#39t function and they actually go off.""

Of course, this concern would apply with equal or greater force to Russian nuclear missiles. Russia&#39s bankruptcy has made upgrades for Y2K compliance even more problematic than in the United States. And there is evidence that Russia is not yet taking Y2K conversion seriously. While one would pray that no accidental launches would occur, there should be little doubt that the turn of the year 2000 has a potential for aggravating global insecurity if for no other reason than that military communications systems in many countries may not function normally. As Koskinen puts it, ""If you&#39re sitting in a country and suddenly you can&#39t quite figure out exactly what&#39s happening, and your communications don&#39t work as well, you get even more nervous."" So put that on your list of Y2K worries. The logic time bomb could precipitate the launch of genuinely explosive bombs -- a fact that highlights the danger from information warfare to centralized command and control systems.

If terrorists wish to strike any centralized system, they may pick December 31, 1999, as the date for action because it will be a time of maximum vulnerability of many systems. Not only will communications be strained at best, with the possibility that electricity may fail, vehicles may hot start, police, fire, and ambulance 911 service may not work, and so on, but many other functions you probably take for granted, such as air traffic control, may cease to function. No power means no water from the tap. Sewage systems would fail. Traffic lights could turn off. Within a few hours of a genuine breakdown in the transportation system, food in grocery stores would be shopped out. (Or looted.) On the basis of recent experience in American cities, you could suppose that no power, no water, no heat for many, no light, and fragmented communications with emergency services, including police and fire, all add up to no civilization. While no one can be sure what the impact of the Y2K problem may be, it could extend to looting and rioting in the streets, especially if it becomes known that there could be widespread failures to issue payroll, welfare and pension checks.

""We shall not be what we have been, but we shall begin to be other.""

Joachim de Fiore

