Nom,Description,Photo
Mme Anne Reymonet-Valers,,
Guilhem Cayzac,"Essénien depuis près de 30 ans, Guilhem Cayzac s’est orienté vers la naturopathie après une carrière dans l’édition et le journalisme. Il a découvert l’apport incroyable que pourrait constituer le savoir essénien appliqué aux thérapies de toutes sortes. Il prend du temps pour transmettre à tous les thérapeutes, les riches apports que constitue la sagesse essénienne.",https://m.media-amazon.com/images/S/amzn-author-media-prod/naenbqa4qrdecbih7787mh4o5k._SY600_.jpg
Franck Ribaldy,,
Evelyn Schneider-Mark,,
Weiming Shi,,
Olda BUCH,,https://m.media-amazon.com/images/S/amzn-author-media-prod/8t8eonh0975853s5rvfuf1ehk0._SY600_.jpg
Dr. Mindy Pelz,"If you’ve grown tired of one-size-fits-all health advice that leaves you feeling disappointed, this book will feel like a breath of fresh air. Dr Mindy Pelz will help you create a plan that’s unique to your body and your goals. She combines ground-breaking research, powerful stories and a clear guide to greater health. ― Jessica Ortner, New York Times bestselling author of The Tapping Solution

Dr Mindy is the Warren Buffet of fasting. ― Jesse Itzler, entrepreneur, New York Times bestselling author, endurance athlete and an owner of the Atlanta Hawks

I have never met someone that has more respect for the body and its innate intelligence to heal than Mindy. Her reverence for the body is met with an intense passion for helping people learn how to tap into it through the timing of fasting, eating and detoxing. This way of living is the way of the future for all women if they want to truly thrive. ― Danica Patrick, entrepreneur and former race car driver

Fast Like a Girl is an amazing book that is both inspiring and informative. It’s a wealth of knowledge for any woman who wants to reclaim their health. It will leave you feeling motivated and ready to take on the world. ― Megan Ramos, New York Times bestselling author, co-founder and CEO of The Fasting Method

Fasting is an incredible tool for longevity and healing. With Fast Like a Girl, women finally have a go-to manual designed specifically to their unique hormonal needs. ― John Gray, New York Times bestselling relationship author of Men Are from Mars, Women are from Venus

In her ground-breaking book, Fast Like a Girl, Dr Mindy Pelz provides a much-needed manual on fasting specifically for women. ― Elle Macpherson, founder of Wellco, humanitarian, supermodel and actress

At a time when all of us are looking for ways to improve our health and vitality, Dr Mindy Pelz offers great advice. This book is about fasting, but also so much more. It’s about our womanhood, our health and our lives. ― Marianne Williamson, four-time New York Times bestselling author

A much-needed fasting resource for women! ― Sara Gottfried MD, New York Times bestselling co-author of The Hormone Cure

Fasting is such an incredible tool for our mental and physical health. Dr Mindy is my go-to for fasting! She’s teaching women like me how to tap into our innate intelligence while minding our hormones. ― Alexandra Elle, author of After the Rain and How We Heal

It’s possible to say goodbye to being tired and hungry all the time. Fast Like a Girl will teach you how long and when to fast so your hormones will support you instead of working against you. Welcome to getting your brain back and having to buy new, smaller pants! ― Dave Asprey, author of four New York Times bestselling books, including Fast This Way

Fasting is not a one-size-fits-all approach. Dr Mindy Pelz is one of the leading experts in this area of fasting for women, and she truly understands how fasting is different for both men and women. If you’re a woman and want to get the most out of fasting, then this is the book for you. ― Drew Manning, creator of TV show Fit2Fat2Fit and New York Times bestselling author of Fit2Fat2Fit

Fasting is such a powerful healing tool. In Fast Like a Girl, Dr Mindy doeas an excellent job of helping women understand how they can use fasting to power up their hormones, as well as providing tips and strategies that are easy to follow and tailored specifically for women. ― Josh Axe DC, DNM, CNS, founder of Ancient Nutrition and DrAxe.com, bestselling author of Keto Diet, The Collagen Diet and Ancient Remedies

Wow. Didn’t think Dr Mindy could achieve the same brilliance as she put forth in The Menopause Rest – but she did – going above and beyond. This should be required reading for any and every woman on the planet wanting to bring metabolic flexibility, vitality and longevity to their life! Packed with good science, resources and inspiration, this will be the gift that keeps on giving. ― Nasha Winters ND, FABNO, bestselling co-author of The Metabolic Approach to Cancer

Dr Mindy has written the guide of all guides for women looking to improve their health by adding fasting into their life. Most importantly, she plans it all around their menstrual cycle.
As a women&#39s health and hormone doctor, I can&#39t recommend this book and her step-by-step process enough!
― Carrie Jones ND, FABNE, MPH, head of Medical Education, Rupa Health

When it comes to health, there’s no cookie-cutter approach. This is especially true with fasting. In Fast Like a Girl, Dr Mindy Pelz does a masterful job of outlining why women should practice fasting differently than men. Mindy provides practical steps backed up by science on how women at different stages of life can apply fasting strategies to balance hormones, reset their metabolism and lose weight without having to deprive themselves. If you are wondering how to apply fasting for your unique hormonal needs, this is the book for you! ― Ben Azadi, bestselling author of Keto Flex

The nutrition and integrative health fields are increasingly recognizing the power of short- and long-term fasting in protocols for health and disease. However, too often the influence of cyclical hormonal patterns on metabolism and fasting physiology is overlooked. Dr Mindy outlines here a strategy for optimizing the healthful impact of fasting in coordination with your hormonal cycles. ― Zach Bush PhD, physician (internal medicine, endocrinology and hospice care)

Dr Mindy is such a wonderful women&#39s health advocate by empowering women, at all stages, to embrace their physiology and to stop apologizing for our own unique needs! Fasting is one of many tools that can help us thrive irrespective of our life stage! ― Cynthia Thurlow NP, author of Intermittent Fasting Transformation

Wow! How refreshing! Dr Mindy Pelz’s book weaves patient stories with ancestral and nutritional research about the science of fasting and tied it together with clear steps for women to follow. Her words of truth delivered spot-on advice. I found myself saying, ‘Oh, I’m stealing that.’ A wonderful read! ― Annette Bosworth MD, founder of Dr Boz, owner of Meaningful Medicine and author of Anyway You Can and KetoContinuum

Fast Like a Girl is a must-have-guide for resetting your hormones, ageing beautifully and looking and feeling fantastic. But even more importantly, following Dr Mindy’s guidance can have a profound impact on generations to come because fasting is the ultimate detox. Buy a copy for your daughters and granddaughters, teach them to Fast Like a Girl and help put an end to this epidemic of hormone imbalances, infertility and – ultimately – on the chronic illnesses in our children. ― Donna Gates M Ed, ABAAHP, internationally bestselling author and founder of The Body Ecology Diet

Much like with exercise, fasting is an incredible, free healing tool that everyone can benefit from. What makes this book so unique is that women now have a fasting manual that will help customize food and fasting to match the needs of their hormones. In Fast Like a Girl, Dr Mindy not only makes the science of fasting easy to understand but lays out a whole new health paradigm for women and men to improve their lives in a myriad of ways. ― Tony Horton, bestselling author and creator of the popular P90X workout series

Do check out Mindy’s fabulous book, Fast Like A Girl. I’ve been recommending it to everyone and it’s a great resource for anyone interested in fasting as a tool for health. ― Dr Rupy Aujla, Sunday Times bestselling author, doctor and host of The Doctor&#39s Kitchen podcast",https://m.media-amazon.com/images/S/amzn-author-media-prod/c3rm0gpcu988fv132cbfm9afc4._SY600_.jpg
Eric Riquet,,https://m.media-amazon.com/images/I/01Kv-W2ysOL._SY600_.png
Nicolas ORLER,,https://m.media-amazon.com/images/S/amzn-author-media-prod/bu1ncmb9u0fjlc7cj28pf1mfvm._SY600_.jpg
Olivier Remole,,https://m.media-amazon.com/images/I/01Kv-W2ysOL._SY600_.png
Evelyne Jouval,,https://m.media-amazon.com/images/I/B1Y9ujoo8WS._SY600_.jpg
Ibrahim Karim PhD Dr Sc,,
Franck Ribaldy,,
Gisele Bündchen,"Introduction

Health is true wealth.

I have learned this the hard way.

My experiences have taught me that feeling good both mentally and physically is my greatest asset, because when life is difficult, it’s my health that holds me up. Being strong is something I am proud of and work hard at, and what I eat and how I eat affects my quality of life and my health more than almost anything else I do. I find happiness, contentment, and wellness through food, and I take so much satisfaction and joy in treating my body kindly. Eating nutritious food nourishes my body and feeds my soul.

When it comes to the food I love most, I turn to simplicity. I want all the benefits of real, nutritious food with no fillers or fake stuff. I also don’t want restrictions or complications from diets. Luckily, simple food—like fruits, vegetables, smoothies, occasional meat and fish—usually tastes best and is the easiest to prepare, too. Not to mention, it gives me joy. I don’t just eat to satisfy my hunger or for instant gratification—though of course both are happy by-products. Most important, I’ve found that eating simply provides me with happiness, health, energy, and well-being. This plus good sleep and a daily exercise routine improves my bodily functions, from easy digestion to physical strength to a clear mind. Food is the fuel that drives us. Eating delicious, organic, natural foods and sharing meals with my family where we all feel fully nourished and cared for are deeply meaningful to me. It makes me feel whole.

In life, you reap what you sow. If you give love, you will receive love. And if you eat well and take control of what you choose to put in your body, you will feel strong, mentally resilient, and comfortable in your own skin. But it’s a choice. It’s up to you. The consequences are yours alone, good or bad. Taking responsibility for my health changed my life, and I’m grateful for the courage and discipline it took to get to this point. Today I feel stronger than I ever did before. It was a long road to get here, but I’m so happy that here is where I am. I surround myself with positive energy. I am loving to myself. I really believe that we become what we think and what we eat.

Here is my story. 


Gisele",https://m.media-amazon.com/images/S/amzn-author-media-prod/umos8pfvrdgsm0543ajruog3mb._SY600_.jpg
M Alexandre Auffret,,https://m.media-amazon.com/images/I/61TpmGl02FL._SY600_.jpg
M Jean Fidèle Angius,,
,,
Franck Ribaldy,,https://m.media-amazon.com/images/S/amzn-author-media-prod/rg1o34mfrqmt111tfg0q15nghr._SY600_.jpg
Nicolas ORLER,,https://m.media-amazon.com/images/S/amzn-author-media-prod/bu1ncmb9u0fjlc7cj28pf1mfvm._SY600_.jpg
Yéléna C. Kentish,,
M Jean Fidèle Angius,,
Maureen Keane,"Cherie Calbom, M.S., has been known for her work with juicing and health for more than a decade. She has appeared regularly on QVC for the past eight years with the JuiceLady juicer, the Salton Juiceman juicer, and the George Foreman grills. She is also the author of eleven books on health and nutrition.",
Jeru Kabbal,"""Every so often, a teacher and a book like this appears as a gift to all of us. Finding Clarity is a wonderfully clear roadmap for growing your soul by breaking free of unconscious patterns.""
—Dr. Ken Druck, author of The Secrets Men Keep

""Jeru offers depth, clarity, and practical suggestions and dares you to relax while traveling on an exceptionally wondrous journey—your own life. Finding Clarity represents a breakthrough opportunity to encounter yourself anew and move beyond unconscious, non-productive behavior.""
—Komala Lyra, author of On the Way to NowHere",
Loïc Ternisien,"Scientifique de formation, Loïc Ternisien s&#39est reconverti comme naturopathe au Canada. Il est spécialisé en aromathérapie et en herboristerie. Il consulte au sein de son cabinet et en téléconsultation en France et au Québec, mais est également formateur, conférencier, auteur à succès et créateur de divers supports d&#39apprentissage. Il diffuse ses connaissances sur les réseaux sociaux depuis 10 ans. Son but est de réintroduire les connaissances fondamentales pour que chacun puisse être plus autonome et avoir un rôle actif sur sa santé.",
Olivier Remole,,https://m.media-amazon.com/images/I/01Kv-W2ysOL._SY600_.png
Eugène Authier,,
Olivier Remole Editions,,https://m.media-amazon.com/images/I/01Kv-W2ysOL._SY600_.png
Nicolas ORLER,,https://m.media-amazon.com/images/S/amzn-author-media-prod/bu1ncmb9u0fjlc7cj28pf1mfvm._SY600_.jpg
Collectif,,https://m.media-amazon.com/images/I/01Kv-W2ysOL._SY600_.png
Izabella Wentz PharmD.,,https://m.media-amazon.com/images/S/amzn-author-media-prod/e0k1onmpobpnc73nd54glg4kqf._SY600_.jpg
Olivier Lucas,,
Nicolas ORLER,,https://m.media-amazon.com/images/S/amzn-author-media-prod/bu1ncmb9u0fjlc7cj28pf1mfvm._SY600_.jpg
Dr. Linnea Passaler,"Revue de presse
“Heal Your Nervous System is a thoughtful exploration of nervous system dysregulation and its profound impact on health. Dr. Linnea Passaler offers a comprehensive approach, rooted in scientific research. This is a must-read for those seeking a deeper understanding of mind-body medicine.”
  ― Dr. Amy Shah, author of I’m So Effing Hungry

“This well-researched guide explores the critical link between mental and physical health. The 5-stage roadmap, based on cutting-edge neurobiology and sensitivity research, is highly relevant for medical professionals seeking a holistic understanding of mind-body health, and for patients seeking relief from chronic conditions.”
― Sara Gottfried MD, New York Times bestselling author of The Hormone Cure

“Heal Your Nervous System is a sensitive and sensible owner’s manual for your body and brain. Dr. Passaler helps you to better understand and manage your style of dealing with stress in a way that combines both acceptance of who you are and wisdom in getting to where you want to go.”
― David Spiegel, M.D., Willson Professor and Associate Chair of Psychiatry & Behavioral Sciences, Stan

""Dr. Linnea&#39s book is going to tackle one of the very core issues within our modern society that stops us from living a fulfilling life. Her book provides the perfect amount of science to help the reader understand their physiology, whilst also being an enjoyable read. The tools she provides are undoubtedly going to help a lot of people. Everyone needs to know about nervous system regulation and Dr. Linnea has done a fantastic job at laying it down for the world.""
― Nicole Vignola, neuroscientist and author of Rewire

""Assured, bursting with well-researched and effective insights, accessibly written, Heal Your Nervous System is a resource for anyone seeking to learn effective and easy-to-adapt tools towards finding calm, clarity, purpose, connection and, most of all, mind-body integration! I can personally attest that Dr. Linnea is a passionate, masterful ‘cognoscenti’ of the well-regulated nervous system. Whether you’re looking to adapt a less stressful response to life’s demands, uncover a core purpose or forge more soothing connections with loved ones this book will help you embark on a transformative journey. The Chapters on Connection and Expansion were my particular favorites!"" 
  ― Josh Korda, Buddhist Pastor, author of Unsubscribe
Quatrième de couverture
Relieve anxiety, burnout, feelings of overwhelm, and chronic physical symptoms by healing your dysregulated nervous system with this 5-stage roadmap based on the latest science.

Dr. Linnea Passaler has helped thousands globally in her digital health program address a wide range of symptoms associated with nervous system dysregulation―from mental symptoms, including anxiety, burnout, and brain fog, to physical symptoms, such as digestive issues, chronic inflammation, and fatigue. In Heal Your Nervous Sy
En lire plus",https://m.media-amazon.com/images/S/amzn-author-media-prod/7l27mssqpgccc2s2ohh8g9t738._SY600_.jpg
Laurel Parnell,,https://m.media-amazon.com/images/I/B1PT9IXH9ES._SY600_.jpg
Émilie Sky,,https://m.media-amazon.com/images/I/01Kv-W2ysOL._SY600_.png
Flora Douville,,
Olivier Remole,,https://m.media-amazon.com/images/I/01Kv-W2ysOL._SY600_.png
Frédéric Saldmann,"Praticien attaché des Hôpitaux de Paris, cardiologue, nutritionniste, spécialiste de médecine prédictive internationalement reconnu, le Dr Frédéric Saldmann est l’auteur de plusieurs best-sellers.",https://m.media-amazon.com/images/I/01Kv-W2ysOL._SY600_.png
Marco Caldi,,https://m.media-amazon.com/images/S/amzn-author-media-prod/689j3s5f411k25bd2pluufm5d3._SY600_.jpg
Pierre Meunier,"Pierre Meunier est praticien en Énergique Traditionnelle Chinoise depuis plus de dix ans, diplômé de l&#39école SHEN, praticien Access Bars® et naturopathe formé au CNFDI.
Son objectif est d&#39apporter une ouverture et des éléments de réponse à des problématiques parfois non résolues par la médecine classique, notamment grâce aux remèdes naturels et à l&#39approche holistique sur le corps et l&#39esprit.",
John E. Sarno MD,"""He has cured thousand....I recommend this book highly.""―Benjamin J. Saddock, M.D., professor and vice chairman, Department of Psychiatry, NYU Medical Center

""My life was filled with excruciating back and shoulder pain until I applied Dr. Sarno&#39s principles, and in a matter of weeks my back pain disappeared. I never suffered a single symptom again....I owe Dr. Sarno my life.""―Howard Stern",https://m.media-amazon.com/images/I/519387dM-zL._SY600_.jpg
Dr Robert E. Svoboda,"Le Dr Robert E. Svoboda est certainement l&#39un des plus importants experts occidentaux en Ayurvéda. Prakriti, Votre Constitution Ayurvédique a été publié pour la première fois en 1989. C&#39est un travail décisif sur le concept de l&#39homéostasie individuelle. La profonde érudition que l&#39auteur a reçue en Inde pendant une dizaine d&#39années de son mentor tantrique rend cet ouvrage unique et essentiel.",https://m.media-amazon.com/images/I/01Kv-W2ysOL._SY600_.png
Robert Chu PhD,,
Bessel van der Kolk,"Revue de presse
An astonishing and important book. The trauma Bible. I cannot recommend it enough for anyone struggling with...well...anything -- Tara Westover

Fascinating, hard to put down, and filled with powerful case histories. . . . the most important series of breakthroughs in mental health in the last thirty years -- Norman Doidge, author of The Brain That Changes Itself

A gripping bestseller about where trauma goes, and its disastrous effects on both individuals and societies. Deeply interesting. ― The Times

Nobody can stop talking about this book right now . . . you might want to listen -- Maddie Bender ― Men&#39s Health

Dr. van der Kolk&#39s masterpiece combines the boundless curiosity of the scientist, the erudition of the scholar, and the passion of the truth teller -- Judith Herman, M.D., author of Trauma and Recovery

Everyone should read this book -- Nigella Lawson

A seminal book that outlines the author&#39s pioneering work -- Thea Jane May ― Vogue

Draws on 30 years of experience to argue powerfully that trauma is one of the West&#39s most urgent public health issues... Packed with science and human stories ... van der Kolk has a lot to say, and the struggle and resilience of his patients is very moving ― New Scientist

Fundamental in understanding how our physical self is connected to all the things we go through and beyond -- Gemma Cairney

A masterpiece of powerful understanding and brave heartedness, one of the most intelligent and helpful works on trauma I have ever read. . . a brilliant synthesis of clinical cases, neuroscience, powerful tools and caring humanity, offering a whole new level of healing -- Jack Kornfied, author of A Path With Heart

Incredible -- William Leith, &#39Books of the Year&#39 ― Evening Standard
Quatrième de couverture
The effects of trauma can be devastating for sufferers, their families and future generations. Here one of the world&#39s experts on traumatic stress offers a bold new paradigm for treatment, moving away from standard talking and drug therapies and towards an alternative approach that heals mind, brain and body.
En lire plus",
Tracey Meyers,"Tracey Meyers is a Clinical Psychologist, a yoga therapist and an advanced yoga teacher and has contributed to publications such as Yoga and Science in Pain Care, edited by Neil Pearson, Shelly Prosko and Marlysa Sullivan and Yoga Therapy Foundations, Tools, and Practice, edited by Laurie Hyland Robertson and Diane Finlayson.. She is Assistant Professor at Department of Psychiatry, Yale University and Adjust Professor at both Maryland University of Integrative Health and University of Hartford. She also leads nationally recognized mindfulness programs and retreats, and Yin Yoga Teacher Training Immersions for yoga teachers, yoga therapists, and mental health professionals.",https://m.media-amazon.com/images/S/amzn-author-media-prod/bt0hbjekb68jqb9dj8bv0nbkll._SY600_.jpg
LUC BISSMAN,,
Isabel S Churchill,,https://m.media-amazon.com/images/S/amzn-author-media-prod/qvog9obcugf9adqo3qd7mf5og._SY600_.jpg
Aliana Kim,"Aliana Kim is a licensed massage therapist, registered yoga teacher, biologist, CrossFit trainer, CrossFit, and has completed all four levels of Kinesio Tape practitioner training. In her spare time she enjoys lifting, swimming, hiking, snowboarding, adventure racing and reading. Aliana currently resides in Las Vegas, NV.",https://m.media-amazon.com/images/I/51tAOCiAEZL._SY600_.jpg
Lise Bourbeau,"Author Lise Bourbeau is the founder of Listen to Your Body, an international school dedicated to personal growth and well-being. It is recognized by the Qubec government as an educational institution, accredited by the Human Resources and Social Development center of Canada. Since 1982, Lise Bourbeu has been helping people advance their personal development through workshops and study. She is the author of 25 books which have been tranlated into more than 20 languages.",https://m.media-amazon.com/images/I/71RyiOqLpUL._SY600_.jpg
Dr Michel Geeraert,,
Isabelle de Séréville,,
Marc Isenschmid,"Né en 1974, Marc Isenschmid exerce son métier de thérapeute et d’enseignant en médecines naturelles en Suisse. Éclectique et autodidacte, il montre dès son plus jeune âge de l&#39intérêt pour de nombreux domaines. Passionné par l’écriture, il suit une formation de journalisme à l&#39Université de Fribourg. Puis il se consacre à la conception de sites internet, en développant des compétences en design et en informatique.   À 25 ans, après avoir vécu l’expérience de guérisons étonnantes lors d’un traitement en kinésiologie, il décide de réorienter sa carrière vers les thérapies naturelles. Il se forme dès lors à différentes techniques thérapeutiques et après plusieurs années d’expérience, conçoit sa propre méthode de guérison et de développement personnel. Cette méthode se nomme « Portes de Conscience ». Depuis il enseigne cette méthode au travers de différents cours et stages en parallèle à son activité de thérapeute. Marc vit en couple et a deux enfants. ",https://m.media-amazon.com/images/S/amzn-author-media-prod/t4uk99k0jbi7ov7mehl8dqktaq._SY600_.jpg
