Nom,Description,Photo
In retaliation for Correa’s actions, Standard and Poor’s Rating Services and Fitch Ratings slashed Ecuador’s credit score. They were determined to send a signal that any country that refused to honor World Bank and other US debt claims, that did not buy into the EHM strategy, would be punished. Ecuador had to be brought to its knees.

But Correa was not about to give in. He recognized that modern capitalism was based on using the EHM strategy to beat the competition and attain monopolistic power. He saw, sooner than most, that the position of the United States as top competitor was being seriously challenged. The American monopoly, the empire, was showing signs of collapse. The “Chinese dragon” had woken up and it did not give a damn about rating services.

China came to Ecuador’s rescue with a $1 billion loan, followed quickly by another billion. Ecuador’s credit ratings immediately rose. Correa had rejected neoliberalism and the Washington Consensus; he had successfully turned to Chinese bankers and their promises to expand trade throughout Latin America and with the rest of the world. To benefit from this New Silk Road, the country had to build up its electrical systems, highways, ports, and airports. All of this, along with the new schools and hospitals, would seal Correa’s legacy as the leader who had used the sea of oil buried beneath Ecuador’s rain forest as collateral to bring the nation out of poverty and set an example that offered hope to other countries.

Correa leaned against the railing and studied the crowd of onlookers that continued to gather below him; they were waving at him, smiling and shouting greetings, and continuing to snap photographs. He had done a good job. In addition to the new constitution and the Ministry of Buen Vivir, he had brought unprecedented political stability to a country that had experienced seven presidents during the ten years before him and suffered from a long history of coups and military dictators. He had followed in the footsteps of his hero, President Roldós, during his first term by reining in foreign oil companies. In his second term, he had built the infrastructure and developed the social services he thought were critical to the well-being of his people. Ecuador had experienced continual economic growth, even during the 2008–2009 international financial crisis. The country’s minimum wage had more than doubled and become one of the highest in Latin America. More than a million people had been lifted out of poverty. All this under his leadership. He raised a hand and gave a thumbs-up to the people in the plaza. The Sino-Ecuador partnership had paid off.

But questions hounded Correa. Reporters kept asking, “Do you think the Chinese will be less exploitative than the Americans?” The reporters brought up the violence against the minority Uyghurs, Hong Kong and Tibet, the extension of Beijing’s imperialistic activities in the South China Sea and toward Hong Kong and Taiwan, and its dismal record around freedom of speech, gender, and other human rights issues. And it wasn’t just the reporters who asked those questions. Opposition politicians asked them. Correa’s own advisors asked them. He himself asked them. And yet, he wanted to believe in China’s stated commitment to spreading global trade. The New Silk Road idea contrasted sharply with Washington’s focus on bilateral US–Ecuador projects and trade. In addition, China’s President Xi had assured him that he would not use debt to impose Beijing’s will on Ecuador. Besides, there was no backtracking. Correa had committed himself to reversing the excessively pro-American policies of his predecessors.

By the end of 2015, Correa had accepted nearly $6 billion from China, around 30 percent of Ecuador’s external debt. And it kept growing. The New York Times reported:

Chinese banks are in talks to lend $7 billion for the construction of an oil refinery, which could make Ecuador a global player in gasoline, diesel and other petroleum products.

Across the country in villages and towns, Chinese money is going to build roads, highways, bridges, hospitals, even a network of surveillance cameras stretching to the Galápagos Islands. State-owned Chinese banks have already put nearly $11 billion into the country, and the Ecuadorean government is asking for more.

Ecuador, with just 16 million people, has little presence on the global stage. But China’s rapidly expanding footprint here speaks volumes about the changing world order, as Beijing surges forward and Washington gradually loses ground.

One of China’s loans was used to pay the Chinese Sinohydro Corporation to construct a massive hydroelectric dam that promised to generate more than a third of Ecuador’s electricity, stimulate business and industry, produce hundreds of thousands of jobs, and expand international trade. Correa knew that electricity was the key to Ecuador’s future development. This particular deal seemed like frosting on the president’s cake.

But the costs mounted. China bailed Ecuador out with more funds. Again and again. Debt piled on debt.

Then everything went terribly wrong—all at once.
Revue de presse
Praise for John Perkins’s books:
 
“John Perkins’s books have helped me better understand something that has been puzzling me for a long time: Why have so many resource-rich countries in the developing world remained steadfastly poor? The answers he gives are both complex and uncomfortable, and none of us in the first world can abrogate responsibility easily.”
—Sting

“In this brilliantly informative third edition of Confessions, John Perkins draws on his extraordinary personal experience to reveal how China has used lessons from the US economic hit man assault on people and Earth to best the United States in what ultimately will be a mutually fatal competition to be the last global superpower on a dead Earth. Let us heed his call to the people and leaders of both countries to put that past behind us and join with people everywhere to create an ecological civilization free of superpower competition and dedicated to the well-being of Earth and all its people.”
—David Korten, author of When Corporations Rule the World and The Great Turning

“This eloquent book inspires us to create a new reality of what it means to be human in this magnificent planet.”
—Deepak Chopra, author of Perfect Health, You Are the Universe, and other bestsellers

“A highly readable—and shocking—book. It&#39s difficult to accept that United States and corporate policies can be so brutal and greedy, but knowing John Perkins personally, I have come to understand the importance of disclosing this uncomfortable truth. Only by confronting the truth can we eventually create a world that works for all of us. John Perkins inspires us to get up and take action to create a more just and equitable world.” 
—Jack Canfield, co-creator of the Chicken Soup for the Soul series

“A sweeping, bold assault on the tyranny of corporate globalization, full of drama and adventure, with devastating stories of greed run wild.  But Perkins is undaunted, and offers imaginative ideas for a different world.” 
—Howard Zinn, author of A People&#39s History of the United States
 
“Like finding the key that unlocks a mystery. It simultaneously confirms your suspicions and inspires you to hope. I wouldn&#39t say it&#39s good news, but it&#39s important news.... about where America&#39s gone wrong, and what it will take for us to make things right.
—Marianne Williamson, author of A Year of Miracles, A Politics of Love, and other bestsellers

“A significant contribution to the new universal way of searching for innovative and better approaches to coexistence.”
—Dr. Rafael Correa Delgado, President of Ecuador (2007-2017)
 
“Resonates with my experiences of the brutish methods and gross economic irrationality guiding powerful institutions in their bid to undermine democratic control over economic power. Perkins has, once again, made a substantial contribution to a world that needs whistle-blowers to open its eyes to the true sources of political, social, and economic power.”
—Yanis Varoufakis, former Minister of Finance, Greece

“An eye-opening exposé of global corruption and a fascinating story of adventure and intrigue. This devastating indictment of current economic policies also offers hope by showing the power of the growing movement toward a caring economics worldwide.”
–Riane Eisler, author of The Chalice and the Blade and The Real Wealth of Nations

“Offers deep insights into the nefarious ways economic hit men and jackals have expanded their powers. It shows how they came home to roost in the United States—as well as the rest of the world. It is a brilliant and bold book that illuminates the crises we now face and offers a road map to stop them.”
—John Gray, PhD, author of Men Are from Mars, Women Are from Venus

“John Perkins’s engaging narrative draws us into a brilliant analysis of capitalism’s shadow side and points us to a hopeful path to a better future… a must read for anyone who cares about our economic welfare, social justice, and collective well-being.”
—Daniel Goleman, author of Emotional Intelligence and Ecological Intelligence

“John Perkins probed the dark depths of global oligarchy and emerged into the light of hope. This true story that reads like a page-turning novel is great for all of us who want the better world that we know is possible for ourselves, future generations, and the planet.”
—Marci Shimoff, author of Happy for No Reason and Chicken Soup for the Woman’s Soul

“Here are the real-life details—nasty, manipulative, plain evil—of international corporate skullduggery spun into a tail rivaling the darkest espionage thriller.”
–Greg Palast, author of The Best Democracy Money Can Buy

“Perkins provides a profound analysis of two forces vying to define the future. One is intent on preserving systems that serve the few at the expense of the many, while the other promotes a new consciousness of what it means to be human on this beautiful, fragile planet. This powerful book inspires and empowers actions that manifest an awakening to our collective ecosystem and the rebirth of humanity—an ECOrenaissance.”
—Marci Zaroff, founder of ECOfashion brands Under the Canopy and Metawear

“Tells the rest of that story—the terrible things that have happened . . .and what we all can do to turn a death economy into a life economy.”
—Yoko Ono

“Stunning and groundbreaking. . . A must read for anyone who cares about the world.”
—Lynne Twist, global activist and author of The Soul of Money and Living a Committed Life

“An amazing guide to co-creating a human presence on our planet that honors all life as sacred. It exposes our past mistakes; offers a vision for a compassionate, sustainable future; and provides practical approaches for making the transition between the two. A must-read for anyone who loves our beautiful home, Earth.”
—Barbara Marx Hubbard, bestselling author and President, Foundation for Conscious Evolution

“As one who has helped thousands of people grow their businesses, I’ve learned firsthand the importance of facing the crises old economic models created and acting positively to develop new approaches. Perkins’s experiences, his exposé of the failures, his clear vision of what needs to be done, his call to action, and the sense of joy he feels for being part of this consciousness revolution are deeply inspiring.”
—Sage Lavine, CEO, Conscious Women Entrepreneurs; and founder of the Entrepreneurial Leadership Academy

""Mr. Perkins&#39s core message is that American corporations and government agencies employ two types of operatives: &#39economic hit men,&#39 who bribe emerging economies, and ‘jackals,&#39 who may be used to overthrow or even murder heads of state in Latin America and the Middle East to serve the greater cause of American empire. . . . [This] book seems to have tapped into a larger vein of discontent and mistrust that Americans feel toward the ties that bind together corporations, large lending institutions and the government — a nexus that Mr. Perkins and others call the ‘corporatocracy.’”
—The New York Times

“This riveting look at a world of intrigue reads like a spy novel . . . Highly recommended.”
—Library Journal

“Imagine the conceptual love child of James Bond and Milton Friedman.”
—Boston Herald

""Conspiracy buffs are most likely to enjoy this updated version of a memoir that was a surprise bestseller in 2004…This revised version, he states, was written to answer the thousands of emails he received from readers interested in what they could do to resist.”
—Publishers Weekly

“Ultimately, Confessions is a parable for all Americans who try to deny the heartbreaking fact that our society’s affluence often comes at the wider world’s expense.”
—Utne Reader

“[A] gripping tell-all book . . . Perkins reveals how the US machine works behind closed doors and how America has exploited others for its own needs.”
—Rocky Mountain News

“Perkins claims may seem unthinkable to most Americans. But the evidence, looking at the world economy, is damning . . . the citizens of this country need to be willing to examine the actions of our political and corporate leaders and demand that they stop the destruction that is making the world an increasingly dangerous place to live.”
—Charlotte Observer

“An intriguing, vivid account of Perkins’s ‘living on the edge’ experiences, this fascinating read is of the truth-is-stranger-than-fiction variety.”
—Library Journal (Lucy Heckman, St. John’s University Lib., Queens, NY)
En lire plus",https://m.media-amazon.com/images/S/amzn-author-media-prod/c8r8eauh557u271c6286eeg73t._SY600_.jpg
Pierre-Noël Giraud,"Pierre-Noël Giraud est professeur d’économie émérite à Mines Paris et à Dauphine PSL, professeur affilié à l’Université Mohammed-VI-Poly-
technique. Il est l’auteur d’ouvrages d’économie qui ont fait date, tels L’Homme inutile publié chez Odile Jacob, L’Inégalité du monde chez Gallimard et Le Commerce des promesses au Seuil.",
Amandine Cayol,"Amandine Cayol est maîtresse de conférences en droit privé à la faculté de droit de l&#39Université de Caen-Normandie où elle codirige le Master Assurances. Elle enseigne le droit des contrats, de la responsabilité civile, des assurances et le droit des biens. Elle est auteure de cinq ouvrages dont Le contrat d&#39ouvrage (2013) et Le droit des biens en tableaux (2019). Elle dirige actuellement un projet de recherche RIN sur les enjeux du développement de la télémédecine en Normandie financé à 100% par des fonds FEDER. Emilie Gaillard est maîtresse de conférences H.D.R. en droit privé à SciencesPo Rennes. Elle enseigne, notamment, le droit international des droits de l&#39homme, de la bioéthique, de l&#39environnement. Elle dirige un parcours de grade master intitulé Générations futures et transitions juridiques au campus de Caen. Auteure de deux ouvrages : Générations futures et droit privé. Vers un droit des générations futures (2011) et Legal Actions for Future Generations (Peter Lang 2020), elle est la coordinatrice générale de la Chaire d&#39excellence Normandie pour la Paix.",
Antoine Bozio,"Antoine Bozion dirige, avec Julien Grenet, l&#39Institut des politiques publiques (IPP), dédié à l&#39analyse et à l&#39évaluation des politiques publiques.

Julien Grenet dirige , avec Antoine Bozion, l&#39Institut des politiques publiques (IPP), dédié à l&#39analyse et à l&#39évaluation des politiques publiques. Il est directeur de recherche au CNRS, professeur à l&#39École d&#39économie de Paris, et enseigne l&#39économie publique et l&#39économie de l&#39éducation.",
Peter Joseph,"""Peter Joseph is one of the great visionaries of our time. If there&#39s a beautiful futureand I think there will bethen his fingerprints will be all over it.""
Marianne Williamson, #1 New York Times bestselling author


""Since 9/11, security took over and retired human rights into a small closet. We need to get back to the issue of rights for all. Hopefully this important work will draw us closer to that reality and promise. Without economic realignment with nature to secure our habitat, along with conquering the sociological roots of fragmentation and bigotry, the human family is in peril.""

—Jack Healey, Head of Human Rights Action Center

""One of this generation&#39s greatest visionaries delivers a startling exposé about the violent oppression that defines our economic order, while issuing an urgent call for global activism to unite to change it. Amidst a deepening crisis of capitalism and inequality, coupled with an intensifying assault by the Empire&#39s elite, The New Human Rights Movement provides a crucial roadmap for the movement toward the next system.""
–Abby Martin, host of The Empire Files",https://m.media-amazon.com/images/I/01Kv-W2ysOL._SY600_.png
Thomas Sowell,"""Thomas Sowell marshals his arguments with admirable clarity and authority. There is not a chapter in which he does not produce a statistic that both surprises and overturns received wisdom.""―The Economist

""From one of America&#39s most noted conservative economists, a short, original book that offers some unconventional ideas about how to think about common economic topics.""―Baltimore Sun

“Simply on the basis of the byline, I read everything Thomas Sowell writes.  And it keeps me busy because he writes a lot.  But I’m always richly rewarded, as I was once again when I picked up Economic Facts and Fallacies.  Sowell is fearless and invariably so far ahead of the curve in discussing economics or politics or pretty much anything that the rest of us are left with eating his intellectual dust.  I can’t think of a higher compliment than that.” ―Fred Barnes, Executive Editor, The Weekly Standard and co-host of The Beltway Boys on Fox News Channel

“Economic Facts and Fallacies is the kind of book lesser lights would have labored for years to produce.  Full of pithy and useful data and imbued with the wisdom of a lifetime of economic analysis, this is another home run for the sage of Palo Alto.” ―Mona Charen, Nationally syndicated columnist

""This readable volume is a useful primer exposing how economics relates to the social issues that affect our country.""―Publishers Weekly

""Sowell&#39s book dismantles many of the pervasive fallacies running rampant in politics today, broken into categories of urban life, gender, academia, income, race, and the problems of the third world. ... In Economic Facts and Fallacies, as in his other work, Sowell makes a persuasive and powerful case, armed with a solid arsenal of statistics, numbers, and historical facts.""―RealClearPolitics.com

“[An] interesting and challenging book.”―News Weekly (Australia)

“In a new second edition, Economic Facts and Fallacies shows how misinterpretation of economics can result in flawed public policy in easily understandable terms that does not require prior knowledge of economics.”―The Galveston County Daily News

“Armed with historical facts, imperical economics, plain logic and lots of reputable statistics…Economic Facts and Fallacies contains persuasive evidence that many commonly held beliefs, especially in modern politics, simply cannot withstand the scrutiny of hard facts…Sowell successfully addresses the tough issues… An excellent read for those with a basic understanding of statistics, those who learn to distinguish fact from fallacy in this book are sure to be more perceptive members of society and more enlightened citizens and voters. And who knows? Maybe one day Economic Facts and Fallacies will open opportunities for the nations of the world.”―Deseret Morning News",https://m.media-amazon.com/images/I/01Kv-W2ysOL._SY600_.png
John Rapley,"A fascinating, informative and deeply thoughtful work. -- Linda Colley ― Financial Times

A useful post-Gibbonian primer in why things went wrong for the Romans - Heather&#39s scholarship shines through its pages ... an interesting polemic. -- Simon Heffer ― Daily Telegraph

[A] provocative short book . . . with a novel twist. ― The Economist

[A] fascinating book. -- Martin Wolf ― Financial Times, &#39Best Summer Books of 2023: Economics&#39

A short, sober (and sobering) account of where we are now and where we might be heading ... lucid and absorbing ... jaw-dropping facts and figures. -- Carlos F. Noreña ― Times Literary Supplement

This essay has changed my view both of the past and the present ... It’s convincing and relevant to the west today. -- Carlo Rovelli ― The Observer

Two experienced scholars lucidly engage in contemporary debates about the future of the West and its parallels to the Roman Empire. This is comparative history done right. -- David Potter, author of DISRUPTION: WHY THINGS CHANGE

Enlightening ... Heather and Rapley&#39s book is not pessimistic. It does not predict a collapse of the West analogous to the tragic collapse of Rome in the fifth century. On the contrary, it offers a penetrating historical analogy as a tool for reading the present, so that it can help us avoid the political mistakes of the late empire. -- Carlo Rovelli ― Corriere della Sera",https://m.media-amazon.com/images/I/01Kv-W2ysOL._SY600_.png
Noam Chomsky,"Dans cet essai concis, brillant, et extrêmement polémique, Noam Chomsky, un des critiques les plus virulents du nouvel ordre mondial, montre comment, sous couvert de divers paravents (organisation mondiale du commerce, OTAN, etc.) le capitalisme, en particulier américain, est en train d&#39imposer au monde une véritable tyrannie, qui non seulement empiète sur la souveraineté des Etats, mais sur celle des individus eux-mêmes.",https://m.media-amazon.com/images/S/amzn-author-media-prod/uvt72g9sqfuompjf1k6no5i5so._SY600_.jpg
Nicolas Nekourouh,,
Darko Suvin,"Darko Suvin, Ph.D. (1970) Zagreb University, is Professor Emeritus of McGill University. He has published 21 books on Literature, Dramaturgy, Culture, and Political Epistemology, as well as poetry. Major publications include Metamorphoses of Science Fiction, To Brecht and Beyond, and Defined by a Hollow.",https://m.media-amazon.com/images/I/01Kv-W2ysOL._SY600_.png
Simon Gregory,,
Helen Thompson,"Helen Thompson&#39s book stands tallest among the recent titles that attempt to make sense of our age of crises. Disorder is a singular work owing to the skill with which Thompson maps the intersecting relationships between energy, global monetary policy, and the state of liberal democracy. ― New Statesman

Fascinating ― Simon Nixon, The Times

A stimulating read. ― Howard Davies, Literary Review

Exceptional ― Gavin Jacobson, New Statesman

Excellent. ― Peter Franklin, Unherd

Bold and brilliant, studded with insights...one of the year&#39s most essential books. ― Christopher Bray, The Tablet

A powerful guide to modern Hard Times...any reader will finish it with a deeper understanding of our contemporary challenges. ― Paschal Donohoe, Irish Times

Most of us struggle to keep up [with the news], but not Helen Thompson - she doesn&#39t merely grip each strand, but ties them together. ― Tom Clark, Prospect

Bursting with ideas. ― James Barr, The Critic

[Disorder is] as disturbing as it is thought-provoking. ― Martin Wolf, Financial Times, Summer Books 2022: Economics

If you are looking for a well-developed and convincing theory of our time, I advise you to start here. ― Gilles Gressani, Le Grand Continent, &#39What to read this summer&#39

We are on the verge of a fascinating epoch that Thompson might write about in a second volume, but that doesnt invalidate her first. Instead, it underscores her larger point that energy and finance are often at the heart of geopolitics. ― Tony Yates, Chatham House

Disorder is a brilliant extended essay on the troubles of the era in terms of energy, global finance, governance and democracy...So much of this tortuously fascinating book gives the background to the global crisis now upon us, specifically in energy and governance. ― Robert Fox, Reaction

If you want to understand why Russia invaded Ukraine then this book will help ― Richard Lofthouse, QUAD

Deftly weaving together the history of energy, economics, and politics, Disorder restores depth to contemporary history. Refusing familiar stereotypes, Thompson offers a truly eye-opening account of our current predicament and points the way to a deeper understanding of the energy transition that lies ahead. Challenging and essential reading. ― Adam Tooze, Kathryn and Shelby Cullom Davis Professor of History, Director of the European Institute, Columbia University

A remarkable history of the complex ways in which the global energy economy has shaped the wealth and politics of nations. Helen Thompson&#39s command of her subject is second to none. Disorder is revelatory, sobering, and indispensable. ― Gary Gerstle, author of The Rise and Fall of the Neoliberal Order: America and the World during the Free Market Era

To read Thompson on the history of the past century is to see it in a sudden sharp definition. It is akin to looking through glass after the window-cleaner has been. ― Tom Holland, bestselling author and co-host of The Rest is History podcast

