Nom,Prix,Description,Isbn,Photo,Editeur,Auteur,Categorie
"REMÈDES HOMÉOPATHIQUES POUR TOUTES LES MALADIES: Le guide de base du sel cellulaire homéopathique et comment l&#39utiliser pour traiter la constipation, les ecchymoses, les allergies, la neuropathie, les",11.61,"Les sels cellulaires homéopathiques, également appelés sels tissulaires ou sels de Schuessler, constituent un aspect fascinant de la médecine homéopathique. Cette approche thérapeutique a été lancée par un médecin allemand à la fin du XIXe siècle, offrant une perspective unique sur la relation entre les minéraux et la santé cellulaire. Basés sur les principes de l&#39homéopathie, les sels cellulaires visent à rétablir l&#39équilibre et à favoriser le bien-être en s&#39attaquant aux déséquilibres ou aux carences en minéraux essentiels au sein des cellules.

Les recherches du Dr Schuessler ont été inspirées par son observation approfondie du rôle crucial que jouent les minéraux dans la fonction cellulaire. Il a suggéré que des déséquilibres dans la distribution ou la disponibilité de ces minéraux pourraient entraîner toute une série de problèmes de santé. Contrairement à l&#39homéopathie traditionnelle, qui utilise fréquemment des substances énergétiques dérivées d&#39animaux, de plantes ou de minéraux, les sels cellulaires ciblent spécifiquement les minéraux essentiels qui jouent un rôle crucial dans la biochimie du corps humain.

La théorie biochimique, principe fondamental de la thérapie par les sels cellulaires, suggère qu&#39il existe 12 sels minéraux cruciaux nécessaires à la préservation du bien-être cellulaire. Ces minéraux sont constitués d’une variété d’éléments essentiels, chacun ayant ses propres propriétés et bienfaits pour le corps. Selon l&#39expert, ces minéraux se trouvent dans chaque cellule et sont essentiels au bon fonctionnement des processus biochimiques du corps.
L&#39un des principes fondamentaux des sels cellulaires homéopathiques est le concept de dynamisation, un processus de dilution et de succussion qui joue un rôle crucial dans les remèdes homéopathiques. Bien qu&#39un débat soit en cours sur le mécanisme d&#39action précis, les partisans affirment que ce processus amplifie les propriétés énergétiques ou vibratoires de la substance tout en diminuant sa concentration matérielle. En ce qui concerne les sels cellulaires, on pense que ces préparations minérales diluées activent les processus naturels de guérison du corps.",979-8879269352,https://m.media-amazon.com/images/I/61+TkHNo9zL._SY522_.jpg,Independently published (11 février 2024),Jorge Mateo,Homéopathie
La médecine traditionnelle au Rwanda,11.61,,978-2865374526,https://m.media-amazon.com/images/I/81xAldaUcGL._SY522_.jpg,Karthala (1 janvier 1993),Pierre Claver Rwangabo,Homéopathie
PHARMACOLOGIE ET MATIÈRE MÉDICALE HOMÉOPATHIQUE,39.0,"Indispensable à la connaissance approfondie des médicaments à usage homéopathique, cet ouvrage actualise les indications cliniques ainsi que les données toxicologiques et pharmacologiques. Il apporte aussi de nouveaux éclairages sur l&#39origine précise de chaque médicament. Fiabilité des indications cliniques Pharmacologie et matière médicale homéopathique est le fruit d&#39un travail d&#39équipe qui intègre l&#39expérience clinique de chacun des auteurs, médecins et enseignants du Centre d&#39Enseignement et de Développement de l&#39Homéopathie. Rigueur et actualité des pathogénésies. Dans le but de retenir des signes pathogénésiques fiables, les auteurs ont vérifié chaque information contenue dans les ouvrages les plus classiques d&#39homéopathie et intégré un certain nombre de données de la pharmacologie moderne. Pédagogie et clarté. La méthode de travail s&#39appuie sur un plan simple et didactique : origine et description, action générale, signes caractéristiques, correspondances étiologiques, type sensible, principales indications cliniques par appareil, exemples de prescription. Une matière médicale de référence utilisable pour le travail personnel comme pour la consultation. 326 médicaments à usage homéopathique Index des pathologies en fin d&#39ouvrage.",978-2915668391,https://m.media-amazon.com/images/I/4149T3+HwvL.jpg,CEDH; 3e édition (1 octobre 2009),Denis Demarque,Homéopathie
Homéopathie courante,18.71,"Par vous-même
Vous souhaitez comprendre réellement comment marche l&#39homéopathie ? Vous avez envie d&#39une certaine autonomie pour fabriquer vos propres remèdes ? Vous voulez rester dans la simplicité, au niveau de la famille, pour régler les problèmes courants de santé ? Vous pouvez à tout moment consulter ce petit répertoire : ? par troubles, ? par remèdes. Et vous soulager dans beaucoup de cas. Vive l&#39autonomie !",978-2813201577,https://m.media-amazon.com/images/I/616KsC1IcsL._SY522_.jpg,Les éditions Trédaniel; Tredaniel édition (5 juillet 2010),Michel Dogna,Homéopathie
"Le Guide de Réflexologie pour se soigner SEUL: Apprendre la Réflexologie plantaire, l’Acupression, le Massage des pieds, pour les débutants",10.09,"« Et si vous supprimiez n’importe quelle douleur avec une pression de doigt ? »
Cette phrase surprenante pourrait résumer toute la philosophie de la réflexologie.
Découvrez ce guide de réflexologie plantaire illustré pour les débutants. 🦶
Ce livre est conçu pour les gens qui veulent apprendre à se soigner SEUL ou à soigner leurs proches.
La réflexologie est une thérapie extraordinaire grâce à ses nombreux atouts : elle est naturelle, gratuite, sans effet secondaire néfaste, très simple à pratiquer n’importe où ou n’importe quand.",978-2958342623,https://m.media-amazon.com/images/I/61cu7Asf4nL._SY522_.jpg,Editions Santé en Autonomie (7 février 2023),Pascal OLIVIER,Homéopathie
Homoeopathy In Epidemic Diseases,13.06,"Here is a vital tool of reference that should always be at hand as it gives vital information for dealing with Epidemic diseases: information which can be followed by both the novice as well as the experienced practitioner.

Homoeopathy can quickly overcome measles, scarlet fever, influenza, whooping cough, chicken pox, mumps, diphtheria and other ailments. Furthermore homoeopathic remedies have no side effects.

Infectious diseases can also be aborted with homoeopathy when the early symptoms are dealt with promptly.",978-0852073056,https://m.media-amazon.com/images/I/91Wa82fVXlL._SY522_.jpg,C W Daniel (1 août 1996),Dr Dorothy Shepherd,Homéopathie
Homéopathie - Guide pratique,18.0,"Vous êtes allergique ? Vous voulez vous prémunir contre les maladies et les virus ? Vous souffrez d&#39angines ? de migraines ? de brûlures d&#39estomac ? Vous êtes enceinte ? Votre bébé "" fait "" ses dents ? Votre enfant est agité ? L&#39homéopathie est une médecine douce, efficace et sans danger pour tous, des nourrissons aux aînés, de 0 à 107 ans ! Pour les problèmes de santé de chaque jour, l&#39homéopathie est une solution accessible, efficace et sans danger ! Consultez quotidiennement ce guide pratique pour trouver les réponses homéopathiques aux problèmes de toute la famille. Et déterminez votre profil à l&#39aide des tests pour découvrir votre remède clé.",978-2848993577,https://m.media-amazon.com/images/I/719vZRYKQrL._SY522_.jpg,LEDUC (9 février 2010),Albert-Claude Quemoun,Homéopathie
Le livre perdu de la médecine naturelle: Guérison rajeunie grâce à des recettes médicinales naturelles,6.88,"Dans une société saturée de médicaments et de médecines synthétiques, il reste un trésor caché de connaissances sur la guérison : le livre perdu de la médecine naturelle. Dans ses pages se trouvent les secrets de l&#39utilisation de la capacité intrinsèque de la nature à guérir et revitaliser le corps, l&#39esprit et l&#39âme.

Le Livre Perdu de la Médecine Naturelle plonge dans les connaissances intemporelles des médecines naturelles, fournissant une référence approfondie à vingt traitements curatifs puissants dérivés directement du sol. Des plantes médicinales aux méthodes de guérison traditionnelles, ce livre fournit un guide du bien-être holistique basé sur des traditions séculaires.

Découvrez les pouvoirs médicinaux des plantes et herbes utilisées pour guérir depuis l’Antiquité. Apprenez à utiliser l&#39aromathérapie pour réduire le stress et favoriser la relaxation, ou étudiez l&#39Ayurveda pour équilibrer l&#39énergie du corps et stimuler la vitalité.

Mais le livre enterré de la médecine naturelle ne s’arrête pas là ; il plonge également dans des thérapies moins connues comme l&#39acupuncture, l&#39homéopathie et la guérison énergétique, donnant un aperçu de leur efficacité et de leurs applications pratiques dans la vie contemporaine.

Que vous recherchiez un traitement contre des maladies chroniques, renforciez votre système immunitaire ou simplement renouez avec les bienfaits de la nature, The Lost Book of Natural Medicine offre un chemin vers un bien-être holistique qui va au-delà des restrictions de la médecine traditionnelle.

Rejoignez-nous dans un voyage de redécouverte alors que nous découvrons les secrets du livre ancien de la médecine naturelle et célébrons le pouvoir de guérison de la nature sous toutes ses formes magnifiques.",979-8326633552,https://m.media-amazon.com/images/I/61UPyNX-SCL._SY522_.jpg,Independently published (25 mai 2024),Alexandro Bokan,Homéopathie
Le Larousse de l&#39homéopathie,19.31,"Un ouvrage de référence très accessible, pour comprendre l&#39homéopathie et savoir quand et comment l&#39utiliser. Il s&#39adresse à ceux qui ont régulièrement recours à cette médecine douce comme à ceux, de plus en plus nombreux, qui s&#39y intéressent. Découvrir l&#39homéopathie Pour connaître l&#39histoire et les principes de l&#39homéopathie, bien préparer vos consultations chez le médecin, savoir comment sont fabriqués les médicaments et où en est la recherche aujourd&#39hui... Se soigner avec l&#39homéopathie Pour comprendre les prescriptions de votre médecin, et traiter vous-même sans risque les petits maux de tous les jours : * les questions que vous devez vous poser pour bien vous connaître et mieux vous soigner, * des tableaux pratiques pour traiter les affections courantes, * des traitements sur mesure, fondés sur l&#39observation des symptômes, selon la démarche même des homéopathes, * l&#39apport de l&#39homéopathie dans le suivi des affections plus graves. Connaître les médicaments 180 médicaments homéopathiques couramment prescrits, avec leurs constituants, leurs emplois usuels, et les caractéristiques des personnes auxquelles ils conviennent... Un guide pratique de l&#39homéopathie Le statut de cette médecine, son vocabulaire, son utilisation pour soigner les animaux... Une véritable mine d&#39informations, pour se soigner au quotidien et préserver le capital santé de toute la famille.",978-2035101020,https://m.media-amazon.com/images/I/41UNdxr4ZsL.jpg,"Larousse; Paris, Librairie Larousse édition (25 juillet 2000)",Philippe Servais (dirigé par),Homéopathie
Thérapeutique et répertoire homéopathique du praticien,15.6,"Henri Voisin comptait parmi les meilleurs praticiens homéopathes de France. Son répertoire est déjà devenu légendaire. Il n’a intégré dans ce répertoire pratique que ce que lui-même a pu utiliser avec succès au cours de sa longue pratique. Pour les indications dont il n’était pas vraiment convaincu, il a eu l’honnêteté d’écrire qu’elles n’étaient efficaces que dans quelques cas.

Après avoir été longtemps épuisé, l’ouvrage est à nouveau disponible. Il est une véritable mine de conseils cliniques inhabituels qui ont maintes fois fait leurs preuves dans la pratique, comme Scolopendra pour le prolapsus des disques. Étant donné que les diagnostics cliniques sont classés par ordre alphabétique, il est possible d’y rechercher très rapidement un mot, même au cours d’une consultation.
Un ouvrage qui constitue un vrai trésor, même pour l’homéopathe expérimenté.",978-3955820190,https://m.media-amazon.com/images/I/71DfuOk4WlL._SY522_.jpg,Editions Narayana; Edition spéciale (21 novembre 2014),Henri Voisin,Homéopathie
"Praxisbuch Neue Homöopathie. 20 bewährte Testlisten für den Einsatz in der Pendel-, Tensor- oder Kinesiologie-Praxis",9.27,"Die vom Wiener Elektrotechniker Erich Körbler (1936 - 1994) begründete Neue Homöopathie - das ganzheitliche Heilen mittels Informationsübertragung - erlebt einen grandiosen Aufschwung. Die dabei zum Einsatz kommenden Strichcodes und Symbole aktivieren schnell die Selbstheilungskräfte und heilen energetisch Körper, Geist und Seele sanft und effektiv.
Mit dem Praxisbuch erhalten alle Anwender der Neuen Homöopathie ein wertvolles und nützliches ""Werkzeug"" für die Selbstbehandlung und die therapeutische Praxis, aber auch Therapeuten und Berater, die mit Pendel oder kinesiologischen Testsystemen arbeiten. Sie verfügen in kompakter, übersichtlicher Form über die 20 wichtigsten Testlisten und Schautafeln, mit prägnanten und verständlichen Anleitungen, in langjähriger Praxis von Therapeuten und Beratern der Neuen Homöopathie entwickelt und erprobt. Die großformatigen Seiten sind farbig gestaltet, spiralgebunden, stabil, schmutzunempfindlich und abwaschbar - somit ideal für die tägliche Anwendung.",978-3863741068,https://m.media-amazon.com/images/I/71btaOfusVL._SY522_.jpg,Mankau; 3e édition (10 septembre 2013),Christina Baumann,Homéopathie
Dictionnaire homéopathique,15.2,"Plus qu&#39un dictionnaire, voici un véritable précis d&#39homéopathie. L&#39auteur ne se contente pas de l&#39exposé des formules. Il prodigue conseils et recommandations en fonction du tempérament de chacun. Son livre est une véritable encyclopédie du mieux-être par les médecines douces : homéopathie, bien-sûr, mais aussi vitaminothérapie, oligothérapie, hygiène de vie, diététique...",978-2253038153,https://m.media-amazon.com/images/I/A1LIaNPcy8L._SY522_.jpg,Le Livre de Poche (1 janvier 1986),Louis Pommier,Homéopathie
Microdosage - Les psychédéliques au quotidien,16.8,"Des doses infinitésimales de substances psychoactives telles que LSD, DMT, psilocybine ou encore mescaline, peuvent-elles être utilisées pour mieux répondre aux exigences de la vie courante ? Les molécules psychédéliques ont elles le pouvoir d’améliorer la coexistence et l’intégration sociales des individus ? Destiné à ceux qui souhaitent s’informer sur un sujet paradoxalement tout aussi confidentiel que populaire, ce livre présente un résumé des rapports les plus courants sur le microdosage de substances psychoactives ainsi qu’une synthèse des connaissances scientifiques disponibles à ce jour. Avec les contributions du docteur Torsten Passie, psychiatre et professeur à Harvard, Dr Jochen Gratz, chimiste et mycologue, Frank Sembowski, biologiste et généticien, et Linus Naumann, doctorant en biologie moléculaire.",978-3037887578,https://m.media-amazon.com/images/I/61U7Atx0ggL._SY522_.jpg,SOLANACEE; Illustrated édition (12 mai 2021),Markus Berger,Homéopathie
Les constitutions homéopathiques,23.0,"Le concept de Constitution introduit la notion typologique dans la définition du Terrain et dans la mise en œuvre d’un remède minéral constitutionnel adéquat au patient à traiter. L’auteur développe ici une ""Similitude constitutionnelle"" fondée sur la clinique morphologique et la notion de type sensible conduisant à la prescription de nombreux sels minéraux constitutifs de nos tissus. La logique de leur usage confirme les vues de Grauvogl et de Nébel dans leur abord physico-chimique de l’Homéopathie.",978-2842510398,https://m.media-amazon.com/images/I/516+Ku5B8FL.jpg,Editions Similia (13 juillet 2007),Max Tétau,Homéopathie
,14.12,,,,,,Homéopathie
"La bible Homéopathique: Le livre de référence pour se soigner naturellement, guérir tout les maux de la famille et vivre plus sainement au quotidien I Plus de 100 remèdes pour tout les tracas !",7.37,"Découvrez comment vous guérir facilement à la maison avec plus de 100 remèdes !

Et si, au lieu d’une attente longue et coûteuse chez le médecin, vous pouviez vous soigner, vous et votre famille, à la maison, de manière sûre et efficace, pour des maladies courantes telles que le rhume, les infections, les otites et même les intoxications alimentaires ? Si c’est ce que vous recherchez, alors ce livre est fait pour vous !

Qui n’a jamais souffert d’un mauvais rhume ou d’une horrible grippe à l’étranger ? Rien ne peut plus gâcher des vacances que d’être coincé dans une chambre d’hôtel loin de chez soi, en train de vomir. Mais si vous savez comment utiliser efficacement et en toute sécurité ces",979-8429097732,https://m.media-amazon.com/images/I/611fxpXWBwL._SY522_.jpg,Independently published (8 mars 2022),Hervé Larrant,Homéopathie
"La bible Homéopathique: Le livre de référence pour se soigner naturellement, guérir tout les maux de la famille et vivre plus sainement au quotidien I Plus de 100 remèdes pour tout les tracas !",19.3,"Découvrez comment vous guérir facilement à la maison avec plus de 100 remèdes !

Et si, au lieu d’une attente longue et coûteuse chez le médecin, vous pouviez vous soigner, vous et votre famille, à la maison, de manière sûre et efficace, pour des maladies courantes telles que le rhume, les infections, les otites et même les intoxications alimentaires ? Si c’est ce que vous recherchez, alors ce livre est fait pour vous !

Qui n’a jamais souffert d’un mauvais rhume ou d’une horrible grippe à l’étranger ? Rien ne peut plus gâcher des vacances que d’être coincé dans une chambre d’hôtel loin de chez soi, en train de vomir. Mais si vous savez comment utiliser efficacement et en toute sécurité ces",979-8429097732,https://m.media-amazon.com/images/I/611fxpXWBwL._SY522_.jpg,Independently published (8 mars 2022),Hervé Larrant,Homéopathie
104 maladies du XXIe siècle - 104 prescriptions naturelles - Les conseils coronavirus du Dr Willem,9.15,"Cette nouvelle édition remaniée et augmentée, très attendue, est un trésor d’explicatifs pratiques qui permettront à chacun de mieux comprendre sa maladie, puis d’appliquer les prescrits de la meilleure façon dans le cadre d’une auto-médication guidée avec pertinence. Cet ouvrage, pratique et accessible à tous, est un recueil d’ordonnances types pour chaque maladie, étant bien entendu que chacune de ces ordonnances devra être adaptée à chaque maladie et modifiée selon chaque cas, en vertu du vieil adage?: «?Il n’y a pas de maladies mais des malades?». On y trouvera pour chaque affection (classée alphabétiquement) plusieurs ordonnances homéopathiques complètes, avec tous les dosages, ainsi que des prescriptions inspirées des diverses médecines naturelles?: phytothérapie, gemmothérapie, organothérapie, oligothérapie, et même un usage guidé pour un traitement aux huiles essentielles. Chacun pourra alors choisir la pratique qui lui convient le mieux.",978-2874611346,https://m.media-amazon.com/images/I/71U8Q4wjYdL._SY522_.jpg,TESTEZ; 3e édition (15 juillet 2021),Jean-Pierre Willem,Homéopathie
"Makula-Degeneration, Diabetische Retinopathie: Mit Naturheikunde erfolgreich selbst behandeln",16.66,"Andreas Nieswandt hat die Augen-Regenerations-Therapie speziell zur ganzheitlichen Behandlung von Augenerkrankungen entwickelt. Im Rahmen dieser über viele Jahre immer weiter verfeinerte und bereits bei hunderten Patienten durchgeführte Therapie kombiniert der Heilpraktiker mit eigener Praxis in Düsseldorf naturheilmedizinische Methoden.
Mithilfe eines speziellen, sehr individuellen Behandlungsschemas gelingt es dem studierten Naturwissenschaftler, selbst schwere Augenerkrankungen wie Makula-Degeneration oder die Diabetische Reniopathie erfolgreich zu behandeln. Schon nach kurzer Zeit stellen sich bei den meisten Patienten deutliche Sehverbesserungen ein. Je eher die Augen-Regenerations-Therapie angewandt wird, desto größer sind die Erfolgsaussichten! Zu den häufigsten Erkrankungen, die Andreas Nieswandt heute mit der Augen-Regenerations-Therapie behandelt, gehören neben Makula-Degeneration oder Diabetische Reniopathie: Retinitis pigmentosa, Grüner Star, Grauer Star, Erkrankungen der Netzhaut bedingt durch Durchblutungsstörungen, z.B. bei Diabetes Mellitus, Erblindungen durch Gehirnschädigungen, Thrombosen. Für diejenigen Patienten, die sich beim Augenarzt schulmedizinisch behandeln lassen, ist die Augen-Regenerations-Therapie nach Andreas Nieswandt, der neben Prof. Dr. John Boel zu den renommiertesten naturmedizinischen Behandlern in Europa gehört, eine sinnvolle Alternative bzw. Ergänzung",978-3981252026,https://m.media-amazon.com/images/I/61KYlOw7ELL._SY522_.jpg,"Vivita Verlag; 2., verb. Aufl. édition (1 juin 2010)",Andreas Nieswandt,Homéopathie
Le coeur trois fois heureux : Amour et Homéopathie,18.0,"Il nous livre dans cet essai une somme de réflexions s&#39appuyant sur les paroles du Christ et d&#39autres Maîtres en sagesse qu&#39il relie à la lumière de sa connaissance homéopathique. Comme d&#39habitude Didier Grandgeorge enrichit son texte de nombreux cas cliniques tirés de sa pratique quotidienne qui illustre tous les trésors d&#39humanité que recèle la médecine découverte par Christian Samuel Hahvemann au début du XIXe siècle. Ce travail s&#39inscrit dans la recherche d&#39un sens à notre monde tourmenté et chaotique pour voir au-delà de la souffrance, l&#39Amour qui nous attend, qui est là, qui frappe à la porte de nos coeurs dans ses trois dimensions.",978-2918413080,https://m.media-amazon.com/images/I/41iuF0Ri0NL.jpg,Sudarènes éditions (8 décembre 2009),Didier Grandgeorge,Homéopathie
Homeopathic Psychology: Personality Profiles of the Major Constitutional Remedies,17.45,"This is a most interesting book that combines psychology with homeopathy. Philip Bailey describes in depth the personality profiles of some 35 polychrests. The last pages of the book cover a mix of psychological astrology and homeopathy when he explores the elements and some polychrests. Bailey provides detailed information on 35 major types, giving insight on diagnosis, mental and emotional traits, and physical characteristics. His broad profiles of major constitutional remedies give the reader a good overall picture of the personality type and therefore ways of remembering facts about the archetype, by having a unifying theory for each remedy.",978-1556430992,https://m.media-amazon.com/images/I/61H88TRXKhL._SY522_.jpg,North Atlantic Books (30 novembre 1995),Philip M. BAILEY M.D.,Homéopathie
Les sels homéopathiques de schüssler: Apprendre à se soigner avec des produits naturels,9.5,"Cet ouvrage présente de manière synthétique et simple, l&#39utilisation des fameux sels homéopathiques du Docteur Schüssler. Mis au point au XIXème siècle, par ce médecin homéopathe allemand, les sels de Schüssler sont une réponse naturelle pour prévenir ou enrayer différentes pathologies. Le corps humain contient ces sels bio-chimiques en quantité infinitésimale, toutefois le déficit d&#39un ou de plusieurs de ces sels conduit à un dérèglement du corps humain et à la maladie. Aussi, avec l&#39aide des quelques conseils indiqués dans ce livret, nous vous invitons à prendre soin de votre santé par vous même, à moindre coût, en apprenant à connaître et à se servir de ces produits.La santé naturellement....",979-1091057172,https://m.media-amazon.com/images/I/41swdRwXqNL.jpg,Europa Ebooks Edition (6 février 2019),gustavo d&#39albrega,Homéopathie
Homéo portraits - Histoires de remèdes,16.38,"Histoires de remèdes
Pratiquée par plus ou moins quatre mille praticiens en France et utilisée peu ou prou par un tiers de la population, l&#39homéopathie n&#39a plus à faire ses preuves. Mais en quoi l&#39homéopathie uniciste peut-elle être en outre un merveilleux chemin de connaissance et de guérison au sens noble, participant ainsi à l&#39une des plus belles aventures humaines ? Bien peu connaissent les possibilités ultimes de cette médecine et savent combien la fameuse Loi de Similitude peut non seulement s&#39appliquer aux pathologies les plus sérieuses, mais également aider les individus eux-mêmes dans leur chemin de vie. L&#39auteur nous raconte, histoires cliniques à l&#39appui, quarante personnages ""homéopathiques"" parmi les plus rencontrés. L&#39homéopathie quitte le pur domaine de la science pour aborder les rives des sciences humaines et de l&#39histoire des hommes. Corps et esprit ne faisant qu&#39un, c&#39est cette dynamique en chaque être qu&#39il va falloir débusquer pour en découvrir l&#39équivalence subtile dans la nature. (Trois mille remèdes, d&#39origine minérale, végétale et animale ont déjà été expérimentés et la recherche continue). Substance unique qui, entrant en ""vibration"" avec chaque être, va lui permettre non seulement de se guérir mais aussi de se renouveler, s&#39harmoniser et se résoudre tant dans son corps que dans son coeur. A quel personnage - en similitude avec un remède - de la Comédie humaine puis-je correspondre, avec ma personnalité propre, ma problématique essentielle, mon mode réactionnel particulier ?",978-2843192463,https://m.media-amazon.com/images/I/51B3DCdKPwL._SY522_.jpg,Josette Lyon (30 septembre 2011),Philippe Servais,Homéopathie
