Nom,Prix,Description,Isbn,Photo,Editeur,Auteur,Categorie
AFFIRMATIONS POSITIVES: 1000+ Affirmations pour reformater le cerveau et booster l&#39estime de soi. Le moyen le plus rapide de développer la pensée positive et d&#39attirer tout ce que vous voulez.,11.62,"Nouveau : Version audio incluse avec la version brochée !

Vous êtes fatigué(e)s de la façon dont votre vie se déroule.
Vous aimeriez avoir un meilleur emploi, plus d&#39argent, être en meilleure santé et avoir de meilleures relations, mais peu importe les efforts que vous déployez, vous n&#39obtenez jamais les résultats escomptés. Vous avez entendu parler du pouvoir des affirmations positives, mais vous ne savez pas à quel point elles peuvent vous aider à améliorer votre vie.",979-8783077180,https://m.media-amazon.com/images/I/61InZNF2eUL._SY522_.jpg,Independently published (30 septembre 2022),Health and Wealth,Depression
The Wild Edge of Sorrow: Rituals of Renewal and the Sacred Work of Grief.,12.38,"""It blew me away. I underlined things on nearly every page."" —Anderson Cooper, All There Is

The Wild Edge of Sorrow offers hope and healing for a profoundly fractured world—and a pathway home to the brightness, pains, and gifts of being alive.

Introducing the 5 gates of grief, psychotherapist Francis Weller explores how we move through the waters of grief and loss in a culture so fundamentally detached from the needs of the soul.

• The first gate recognizes—and invites us to accept—the painful truth that everything we love, we will lose. With this acceptance comes beauty and responsibility—and an openness into which we can pour the full love of our hearts. At the first gate, we meet the sorrow of losing a loved one; the grief of illness; and the unique and profound pains that accompany loss by suicide.

• The",978-1583949764,https://m.media-amazon.com/images/I/71aCawGKp3L._SY522_.jpg,North Atlantic Books (15 septembre 2015),Francis Weller,Depression
"Exercices Somatiques pour Débutants: Le Guide Complet de la Perte de Poids, du Soulagement du Stress et du Bien-Être Émotionnel",17.2,"Êtes-vous fatigués de vous sentir stressés, alourdis et piégés en mode survie ? Vous sentez-vous souvent épuisés ou vidés ?
Il est temps de changer ! Les &#39Exercices somatiques pour débutants&#39 représentent une nouvelle manière de bouger et de mieux comprendre notre corps. Ces exercices vous aident non seulement à rendre votre corps plus fort en favorisant une meilleur conscience de son fonctionnement mais vous aide également à le connecter à votre esprit.
Ici, vous trouverez :
+ de 30 Exercices Somatiques : illustrés avec des images faciles à suivre, rendant ainsi la pratique du mouvement somatique accessible même aux débutants.",979-8874480080,https://m.media-amazon.com/images/I/61iRovRrnpL._SY522_.jpg,Independently published (10 janvier 2024),Merton Corey,Depression
Guide de survie des proches aidants - Conseils pratiques pour soutenir sans s&#39épuiser,6.65,"Vous pouvez prendre soin d&#39un proche tout en conservant votre énergie.
En France, entre 40 % et 60 % de la population assume un rôle d&#39aidance de façon plus ou moins intensive. Et ces personnes risquent l&#39épuisement. En effet, être proche aidant n&#39est pas de tout repos ! Comme point de départ de leur réflexion, les autrices se sont posé la question suivante : comment une personne peut-elle s&#39engager dans ce rôle sans aller jusqu&#39au bout de ses forces ? S&#39appuyant sur leur longue expérience clinique de travailleuse sociale et de psychologue, elles proposent dans ce livre une démarche simple et structurée. Y sont traitées toutes les facettes : les étapes inéluctables de ce rôle, les prises de conscience nécessaires, les attentes bien normales, les façons de conserver sa santé, la fonction de la famille, l&#39apport des soins extérieurs... Cet ouvrage a le mérite de dépasser largement la description des difficultés et offre aux aidants naturels toutes sortes de réflexions et de moyens pour qu&#39ils puissent poursuivre leur aide, tout en gardant leur énergie et leur vie.",978-2761959353,https://m.media-amazon.com/images/I/51pG0D1bQrL._SY522_.jpg,de l&#39Homme (19 mai 2022),Michelle Arcand,Depression
Résilience - Les 7 piliers de la force mentale: Gérer le stress et cultiver le bien-être émotionnel. Découvrir la sérénité et canaliser son potentiel dans sa vie personnelle et professionnelle,13.56,"Comment surmonter les défis de la vie avec résilience !
Avez-vous déjà souhaité pouvoir...
Relever les défis sans effort, comme s&#39ils n&#39étaient rien ?
Gérer tous les problèmes avec aisance et sang-froid ?
Rester impassible face à toute crise, quelle qu&#39en soit la gravité ?
Les personnes qui font preuve de résilience ne se laissent pas facilement déstabiliser.
Elles font face aux crises avec une facilité remarquable et relèvent même les défis avec enthousiasme.
En d&#39autres termes, ces personnes ont un niveau de résilience psychologique incroyablement élevé.",978-1964617015,https://m.media-amazon.com/images/I/61NsfkfbyZL._SY522_.jpg,HeartWisdom Publishing (14 mai 2024),Sophie Evrard,Depression
"Change Your Brain, Change Your Life: Revised and Expanded Edition: The breakthrough programme for conquering anxiety, depression, anger and obsessiveness",19.1,"Revised and Expanded Edition.

In this completely revised and updated edition of the breakthrough bestseller that&#39s sold nearly a million copies worldwide, you&#39ll see scientific evidence that your anxiety, depression, anger, obsessiveness or impulsiveness could be related to how specific structures work in your brain. You&#39re not stuck with the brain you&#39re born with. Renowned neuropsychiatrist Dr Daniel Amen includes new, cutting-edge research gleaned from more than 100,000 SPECT brain scans over the last 25 years and the latest, surprising, effective &#39brain prescriptions&#39 that can help heal your brain and change your life.

This book offers simple techniques which will help you to: Quell anxiety and panic; fight depression; boost memory; conquer impulsiveness and learn to focus; and stop obsessive worrying.",978-0349413358,https://m.media-amazon.com/images/I/81vikpn85BL._SY522_.jpg,Piatkus (28 janvier 2016),Dr Daniel G. Amen,Depression
Changer: La liberté en trois étapes,11.34,"Ce sont les lecteurs qui en parlent le mieux !
""Changer"" est un outil puissant pour l&#39exploration et le dépassement des peurs, offrant des exercices concrets et une réflexion profonde sur soi-même.
Les lecteurs apprécient particulièrement sa facilité de lecture, sa capacité à susciter une prise de conscience et son potentiel à ouvrir des portes vers un développement personnel significatif.
L&#39alternance entre exercices pratiques et lecture pure, ainsi que sa capacité à engager le lecteur dans une démarche active, sont des éléments soulignés à plusieurs reprises.
En somme, les avis élogieux suggèrent que ce livre pourrait être une ressource précieuse pour quiconque cherche à mieux comprendre et surmonter ses peurs, et à entreprendre un voyage vers une",979-8878871884,https://m.media-amazon.com/images/I/51-VdYRo2LL._SY522_.jpg,Independently published (15 mars 2024),Florian Vezzoli,Depression
"LA FAIM NERVEUSE: Comment mettre fin aux fringales incontrôlées, résister à une alimentation émotionnelle et éviter les kilos superflus pour respecter votre minceur.",11.73,"Avez-vous déjà ressenti une faim soudaine qui vous semble impossible à contrôler ?
Vous arrive-t-il souvent de manger pour vous réconforter, pour combler un vide intérieur ou évacuer vos émotions négatives ?
Si vous vous trouvez dans ces situations, vous souffrez peut-être de faim nerveuse.
La faim nerveuse est un trouble alimentaire très répandu qui peut avoir plusieurs causes, notamment le stress, l&#39anxiété, la dépression ou des problèmes relationnels.

Elle peut conduire à un comportement alimentaire dysfonctionnel qui peut affecter l&#39estime de soi, l&#39humeur et la santé.",979-8851143885,https://m.media-amazon.com/images/I/61jQWzpJucL._SY522_.jpg,Independently published (5 juillet 2023),Camille Bonnet,Depression
"Loving What Is, Revised Edition: Four Questions That Can Change Your Life",17.45,"Discover the truth hiding behind troubling thoughts with Byron Katie’s self-help classic.

In 2003, Byron Katie first introduced the world to The Work with the publication of Loving What Is. Nearly twenty years later, Loving What Is continues to inspire people all over the world to do The Work; to listen to the answers they find inside themselves;and to open their minds to profound, spacious, and life-transforming insights. The Work is simply four questions that, when applied to a specific problem, enable you to see what is troubling you in an entirely different light.

Loving What Is shows you step by step, through clear and vivid examples, exactly how to use this revolutionary process for yourself. In this revised edition, readers will enjoy seven new dialogues, or real examples of Katie doing The Work with people to discover the root cause of their suffering. You will observe people work their way through a broad range of human problems, learning freedom through the very thoughts that had caused their suffering—thoughts such as “my husband betrayed me” or “my mother doesn’t love me enough.”

If you continue to do The Work, you may discover that the questioning flows into every aspect of your life, effortlessly undoing the stressful thoughts that keep you from experiencing peace.",978-0593234518,https://m.media-amazon.com/images/I/815lLJobYGL._SY522_.jpg,Harmony/Rodale; Revised édition (7 décembre 2021),Byron Katie,Depression
Pour en finir avec l&#39épuisement psychique et émotionnel,19.9,"Le nouveau best-seller de Klaus Bernhardt
Après le succès de son précédent ouvrage Pour en finir avec les crises d&#39angoisse, Klaus Bernhardt nous livre les outils pour se libérer de la dépression et du burn out, en expliquant leurs mécanismes pour mieux les surmonter. L&#39auteur donne des indications claires et précises qui permettent d&#39obtenir rapidement une réduction significative de tous les symptômes dépressifs, afin que le lecteur puisse s&#39aider lui-même. Les connaissances réunies dans cet ouvrage lui permettront d&#39identifier enfin les véritables causes de la dépression et de l&#39épuisement professionnel et d&#39apprendre à agir en conséquence, pour le mener vers une vie empreinte de légèreté et de joie.",978-2813227638,https://m.media-amazon.com/images/I/61j3bXGB6IL._SY522_.jpg,Les éditions Trédaniel (9 juin 2022),Klaus Bernhardt,Depression
