Nom,Prix,Description,Isbn,Photo,Editeur,Auteur,Categorie
"Running, courir après un objectif et l&#39atteindre: avec la méthode S.M.A.R.T - 5km, 10km, Semi-marathon, Marathon... Lancez-vous à la conquête de ... grâce à ce livre sur la course à pied",10.7,"Vous souhaitez vous lancer dans le running❓
Vous êtes débutant en course à pied et voulez progresser❓
Vous êtes déjà un coureur aguerri mais aimeriez performer sur de nouvelles distances❓

Nous avons tous un objectif ou une raison propre qui nous motive à courir, que ce soit battre un chrono, boucler un marathon ou simplement réussir à courir plus pour sa santé. Malheureusement, sans méthode ni planification précise, il peut parfois s&#39avérer compliqué d&#39atteindre son but.

Si tel est votre cas, ne cherchez plus, voici le guide ultime pour la course à pied qu&#39il vous faut ! Précis, synthétique, complet et motivant. Que vous soyez un coureur débutant ou confirmé, ce livre vous offre toutes les connaissances et conseils pour optimiser au mieux votre expérience de course en fonction de",979-8857852767,https://m.media-amazon.com/images/I/61MK0k+kfqL._SY522_.jpg,Independently published (17 août 2023),Run Rise,Marathon
"Carnet d&#39Entraînement TRIATHLON: Deviens le Triathlète de tes Rêves, 240 Fiches d&#39Entraînement et 52 Récapitulatifs Semaines. Du Sprint à l&#39Ironman, ... en Natation, Cyclisme et Course à Pied",7.98,"Carnet d&#39Entraînement Triathlon : Optimisez Chaque Séance
Transformez votre préparation triathlon avec ce carnet conçu pour un contrôle absolu de vos entraînements. Divisé en deux parties, il vous guide avant et après chaque séance.
Planifiez avec Précision : Avant de démarrer, définissez vos objectifs pour une séance ciblée.
Analysez et Progressez : Post-entraînement, compilez vos données et évaluez vos sensations avec le RPE, un indicateur très utilisé dans le sport professionnel.
Profitez aussi de 52 tableaux hebdomadaires pour visualiser votre évolution et ajuster votre stratégie semaine après semaine.
En bonus, des tableaux d&#39allures pour natation, vélo, et course à pied vous aident à estimer vos temps de course.

Ce carnet n&#39est pas juste un outil de suivi, c&#39est votre partenaire pour dépasser vos objectifs.

Alors, prêt à porter ton entraînement à un tout autre niveau ?",,https://m.media-amazon.com/images/I/714KRat-MkL._SY522_.jpg,Independently published (31 décembre 2023),Acian,Marathon
Les 50 coureurs qui ont marqué l&#39histoire: Trail - marathon - Athlétisme,25.9,"Ce Beau livre réunit une galerie de portraits de coureurs à pied, d&#39hier et d&#39aujourd&#39hui, aux destins extraordinaires, glorieux ou tragiques, marqués par l’évolution des sociétés et la marche du monde.

Les 50 athlètes d’exception présentés dans cet ouvrage ont tous mérité le qualificatif “C’est le coureur du siècle !” à l’époque de leurs exploits. Néanmoins, ce ne sont pas uniquement leurs performances et leurs exceptionnelles foulées qui les mettent à l’honneur dans ce livre.
Leurs destins - extraordinaires, tragiques ou glorieux - les ont portés vers des vies mouvementées bien au-delà des seuls instants de leur gloire sportive. Projetés sur le devant de la scène grâce à leurs talents de coureurs, ils ont vu leurs existences bouleversées par l’histoire du monde en marche.
Icônes sportives, mais simples hommes et femmes, ces coureurs du siècle s’inscrivent dans l’histoire du sport et au-delà, dans l’histoire de nos sociétés modernes.",978-2807360563,https://m.media-amazon.com/images/I/71mCob2mXZL._SY522_.jpg,DE BOECK SUP; 1er édition (1 mars 2024),Sylvain Bazin,Marathon
MARATHONIEN de coeur et d&#39esprit,12.5,"« Deviens qui tu es. Fais ce que toi seul peut faire. » (Nietzsche) Ceci n&#39est pas un livre sur le marathon. Il ne s&#39agit pas d&#39une méthode d&#39entraînement. Il n&#39est pas destiné à une élite. L&#39auteur ne fréquente pas les coureurs qui accomplissent un marathon en moins de trois heures. Eux et lui ne se retrouvent pas sous la douche au même moment. C&#39est un récit, un regard et une réflexion autour du marathon. Loin de s&#39astreindre à courir cent kilomètres par semaine à l&#39entraînement, ce qui lui pèserait comme une sorte de seconde occupation professionnelle, l&#39auteur recherche, dans une pratique régulière de la course à pied, plaisir, santé et une forme de catharsis dans un monde fracturé, parfois avachi, souvent déboussolé. Au travers d&#39un périple personnel qui a mené l&#39auteur de Rome à la Grande Canarie en passant par Madrid, Copenhague, Berlin, Lisbonne, Barcelone, Paris et Siebengebirge et d&#39une évocation de trente participations consécutives aux 20 Kilomètres de Bruxelles, ce livre témoigne d&#39une époque et d&#39un phénomène populaire dans lequel le sport retrouve son essence de désintéressement matériel et de dépassement de soi.",978-2930650012,https://m.media-amazon.com/images/I/41-LDLZCIyL.jpg,Albouraq éditions (26 juin 2012),Thierry Godefridi,Marathon
Réussir son marathon: Plans d&#39entraînement du débutant au coureur confirmé,16.29,"Tu rêves de courir un marathon, mais tu ne sais pas comment t&#39y préparer ?

Dans ce guide pratique sont proposés plusieurs plans d&#39entraînement adaptés à tous les niveaux, du débutant au coureur confirmé. Avec ses conseils avisés et ses entraînements spécifiques, tu seras prêt(e) à franchir la ligne d&#39arrivée en toute confiance.


Que tu sois un débutant ou un coureur confirmé, """,979-8394866395,https://m.media-amazon.com/images/I/61AJj5dxueL._SY522_.jpg,Independently published (18 juin 2023),Julien Couderc,Marathon
"Running, courir après un objectif et l&#39atteindre: avec la méthode S.M.A.R.T - 5km, 10km, Semi-marathon, Marathon... Lancez-vous à la conquête de ... grâce à ce livre sur la course à pied",11.16,"Vous souhaitez vous lancer dans le running❓
Vous êtes débutant en course à pied et voulez progresser❓
Vous êtes déjà un coureur aguerri mais aimeriez performer sur de nouvelles distances❓

Nous avons tous un objectif ou une raison propre qui nous motive à courir, que ce soit battre un chrono, boucler un marathon ou simplement réussir à courir plus pour sa santé. Malheureusement, sans méthode ni planification précise, il peut parfois s&#39avérer compliqué d&#39atteindre son but.

Si tel est votre cas, ne cherchez plus, voici le guide ultime pour la course à pied qu&#39il vous faut ! Précis, synthétique, complet et motivant. Que vous soyez un coureur débutant ou confirmé, ce livre vous offre toutes les connaissances et conseils pour optimiser au mieux votre expérience de course en fonction de",979-8857852767,https://m.media-amazon.com/images/I/61MK0k+kfqL._SY522_.jpg,Independently published (17 août 2023),Run Rise,Marathon
Run Fast. Eat Slow.: Nourishing Recipes for Athletes: A Cookbook,27.12,"NEW YORK TIMES BESTSELLER • Fuel up like New York City Marathon champion Shalane Flanagan.

“Run Fast. Eat Slow. contains sound advice and delicious and nutritious recipes—finally a true runner&#39s kitchen companion.”—Joan Benoit Samuelson, first-ever women’s Olympic marathon champion

From world-class marathoner and four-time Olympian Shalane Flanagan and chef Elyse Kopecky comes a whole foods, flavor-forward cookbook that proves food can be indulgent and nourishing at the same time. Finally here’s a cookbook for runners that shows fat is essential for flavor and performance and that counting calories, obsessing over protein, and restrictive dieting does more harm than good.

Packed with more than 100 recipes for every part of your day, mind-blowing nutritional wisdom, and inspiring stories from two fitness-crazed women that became fast friends over fifteen years ago,",978-1623366810,https://m.media-amazon.com/images/I/81+ZrELS4HL._SY522_.jpg,Rodale Books; 1er édition (9 août 2016),Shalane Flanagan,Marathon
"Running, courir après un objectif et l&#39atteindre: avec la méthode S.M.A.R.T - 5km, 10km, Semi-marathon, Marathon... Lancez-vous à la conquête de ... grâce à ce livre sur la course à pied",9.78,"Vous souhaitez vous lancer dans le running❓
Vous êtes débutant en course à pied et voulez progresser❓
Vous êtes déjà un coureur aguerri mais aimeriez performer sur de nouvelles distances❓

Nous avons tous un objectif ou une raison propre qui nous motive à courir, que ce soit battre un chrono, boucler un marathon ou simplement réussir à courir plus pour sa santé. Malheureusement, sans méthode ni planification précise, il peut parfois s&#39avérer compliqué d&#39atteindre son but.

Si tel est votre cas, ne cherchez plus, voici le guide ultime pour la course à pied qu&#39il vous faut ! Précis, synthétique, complet et motivant. Que vous soyez un coureur débutant ou confirmé, ce livre vous offre toutes les connaissances et conseils pour optimiser au mieux votre expérience de course en fonction de",979-8857852767,https://m.media-amazon.com/images/I/61MK0k+kfqL._SY522_.jpg,Independently published (17 août 2023),Run Rise,Marathon
"Running, courir après un objectif et l&#39atteindre: avec la méthode S.M.A.R.T - 5km, 10km, Semi-marathon, Marathon... Lancez-vous à la conquête de ... grâce à ce livre sur la course à pied",19.92,"Vous souhaitez vous lancer dans le running❓
Vous êtes débutant en course à pied et voulez progresser❓
Vous êtes déjà un coureur aguerri mais aimeriez performer sur de nouvelles distances❓

Nous avons tous un objectif ou une raison propre qui nous motive à courir, que ce soit battre un chrono, boucler un marathon ou simplement réussir à courir plus pour sa santé. Malheureusement, sans méthode ni planification précise, il peut parfois s&#39avérer compliqué d&#39atteindre son but.

Si tel est votre cas, ne cherchez plus, voici le guide ultime pour la course à pied qu&#39il vous faut ! Précis, synthétique, complet et motivant. Que vous soyez un coureur débutant ou confirmé, ce livre vous offre toutes les connaissances et conseils pour optimiser au mieux votre expérience de course en fonction de",979-8857852767,https://m.media-amazon.com/images/I/61MK0k+kfqL._SY522_.jpg,Independently published (17 août 2023),Run Rise,Marathon
"Running, courir après un objectif et l&#39atteindre: avec la méthode S.M.A.R.T - 5km, 10km, Semi-marathon, Marathon... Lancez-vous à la conquête de ... grâce à ce livre sur la course à pied",18.61,"Vous souhaitez vous lancer dans le running❓
Vous êtes débutant en course à pied et voulez progresser❓
Vous êtes déjà un coureur aguerri mais aimeriez performer sur de nouvelles distances❓

Nous avons tous un objectif ou une raison propre qui nous motive à courir, que ce soit battre un chrono, boucler un marathon ou simplement réussir à courir plus pour sa santé. Malheureusement, sans méthode ni planification précise, il peut parfois s&#39avérer compliqué d&#39atteindre son but.

Si tel est votre cas, ne cherchez plus, voici le guide ultime pour la course à pied qu&#39il vous faut ! Précis, synthétique, complet et motivant. Que vous soyez un coureur débutant ou confirmé, ce livre vous offre toutes les connaissances et conseils pour optimiser au mieux votre expérience de course en fonction de",979-8857852767,https://m.media-amazon.com/images/I/61MK0k+kfqL._SY522_.jpg,Independently published (17 août 2023),Run Rise,Marathon
"Running, courir après un objectif et l&#39atteindre: avec la méthode S.M.A.R.T - 5km, 10km, Semi-marathon, Marathon... Lancez-vous à la conquête de ... grâce à ce livre sur la course à pied",5.15,"Vous souhaitez vous lancer dans le running❓
Vous êtes débutant en course à pied et voulez progresser❓
Vous êtes déjà un coureur aguerri mais aimeriez performer sur de nouvelles distances❓

Nous avons tous un objectif ou une raison propre qui nous motive à courir, que ce soit battre un chrono, boucler un marathon ou simplement réussir à courir plus pour sa santé. Malheureusement, sans méthode ni planification précise, il peut parfois s&#39avérer compliqué d&#39atteindre son but.

Si tel est votre cas, ne cherchez plus, voici le guide ultime pour la course à pied qu&#39il vous faut ! Précis, synthétique, complet et motivant. Que vous soyez un coureur débutant ou confirmé, ce livre vous offre toutes les connaissances et conseils pour optimiser au mieux votre expérience de course en fonction de",979-8857852767,https://m.media-amazon.com/images/I/61MK0k+kfqL._SY522_.jpg,Independently published (17 août 2023),Run Rise,Marathon
Marathons: 42 km 195,29.0,"Agrémenté d’une centaine de photographies, ce livre (nouvelle édition) est consacré à la beauté singulière de cette épreuve nommée ""marathon"". Il rappelle ses origines à la fois historiques et mythiques et s’interroge sur ce qui fait courir les hommes depuis l’Antiquité. Il nous plonge ensuite dans la liste devenue légendaire des marathons olympiques magnifiés par tant d’exploits et de défaillances, s&#39arrêtant, par le bais de ""portraits"" sur les héros de la course. Il nous propose enfin une balade sur les cinq continents parmi les marathons les plus réputés ou les plus étonnants (New York, Londres, Berlin, Boston, Chicago, Paris mais aussi Zürich, Montréal, Rotterdam, Venise, Tokyo, Osaka, Aukland, la grande muraille de Chine, le Kilimandjaro, le Médoc, le Cercle polaire). Il s’adresse aussi bien au passionné de la course à pied qu’au néophyte qui aimerait s’y lancer, et aussi à toux ceux qui seraient prêts à venir encourager sur le parcours, même si la chose les intrigue, les hommes et les femmes qui courent après dieu sait quoi.",978-2021350760,https://m.media-amazon.com/images/I/81YC+55mIIL._SY522_.jpg,SEUIL; Illustrated édition (9 mars 2017),Bernard Chambaz,Marathon
IKMF: International Kettlebell Marathon Federation and Associated Disciplines,19.58,"The idea of writing this book was born in 2019. The desire to share the discipline, its history, and the creation of the federation seemed to flow naturally, aiming to introduce kettlebell sport to a wider audience and explore the kettlebell comprehensively. We hope this book will help dispel misconceptions about the tool. We’ve taken a nuanced approach, and we trust that this book will provide you with deeper insights into this esoteric fitness tool.",979-8325234576,https://m.media-amazon.com/images/I/51IbYTL62fL._SY522_.jpg,Independently published (14 mai 2024),Mr Stéphane Dauvergne,Marathon
Finding Gobi (Main edition): The True Story of a Little Dog and an Incredible Journey,13.6,"Finding Gobi (Main Edition) The True Story Of A Little Dog And An Incredible Journey, 9780008227968",978-0008227968,https://m.media-amazon.com/images/I/61j4oo9IxkL._SY522_.jpg,HarperCollins (8 février 2018),Dion Leonard,Marathon
Je cours mon premier marathon: La bloggeuse qui fait courir toute la France !,15.11,"« J’ai envie de me lancer dans l’aventure du marathon, mais je doute… »
Après son livre La Magie du running, qui a séduit des milliers de sportifs et non-sportifs, retrouvez tous les conseils « pro » de Anne&Dubndidu pour vous donner l’envie de franchir le pas et… la ligne d’arrivée des 42,195 km !
Étape par étape, Anne&Dubndidu aborde toutes les questions que vous pourriez vous poser dans les moindres détails : quand saurais-je que je suis prêt, choisir le bon marathon (lieu, date…), bien s’équiper, la préparation, les exercices pour entretenir son corps, l’alimentation adaptée, l’après-marathon…
Avec en plus :
trois programmes de préparation pour un niveau plus ou moins débutant, en 16, 12 ou 8 semaines.",978-2035952950,https://m.media-amazon.com/images/I/81PPE2MMXtL._SY522_.jpg,Larousse; Illustrated édition (28 mars 2018),Anne&Dubndidu,Marathon
"CrossFit : Dépasser Vos Limites, Repousser Vos Frontières: 1000 WODS Pour vous!",8.16,"Ce livre, CrossFit : Dépasser Vos Limites, Repousser Vos Frontières vous emmènera dans un voyage captivant à travers l&#39univers du CrossFit. Que vous soyez un athlète chevronné cherchant à perfectionner vos compétences ou un débutant curieux de découvrir ce que le CrossFit a à offrir.
Le CrossFit repose sur des principes fondamentaux tels que la variété, l&#39intensité, et la fonctionnalité. Il ne se limite pas à un seul type d&#39entraînement, mais intègre une multitude de disciplines, des mouvements d&#39haltérophilie à l&#39endurance en passant par la gymnastique. Ce mélange unique de techniques et d&#39approches fait du CrossFit l&#39une des méthodes d&#39entraînement les plus complètes et les plus exigeantes qui soient.",979-8862351996,https://m.media-amazon.com/images/I/61tf3IEqikL._SY522_.jpg,Independently published (24 septembre 2023),wods crossfit,Marathon
Daniels&#39 Running Formula,10.79,"Train for your next race with the man who has been called ""the world&#39s best running coach."" With more than 55 years of experience, Jack Daniels is a legendary figure in the running community. Named the National Coach of the Year by the NCAA and honored as the Division III Women&#39s Cross Country Coach of the Century, Daniels has mentored some of the greatest names in running, including Jim Ryun, Ken Martin, Jerry Lawson, Alicia Shay, Peter Gilmore, Magdalena Lewy-Boulet, and Janet Cherobon-Bawcom. In Daniels&#39 Running Formula, he has shared training advice with hundreds of thousands of runners. Now in this updated--and definitive--fourth edition, he again refines his methods and strategies to help you run faster and stronger.
Building upon his revolutionary VDOT system, Daniels incorporates new insights gained from studying participants in his unique Run SMART Project. You&#39ll be guided through the components that make the training formula work and then learn different types of training--including treadmill training, fitness training, and training at altitude or in other challenging environments--along with age-related modifications for runners from ages 6 to 80.",978-1718203662,https://m.media-amazon.com/images/I/81MknEhcDeL._SY522_.jpg,Human Kinetics; Fourth édition (19 mars 2021),Jack Daniels,Marathon
Open Water Swimming Manual: An Expert&#39s Survival Guide for Triathletes and Open Water Swimmers,8.31,"Lynne Cox has set open water swimming records across the world, and now she has focused her decades-long experience and expertise into this definitive guide to swimming.

Open Water Swimming Manual provides a wealth of knowledge for all swimmers, from seasoned triathletes and expert swimmers to beginners exploring open water swimming for the first time. 

Cox methodically addresses what is needed to succeed at and enjoy open water swimming, including choosing the right bathing suit and sunscreen; surviving in dangerous weather conditions, currents, and waves; confronting various marine organisms; treating ailments, such as being stung or bitten, and much more. Cox calls upon Navy SEAL training materials and instructors’ knowledge of open water swimming and safety procedures to guide her research. In addition, first-hand anecdotes from SEAL specialists and stories of Cox’s own experiences serve as both warnings and proper practices to adopt.
 ",978-0345806093,https://m.media-amazon.com/images/I/61Vfz3iuMOL._SY522_.jpg,Knopf Doubleday Publishing Group (30 juillet 2013),Lynne Cox,Marathon
Performer en mode cétogène - Comment en finir avec les hypoglycémies et accéder à l&#39énergie infinie,19.9,"DU BEURRE ET DES BORNES

Ce mantra résume bien la philosophie d&#39Olivier Maria alias lowcarbfrenchie sur les réseaux sociaux. Ce sportif, fou d&#39endurance, est capable d&#39avaler les kilomètres à vélo ou en courant sans se ravitailler en sucre, sans connaître d&#39hypoglycémies ni de troubles digestifs.

Son secret: l&#39alimentation cétogène, une alimentation pauvre en glucides et riche en graisses.

Manger gras pour devenir un bon brûleur de gras et goûter à l&#39énergie inﬁnie, c&#39est désormais à votre portée grâce à ce guide. Olivier Maria vous propose un programme alimentaire et sportif de transition en 3 étapes. Sa méthode – adaptée à tous, débutant ou conﬁ rmé, sportif d&#39endurance ou de force –, il la met à votre disposition pour vous permettre d&#39explorer de nouvelles sensations, de nouvelles performances et de toucher du doigt cette liberté incroyable de ne plus dépendre du sucre pour avancer.

L&#39ouvrage fourmille de conseils pratiques. Le tout est accompagné de témoignages, de menus adaptés et de recettes testées et approuvées par la communauté d&#39Olivier !",978-2365497381,https://m.media-amazon.com/images/I/614VgRwU7-L._SY522_.jpg,Thierry Souccar; Illustrated édition (25 mai 2023),Olivier Maria,Marathon
"Running, courir après un objectif et l&#39atteindre: avec la méthode S.M.A.R.T - 5km, 10km, Semi-marathon, Marathon... Lancez-vous à la conquête de ... grâce à ce livre sur la course à pied",9.53,"Vous souhaitez vous lancer dans le running❓
Vous êtes débutant en course à pied et voulez progresser❓
Vous êtes déjà un coureur aguerri mais aimeriez performer sur de nouvelles distances❓

Nous avons tous un objectif ou une raison propre qui nous motive à courir, que ce soit battre un chrono, boucler un marathon ou simplement réussir à courir plus pour sa santé. Malheureusement, sans méthode ni planification précise, il peut parfois s&#39avérer compliqué d&#39atteindre son but.

Si tel est votre cas, ne cherchez plus, voici le guide ultime pour la course à pied qu&#39il vous faut ! Précis, synthétique, complet et motivant. Que vous soyez un coureur débutant ou confirmé, ce livre vous offre toutes les connaissances et conseils pour optimiser au mieux votre expérience de course en fonction de",979-8857852767,https://m.media-amazon.com/images/I/61MK0k+kfqL._SY522_.jpg,Independently published (17 août 2023),Run Rise,Marathon
"Running, courir après un objectif et l&#39atteindre: avec la méthode S.M.A.R.T - 5km, 10km, Semi-marathon, Marathon... Lancez-vous à la conquête de ... grâce à ce livre sur la course à pied",8.07,"Vous souhaitez vous lancer dans le running❓
Vous êtes débutant en course à pied et voulez progresser❓
Vous êtes déjà un coureur aguerri mais aimeriez performer sur de nouvelles distances❓

Nous avons tous un objectif ou une raison propre qui nous motive à courir, que ce soit battre un chrono, boucler un marathon ou simplement réussir à courir plus pour sa santé. Malheureusement, sans méthode ni planification précise, il peut parfois s&#39avérer compliqué d&#39atteindre son but.

Si tel est votre cas, ne cherchez plus, voici le guide ultime pour la course à pied qu&#39il vous faut ! Précis, synthétique, complet et motivant. Que vous soyez un coureur débutant ou confirmé, ce livre vous offre toutes les connaissances et conseils pour optimiser au mieux votre expérience de course en fonction de",979-8857852767,https://m.media-amazon.com/images/I/61MK0k+kfqL._SY522_.jpg,Independently published (17 août 2023),Run Rise,Marathon
What I Talk About When I Talk About Running,12.38,"&#39Pain is inevitable, suffering is optional&#39

A compelling mediation on the power of running and a fascinating insight into the life of this internationally bestselling writer. A perfect reading companion for runners.

In 1982, having sold his jazz bar to devote himself to writing, Murakami began running to keep fit. A year later, he&#39d completed a solo course from Athens to Marathon, and now, after dozens of such races, he reflects upon the influence the sport has had on his life and on his writing.

Equal parts travelogue, training log and reminiscence, this revealing memoir covers his four-month preparation for the 2005 New York City Marathon and settings ranging from Tokyo&#39s Jingu Gaien gardens, where he once shared the course with an Olympian, to the Charles River in Boston.

By turns funny and sobering, playful and philosophical, this is a must-read for fans of this masterful yet private writer as well as for the exploding population of athletes who find similar satisfaction in distance running.

*",978-0099526155,https://m.media-amazon.com/images/I/71skAxiMC2L._SY522_.jpg,Vintage; 1er édition (2 avril 2009),Haruki Murakami,Marathon
Eat and Run: My Unlikely Journey to Ultramarathon Greatness.,9.42,"&#39Run until you can&#39t run anymore. Then run some more. Find a new source of energy and will. Then run even faster.&#39 The words of Scott Jurek, a dominant force - and darling - in the gruelling and growing sport of ultrarunning for more than a decade. In 1999, as a complete unknown, he took the lead in the Western States Endurance Run, a 100-mile jaunt over the Gold Rush trails of America&#39s Sierra Nevada. He went on to win that race seven years in a row. Jurek was also one of the elite runners who travelled to Mexico to run with the Tarahumara Indians, as profiled in the international bestseller Born to Run. His accomplishments are nothing short of extraordinary. In Eat and Run, Jurek opens up about his life and career as an elite athlete, and about the vegan diet that is key to his success. From his Midwestern childhood of hunting and fishing to his slow transition to ultrarunning and veganism, to his epic, record-breaking races, Jurek&#39s story shows the power of an iron will and the importance of thinking of food as fuel. Full of stories of endurance and competition as well as practical advice and some of his original recipes,",978-1408833407,https://m.media-amazon.com/images/I/71lRz5zWtxL._SY522_.jpg,Bloomsbury Publishing PLC (11 avril 2013),Scott Jurek,Marathon
