Nom,Prix,Description,Isbn,Photo,Editeur,Auteur,Categorie
Vivre et renaître chaque jour,17.46,""" Ne pas se lamenter sur les bonheurs perdus... juste se contenter de les avoir vécus. ""

"" Une éviction injuste, un cancer, une séparation, ces derniers mois j&#39ai tout pris en rafale. Des épreuves ajoutées aux blessures passées. Je pourrais être au fond du trou, me plaindre du matin au soir. C&#39est tout le contraire qui se produit.

Je remonte sur scène, écris de nouvelles chansons, découvre des jeunes talents. Car, quelle que soit la tristesse de nos crépuscules, il faut toujours croire à un jour nouveau. Oublier l&#39hiver et mettre nos pendules à l&#39heure d&#39été. Vivre et renaître chaque jour.

J&#39aimerais que ce livre aide toutes celles et tous ceux qui connaissent des deuils, des difficultés, des maladies, à RENAÎTRE. """,978-2374484723,https://m.media-amazon.com/images/I/61WRyM4TnFL._SY522_.jpg,XO (29 septembre 2022),Patrick Sébastien,Radio
Law & Order: Mini Gavel Set with Sound,13.5,"DUN-DUN. Show your love for Law & Order with this officially licensed mini gavel set. With a swift rap of the gavel, you can be the judge with this iconic set piece from the show.

- Specifications: 3-inch gavel with base that is both functional and makes for a nice display piece

- Fun Sound Feature: Plays iconic ""dun-dun"" sound from the show when the gavel strikes the base

- Mini Book Included: 32-page mini book with a brief history of the show, cast profiles, and full-color images

-",978-0762482719,https://m.media-amazon.com/images/I/81IweTryRTL._SX679_.jpg,Running Press Mini Editions (5 octobre 2023),Chip Carter,Radio
Quit: The Power of Knowing When to Walk Away,11.12,"&#39Brilliant and entertaining&#39 Daniel Kahneman | &#39Quit what you are doing right now and read this&#39 Richard Thaler | &#39Engrossing, important, and grounded in science&#39 Katy Milkman

What if the secret to success is not just hard work, but knowing when to change track?

In this game-changing guide, decision-making expert Annie Duke shows why quitting what holds you back is essential for success. Drawing on new research and fascinating examples, this book offers practical strategies and explains:

Why it&#39s so hard to walk away",978-1529146165,https://m.media-amazon.com/images/I/71kTVparZgL._SY522_.jpg,Ebury Edge (21 septembre 2023),Annie Duke,Radio
40 ans et merveilleuse - Livre d&#39or -: Découvrez ce que vos proches pensent de vous | Cadeau & deco anniversaire 40 ans femme homme | 100 pages à personnaliser de photos et messages.,18.34,"♥♥ Ce livre d&#39or anniversaire est une idée de cadeau idéal pour vos proches avec laquelle vous laisserez certainement une impression durable ! ♥♥
Chaque invité peut y laisser un message personnalisé, un remerciement, ses meilleurs vœux et une photo en souvenir de ces moments de manière plus vivante que les félicitations manuscrites.
Mieux qu&#39une carte à signer, ce livre d&#39or va vous permettre de réaliser un cadeau incontournable et unique en son genre pour. Une fois créé votre livre d’or sera rangé fièrement dans une bibliothèque. Ensuite consultez-le lors des réunions de famille ou pour raconter votre jeunesse à vos futurs enfants !
♥ Idéal comme alternative originale à la fameuse carte qui finit trop souvent dans un tiroir. Et pour le même prix ! ♥",979-8757710259,https://m.media-amazon.com/images/I/6100rIDUcwL._SY522_.jpg,Independently published (1 novembre 2021),Agathe Edition,Radio
Being You: A New Science of Consciousness (The Sunday Times Bestseller),12.8,"A BOOK OF THE YEAR
GUARDIAN, THE ECONOMIST, NEW STATESMAN, FINANCIAL TIMES, BLOOMBERG

Anil Seth&#39s radical new theory of consciousness challenges our understanding of perception and reality, doing for brain science what Dawkins did for evolutionary biology.

&#39A brilliant beast of a book.&#39 DAVID BYRNE

&#39Hugely important.&#39 JIM AL-KHALILI

&#39Masterly . . . An exhilarating book: a vast-ranging, phenomenal achievement that will undoubtedly become a seminal text.&#39",978-0571337729,https://m.media-amazon.com/images/I/81p6gj1eydL._SY522_.jpg,Faber & Faber; Main édition (1 septembre 2022),Professor Anil Seth,Radio
La Créativité érotique dans le couple - Cultiver l&#39érotisme en soi - Oser l&#39imaginaire - Préserver l,11.81,"Une approche bienveillante, créative et concrète de l&#39équilibre
érotique dans le couple.
Manque d&#39apprentissage et de connaissance de soi, mythe du naturel et du spontané, parentalité qui prend le pas sur la vie de couple, nombreuses sont les causes d&#39appauvrissement de nos intimités. Pour autant, il est possible de redonner du souffle, de l&#39authenticité et de la créativité à nos espaces érotiques, à tout âge et à tout moment, si l&#39on accepte de les nourrir. Ce manuel propose des pistes de réflexion et d&#39exploration concrètes pour partir à la rencontre de sa graine érotique, unique et multiple.
Chaque partenaire apprendra à connaître son état érotique intérieur, écouter ce que dit son corps, évaluer et respecter la bulle intime de l&#39autre. Érotiser des espaces communs, se donner rendez-vous, casser la routine du rapport sexuel en créant des contraintes qui surprennent figurent parmi les nombreux exercices et explorations proposés, pour que chacun évolue vers une meilleure adéquation à soi et à l&#39autre.
Ce livre s&#39inspire de l&#39expérience de la sexologue Capucine Moreau, de son propre parcours de transformation, mais aussi de différentes pratiques artistiques, énergétiques ou spirituelles qui magnifient la créativité érotique.",978-2364904897,https://m.media-amazon.com/images/I/61CYKzC5HIL._SY522_.jpg,La Musardine; Illustrated édition (22 septembre 2022),Capucine Moreau,Radio
Tout Osez - Edition 2023 - Guide de la sexualité joyeuse et libérée,7.37,"L&#39essentiel de la collection Osez en un seul volume...
Nouvelle édition.

La collection "" Osez "" est la référence dans le domaine des guides de sexualité, abordant toutes les pratiques sexuelles de manière ludique, décomplexée et drôle.
Voici LE GUIDE "" OSEZ "" ou comment transformer chaque acte d&#39amour en un moment unique.

Un guide 100% pratique qui répond à toutes vos questions

Les thématiques sexuelles sont abordées sous l&#39angle de 60 questions, autour de l&#39anatomie féminine et masculine, des zones érogènes (Point G., Point P.), de la préparation du corps (lingerie, piercing, épilation) et bien sûr des pratiques (fellation, cunnilingus, Kama Sutra).
Mais comme son nom l&#39indique, la collection a aussi pour but de vous inciter à sortir des sentiers battus... Vous serez ainsi invités à découvrir les sextoys, le BDSM, la fessée, le libertinage et bien plus encore pour pimenter votre vie sexuelle.

Une invitation à booster votre sexualité

S&#39adressant aussi bien aux femmes qu&#39aux hommes, émaillé de témoignages, de conseils de lectures, de "" top ten "" des choses à savoir, d&#39anecdotes amusantes, largement illustré, ce livre recèle quantité d&#39informations utiles, claires et concrètes. Plongez- vous y, seul·e, à deux ou plus, si vous souhaitez approfondir vos connaissances, inventer de nouveaux jeux érotiques, ou casser la routine !",978-2364904941,https://m.media-amazon.com/images/I/61HGUJqjJ1L._SY522_.jpg,La Musardine; Illustrated édition (12 janvier 2023),Marc Dannam,Radio
All-American Ads of the 40s,6.54,"Au début de la décennie, l’Amérique était en guerre. Le patriotisme faisait partie intégrante de la vie quotidienne, et ce sentiment se reflétait dans la publicité. Quand l’Amérique est sortie victorieuse en 1945 des ténèbres de la Seconde Guerre mondiale, le boom économique de l’époque a favorisé l’augmentation la plus spectaculaire de la qualité de vie, de l’excès et du consumérisme. La fin de la guerre a également apporté une fierté et une prospérité sans précédents au peuple américain, et rien ne reflète mieux la nouvelle vague de consumérisme et de progrès que les publicités de l’époque. Le pouvoir d’achat a considérablement augmenté au cours de la seconde moitié de la décennie, avec un marché du travail florissant et des salaires plus élevés. Grâce au nouveau projet de loi G.I. Bill, des logements abordables ont été pour la première fois mis à la disposition des anciens combattants de retour au pays. Les",978-3836588584,https://m.media-amazon.com/images/I/91KM3pmm+xL._SY522_.jpg,TASCHEN; Multilingual édition (26 avril 2023),W. R. Wilkerson III,Radio
J&#39assume: Les Mémoires du fondateur de Jeune Afrique,24.9,"Né en 1928 à Djerba, Béchir Ben Yahmed aurait dû être épicier, comme son père.Il a été un acteur majeur de l&#39indépendance tunisienne, le confident et le bras droit de Habib Bourguiba, son jeune ministre de l&#39Information (à 28 ans). Il aurait pu ne faire que de la politique, et viser haut.Non, il sera éditeur de presse et journaliste.Béchir Ben Yahmed, « BBY » pour reprendre les initiales devenues célèbres, c&#39est avant tout l&#39homme d&#39une intuition improbable et révolutionnaire, le fondateur et le patron de Jeune Afrique : un « hebdo » pour tout un continent à peine sorti des nuits coloniales. BBY, c&#39est plus de soixante ans d&#39écriture et de luttes. Avec Jeune Afrique, puis, à partir de 2003, La Revue. Il sera un Africain convaincu, un militant de l&#39émancipation des « Sud », un observateur lucide de la vie internationale. Et l&#39auteur, chaque semaine, de cet édito, le fameux « Ce que je crois », où il ne craint pas de prévoir, souvent avec justesse, d&#39être tranchant, à contre-courant. D&#39assumer.Ces Mémoires écrits sans fausse diplomatie se révèlent un témoignage rare qui échappe au « récit dominant ». BBY fait revivre le soleil des indépendances, les espoirs et les désillusions de l&#39Afrique moderne, l&#39évolution complexe de la Tunisie, les guerres d&#39Orient, les convulsions du monde. Surgissent les portraits de Bourguiba, Lumumba, Che Guevara, Hô Chi Minh, Boumédiène, Senghor, Houphouët-Boigny, Foccart, Mitterrand, Bongo Ondimba, Hassan II, Alassane Ouattara, et tant d&#39autres.On y retrouve aussi ses propres combats, dignes d&#39un roman, l&#39autoportrait d&#39un professionnel exigeant qui aura influencé plusieurs générations de lecteurs. Et une réflexion émouvante sur l&#39identité, la spiritualité et la fin du chemin.
Béchir Ben Yahmed nous a quittés le 3 mai 2021, journée mondiale de la liberté de la presse. Il avait 93 ans. Presque un siècle.",978-2268106182,https://m.media-amazon.com/images/I/71FPV+k4VGL._SY522_.jpg,Editions du Rocher; Illustrated édition (3 novembre 2021),Béchir Ben Yahmed,Radio
Rien n&#39est impossible: Mon histoire pourrait être la vôtre,7.9,"« Un livre sur moi ? Vous êtes fou ! » Ce fut ma première réaction quand on me l’a proposé, il y a quelques années. Et puis, le temps passant, j’ai compris que j’avais peut-être des choses à dire. Hyperactivité, résilience, insatisfaction permanente, frustrations jamais assouvies… Et si ces mots vous parlaient plus que vous le pensez ? Je cours. Après quoi ? Je ne sais pas. Mais ce que je sais, c’est que je vais bien. Très bien, même. Je vous livre ici mon histoire ; peut-être pourra-t-elle éclairer la vôtre. M. C.

Un livre surprenant, sincère, drôle parfois, émouvant, mais jamais impudique. . Du franc-parler et une bonne dose d’émotion, mais aussi d’autodérision. Femme actuelle.",978-2253195788,https://m.media-amazon.com/images/I/51WjGBSK5yL._SY522_.jpg,Le Livre de Poche (17 janvier 2024),Michel Cymes,Radio
Il y a 40 ans naissait une légende !: Livre d&#39or 40 ans élégant | Cadeau anniversaire femme homme | 100 pages à personnaliser de photos et messages,7.23,"♥♥ Ce livre d&#39or anniversaire est une idée de cadeau idéal pour vos proches avec laquelle vous laisserez certainement une impression durable ! ♥♥
Chaque invité peut y laisser un message personnalisé, un remerciement, ses meilleurs vœux et une photo en souvenir de ces moments de manière plus vivante que les félicitations manuscrites.
Mieux qu&#39une carte à signer, ce livre d&#39or va vous permettre de réaliser un cadeau incontournable et unique en son genre pour. Une fois créé votre livre d’or sera rangé fièrement dans une bibliothèque. Ensuite consultez-le lors des réunions de famille ou pour raconter votre jeunesse à vos futurs enfants !
♥ Idéal comme alternative originale à la fameuse carte qui finit trop souvent dans un tiroir. Et pour le même prix ! ♥",979-8759534013,https://m.media-amazon.com/images/I/71JMsAbEIYL._SY522_.jpg,Independently published (4 novembre 2021),Augustin Art Collection,Radio
Survivant des réseaux sociaux - poche,7.9,"JE SUIS UN SURVIVANT. UN RESCAPÉ DES RESEAUX SOCIAUX.
Menaces d&#39attentats sur la tournée de mon spectacle. Seringues pleines de sang dans ma boîte aux lettres. Courriers anonymes me promettant la mort. Agressions dans la rue. Voici les répercussions du harcèlement permanent que je subis depuis maintenant cinq ans. Bienvenue dans ma vie, ou plutôt mon enfer. Bienvenue dans les coulisses de mon combat judiciaire. Face à des tribunaux qui n&#39y comprennent rien et laissent mes agresseurs en liberté, j&#39en viens parfois à penser que j&#39aurais mieux fait de me suicider. La gravité du cyberharcèlement aurait sans doute été davantage considérée. J&#39aime autant les réseaux sociaux que je les déteste. Ces plateformes, devenues de parfaites scènes de crimes et d&#39homicides des temps modernes, m&#39inquiètent de plus en plus. Aujourd&#39hui, n&#39importe quel détraqué peut ruiner votre vie grâce à un algorithme. Tout le monde peut devenir connu en un claquement de doigts. Balance tout et n&#39importe quoi sur n&#39importe qui. C&#39est donc ça, le monde dans lequel on vit ? Cinq ans après mes terribles ennuis judiciaires et médiatiques, voici mon bilan et les nouveaux drames qui se sont déroulés dans ma vie. Parce qu&#39en réalité, ça ne s&#39est jamais arrêté. Dans ce livre choc et poignant, Jeremstar dévoile tout ce qu&#39il n&#39a jamais pu raconter jusqu&#39à présent. Il dresse le portrait effroyable du monde de la téléréalité, de l&#39influence et des réseaux sociaux. Un monde qui l&#39a définitivement broyé.",978-2755665017,https://m.media-amazon.com/images/I/41Frd2d+CPL._SY445_SX342_.jpg,Hugo Poche (4 octobre 2023),Jeremstar,Radio
90 ans d&#39Amour,20.9,""" Il est des lectures qui marquent profondément parce qu&#39elles ouvrent des perspectives inattendues pour chacun d&#39entre nous... Voici un conte vrai. Le conte de Jacques met en scène les personnages qui ont jalonné sa vie, créant un genre nouveau, une forme de réal-poésie qui atteint parfaitement son but. "" - Jean-Louis Borloo (avant-propos)
C&#39est un livre de vie, drôle et tendre, où se mêlent des campagnes légendaires et les pires des dérapages, les dîners les plus électriques et les rencontres les plus éclectiques. On y croise, pêle-mêle, DalÍ et son poids des mots, Prévert et son choc des images, Gainsbourg et sa magie des sons, Claudia Schiffer et sa témérité, Tapie et son tempérament, Coluche et sa bonté... Comme tant d&#39autres qui m&#39ont montré le chemin.

Autant de leçons de vie. C&#39est un livre passion, passion de l&#39aventure, de l&#39Autre, de la pub, de l&#39échange, de la politique. De la victoire de Mitterrand à l&#39échec de Jospin, des premiers pas du candidat Macron au coup de foudre de Sarkozy, l&#39humanisme du dalaïlama face à l&#39inhumanité de Poutine.

C&#39est le Séguéla intime qui se dévoile, dans une version augmentée de ses Mémoires, faisant rimer humour et amour.",978-2259314046,https://m.media-amazon.com/images/I/510JXv2D3rL._SY522_.jpg,Plon (3 novembre 2022),Jacques Séguéla,Radio
"The Last of Us, la saga - Petites histoires et grands secrets sur la saga et la série TV",17.79,"Plongez dans l&#39univers fascinant de la saga vidéoludique et télévisuelle The Last of Us !
Cet ouvrage non officiel propose une véritable plongée dans l&#39univers fascinant de la célèbre franchise de Naughty Dog, mais aussi dans les coulisses de la série télévisée acclamée par la critique et le public...

RÉSUMÉ
Dans un futur proche post-apocalyptique, une épidémie provoquée par un champignon a ravagé la civilisation, transformant les humains en infectés violents. 20 ans plus tard, Joel, un homme désabusé et ayant perdu sa fille à l&#39aube de l&#39épidémie, accepte une mission périlleuse : accompagner Ellie, une jeune fille de 14 ans dont l&#39immunité pourrait sauver l&#39humanité, à travers les États-Unis...

Cet ouvrage explore tous les aspects de cet univers captivant à travers
100 faits et anecdotes, le tout via différentes sections :
- L&#39univers
- Les personnages
- Les thématiques (comparaisons jeu/série TV, mises en perspective
entre les deux versions...)
- Les coulisses de la série TV",978-2379892608,https://m.media-amazon.com/images/I/61larOmYDaL._SY522_.jpg,Omake books (31 août 2023),Vincent Jourdaa,Radio
Don&#39t Look Now,11.58,"Don&#39t Look Now, released in 1973, confirmed director Nicolas Roeg as one of the most stylish and innovative British directors of the postwar period. Adapted from a short story by Daphne du Maurier, it is both a complex study of how people come to terms with grief and a chilling tale of murder set among the canals and churches of Venice. Featuring telling performances by Julie Christie and Donald Sutherland as the couple whose daughter has tragically died, Don&#39t Look Now depicts the way in which the macabre and the everyday are intertwined. In his lucid, subtle account, Mark Sanderson describes the collaboration between director and actors that sustained the film&#39s emotional richness. He returns to du Maurier&#39s original text and to the traditions of Gothic writing that underpin Don&#39t Look Now&#39s combination of horror, melodrama and black comedy. Sanderson examines the film&#39s intricate visual style, uncovering the way in which particular motifs are used to amplify its depiction of two terrible deaths. He finds compensation for the film&#39s grimly fatalistic view of life in its celebration of sexual relationships and the power of recollection. The book includes an exclusive and in-depth interview with Roeg as well as rare and unpublished comments from Christie. In his foreword to this special edition, published to celebrate the 20th anniversary of the BFI Film Classics series, Jason Wood places Don&#39t Look Now in the context of Roeg&#39s film-making careeer, and draws upon Roeg&#39s revealing insights into the film&#39s production.",978-1844575152,https://m.media-amazon.com/images/I/615eFyoapzL._SY522_.jpg,BFI Publishing; 2nd ed. 2012 édition (1 août 2012),Mark Sanderson,Radio
"Esprit et Magie De Noël: Livre de 50 Coloriages de Scènes de Noël, Hivernales avec des Dessins Variés Apaisants et Relaxants à Colorier | 102 Pages | Grand Format |",16.47,"Entrez dans la magie de noël à travers 50 coloriages variés de scènes de Noël et d&#39hiver, intérieures, extérieures...

La variété des dessins est idéale pour vous évader dans une parenthèse chaleureuse et magique de l&#39esprit de noël, développer votre créativité et passer un moment zen !

Un grand choix d&#39illustrations soignées sont proposées dans ce livre pour votre plus grand plaisir !

🪄 Découvrez des exemples de dessins à colorier tout en bas de la page ainsi que notre collection de livres de coloriages !

Description :",979-8863246888,https://m.media-amazon.com/images/I/71USNgZuvZL._SY522_.jpg,Independently published (5 octobre 2023),Papeterie Couleur et Harmony,Radio
Bugaled Breizh: L&#39enquête,15.63,"20 ans d’enquête. Quand le 15 janvier 2004, à 12h25, le chalutier breton, le Bugaled Breizh, coule en Manche avec ses cinq hommes d’équipage, Le Télégramme relaie d’emblée cette information. Ce que ne savent pas les journalistes du quotidien régional, à cette date, à cette heure : l’enquête sur ce drame qui affecte toute la communauté maritime va durer… près de vingt ans. Cet ouvrage fait œuvre de référence pour comprendre et décrypter les raisons du naufrage du bateau de Loctudy. Pendant près de vingt ans, le quotidien Le Télégramme a mis en œuvre des moyens d’investigation journalistique sans pareil avec, à la manœuvre, le Bigouden, Pascal Bodéré. Méticuleusement, chaque détail de cette affaire est décortiqué, chaque piste creusée. Ce qui ne peut être dit avec des mots est mis en image par Laurent Lefeuvre. À la lecture de ce livre, vous plongerez dans ce qui se révèle être une affaire d’État.",978-2492394041,https://m.media-amazon.com/images/I/71-6qTZDSlL._SY522_.jpg,Le Télégramme; Illustrated édition (17 octobre 2023),Pascal Bodéré,Radio
"Neville Goddard - The Complete Collection: The reference book by Neville Goddard with all 15 books, radio lectures and lessons.",7.61,"This reference book contains ALL 14 Neville Goddard Books published between 1939 and 1966. This book is the Complete Collection of Neville Goddard on Manifesting with the Law of Assumption.

This includes all of Neville Goddard&#39s original books, the transcripts of his 1948 Course Lectures, the 1951 Radio Lectures, and the Neville Goddard Book: The Creative Use Of Imagination by Margaret Ruth Broome, a personal student of Neville Goddard.

The full contents of this reference book by Neville Goddard",979-8374650051,https://m.media-amazon.com/images/I/610WbLG7WEL._SY522_.jpg,Independently published (21 janvier 2023),Neville Goddard,Radio
Au cas où je mourrais,22.0,"""Je suis née un 13. Un chiffre qui porte malheur, pour une grande partie de mes compatriotes qui n&#39en sont pas à une contradiction près lorsque, ce même jour, ils se ruent dans les bureaux de tabac pour jouer au loto. Le 13 mars 1939, quatre mois et demi avant l&#39entrée de la France en guerre contre l&#39Allemagne, je fais plus discrètement la mienne dans ce monde où je vais grandir au rythme mesuré d&#39une famille d&#39artistes musiciens du côté de mes parents et d&#39artisans du côté de mes grands-parents."" Pour la première fois, Ève Ruggieri se raconte dans une autobiographie foisonnante où elle revient sur son parcours, ses émissions à la radio et à la télévision, comme Ève raconte ou Musiques au cooeur, et ses plus belles rencontres (Vladimir Horowitz, Herbert von Karajan, Nina Simone, Luciano Pavarotti, François Mitterrand, Jessye Norman, Roberto Alagna...), avec le talent de conteuse qu&#39on lui connaît.",978-2080419088,https://m.media-amazon.com/images/I/61AX8olPk9L._SY522_.jpg,FLAMMARION; Illustrated édition (4 octobre 2023),Ève Ruggieri,Radio
Dans les coulisses de House of the Dragon,49.95,"Découvrez la genèse d&#39une nouvelle génération de Targaryen dans ce livre luxueux qui explore les coulisses de House of the Dragon, la série phare de HBO. Adaptée de Feu et Sang, le livre culte de George R. R. Martin, cette saga télévisuelle raconte la chute de la maison Targaryen, la famille la plus puissante de Westeros. Portée à l&#39écran par les showrunners Ryan Condal et Miguel Sapochnik, cette préquelle ambitieuse a demandé un travail titanesque afin de transporter les spectateurs deux siècles avant Game of Thrones. Grâce à des interviews exclusives avec les acteurs et l&#39équipe technique, ce livre raconte cette incroyable aventure, de l&#39écriture des premiers scripts au tournage épique dans plusieurs pays. Richement illustré de concept arts, de photographies de plateau et d&#39autres visuels inédits, voici un ouvrage indispensable pour les fans : le guide ultime de la série House of the Dragon.",978-2364808751,https://m.media-amazon.com/images/I/81FdBie9J3L._SY522_.jpg,HUGINN MUNINN; Illustrated édition (20 octobre 2023),McIntyre Gina,Radio
BLACK LADIES,19.86,"Marques d’usage sur la couverture, intérieur frais. La vente de cet article permet de financer la plantation d’arbres en France :) Envoi soigné",978-2869500143,https://m.media-amazon.com/images/I/41DnYp2QLML.jpg,Editions du Jaguar (1 février 1992),Uwe Ommer,Radio
Je construis ma première radio,11.78,"Cet ouvrage instructif et ludique vous propose de réaliser simplement, pour une somme modique ou avec des composants de récupération, trois modèles originaux de récepteurs radio :
découvrez les principes de la radio à travers un récepteur ultra simple qui fonctionne sans pile ;
construisez une radio à ondes courtes avec un minimum de composants ;
réalisez une véritable radio FM qui étonnera vos amis.
Vous aurez ainsi le plaisir de capter, avec des systèmes de votre fabrication, des émissions ayant parcouru parfois des milliers de kilomètres !",978-2100500246,https://m.media-amazon.com/images/I/61Z2-ED9LzL._SY522_.jpg,Dunod (4 avril 2007),Gérard Chevaillier,Radio
