Nom,Prix,Description,Isbn,Photo,Editeur,Auteur,Categorie
,5.8,,,,,,Depression
"Les pouvoirs de l&#39iode - Préventions des cancers, lutte contre l&#39hypothyroïdie, la dépression",5.11,"Cancers, hypothyroïdie, baisse du QI, dépression, eczéma, fatigue... réhabilitons cet oligo-élément essentiel à la bonne santé !
Depuis les années 1950 le grand public mais aussi toute la communauté médicale mondiale ont été victimes d&#39une énorme erreur scientifique régulièrement colportée depuis et qui martèle que l&#39iode est toxique. En réalité cet oligo-élément nous est totalement indispensable à bonne dose, non seulement pour le fonctionnement de la thyroïde mais aussi pour celui de nos cerveaux, du système cardio-vasculaire, de l&#39estomac, de la peau, du pancréas, des organes génitaux, du système immunitaire... Malheureusement, les carences les plus basiques en iode frappent aujourd&#39hui la moitié de la planète. En Europe, la France fait partie des pays les plus touchés et nos autorités de santé le savent. Mais que fait-on ? Porté par près de 350 références d&#39articles publiés dans le monde entier, ce livre démontre qu&#39il existe pourtant des solutions simples et accessibles à tous pour améliorer énormément notre santé en réalisant le plein idéal d&#39iode à tous les âges, femmes enceintes en tête, afin de retrouver le chemin vers la pleine santé. Le présent ouvrage vous propose également d&#39y voir plus clair dans le maquis des supplémentations possibles : Mauvais choix à éviter, produits emblématiques, quelles posologies retenir pour se supplémenter efficacement... Un livre écrit pour tout public, au contenu aussi érudit que nécessaire par ces temps sanitairement si difficiles.",978-2813231505,https://m.media-amazon.com/images/I/61YvSuZzXcL._SY522_.jpg,Les éditions Trédaniel (25 avril 2024),Vincent Reliquet,Depression
J&#39ai broyé du Noir pour voir la vie en Rose: Apaiser son anxiété pour éclairer le présent et préparer le futur,15.35,"Ce livre t&#39accompagne dans un parcours vers un mieux-être face à l&#39anxiété.

En combinant des mots sincères, des réflexions profondes, et des coloriages apaisants, il t&#39offre les outils pour explorer et comprendre tes émotions vers une vie moins anxieuse.

A travers des images fortes et des exemples parlants, tu seras guidé(e) à déchiffrer les messages cachés derrière tes angoisses, à reconnaître ses origines et à développer des stratégies pour une vie quotidienne plus sereine.

Et plus encore, ce livre t&#39encourage à examiner de près comment tes propres pensées et anticipations façonnent ton ressenti, te donnant les clés pour rebâtir une existence où l&#39anxiété ne prend plus le dessus.

C&#39est un pas vers la liberté intérieure, une invitation à cultiver la patience et l&#39acceptation de soi dans un monde qui peut souvent sembler accablant.",979-8878959872,https://m.media-amazon.com/images/I/61mp31C812L._SY522_.jpg,Independently published (8 février 2024),Célestine Leroi,Depression
C&#39est quoi demain ?: Journal d&#39une éducatrice burn-outée,19.25,"4ème de couverture
Ce livre est un concept littéraire qui mêle les genres, emmêle les mots et entremêle le temps pour démêler un burn-out pourtant bien ancré.
Plongez dans les méandres du burn-out au travers de l&#39histoire de cette éducatrice spécialisée confrontée aux tumultes de l&#39institution. Teintée de poésie incisive, retrouvez des histoires de quotidien éducatif qui cotoient la réalité professionnelle.
De regain en rechute, le temps joue sa partie.
Subir ou actionner, le jeu s’est tout permis.
Rester ou partir, comment évoluer dans une situation inextricable ?
Donner un après à un présent insoutenable, comment rebondir à sa propre chute ?",978-2959299704,https://m.media-amazon.com/images/I/61qw5EiqcnL._SY522_.jpg,Maison grendi (30 mai 2024),Ingrid Romane,Depression
TikTok m&#39a tuée: Journal intime d&#39une ado accro à TikTok,9.29,"""TikTok m&#39a tuée"" est l&#39histoire vraie de Lucie, une adolescente de 14 ans prise au piège par son addiction à TikTok. Ce livre, écrit avec sa mère, raconte comment cette application populaire est passée d&#39un simple passe-temps à une obsession dangereuse qui a bouleversé sa vie.",979-8864572238,https://m.media-amazon.com/images/I/71IiTqti5-L._SY522_.jpg,Independently published (16 octobre 2023),Lucie HEUREND,Depression
"Ce n&#39est pas toi le problème !: Anxiété, sommeil, problèmes de poids... Les clés pour agir contre les troubles psy qui te gâchent la vie !",18.0,"Aujourd’hui, près d’une personne sur deux présentera un trouble psychiatrique au moins une fois au cours de sa vie. Tu en fais peut-être partie, ou l’un de tes proches. Mais soyons clair : aucune raison d’en avoir honte. Et surtout, ce n’est pas toi le problème ! Réseaux sociaux, alimentation industrielle, sédentarité, injonctions sociétales… : nos modes de vie ont considérablement évolué, affectant notre santé physique mais aussi mentale. Et si l’on sait désormais faire face aux pathologies touchant le corps, c’est beaucoup moins le cas pour notre fonctionnement psychologique.
Dans cet ouvrage, je te propose des clés pour prévenir ces maux et limiter leur influence sur ton quotidien.
   • Dépression, anxiété, troubles du sommeil et alimentaires, perte d’estime de soi :",979-1028529246,https://m.media-amazon.com/images/I/81m53sK1CAL._SY522_.jpg,LEDUC; 1er édition (24 octobre 2023),PsykoCouac,Depression
The Anxious Generation: How the Great Rewiring of Childhood Is Causing an Epidemic of Mental Illness,30.96,"THE NO.1 SUNDAY TIMES BESTSELLER

‘Jonathan Haidt is a modern-day prophet, disguised as a psychologist . . . He points the way forward to a brighter, stronger future for us all’ Susan Cain

&#39Compelling, readable – and incredibly chilling . . . remarkably persuasive&#39 Telegraph

&#39Urgent and essential&#39 Guardian

&#39One of the most terrifying books I have read . . . some of the statistics Haidt quotes are truly shocking&#39 Evening Standard",978-0241647660,https://m.media-amazon.com/images/I/61L5Kw5osLL._SY522_.jpg,Allen Lane; 1er édition (26 mars 2024),Jonathan Haidt,Depression
"Et Si Tu Vidais ton Sac ?: Thérapie par l’écriture de lettres. Exprime, libère et soulage tes émotions grâce à la courrier-thérapie. Livre de développement personnel à compléter",14.04,"Tu te sens souvent submergé(e) par des émotions négatives ?
Tu as du mal à trouver la paix intérieure face au stress quotidien ?
Tu cherches un moyen efficace pour exprimer et comprendre tes sentiments les plus profonds ?

"" Et Si Tu Vidais ton Sac ?"" est ton guide personnel vers la guérison émotionnelle.

Ce livre t&#39offre un espace pour explorer tes émotions, les exprimer en mettant des mots sur tes maux et les transformer positivement. À travers des exercices d&#39écriture de lettres (à brûler, à conserver ou à expédier), tu apprendras à dialoguer avec ton intérieur, facilitant ainsi ton chemin vers la libération émotionnelle.

A une époque où comprendre et prendre soin de sa santé mentale est essentiel, "" Et Si Tu Vidais ton Sac ?"" te donne les clés pour agir.

Que tu souhaites",,https://m.media-amazon.com/images/I/5130OvxPq6L._SY522_.jpg,Independently published (18 mars 2024),Claire Vermont,Depression
Exister: Le plus intime et fragile des sentiments,16.2,"« À vous dont le sentiment d’exister a été attaqué, ébranlé ou détruit, la société ne propose plus que cette issue banalisante : la “dépression”. De victimes de la vie, vous vous retrouvez “malades”. Il y a pourtant des alternatives. Elles sont libératrices. Elles redonnent une dignité. Je vous les présente dans ce livre. »",978-2228933452,https://m.media-amazon.com/images/I/51He1RJi6bL._SY522_.jpg,Payot; Enlarged édition (10 mai 2023),Robert Neuburger,Depression
Passez à l&#39ACT: Pratique de la thérapie d&#39acceptation et d&#39engagement,12.49,"La référence incontournable pour devenir un expert de l&#39ACT.
La thérapie d’acceptation et d’engagement fait aujourd’hui partie des grands classiques. Son efficacité est reconnue dans le traitement de nombreux troubles psychologiques. En mettant l’accent sur les valeurs du patient et son engagement à changer, l’ACT s’avère efficace dans le traitement de la dépression, de l’anxiété, du stress, des dépendances, du trouble de la personnalité borderline, et de bien d’autres encore.
Cette nouvelle édition, entièrement remaniée, présente tous les concepts de l’ACT ainsi que de très nombreux nouveaux outils, métaphores, exercices, qui faciliteront encore la pratique. Russ Harris y dévoile notamment un outil de conceptualisation novateur, la Question du Choix, qui guidera le professionnel dans sa pratique.",978-2807329980,https://m.media-amazon.com/images/I/71+zD668dhL._SY522_.jpg,DE BOECK SUP; 3e édition (3 mai 2022),Russ Harris,Depression
"L&#39anorexie, mon bouclier mortel - Livre autobiographique - Témoignage anorexie: Livre TCA - Livre histoire vraie",11.22,"Cela me tenait à cœur d’écrire mon roman autobiographique pour retracer mon parcours de guérison des troubles alimentaires.
Ce livre m’a d’ailleurs aidé dans mon propre chemin de guérison.
Mais je l’ai fait pour offrir un témoignage authentique sur toutes les étapes que j’ai traversées pour m’en sortir. J’ai voulu y partager toutes les réflexions personnelles que j’ai eues, toutes les prises de conscience qui m’ont été nécessaires.
Je l’ai également écrit pour offrir un guide afin d’aider les proches à mieux comprendre et ainsi mieux aider les personnes qui souffrent de troubles alimentaires (anorexie, boulimie…).",979-1041532667,https://m.media-amazon.com/images/I/71e07sDDdrL._SY522_.jpg,Norainnoflower Édition (29 janvier 2024),Mathilde CRESPEL Norainnoflower,Depression
On ne peut pas plaire à tout le monde: Un livre sur la confiance en soi,13.99,"Détachez-vous du regard des autres et libérez votre véritable personnalité !

Et si je vous disais que peu importe votre physique, vos actions, vos décisions, vous serez toujours critiqué ? Que même si vous étiez parfait, certains persisteraient à vous juger ?

Peur, abandon, regrets…

Le manque de confiance en soi empêche énormément de personnes de s’épanouir et de s’accomplir. La plupart du temps, les gens s’oublient pour faire plaisir au plus grand nombre. Ils vivent à travers le regard des autres et n’osent pas par peur d’être exclus, de déplaire ou de décevoir. Dans ce livre, vous apprendrez comment vous défaire de l’opinion des autres.",979-8405475813,https://m.media-amazon.com/images/I/71SyaZ0-COL._SY522_.jpg,Independently published (31 janvier 2022),Valentin Auwercx,Depression
"Journal de Suivi de l&#39Humeur: Carnet Quotidien de Bien-être et de Santé Mentale pour Suivre votre Humeur, Sommeil , et Sentiments pour Soulager l&#39Anxiété & la Depression",6.96,"Que vous soyez aux prises avec la dépression, le stress ou que vous souhaitiez simplement être plus positif dans votre vie, vous trouverez tout ce dont vous avez besoin dans notre journal. Ce journal de suivi d&#39humeur vous accompagnera dans votre démarche de suivi quotidien de votre santé mentale.

Il vous aidera à mieux vous connaître et à identifier les domaines de votre vie qui vous causent le plus de chagrin, de stress ou de bonheur. Vous apprendrez à prendre soin de vous et à savoir quand il est temps de faire une pause. Vous découvrirez également comment équilibrer votre vie dans tous ses aspects et la gérer plus efficacement.",,https://m.media-amazon.com/images/I/61FUwihx5YL._SY522_.jpg,Independently published (25 novembre 2023),Hilal Creations Press,Depression
Libéré de l&#39enfer intérieur: L&#39histoire pratique d&#39un survivant de la dépression et de l&#39anxiété,14.14,"Plongez dans l&#39histoire authentique d&#39un homme qui a navigué à travers les profondeurs déconcertantes de la dépression et de l&#39anxiété pour émerger, non seulement victorieux, mais également armé d&#39un savoir précieux. Ce récit sincère dépasse le simple partage d&#39expériences pour exposer avec une clarté perspicace un cheminement personnel. Ce n&#39est pas uniquement un récit : c&#39est un compagnon de route. Contrairement à beaucoup de récits similaires, ce livre est guidé par quelqu&#39un qui comprend véritablement, ayant lui-même traversé ces tourments.
En effet, ces pages ne se contentent pas de raconter, elles accompagnent. Elles offrent des perspectives, des leçons apprises et des techniques concrètes éprouvées. Ce livre, enrichi par une empathie fondée sur une expérience commune, offre bien plus qu&#39un simple aperçu. Il propose un éclairage authentique et un guide pratique, élaboré à partir d&#39une connaissance intime des difficultés, pour s&#39affranchir de cet enfermement mental.",979-8878375597,https://m.media-amazon.com/images/I/615jjulCWTL._SY522_.jpg,Independently published (3 février 2024),Freddy G,Depression
,16.01,,,,,,Depression
Comment Arrêter De Trop Penser: Le Guide Ultime pour se Libérer de la Pensée Excessive. Nouvelles Techniques et Conseils Pratiques pour Améliorer sa Vie et Retrouver la Paix Intérieure,8.39,"Vous sentez-vous constamment envahi par un sentiment d&#39anxiété ?
Vos pensées sont-elles devenues une spirale sans issue qui vous frustre et vous prive de la paix intérieure ?
Si vous avez répondu ""oui"" à l&#39une de ces questions, vous pouvez enfin pousser un soupir de soulagement, car la solution à vos problèmes est enfin arrivée !",979-8883091727,https://m.media-amazon.com/images/I/71lzx+zgYEL._SY522_.jpg,Independently published (27 février 2024),Amos Lloyd,Depression
Comment vas-tu ? (Vraiment !): Le journal d&#39écriture thérapie - 120 questions pour se reconnecter à soi,14.45,"Infos pratiques :
- Format A5
- 138 pages
- 120 questions (4 mois d&#39écriture et d&#39introspection)

L’écriture revêt un caractère thérapeutique qui s&#39avère être une excellente façon de s’investir dans son développement personnel. Ce livre et ces séances d&#39écriture introspective vont vous aider à vous reconnecter à votre inconscient, vous aligner avec vos besoins et vous connecter à vos émotions.
Découvrez ce que vous avez vraiment à dire, ce que vous avez oublié volontairement ou inconsciemment, et ce que vous préférez ne pas voir.",,https://m.media-amazon.com/images/I/611EMxJKEUL._SY522_.jpg,Independently published (12 décembre 2022),Papier Bohème,Depression
Comment traiter le TDA-H grâce à la pleine conscience ?: Programme en 8 séances,6.33,"Un programme de 8 semaines efficace et sans médicament du TDAH grâce à la pleine conscience.
Si l’efficacité de la pleine conscience n’est plus à démontrer, elle n’avait jamais été adaptée à la population présentant des troubles de l’attention avec ou sans hyperactivité. Grâce à Lidia Zylowska et John T. Mitchell, c’est aujourd’hui chose faite.
Ce manuel présente aux professionnels le programme MAPs (Mindful Awareness Practices for ADHD) permettant de pratiquer la pleine conscience avec les patients présentant un TDA-H. L’objectif est de les aider à mieux réguler leurs émotions, à mieux contrôler le vagabondage de leur esprit et à développer une meilleure image d’eux-mêmes. Le livre contient :",978-2807329881,https://m.media-amazon.com/images/I/71AM+L2CvlL._SY522_.jpg,DE BOECK SUP; 1er édition (3 mai 2022),Lidia Zylowska,Depression
Mots Mêlés Anti-Stress Gros Caractères: Livre jeux + de 1200 mots cachés pour retrouver la sérénité intérieure | Adultes et Séniors | Grand format 21 mots par grille,19.15,"⭐ Vous cherchez une manière ludique de vous détendre et plonger dans une atmosphère apaisante ? 🙏
👉 Découvrez notre livre de mots cachés conçu pour ceux qui recherchent un moment de calme et de tranquillité.
Chaque grille de mots mêlés est soigneusement élaborée pour vous immerger pleinement dans l&#39univers anti-stress. Des mots réconfortants accompagnés de citations apaisantes vous emportent vers un monde où le stress n&#39a pas sa place !
✔ Caractéristiques :
60 grilles et + de 1200 mots à démêler : 21 mots par grille
Pages de solutions à la fin du cahier
Grand Format 21.60 x 27.94 cm pour faciliter la lecture",979-8879376104,https://m.media-amazon.com/images/I/711KXSFtfZL._SY522_.jpg,Independently published (12 février 2024),Edition LuxMots,Depression
"La Psychiatrie pour les Nuls, grand format, 2e éd",15.1,"De la folie aux neurosciences, sondez l&#39évolution de la psychiatrie
Le psychiatre, souvent, fait peur. On lui attribue un regard en rayons X, capable de détecter derrière un comportement apparemment normal une tare cachée. On a honte de le consulter. Et s&#39il allait nous considérer comme dérangés ? Pourtant, on attend beaucoup de la psychiatrie.
Cet ouvrage retrace son histoire, mais aussi son évolution (diagnostic, thérapies, médicaments, neurosciences, psychiatrie de l&#39enfant, des personnes âgées, du stress, etc.) ainsi que la place du patient dans celle-ci et le concept de rétablissement.

Découvrez comment :
Distinguer dépression, bipolarité et schizophrénie
Appréhender la dépression selon l&#39âge
Comprendre les phobies, TOC et autres troubles anxieux
Reconnaître les symptômes de la paranoïa et de l&#39autisme
L&#39aide des psychiatres est multiple (psychothérapie, hypnose, TCC, etc.)
Et bien plus encore...",978-2412094594,https://m.media-amazon.com/images/I/51bj9-Kn4yL._SY522_.jpg,Pour les nuls; 2e édition (4 avril 2024),Jacques Hochmann,Depression
Du burn-out au born-out : les 7 étapes vers la renaissance: Autrice du blog Partage ton burn-out,6.99,"Du burn-out au born-out, le chemin vers la renaissance

Vous êtes concerné par le burn-out et recherchez des solutions pour rebondir ? Ou l’un de vos proches est concerné et vous souhaitez l’aider ? Au final vous voulez mieux comprendre ce syndrome complexe et savoir comment en remonter la pente abrupte ?
Structuré et structurant, ce livre vous y accompagne, pas à pas, au travers de 7 étapes. Manuel précis et accessible il vous permettra de comprendre chacun des engrenages du burn-out. Tel un programme d’accompagnement, l’auteure a parsemé le texte d’exercices de coaching et d’introspection. Astrid Le Fur vous invite à embrasser l’idée que le burn-out peut être une opportunité pour vous créer une vie plus épanouissante et vous en montre le chemin.",978-2311626223,https://m.media-amazon.com/images/I/71UPtKs4j6L._SY522_.jpg,VUIBERT; 1er édition (13 septembre 2022),Astrid Le Fur,Depression
No Bad Parts,19.38,"Discover an empowering new way of understanding your multifaceted mind and healing the many parts that make you who you are. Is there just one? We have been taught to believe we have a single identity, and to feel fear or shame when we can control the inner voices that don&#39t match the ideal of who we think we should be. Yet Dr. Richard Schwartz research now challenges this theory. All of us are born with many sub-minds or parts, says Dr. Schwartz. These parts are not imaginary or symbolic. They are individuals who exist as an internal family within us and the key to health and happiness is to honor, understand, and love every part. Dr. Schwartz&#39s Internal Family Systems (IFS) model has been transforming psychology for decades. With No Bad Parts you&#39ll learn why IFS has been so effective in areas such as trauma recovery, addiction therapy, and depression treatment and how this new understanding of consciousness has the potential to radically change our lives. Here you&#39ll explore: The IFS revolution - how honoring and communicating with our parts changes our approach to mental wellness - Overturning the cultural, scientific, and spiritual assumptions that reinforce an outdated mono mind model - The ego, the inner critic, the saboteur - making these often - maligned parts into powerful allies - Burdens - why our parts become distorted and stuck in childhood traumas and cultural beliefs - How IFS demonstrates human goodness by revealing that there are no bad parts - The Self-discover your wise, compassionate essence of goodness that is the source of healing and harmony - Exercises for mapping your parts, accessing the Self, working with a challenging protector, identifying each part&#39s triggers, and more IFS is a paradigm - changing model because it gives us a powerful approach for healing ourselves, our culture, and our planet. As Dr. Schwartz teaches, Our parts can sometimes be disruptive or harmful, but once they&#39re unburdened, they return to their essential goodness. When we learn to love all our parts, we can learn to love all people - and that will contribute to healing the world.",978-1683646686,https://m.media-amazon.com/images/I/71CuznUr+IS._SY522_.jpg,Sounds True Adult (6 juillet 2021),Richard Schwartz,Depression
Tout ce que je garde au fond de moi,5.76,"Tout ce que tu gardes au fond de toi et qui devrait sortir.
Libère-toi. Confie-toi. Sauve-toi.
Des questions pertinentes sur l’amour, l’amitié, la famille. Evacue tout ce qui ne va pas et retrouve confiance en toi.
Effacer le passé. Changer le présent et construire un avenir meilleur.
Le bonheur est à la portée de tous, il suffit de se poser les bonnes questions.
Ce livre est là pour t’aider.",,https://m.media-amazon.com/images/I/61yNw+lR4JL._SY522_.jpg,Independently published (6 août 2023),Delphine Laffon,Depression
Solve For Happy: Engineer Your Path to Joy,13.61,"&#39He explains how even in the face of the unthinkable, happiness is still possible&#39 – Stylist

Solve for Happy is the equation for happiness. A startlingly original book about creating and maintaining happiness, written by a top Google executive with an engineer&#39s training and fondness for thoroughly analyzing a problem.

Mo Gawdat, a remarkable thinker whose gifts had landed him top positions in half a dozen companies and who – in his spare time – had created significant wealth, realized that he was desperately unhappy. A lifelong learner, he attacked the problem as an engineer would, examining all the provable facts and scrupulously following logic. When he was finished, he had discovered the equation for enduring happiness.

Ten years later, that research saved him from despair when his college-aged son, Ali – also intellectually gifted – died during routine surgery. In dealing with the loss, Mo found his mission: he would pull off the type of &#39moonshot&#39 that he and his Google [X] colleagues were always aiming for: he would help ten million people become happier by pouring his happiness principles into a book and spreading its message around the world.

One of",978-1509809950,https://m.media-amazon.com/images/I/81pZ-vligdL._SY522_.jpg,Bluebird (10 janvier 2019),Mo Gawdat,Depression
Halte aux métaux lourds: ENFIN LA SOLUTION ! Votre programme pour détoxifier votre organisme en toute sécurité et retrouver l&#39énergie,7.24,"Saviez-vous que près d&#39un Français sur deux a dans le corps un taux de métaux toxiques supérieur aux recommandations officielles ?
Alimentation, produits d’hygiène, traitements de santé, sans parler de la pollution ambiante, les métaux lourds sont omniprésents. Ils sont à l&#39origine d’une partie des maladies neurodégénératives (Parkinson, Alzheimer, SLA...), de nombreux troubles (fatigue chronique, dépression, fibromyalgie...), ainsi que de certains cancers, d’hypersensibilité chimique ou encore d’électro-hypersensibilité.
Dans ce guide, vous découvrirez comment :
» Identifier les métaux lourds et mesurer votre degré d’intoxication.",979-1028529642,https://m.media-amazon.com/images/I/71OraZYlorL._SY522_.jpg,LEDUC; 1er édition (19 septembre 2023),Stéphane Tetart,Depression
,11.22,,,,,,Depression
"FORCE MENTALE: Le système en 8 étapes pour se forger un caractère de fer, surmonter l&#39adversité avec courage et développer une profonde résilience (Exercices inclus)",17.64,"Saviez-vous que le courage peut s&#39apprendre ?



Ce guide vous aidera à renforcer votre esprit afin d’affronter les défis et l&#39adversité. Apprenez à vous autodiscipliner, à améliorer votre dialogue intérieur et à comprendre comment gérer vos émotions...

Souvent, nous croyons que les personnes dotées d&#39une grande force mentale ont un secret que nous ne connaissons pas.

Ce livre révèle",979-8846090248,https://m.media-amazon.com/images/I/71hwIjCrhIL._SY522_.jpg,Independently published (11 août 2022),Robert Mercier,Depression
,13.61,,,,,,Depression
