Nom,Prix,Description,Isbn,Photo,Editeur,Auteur,Categorie
La Goutte Journal de suivi: Carnet de bord crise de goutte à remplir / Cahier d&#39autosurveillance arthropathie uratique ou goutteuse à compléter / ... des rois/acide urique,9.15,"Tout d&#39abord, pour avoir un aperçu de l&#39intérieur du livre, cliquez sur l&#39option ""feuilleter"" ou consultez la dernière de couverture.


Ce carnet, véritable outil de mémoire et de planification est destiné à toutes les personnes souffrant de la goutte. Très complet, il sera votre allié et votre compagnon de route dans le combat contre vos rhumatismes microcristallins.


Grâce à ce cahier de suivi, vous pourrez noter quotidiennement toutes les données concernant votre arthropathie uratique (symptômes, douleurs, rendez-vous médicaux, traitements...).
Ainsi, toutes les informations relatives à votre maladie seront regroupées dans un endroit unique. Vous pourrez donc présenter aux professionnels de santé un historique précis de votre maladie pour qu&#39il puisse vous soigner plus précisément et efficacement.",,https://m.media-amazon.com/images/I/61jIw05SNlL._SY522_.jpg,Independently published (6 juin 2022),Mémento et Santé RT éditions,Gestion de la douleur
Se Debarrasser de Ses Douleurs: Les gestes simples de la méthode Tao,18.86,"Qui n&#39a pas souhaité, quelle que puisse être l&#39intensité de ses douleurs, s&#39en débarrasser de façon instantanée ou, au minimum, les atténuer ?
C&#39est ce que propose ce livre, grâce à des gestes simples issus de la médecine traditionnelle chinoise millénaire.
Ils seront efficaces dans un grand nombre de situations (hors blessure), ainsi que nous l&#39avons constaté et testé à de multiples reprises.
De culture taoïste, Weiming Shi pratique depuis longtemps cet enseignement ancestral qu&#39il partage avec générosité et humilité pour soulager des cas douloureux allant de la migraine ou de la sinusite au blocage du dos ou d&#39un bras, de l&#39impossibilité de marcher à une douleur chronique de la hanche...",979-1096132294,https://m.media-amazon.com/images/I/51a-3oN2whL._SY522_.jpg,Talma Studios (15 août 2019),Weiming Shi,Gestion de la douleur
Le Self-Havening : un super pouvoir entre vos mains,18.0,"« Un ouvrage passionnant qui montre à quel point le self-Havening est efficace et promis à un bel avenir. »
–Jean-Michel Gurret, psychothérapeute, spécialiste français de l’EFT

Révolutionnaire par sa simplicité et son efficacité, le self-Havening est une nouvelle technique corps-esprit issue des dernières découvertes en neurosciences.
Elle utilise le toucher pour apaiser et modifier la chimie cérébrale. En effectuant de simples stimulations tactiles sur les bras, les mains et le visage, on offre à son cerveau un havre de paix (haven signifie « refuge » en anglais) lui permettant de surmonter les traumatismes, se libérer du stress et de l’anxiété.",978-2365497985,https://m.media-amazon.com/images/I/71L8T6koGUL._SY522_.jpg,THIERRY SOUCCAR (10 avril 2024),Kate Truitt,Gestion de la douleur
"YOGA sur CHAISE SENIORS Plus de 60 ans: 10 MINUTES PAR JOUR avec INSTRUCTIONS ÉTAPE PAR ÉTAPE - AMÉLIORER L&#39ÉQUILIBRE, LA FLEXIBILITÉ ET LA CONSCIENCE",17.79,"★ UN PROGRAMME SOIGNEUSEMENT ORGANISÉ© AVEC DES IMAGES ET DES INSTRUCTIONS ÉTAPE PAR ÉTAPE ! ★
Le maintien d&#39un bon équilibre, d&#39une démarche et d&#39une amplitude de mouvement est la clé d&#39une bonne santé et du bien-être

🌿 Ce programme© est parfait pour :
◆ les débutants à la recherche d&#39un moyen à faible risque et à faible enjeu d&#39essayer le yoga pour la première fois
◆ pour l&#39arthrose des mains, des genoux et des hanches
◆ AMÉLIOREZ VOTRE ÉQUILIBRE EN MINIMISANT LE RISQUE DE CHUTE
◆ les personnes âgées à la recherche d&#39exercices doux pour les articulations et reconnus pour RÉDUIRE LES DOULEURS ET LES DOULEURS",979-8386284558,https://m.media-amazon.com/images/I/61jiBxB5G8L._SY522_.jpg,Independently published (9 mars 2023),Jonathan Price,Gestion de la douleur
LA FIBROMYALGIE-QUAND LE CORPS HURLE SES SOUFFRANCES-: Du patient expérientiel au patient expert,6.21,"Quand cette maladie invisible, en sommeil jusqu&#39ici dans ton ton corps, trouve la brèche pour s&#39insérer insidieusement et attendre le bon moment.

Puis suite à un élément déclencheur ou précipitant, la fibromyalgie va se déployer et prendre possession de tout ton être dans sa totalité.
Alors, commence une lutte incessante mais elle te broie, te tord de douleurs, te malmène, te prive d&#39énergie, de sommeil jusqu&#39à te terrasser complètement.
Tu comprends, à ce moment précis, qu&#39il va falloir être plus subtile que le maladie, et faire un long travail sur toi, si tu veux aller de l&#39avant jusqu&#39à atteindre la résilience.

Ce récit témoignage est une tranche de ma vie que je vous délivre brute, comme je la vis, avec mon expérience.

Quand la maladie s&#39est emparée de moi, et que je ne pouvais plus lutter, j&#39ai visionné un reportage sur ""le patient expert"" et j&#39ai réalisé que c&#39était exactement le chemin qu&#39il fallait emprunter, pour un début de reconstruction vers un avenir adapté.
D&#39où mon investissement dans l&#39aide aux patients atteints de la même pathologie que moi, avec mon diplôme d&#39éducation thérapeutique.
Ainsi que l&#39aide aux familles et entourages proches, afin qu&#39ils soient à même d&#39aider et de mieux comprendre ce que nous vivons réellement dans nos corps, ""quand ils hurlent leurs souffrances"", et de rendre visible au maximum aux yeux de tous cette maladie invisible, qui a cruellement besoin de sortir du placard !

Ce livre est est ouvrage résolument positif, qui part d&#39une situation terriblement douloureuse et que je transforme en un parcours de vie vers un nouvel avenir adapté, pour vivre mieux avec la maladie.

Ce livre a été envoyé au ministère de la santé et à plusieurs sénateurs pour mettre un coup de projecteur sur cette pathologie invisible, non imaginaire et qui existe bel et bien, pour tenter de lui donner une petite visibilité",979-8387618956,https://m.media-amazon.com/images/I/61dQc6nheCL._SY522_.jpg,Independently published (19 mars 2023),STÉPHANIE GHIGI,Gestion de la douleur
"J&#39ai gueri de la fibromyalgie: Ce livre, preface par le Dr AlainTuan Qui, temoigne du combat que l auteure a mene durant dix ans contre la ... a gueri avec diverses methodes naturelles.",17.61,"La fibromyalgie est une maladie classée par la médecine traditionnelle comme étant invalidante, neurodégénérative et évolutive, sans cause et sans traitement et sans possibilité de guérison. Et pourtant, si on pouvait en guérir ? Au sortir d’un combat de dix années, Évelyne Jouval, à travers son témoignage, prouve que c’est possible. Cela au prix de recherches personnelles. Incomprise par le corps médical et livrée à elle-même face à une médecine conventionnelle ne lui apportant aucune solution, elle a rejeté tout traitement chimique et s’est orientée vers diverses alternatives qui lui ont été bénéfiques.Si cette maladie, dite invisible, échappe à tout examen, pourquoi le nombre de malades explose-t-il ? Pourquoi, alors que la fibromyalgie ne répond à aucun traitement, les professionnels de la santé prescrivent-ils, à outrance, des antidépresseurs, anti-inflammatoires, antidouleurs….aux effets secondaires bien connus ? Pourquoi négligent-ils toute pollution aux métaux lourds ? Pourquoi ne se penchent-ils pas sur les méfaits de l’alimentation industrielle ? Pourquoi ne prennent-ils pas au sérieux les répercussions sur l’organisme d’un corps en déséquilibre acido-basique ? Pourquoi ne proposent-ils pas un changement de l’alimentation et/ou une détoxification de l’organisme En réponse à ces questions, Évelyne Jouval a exploré diverses pistes. Thérapies, médecines alternatives non conventionnelles et changement d’alimentation lui ont ouvert le chemin de la guérison. Elle vous livre son parcours. Ce livre est préfacé par le Docteur Alain Tuan Qui dont voici un extrait de sa préface « Ce livre témoignage nous fait comprendre que la voie de la guérison n’est pas une mais multiple, avec le vécu de chacun, ses souffrances et son environnement personnel et familial. Il faut savoir que dans ce genre de maladie, la dimension holistique (globale) de l’être prend tout son sens et son importance. L’art de savoir décrypter les messages du corps et de la tête, passera par la rencontre de thérapies aussi bien physiques (nutrition, jeûne, phytothérapie, massages, acupuncture, Yoga, Qi Gong, médecine chinoise et ayurvédique, …) que psychologiques (psychothérapie, psychanalyse, hypnose, sophrologie, …) - à chacun de trouver sa voie et surtout de rencontrer le médecin et/ou le thérapeute qui sera à l’écoute avec ses yeux, ses oreilles, son toucher, son savoir et surtout son cœur. Donner un espoir de guérison à tous les fibromyalgiques, mais aussi aider leurs proches et les médecins à mieux les comprendre, les soutenir et les guider vers le chemin de la guérison : Ce livre aura alors atteint son objectif.",978-1540856241,https://m.media-amazon.com/images/I/51adOqyMf7L._SY522_.jpg,CreateSpace Independent Publishing Platform; 1er édition (14 décembre 2016),Evelyne Jouval,Gestion de la douleur
"Fibromyalgie - Ce que vous voyez, ce que je ressens.",16.65,"« Je suis enfermée dans un corps de douleurs. »Voilà comment la fibromyalgie a investi Virginie il y a neuf ans. À tout juste vingt-six ans, en pleine jeunesse, des douleurs intenses et une fatigue profonde la submergent à tel point qu’elle doit s’arrêter de travailler et ne se reconnaît plus. Un long parcours médical, d’examens et un diagnostic : fibromyalgie. Ce témoignage intense explique bien le chemin de cette jeune femme des premiers symptômes au diagnostic, de cette colère face à « Dame fibro », et enfin l’acceptation jusqu’à devenir maman malgré la maladie. Les personnes atteintes de fibromyalgie, de maladies invisibles, se retrouveront dans ce texte et se sentiront comprises et légitimes. Il est destiné également à la famille et aux proches des malades, pour les aider à mieux comprendre ce que souffrir de fibromyalgie représente. Ce livre permettra aux gens d’être plus à l’écoute et tolérants à la souffrance des autres, même s’il est difficile de comprendre et d’admettre quelque chose qui ne se voit pas.

Ce livre témoignage est illustré de photographies aquatiques pour sensibiliser les lectrices et lecteurs à travers les mots et les images. Ce livre a été au cœur d&#39un projet artistique, dont une vidéo ""Rendre visible l&#39invisible"" à découvrir ici : https://www.youtube.com/watch?v=mBAUROPQl2I",978-2955786406,https://m.media-amazon.com/images/I/61gQSYTdiJL._SY522_.jpg,978-2-9557864 (8 juillet 2016),Virginie Zakarian Clave,Gestion de la douleur
Toxic Superfoods: How Oxalate Overload Is Making You Sick--and How to Get Better,14.24,"An acclaimed nutrition educator reveals how the foods you’re eating to get healthy might be making you sick.
 
“Sally Norton’s well-researched book makes a truly important contribution to the literature in revealing just how much oxalates can damage the human body.”—Nina Teicholz, author of The Big Fat Surprise
 
If you’re eating a healthy diet and you’re still dealing with fatigue, inflammation, anxiety, recurrent injuries, or chronic pain, the problem could be your spinach, almonds, sweet potatoes, and other trusted plant foods. And your key to vibrant health may be quitting these so-called superfoods.

After suffering for decades from chronic health problems, nutrition educator Sally K. Norton, MPH, discovered that the culprits were the chemical toxins called oxalates lurking within her “healthy,” organic plant-heavy diet. She shines light on how our modern diets are overloaded with oxalates and offers fresh solutions including:

• A complete, research-backed program to safely reverse your oxalate load
• Comprehensive charts and resources on foods to avoid and better alternatives
• Guidance to improve your energy, optimize mood and brain performance, and find true relief from chronic pain
 
In this groundbreaking guide, Norton reveals that the popular dictum to “eat more plants” can be misleading.",978-0593139585,https://m.media-amazon.com/images/I/817wiPVsJKL._SY522_.jpg,Harmony/Rodale (3 janvier 2023),Sally K. Norton MPH,Gestion de la douleur
Soulager durablement la fibromyalgie et les douleurs chroniques: Guide pratique - Méthode MIGERR Intégrale,15.62,"La maladie est une épreuve qui bouleverse l’existence tout entière. Elle est un chemin et non une fin en soi. Elle nous oblige à nous arrêter et, dans ces moments, à poser un regard neuf sur nous, notre histoire de vie, notre mode de vie et les facettes que le composent. Le processus de guérison nous demande de parcourir les unes après les autres ces étapes, d’accepter ce qui est à accepter et de changer ce qui peut l’être. L’amour de soi est, à tous égards, l’incontournable compagnon du fabuleux processus de guérison.
Loin des clichés et de la simplification abusive, Elizabeth Rojas Ruiz partage ici une réflexion nourrie à la fois de son parcours personnel de la maladie, de la recherche scientifique et de son expérience comme coach de la méthode MIGERR. Le livre « Soulager durablement la fibromyalgie et les douleurs chroniques – guide pratique-méthode MIGERR intégrale », nous propose une approche psychocorporelle basée sur des exercices simples et accessibles à tous, dont le but ultime est de permettre à chaque individu de se réapproprier les rênes de sa propre guérison. Un livre essentiel et une méthode prouvée pour accroître notre bien-être général, soulager durablement la fibromyalgie et les douleurs chroniques, agrandir notre spiritualité, reliant la totalité de ce qui nous entoure et nous habite.",978-2956600947,https://m.media-amazon.com/images/I/613Z4X3LGkL._SY522_.jpg,AFNIL (14 mars 2024),Elizabeth Rojas Ruiz,Gestion de la douleur
Sophrologie et la Douleur Chronique: Soulager la douleur chronique,19.74,"Introduction: La sophrologie est une technique de relaxation et de développement personnel qui peut être utilisée pour soulager la douleur chronique. Elle combine des exercices de respiration, de visualisation et de relaxation musculaire pour aider les personnes à gérer leur douleur et à améliorer leur qualité de vie.

Contenu: Ce livre vous propose une introduction complète à la sophrologie et à son application à la gestion de la douleur chronique. Vous y trouverez des exercices pratiques que vous pourrez mettre en œuvre immédiatement pour soulager votre douleur.

Le livre commence par une présentation de la sophrologie et de ses principes fondamentaux. Il aborde ensuite les différents types de douleur chronique et les mécanismes par lesquels la sophrologie peut les soulager.

Le reste du livre est consacré à des exercices pratiques de sophrologie. Ces exercices sont conçus pour vous aider à :",979-8877408418,https://m.media-amazon.com/images/I/610Xy06fyiL._SY522_.jpg,Independently published (25 janvier 2024),Sophie LAROCHE,Gestion de la douleur
Opium for the Masses: A Practical Guide to Growing Poppies and Making Opium,17.16,sd,978-1559501149,https://m.media-amazon.com/images/I/619kL1De4zL._SY522_.jpg,Loom Panics Unlimited (1 septembre 1994),Jim Hogshire,Gestion de la douleur
Le Costume sur Mesure pour la Spondylarthrite Ankylosante: Traiter les Symptômes Grâce à l’Alimentation et l’Exercice pour une Vie Saine et Sans Douleur,16.71,"""Le Costume sur Mesure pour la Spondylarthrite Ankylosante:Traiter les Symptômes Grâce à l’Alimentation et l’Exercice pour une Vie Saine et Sans Douleur"" est un livre inspirant écrit par quelqu&#39un qui a fait l&#39expérience de première main des défis et des difficultés de vivre avec la spondylarthrite ankylosante. Dans ce livre, l&#39auteur partage son histoire personnelle et les stratégies qu&#39il a utilisées pour gérer et contrôler sa maladie, ainsi que comment elles ont contribué à améliorer sa qualité de vie. De plus, en raison de sa formation en tant que physiothérapeute et chercheur dans le domaine des facteurs humains, l&#39auteur présente des preuves scientifiques et des lectures complémentaires qui sont extrêmement utiles pour comprendre la maladie en termes simples et savoir comment la gérer.",979-8862225600,https://m.media-amazon.com/images/I/71n7ERITJ8L._SY522_.jpg,Independently published (26 septembre 2023),PhD Carlos Viviani,Gestion de la douleur
Déjouer la douleur chronique - Une approche scientifique révolutionnaire pour reconditionner son cerveau et retrouver le bien-être,18.18,"Un grand pas en avant dans le traitement de la douleur chronique.
En 2019, l&#39Organisation mondiale de la Santé (OMS) a reconnu la douleur chronique comme une maladie à part entière. Maux de dos, maux de tête, fibromyalgie, élancements musculo-squelettiques : l&#39ensemble de ces affections représente un véritable enjeu de santé publique en Occident. En France, c&#39est 12 millions d&#39individus qui ont reçu ce type de diagnostic. Or, les traitements médicaux administrés ont à ce jour démontré une efficacité limitée, et on répète inlassablement aux personnes aux prises avec ce trouble qu&#39il n&#39existe pas de remède pour le soigner.
Les dernières recherches en neurosciences ont révélé que la douleur chronique, bien qu&#39elle soit réelle et ressentie physiquement, est la majorité du temps générée par des courts-circuits neuronaux dans le cerveau. Lui-même affaibli par la douleur chronique pendant plusieurs années et frustré par le manque de traitement efficace, le psychothérapeute Alan Gordon a mis au point une thérapie de reconditionnement de la douleur qui a éliminé ses propres symptômes et transformé sa vie ainsi que celle de milliers de patients. Ce traitement non médicamenteux révolutionnaire repose sur des techniques en psychologie qui visent à recâbler le cerveau afin de briser le cycle de la douleur chronique. Avec humour et habilement vulgarisé, les auteurs présentent les recherches scientifiques sur lesquelles ils s&#39appuient et proposent une marche à suivre complète, étape par étape, pour traiter la maladie.
Un ouvrage rempli d&#39espoir qui s&#39adresse tant aux personnes aux prises avec la douleur chronique qu&#39aux professionnels de la santé qui disposent présentement de peu d&#39outils pour accompagner leurs patients.",978-2761962308,https://m.media-amazon.com/images/I/61FQLfsbKkL._SY522_.jpg,de l&#39Homme (18 janvier 2024),Alain Gordon,Gestion de la douleur
La Goutte Journal de suivi: Carnet de bord crise de goutte à remplir / Cahier d&#39autosurveillance arthropathie uratique ou goutteuse à compléter / ... des rois/acide urique,18.02,"Tout d&#39abord, pour avoir un aperçu de l&#39intérieur du livre, cliquez sur l&#39option ""feuilleter"" ou consultez la dernière de couverture.


Ce carnet, véritable outil de mémoire et de planification est destiné à toutes les personnes souffrant de la goutte. Très complet, il sera votre allié et votre compagnon de route dans le combat contre vos rhumatismes microcristallins.


Grâce à ce cahier de suivi, vous pourrez noter quotidiennement toutes les données concernant votre arthropathie uratique (symptômes, douleurs, rendez-vous médicaux, traitements...).
Ainsi, toutes les informations relatives à votre maladie seront regroupées dans un endroit unique. Vous pourrez donc présenter aux professionnels de santé un historique précis de votre maladie pour qu&#39il puisse vous soigner plus précisément et efficacement.",,https://m.media-amazon.com/images/I/61jIw05SNlL._SY522_.jpg,Independently published (6 juin 2022),Mémento et Santé RT éditions,Gestion de la douleur
"Kinesiology Taping for Rehab and Injury Prevention: An Easy, At-Home Guide for Overcoming Common Strains, Pains and Conditions",10.91,"Learn how to apply and use kinesiology tape (""K Tape"") to allieve everday injuries and ailments with over 200 step-by-step photos and instructions for every part of the body.

Widely used by physical therapists, chiropractors and personal trainers, kinesiology tape provides incredible support while simultaneously stretching so your body can perform its normal range of motion. Now you can utilize this amazing material at home. Simply buy a roll at your local drugstore and follow the taping methods described in this book to reduce pain, rehab an injury and get back in the game.

Providing clear step-by-step instructions and helpful photos, the author shows how to tape the most common injuries and conditions anywhere on the body:

• Neck pain
• Frozen shoulder
• Bicep strain
• Tennis elbow
• Wrist sprain
• Tight IT band
• ACL/MCL sprains
• Achilles tendinitis
• Ankle sprain
• Plantar fasciitis",978-1612435534,https://m.media-amazon.com/images/I/71SW6vz86HL._SY522_.jpg,Ulysses Press; 1er édition (26 avril 2021),Aliana Kim,Gestion de la douleur
Mon cahier de suivi de douleur: Cahier à remplir pour l’évaluation et le suivi de la douleur ; Suivi de symptômes de la douleur chronique ; Journal ... de santé (Carnet de santé pour adulte),19.65,"Arrêtez de vivre votre vie dans la douleur !

Ce cahier de suivi de douleur, magnifiquement conçu, est la première étape pour aider votre médecin et améliorer votre diagnostic. La douleur chronique peut devenir normale pour vous, mais une fois que vous et votre médecin aurez trouvé un traitement approprié, vous commencerez à réaliser à quel point la vie est plus facile sans cette douleur.

Plus vous fournirez d’informations à votre médecin, mieux ce sera. Ce journal comporte des blocs et des sections pour toutes les informations dont les médecins ont besoin pour approfondir votre diagnostic et votre traitement ultérieur. Vous commencerez également à constater vous-même ces schémas que vous n’aviez peut-être pas réalisés auparavant et à modifier votre comportement afin de minimiser le risque de déclencher davantage votre douleur.",979-8614387501,https://m.media-amazon.com/images/I/51ETSr9eKLL.jpg,Independently published (21 février 2020),Mes Cahiers Pratiques,Gestion de la douleur
Fibromyalgie : Solutions Naturelles pour Soulager la Douleur: Alimentation - Sophrologie | Yoga - Traitements Naturels | Naturopathie - Nutrition,9.97,"Edition 2021. Livre mis à jour en 2021.

La fibromyalgie est une maladie souvent mal comprise par le grand public et les médecins. Ce livre vise à briser les mythes sur la fibromyalgie et propose des stratégies pratiques qui peuvent aider toute personne vivant avec cette maladie à la gérer avec succès et à retrouver une vie épanouie et agréable.
L&#39objectif de ce livre est de vous aider à améliorer votre qualité de vie avec une approche centrée sur la reconstruction : diminuer la douleur, contrôler l&#39inflammation, améliorer le sommeil et améliorer le niveau d&#39énergie.",979-8632183734,https://m.media-amazon.com/images/I/414VPOSgwlL.jpg,Independently published (30 mars 2020),Pauline PATRY,Gestion de la douleur
Cahier de suivi de douleurs: Carnet à remplir pour l’évaluation et le suivi de la douleur | Journal suivi de symptômes de la douleur chronique ... de santé (Journal Fibromyalgie),11.8,"CARNET DE SUİVİ DE DOULEURS
ce cahier vous permettra de suivre quotidiennement vos douleurs afin d&#39aider votre médecin à améliorer son diagnostic .
LES CARACTERİSTİQUES :
110 Pages d’évaluation de la douleur : des pages très détaillées et merveilleusement conçues qui seront utilisées pour enregistrer et suivre les douleurs chroniques Ces pages comprennent :
Date, heure de début et de fin de la douleur, durée de la douleur
Sévérité de la douleur
Des croquis anatomiques pour marquer exactement l&#39endroit où la douleur se manifeste sur votre corps.",979-8498666662,https://m.media-amazon.com/images/I/71ERRhTNSkL._SY522_.jpg,Independently published (17 octobre 2021),Stephan Oj Edition,Gestion de la douleur
