Nom,Prix,Description,Isbn,Photo,Editeur,Auteur,Categorie
"Thérapie du corps: 70 pathologies - Leurs symboliques, les solutions de la médecine chinoise, les remèdes naturels",24.95,"À chaque mal ses solutions !

Acné, agoraphobie, angoisse, boulimie, épuisement, migraines, vertiges… ces désagréments vous sont familiers ? Retrouvez dans ce livre 70 maux du quotidien, leur signification symbolique et des remèdes naturels pour les neutraliser. Que ce soit par la gemmothérapie, l’homéopathie, les huiles essentielles ou encore la médecine chinoise, découvrez comment prendre soin de votre corps et le rééquilibrer naturellement.

Therapieducorps, c&#39est :
- un large panel de méthodes naturelles pour faire son choix en toute conscience ;
- des conseils pour associer bien-être physique et mental ;
- l’expertise d’un praticien en médecine chinoise et naturopathe.",978-2017165170,https://m.media-amazon.com/images/I/81MM4DKGX1L._SY522_.jpg,Hachette Pratique; Illustrated édition (27 avril 2022),Pierre Meunier,Guerison
"The Mindbody Prescription: Healing the Body, Healing the Pain",6.97,"The New York Times bestselling guide to a healthy and pain-free life.

Musculoskeletal pain disorders have reached epidemic proportions in the United States, with most doctors failing to recognize their underlying cause. In this acclaimed volume, Dr. Sarno reveals how many painful conditions-including most neck and back pain, migraine, repetitive stress injuries, whiplash, and tendonitises-are rooted in repressed emotions, and shows how they can be successfully treated without drugs, physical measures, or surgery.

""My life was filled with excruciating back and shoulder pain until I applied Dr. Sarno&#39s principles, and in a matter of weeks my back pain disappeared. I never suffered a single symptom again...I owe Dr. Sarno my life."" - Howard Stern",978-0446675154,https://m.media-amazon.com/images/I/816rC2h2yzL._SY522_.jpg,Grand Central Publishing; Reprint édition (1 octobre 1999),John E. Sarno MD,Guerison
Prakriti : Votre constitution ayurvédique,26.4,"L&#39Ayurvéda estime que chaque individu est un phénomène unique et qu&#39il est indivisible du cosmos. Tout ce qui existe dans le macrocosme existe dans le microcosme. Chaque individu est une manifestation de la conscience cosmique.Notre prakriti, ou constitution individuelle, est le modèle inné de nos tendances psychologiques et physiques, la source de tout ce qui se manifeste dans notre microcosme personnel. Cet ouvrage est le plus important travail de référence occidental au sujet de la constitution ayurvédique. Il introduit prakriti et la philosophie qui l&#39a créée, et nous indique comment utiliser cette connaissance pour perfectionner notre santé et notre bien-être.La science de guérison de l&#39Ayurvéda est entièrement basée sur la connaissance de prakriti ou constitution individuelle. Lorsque chaque individu connaît sa propre constitution, il peut alors définir, par exemple, l&#39alimentation et le style de vie qui lui conviennent le mieux. La nourriture d&#39une personne peut devenir un poison pour une autre personne. Ainsi, s&#39il veut avoir une vie saine, heureuse et équilibrée, la connaissance de sa constitution est absolument nécessaire.Le Dr Robert E. Svoboda est certainement l&#39un des plus importants experts occidentaux en Ayurvéda. Prakriti : Votre constitution ayurvédique a été publié pour la première fois en 1989. C&#39est un travail décisif sur le concept de l&#39homéostasie individuelle. La profonde érudition que l&#39auteur a reçue en Inde pendant une dizaine d&#39années de son mentor tantrique rend cet ouvrage unique et essentiel.",978-2951801943,https://m.media-amazon.com/images/I/51eU1jzxvLL._SY522_.jpg,Editions Turiya (20 avril 2005),Dr Robert E. Svoboda,Guerison
Traitement de la douleur par l’acupuncture de Maitre Tung,11.96,"En Francais!

Étant donné que l’acupuncture est une thérapie à large spectre, le clinicien peut utiliser les points décrits ici pour traiter une région anatomique particulière, peu importe le diagnostic en médecine occidentale, même si mes futurs ouvrages aborderont en détails la différenciation des causes des maladies. En utilisant ces points, vous observerez des résultats rapides.",979-8409187804,https://m.media-amazon.com/images/I/61fkTGudLgL._SY522_.jpg,Independently published (3 février 2022),Robert Chu PhD,Guerison
"The Body Keeps the Score: Brain, Mind, and Body in the Healing of Trauma",9.94,"THE INTERNATIONAL BESTSELLER - OVER 3 MILLION COPIES SOLD

&#39Dr. van der Kolk&#39s masterpiece combines the boundless curiosity of the scientist, the erudition of the scholar, and the passion of the truth teller&#39 Judith Herman, author of Trauma and Recovery

The effects of trauma can be devastating for sufferers, their families and future generations. Here one of the world&#39s experts on traumatic stress offers a bold new paradigm for treatment, moving away from standard talking and drug therapies and towards an alternative approach that heals mind, brain and body.",978-0141978611,https://m.media-amazon.com/images/I/71BCCd79xgL._SY522_.jpg,Penguin; 1er édition (24 septembre 2015),Bessel van der Kolk,Guerison
Yin Yoga Therapy and Mental Health,15.55,"This highly illustrated guide teaches yoga therapists and mental health professionals how to integrate Yin Yoga into practice and treatment plans as part of a holistic approach to healing and treating a variety of mental health challenges and brain injuries.
Yin yoga is an accessible form of yoga consisting of mainly floor based low force stretching, perfect for all patients regardless of physical limitations. The use of Yin yoga when combined with breath work and meditation can decrease anxiety, improve overall mood, and create a sense of well-being.
With explanations on the principles of practice, such as asanas, meditation, breathwork and how to integrate different psychological methods to decrease emotional suffering and increase self-care along with examples of how to apply these principles for a range of mental health conditions; this guide is essential reading for all practitioners interested in an integrated approach to healing.",978-1848194151,https://m.media-amazon.com/images/I/71vuSgEfXoL._SY522_.jpg,Singing Dragon (21 juin 2022),Tracey Meyers,Guerison
DEVENIR GUERISSEUR: Le guide complet du débutant pour libérer votre potentiel de guérison,6.96,"Êtes-vous prêt à libérer votre potentiel de guérisseur ? ""Devenir guérisseur : Le guide complet du débutant pour libérer votre potentiel de guérison"" est là pour vous guider dans ce parcours transformateur. Rédigé à l&#39intention d&#39un large public de débutants, ce livre complet et pratique fournit des conseils étape par étape pour devenir un guérisseur compétent et responsable.
Découvrez le monde fascinant de la guérison en explorant les principes fondamentaux qui sous-tendent cette pratique ancestrale. De la compréhension du rôle de l&#39énergie dans la guérison à l&#39exploration d&#39un large éventail de modalités de guérison, vous acquerrez une compréhension approfondie de la manière d&#39exploiter vos capacités innées de guérison.
Apprenez à réveiller votre potentiel de guérison en explorant les principes",979-8850343286,https://m.media-amazon.com/images/I/612eBE4kMrL._SY522_.jpg,Independently published (4 juillet 2023),LUC BISSMAN,Guerison
Journal Intuitif: 100 jours pour développer votre intuition,8.48,"Le journal intuitif est un magnifique outil pour ceux et celles qui désirent développer leurs capacités intuitives au travers de l&#39écriture. Ce journal vous permet de répondre intuitivement à des questions pendant 100 jours afin d&#39explorer votre intuition et développer votre sixième sens.

Vous disposez de 210 pages pour répondre aux questions, et noter la date, vos interprétations et les résultats finaux de votre enquête; soit un total de 100 entrées.

Profitez de votre journal intuitif!",978-1435796959,https://m.media-amazon.com/images/I/61tsibxNgAL._SY522_.jpg,"Lulu Press, Inc (12 décembre 2022)",Isabel S Churchill,Guerison
"Kinesiology Taping for Rehab and Injury Prevention: An Easy, At-Home Guide for Overcoming Common Strains, Pains and Conditions",10.31,"Learn how to apply and use kinesiology tape (""K Tape"") to allieve everday injuries and ailments with over 200 step-by-step photos and instructions for every part of the body.

Widely used by physical therapists, chiropractors and personal trainers, kinesiology tape provides incredible support while simultaneously stretching so your body can perform its normal range of motion. Now you can utilize this amazing material at home. Simply buy a roll at your local drugstore and follow the taping methods described in this book to reduce pain, rehab an injury and get back in the game.

Providing clear step-by-step instructions and helpful photos, the author shows how to tape the most common injuries and conditions anywhere on the body:

• Neck pain
• Frozen shoulder
• Bicep strain
• Tennis elbow
• Wrist sprain
• Tight IT band
• ACL/MCL sprains
• Achilles tendinitis
• Ankle sprain
• Plantar fasciitis",978-1612435534,https://m.media-amazon.com/images/I/71SW6vz86HL._SY522_.jpg,Ulysses Press; 1er édition (26 avril 2021),Aliana Kim,Guerison
"Heal Your Wounds & Find Your True Self: Self Betrayal: Finally, a Book That Explains Why Its So Hard Being Yourself!",14.11,"In this empowering book, Lise Bourbeau demonstrates that all problems, whether physical, emotional or mental, stem from five significant wounds: rejection, abandonment, humiliation, betrayal and injustice. The book contains detailed descriptions of these wounds and the masks we&#39ve developed to hide them. With this information, you will learn to identify the causes of specific problems in your life, and begin the path towards complete healing and discovering your true self.",978-2920932838,https://m.media-amazon.com/images/I/6137z3L58wL._SY522_.jpg,Lotus Light Publications; 1er édition (7 juillet 2020),Lise Bourbeau,Guerison
De l&#39ombre à la lumière un chemin de guérison: Déprogrammer le subconscient,15.81,"La vie de l&#39être humain passe d&#39un moment de lumière, d&#39extase, dans le ventre de maman à la dure réalité de la vie terrestre au moment de la naissance qui va faire apparaître en nous un imposteur qui deviendra notre partie ténèbre.
Accompagné de ce double, nous voguerons d&#39un état de bien-être à un sentiment de désolation faisant souvent le yoyo entre les deux.
Tout cela explique bien les problèmes que nous vivons dans notre existence : maladie psychique, physique, dégénérative.
La lumière peut vaincre les ténèbres nous permettant de passer de l&#39inconscient à l&#39un-conscient.
C&#39est l&#39histoire de ce livre, l&#39histoire de l&#39être humain et de son trépied physique, psychique, spirituel et les outils pour évoluer.",979-8853614222,https://m.media-amazon.com/images/I/61SFW2lb6mL._SY522_.jpg,Independently published (9 août 2023),Dr Michel Geeraert,Guerison
Vivre mieux avec une polyarthrite: Aide-toi et la médecine t’aidera,9.18,"Isabelle de Séréville est atteinte depuis 25 ans d’une polyarthrite rhumatoïde. Elle est aujourd’hui, à 53 ans, bien plus en forme qu’elle ne l’était à 28. En écrivant ce livre, elle a voulu partager son expérience avec d’autres malades et leur expliquer comment, après des années de galère et de souffrance, elle a réussi à retrouver une vie normale.   En effet, pour lutter contre cette maladie évolutive et douloureuse, suivre un traitement médical est nécessaire. Mais ce n’est pas suffisant. Il faut savoir que, outre la prédisposition génétique, certains facteurs déclenchent, entretiennent ou aggravent les phénomènes inflammatoires.   Son approche positive et globale, guidée par des professionnels, vous montre comment on doit changer certaines habitudes de vie pour retrouver la santé et le moral : apprendre à mieux se nourrir, à gérer son stress, retrouver une activité physique, prévenir les infections, réfléchir sur soi, positiver son mental…   Ce témoignage, à la fois clair, concis et documenté, sera utile à toutes les personnes atteintes par cette maladie aussi bien qu’à leur entourage. Isabelle de Séréville a écrit ce livre pour eux, en espérant les aider à vivre mieux, même avec une polyarthrite !",978-2956361121,https://m.media-amazon.com/images/I/51kscRPKwEL.jpg,Isabelle de Séréville (15 février 2018),Isabelle de Séréville,Guerison
Le réveil de votre puissance,16.22,"Voici un livre comme aucun autre. Vous pourrez vivre, grâce à lui, plusieurs séances de thérapie qui vous permettront de changer votre vie et de retrouver votre puissance fondamentale. Mon but est de vous aider à guérir votre être, votre corps et votre esprit en vous aidant à enlever les conditionnements qui vous ont été imposés tout au long de votre vie.

Ce livre est un puissant outil pour ceux qui souffrent, qui se sentent impuissants, malades, ou qui ont l’impression de lutter chaque jour de leur vie. Vous trouverez dans cet ouvrage de nombreuses solutions pratiques et efficaces pour changer, guérir, évoluer et vous comprendre.

Mais ce livre n’est pas seulement destiné à ceux qui souffrent le plus, il est aussi un formidable tremplin pour tous ceux qui souhaitent guérir, être heureux, créatifs, puissants, déterminants et pour tous ceux qui souhaitent peu ou prou améliorer leur vie et se réinventer.

Prenez ce livre comme un compagnon de route, bienveillant à votre égard et toujours disponible, qui va parfois vous bousculer, vous chambouler, mais pour votre bien. Cet outil thérapeutique vous permettra, si vous vous engagez vraiment en faisant tous les exercices proposés, de vous libérer et de trouver le moyen de réaliser vos rêves.",978-1540822987,https://m.media-amazon.com/images/I/71fK0ZyN+7L._SY522_.jpg,CreateSpace Independent Publishing Platform (22 janvier 2017),Marc Isenschmid,Guerison
You Can Heal Your Life,18.38,"Louise L. Hay, bestselling author, is an internationally known leader in the self-help field. Her key message is: ""If we are willing to do the mental work, almost anything can be healed"" The author has a great deal of experience and firsthand information to share about healing, including how she cured herself after being diagnosed with cancer. An excerpt from You Can Heal Your Life: Life Is Really Very Simple. What We Give Out, We Get Back What we think about ourselves becomes the truth for us. I believe that everyone, myself included, is responsible for everything in our lives, the best and the worst. Every thought we think is creating our future. Each one of us creates our experiences by our thoughts and our feelings. The thoughts we think and the words we speak create our experiences.",978-0937611012,https://m.media-amazon.com/images/I/71sHP9NoMNL._SY522_.jpg,Hay House; Highlighting édition (1 janvier 1984),Louise L. Hay,Guerison
Carnet d&#39Anamnèse et Outils pour Thérapeute: Cahier pour Professionnels de Santé | Carnet à remplir | Bilans et Anamnèses | Fiches à compléter,7.69,"VOIR LES PHOTOS DE L&#39INTERIEUR DU CARNET A REMPLIR PLUS BAS DANS LA FICHE PRODUIT
Je suis heureuse de vous proposer ce carnet de suivi patient qui vous permettra, en tant que thérapeute, coach et professionnel de santé et du bien être, de noter toutes les informations nécessaires à un accompagnement de qualité.

Crée en collaboration avec mon amie et partenaire de résilience, Bélen Ramirez, sophrologue dans la région paloise, nous avons imagé un carnet complet, avec l&#39anamnèse détaillée du patient, mais aussi des outils d&#39accompagnement et de suivi individuel. Ces fiches à imprimer sont à découvrir dans la dernière partie du cahier et vous permettrons de compléter le travail entrepris lors des séances.",,https://m.media-amazon.com/images/I/71yE+aBJuRL._SY522_.jpg,Independently published (29 septembre 2023),Mme Karine Beghin,Guerison
Neurofunctional scalp acupuncture,11.29,"Neurofunctional Scalp Acupuncture is a manual that contains nearly 200 illustrations and color photographs. This work covers different types of Scalp Acupuncture, such as Jiao Shunfa, Lin Xue-Jian, or Ming Qing Zhu, among others. It also includes the Western perspective of neuroanatomy, neurophysiology, and neuroscience in a highly visual, practical, and easy-to-understand manner. This book is intended for students, therapists, healthcare professionals, and both novice and experienced acupuncturists eager to learn more.
Juan Hahn is an acupuncturist and manual therapist. Although trained in various natural therapies, he specializes in his own personal style of acupuncture that synergizes different techniques from classic acupuncture to cutting-edge modern practices. He holds a nursing degree and has pursued postgraduate studies in Pain Management, Pre-Hospital Emergencies, Critical Care, Operating Room, and Resuscitation.",979-8883191298,https://m.media-amazon.com/images/I/619oi8vgt6L._SY522_.jpg,Independently published (28 février 2024),Juan Hahn,Guerison
Pain Free (Revised and Updated Second Edition): A Revolutionary Method for Stopping Chronic Pain,10.66,"Live pain free! Now fully updated and revised throughout, this million-copy bestseller will help you feel and move better.

“This book is extraordinary, and I am thrilled to recommend it to anyone who’s interested in dramatically increasing the quality of their physical health.”—Tony Robbins

With a new foreword by John Lynch, Hall of Fame NFL safety and general manager of the San Francisco 49ers

Can gentle exercise help with chronic pain? Yes! That is the revolutionary message of the Egoscue Method, a breakthrough system for eliminating musculoskeletal pain without drugs, surgery, or expensive physical therapy. Developed by Pete Egoscue, an internationally renowned physiologist and injury consultant to some of the most successful performers in all walks of life, the Egoscue Method has helped millions of people with an astounding success rate of over 90 percent. The Method uses a series of gentle exercises and carefully constructed stretches called “E-cises” to teach the body to return to its natural, pain-free state. Inside, you’ll find detailed photographs and step-by-step instructions for dozens of E-cises specifically designed to provide quick and lasting relief of

• joint discomfort, including back and neck pain; achy knees, hips, and shoulders; arthritis; and injured ankles.
• muscle and soft-tissue problems, including rotator cuff injuries, tendinitis, and common foot ailments.
• shooting pains, including sciatica and carpal tunnel syndrome.
• and much more, including headaches, vertigo, and fatigue.

With this book, you’re on your way to regaining the greatest gift of all: a pain-free body!",978-1101886649,https://m.media-amazon.com/images/I/71M7zEn5fQL._SY522_.jpg,Random House Publishing Group; Updated édition (16 novembre 2021),Pete Egoscue,Guerison
Formules magiques des leveurs de maux et coupeurs de feu,9.7,"Un recueil écrit simplement, facile à lire et à comprendre, réservé à tous ceux qui veulent apprendre, comprendre et pratiquer les formules magiques des leveurs de maux, guérisseurs et coupeurs de feu, sur eux mêmes ou sur leur entourage. Spécial débutants, vous y trouverez tous les conseils pour obtenir une réussite maximale lors de la mise en application des formules, ainsi qu&#39une cinquantaine de formules magiques de guérison des maux les plus courants de la vie quotidienne (abcès, allergies, aphtes, arthrose, brûlures, coups, contusions, coupures, dépression, diarrhées, entorses, piqûres, migraine, mal de dents, verrues etc...). Un recueil essentiel pour découvrir cet univers si particulier.",978-1511525534,https://m.media-amazon.com/images/I/61ywXzQ3lkL._SY522_.jpg,CreateSpace Independent Publishing Platform (31 mars 2015),Gérard A. Bissman,Guerison
Reiki Niveau 3 : le manuel du Reiki 3ème degré,16.05,"Ce livre est un manuel correspondant aux enseignements du troisième niveau de Reiki Usui (3ème degré). Il a été conçu pour accompagner l&#39élève avant, pendant, ou après le stage, au cours duquel il accèdera au statut de Maître Reiki.

Le livre revient d&#39abord brièvement sur les acquis des niveaux 1 et 2 de Reiki.

Puis sont étudiés les symboles et outils du niveau 3 :
Dai Ko Myo
L’Antahkarana (et ses 4 versions)
Les techniques japonaises (TJR) du 3ème degré
Le livre aborde longuement le rôle des cristaux et la grille des cristaux, enseignement majeur du niveau 3.

En dernière partie, vous découvrirez les enseignements et partage d&#39expérience concernant",979-8425638755,https://m.media-amazon.com/images/I/51BRVyM3A2L._SY522_.jpg,Independently published (4 mars 2022),Olivier Remole,Guerison
This Book May Save Your Life: Everyday Health Hacks to Worry Less and Live Better,23.51,"THE #1 SUNDAY TIMES BESTSELLER

&#39When you want to sort medical fact from medical fiction, Dr Karan is your man. This is the only book that will have you laughing and learning in equal measure&#39 Dr Julie Smith, bestselling author of Why Has Nobody Told Me This Before

&#39Wonderfully comforting&#39 Chris van Tulleken, bestselling author of Ultra-Processed People

&#39In a world of charlatans and social media snake-oil salesmen, [Dr Karan] provides a voice of reason...his health hacks may save your life&#39 Mail on Sunday",978-1529136326,https://m.media-amazon.com/images/I/71v7NronpGL._SY522_.jpg,Century (28 décembre 2023),Dr Karan Rajan,Guerison
The Genius of Flexibility,21.33,"Utilizing a revolutionary technique that has been user-tested by thousands of people from Olympic athletes to people suffering from serious injury, The Genius of Flexibility presents a 16-step stretching regimen for unique muscle groups that dramatically improves flexibility and strength while improving physiological and psychological health.

16 Steps to Complete Freedom of Movement!

The Technique: RESISTANCE STRETCHING® offers immediate, cumulative, and permanent increases in flexibility, takes the pain out of stretching, and protects you from injuring yourself by overstretching.

The Program: THE MERIDIAN FLEXIBILITY SYSTEM® provides stretches for 16 unique muscle groups with physiological and psychological benefits.",978-0743270878,https://m.media-amazon.com/images/I/61KZoquMjxL._SY522_.jpg,Touchstone (6 septembre 2005),Bob Cooley,Guerison
"Mon Agenda Minceur 90 Jours: Journal de Suivi à Compléter Durant Votre Régime, Rééquilibrage Alimentaire ou Programme Minceur Afin de Suivre Vos Progrès et Rester Motivé Au Quotidien",14.6,"Enfin décidée à perdre vos kilos en trop qui vous collent à la peau ?
Vous suivez un programme minceur et souhaitez cette fois aller au bout de celui-ci ?
Vous avez décidé de perdre quelques kilos et parfois la motivation vous manque ?

Découvrez notre agenda minceur 90 jours.

Véritable journal de bord, cet agenda minceur vous accompagnera au quotidien dans l&#39atteinte de votre objectif.

Dans un premier temps, il vous permettra de fixer votre objectif et de faire un bilan de votre situation. Puis, durant 90 jours, vous y assurerez le suivi de vos repas, activités physiques, apports et dépenses caloriques et autres. Chaque jour, vous pourrez célébrer votre victoire du jour, quelle soit grande ou petite.

Tous les sept jours, l’heure du bilan vous permettra de mesurer vos progrès concernant vos mensurations, votre poids et votre indice de masse corporelle (IMC). Vous pourrez également, si vous le souhaitez, planifier vos repas de la semaine à venir.

Si un-e nutritionniste ou diététicien(ne) réalise votre suivi, ce journal sera une base de discussion idéale entre vous.

Les avantages de cet agenda :",979-8490282723,https://m.media-amazon.com/images/I/61rcH4EojyL._SY522_.jpg,Independently published (5 octobre 2021),Léa Desvelte,Guerison
Manuel Reiki Usui degré 2: Soins a distance et utilisation des symboles,17.47,"Ce manuel de Reiki USUI est un ouvrage complet et richement illustré pour acquérir facilement son niveau 2 de Reiki USUI traditionnel (issu de la lignée de Mikao USUI). Que nous soyons débutant ou avancés, nous pouvons aisément nous appuyer sur cet ouvrage clair et pratique. Pas à pas, nous y abordons tous les éléments de base, comme les symboles, les techniques Japonnaises du 2ème niveau, ainsi que les exercices nécessaires à la bonne pratique du Reiki du second niveau. Il est un support très abordable et intuitif pour nous permettre d&#39effectuer nos soins en distanciel ou en présentiel, que cela soit pour nous même ou sur autrui.

Nous utiliserons les outils Symboles (inclus dans ce cours), ainsi que le cristal de quartz. Qui seront désormais nos nouveaux et puissants outils de soins.",979-8525503977,https://m.media-amazon.com/images/I/61q4hub4XtL._SY522_.jpg,Independently published (23 juin 2021),Nicolas ORLER,Guerison
Healing Energies of Heat and Light: A Quantum Leap in Healthcare,7.54,,978-0963697967,https://m.media-amazon.com/images/I/41Yc18tAGRL.jpg,"MediPress,U.S. (13 juillet 2001)",Charles T. McGee,Guerison
