Nom,Prix,Description,Isbn,Photo,Editeur,Auteur,Categorie
50 ans dans l&#39oeil de Libération,39.9,"C’est un demi-siècle raconté en images. L’actualité de ces dernières décennies capturée et mise en scène dans les photographies choisies par Libération.
Libé va avoir 50 ans. 50 ans que le journal fondé par Serge July raconte, accompagne et bouscule son époque. De la Une affiche au portrait de dernière page, la photographie irrigue le quotidien, comme aucun autre. On retrouvera Dans 50 ans dans l&#39œil de Libération, reportages inédits, images de légendes, portraits commandés par le journal. Des trésors, qui nous permettent de revivre l’histoire immédiate. Comme si on y était. Des grands noms (comme Henri Cartier Bresson, Raymond Depardon ou William Klein) aux collectifs les plus récents, ils ont couvert pour le journal les élections présidentielles comme les révoltes de la rue, les guerres, comme le festival de Cannes. Les soubresauts du monde et ce qui, parfois, en fait, la poésie.",978-2021510652,https://m.media-amazon.com/images/I/61V89KZCRfL._SY522_.jpg,SEUIL; Illustrated édition (7 avril 2023),Lionel Charrier,Radio
Veritas Tantam: Potentiam habet ut non subverti possit. La vérité a une telle puissance qu&#39elle ne peut être anéanti,6.9,"Le monde selon Olivier de Kersauson.
Comment rester libre dans une société de plus en plus contrainte ?
Le monde change : il vacille, il tangue. Olivier de Kersauson est de ceux qui le connaissent bien tout en l’interrogeant sans cesse. Son point de vue si caractéristique, son écriture pure et sans détours ont fait de lui un témoin hors norme de notre époque. Depuis le large, ce grand marin aperçoit nettement les contours de notre société en constante mutation. Pour lui, une seule chose compte : garder le cap au milieu des tempêtes. Alors, comment faire pour ne pas chavirer ? Comment rester libre dans une société de plus en plus contrainte ?
Olivier de Kersauson nous offre ici de magnifiques pages où s’aiguisent sa pensée autant que sa plume.",979-1041415885,https://m.media-amazon.com/images/I/71WMeooeh0L._SY522_.jpg,POINTS (19 janvier 2024),Olivier de Kersauson,Radio
Dieux d&#39Afrique,6.53,,978-2909571133,https://m.media-amazon.com/images/I/51CGH6M28FL.jpg,Revue Noire (15 juin 2002),Pierre Verger,Radio
Ham Radio For Dummies-,9.32,"An ideal first step for learning about ham radio
Beyond operating wirelessly, today′s ham radio operators can transmit data and pictures; use the Internet, laser, and microwave transmitters; and travel to places high and low to make contact. This hands–on beginner guide reflects the operational and technical changes to amateur radio over the past decade and provides you with updated licensing requirements and information, changes in digital communication (such as the Internet, social media, and GPS), and how to use e–mail via radio.
Addresses the critical use of ham radio for replacing downed traditional communications during emergencies or natural disasters",978-1118592113,https://m.media-amazon.com/images/I/71hMx2ON-IL._SY522_.jpg,For Dummies; 2nd édition (16 août 2013),H. Ward Silver,Radio
"""Playboy"", quarante ans",10.24,"Rayon : Enfer Editeur : Hors Collection Date de parution : 1996 Description : In-4, 336 pages, relié cartonné avec jaquette parfaite, occasion, très bon état. Envois quotidiens du mardi au samedi. Les commandes sont adressées sous enveloppes bulles. Photos supplémentaires de l&#39ouvrage sur simple demande. Réponses aux questions dans les 12h00. Librairie Le Piano-Livre. Merci. Référence catalogue vendeur: 61488",978-2258044685,https://m.media-amazon.com/images/I/31TZAxDTUbL.jpg,Presses de la Cité (3 octobre 1996),Gretchen Edgren,Radio
Skulls & Anatomy: Copyright Free Vintage Illustrations for Artists and Designers,8.54,"Do you want to make amazing artwork, take your creative practice to the next level and impress both your clients and peers?Skulls & Anatomy, Copyright Free Vintage Illustrations for Artists & Designers is a collection of 180 high quality, digitised, anatomical drawings for use in personal or commercial creative projects. This is an essential resource to take your art and design to the next level and give you a competitive advantage over your peers. Vault Editions&#39 team of designers and illustrators have spent a lifetime hunting and restoring vintage woodcuts and engravings from around the world to create amazing artwork with. Now, we are opening the vault of our archives to the public.Within this collection, you will find rare, high-quality images carefully curated by our team of professional artists and designers who have used this imagery to create book cover designs, gig-posters, logos, t-shirt designs and more. We have carefully restored the artwork and provided a download link within the publication where you will locate high-resolution files in JPEG format as well as TIFF files with backgrounds removed to speed up your workflow.By collaging multiple images together, you can create limitless impressive and dynamic designs in minutes that will impress everyone, no matter what your skill level is.Start creating amazing artwork today.",978-0648049760,https://m.media-amazon.com/images/I/81Hh-To7FsL._SY522_.jpg,Avenue House Press PTY LTD (6 mars 2019),Kale James,Radio
Skulls & Anatomy: Copyright Free Vintage Illustrations for Artists and Designers,11.27,"Do you want to make amazing artwork, take your creative practice to the next level and impress both your clients and peers?Skulls & Anatomy, Copyright Free Vintage Illustrations for Artists & Designers is a collection of 180 high quality, digitised, anatomical drawings for use in personal or commercial creative projects. This is an essential resource to take your art and design to the next level and give you a competitive advantage over your peers. Vault Editions&#39 team of designers and illustrators have spent a lifetime hunting and restoring vintage woodcuts and engravings from around the world to create amazing artwork with. Now, we are opening the vault of our archives to the public.Within this collection, you will find rare, high-quality images carefully curated by our team of professional artists and designers who have used this imagery to create book cover designs, gig-posters, logos, t-shirt designs and more. We have carefully restored the artwork and provided a download link within the publication where you will locate high-resolution files in JPEG format as well as TIFF files with backgrounds removed to speed up your workflow.By collaging multiple images together, you can create limitless impressive and dynamic designs in minutes that will impress everyone, no matter what your skill level is.Start creating amazing artwork today.",978-0648049760,https://m.media-amazon.com/images/I/81Hh-To7FsL._SY522_.jpg,Avenue House Press PTY LTD (6 mars 2019),Kale James,Radio
Friends: The One Where Everyone Is Hiding: A Seek-and-Find Book,18.44,"Where are the friends? Are they hiding in Monica&#39s apartment? Drinking coffee at Central Perk? Maybe at the beach house? Find all your favorite friends in fifteen unique settings-plus additional items and accessories-within this original and officially licensed search-and-find activity book.

Search for the beloved cast of Friends in more than a dozen fun scenes within this original officially licensed search-and-find activity book inspired by the most iconic settings from the show, including Central Perk, all the friends&#39 apartments, Estelle&#39s office, Joey&#39s TV studio set, and more. This book also invites you to look for additional items and accessories within each illustration. Can you spot Ross&#39s keyboards? The Mac and C.H.E.E.S.E. robot? Or Marcel the monkey? Good luck!


Copyright © 2023 Warner Bros. Entertainment Inc.
FRIENDS and all related characters and elements © & ™ Warner Bros. Entertainment Inc.",978-0762482900,https://m.media-amazon.com/images/I/91XG+A8rHLL._SY522_.jpg,Running Press Adult (23 novembre 2023),Michelle Morgan,Radio
Amicalement Vôtre: L&#39apologie des contraires,26.95,"Étude complète sur la série télévisée Amicalement vôtre : coulisses du tournage, guide des épisodes, portraits des acteurs, présentation des produits dérivés, etc. Illustrée de plusieurs centaines de documents d&#39archives.",978-2912215468,https://m.media-amazon.com/images/I/71y0UuMKM9L._SY522_.jpg,Yris; Illustrated édition (1 décembre 2020),Didier Liardet,Radio
La Nostalvie,19.9,"Après le succès de ""Vivre et Renaître chaque jour"" le nouveau livre de Patrick Sébastien Et si on faisait un pas en en arrière pour mieux aller de l&#39avant ? La "" nostalvie ""... tu veux dire la nostalgie, Patrick ? Non la "" nostalvie "" c&#39est différent. Quelle différence ? La nostalgie chronique est une aigreur, elle est grise. C&#39est du soleil derrière et du brouillard devant. La "" nostalvie "" est rose, c&#39est du soleil toujours. C&#39est se rappeler qu&#39un coup d&#39oeil dans le rétro est le moyen le plus sûr de déboîter sans risque. Il ne s&#39agit pas de refuser le progrès et la marche inexorable du temps mais juste de picorer des bouts d&#39avant pour mieux nourrir l&#39après ! Avec sa verve et sa sensibilité à fleur de peau, Patrick Sébastien revient sur les cent vies qu&#39il a vécues. Passionnantes, vibrantes, riches d&#39émotions, libres surtout. Il était une fois... un passé libre et lumineux ! Dans une époque qui se replie, juge, affronte avec angoisse les enjeux de demain, c&#39est la belle promesse qu&#39il fait à ses lecteurs : "" Peut-être qu&#39au bout du conte, tu y trouveras le tien... """,978-2374486147,https://m.media-amazon.com/images/I/71eC9YD35YL._SY522_.jpg,XO Editions (28 septembre 2023),Patrick Sébastien,Radio
The Art of Tangled,6.07,"A lighthearted twist on Rapunzel, the beloved fairy tale from the Brothers Grimm, Tangled brims with thrilling adventure, a distinctive cast of characters, a daring heroine, and, of course, seventy feet of golden hair. Featuring the stunning concept art behind the newest Disney masterpiece, The Art of Tangled also includes a preface by John Lasseter, a foreword by Directors Nathan Greno and Byron Howard, and interviews with the artists, animators, and production team—including Art Director David Goetz—that shed light on the history and artistry of this landmark film.",978-0811875554,https://m.media-amazon.com/images/I/91beIPutSkL._SY522_.jpg,Chronicle Books; 1er édition (3 novembre 2010),Jeff Kurtti,Radio
You Never Know: A Memoir,8.74,"There are many miles from the business school and basketball court at the University of Southern California to 50 million viewers for the final episode of a TV show called Magnum P.I. Tom Selleck has lived every one of those miles in his own iconoclastic and joyful way.
Frank, funny and open-hearted, You Never Know is an intimate memoir from a beloved actor, the story of a remarkable life and thoroughly accidental career. Journey to the top in Hollywood, learn of his mistakes and his well-earned success. Selleck clears up an armload of misconceptions and shares never-told stories. His rambunctious California childhood. His clueless arrival as a good-looking college jock in Hollywood (from the Dating Game to the Fox New Talent Program to co-starring with Mae West). What it was like to emerge as a mega-star in his mid-thirties and remain so for decades to come, an actor whose ease on screen connected with audiences worldwide, while redefining the clichés of manhood.",978-0008685690,https://m.media-amazon.com/images/I/71nZhS4IeEL._SY522_.jpg,HarperCollins (9 mai 2024),Tom Selleck,Radio
Tête en l&#39air et pieds sur terre,7.45,"Marcher aux côtés d’une figure de la télévision qui nous emmène sur les sentiers de sa vie, de forêts majestueuses aux plages longeant l’océan et jusqu’au cœur de Paris où la nature s’invite de façon inattendue

Sur les pas de son enfance en Sologne, de son adolescence en Bretagne, la productrice et animatrice de radio et de télévision, Noëlle Bréham, nous emmène aussi dans le jardin de l’émission ""Silence ça pousse !"", un jardin paradis pour la faune et la flore, habité par la présence d’une personnalité extraordinaire. « Mes collègues de souliers usés, faisons encore quelques pas ensemble, histoire de nous rappeler le pays des chemins, des routes, des plages et des sous-bois, histoire de se prendre encore un peu le vent dans le nez, ou dans le dos, ça arrive aussi Dieu merci », invite-t-elle.",,https://m.media-amazon.com/images/I/71nU8XE5WhL._SY522_.jpg,LA SALAMANDRE (13 mars 2024),Noëlle Bréham,Radio
Buffy ou la révolte à coups de pieu,18.04,"Diffusée entre 1997 et 2003, la série Buffy contre les vampires raconte en sept saisons le passage à l’âge adulte d’un groupe d’adolescent·e·s américain·e·s aux prises avec toutes sortes de démons, métaphore de leurs angoisses. Leur leadeuse, Buffy, est une Tueuse de vampires aux pouvoirs surnaturels, qui apprend à s’émanciper de toutes les formes de domination, en particulier d’un système patriarcal omniprésent.Célébrée par les fans à travers le monde, analysée par de nombreux universitaires, Buffy contre les vampires a inspiré des générations de showrunners et est entrée au panthéon de la pop culture. Échappant à Joss Whedon, son créateur, Buffy Summers est devenue un symbole de réappropriation du pouvoir par les femmes. Au-delà de cette figure féminine puissante, la série revalorise les bienfaits du collectif dans notre société individualiste en crise. Buffy ou la révolte à coups de pieu explore les différentes facettes d’une série unique, qui offre des pistes de réflexion pour mieux vivre ensemble et peut-être même, sauver le monde.",979-1096098668,https://m.media-amazon.com/images/I/51nnVhvkqPL._SY522_.jpg,PLAYLIST SOCIETY (5 octobre 2023),Marion Olité,Radio
The Art of Ponyo on the Cliff,33.24,"From Viz! Relive the story of Ponyo and Sosuke in this full-color movie art book! From the animators of Howl’s Moving Castle, Princess Mononoke, and Academy Award-winner, Spirited Away, comes the film Ponyo. Loosely based on Hans Christian Andersen’s “The Little Mermaid”, this is a hand-drawn feature-length film. The art of the film involves not only cel, but also striking watercolor and pastel concept sketches and layout pages. Interviews with production principals about their daring choice to hand-draw a film in the age of CGI and the screenplay complete the package.",978-1421566023,https://m.media-amazon.com/images/I/81cjCvjBvqL._SY522_.jpg,Viz LLC; Reprint édition (3 septembre 2013),Hayao Miyazaki,Radio
Nik ta race: Une histoire du rire en France,15.9,"Nik ta race, c’est l’histoire d’un délit de sale gueule : celui du rire en France. Une histoire qui commence dans un bar à chicha, fait des années quatre vingt dix un âge d’or, croise le rap français, le Splendid, Les Inconnus, Dieudonné, remonte à Céline et quelques procès jusqu’à celui des Fleurs du mal et les spectacles de Mustapha El Atrassi. Avec pour fil conducteur cette simple question : comme les communautés dans leur banlieue, quel malaise pousse la France à réprimer son rire ?",978-2364810631,https://m.media-amazon.com/images/I/81WFPwlA9iL._SY522_.jpg,Façonnage éditions (7 avril 2023),Adrien Dénouette,Radio
La radio ?... mais c&#39est très simple ! - 29e éd.,11.19,"La radio ?... mais c&#39est très simple est un grand classique du livre d&#39initiation : vivant, accessible même aux débutants, il explique dans le détail le fonctionnement des appareils radios de l&#39époque. Sa lecture ne nécessite pas de connaissances préalables, car il contient toutes les notions préliminaires d&#39électricité indispensables à l&#39étude de la radio.",978-2100041077,https://m.media-amazon.com/images/I/41EepY7NJfL.jpg,Dunod (12 octobre 1998),Eugène Aisberg,Radio
Les Envahisseurs: Le futur recomposé,28.5,"Étude complète de la série Les Envahisseurs : coulisses du tournage, étude complète, biographie-filmographie de Roy Thinnes, du créateur Larry Cohen, du compositeur Dominic Frontiere et du producteur Quinn Martin. Présentation détaillée de la mini-série Le retour des Envahisseurs (1995) et tour d&#39horizon des produits dérivés de la série. Illustrée de documents et photos inédits.
Préfacé par Roy Thinnes.",978-2912215529,https://m.media-amazon.com/images/I/51tTf4MKGPL.jpg,Yris; Illustrated édition (1 mars 2023),Didier Liardet,Radio
"The Official Bridgerton Guide to Entertaining: How to Cook, Host, and Toast Like a Member of the Ton: A Cookbook",5.26,"Entertain like a queen with these forty recipes for Bridgerton-style food and drink in the first official cookbook from this hugely popular Shondaland series on Netflix.
 
Whether it’s a sumptuous lawn party, a high tea, or a boozy late-night salon, this gorgeous cookbook delivers recipes for finger food, cocktails, and entertaining ideas that help you recreate the high society of Bridgerton in your own home.
 
Host the perfect pique-nique, complete with the Duke’s favorite Gooseberry Hand Pies and a rousing game of Pall Mall (played the Bridgerton way, of course). Create grazing boards with recipes like Roasted Pork Belly Skewers and Beet-Dyed Deviled Eggs that are perfect for a stylish watching party. Evoke the delightful decadence of Lady Danbury’s Den of Iniquity with Sausage-Stuffed Mushroom Caps, an espresso martini, and an old-fashioned game of chance.   
 
These forty recipes have been developed with a modern audience in mind, offering mocktail, vegetarian, and gluten-free options to ensure that no fan is left hungry. They are presented alongside mouth-watering food photography, stills from the show, and sidebars explaining essential expertise, such as how to address a Marquis, execute the perfect curtsy, or build a macaron tower sturdy enough to last the night.
 
It’s time to entertain,",978-0593796238,https://m.media-amazon.com/images/I/91+kJvOhwTL._SY522_.jpg,Random House Worlds; Media tie-in édition (31 octobre 2023),Emily Timberlake,Radio
The Body: A Guide for Occupants - THE SUNDAY TIMES NO.1 BESTSELLER,13.64,"#1 Bestseller in both hardback and paperback: SHORTLISTED FOR THE 2020 ROYAL SOCIETY INSIGHT INVESTMENT SCIENCE BOOK PRIZE
_______

&#39A directory of wonders.&#39 - The Guardian

&#39Jaw-dropping.&#39 - The Times

&#39Classic, wry, gleeful Bryson...an entertaining and absolutely fact-rammed book.&#39 - The Sunday Times

&#39It is a feat of narrative skill to bake so many facts into an entertaining and nutritious book.&#39- The Daily Telegraph",978-0552779906,https://m.media-amazon.com/images/I/71Ro5NUIQQL._SY522_.jpg,Black Swan; 1er édition (23 juillet 2020),Bill Bryson,Radio
Le guide des k-dramas : 150 dramas asiatiques à découvrir,14.95,"Plongez dans le phénomène des k-dramas !
De Business Proposal à True Beauty, en passant par Vincenzo ou Extraordinary You... Les k-dramas, ces mini-séries coréennes, sont à l&#39origine du déferlement de la vague coréenne en Europe. Romances, tranches de vie, histoires de bureau, d&#39horreur, thriller et mafia... Il y en a pour tous les goûts !

Sam & les Dramas, créatrice de contenus spécialisée dans la culture coréenne, vous propose ici une sélection de près de 150 dramas, dans tous les styles différents ! Résumé, avis, anecdotes, top des pires méchants ou des meilleurs baisers sous la neige...Vous trouverez ici un guide complet pour revoir de grands succès ou découvrir de nouvelles pépites !",979-1032407783,https://m.media-amazon.com/images/I/71gB1K++cxL._SY522_.jpg,404 Editions; Illustrated édition (26 octobre 2023),Sam & les dramas,Radio
Wearable Antennas and Body Centric Communication: Present and Future,7.46,"This book presents state-of-the-art technologies, trends and applications with a focus on the healthcare domain for ultra-wideband (3.1–10.6 GHz) and 60 GHz (57–66 GHz) wireless communication systems. Due to various key features such as miniaturized antenna design, low power, high data rate, less effects on the human body, relatively less crowded spectrum, these technologies are becoming popular in various fields of biomedical applications and day-to-day life. The book highlights various aspects of these technologies related to body-centric communication, including antenna design requirements, channel modeling and characterization for WBANs, current fabrication and antenna design strategies for textile, flexible and implanted antennas. Apart from the general requirements and study related to these frequency bands, various application specific topics such as localization and tracking, physical activity recognition and assessment, vital sign monitoring and medical imaging are covered indetail. The book concludes with the glimpses of future aspects of the UWB and 60 GHz technology which includes IoT for healthcare and smart living, novel antenna materials and application of machine learning algorithms for overall performance enhancement.",978-9811639722,https://m.media-amazon.com/images/I/61mZYNAB+NL._SY522_.jpg,"Springer Verlag, Singapore; 1st ed. 2021 édition (19 septembre 2021)",Shiban Kishen Koul,Radio
Skulls & Anatomy: Copyright Free Vintage Illustrations for Artists and Designers,18.24,"Do you want to make amazing artwork, take your creative practice to the next level and impress both your clients and peers?Skulls & Anatomy, Copyright Free Vintage Illustrations for Artists & Designers is a collection of 180 high quality, digitised, anatomical drawings for use in personal or commercial creative projects. This is an essential resource to take your art and design to the next level and give you a competitive advantage over your peers. Vault Editions&#39 team of designers and illustrators have spent a lifetime hunting and restoring vintage woodcuts and engravings from around the world to create amazing artwork with. Now, we are opening the vault of our archives to the public.Within this collection, you will find rare, high-quality images carefully curated by our team of professional artists and designers who have used this imagery to create book cover designs, gig-posters, logos, t-shirt designs and more. We have carefully restored the artwork and provided a download link within the publication where you will locate high-resolution files in JPEG format as well as TIFF files with backgrounds removed to speed up your workflow.By collaging multiple images together, you can create limitless impressive and dynamic designs in minutes that will impress everyone, no matter what your skill level is.Start creating amazing artwork today.",978-0648049760,https://m.media-amazon.com/images/I/81Hh-To7FsL._SY522_.jpg,Avenue House Press PTY LTD (6 mars 2019),Kale James,Radio
Skulls & Anatomy: Copyright Free Vintage Illustrations for Artists and Designers,11.87,"Do you want to make amazing artwork, take your creative practice to the next level and impress both your clients and peers?Skulls & Anatomy, Copyright Free Vintage Illustrations for Artists & Designers is a collection of 180 high quality, digitised, anatomical drawings for use in personal or commercial creative projects. This is an essential resource to take your art and design to the next level and give you a competitive advantage over your peers. Vault Editions&#39 team of designers and illustrators have spent a lifetime hunting and restoring vintage woodcuts and engravings from around the world to create amazing artwork with. Now, we are opening the vault of our archives to the public.Within this collection, you will find rare, high-quality images carefully curated by our team of professional artists and designers who have used this imagery to create book cover designs, gig-posters, logos, t-shirt designs and more. We have carefully restored the artwork and provided a download link within the publication where you will locate high-resolution files in JPEG format as well as TIFF files with backgrounds removed to speed up your workflow.By collaging multiple images together, you can create limitless impressive and dynamic designs in minutes that will impress everyone, no matter what your skill level is.Start creating amazing artwork today.",978-0648049760,https://m.media-amazon.com/images/I/81Hh-To7FsL._SY522_.jpg,Avenue House Press PTY LTD (6 mars 2019),Kale James,Radio
Roll&#39cube vendredi tout est permis,9.99,"Avec ce rollcube Vendredi tout est permis, Arthur s&#39invite à la maison, en weekend, en vacances pour des moments de rires et délires à partager en famille ou entre amis !
Retrouvez les épreuves cultes et hilarantes de l&#39émission animée par Arthur :
speed quiz, ABC song, Alphabody, Casting pub, photomime, Mexico, Mime en bouche, panique à l&#39hôpital, qui suis-je ?, devine langue...

Faites bonne pioche et amusez-vous !
matériel : 150 fiches pour plus de 300 occasions de rire et de vous mettre au défi d&#39une bonne humeur absolument garantie",978-2263175039,https://m.media-amazon.com/images/I/61swQBZAGHL._SY522_.jpg,Solar (18 novembre 2021),Collectif,Radio
,12.29,,,,,,Radio
