Nom,Prix,Description,Isbn,Photo,Editeur,Auteur
La frénésie du bonheur: Du bonheur différé au bonheur immédiat,16.08,"« En quelques décennies, alors qu'une autre religion gagnait les quartiers, nous avons vécu en France la déconstruction, puis l'effondrement des deux grandes religions de salut céleste (catholicisme) et terrestre (communisme). En 1950, plus de 90 % des Français étaient baptisés, ils ne sont plus que 30 % ! 45 000 prêtres diocésains prêchaient dans nos églises, ils ne sont plus que 4 500, tandis que l'électorat communiste passait de 25 % à 2,5 % ! Conséquence : s'il n'y a plus d'après, plus de seconde vie après la mort ou la Révolution, c'est ici et maintenant qu'il s'agit d'être heureux, en quoi nous vivons le passage de l'acceptation d'un bonheur différé à l'exigence du bonheur immédiat. À l'encontre de la leçon du conte, le premier petit cochon l'emporte désormais sur le troisième. Ce livre analyse les causes (non pas Mai 68, comme on le croit souvent, mais le capitalisme d'innovation, d'hyperconsommation et de rupture avec les traditions), puis les conséquences d'une profondeur abyssale de cette véritable faille dans la civilisation qui touche tous les domaines de nos existences, du rapport au travail (si je n'ai qu'une seule vie, alors on ne touche pas à ma retraite !) à la naissance des métavers, qui prétendent nous offrir une ""seconde vie plus réussie"", en passant par l'explosion de la psychologie positive et des théories du développement personnel, qui nous promettent le bonheur ici et maintenant. »   L.F.",979-1032926871,https://m.media-amazon.com/images/I/41NOgWOiADL._SY522_.jpg,L'OBSERVATOIRE (4 octobre 2023),Luc Ferry
Les Vertus de l'échec,14.81,"Et si nous changions de regard sur nos échecs ?
Les succès viennent rarement sans accroc. Charles de Gaulle, Rafael Nadal, Steve Jobs ou Barbara ont tous essuyé des revers cuisants avant de s'accomplir.
Relisant leurs parcours et de nombreux autres à la lumière de Marc Aurèle, saint Paul, Nietzsche ou Freud, cet essai nous apprend à réussir nos échecs. Il nous montre comment chaque épreuve, parce qu'elle nous confronte au réel ou à notre désir profond, peut nous rendre plus lucide, plus combatif, plus vivant.
Un petit traité de sagesse qui nous met sur la voie d'une authentique réussite.

"" Un livre qui va redonner un coup d'optimisme à tout le monde. """,978-2266285421,https://m.media-amazon.com/images/I/51tpPNRGp5L._SY522_.jpg,Pocket (6 septembre 2018),Charles Pépin
"La Confiance en soi, une philosophie",15.73,"Après le succès des Vertus de l'échec, Charles Pépin nous éclaire sur le mystère de la confiance en soi.
Cultivez les bons liens
Entraînez-vous
Écoutez-vous
Émerveillez-vous
Décidez
Mettez la main à la pâte
Passez à l'acte
Admirez
Restez fidèle à votre désir
Faites confiance au mystère

En puisant dans les textes des philosophes et des sages, dans les travaux des psychanalystes et des psychologues, mais aussi dans l'expérience de grands sportifs, d'artistes ou d'anonymes, ce livre éclaire le mystère de la confiance en soi. Et nous montre le chemin pour avoir davantage confiance en nous.",978-2266313568,https://m.media-amazon.com/images/I/61P6Dd9WOiL._SY522_.jpg,Pocket (14 janvier 2021),Charles Pépin
Pensées pour moi-même,11.37,"« Une excellente manière de te défendre d'eux, c'est d'éviter de leur ressembler. » VI, 6",978-2251445526,https://m.media-amazon.com/images/I/61dT17JJ2iL._SY522_.jpg,Les Belles Lettres (20 novembre 2015),Marc Aurèle
Le Déclin du courage,6.0,"Le 8 juin 1978 Alexandre Soljénitsyne disait aux étudiants de l'université de Harvard :
« Non, je ne peux pas recommander votre société comme idéal pour transformation de la nôtre. (…) Nous avions placé trop d’espoirs dans les transformations politico-sociales, et il se révèle qu’on nous enlève ce que nous avons de plus précieux : notre vie intérieure. À l’Est, c’est la foire du Parti qui la foule aux pieds, à l’Ouest la foire du Commerce : ce qui est effrayant, ce n’est même pas le fait du monde éclaté, c’est que les principaux morceaux en soient atteints d’une maladie analogue. »
Alexandre Issaïevitch Soljénitsyne est né le 11 décembre 1918 à Kislovodsk (Russie). Mobilisé en 1941 dans les rangs de l’Armée rouge, il est arrêté à la veille de la victoire pour avoir prétendument insulté Staline dans une lettre à un ami, et purgera huit ans de détention et trois de relégation. En 1962, la parution d’",978-2251200460,https://m.media-amazon.com/images/I/51DyEPp2lRL._SY522_.jpg,Les Belles Lettres (21 octobre 2014),Alexandre Issaïevitch Soljénitsyne
Comment le peuple juif fut inventé : De la Bible au sionisme,11.56,"La couverture de l'article peut varier

Quand le peuple juif fut-il créé? Est-ce il y a quatre mille ans, ou bien sous la plume d'historiens juifs du XIXe siècle qui ont reconstitué rétrospectivement un peuple afin de façonner une nation future ? Dans ce livre qui a fait date, Shlomo Sand a montré pour la première fois comment, à partir du XIXe siècle, le temps biblique a commencé à être considéré par les sionistes comme le temps historique, celui de la naissance d'une nation. Si ses propos ont soulevé une onde de choc dans le monde entier, c'est que derrière le débat historiographique se cache une question brûlante : à l'heure où certains généticiens israéliens cherchent encore à démontrer que les juifs forment un peuple doté d un ADN spécifique, que cache aujourd'hui le concept d'«État juif», et pourquoi cette entité n a-t-elle pas réussi jusqu'à maintenant à se constituer en une république appartenant à l'ensemble de ses citoyens, quelle que soit leur religion ? En dénonçant cette dérogation profonde au principe sur lequel se fonde toute démocratie moderne, c'est une critique de la politique identitaire de son pays que propose Shlomo Sand.",978-2081380288,https://m.media-amazon.com/images/I/61igexKAB7L._SY522_.jpg,FLAMMARION (26 septembre 2018),Shlomo Sand
L’Art d’avoir toujours raison,7.58,"Arthur Schopenhauer

Devant un tribunal, on ne débat qu’avec des autorités, celles de la loi, dont le jugement consiste à trouver quelle loi ou quelle autorité s’applique à l’affaire dont il est question. Il y a pourtant tout à fait place à user de la dialectique, car si l’affaire et la loi ne s’ajustent pas complètement, on peut les tordre jusqu’à ce qu’elles le paraissent, et vice versa.",978-1696355957,https://m.media-amazon.com/images/I/412GnrE7s+L._SY522_.jpg,Independently published (29 septembre 2019),Arthur Schopenhauer
Ainsi parlait Zarathoustra,11.39,"Ainsi parlait Zarathoustra est une oeuvre philosophique magistrale. Elle a bouleversé la pensée de l'Occident. « Nietzsche démolit, il sape », disait Gide. Il remet définitivement l'homme en question. Poète-prophète, Zarathoustra se retire dans la montagne et revient parmi les hommes pour leur parler. Sa leçon essentielle : « Vouloir libère. » Son leitmotiv : rejeter ce qui n'est pas voulu, conquis comme tel, tout ce qui est subi. C'est le sens du fameux : « Deviens celui que tu es. » La vertu est souvent le droit du plus faible, elle paralyse tout, désir, création et joie. Le surhomme nietzschéen est celui qui a la plus grande diversité d'instincts qui s'opposent puissamment mais qu'il maîtrise. La pensée de Nietzsche est un défi permanent. Elle échappe à tout système politique.
La ferveur de sa poésie, sa vigoureuse drôlerie ont donné à Nietzsche une célébrité universelle. Nos contemporains n'ont le choix qu'entre lui et Marx.",978-2253006756,https://m.media-amazon.com/images/I/81R8QHEwzXL._SY522_.jpg,Le Livre de Poche; Le Livre de poche édition (6 juin 1972),Friedrich Nietzsche
L'art de la guerre,24.9,"Lecture incontournable des stratèges orientaux depuis la nuit des temps, L'Art de la guerre de Sun Tzu est probablement le traité de guerre et de science militaire le plus connu au monde. Pragmatique, il enseigne comment s'assurer la victoire à moindre coût, grâce à toutes sortes de moyens - ruse, espionnage, mobilité, surprise... -, en s'adaptant à la stratégie de son adversaire. Véritable référence pour de nombreux leaders à travers l'histoire - Napoléon et Mao Zedong notamment -, les techniques de résolutions des conflits qu'il présente restent d'une incroyable actualité et sont facilement transposables à d'autres domaines, y compris à la stratégie d'entreprise, le commerce, ou même le sport.",978-2813215710,https://m.media-amazon.com/images/I/61gi9XB57pL._SY522_.jpg,Les éditions Trédaniel; 2e édition (17 novembre 2017),Sun Tzu
Yoga-Sutras,8.9,"En 195 aphorismes, les Yoga-Sutras de Patanjali codifient l'enseignement d'une pratique traditionnelle plusieurs fois millénaire.
C'est l'esprit même du Yoga qui se trouve ici décrit, résumé en une série de remarques lapidaires et lumineuses.
Vrai traité de connaissance de soi, cet ouvrage est l'un des textes majeurs de l'humanité. Son message, transcendant les siècles, se révèle bien plus que moderne : essentiel.

la couverture de l'article peut varier",978-2226052476,https://m.media-amazon.com/images/I/71TEtiGVLCL._SY522_.jpg,Albin Michel (21 février 1991),Patanjali
OEUVRES - II - TRAITE THEOLOGICO-POLITIQUE,14.03,OEUVRES - II - TRAITE THEOLOGICO-POLITIQUE,978-2080270764,https://m.media-amazon.com/images/I/61S7+t5YZzL._SY522_.jpg,FLAMMARION (12 janvier 2022),Spinoza
Le miracle Spinoza: Une philosophie pour éclairer notre vie,8.4,"Banni de la communauté juive à vingt-trois ans pour hérésie, Baruch Spinoza décide de consacrer sa vie à la philosophie. Son objectif ? Découvrir un bien véritable qui lui « procurerait pour l’éternité la jouissance d’une joie suprême et incessante ». Il édifie une œuvre révolutionnaire. Comment cet homme a-t-il pu, en plein XVIIe siècle, être le précurseur des Lumières et de nos démocraties modernes ? Le pionnier d'une lecture historique et critique de la Bible ? Le fondateur de la psychologie des profondeurs ? Et surtout, l'inventeur d'une philosophie fondée sur le désir et la joie, qui bouleverse notre conception de Dieu, de la morale et du bonheur ? À bien des égards, Spinoza est non seulement très en avance sur son temps, mais aussi sur le nôtre. C'est ce que j'appelle le « miracle » Spinoza.",978-2253091936,https://m.media-amazon.com/images/I/81QCgC4Y08L._SY522_.jpg,Le Livre de Poche (28 août 2019),Frédéric Lenoir
La Transformation intérieure,8.0,"Grâce à ses enseignements, ainsi qu'à ses nombreux engagements pour la paix et l'éducation, Sadhguru est devenu l'un des guides spirituels les plus reconnus en Inde.
À travers le récit de son propre parcours et en explorant les différents champs d'action de la pratique du yoga, Sadhguru nous entraîne, avec intelligence et sagesse, vers une meilleure connaissance de soi, de notre corps et des énergies qui le composent.
Un livre pour que la paix et la joie ne soient plus seulement un but à atteindre, mais le socle de notre vie.

Grand maître yogi comptant des millions d'adeptes à travers le monde, Sadhguru (Jaggi Vasudev) fait partie des cinquante personnes les plus influentes en Inde.

"" Inspirant ! """,978-2266306027,https://m.media-amazon.com/images/I/61N4UN0gT6L._SY522_.jpg,Pocket (20 août 2020),Sadhguru
Start With Why: The Inspiring Million-Copy Bestseller That Will Help You Find Your Purpose,13.6,"THE LIFE-CHANGING MILLION-COPY GLOBAL BESTSELLER - BASED ON ONE OF THE MOST WATCHED TED TALKS OF ALL TIME! DISCOVER YOUR PURPOSE WITH ONE SIMPLE QUESTION: WHY?

'One of the most incredible thinkers of our time; someone who has influenced the way I think and act every day' - Steven Bartlett, investor, BBC Dragon and host of The Diary of a CEO podcast

*****

Why are some people more inventive, pioneering and successful than others?",978-0241958223,https://m.media-amazon.com/images/I/71M1P287BjL._SY522_.jpg,Penguin; 1er édition (6 octobre 2011),Simon Sinek
"Le deuxième sexe, tome 2",12.4,"""Comment la femme fait-elle l'apprentissage de sa condition, comment l'éprouve-t-elle, dans quel univers se trouve-t-elle enfermée, quelles évasions lui sont permises, voilà ce que je chercherai à décrire. Alors seulement nous pourrons comprendre quels problèmes se posent aux femmes qui, héritant d'un lourd passé, s'efforcent de forger un avenir nouveau. Quand j'emploie les mots ""femme"" ou ""féminin"" je ne me réfère évidemment à aucun archétype, à aucune immuable essence ; après la plupart de mes affirmations il faut sous-entendre ""dans l'état actuel de l'éducation et des moeurs"". Il ne s'agit pas ici d'énoncer des vérités éternelles mais de décrire le fond commun sur lequel s'élève toute existence féminine singulière."" Simone de Beauvoir.",978-2070323524,https://m.media-amazon.com/images/I/81VJC-pIOdL._SY522_.jpg,FOLIO ESSAIS (21 avril 1986),Simone de Beauvoir
Ikigai: The Japanese secret to a long and happy life,5.27,"THE INTERNATIONAL BESTSELLER

We all have an ikigai.

It's the Japanese word for 'a reason to live' or 'a reason to jump out of bed in the morning'.

It's the place where your needs, desires, ambitions, and satisfaction meet. A place of balance. Small wonder that finding your ikigai is closely linked to living longer.

Finding your ikigai is easier than you might think. This book will help you work out what your own ikigai really is, and equip you to change your life. You have a purpose in this world: your skills, your interests, your desires and your history have made you the perfect candidate for something. All you have to do is find it.

Do that, and you can make every single day of your life joyful and meaningful.
______________________________",978-1786330895,https://m.media-amazon.com/images/I/814L+vq01mL._SY522_.jpg,Hutchinson; 1er édition (7 septembre 2017),Héctor García
L'Art d'avoir toujours raison,13.14,"Vous avez tort mais refusez de l'admettre ? Avec humour et perspicacité, ce petit précis recense et analyse les stratagèmes et les ruses pour sortir vainqueur de tout débat, dispute ou joute verbale. Schopenhauer se livre à une savoureuse réflexion sur le langage et la dialectique, pour le plus grand plaisir des amoureux de la contradiction. Ces conseils, aussi précieux que sarcastiques, sont suivis de deux essais incisifs sur la pensée et la lecture : les livres nourrissent-ils notre réflexion, ou nous empêchent-ils de penser par nous-mêmes ?",978-2290258644,https://m.media-amazon.com/images/I/61Um5UKEtmL._SY522_.jpg,Librio (7 avril 2021),Arthur Schopenhauer
La crise de la culture,9.9,"L'homme se tient sur une brèche, dans l'intervalle entre le passé révolu et l'avenir infigurable. Il ne peut s'y tenir que dans la mesure où il pense, brisant ainsi, par sa résistance aux forces du passé infini et du futur infini, le flux du temps indifférent.Chaque génération nouvelle, chaque homme nouveau doit redécouvrir laborieusement l'activité de pensée. Longtemps, pour ce faire, on put recourir à la tradition. Or nous vivons, à l'âge moderne, l'usure de la tradition, la crise de la culture.Il ne s'agit pas de renouer le fil rompu de la tradition, ni d'inventer quelque succédané ultra-moderne, mais de savoir s'exercer à penser pour se mouvoir dans la brèche.Hannah Arendt, à travers ces essais d'interprétation critique - notamment de la tradition et des concepts modernes d'histoire, d'autorité et de liberté, des rapports entre vérité et politique, de la crise de l'éducation -, entend nous aider à savoir comment penser en notre époque.",978-2070325030,https://m.media-amazon.com/images/I/713gP-ULuWL._SY522_.jpg,FOLIO ESSAIS (4 avril 1989),Hannah Arendt
Par-delà bien et mal,6.74,"En quoi la philosophie est-elle demeurée jusqu'à présent prisonnière de préjugés ? Pourquoi le projet même de recherche du vrai est-il suspect ? C'est l'examen de ces deux questions qui conduit Nietzsche, dans Par-delà bien et mal, à récuser la problématique de la vérité pour lui substituer celle, plus radicale, de la valeur. Et c'est pourquoi ce texte de 1886 - ""une sorte de commentaire de mon Zarathoustra"" ainsi que le présente Nietzsche - constitue sans doute l'ouvrage le plus propre à faire saisir la logique spécifique, déroutante autant que rigoureuse, de la réflexion nietzschéenne, tout comme il est celui qui en détaille le plus clairement les aboutissements : la définition nouvelle du philosophe, du ""philosophe de l'avenir"", comme créateur de valeurs, et l'interprétation de la réalité comme volonté de puissance.",978-2080278036,https://m.media-amazon.com/images/I/61mq7nQNCzL._SY522_.jpg,FLAMMARION (13 avril 2022),Friedrich Nietzsche
Etre à sa place,8.4,"Ça commence parfois par une inquiétude ou un malaise. On se sent en décalage. On a le sentiment de ne pas « être à sa place ». Mais qu'est-ce qu'être à sa place, dans sa famille, son couple, son travail ? Quels sont les espaces, réels ou symboliques, qui nous accueillent ou nous rejettent ? Faut-il tenter de conquérir les places qui nous sont interdites, à cause de notre genre, notre handicap, notre âge, notre origine ethnique ou sociale ? Peut-être faut-il transformer ces lieux de l'intérieur et s'y créer une place à soi ?
C. M.
Cet ouvrage interroge ce qui est à la fois la formulation d'un désir personnel et un nouvel impératif social. Et si, comme nous le suggère Claire Marin, le propre d'une place était de sans cesse se déplacer, ou de déplacer celui qui croit pouvoir s'y installer ?",978-2253941118,https://m.media-amazon.com/images/I/61G25B2szwL._SY522_.jpg,Le Livre de Poche (8 mars 2023),Claire Marin
Autobiographie d'un yogi,6.41,"Élue parmi les 100 meilleurs livres spirituels du XXe siècle, la seule autobiographie d'un yogi écrite par un yogi lui-même nous fait explorer de manière inoubliable le monde des saints et des yogis, de la science et des miracles, de la mort et de la résurrection. Avec une sagesse qui comble le coeur et un humour prenant, Paramahansa Yogananda nous éclaire sur les plus grands secrets de la vie et de l'univers, ouvrant ainsi notre âme et notre esprit à la joie, à la beauté et aux potentiels spirituels illimités qui sommeillent au fond de tout être humain. Traduite en plus de 40 langues, son Autobiographie d un yogi est tenue en estime dans le monde entier comme un grand classique de la littérature spirituelle. Seule cette édition publiée par la Self-Realization Fellowship inclut les révisions majeures et les ajouts auxquels l'auteur procéda à partir du texte de la première édition de 1946. L'ouvrage, qui se lit comme un roman d aventures, répond à des questions de fond sur la religion, Dieu, l'existence, le yoga et les états de conscience supérieure. De portée universelle, il peut être lu par des publics de toutes croyances, en fait par quiconque cherche à comprendre ce qu'est le sens de la vie.",978-0876127087,https://m.media-amazon.com/images/I/71mOe5+YXqL._SY522_.jpg,Self Realization Fellowship (1 avril 2016),Paramahansa Yogananda
"The Silent Patient: The record-breaking, multimillion copy Sunday Times bestselling thriller and TikTok sensation",10.5,"- THE RECORD-BREAKING, MULTIMILLION COPY GLOBAL BESTSELLER AND TIKTOK SENSATION -
Discover the #1 New York Times and Sunday Times bestselling thriller with a jaw-dropping twist that everyone is talking about - as seen on TikTok. Soon to be a major film.

Alicia Berenson lived a seemingly perfect life until one day six years ago.

When she shot her husband in the head five times.

Since then she hasn't spoken a single word.",978-1409181637,https://m.media-amazon.com/images/I/81JJPDNlxSL._SY522_.jpg,Orion (12 décembre 2019),Alex Michaelides
Éthique,11.9,"Le point de départ de la réflexion de Spinoza, c'est son expérience propre : il sait, par l'observation, qu'il a un corps, et il a conscience de ses affects. Mais, si c'est bien là une sorte de connaissance, c'est une connaissance incomplète et douloureuse : avoir conscience, c'est, pour l'être humain, sinon toujours souffrir, du moins pâtir, être contraint, accablé. Selon Spinoza, il importe de se faire de son être propre - et des accidents dont sa vie se compose - une idée comparable à celle qu'un mathématicien a d'une figure et des propriétés qui la constituent. Voilà pourquoi il écrit son Éthique ""suivant l'ordre géométrique"". À la passion succédera alors l'action, à une nécessité extérieure et contraignante, une nécessité conforme à sa volonté devenue raison. Mais, pour atteindre ce but, une connaissance adéquate des rapports que l'être humain entretient avec l'univers est indispensable. L'Éthique, en un mot, prétend nous élever de la conscience à la connaissance de nous-mêmes, et cette connaissance commence par celle de Dieu.",978-2080413550,https://m.media-amazon.com/images/I/610SJb-bl3L._SY522_.jpg,FLAMMARION (8 mars 2023),Spinoza
Éthique,35.0,"""Je me livrai à cette lecture et pensai, tandis que je plongeais en moi-même, que je n'avais jamais compris aussi clairement le monde.""Goethe"" Vous voulez être philosophe ? Commencez par être spinoziste ; vous ne pouvez rien sans cela.""Hegel",978-2081513839,https://m.media-amazon.com/images/I/71XJS1U4SeL._SY522_.jpg,FLAMMARION (10 novembre 2021),Spinoza
L'Esprit artificiel: Une machine ne sera jamais philosophe,19.0,"De la science au droit, de la médecine aux questions militaires, l'intelligence artificielle bouleverse tous nos champs de compétence. Tous ? Non ! En philosophie, l'IA ne sert à rien. Le prototype d'agent conversationnel ChatGPT, qui peut répondre à toute question, trouver une recette de cuisine à partir du contenu d'un réfrigérateur, rédiger un article ou composer un poème sur le sujet de notre choix, qui puise dans l'intégralité du savoir disponible pour en livrer une synthèse en quelques secondes... se trouve comme une poule devant un couteau quand on lui demande de réfléchir. Quelle énigme ! Pourquoi le geste tout simple qui consiste à trouver une problématique, c'est-à-dire à transformer une question en problème pour en faire la colonne vertébrale d'une réflexion, demeure-t-il hors de sa portée ? À quoi tient cette singularité, ce je-ne-sais-quoi ? Pourquoi la pratique de la philosophie est-elle inaccessible à l'intelligence artificielle ? Et pourquoi l'humanité demeure-t-elle un casse-tête pour la machine ? C'est la même question.",979-1032920619,https://m.media-amazon.com/images/I/51Ygp1Rq+-L._SY522_.jpg,L'OBSERVATOIRE (24 janvier 2024),Raphaël Enthoven
Les Rebelles magnifiques: Les premiers romantiques et l'invention du Moi,26.5,"Oubliez Paris : dans les années 1790, la véritable révolution a eu lieu à Iéna, une ville universitaire tranquille où les rebelles n’étaient ni soldats ni politiciens, mais poètes (Goethe, Schiller, Novalis), philosophes (Fichte, Schelling, Hegel), critiques littéraires (les frères Schlegel) et scientifiques (Alexander von Humboldt). Au centre de ce groupe se trouvait Caroline Böhmer, une femme libre et formidable.
Le cercle de Iéna rassemblait les premiers Romantiques. Leurs vies libérées des conventions ont été des laboratoires pour leurs idées radicales – sur le pouvoir de création de l’individu, les rapports à la nature, les aspirations de l’art et de la science, et sur le sens profond de la liberté. Dans Les Rebelles magnifiques, Andrea Wulf nous emmène à la découverte de leurs aventures, de leurs histoires d’amour passionnées, leurs querelles mémorables, leurs succès et leurs échecs. À chaque page, elle fait revivre ces héros de l’histoire de la littérature, dont les idées sont à l’origine d’une révolution de la pensée qui imprègne notre monde moderne.",978-2889830060,https://m.media-amazon.com/images/I/91Ign5lcwDL._SY522_.jpg,NOIR BLANC; Illustrated édition (11 avril 2024),Wulf Andrea
Spinoza Code,19.5,"Hollande, 1674. Spinoza termine un traité radical, l’Éthique, auquel il travaille depuis quinze ans. Son œuvre majeure. Mais l’avenir est incertain. Les ennemis du philosophe sont nombreux et puissants, sa trop grande liberté et ses idées menacent les églises et les autorités. Son ouvrage tout juste achevé, Spinoza en confie une copie à Ehrenfried Walther von Tschirnhaus, un jeune baron et brillant mathématicien allemand qui se prépare à faire le tour des capitales européennes.
Le traité, dont la publication est compromise en Hollande, parcourt l’Europe sous le manteau. Spinoza meurt en 1677, sans avoir pu publier l’Éthique, laissant soudain Tschirnhaus dépositaire d’un manuscrit inestimable. Mais la trace de ce codex se perd. Trois cent trente-trois ans plus tard, il est retrouvé au Vatican, dans les archives de l’Inquisition… Comment le Traité est-il tombé entre les mains du bras armé de l’Église ?
Récit historique et enquête littéraire, Spinoza Code nous conte la fascinante épopée du seul manuscrit de l’Éthique qui nous soit parvenu. S’y dévoile un autre XVIIe siècle, où les batailles intellectuelles se déchaînent et font avancer la Connaissance. Et où, malgré les périls encourus, un philosophe de génie vécut dans la plus grande fidélité à ses idées.",978-2246827658,https://m.media-amazon.com/images/I/71X4p5Oi1vL._SY522_.jpg,Grasset (20 mars 2024),Mériam Korichi
