Nom,Prix,Description,Isbn,Photo,Editeur,Auteur
Pour en finir avec Dieu,12.0,"Peut-on vivre dans un monde sans religion ?
Dans une attaque frontale contre la religion et la barbarie qu'elle engendre, Richard Dawkins dénonce "" l'illusion de Dieu "". Il estime que l'hypothèse de Dieu doit être analysée avec les mêmes outils rationnels et le même scepticisme que n'importe quelle autre. Il s'attache donc à faire la démonstration de la "" probabilité extrêmement faible de son existence "". Amoureux de la nature, le scientifique invite son lecteur à se tourner vers la splendeur du monde réel. Comprendre le monde du vivant, voilà qui, selon l'auteur, devrait permettre d'abandonner toutes les formes de superstition. Et notamment, celles remises au goût du jour par le créationnisme qui sévit dans de nombreux pays, en particulier aux Etats-Unis.",978-2262075095,https://m.media-amazon.com/images/I/71cKF-BHZoL._SY522_.jpg,Tempus Perrin (1 mars 2018),Richard Dawkins
Critique de la raison pure: Traduction française avec notes par A. Tremesaygues et B. Pacaud,12.54,"La nouveauté de la philosophie kantienne, que son auteur appelle philosophie transcendantale, est de s'occuper « moins des objets que de nos concepts a priori des objets ». Qualifié d'ouvrage le plus génial et le plus contradictoire de toute la littérature philosophique, ce livre a apporté « une définition nouvelle de la vérité. Les choses ne se soumettent à nos idées que parce que l'esprit leur impose ses cadres » (C. Serrus in Préface).",978-2130608714,https://m.media-amazon.com/images/I/61mMQ1u8ufL._SY522_.jpg,PUF; 8e édition (17 août 2012),Emmanuel Kant
Éloge du carburateur: Essai sur le sens et la valeur du travail,12.5,"Matthew B. Crawford était un brillant universitaire, bien payé pour travailler dans un think tank à Washington. Au bout de quelques mois, déprimé, il démissionne pour ouvrir... un atelier de réparation de motos. À partir du récit de son étonnante reconversion, il livre dans cet ouvrage intelligent et drôle une réflexion particulièrement fine sur le sens et la valeur du travail dans les sociétés occidentales.
Mêlant anecdotes, récit, et réflexions philosophiques et sociologiques, il montre que ce "" travail intellectuel "", dont on nous rebat les oreilles, se révèle pauvre et déresponsabilisant. À l'inverse, il restitue l'expérience de ceux qui, comme lui, s'emploient à fabriquer ou réparer des objets – dans un monde où l'on ne sait plus qu'acheter, jeter et remplacer. Le travail manuel peut même se révéler beaucoup plus captivant d' un point de vue intellectuel",978-2707181978,https://m.media-amazon.com/images/I/71qXgPFHFGL._SY522_.jpg,La Découverte (25 février 2016),Matthew B. Crawford
Le Bouddhisme: Mener une vie équilibrée entre bonheur et pleine conscience grâce au Bouddhisme,5.27,"Menez une vie équilibrée, entre bonheur et pleine conscience, grâce au Bouddhisme


Savez-vous vraiment tout ce que le bouddhisme peut vous apporter?
Vous aimeriez être plus détendu au quotidien? Plus enthousiaste et positif sur le long terme?",978-1718838741,https://m.media-amazon.com/images/I/419tCGGslaL.jpg,CreateSpace Independent Publishing Platform (9 mai 2018),Michel Lambert
La société de consommation,9.9,"La consommation est devenue la morale de notre monde. Elle est en train de détruire les bases de l'être humain, c'est-à-dire l'équilibre que la pensée européenne, depuis les Grecs, a maintenu entre les racines mythologiques et le monde du logos. L'auteur précise : ""Comme la société du Moyen Age s'équilibre sur la consommation et sur le diable, ainsi la nôtre s'équilibre sur la consommation et sur sa dénonciation"".",978-2070323494,https://m.media-amazon.com/images/I/91o9QS08MRL._SY522_.jpg,FOLIO ESSAIS (15 novembre 1996),Jean Baudrillard
Le Gai Savoir,9.9,"Interroger le fanatisme de la vérité qui gouverne la philosophie, reconnaître la vie seule pour source de toute valeur, l'indépendance pour la vertu suprême du philosophe, et rechercher une réconciliation inédite de l'art et de la science : tel est pour Nietzsche le sens du gai savoir. Publié en 1882, réédité et augmenté en 1887, cet ouvrage met en oeuvre les principaux thèmes de la pensée de Nietzsche, dont celui de l'éternel retour, qu'il introduit ici pour la première fois. L'auteur y déploie le projet d'une guérison de l'humanité, d'un regain de force et d'amour de la vie : ""suprême espérance"" qui ne saurait se conquérir que dans la douleur... et dans l'ivresse.Dossier1. La force de vivre : comment surmonter les idéaux maladifs ?2. La philosophie de l'avenir : une thérapeutique culturelle3. Le gai savoir : l'affirmation de la vie- Glossaire des principales notions de la philosophie de Nietzsche",978-2081510852,https://m.media-amazon.com/images/I/71fadnopuRL._SY522_.jpg,FLAMMARION; Edition 2020-2021 (10 juin 2020),Friedrich Nietzsche
Foutriquet,7.33,"Dans Macron président, la fin de l'innocence, un documentaire à sa gloire diffusé sur France 3, le président de la République Emmanuel Macron dit à propos de la Commune : ""Versailles, c'est là où la République s'était retranchée quand elle était menacée."" Les communards ont affublé Thiers, le boucher de la Commune, d'un certain nombre de sobriquets : Adolphe-le-Petit, Général Boum, Coeur Saignant, Obus 1er, Crapaud Venimeux, Tamerlan à lunettes, César en raccourci, Satrape de Seine-et-Oise, Petit Jean-Foutre, Général Tom Pouce, Croquemort de la Nation. Chez Jules Vallès, il y avait aussi : ""Foutriquet"". M.O. Dans la pure tradition du libelle politique, Michel Onfray ose un portrait irrévérencieux d'Emmanuel Macron et dresse un bilan sans concession du quinquennat de l'en même temps. Cet essai mordant et drôle offre aussi une édifiante radioscopie de notre société et de la faillite de sa classe politique. Indispensable à quiconque entend voter... ou non.",978-2290381458,https://m.media-amazon.com/images/I/61VQIWbAbDL._SY522_.jpg,J'AI LU (5 avril 2023),Michel Onfray
Apologie de Socrate,19.19,"Athènes, 399 avant notre ère. Socrate, citoyen sans fortune ni pouvoir politique, comparaît devant le Tribunal de la cité. Quels sont les faits reprochés ? On l'accuse de ne pas reconnaître l'existence des dieux traditionnels, d'introduire de nouvelles divinités et de corrompre la jeunesse. Face à ses juges, Socrate assure seul sa défense et met en garde les Athéniens : le philosophe est un bienfait pour la cité et celle-ci se condamne elle-même en mettant à mort son héros. Mais le verdict est sans appel : la condamnation à mort. Élevée au rang de mythe fondateur de la philosophie, l'Apologie de Socrate expose les exigences d'une vie vertueuse telle que la défend Socrate : amour du savoir, souci du vrai, recherche de l'acte et du mot justes. Dossier : 1. Le philosophe au banc des accusés 2. La place du philosophe dans la cité",978-2081377226,https://m.media-amazon.com/images/I/61tPp--px9L._SY522_.jpg,FLAMMARION (5 avril 2017),Platon
Yoga: L'encyclopédie,7.93,"[...] Un fantastique voyage à travers siècles et continents pour mieux cerner [...] les mille et une facettes [du] yoga.Télérama
En ce début de XXIe siècle, la pratique du yoga connaît un succès planétaire. S'agit-il d'une mode exotique, d'un simple désir de bien-être, ou, plus profondément, de l'aspiration à une forme de sagesse incarnée ? Même lorsqu'ils se réfèrent à une mythique « Inde éternelle », les yogas d'aujourd'hui relèvent d'une histoire riche et complexe. Imbriquée dans les relations entre cultures, religions et puissances politiques, celle-ci n'a cessé d'évoluer depuis les temps védiques jusqu'à notre post-modernité.
C'est pour raconter cette histoire à la fois fascinante et méconnue que se trouvent pour la première fois réunis sous la direction d'Ysé Tardan-Masquelier des spécialistes du monde entier, indianistes, philosophes, anthropologues, sociologues, enseignants de yoga. Ils explorent les sources textuelles, les pratiques corporelles, les arrière-plans philosophiques, les parcours de personnalités hautes en couleur qui ont contribué à l'incroyable diffusion de cette pratique à travers le monde.",978-2226448286,https://m.media-amazon.com/images/I/71xHlENp7pL._SY522_.jpg,Albin Michel; Illustrated édition (13 octobre 2021),Collectif
