Nom,Prix,Description,Isbn,Photo,Editeur,Auteur,Categorie
Manuel Reiki Usui degrés 1 à 4: Débutant à Maître - Enseignant,7.45,"Manuel de cours Reiki USUI des degrés 1 à 4.
L&#39ouvrage au format A4 (21 x 29.7 env.) de qualité prémium couleur, contient les cours complets des 4 niveaux Reiki de la lignée traditionnelle Mikao USUI. Plutôt destinés aux professionnels et formateurs officiels USUI, les débutants ou thérapeutes en devenir désireux eux aussi s&#39appuyer sur une ""Bible Reiki"" complète fiable et illustrée, trouveront de nombreux schémas explicatifs, des photographies claires et très démonstratives, ainsi que des planches anatomiques détaillées et efficacement pédagogique. Celles-ci, vous permettrons d&#39apprendre ou de réapprendre progressivement à cibler avec précision l&#39origine d&#39un symptôme ainsi que d’acquérir un langage professionnel (médical) se rapportant au corps humain : Identifier et nommer une zone du corps en souffrance, un organe, un os, un muscle, une capsule ligamentaire...

Ces 4 cours contiennent les éléments indispensables à une pratique professionnelle et respectueuse du sacré et de l&#39aspect traditionnel USUI.
Cependant, la technique de l&#39IPE (L&#39Intervention Psycho-Energétique) parfois transmise au degré 3, n&#39est pas incluse dans cette première édition. En effet, l&#39IPE, bien que fort intéressante est originaire des guérisseurs ""Kahuna"" de l&#39ile d’Hawaï ; elle revêt donc un coté traditionnel Hawaïen plutôt que ""USUI"" Japonais. Cette décision d&#39exclusion, n&#39est pas absolue ou définitive, mais elle a été réfléchie posément dans ce cadre précis.

Cet ouvrage s&#39ouvre en premier sur tous les éléments de base, bien sur : les positions des mains, le traitement sur soi et autrui, l&#39intuition, l&#39intention, la méditation, le fonctionnement des chakras et leurs intérêts. Puis ensuite, il aborde pas à pas : Le scan de l&#39aura (Byosen), les soins à distances sur un receveur ou sur une situation bloquée, l&#39utilisation et la purification du cristal de quartz, l&#39activation de la grille de cristaux basée sur l&#39Anthakarana sacré. Les techniques Japonaises et gestuelles de traitement de chaque niveau y sont organisées par degré. Pour terminer par le degré 4 permettant d&#39enseigner et d&#39initier vos futurs stagiaires ou élèves. Tous ceci est très structuré et documenté par de larges photographies, croquis et textes explicatifs abordables mais précis.

Intuitif mais très ordonné, ce manuel est un support fiable de cours allant du débutant souhaitant être initié, au Maître Reiki enseignant reconnu.",979-8363491818,https://m.media-amazon.com/images/I/71NZWmsFabL._SY522_.jpg,Independently published (28 juin 2023),Nicolas ORLER,Guerison
"Le pouvoir du jeûne: Maigrir, guérir, rajeunir",9.91,"Le jeûne a le vent en poupe. On lui confère des pouvoirs de guérison, de régénération, de rajeunissement. La communauté médicale est très sceptique, surtout en France. Elle considère cette discipline comme inutile, voire dangereuse. Mais qu’en est-il réellement ? Le jeûne thérapeutique est-il une réalité ou un fantasme ? Y-a-t-il des dangers à s’abstenir de nourriture ?

Le jeûne et la santé
Du renforcement du système immunitaire à une inversion du cours du diabète de type II, du rajeunissement de la peau à une prévention des maladies neurodégénératives, d’une limitation de l’effet des substances toxiques à une favorisation de la guérison des lésions de la moelle épinière, d’une aide dans le traitement du cancer à la prévention des infarctus, ou encore d’une diminution des inflammations chroniques à une régénération des capacités de fertilité, de nombreuses études présentent des résultats époustouflants.",978-1982982263,https://m.media-amazon.com/images/I/51pLikQePEL._SY522_.jpg,Independently published (14 juin 2018),Yéléna C. Kentish,Guerison
"MAGNÉTISME ET ÉNERGÉTIQUE AU-DELÀ DES MYTHES, VERS UNE PRATIQUE ÉCLAIRÉE: L&#39art du magnétiseur : Techniques, intuition et dialogue centré-patient",9.13,"Jean Angius est un magnétiseur de tradition familiale depuis bientôt 50 années. Titulaire d&#39un master en gestion des émotions et du stress et des risques psychosociaux en entreprise, il a enrichi sa pratique avec des connaissances académiques solides. Il anime des stages de magnétisme et de techniques énergétiques depuis 2007. Dans son livre, il explore en profondeur le monde du magnétisme et de l&#39énergétique, démystifiant les croyances populaires et offrant aux lecteurs une perspective équilibrée sur la pratique. Jean Angius discute de la manière dont chaque individu possède des capacités innées qui, avec la formation et la pratique appropriées, peuvent être développées pour maîtriser l&#39art du magnétisme. En plus d&#39une riche théorie, ce livre apporte également des techniques de développement de facultés latentes avec des exercices concrets, ainsi que des méthodes de magnétisme éprouvées. Le texte souligne la nécessité de comprendre le corps humain non seulement comme une entité physique, mais aussi comme un écosystème complexe d&#39énergies subtiles interagissant dynamiquement. Il aborde également l&#39importance d&#39équilibrer la foi en vos capacités avec un esprit critique et rationnel. Avec cette approche holistique, Jean Angius vous encourage à rester enracinés dans la réalité tout en explorant les dimensions plus éthérées de l&#39énergétique, et à chercher constamment à vous développer personnellement et professionnellement.",979-8865419211,https://m.media-amazon.com/images/I/61N3m790wLL._SY522_.jpg,Independently published (25 octobre 2023),M Jean Fidèle Angius,Guerison
Juicing for Life: A Guide to the Benefits of Fresh Fruit and Vegetable Juicing,16.5,"Eating fresh fruits and vegetables can boost your energy level, supercharge your immune system, and maximize your body&#39s healing power. Convenient and inexpensive, juicing allows you to obtain the most concentrated from of nutrition available from whole foods.
This A-Z guide shows you how to use nature&#39s bounty in the prevention and treatment of our most common health disorders. This accessible book gives complete nutritional programs for over 75 health problems, telling you which fruits and vegetables have been shown effective in combatting specific illnesses and why. Along with hundreds of delicious, nutrition-rich juicing recipes, this book provides dietary guidelines, and diet plans to follow in conjunction with your juicing regimen.",978-0895295125,https://m.media-amazon.com/images/I/61ibAJpA3TL._SY522_.jpg,Penguin Publishing Group (1 novembre 1991),Maureen Keane,Guerison
Finding Clarity: A Guide to the Deeper Levels of Your Being,8.24,"""You are already that which you long to be."" These words, the last Jeru Kabbal wrote before he died, sum up the philosophy of a man who touched thousands of lives in the course of 30 years of teaching about paths to inner peace, emotional growth, and compassionate behavior. Kabbal developed his Finding Clarity Process over decades of spiritual exploration in both Eastern belief systems and Western philosophy and science. This collection drawn from his writings and workshops provides a guide to the essentials of his transformational teachings.",978-1556436208,https://m.media-amazon.com/images/I/615d1njIk7L._SY522_.jpg,North Atlantic Books (27 juillet 2006),Jeru Kabbal,Guerison
Le Guide ultime de l&#39herboristerie: Initiez-vous aux savoirs ancestraux des plantes et concoctez vos propres remèdes,19.9,""" Gageons que ce livre aura bientôt sa place de classique sur l&#39herboristerie."" Plantes et santé
Devenez votre propre herboriste !
Grâce à ce guide très complet de l&#39herboristerie, les connaissances pour préparer des remèdes naturels sont désormais accessibles à tous. Absolument tout ce que vous devez savoir pour remédier aux maux quotidiens par les plantes, en toute autonomie et de manière sécurisée se trouve dans cet ouvrage. Vous pourrez également piocher parmi les recettes toutes prêtes, en fonction de vos besoins.
Découvrez dans ce livre :
- L&#39histoire de l&#39herboristerie",978-2226469335,https://m.media-amazon.com/images/I/71iwp0sXAaL._SY522_.jpg,Albin Michel; Illustrated édition (16 février 2022),Loïc Ternisien,Guerison
Reiki Niveau 1: le manuel du Reiki 1er degré,13.69,"Ce livre est un manuel complet correspondant aux enseignements du stage du premier niveau de Reiki Usui (1er degré). Il a été conçu pour accompagner l&#39élève avant, pendant, ou après le stage.

Le livre revient d&#39abord sur ce qu&#39est le Reiki, son histoire, sa pratique, ses vertus, et ses cinq idéaux.

Puis il apprend à se connecter à l&#39énergie, l&#39aide des Chakras, avant de présenter en détail les positions de traitement, sur soi et sur les autres, correspondant à différents maux : physiques (migraines, cervicales, troubles digestifs, musculaires...) et psychologiques. Ces positions sont expliquées en détail pour être réalisées ensuite facilement.

Enfin, le livre revient sur les positions avancées du 1er degré (",978-1718035690,https://m.media-amazon.com/images/I/61YukVTHapL._SY522_.jpg,Independently published (3 août 2018),Olivier Remole,Guerison
Yoga Somatiques Exercices Pour Maigrir: Un Livre De Défi De 28 Jours Pour Débutants Avec Une Méthode Éprouvée Pour Brûler Les Graisses Et Gagner En Confiance,17.8,"Frustré(e) par un sentiment de déconnexion avec votre corps et coincé(e) dans un cycle infernal de perte de poids ?

Imaginez perdre vos kilos en trop tout en renouant avec vous-même grâce à des mouvements doux.

C&#39est le pouvoir du Yoga Somatique !

Ce livre est votre invitation à un voyage transformateur de 28 jours. Oubliez les entraînements punitifs et les régimes restrictifs. Le Yoga Somatique se concentre sur le mouvement conscient et la conscience corporelle. Vous apprendrez à être à l&#39écoute des sensations de votre corps, à bouger avec intention et à redécouvrir la joie du mouvement.

Chaque jour vous propose une nouvelle série d&#39exercices Somatiques, soigneusement conçus pour cibler différents groupes musculaires et améliorer votre flexibilité. Ne vous inquiétez pas, il ne s&#39agit pas de postures compliquées qui nécessitent des années de pratique. Le Yoga Somatique est doux et accessible à tous, quel que soit votre niveau de condition physique.

Mais ce livre va au-delà du simple exercice. Nous savons tous qu&#39une perte de poids durable nécessite une alimentation saine. C&#39est pourquoi vous trouverez également un plan de repas délicieux et facile à suivre, rempli d&#39ingrédients sains qui nourrissent votre corps. On parle de vraie nourriture, pas de régimes à la mode !

À l&#39intérieur, vous découvrirez un trésor de recettes simples et alléchantes, parfaites pour les horaires chargés. Des petits déjeuners riches en protéines aux dîners copieux, vous ne vous sentirez jamais privé(e). Ce plan est conçu pour alimenter votre corps et vous garder plein(e) d&#39énergie tout au long de la journée.",979-8324578053,https://m.media-amazon.com/images/I/61SObtelm0L._SY522_.jpg,Independently published (1 mai 2024),Eugène Authier,Guerison
Symboles Reiki : le petit manuel,11.1,"Découvrez les symboles Reiki les plus importants, à tous les niveaux et degrés.

Ce livre regroupe des symboles des différents Reiki : Usui, Shamballa et Karuna. Il est plutôt destiné aux débutants, en recherche de symboles et de méthodes pour les activer.

Pour chaque symbole, est abordé :
la signification du symbole
la méthode pour le dessiner
son utilisation et son pouvoir énergétique dans le cadre du Reiki
la méthode pour activer le symbole
sa prononciation",979-8788378428,https://m.media-amazon.com/images/I/61WM84rX7XL._SY522_.jpg,Independently published (4 janvier 2022),Olivier Remole Editions,Guerison
"Manuel Reiki Usui degré 3: Le Maître et son symbole, la grille de cristaux et l&#39Antahkarana",5.1,"L&#39ouvrage contient le cours complet permettant d&#39acquérir le niveau Maître Reiki USUI. Nous y étudions le symbole du Maître, l&#39utilisation de la grille de cristal de quartz pour transmettre du Reiki à plusieurs personnes et plusieurs situations en même temps.

Dans ce cours, sont abordés tous les éléments de base : La connexion à son intuition, l&#39onde de forme de l&#39Antahkarana , la technique de soins à distance avec la grille de cristaux, ainsi que les techniques Japonaises du 3ème niveau.

Abordable et intuitif, ce manuel convient aux Maîtres enseignants comme aux praticiens du second niveau.

Cependant, la technique de l&#39",979-8752789038,https://m.media-amazon.com/images/I/61fTDU4plvL._SY522_.jpg,Independently published (24 octobre 2021),Nicolas ORLER,Guerison
"Hildegarde de Bingen : ses conseils, remèdes et secrets pour guérir par l&#39alimentation, les plantes et les pierres",16.84,"Le livre pour découvrir les secrets et remèdes d&#39Hildegarde de Bingen et en bénéficier pour sa santé dès aujourd&#39hui

Première naturopathe de l&#39histoire, visionnaire des vibrations énergétiques et personnalité exceptionnelle, Hildegarde de Bingen a laissé des enseignements dont l&#39intérêt pour notre alimentation et notre santé est important encore aujourd&#39hui. Chez Hildegarde, d&#39origine allemande, chaque aliment est vu comme un remède aux vertus curatives.

Avec ce livre, vous apprendrez à prendre soin de votre corps et de votre esprit, selon les méthodes originales, les remèdes et les recettes d&#39Hildegarde de Bingen.

Vous découvrirez aussi ses secrets pour guérir de certaines maladies, et mettre en place",979-8766263760,https://m.media-amazon.com/images/I/71koacOcU3L._SY522_.jpg,Independently published (16 novembre 2021),Collectif,Guerison
Hashimoto&#39s Protocol: A 90-Day Plan for Reversing Thyroid Symptoms and Getting Your Life Back,11.35,"Instant #1 New York Times Bestseller
Dr. Izabella Wentz, the author of the phenomenal New York Times bestseller Hashimoto’s Thyroiditis, returns with a long-awaited, groundbreaking prescription to reverse the symptoms of this serious autoimmune condition that is becoming one of the country’s fastest growing diseases.
More than thirty-five million Americans currently suffer from Hashimoto’s—an autoimmune disease that affects the thyroid gland and causes the body to attack its own cells. To alleviate the symptoms of this debilitating condition—including chronic cough, acid reflux, IBS, allergies, chronic pain, hair loss, brain fog, and forgetfulness—patients are often prescribed synthetic hormones that have numerous life-altering side effects.",978-0062571298,https://m.media-amazon.com/images/I/81oQIKt4PdL._SY522_.jpg,HarperOne; 1er édition (28 mars 2017),Izabella Wentz PharmD.,Guerison
Devenir magnétiseur: Soigner avec l’énergie et guérir avec le magnétisme,16.12,"Découvrez le pouvoir de guérison du magnétisme et libérez votre potentiel énergétique avec ""Devenir Magnétiseur""!

Vous avez toujours été fasciné par les pouvoirs de guérison du magnétisme? Vous êtes un praticien en devenir ou un magnétiseur confirmé qui cherche à élargir vos connaissances et à affiner vos compétences? Ne cherchez pas plus loin. ""Devenir magnétiseur"" est l&#39outil indispensable pour comprendre, apprendre et maîtriser l&#39art du magnétisme.

Ce livre complet et pratique vous guide à travers le monde fascinant du magnétisme, de ses origines ancestrales à ses applications contemporaines. Que vous soyez novice ou déjà initié à la pratique, vous y trouverez une mine d&#39informations précieuses pour développer et améliorer vos compétences.
Dans cet ouvrage, vous découvrirez:",979-8394450426,https://m.media-amazon.com/images/I/71-ojgpjXpL._SY522_.jpg,Independently published (12 mai 2023),Olivier Lucas,Guerison
"Manuel Reiki Usui degrés 1 et 2: Traitement sur soi, autrui et à distance avec les symboles et le cristal de quartz",10.76,"Manuel de cours Reiki USUI des degrés 1 et 2.
L&#39ouvrage contient les cours complets permettant d&#39acquérir les 2 premiers niveaux Reiki de la lignée traditionnelle Mikao USUI. Débutants et thérapeutes avancés peuvent s&#39appuyer sur ce manuel explicatif clair et très illustré. Les traitements (sur soi, sur autrui, à distance et sur les situations bloquées) sont décrits pas à pas et guidés par des photographies claires ; tout comme les exercices et techniques Japonaises des 2 niveaux.
Dans ces cours, sont abordés tous les éléments de base : les positions des mains, les symboles Reiki Sacrés, les techniques de soins à distances, l&#39utilisation du cristal de quartz ainsi que toutes les techniques Japonaises du 1er et 2ème niveau.

Abordable et intuitif, ce manuel peut parfaitement servir de support de cours aux Maîtres enseignants & Formateurs.",979-8493047619,https://m.media-amazon.com/images/I/61U29xcsTNL._SY522_.jpg,Independently published (9 octobre 2021),Nicolas ORLER,Guerison
Heal Your Nervous System: The 5-stage Plan to Reverse Nervous System Dysregulation,27.15,"Relieve anxiety, burnout, feelings of overwhelm, and chronic physical symptoms by healing your dysregulated nervous system with this 5-stage roadmap based on the latest science.
 
Dr. Linnea Passaler has helped thousands globally in her digital health program address a wide range of symptoms associated with nervous system dysregulation—from mental symptoms, including anxiety, burnout, and brain fog, to physical symptoms, such as digestive issues, chronic inflammation, and fatigue. In Heal Your Nervous System, Dr. Passaler presents her 5-stage plan, developed over the last decade, to equip you with the knowledge to understand and regulate your unique nervous system.
 
Despite its advances, conventional medicine has often overlooked the importance of nervous system regulation in our health and quality of life. This is especially true for highly sensitive individuals, who may be more susceptible to a dysregulated nervous system. Instead of merely treating the symptoms, Dr. Passaler shows you how to make a profound shift from reactive treatment to proactive healing.
 
Grounded in recent scientific advances in neurobiology, chronic stress, trauma, and sensitivity, this is not a short-term or one-size-fits-all solution, but a comprehensive strategy to tackle the source of your symptoms, and restore your physical, cognitive, and emotional health.
 
In",978-0760385654,https://m.media-amazon.com/images/I/81ar6FuvK8L._SY522_.jpg,Fair Winds Press; 1er édition (25 janvier 2024),Dr. Linnea Passaler,Guerison
Tapping In: A Step-By-Step Guide to Activating Your Healing Resources through Bilateral Stimulation,9.1,"Never has it been so effortless to activate your inner power and resilience than with the remarkable technique known as &#39&#39resource tapping.&#39&#39 Tapping In makes available for the first time a self-guided program for learning this revolutionary EMDR-related method. With step-by-step instruction in bilateral stimulation (a core component of EMDR, or Eye Movement Desensitization and Reprocessing), Tapping In teaches you a clinically recognized system for tapping both sides of the body to overcome trauma, boost confidence, calm the body on a deep, physiological level, and to respond better to stress. Join world-renowned EMDR expert Dr. Laurel Parnell as she shares a series of easy-to-learn exercises to access your &#39&#39latent positive resources&#39&#39 - your neurological foundation for internal resilience and stability.",978-1458770738,https://m.media-amazon.com/images/I/61bQ-45q4eL._SY522_.jpg,ReadHowYouWant; Large type / Large print édition (28 décembre 2012),Laurel Parnell,Guerison
"Au cœur de la Lithothérapie: Découvrez enfin les secrets des pierres guérisseuses ! Le guide complet pour retrouver l’équilibre, accéder au bien-être et guérir avec les cristaux et les pierres de soin",14.11,"Découvrez la Magie des Pierres et Libérez enfin Leur Puissance pour guérir !
Depuis l&#39aube de la civilisation, l&#39homme a toujours été fasciné par les pierres et les cristaux. Leurs formes, leurs couleurs et leur énergie ont toujours exercé une attraction mystérieuse sur nous. Avez-vous déjà ressenti cette énergie mystique émanant d&#39une pierre que vous teniez dans vos mains ? Voulez-vous apprendre comment ces joyaux naturels, formés sur des millions d&#39années, peuvent améliorer votre vie de manière tangible ?
Votre quête de connaissance et d’harmonie commence ici. Ce livre est bien plus qu&#39un simple guide sur les cristaux, c’est une invitation à un voyage d&#39exploration et de découverte spirituel.",979-8861114752,https://m.media-amazon.com/images/I/71uZlyphsOL._SY522_.jpg,Independently published (11 septembre 2023),Émilie Sky,Guerison
Je m&#39aime comme je suis: Petit manuel de suvie intérieure à l&#39usage des personnes qui ne savent plus par quel bout prendre leur vie,16.98,"Le monde du développement personnel regorge d’injonctions a priori bienveillantes qui, en réalité, poussent ceux qui veulent avancer dans une impasse ―“aime-toi” arrivant en tête du classement. 


Dans ce livre éclairé et pragmatique, Flora Douville nous montre pourquoi chercher à s’aimer est voué à l’échec et ce qu’il faut comprendre pour laisser l’amour de soi grandir. Loin des concepts déconnectés de la réalité, elle balise le chemin en s’appuyant sur de nombreux exemples tirés de son expérience personnelle. 

Après la lecture de ce livre, vous vous aimerez déjà davantage mais surtout, vous aurez compris comment faire grandir l’amour que vous portez en vous : pour vous-même et pour les autres. C’est comme ça qu’on change le monde.",979-1032309513,https://m.media-amazon.com/images/I/71PJMmL-jLL._SY522_.jpg,MARIE-CLAIRE; Illustrated édition (24 janvier 2024),Flora Douville,Guerison
Energies & Reiki : 50 exercices pour soulager la douleur physique et émotionnelle,10.32,"Le premier cahier d’exercices énergétiques et Reiki, pour explorer le Reiki, les énergies et leur potentiel.

L’objectif de ce livre : vous permettre d&#39explorer et d&#39expérimenter les soins énergétiques sur vous-même, et de mieux vivre grâce au travail des énergies vitales.

Au programme :
- Un manuel pour comprendre le fonctionnement de nos énergies vitales, les concepts de chakras et d’auras, d&#39énergie subtile, et le Reiki.
- Des exercices pour appréhender ses chakras, devenir plus sensible à l’énergie vitale, se centrer, s’ancrer, lâcher prise.
- Les meilleurs exercices de soins et protections énergétiques, pour réduire le stress et l&#39anxiété.
- Des activités de",979-8780802624,https://m.media-amazon.com/images/I/61etcLeqU8L._SY522_.jpg,Independently published (10 décembre 2021),Olivier Remole,Guerison
"Le Meilleur médicament, c&#39est vous !",8.4,"À rebours d&#39une médicalisation excessive et systématique, notre corps est, sans que nous le sachions, notre plus grande ressource. Il détient des capacités inouïes, infiniment plus efficaces que nombre de médicaments. Ces pouvoirs, il suffit de les activer : en découvrant les mouvements qui soignent, les vrais aliments santé, en oubliant les régimes…
Dans cet ouvrage le docteur Frédéric Saldmann donne les clés pour prendre sa santé en main et consolider tous les domaines qui la composent (alimentation, poids, allergies, sommeil, sexualité, vieillissement...), afin de mieux se protéger avec des moyens à notre portée, passer au travers des maladies et profiter pleinement de la vie.

Saldmann est le nouvel oracle du bien-être et de l’éternelle jeunesse.",978-2253187547,https://m.media-amazon.com/images/I/71yFUtw6SpL._SY522_.jpg,Le Livre de Poche (28 février 2016),Frédéric Saldmann,Guerison
Zappeur du Dr Clark : principes d&#39utilisation et méthodes de soin: Seconde Edition (2023),9.38,"L’invention du zappeur du Dr Clark a ouvert la voie à une nouvelle approche thérapeutique basée sur les fréquences. Bien que son usage n’est pas validé à des fins médicales, de nombreuses personnes l’utilisent pour ses effets bénéfiques sur leur santé. À notre époque où les maladies dites de civilisation sont en croissance exponentielle, les personnes atteintes de la maladie de Lyme font partie des utilisateurs les plus réguliers de cet appareil. Les informations disponibles sur le zappeur sont dispersées dans les livres du Dr Clark, et peu de documents traitent de ce sujet. Comment s’étonner qu’une part de mystère plane sur son utilisation. Quand l’utiliser ? Pourquoi ? Sur quelle durée ? À quelle fréquence ? Le Dr Clark a constamment élargi les possibilités du zappeur, inventant de nouveaux dispositifs afin d’aider les nombreux patients atteints de cancer dans sa clinique au Mexique.

Ce livre constitue une synthèse des recherches du Dr Clark dans ce domaine, publiées de 1993 à 2010 dans huit livres, et apporte des compléments sur le principe d’action du zappeur, son utilisation en fonction de différentes affections et avec d’autres dispositifs. Chaque sujet est abordé avec le soucis d&#39être complet et assimilable pour l&#39utilisateur. En outre, cette seconde édition est revue et enrichie d&#39éléments nouveaux: les chapitres sont plus complets dans le traitement des sujets; des données ont été mises à jour; de nouvelles réponses aux questions et de nouveaux conseils ont été ajoutés, fondés sur le retour de nombreux utilisateurs.",978-1698432717,https://m.media-amazon.com/images/I/61dOTn8fwbL._SY522_.jpg,Independently published (21 août 2023),Marco Caldi,Guerison
