Nom,Prix,Description,Isbn,Photo,Editeur,Auteur
"Le livre pnl: Le grand livre sur le développement personnel, le comportement humain, le intelligence emotionnelle et le pouvoir de la confiance de soi - Inclus pnl exercices",19.4,"*** Version mise à jour et améliorée du 29.08.2023 ***

La PNL pour les débutants - Livre sur le développement personnel

L'état d'esprit et le développement d'une personne sont considérablement influencés par le subconscient. Cependant, la plupart des gens ne sont pas conscients de ce fait, ou bien, n'ont tout simplement pas les connaissances nécessaires pour pouvoir utiliser efficacement ces informations.
Les sentiments, les actions, le langage corporel, et les décisions sont intimement liés à notre subconscient et contribuent donc inévitablement à notre succès ou à notre échec. Ne serait-il pas formidable de pouvoir influencer et apprendre à programmer son propre subconscient ?
***
Avec le livre La PNL pour les débutants, qui est aussi un livre sur la confiance en soi, vous apprendrez à programmer votre propre état d'esprit, et à utiliser une communication assertive. Ne donnez plus de place aux pensées négatives et remplacez-les par des structures de pensées positives, appelées psychologie positive. Cela n'est pas seulement bénéfique pour votre niveau de stress et votre bien-être, pour toute la confiance en soi que vous pouvez acquérir... C'est aussi pour améliorer votre intelligence émotionnelle et comprendre le langage corporel des autres, mais également la pierre angulaire d'une vie épanouie.",979-8825184425,https://m.media-amazon.com/images/I/61S-RVCBh+L._SY522_.jpg,Independently published (12 mai 2022),Louis-Arthur Girard
"Je suis épuisé !: Stress, surmenage, burn-out : le guide pour reprendre le contrôle",19.9,"Anxiété, surmenage, burn-out... ce n'est pas que dans la tête ! L'épuisement est une réalité physiologique, et ce livre vous donne les clés pour lutter efficacement contre lui.

Dans ce livre, Cathy Assenheim vous éclaire et vous aide à :
comprendre les causes nerveuses et hormonales des symptômes typiques ;
interpréter les signaux d'alerte physiologiques avant qu'il ne soit trop tard ;
faire le point sur votre état de résistance grâce à différents questionnaires.
Elle vous donne également (et surtout !) un guide pratique pour réagir concrètement lorsque la fatigue s'est installé ou qu'un diagnostic d'épuisement a été posé :",978-2807337800,https://m.media-amazon.com/images/I/61KR-185BqL._SY522_.jpg,DE BOECK SUP; 1er édition (19 octobre 2021),Cathy Assenheim
"Les 5 piliers de la pensée positive – Maîtrisez votre esprit: Cultivez joie, confiance et sérénité. Contrôlez vos pensées, libérez votre potentiel authentique pour bonheur et succès",14.99,"Découvrez les 5 piliers de la pensée positive pour plus de succès et de bonheur dans la vie.
Faites une pause.
Soyez honnête…
Aimeriez-vous être plus calme et plus positif dans de nombreuses situations ?
Aimeriez-vous arrêter efficacement les pensées négatives ?
Faire disparaître vos peurs ?
Faire taire votre critique intérieur ?
Et préférez-vous plutôt…
Aborder la vie avec joie ?
Traverser la journée avec confiance et énergie ?",978-1957667652,https://m.media-amazon.com/images/I/61omMSccjhL._SY522_.jpg,Wise Minds Publishing (22 août 2023),David Heimbacher
Relaxation Dynamique - 90 idées d'exercices ludiques pour pratiquer la sophrologie avec les enfants: Par les créatrices des Sophro'Contes,17.75,"👧👦 Vous êtes en recherche d’inspiration pour accompagner au mieux les enfants vers le bien-être ?
📖 Ce livre d’exercices de relaxations dynamiques s’adresse aux professionnels de la relation d’aide souhaitant accompagner les enfants de 5 à 11 ans environ (sophrologues, relaxologues, thérapeutes, psychologues, éducateurs etc…), mais également aux parents souhaitant initier leurs enfants à la sophrologie.
Il est le fruit d’un travail passionné entre Nadine Atmani & Sarah Nédélec, sophrologues spécialisées sur le public des enfants. Il vient compléter le livre Ma Boite à Bonheurs (publié aux éditions Dunod)afin d’apporter aux professionnels travaillant auprès d’un jeune public des séances complètes clé en mains pour accompagner efficacement les enfants. Ces exercices peuvent également être utilisés pour créer vos propres séances en vous inspirant de ces idées.",979-8856541624,https://m.media-amazon.com/images/I/61haeMXnfeL._SY522_.jpg,Independently published (28 août 2023),Nadine Atmani
Aujourd'hui sera une Belle Journée - Journal de Gratitude: Carnet pour Augmenter le Bien-être & la Confiance en Soi par la Pensée Positive en 5 minutes par Jour,10.99,"Vous sentez-vous parfois frustré(e), avec une impression de manque dans votre vie ? Vous sentez-vous régulièrement morose ou facilement découragé(e) ?

Il vous manque probablement votre dose quotidienne de gratitude ! ❤
A l’aide de ce journal, apprenez à semer les graines de la gratitude pour cultiver votre joie de vivre !
Conçu pour les adultes (homme ou femme) et adolescents, ce journal vous guidera dans votre pratique personnelle en vous permettant de consigner vos réflexions quotidiennes. Emotions, éléments de gratitude, affirmation du jour, rétrospective des événements (choses positives comme ce qui pourrait être amélioré) et citations inspirantes pourront être passés en revue en environ 5 minutes par jour !",979-8689616308,https://m.media-amazon.com/images/I/513+7hwaxCL._SY522_.jpg,Independently published (25 septembre 2020),Erika Rossi
When the Body Says No: The Cost of Hidden Stress,16.09,"Can a person literally die of loneliness? Is there a connection between the ability to express emotions and Alzheimer's disease? Is there such a thing as a 'cancer personality'?

With compassion, warmth and empathy, Dr Gabor Maté draws on deep scientific research and his acclaimed clinical work to provide the answers to critical questions about the mind-body link - and illuminates the role that stress and our emotional makeup play in an array of common diseases.

When the Body Says No:

- Explores the role of the mind-body link in conditions and diseases such as arthritis, cancer, diabetes, heart disease, irritable bowel syndrome and multiple sclerosis.
- Shares dozens of enlightening case studies and personal and moving stories, including those of people such as Lou Gehrig (ALS), Betty Ford (breast cancer), Ronald Reagan (Alzheimer's), Gilda Radner (ovarian cancer) and Lance Armstrong (testicular cancer)
- Reveals 'The Seven A's of Healing': principles in healing and the prevention of illness from hidden stress",978-1785042225,https://m.media-amazon.com/images/I/81PvAO9G+HL._SY522_.jpg,Vermilion; 1er édition (3 janvier 2019),Gabor Maté
L'anxiété racontée aux enfants,14.41,"Béatrice est bouleversée d'apprendre que les malaises qu'elle ressent ont une cause : l'anxiété ! Avec le soutien d'une psychologue zoothérapeute et de ses collègues à quatre pattes, la jeune fille découvre les différentes facettes des troubles anxieux et comment les apprivoiser. Votre enfant voit-il des dangers partout ? S'alarme-t-il sans raison ? Envisage-t-il le pire de toute situation ? Perçoit-il les tâches à accomplir comme une montagne ? A-t-il peur de l'échec ? Si vous avez répondu oui à l'une de ces questions, ce conte illustré vous permettra d'aborder l'anxiété avec lui, d'une façon simple et imagée. Aidez aussi votre enfant à mieux comprendre ses symptômes grâce à la section « auto-observation » de ce petit livre sympathique et coloré. Faites le plein de trucs applicables au quotidien afin de surmonter les difficultés liées à l'anxiété. Vous verrez, ce n'est pas si compliqué ! Un outil indispensable pour les parents, les intervenants et les enfants !",978-2896626878,https://m.media-amazon.com/images/I/71e2AjSqC6L._SY522_.jpg,DE MORTAGNE; Illustrated édition (11 septembre 2017),Ariane Hébert
Coloriage Adulte: Coloriage par numéros,6.46,"Lance-toi dans une aventure artistique captivante à la découverte du règne animal avec ce livre de “Coloriage par numéros” spécialement conçu pour enchanter et inspirer aussi bien adultes qu’adolescents. Ce livre d’activités illustré par l’artiste de renommée internationale Maverick Infanta, t’invite à découvrir une faune sauvage colorée parée d’une foule de détails et par là-même l’immense bonheur de colorier. Au fil des pages de cet exceptionnel livre de coloriage, tu trouveras une formidable sélection d’illustrations animalières, toutes prêtes à révéler ta créativité. Du lion majestueux au délicat colibri, du tigre féroce à la loutre joueuse, en passant par une multitude d’autres créatures, les œuvres fascinantes et détaillées de Maverick Infanta présentent l’incroyable beauté et la diversité qu’offre la nature.

Grâce au code couleur proposé, tu transformeras ces illustrations en véritables chefs-d’œuvre en un tournemain. Chaque illustration est segmentée et numérotée avec précision, t’aidant ainsi à évoluer avec aisance dans ton parcours artistique. Au fur et à mesure que tu colories et avances méticuleusement de segment en segment, les images prennent peu à peu vie, révélant ainsi des motifs détaillés, des textures plus vraies que nature et donnant une impression incroyable de profondeur. « Coloriage par numéros » est bien plus qu’un simple livre de coloriage, c’est une évasion créative qui t’apportera relaxation, détente et te permettra de te reconnecter à la nature et ses richesses. Que tu sois à la recherche d’un passetemps paisible pour tes instants de repos, d’un moyen de perfectionner tes talents artistiques ou bien d’une activité agréable à partager entre amis ou en famille, ce livre est exactement fait pour toi.

Les magnifiques illustrations de Maverick Infanta savent capturer l’essence même de chaque animal, de la posture régalienne du lion au battement délicat des ailes du papillon. La variété des animaux présents dans ce livre alliant majesté et charme, fait que tu trouveras sans peine une illustration correspondant à ton humeur et ta préférence du moment.

Laisse-toi séduire par la magie du coloriage au fil des pages de « Coloriage par numéros ». En ajoutant des nuances de couleurs à un ours, un bison, un chat, une grue ou bien d’autres animaux encore, tu verras chaque page blanche se transformer petit à petit en ménagerie charmante et colorée. « Coloriage par numéros » témoigne du pouvoir que représente la créativité, offrant une expérience enrichissante et méditative que tout un chacun peut apprécier.",978-1700818485,https://m.media-amazon.com/images/I/71dWfHpnxvL._SY522_.jpg,Gray & Gold Publishing (8 septembre 2023),Papeterie Bleu
LA PENSÉE POSITIVE: Comment atteindre vos objectifs et mener une vie positive à travers le pouvoir de la pensée,9.99,"Changez votre vie et commencez à penser positivement!
Savez-vous que la pensée positive fonctionne mais que vous ne savez pas comment la mettre en pratique?
Vous vous sentez triste? Découragé? Tout le monde vous semble heureux?

Tout semble aller mal et la malchance vous suit?

Apprenez l'art de la pensée positive. Apprenez des stratégies, et changez totalement votre vie en lui donnant une toute nouvelle empreinte! Enfin, vous saurez comment utiliser la pensée positive et quels sont ses avantages! Vous allez découvrir un nouveau monde! Dans chaque situation, vous serez en mesure de garder la sérénité, d'affronter les choses de la bonne façon, d'analyser et de faire les meilleurs coups. Grâce à quelques conseils simples, la pensée positive améliorera votre estime de soi, votre santé et vous portera chance!

Dans ce manuel utile, vous apprendrez...",979-8621428907,https://m.media-amazon.com/images/I/61vPdMfXVCL._SY522_.jpg,Independently published (4 mars 2020),Marcello Borelli
LA PENSÉE POSITIVE: Comment atteindre vos objectifs et mener une vie positive à travers le pouvoir de la pensée,9.99,"Changez votre vie et commencez à penser positivement!
Savez-vous que la pensée positive fonctionne mais que vous ne savez pas comment la mettre en pratique?
Vous vous sentez triste? Découragé? Tout le monde vous semble heureux?

Tout semble aller mal et la malchance vous suit?

Apprenez l'art de la pensée positive. Apprenez des stratégies, et changez totalement votre vie en lui donnant une toute nouvelle empreinte! Enfin, vous saurez comment utiliser la pensée positive et quels sont ses avantages! Vous allez découvrir un nouveau monde! Dans chaque situation, vous serez en mesure de garder la sérénité, d'affronter les choses de la bonne façon, d'analyser et de faire les meilleurs coups. Grâce à quelques conseils simples, la pensée positive améliorera votre estime de soi, votre santé et vous portera chance!

Dans ce manuel utile, vous apprendrez...",979-8621428907,https://m.media-amazon.com/images/I/61vPdMfXVCL._SY522_.jpg,Independently published (4 mars 2020),Marcello Borelli
,19.5,,,,,
"Comment Arrêter De Trop Penser: Les Règles d'Or et Les Techniques Pratiques Pour Éliminer La Pensée Négative, Vivre Dans Le Présent et Atteindre La Paix Intérieure.",15.99,"⚠️ ARRÊTER DE TROP PENSER,L'ORIGINAL! - SE MÉFIER DES IMITATIONS⚠️

⭐Nouvelle édition 2024 - Le Guide Ultime⭐
Comment le fait d’apprendre à arrêter de trop penser peut-il nous mener à notre paix intérieure?

✓ Ce livre explique exactement ce qu'est la pensée excessive et comment l'empêcher de saboter vos performances, votre productivité et votre humeur. ✓
Il est nécessaire d'évaluer tout problème dans la vie quotidienne avant de s'y attaquer. Cependant, en raison d’une réflexion excessive, nous nous retrouvons trop souvent à tourbillonner dans un état mental de malaise et d'incertitude.",979-8354658831,https://m.media-amazon.com/images/I/61NBcKqAPNL._SY522_.jpg,Independently published (1 octobre 2022),James Path
J'utilise le sarcasme parce que tuer c'est illégal : Un livre de coloriage décalé pour adultes,17.63,"IDÉES CADEAUX – LIVRES DE COLORIAGE POUR ADULTES – HUMOUR
Description du produit:
Couverture mate haute qualité
Imprimé sur papier ultra blanc au recto uniquement
Parfait pour ttoutes sortes de feutres et crayons de couleur
Papier 90 g/m² de haute qualité
Pages grand format de 21,5 cm x 28 cm
Verso noir pour limiter le risque de transpercer",978-1640015524,https://m.media-amazon.com/images/I/81hPBDozyAL._SY522_.jpg,Gray & Gold Publishing (19 octobre 2018),Papeterie Bleu
"LA RÉSILIENCE: Apprenez à utiliser votre esprit en votre faveur pour gérer toutes les crises, pour réussir et atteindre la sérénité.",15.09,"Vous êtes-vous déjà arrêté un instant pour penser au nombre de situations apparemment incontrôlables dont vous vous êtes sorti ?
La force mentale qui est en nous et qui peut nous sortir des problèmes n'est-elle vraiment qu'une platitude boudée par beaucoup ? Ou est-ce qu'il y a plus que ça ?",979-8842895960,https://m.media-amazon.com/images/I/61vkYi7LpoL._SY522_.jpg,Independently published (28 juillet 2022),Angelo Giardino
Four Thousand Weeks: Embrace your limits. Change your life. Make your four thousand weeks count.,14.19,"**The instant Sunday Times bestseller**

What if you tried to stop doing everything, so you could finally get round to what counts?

Rejecting the futile modern obsession with 'getting everything done,' Four Thousand Weeks introduces readers to tools for constructing a meaningful life by embracing rather than denying their limitations.

Drawing on the insights of both ancient and contemporary philosophers, psychologists, and spiritual teachers, Oliver Burkeman sets out to realign our relationship with time - and in doing so, to liberate us from its tyranny.",978-1784704001,https://m.media-amazon.com/images/I/81QYEb6YnVL._SY522_.jpg,Vintage; 1er édition (7 avril 2022),Oliver Burkeman
Unstressable: A Practical Guide to Stress-Free Living,18.09,"A new way to take control of all kinds of stress from the internationally bestselling author Mo Gawdat and stress-management specialist Alice Law.

'Everything he writes is an enlightening education in how to be human.' - Elizabeth Day

Unstressable applies Mo Gawdat's brilliant engineering mind and Alice Law's psychology and stress-management expertise to the 'stress pandemic'.

This follow up to bestselling Solve For Happy will show you that chronic stress is not an unavoidable part of modern life, but a predictable – and therefore preventable – response, often as much to do with negative thought patterns as external circumstances. Mo explains how he made it through the most acutely stressful times in his own life, and the book touches on the idea of post-traumatic growth – both on a personal level and in response to huge events that affected all of us, such as the COVID pandemic and subsequent economic turmoil.

Practical exercises will help you build up the skills to manage stress no matter your circumstances, backed up by neuroscience and accessible psychology.",978-1035022724,https://m.media-amazon.com/images/I/71tVhuR0qbL._SY522_.jpg,Bluebird; 1er édition (9 mai 2024),Mo Gawdat
Un livre de coloriage décalé pour adultes,7.56,"IDÉES CADEAUX – LIVRES DE COLORIAGE POUR ADULTES – ANTISTRESS
Je crois que je ne vais pas pouvoir aller travailler demain, je me suis fracturé la motivation.
Même si les récents débats présidentiels nous ont inspiré une série de livres d’insultes à colorier, on a décidé de ne pas mettre de gros mots en couverture de ce livre ! On a plutôt décidé de concocter avec cette rage et cette négativité un peu de sarcasme, d'agressivité passive (ça se dit, non ?!) et un chouia de culot. Dégustez ce savoureux mélange après une longue cuisson. Mais n’oubliez pas, la vengeance est un plat qui se mange froid… attention, risque d’allergie : patron, belle-mère, ex et bien sûr, démarchage téléphonique.",978-1640010864,https://m.media-amazon.com/images/I/71p-QNojImL._SY522_.jpg,Gray & Gold Publishing (15 mai 2017),Papeterie Bleu
Affirmations Positives - Amour de Soi: Faites le Plein des Sens,16.72,"Pourquoi devriez-vous acheter ce livre
et commencer votre transformation vers un vous plus radieux ? 🌈
1. Parce que Vous le Valez Bien : Oui, c'est un cliché, mais c'est aussi 100% vrai.
Vous méritez de vous sentir comme une superstar tous les jours,
pas seulement le week-end.
2. Une Dose d'Optimisme Quotidienne :
Ce livre est comme un smoothie pour votre esprit –",979-8326750143,https://m.media-amazon.com/images/I/710vj3ZlOdL._SY522_.jpg,Independently published (26 mai 2024),Victor Soleil
LA PENSÉE POSITIVE: Comment atteindre vos objectifs et mener une vie positive à travers le pouvoir de la pensée,9.99,"Changez votre vie et commencez à penser positivement!
Savez-vous que la pensée positive fonctionne mais que vous ne savez pas comment la mettre en pratique?
Vous vous sentez triste? Découragé? Tout le monde vous semble heureux?

Tout semble aller mal et la malchance vous suit?

Apprenez l'art de la pensée positive. Apprenez des stratégies, et changez totalement votre vie en lui donnant une toute nouvelle empreinte! Enfin, vous saurez comment utiliser la pensée positive et quels sont ses avantages! Vous allez découvrir un nouveau monde! Dans chaque situation, vous serez en mesure de garder la sérénité, d'affronter les choses de la bonne façon, d'analyser et de faire les meilleurs coups. Grâce à quelques conseils simples, la pensée positive améliorera votre estime de soi, votre santé et vous portera chance!

Dans ce manuel utile, vous apprendrez...",979-8621428907,https://m.media-amazon.com/images/I/61vPdMfXVCL._SY522_.jpg,Independently published (4 mars 2020),Marcello Borelli
LA PENSÉE POSITIVE: Comment atteindre vos objectifs et mener une vie positive à travers le pouvoir de la pensée,9.99,"Changez votre vie et commencez à penser positivement!
Savez-vous que la pensée positive fonctionne mais que vous ne savez pas comment la mettre en pratique?
Vous vous sentez triste? Découragé? Tout le monde vous semble heureux?

Tout semble aller mal et la malchance vous suit?

Apprenez l'art de la pensée positive. Apprenez des stratégies, et changez totalement votre vie en lui donnant une toute nouvelle empreinte! Enfin, vous saurez comment utiliser la pensée positive et quels sont ses avantages! Vous allez découvrir un nouveau monde! Dans chaque situation, vous serez en mesure de garder la sérénité, d'affronter les choses de la bonne façon, d'analyser et de faire les meilleurs coups. Grâce à quelques conseils simples, la pensée positive améliorera votre estime de soi, votre santé et vous portera chance!

Dans ce manuel utile, vous apprendrez...",979-8621428907,https://m.media-amazon.com/images/I/61vPdMfXVCL._SY522_.jpg,Independently published (4 mars 2020),Marcello Borelli
LA PENSÉE POSITIVE: Comment atteindre vos objectifs et mener une vie positive à travers le pouvoir de la pensée,9.99,"Changez votre vie et commencez à penser positivement!
Savez-vous que la pensée positive fonctionne mais que vous ne savez pas comment la mettre en pratique?
Vous vous sentez triste? Découragé? Tout le monde vous semble heureux?

Tout semble aller mal et la malchance vous suit?

Apprenez l'art de la pensée positive. Apprenez des stratégies, et changez totalement votre vie en lui donnant une toute nouvelle empreinte! Enfin, vous saurez comment utiliser la pensée positive et quels sont ses avantages! Vous allez découvrir un nouveau monde! Dans chaque situation, vous serez en mesure de garder la sérénité, d'affronter les choses de la bonne façon, d'analyser et de faire les meilleurs coups. Grâce à quelques conseils simples, la pensée positive améliorera votre estime de soi, votre santé et vous portera chance!

Dans ce manuel utile, vous apprendrez...",979-8621428907,https://m.media-amazon.com/images/I/61vPdMfXVCL._SY522_.jpg,Independently published (4 mars 2020),Marcello Borelli
LA PENSÉE POSITIVE: Comment atteindre vos objectifs et mener une vie positive à travers le pouvoir de la pensée,9.99,"Changez votre vie et commencez à penser positivement!
Savez-vous que la pensée positive fonctionne mais que vous ne savez pas comment la mettre en pratique?
Vous vous sentez triste? Découragé? Tout le monde vous semble heureux?

Tout semble aller mal et la malchance vous suit?

Apprenez l'art de la pensée positive. Apprenez des stratégies, et changez totalement votre vie en lui donnant une toute nouvelle empreinte! Enfin, vous saurez comment utiliser la pensée positive et quels sont ses avantages! Vous allez découvrir un nouveau monde! Dans chaque situation, vous serez en mesure de garder la sérénité, d'affronter les choses de la bonne façon, d'analyser et de faire les meilleurs coups. Grâce à quelques conseils simples, la pensée positive améliorera votre estime de soi, votre santé et vous portera chance!

Dans ce manuel utile, vous apprendrez...",979-8621428907,https://m.media-amazon.com/images/I/61vPdMfXVCL._SY522_.jpg,Independently published (4 mars 2020),Marcello Borelli
Les quatre accords toltèques: La voie de la liberté personnelle,8.95,"Castaneda a fait découvrir au grand public les enseignements des chamans mexicains qui ont pour origine la tradition toltèque, gardienne des connaissances de Quetzacoatl, le serpent à plumes. Dans ce livre, Don Miguel révèle la source des croyances limi-tatrices qui nous privent de joie et créent des souffrances inutiles. Il montre en des termes très simples comment on peut se libérer du conditionnement collectif - le rêve de la planète, basé sur la peur - afin de retrouver la dimension d'a mour inconditionnel qui est à notre origine et constitue le fondement de s enseignements toltèques. Les quatre accords proposent un puissant code de conduite capable de transformer rapidement notre vie en une expérience de liberté, de vrai bonheur et d'amour. Le monde fascinant de la Connaissance véritable et incarnée est enfin à la portée de chacun.",978-2889116546,https://m.media-amazon.com/images/I/615Hq44qv1L._SY522_.jpg,JOUVENCE (8 janvier 2016),Don Miguel Ruiz
Coloriages mystères - Trombinoscope: 100 portraits à colorier,17.27,"Calamity Jane ou Bouddha? Charlie Cplin ou Gandhi ? Les coloriages mystères griment les portraits les plus célèbres ! Grâce aux codes couleurs, démêlez les entrelaces des lignes, appliquez chaque nuance dans la zone correspondante et révélez la personnalité représentée.
Concentrez-vous, faites le vide dans votre esprit, détendez-vous et retrouvez le plaisir de créer.",978-2012047396,https://m.media-amazon.com/images/I/61NNhxnvY1L._SY522_.jpg,Hachette Heroes; Illustrated édition (10 juin 2015),Jérémy Mariez
