Nom,Prix,Description,Isbn,Photo,Editeur,Auteur
Air Fryer IG Bas Facile: 300 Recettes Rapides et Sans Effort,12.51,"Air Fryer IG Bas Facile : 300 Recettes Rapides et Sans Effort pour Tous
Le grand livre de recettes Air Fryer français et IG Bas : 300 recettes faciles, savoureuses et inratables pour tous les jours.
Bienvenue dans le monde de la cuisine à l’Air Fryer, où simplicité rime avec plaisir !
Si vous cherchez à transformer votre routine culinaire avec des recettes simples, rapides et savoureuses tout en respectant les principes de l'alimentation à indice glycémique bas, ""Air Fryer IG Bas Facile"" est le guide parfait pour vous.

Vous êtes :
❌ Fatigué(e) des idées reçues sur la cuisine à l'Air Fryer, limitée à des frites et ailes de poulet ?
❌ Vous souhaitez des plats variés, croustillants et sains, adaptés à une alimentation à indice glycémique bas ?
❌ En quête de recettes faciles, sans ingrédients compliqués ni processus fastidieux ?",979-8877720206,https://m.media-amazon.com/images/I/71ynXHjFMmL._SY522_.jpg,Independently published (30 janvier 2024),IG Media
"Zéro sucre & IG bas, le déclic santé: Toutes les clés pour réussir son rééquilibrage alimentaire en toute sérénité",19.95,"L’instagrameuse 0sucre_et_igbas vous coache pour réussir votre rééquilibrage alimentaire !

Après avoir démontré dans ses précédents ouvrages tous les bienfaits que l’on peut retirer d’une alimentation sans sucre et IG bas, Bérengère vous aide à trouver le déclic pour réussir à changer d’alimentation durablement et retrouver son poids de forme sans renoncer au plaisir.

• Pourquoi surveiller l’index glycémique dans son assiette, manger plus de légumes et de légumineuses ou consommer moins de viande ?
• Comment trouver la motivation, cultiver le positif en soi et ne pas craquer ?
• Comment préparer son planning de menus et s’organiser pour trouver des astuces pour cuisiner IG bas, même quand on a un travail prenant et une vie de famille bien remplie ?
• Pourquoi est-il important d’avoir une activité sportive et un bon sommeil ?",978-2036025578,https://m.media-amazon.com/images/I/81Zhh8daHeL._SY522_.jpg,Larousse; Illustrated édition (14 septembre 2022),Bérengère Philippon
Je réussis ma détox sucre: Comprenez et cuisinez IG bas au quotidien,11.85,"Vous voulez vous libérer des pulsions sucrées, être en bonne santé et avoir toujours la pêche ? Adoptez l’alimentation à Index glycémique (IG) bas !

La quarantaine à peine passée, Bérengère a eu un déclic : pour éviter les soucis de santé et des kilos en trop, il faut remplacer le sucre par des alternatives saines en petite quantité. Elle découvre l’alimentation à IG bas et décide de l’essayer. Un an plus tard, les résultats dépassent largement ses attentes.

Et si vous vous lanciez aussi ?

Loin des régimes hypocaloriques, sans desserts et impossibles à tenir dans le temps, découvrez une alimentation qui évite d’avoir dans le sang une trop grande quantité de sucre (susceptible de se transformer en graisse), favorise la satiété, empêche les fringales et dont les",978-2035997180,https://m.media-amazon.com/images/I/815qTpSxKyL._SY522_.jpg,Larousse; Illustrated édition (17 février 2021),Bérengère Philippon
Je mange équilibré sans me priver !: 4 semaines de menus simples et rapides pour toute la famille,16.9,"80 recettes saines et gourmandes, 1 mois de menus & plein de conseils… pour mieux manger !

Et si adopter une alimentation saine, équilibrée et variée était un rêve à la portée de tous ? Que diriez-vous de retrouver votre poids de forme tout en vous régalant, sans vous lancer dans un régime ni passer des heures en cuisine ? Pour y parvenir, suivez les conseils d’Ysaline Benakli, diététicienne-nutritionniste.
Dans cet ouvrage, elle vous livre tous ses secrets pour débuter un rééquilibrage alimentaire sans se prendre la tête et sans faire de mal à son portemonnaie.
Elle propose des assiettes délicieuses et colorées, faciles à composer, et 4 semaines de menus équilibrés clés en main.

Avec :
• des alternatives de produits avec de bonnes compositions disponibles en grande surface.
• des conseils nutritionnels simples à mettre en œuvre.
• des variantes en fonction des saisons.",978-2501180382,https://m.media-amazon.com/images/I/71bDtjWGyeL._SY522_.jpg,Marabout; Illustrated édition (28 février 2024),Ysaline Benakli
Bonjour Keto: Ma nouvelle vie 100% cétogène sans sucre et sans frustration,15.69,"Le régime cétogène est un véritable mode de vie sain, aux objectifs multiples : perte de poids (sans faim et sans frustration), meilleure concentration, système immunitaire renforcé, performances sportives améliorées, stabilité d’énergie et d’humeur, disparition des migraines, rémission de diabète de type 2, et bien d’autres bienfaits.
Reposant sur des aliments bruts et faisant la chasse aux glucides pour privilégier les bonnes graisses, l’art de vivre cétogène est facile et gourmand, pour peu que l’on sache faire les bons choix et que l’on en connaisse tous les secrets.
Nelly et Ulrich Génisson, pionniers devenus experts du régime cétogène en France, vous accompagnent pas à pas dans ce changement grâce à ce nouveau guide complet, très simple et accessible à tous.

Avec :",978-2501167260,https://m.media-amazon.com/images/I/71jQ0xEIbzL._SY522_.jpg,Marabout; Illustrated édition (6 avril 2022),Nelly Genisson
mmmBook Equilibre Volume 01,5.73,"Le mmmBook Equilibre Volume 01 contient 80 recettes saines et faciles à combiner. Le livre fonctionne avec une application gratuite qui vous permet de calculer les quantités qui conviennent à votre rééquilibrage. Contenu : 15 recettes pour le matin, 15 recettes de collations, 50 recettes pour le midi/soir.",978-2494442030,https://m.media-amazon.com/images/I/61MuCuM8x6L._SY522_.jpg,mmmEat (8 août 2023),mmmEat
Ma cuisine inratable: 90 recettes super faciles que vous allez adorer !,15.77,"Dans ce nouveau livre, Monelle propose 90 recettes simples, rapides et efficaces, les 3 mots qui caractérisent définitivement sa cuisine, pour un succès garanti !
Monelle aime faire de la cuisine un moment de partage simple et joyeux. C'est ce que l'on retrouve dans ses recettes accessibles utilisant des produits du placard, du frigo ou du congélo.
Pas de prise de tête pour se faire plaisir ou faire plaisir à sa famille et ses amis, il suffit de piocher dans les bonnes idées de Monelle : salade cowboy caviar, lasagna soup, pain magique aux 2 ingrédients, wrap à la viande hachée, poireauflette, egg muffins, glace au skyr et à la figue, invisible aux pommes, porridge façon tiramisu...
Autant de recettes créatives et originales à réaliser avec peu d'ingrédients et en un rien de temps pour 100% de gourmandise.
Succès garanti !",978-2263187452,https://m.media-amazon.com/images/I/51gFtoQvxWL._SY522_.jpg,Solar (16 mai 2024),Monelle @not_so_superflu
Faites votre glucose révolution: La formule scientifique efficace pour réduire vos fringales et retrouver votre énergie,8.26,"Améliorez tous les domaines de votre santé : poids, sommeil, fringales, humeur, énergie, peau, hormones, maladies chroniques, et même signes de l'âge, grâce à des conseils nutritionnels faciles et scientifiquement prouvés qui vous permettent de gérer votre glycémie tout en mangeant tout ce que vous aimez.
Agir sur notre courbe glycémique est le geste le plus efficace que nous puissions faire pour notre santé. La majorité de la population souffre d'un dérèglement du glucose et la plupart l'ignore ! Les symptômes ? Fringales, fatigue, acné, vieillissement prématuré, infertilité... et, au fil du temps, des maladies inflammatoires comme le diabète de type 2, les cancers ou les problèmes cardiaques.
S'appuyant sur 300 études scientifiques récentes et sur ses propres recherches, Jessie Inchauspé vous explique le rôle crucial du glucose dans votre organisme et propose 10 conseils simples et surprenants en matière d'alimentation et de mode de vie pour faire disparaître ces symptômes sans faire de régime ni renoncer aux aliments que vous aimez.
Parmi ces conseils clés :
• Manger les aliments dans le bon ordre durant un repas pour perdre du poids sans effort.
• Consommer l'ingrédient secret qui vous permettra de manger un dessert sans en subir les conséquences.
• Modifier votre petit déjeuner pour débloquer votre énergie et réduire vos fringales...",978-2266325561,https://m.media-amazon.com/images/I/617KF-GapIL._SY522_.jpg,Pocket; Illustrated édition (4 janvier 2024),Jessie Inchauspé
mmmBook Equilibre Volume 02,24.9,"Le mmmBook Equilibre Volume 01 contient 80 recettes saines et faciles à combiner. Le livre fonctionne avec une application gratuite qui vous permet de calculer les quantités qui conviennent à votre rééquilibrage. Contenu : 15 recettes pour le matin, 15 recettes de collations, 50 recettes pour le midi/soir.",978-2494442023,https://m.media-amazon.com/images/I/7135PVUMfJL._SY522_.jpg,mmmEat (8 août 2023),mmmEat
Mes recettes de diabétique à partager en famille : printemps - été: Repas IG-bas - VéGé - Tradi,9.78,"Ce livre est rédigé à l’attention des personnes diabétiques qui souhaitent trouver des solutions pour gérer leur glycémie au mieux avec une alimentation complète et équilibrée et continuer de partager leur repas avec tous les membres de la famille. Il propose des recettes qui sont bonnes pour les personnes diabétiques mais aussi pour les personnes non diabétiques et pour ceux qui veulent évoluer vers une alimentation végétarienne.

Il propose surtout des solutions pour faire ses courses, élaborer ses repas et composer ses menus pour les trois principaux repas de la journée. Nous avons eu envie d’écrire ce livre suite au constat que la plupart des recettes proposent des plats mais laissent le diabétique dans un grand désarroi sur l’intégration du plat dans son repas :",979-8386662783,https://m.media-amazon.com/images/I/61GWwArit+L._SY522_.jpg,Independently published (12 avril 2023),Anne Reymonet-Valers
Je réussis ma détox sucre 2 : desserts et goûters à IG bas,11.32,"Après le bestseller Je réussis ma détox sucre, découvrez de nouvelles recettes de l’instagrameuse @0sucre_et_igbas !

Ancien bec sucré, Bérengère a réussi sa détox sucre. Elle n’a pas pour autant renoncé aux desserts, sauf qu’ils sont différents de ceux d’avant : sans sucre blanc et brun, avec des sucrants alternatifs naturels en quantité limitée, sans farine raffinée, mais non moins gourmands !

• Plus de 50 recettes de pâtisseries et desserts à IG (index glycémique) bas, toujours aussi faciles et rapides à préparer.

• Des recettes pour tous les moments gourmands : gâteaux à partager, biscuits, crèmes, desserts aux fruits, gâteaux spécial fêtes, douceurs de petit-déjeuner…

•",978-2036014596,https://m.media-amazon.com/images/I/81e2acQhFOL._SY522_.jpg,Larousse; Illustrated édition (16 février 2022),Bérengère Philippon
"Recettes NINJA CREAMi: Recettes rapides et inratables pour préparer les meilleurs délices glacés chez vous : crèmes glacées, smoothies, sorbets, bols de smoothies, milkshakes…",14.38,"Une sélection des meilleures recettes rapides et inratables pour préparer des délices glacés au NINJA CREAMi !

Pour tous les amoureux de délices glacés, la fabrique à délices glacés NINJA CREAMi est le choix ultime pour votre cuisine. Elle permet de préparer des crèmes glacées gourmandes, sorbets rafraîchissants, glaces à l’italienne crémeuses, bols de smoothies, milkshakes… les possibilités sont infinies !

La fabrique à délices glacés NINJA CREAMi utilise la technologie de pointe CREAMify et un moteur à double action, qui permet de tout transformer facilement en délicieuses douceurs.",979-8849631073,https://m.media-amazon.com/images/I/71Kp81T3b5L._SY522_.jpg,Independently published (2 septembre 2022),Anna GAINES
Friteuse à air: Recettes facile pour l'Air Fryer - Savourez au quotidien des plats sains et délicieux - Photos en couleurs,15.86,"⭐ MAJ 27/05/2024 - Correction d'erreurs ⭐

Transformez votre cuisine quotidienne en un festivalde saveurs croustillantes et saines, le tout avec la simplicité et la rapidité de la friteuse à air !
🌈 Édition avec photos en couleurs 🌈
Le livre de recettes facile de la Friteuse à Air"" est votre passeport pour une cuisine quotidienne à la fois saine et savoureuse. Adapté à tous, du débutant au cuisinier chevronné, il vous guide à travers une variété de plats légers et croustillants, nécessitant peu ou pas d'huile. De délicieuses recettes du monde entier, des astuces pratiques et des photos alléchantes vous attendent pour transformer chaque repas en une expérience gustative exceptionnelle, sans compromettre votre bien-être. Découvrez comment rendre vos repas à la fois simples, rapides et pleins de saveurs avec cet indispensable de la cuisine saine",979-8320588735,https://m.media-amazon.com/images/I/71qYxj-k3wL._SY522_.jpg,Independently published (22 mars 2024),Éléonore Moreau
Happy Healthy,16.91,"80 recettes healthy et gourmandes créées par Kyria, pour qui le secret de sa bonne humeur et de son énergie passe par l'assiette !
Kyria, avec son pep's et son énergie communicative, a séduit près de 700 000 abonnés sur TikTok.
Son secret ? Se sentir bien dans son assiette sans se priver grâce à ses recettes, à la fois saines et gourmandes. Pois chiche grillés, straciatella maison, champignons farcis, lasagnes de patate douce, boulettes de boeuf au fromage, golden cake, moelleux chocolat banane...
Voici 80 idées d'apéros, de plats et de desserts aussi pétillantes que son quotidien joyeux et sans filtre.

Oh pétard ! La cuisine de Kyria c'est un concentré de bonne humeur !",978-2263183829,https://m.media-amazon.com/images/I/611CZzgAlkL._SY522_.jpg,Solar; Illustrated édition (5 octobre 2023),Kyria Nichelatti
"RÉGIME ANTI-INFLAMMATOIRE: Combattre l'inflammation chronique, Réduire la graisse du ventre et Renforcer le système immunitaire. Avec des recettes françaises traditionnelles",12.97,"NOUVELLE ÉDITION 2024 avec toutes les recettes mesurées avec précision en grammes pour vous garantir des résultats impeccables dans chaque plat !

Avez-vous déjà pensé à utiliser les aliments comme arme contre les inflammations dans votre corps ?

L'alimentation anti-inflammatoire est de plus en plus populaire, et ce, pour de bonnes raisons. Une alimentation composée d'aliments naturels et riches en nutriments peut contribuer à réduire les inflammations chroniques, à renforcer le système immunitaire, et donc à améliorer la santé et le bien-être en général.

C'est pourquoi le livre de cuisine de",978-8894748819,https://m.media-amazon.com/images/I/71ya76tHCQL._SY522_.jpg,Nimbus House (21 juillet 2023),Hans Peter Müller
"Zoé NoGluten - Mes recettes sans gluten: Faciles, rapides et absolument délicieuses",8.69,"Zoe Reich, à la tête du compte @zoe.nogluten, donne dans ce livre tous ses conseils quotidiens pour se faciliter la vie quand on ne peut pas consommer de gluten et ses meilleures recettes salées et sucrées. Wrap de courgettes, tarte aux épinards, pain protéiné, muffins ricotta poireaux, banana bread, cookies… pour une cuisine sans gluten joyeuse et pleine de gourmandise.",978-2501177283,https://m.media-amazon.com/images/I/71D2uMQi2lL._SY522_.jpg,Marabout; Illustrated édition (10 mai 2023),Zoé NoGluten
Jérusalem,38.0,"Les saveurs et les senteurs de Jérusalem sont notre langue maternelle. Les herbes sauvages ramassées lors de voyages scolaires, les jours de marché, les odeurs du sol sec un jour d'été, les chèvres et les moutons errants dans les collines, les pitas fraîches, le persil coupé, les figues noires, les gâteaux sirupeux, les cookies friables...",978-2012315754,https://m.media-amazon.com/images/I/81vjQWU2srL._SY522_.jpg,Hachette Pratique (16 octobre 2013),Yotam Ottolenghi
Le grand livre de l'alimentation cétogène,23.95,"""Grâce à ce livre, les Français vont être plus en forme que jamais"" Tim Noakes
Manger sain, éviter le sucre, perdre du poids, retrouver la forme, abaisser la glycémie : quels que soient vos objectifs, l'alimentation cétogène ou LCHF (low carb high fat) est une option judicieuse. Mais suivre cette alimentation pauvre en glucides, riche en bonnes graisses n'est pas si simple.
C'est pourquoi Le Grand Livre de l'alimentation cétogène, écrit par Ulrich et Nelly, les deux pratiquants français les plus emblématiques, vous donne toutes les clés, les astuces, les conseils, les recettes pour adopter une alimentation cétogène comme un vrai mode de vie sain et durable. Suivez le guide et éprouvez le plaisir de voir les kilos fondre sans stress, sans fringales ni baisse d'énergie.
Dans ce livre, vous allez découvrir :",978-2365492454,https://m.media-amazon.com/images/I/61k0loycYiL._SY522_.jpg,Thierry Souccar; Illustrated édition (14 septembre 2017),Ulrich Genisson
LE RÉGIME IG BAS ET ANTI-INFLAMMATOIRE: 2 LIVRES EN 1 Désintoxiquez votre Corps & Améliorez votre Système Immunitaire Avec un Régime Pauvre en Sucres et Riche en Antioxydants +150 Recettes Délicieuses,13.43,"⭐ 3ÈME ÉDITION MARS 2024 - « TOP 3 DES LIVRES POUR LA SANTÉ » +50.000 EN 2023 ⭐

- Vous sentez-vous souvent ballonné après avoir mangé et vous ne savez pas pourquoi ?
- Voulez-vous enfin atteindre vos objectifs de perte de poids et retrouver votre énergie ?
- Saviez-vous qu’une alimentation saine et anti-inflammatoire joue un rôle essentiel dans le soulagement des symptômes des problèmes courants ?

Dans ce guide ultime 2-en-1, la chercheuse indépendante Nathalie Dufour vous explique comment se débarrasser de l’inflammation chronique, nettoyer son corps et perdre du poids efficacement et durablement.
Un guide indispensable pour revitaliser votre organisme, renforcer votre système immunitaire et rééquilibrer votre alimentation quotidienne.",979-8879380873,https://m.media-amazon.com/images/I/81DgyMxJhML._SY522_.jpg,Independently published (12 février 2024),Nathalie Nathalie
Zoé NoGluten - Mes recettes sans gluten - Tome 2,11.9,"Zoe Reich, à la tête du compte zoe.nogluten, propose des recettes simples pour des déjeuners, des dîners et des touches sucrées 100 % sans gluten sans prise de tête. Cake aux légumes, tarte à la courgette, butternut gratinée, curry de pois chiches, pain aux graines, marbré, tiramisu, cheesecake…
pour une cuisine sans gluten joyeuse et pleine de gourmandise. Zoe Reich, alias zoe.nogluten est atteinte de la maladie cœliaque et partage auprès de sa communauté ses conseils, astuces et recettes sans gluten.",978-2501184410,https://m.media-amazon.com/images/I/81mJ0pV14cL._SY522_.jpg,Marabout; Illustrated édition (15 mai 2024),Zoé NoGluten
J'équilibre mon alimentation,16.9,"Claire Sauge, à la tête du compte claire_mum_fit__ , partage dans ce livre tous ses conseils pour apprendre à maîtriser son poids et propose 75 recettes et 10 menus hebdomadaires pour retrouver le plaisir de manger bon et sain. Salade de poulet croustillant, patates douces farcies, nouilles sautées, gaufres courgettes-parmesan, curry de cabillaud, crumble pomme-poire, cookies, cake fondant au citron…",978-2501184762,https://m.media-amazon.com/images/I/71WyvktQnmL._SY522_.jpg,Marabout; Illustrated édition (2 mai 2024),Claire Sauge @claire_mum_fit__
Bien manger pour être en forme !,22.95,"Ma méthode pour mieux manger et se sentir bien tout au long de l'année
Cela fait des années maintenant que je milite pour une alimentation saine, équilibrée et respectueuse de l'environnement. Bien manger est capital pour être en forme et faire face au temps qui passe.

Ce livre vous propose des recettes – les miennes et celles de mes amis – faciles et savoureuses à base de produits de saison. Mais aussi des conseils de spécialistes pour vous guider vers une alimentation qui vous permettra d'être en forme sans vous priver !",978-2749957852,https://m.media-amazon.com/images/I/61gVPRaCZuL._SY522_.jpg,Michel Lafon; Illustrated édition (18 avril 2024),Marie Drucker
"Régime Anti-inflammatoire: Des recettes faciles et délicieuses pour combattre l'inflammation, affiner votre silhouette et dynamiser votre énergie grâce à des ingrédients naturels",8.14,"Vous cherchez une solution simple et naturelle pour combattre l'inflammation chronique ?
Rêvez-vous de vous sentir pleine d'énergie et sans douleur ?
Avez-vous déjà tout tenté sans succès ?

Ce livre est fait pour vous.

Vivre avec une inflammation chronique est épuisant. Se lever chaque jour avec peu d'énergie, se sentir faible et gérer les symptômes douloureux au quotidien peuvent ruiner votre vie. Je le sais, car je l'ai vécu.

Heureusement,",979-8877424098,https://m.media-amazon.com/images/I/71JoOZyceRL._SY522_.jpg,Independently published (26 janvier 2024),Sophie Girard
La révolution Airfryer - 120 recettes à la friteuse à air,11.54,"Le Airfryer, la nouvelle tendance food des friteuses sans huile en 120 recettes !
Découvrez plus de 120 recettes réalisables à l'Airfryer ! Ce robot est capable de cuire de manière plus saine et plus simple les plats grâce à son système de ventilation chauffante.
Déposez vos ingrédients dans le panier, ajoutez (ou non !) un peu d'huile, choisissez la température et la durée et hop, c'est parti ! L'airfryer permet une cuisson plus rapide et homogène que le four, et moins grasse que la friteuse.
Pour chaque recette, repérez rapidement la température de cuisson, la durée et l'ajout ou non d'huile.
Craquez pour un poulet rôti bien croustillant sans graisse, des apéritifs gourmands et légers, des chips de légumes, des butternuts farcis, des plats pour toute la famille, des légumes bien croquants, des desserts (à la friteuse, oui oui !)...",978-2412094402,https://m.media-amazon.com/images/I/71K7JkMk0FL._SY522_.jpg,First; Illustrated édition (14 mars 2024),Sandra Mahut
Mon cahier de recettes IG bas,18.93,"Retrouvez la collection Mon cahier avec un nouveau titre de recettes de cuisine par l'auteur du blog La cerise sur le maillot ! Mon cahier de recettes IG bas propose 120 recettes recettes saines et gourmandes, imaginées pour apprendre à contrôler l'effet du sucre, toutes photographiées et complétées des nouvelles illustrations si caractéristiques de la collection.
Se faire plaisir en éliminant les pics de glucose, c'est ce que La cerise sur le maillot vous propose dans ce nouveau cahier de recettes. Ou comment retrouvez énergie et équilibre en limitant l'impact du sucre et en suivant son rythme et ses envies.
Dans ce cahier de recettes, découvrez :
- ce que veut dire manger IG bas et comment faire baisser l'index glycémique de votre assiette ;
- tous les bienfaits de l'alimentation IG bas pour votre santé, votre silhouette et votre bien-être général ;
- comment composer simplement votre placard IG bas de base.
Découvrez ensuite 120 recettes saines, légères et toujours gourmandes, pour que chaque occasion ne soit plus un défi mais juste une occasion de mieux manger : des petits déjeuners et goûters, des apéros 0 culpabilité, des soupes gourmandes, des salades repas, des petits plats de viande, poisson ou végétariens.
Avec mon cahier, désormais, prenez aussi soin de vous dans votre assiette !",978-2263186103,https://m.media-amazon.com/images/I/61uVfwxHFgL._SY522_.jpg,Solar; Illustrated édition (22 février 2024),Stéphanie Jouan
IG Bas au Quotidien: Plus de 150 Recettes IG Bas Faciles et Rapides,7.66,"Avec IG Bas au Quotidien, réussissez enfin votre detox sucre ! Retrouvez la ligne à travers plus de 150 recettes healthy ig bas, faciles rapides et gourmandes !

❌ Vous voudriez mieux manger sans vous creuser la tête, jour après jour, sur les recettes que vous pourriez réaliser pour manger sainement et avec plaisir ?
❌ Vous en avez assez des livres de cuisine trop peu diversifiés, testés en quelques semaines, qui ne vous offrent pas assez de recettes pour maintenir une alimentation ig bas tout au long de l’année ?
❌ Votre emploi du temps surchargé ne vous permet pas de passer des heures entières à cuisiner des plats compliqués ? Vous manquez d’inspiration ou de recettes healthy faciles à préparer ?",979-8784086051,https://m.media-amazon.com/images/I/71AueiKdOYL._SY522_.jpg,Independently published (13 décembre 2021),IGFacile
Mes recettes IG bas - spécial anti-glucose,7.22,"Avec Charline Diététicienne, découvrez 100 recettes spécial IG bas pour des repas 100% plaisir et sans pics de glucose !
L'alimentation doit avant tout être une source de plaisir et c'est ce que Charline aime proposer avec ses recettes simples, rapides et gourmandes, qui vous aideront à retrouver de l'énergie en éliminant les pics de glucose.
Du petit déjeuner au déjeuner, entrée, repas, snacks et desserts, tout est garanti IG bas : porridge salé au comté, croque-moniseur au pain de campagne, bowl cake aux myrtilles et aux amandes, wraps de lentilles corail, quiche sans pâte épinards-feta, filet de truite rôti aux légumes & aux figues, steaks de haricots rouges, bouillon miso de légumes et de tofu, cookies banane & noisette...
En introduction, retrouvez toutes les infos et astuces pour bien comprendre la notion d'IG bas (les différents types de glucides, les féculents, la charge glycémique..), ainsi que de nombreux conseils pour changer ses habitudes alimentaires et des menus pour vous aider à y parvenir !",978-2263183317,https://m.media-amazon.com/images/I/61mzC3ZAoqL._SY522_.jpg,Solar; Illustrated édition (1 juin 2023),charline.dieteticienne
