Nom,Prix,Description,Isbn,Photo,Editeur,Auteur,Categorie
Régénération par la marche afghane,10.48,"La respiration au service de la santé
Ce coffret propose des exercices, simples mais puissants, e ration rythmique synchronisée sur la marche et qui vont véritablement révolutionner votre vie. Grâce à la formidable suroxygenation que procurent ces exercices, le métabolisme est revitalisé, le système immunitaire est renforcé, le processus de vieillissement est ralenti, les cellules se régénèrent... Pratiquée régulièrement, cette marche/respiration va enclencher le processus de détoxication dont le corps a besoin, transformant à son tour la chimie interne de celui-ci. Il s&#39en ressent un incroyable bien-être, une santé et une vitalité accrues. Vous deviendrez plus audacieux, plus ambitieux : en un mot plus performant ! Vous retrouverez une meilleure harmonie et vos rapports avec l&#39extérieur et les autres s&#39en trouveront facilités.",978-2813206312,https://m.media-amazon.com/images/I/51HNoD7TVNL._SY522_.jpg,Les éditions Trédaniel (1 novembre 2013),Corinne G. Stiegler,Holistique
"REMÈDES HOMÉOPATHIQUES POUR TOUTES LES MALADIES: Le guide de base du sel cellulaire homéopathique et comment l&#39utiliser pour traiter la constipation, les ecchymoses, les allergies, la neuropathie, les",18.92,"Les sels cellulaires homéopathiques, également appelés sels tissulaires ou sels de Schuessler, constituent un aspect fascinant de la médecine homéopathique. Cette approche thérapeutique a été lancée par un médecin allemand à la fin du XIXe siècle, offrant une perspective unique sur la relation entre les minéraux et la santé cellulaire. Basés sur les principes de l&#39homéopathie, les sels cellulaires visent à rétablir l&#39équilibre et à favoriser le bien-être en s&#39attaquant aux déséquilibres ou aux carences en minéraux essentiels au sein des cellules.

Les recherches du Dr Schuessler ont été inspirées par son observation approfondie du rôle crucial que jouent les minéraux dans la fonction cellulaire. Il a suggéré que des déséquilibres dans la distribution ou la disponibilité de ces minéraux pourraient entraîner toute une série de problèmes de santé. Contrairement à l&#39homéopathie traditionnelle, qui utilise fréquemment des substances énergétiques dérivées d&#39animaux, de plantes ou de minéraux, les sels cellulaires ciblent spécifiquement les minéraux essentiels qui jouent un rôle crucial dans la biochimie du corps humain.

La théorie biochimique, principe fondamental de la thérapie par les sels cellulaires, suggère qu&#39il existe 12 sels minéraux cruciaux nécessaires à la préservation du bien-être cellulaire. Ces minéraux sont constitués d’une variété d’éléments essentiels, chacun ayant ses propres propriétés et bienfaits pour le corps. Selon l&#39expert, ces minéraux se trouvent dans chaque cellule et sont essentiels au bon fonctionnement des processus biochimiques du corps.
L&#39un des principes fondamentaux des sels cellulaires homéopathiques est le concept de dynamisation, un processus de dilution et de succussion qui joue un rôle crucial dans les remèdes homéopathiques. Bien qu&#39un débat soit en cours sur le mécanisme d&#39action précis, les partisans affirment que ce processus amplifie les propriétés énergétiques ou vibratoires de la substance tout en diminuant sa concentration matérielle. En ce qui concerne les sels cellulaires, on pense que ces préparations minérales diluées activent les processus naturels de guérison du corps.",979-8879269352,https://m.media-amazon.com/images/I/61+TkHNo9zL._SY522_.jpg,Independently published (11 février 2024),Jorge Mateo,Holistique
Yoga: THE PATH TO HOLISTIC HEALTH,10.42,"Around the world, increasing numbers of people are turning to yoga as a means of keeping fit and reducing stress. In this comprehensive and highly illustrated guide B.K.S. Iyengar, the world&#39s leading teacher of yoga, shares his unique, holistic approach. For Iyengar, yoga is more than just a form of exercise; it is a holistic experience that benefits the body, mind, and spirit. He outlines the philosophy and ideals behind this ancient practice and explains how yoga can help to counter the stresses of modern living. Designed for every level of ability, age, and physical condition, there are detailed instructions for beginner, intermediate, and advanced students. Clearly illustrated, step-by-step instructions explain how to perform each yoga asana, or posture, correctly, while a unique 360-degree view of the final pose shows exactly how to position each part of the body. A special section introduces B.K.S. Iyengar&#39s innovative use of props, enabling beginners or the less flexible to practice the classic yoga asanas more easily and effectively. A further section illustrates sequences of asanas to treat or prevent a wide range of ailments. In addition, there is a 20-week yoga course, personally formulated by B.K.S. Iyengar, which progresses from simple to more challenging postures. Without a doubt, Yoga: The Iyengar Way is the definitive guide to the practice of yoga by the master.",978-0789471659,https://m.media-amazon.com/images/I/71vA9DfadcL._SY522_.jpg,DK (31 janvier 2001),B.K.S. Iyengar,Holistique
,10.83,,,,,,Holistique
Techniques de guérison pour animaux - Pratiques holistiques,20.0,"Véritable bible pour renforcer la santé et améliorer la vie de vos compagnons adorés, La guérison pour les animaux démystifie les énergies vibratoires et vous apporte une source d&#39informations complètes pour approfondir, développer et harmoniser la conscience que vous avez de l&#39énergie de vos animaux. Ce guide, complet et efficace, propose de véritables méthodes thérapeutiques afin de vous permettre d&#39établir une connexion authentique avec votre animal, d&#39intensifier son bien-être et d&#39enrichir le lien indéfectible que vous avez avec l&#39esprit et l&#39âme de ce dernier. À l&#39aide de méthodes et d&#39exercices simples et innovants, de descriptions détaillées et d&#39études illustrées, Niki J. Senior vous apprend à faire usage de pierres, de cristaux, d&#39essences florales et d&#39autres remèdes naturels pour guérir efficacement votre animal.",979-1097154462,https://m.media-amazon.com/images/I/71fQsHjgxOL._SY522_.jpg,AMETHYSTE ED; Illustrated édition (2 juillet 2020),Niki J. Senior,Holistique
Enfant TDAH et famille épanouie: La méthode et les outils pour accompagner votre enfant TDAH dans la sérénité,18.85,"⚡ Le TDAH, une caractéristique unique à cultiver.

Découvrez, dans ce témoignage vibrant, la clé pour comprendre et soutenir votre enfant atteint d&#39un Trouble Déficit de l&#39Attention avec ou sans Hyperactivité (TDAH).

🌿 Votre parcours est parsemé d&#39angoisses et d&#39incertitudes ?
Comment aider mon enfant à canaliser son énergie ?
Comment apaiser ses souffrances causées par l&#39incompréhension de ses différences ?
Suis-je suffisamment équipé(e) pour répondre à ses besoins spécifiques ?
Ne vous inquiétez plus, une approche révolutionnaire vous attend !",979-8864761144,https://m.media-amazon.com/images/I/6166fZyw1rL._SY522_.jpg,Independently published (3 novembre 2023),Julia Martel,Holistique
Formation Dien Chan: niveau 1,6.55,"Objectifs :Le Dien Chan est une méthode originale vietnamienne pour :- Aider l’apprenant à être en mesure de prévenir et de soigner, pour lui-même et pour d’autres, les maladies courantes et même certaines maladies chroniques.- Le malade devient lui-même son médecin.- Aider l’apprenant non seulement à guérir mais aussi à avoir la confiance en soi, le dynamisme et la possibilité d’aider ceux qui sont autour d’eux.Définition du Dien Chan - thérapie cybernétique :- Le Dien Chan est le nom raccourci de la méthode de Dien Chan - thérapie cybernétique (Face diagnostis - Cybernetic Therapy - FACY).- Il s’agit d’une nouvelle méthode Vietnamienne de prévention et le traitement, née au début de 1980, inventée par un chercheur de la médecine traditionnelle, le Professeur Docteur Bui Quoc Chau.- Le Dien Chan est une méthode de diagnostic et de traitement sur la peau du visage et de tout le corps par la stimulation des points sensibles et les zones correspondantes à l’organe malade du corps entier (appelé schéma de réflexion).- On peut aussi dire que le Dien Chan est la méthode de diagnostic des signes sur le visage de l’état de santé des personnes, car il permet de détecter et d’agir pour améliorer la santé, la prévention et le traitement de la maladie.- Le visage est considéré comme une zone d’information et de contrôle de toutes les activ- ités de l’organisme, grâce à la réflexion et correspondance entre les régions périphériques et les organes du corps.- A partir de cela, nous pouvons agir sur les points vivants sur le visage pour faire les changements sur l’organisme",979-8733408309,https://m.media-amazon.com/images/I/71DTaQnBCNS._SY522_.jpg,Independently published (25 avril 2021),Le Yen Zys,Holistique
Qui es-tu ?,18.52,"Le lecteur désireux de découvrir qui il est puisera des trésors d&#39information dans ce livre. Grace à des exemples pratiques tirés de la vie courante, il apprendra ici à se reconnaître à travers ce qu&#39il dit, pense, voit, entend ou ressent. De plus, l&#39ouvrage décrit en détail la signification des formes du corps. Plus de 250 malaises et maladies sont expliqués dans leur sens métaphysique, aidant ainsi à en découvrir les causes profondes. Les résultats visés sont l&#39auto-guérison, l&#39amélioration de la qualité des communications interpersonnelles et un mieux-être général.",978-2920932012,https://m.media-amazon.com/images/I/61RM2F7GIoL._SY522_.jpg,ETC (3 septembre 1999),Lise Bourbeau,Holistique
Vivre sans boulimie: Un chemin vers la libération,8.25,"Faire la paix avec l’alimentation et avec son corps : c’est possible !
Des compulsions alimentaires vous poussent à dévorer des quantités astronomiques ?
Vous êtes obnubilé par la nourriture et avez l&#39impression qu&#39une force démoniaque s&#39empare de vous, parfois ?
Vous êtes en guerre avec votre corps ?
Vous avez déjà essayé plusieurs approches, sans succès ?
J’ai connu tout cela pendant 28 années avant de parvenir à manger avec plaisir et insouciance, de ressentir la satiété et d’aimer mon corps.",978-2958744908,https://m.media-amazon.com/images/I/61YQfW9JfpL._SY522_.jpg,Aux Girafes en Paix (5 avril 2023),Sonia BORYS,Holistique
The Complete Cookbook Inspired by Barbara O&#39Neill&#39s Natural Recipes: Wholesome Plant-Based Cooking,11.93,"Introducing the globally acclaimed masterpiece, a culinary revelation that transcends borders— ""Barbara O&#39Neill&#39s Natural Recipes: A Culinary Odyssey."" This international bestseller, now in its latest and enhanced edition for 2024, is more than just a cookbook; it&#39s an indispensable guide to life-changing recipes inspired by the transformative teachings of Barbara O&#39Neill.

Step into a world where the art of wholesome, plant-based cooking takes center stage, inviting you to unleash the true potential of your well-being. Say goodbye to fleeting dieting fads and embrace a new approach to healthy eating that promises not only delicious meals but a profound transformation from within.

Every page of this culinary masterpiece opens a gateway to a realm where mouthwatering meals and holistic well-being coexist harmoniously. Crafted with precision,",979-8872857105,https://m.media-amazon.com/images/I/71M3OY+XePL._SY522_.jpg,Independently published (24 décembre 2023),Veronica Greenleaf,Holistique
Les dix cerveaux de la naturopathie: La vision holistique,17.32,"L&#39intelligence humaine est prodigieuse et probablement n&#39exploitons-nous qu&#39une infime part de ses ressources à ce jour. Si les mystères du cerveau révèlent des potentiels inouïs, d&#39autres formes de « cerveaux », comme le coeur, les intestins, l&#39intelligence cellulaire ou encore l&#39intelligence de l&#39Ame, sont aussi à prendre en considération pour une approche globale de la santé, responsable et durable. br/ br/ Ce sont ainsi en tout 10 cerveaux (limbique, reptilien, cortical, associatif, gauche, droit, abdominal, cardiaque, cellulaire et spirituel) dont il faut prendre soin au quotidien. Daniel Kieffer vous livre ici ses secrets de naturopathe, ses conseils sur les bons comportements à adopter et ses clés de bien-être pour une meilleure prise en charge de votre santé de manière holistique.",978-2889532001,https://m.media-amazon.com/images/I/71ZMskWbaOL._SY522_.jpg,JOUVENCE (12 juin 2019),Daniel Kieffer,Holistique
