Nom,Prix,Description,Isbn,Photo,Editeur,Auteur,Categorie
"Comment arrêter de penser, le piège de l’overthinking: Le guide complet ""arrêter de penser et se prémunir contre l’overthinking"". Méthodes pour adopter une réaction saine pour une vie épanouie",7.39,"Stress, angoisse et pression constante, ce sont les principaux signes d’une pensée excessive et cela peut avoir des effets néfastes sur votre santé mentale et physique.

Avec ce livre, nous allons explorer les différentes facettes de cette forme méconnue de stress et d’anxiété. Nous allons énumérer ses dangers et surtout, vous donner des stratégies et des techniques prouvées pour faire face à ce fléau silencieux.

Une vie épanouie passe par la maitrise de l’overthinking et la minimisation de son impact sur votre quotidien. Apprenez à identifier cette habitude destructrice et à la combattre à travers des exercices pratiques et des stratégies à adopter.

Anxiété, dépression, insomnie, fatigue et maladies chroniques. Examinez les effets de la rumination excessive et découvrez des moyens pour l&#39atténuer afin de",979-8395261793,https://m.media-amazon.com/images/I/71yWK4NOwBL._SY522_.jpg,Independently published (19 mai 2023),MetaMind Edition,Depression
Des mots pour fleurir - Recueil de 138 textes inspirants pour t&#39apporter du réconfort dans ton combat contre les TCA: - Troubles alimentaires -,10.16,"✨ Un recueil de 138 textes inspirants écrit par une rescapée de l&#39anorexie.

Mais que tu souffres de n&#39importe quel trouble alimentaire (anorexie, boulimie, hyperphagie, orthorexie...), tu te retrouveras dans ce livre.

Des mots pour fleurir,
🌷Ce sont des textes qui t&#39apporteront bienveillance, qui t&#39aideront à cultiver l&#39auto-compassion.
🌷 Ce sont des mots qui te feront te sentir compris⸱e, moins seul⸱e.
🌷 Ce sont des mots qui t&#39apporteront réconfort et force pour faire face à ton trouble alimentaire.
🌷 Ce sont des mots qui pourront provoquer des déclics, des prises de conscience...
🌷 En bref, ce sont des mots pour t&#39aider à fleurir.",979-8397166140,https://m.media-amazon.com/images/I/619E4FSUgSL._SY522_.jpg,Independently published (12 juin 2023),Norainnoflower By Mathilde,Depression
"Le burn-out, comment le prévenir ou en sortir ?",6.61,"Comment (re)prendre sa vie en mains et se protéger contre le burn-out ?
Ce livre s’adresse à ceux qui veulent éviter le burn-out et apprendre à repérer à temps les signaux d’alerte, chez soi et les autres. Mais aussi à ceux qui sont allés jusqu’au burn-out et qui commencent à remonter la pente.
Il est structuré en 3 parties :
COMPRENDRE explique le phénomène du burn-out, ses causes multifactorielles, ainsi que ses signaux d’alerte.
AGIR vous accompagne dans votre réflexion pour instaurer les changements nécessaires à la prévention du burn-out ou des rechutes.
TRAITER retrace les grandes étapes nécessaires pour sortir du burn-out.",978-2807334182,https://m.media-amazon.com/images/I/71WfEjuIMCL._SY522_.jpg,DE BOECK SUP; 1er édition (11 octobre 2022),Barbara Delbrouck,Depression
La Dépression: Comment en sortir,18.9,"?La dépression, on peut en sortir. On n&#39est pas dépressif à vie. Ce n&#39est ni un manque de volonté ni un simple passage à vide, mais une maladie qui se soigne. Ce guide pratique répond à vos questions et vous propose une méthode pour changer votre vision de vous-même et du monde. Pour sortir de la dépression et ne pas y retomber... Christine Mirabel-Sarron est médecin psychiatre, praticien hospitalier, à l&#39hôpital Sainte-Anne, où elle dirige l&#39unité de thérapie comportementale et cognitive. Docteur en psychologie pathologique et clinique, elle enseigne aux universités de Paris-V et Paris-VIII.",978-2738111340,https://m.media-amazon.com/images/I/719koidw3pL._SY522_.jpg,Odile Jacob (2 mars 2002),Christine Mirabel-Sarron,Depression
The Shadow Work Journal,11.71,"Embark on a journey of self-discovery, healing and inner transformation with the new and updated smash-hit TikTok sensation and million-copy international bestseller.
Are you ready to embark on a powerful journey of self-discovery, healing and inner transformation?
The Shadow Work Journal is an empowering and compassionate tool to help you face your shadows and overcome the obstacles and limiting self-beliefs that are holding you back from achieving your true potential.",978-0008696269,https://m.media-amazon.com/images/I/71D048H5QpL._SY522_.jpg,HQ (18 janvier 2024),Keila Shaheen,Depression
And How Does That Make You Feel?: everything you (n)ever wanted to know about therapy,14.62,"&#39Extraordinary. The psychology world has found its own Adam Kay.&#39Dr Sophie Mort, clinical psychologist & Sunday Times bestselling author of A Manual for Being Human

Have you ever wondered what goes on behind the closed door of the therapist&#39s office? What&#39s revealed there may surprise you.

Psychotherapist Josh Fletcher takes us on a candid and human journey into the individual sessions of four patients - Levi, Zahra, Noah and Daphne - sharing their self-discovery and recovery as they engage in therapy for the first time. And he lets us into the inner thoughts of a therapist, from shock and sympathy while in session, to how it feels to run into a former client on a messy night out.

Interspersed with straight-talking advice on common issues such as anxiety, OCD and panic attacks, as well as a therapist&#39s guide to how to find the right therapist,",978-1398713208,https://m.media-amazon.com/images/I/61U-CKOFf1L._SY522_.jpg,Orion Spring (14 mars 2024),Joshua Fletcher,Depression
Le coeur dans les étoiles,16.8,"Le coeur dans les étoiles est un recueil de poésie abordant les maux d&#39une vie comme l&#39amour, l&#39amitié, l&#39absence, le manque, le deuil jusqu&#39à la guérison et le retour du soleil.",978-2322499557,https://m.media-amazon.com/images/I/61yVfcvI7PL._SY522_.jpg,BOOKS ON DEMAND (23 août 2023),Aurore Afonso,Depression
"En finir avec la dépression en 7 jours: Vaincre la dépression, se sortir de la déprime, et booster son humeur à l&#39aide des meilleures solutions connues à l&#39heure actuelle, et prouvées par la science",17.52,"LAISSE-MOI TE MONTRER COMMENT TE SENTIR BIEN AU QUOTIDIEN GRÂCE À LA SCIENCE DE LA DÉPRESSION.

7 jours…

Nous avons seulement besoin de 7 jours pour vaincre la dépression ou la déprime, à condition de mettre en place les bonnes techniques. Être pleinement heureux prendra évidemment plus que 7 jours, mais ce sera suffisant afin de se soulager fortement du poids de la dépression.

Dans ce livre, je te présente une méthode complète agissant sur chacune des causes de la dépression, pour s&#39en libérer tout en se constituant une humeur de qualité au quotidien. J&#39explique tout d&#39abord comment fonctionne la dépression, puis quelles sont les techniques pour s&#39en débarrasser, et j&#39organise le tout en une méthode concrète.

La science a bien avancé en ce qui concerne la dépression, et je suis aujourd&#39hui pleinement apte à t&#39apporter les réponses dont tu as besoin.",978-2958199753,https://m.media-amazon.com/images/I/61sKvlnKSFL._SY522_.jpg,Independently published (22 avril 2022),Thomas Piquemal,Depression
"Mindfulness Journal For Teen Girls [Revised Edition]: A Guide to Becoming a Calmer, Happier Version of Yourself Through Mindfulness Journaling and Daily Practice",9.16,"Ever feel like you have way too much to deal with? Or like you can&#39t handle all the stressors of school, home, conflicts with friends, or managing your first serious relationships and landing that amazing summer job that you were hoping for?
Life is challenging and stressful. But what can you do to relieve some of that stress?

Develop a daily mindfulness routine!
This journal will teach you everything you need to know to start off on your mindfulness journey. From everyday proven mindfulness strategies to mindfulness journaling prompts and practical planning sheets, this journal has it all and more! Inside you&#39ll find:",978-1914986475,https://m.media-amazon.com/images/I/71lVzWHwT2L._SY522_.jpg,Teen Thrive; Revised édition (21 septembre 2023),Teen Thrive,Depression
Psychologie du sentiment d&#39injustice - Comprendre et traiter la souffrance,18.0,"Le sentiment d&#39injustice peut se révéler très destructeur et nombreuses sont les occasions d&#39y être sujet : rupture, licenciement abusif, injustice, harcèlement, agression, lors du décès d&#39un proche. Certains, aussi, l&#39instrumentalisent pour emporter l&#39adhésion des autres. L&#39auteur détaille ses mécanismes et comment trouver les clés de guérison adaptées pour nous en libérer.
Tout le monde, un jour ou l&#39autre, vit un drame, qu&#39il s&#39agisse du décès d&#39un être aimé, d&#39une agression, d&#39un harcèlement, d&#39une rupture ou d&#39un licenciement abusif. Il peut alors s&#39élever en nous un très fort sentiment d&#39injustice, d&#39autant plus qu&#39un tribunal ou notre entourage s&#39avère souvent impuissant à nous offrir une reconnaissance et une réponse. Piégés dans des ruminations de colère et de tristesse, ressassant les évènements, nous pensons que tant que nous n&#39aurons pas obtenu réparation, nous ne pourrons pas avancer et nous reconstruire.

Cet ouvrage s&#39adresse à chacun de nous, lorsque nous avons besoin d&#39être accompagnés pour maîtriser les pensées destructrices, la colère, le ressentiment, la tristesse, le sentiment d&#39humiliation et de perte de dignité. Il nous guide dans un processus de guérison avec des outils fondés sur des connaissances scientifiques en psychologie.

Le sentiment d&#39injustice déclenché par le deuil est également abordé, par exemple celui d&#39un passé qui ne sera jamais corrigé et réparé, ou encore la difficulté à absorber la violence d&#39un décès dans des circonstances insupportables.

Enfin, la dernière partie de cet ouvrage aborde la politique et offre une grille de lecture de la façon dont certains intervenants publics peuvent instrumentaliser le sentiment d&#39injustice et de ressentiment pour obtenir notre adhésion. Dans nos sociétés hyper-médiatisées, où les idées semblent chauffées à blanc, il est capital de connaître les outils qui permettent de prendre du recul.

Un ouvrage pensé pour le grand public, les personnes en cours de thérapie, les psychologues et psychiatres souhaitant se former dans ce domaine ou utiliser un cahier d&#39accompagnement pour leurs patients.",978-2702921241,https://m.media-amazon.com/images/I/51-gS5ugGUL._SY522_.jpg,Courrier du Livre (31 mars 2022),Vincent Trybou,Depression
It&#39s all love,17.95,"Tant que l&#39amour est là pour éclairer notre chemin, tout est possible.
Depuis mon enfance, je dois jongler entre ma carrière d&#39actrice, ma vie personnelle et ce que le public attend de moi. J&#39ai appris, un peu à mes dépens, que la seule façon d&#39y parvenir est de me laisser guider par l&#39amour – l&#39amour pour mes amis, pour ma famille et, avant tout, pour moi-même. Je veux partager avec vous mes échecs, mes triomphes et les leçons que j&#39en ai tirées. Je vous confie les anecdotes et histoires qui m&#39ont marquée, aussi bien sur les plateaux de tournage que dans ma vie privée et mes relations.",978-2749955636,https://m.media-amazon.com/images/I/51fQBJcyrnL._SY522_.jpg,Michel Lafon (12 octobre 2023),Jenna Ortega,Depression
Tout ce que j&#39ai à te dire.: Carnet d&#39écriture.,15.93,"Carnet d&#39Écriture ""Tout ce que j&#39ai à te dire""
- Plus de 100 Pages avec Lignes
Découvrez le carnet d&#39écriture ""Tout ce que j&#39ai à te dire"", un compagnon parfait pour toutes vos pensées, idées, et inspirations. Ce carnet élégant et fonctionnel, doté de plus de 100 pages lignées, est conçu pour accueillir vos mots les plus précieux.
Caractéristiques :
Titre: ""Tout ce que j&#39ai à te dire""
Pages: Plus de 100 pages avec lignes
Design : Une couverture attrayante et sophistiquée, idéale pour toutes les occasions",,https://m.media-amazon.com/images/I/41Sk34y7JRL._SY522_.jpg,Independently published (5 mars 2024),A G,Depression
,16.4,,,,,,Depression
The Burnout Society,19.97,"Our competitive, service-oriented societies are taking a toll on the late-modern individual. Rather than improving life, multitasking, ""user-friendly"" technology, and the culture of convenience are producing disorders that range from depression to attention deficit disorder to borderline personality disorder. Byung-Chul Han interprets the spreading malaise as an inability to manage negative experiences in an age characterized by excessive positivity and the universal availability of people and goods. Stress and exhaustion are not just personal experiences, but social and historical phenomena as well. Denouncing a world in which every against-the-grain response can lead to further disempowerment, he draws on literature, philosophy, and the social and natural sciences to explore the stakes of sacrificing intermittent intellectual reflection for constant neural connection.",978-0804795098,https://m.media-amazon.com/images/I/71JFv5wkHoL._SY522_.jpg,Stanford University Press (12 août 2015),Byung-Chul Han,Depression
"Game Changer : On se cherche, on se trouve",18.23,"Un roman inspirant pour cheminer vers plus d&#39alignement, de liberté et d&#39authenticité !

Anna est à la croisée des chemins. Engluée dans le métro-boulot-dodo, elle aspire à briser les chaînes de sa routine professionnelle pour accéder à plus de liberté, dédier plus de temps à son fils Benjamin et être plus épanouie. Alors qu’elle est au bord de l&#39épuisement, une opportunité se présente : l’intrigante expérience Game Changer, un parcours initiatique conçu pour aider celles et ceux qui cherchent à redéfinir leur destin. Aux côtés de Nathaniel, un guide énigmatique, Anna plonge dans ce labyrinthe de défis qui promet la clé de sa renaissance. Osera-t-elle affronter ses peurs pour réinventer son futur?

Au fil de l’odyssée d’Anna, ce",979-8865380986,https://m.media-amazon.com/images/I/61RbIh3GfkL._SY522_.jpg,Independently published (15 novembre 2023),Rita Badraoui,Depression
Apprivoiser le syndrome du côlon irritable: Libérez-vous des troubles digestifs,18.84,"Il existe des stratégies pour gérer le syndrome du côlon irritable (SCI) qui ne sont pas uniquement basées sur l’utilisation de médicaments. Lorsqu&#39il s&#39agit de maîtriser le SCI, les changements alimentaires, un sommeil de qualité et un mode de vie sain font la différence. Mais comment faire ?

La méthode de Stella Morel est basée sur sa propre expérience. Elle vous démontre qu&#39il est possible de gérer efficacement votre SCI en se servant des moyens les plus efficaces. Souvent, la gestion du SCI passe par la révision de certaines (mauvaises) habitudes alimentaires, l&#39adaptation de notre routine de sommeil, l&#39adoption d&#39un mode de vie plus sain, et la gestion du stress.

Une révision de nos habitudes nous aide à retrouver l&#39équilibre, à être plus conscients de notre alimentation et de notre corps, et à apprendre les clés d&#39une vie saine pour apprivoiser le SCI.",979-8854530316,https://m.media-amazon.com/images/I/61HKbVdlt-L._SY522_.jpg,Independently published (1 août 2023),Stella Morel,Depression
Prise au piège: Histoire vécue,12.25,"UNE HISTOIRE VÉCUE TRÈS PARTICULIÈRE !

Voici l&#39histoire bouleversante vécue par Christine que vous jugerez incroyable tellement elle va loin. À l&#39aube de ses 31 ans, insatisfaite de sa vie et complètement éblouie par un homme qu&#39elle a rencontré, Christine, aussi naïve qu’ambitieuse, quitte tout pour vivre une expérience hors du commun. Et c&#39est la descente aux enfers...
« Bouleversant
C&#39est un témoignage très touchant et très bouleversant. En lisant ce livre je suis passé par beaucoup de tristesse et aussi beaucoup d&#39admiration pour Christine qui tant bien que mal a réussi à retrouver une vie plus ou moins normale. »",978-2924818053,https://m.media-amazon.com/images/I/518HODogHwL._SY522_.jpg,Éditions Verge-d&#39Or (30 décembre 2017),Annie Robert,Depression
"The Dialectical Behavior Therapy Skills Workbook: Practical DBT Exercises for Learning Mindfulness, Interpersonal Effectiveness, Emotion Regulation, and Distress Tolerance",24.2,"A clear and effective approach to learning evidence-based DBT skills-now in a fully revised and updated second edition.

Do you have trouble managing your emotions? First developed by Marsha M. Linehan for treating borderline personality disorder, dialectical behavior therapy (DBT) has proven effective as treatment for a range of other mental health problems, and can greatly improve your ability to handle distress without losing control and acting destructively.
However, to make use of these techniques, you need to build skills in four key areas: distress tolerance, mindfulness, emotion regulation, and interpersonal effectiveness.

The Dialectical Behavior Therapy Skills Workbook, a collaborative effort from three esteemed authors, offers
evidence-based, step-by-step exercises for learning these concepts and putting them to work for real and lasting change. Start by working on the introductory exercises and, after making progress, move on to the advanced-skills chapters.
Whether you&#39re a mental health professional or a general reader, you&#39ll benefit from this clear and practical guide to better managing your emotions.

This fully revised and updated second edition also includes new chapters on cognitive rehearsal, distress tolerance, and self-compassion. Once you&#39ve completed the exercises in this book and are ready to move on to the next level, check out the authors&#39 new book, The New Happiness Workbook.

This book has been awarded The Association for Behavioral and Cognitive Therapies Self-Help Seal of Merit -",978-1684034581,https://m.media-amazon.com/images/I/811nY+uHCtL._SY522_.jpg,New Harbinger; Workbook édition (28 novembre 2019),Matthew McKay,Depression
The Self-Driven Child: The Science and Sense of Giving Your Kids More Control Over Their Lives,16.62,"“Instead of trusting kids with choices . . . many parents insist on micromanaging everything from homework to friendships. For these parents, Stixrud and Johnson have a simple message: Stop.” —NPR

“This humane, thoughtful book turns the latest brain science into valuable practical advice for parents.” —Paul Tough, New York Times bestselling author of How Children Succeed

A few years ago, Bill Stixrud and Ned Johnson started noticing the same problem from different angles: Even high-performing kids were coming to them acutely stressed and lacking motivation. Many complained they had no control over their lives. Some stumbled in high school or hit college and unraveled. Bill is a clinical neuropsychologist who helps kids gripped by anxiety or struggling to learn. Ned is a motivational coach who runs an elite tutoring service. Together they discovered that the best antidote to stress is to give kids more of a sense of control over their lives. But this",978-0735222526,https://m.media-amazon.com/images/I/71ZAOVkbntL._SY522_.jpg,Penguin Publishing Group; Reprint édition (12 février 2019),William Stixrud PhD,Depression
Mon programme pour mieux gérer le TDA-H avec la pleine conscience: Comment apprivoiser le TDA-H en 8 semaines,16.18,"Le seul programme de pleine conscience à destination des patients pour mieux gérer son TDAH.

Êtes-vous facilement distrait ? Avez-vous tendance à être désorganisé, à procrastiner ou avoir des oublis fréquents ? Avez-vous des difficultés à rester en place ou à gérer les émotions fortes comme la colère ou la frustration ? Si c&#39est le cas, vous présentez peut-être un Trouble du Déficit de !&#39.Attention avec ou sans Hyperactivité (TDA-H), comme environ 3% de la population.
Grâce à la méditation de pleine conscience, vous entraînerez votre attention et découvrirez des clés pour mieux faire face aux symptômes du TDA-H. L&#39auteure explique concrètement comment fonctionne le « cerveau TDA-H » et la manière dont la méditation de pleine conscience peut améliorer la qualité de vie. Cette approche peut également être associée à d&#39autres traitements, y compris les médicaments.",978-2807326798,https://m.media-amazon.com/images/I/61OgizFwYSL._SY522_.jpg,DE BOECK SUP; 2e édition (27 avril 2022),Lidia Zylowska,Depression
The Indoctrinated Brain: How to Successfully Fend Off the Global Attack on Your Mental Freedom,28.39,"Global War on the Human Brain
 
Throughout the world, mental capacity is declining, especially among young people, while depression rates are rising dramatically. Meanwhile, one in forty men and women suffers from Alzheimer&#39s, and the age of onset is falling rapidly. But the causes are not being eliminated, quite the opposite. Can this just be coincidence?
 
The Indoctrinated Brain introduces a largely unknown, powerful neurobiological mechanism whose externally induced dysfunction underlies these catastrophic developments.
 
Michael Nehls, medical doctor and internationally renowned molecular geneticist, lays out a shattering chain of circumstantial evidence indicating that behind these numerous negative influences lies a targeted, masterfully executed attack on our individuality. He points out how the raging wars against viruses, about climate change, or over national borders are—more likely intended than not—fundamentally providing the platform for such an offensive against the human brain that is steadily changing our being and is aimed at depriving us of our ability to think for ourselves.
 
But it is not too late. By exposing these brain-damaging processes and describing countermeasures that anyone can take, Nehls brings light and hope to this fateful chapter in human history. Nothing less will be decided than the question of whether our species can retain its humanity and its creative power or whether it will lose them irretrievably.
 ",978-1510778368,https://m.media-amazon.com/images/I/71V6N4x6d5L._SY522_.jpg,Skyhorse (12 décembre 2023),Michael Nehls MD PhD,Depression
Le journal créatif du burn out,19.0,"Une pratique innovatrice pour sortir du burnout et retrouver le goût du travail !
Aux prises avec un burnout, nous réalisons que nos ressources physiques, intellectuelles et émotionnelles ne sont pas inépuisables. Dans une société de "" sursollicitation "", de surconsommation et d&#39exploitation du vivant, il devient grand temps de ralentir, de prendre soin de soi, de développer sa clairvoyance et de retrouver son bon sens. L&#39art du journal intime ouvre la porte à une rencontre avec soi-même ; en faire un journal créatif qui interroge sur la place du travail dans sa vie, c&#39est se donner l&#39occasion de ranimer la flamme de l&#39énergie.
Grâce à ce livre qui propose de nombreux exercices et tests, toute personne en épuisement professionnel pourra utiliser ces outils pour se poser les bonnes questions, se ressourcer, trouver ce qui l&#39inspire et se remettre en route. Ainsi, réfléchir, écrire, dessiner et faire du collage deviendront autant de façons de faire appel à son imagination pour mieux comprendre le rôle de cet épuisement et la façon d&#39en sortir.",978-2761956321,https://m.media-amazon.com/images/I/713Plhv8IvS._SY522_.jpg,de l&#39Homme; Illustrated édition (16 septembre 2021),Nathalie Hanot,Depression
"Comment Arrêter De Trop Penser: Un Guide Pour Ne Pas Se Perdre Dans Ses Pensées. Obtenez la Paix d’Esprit Avec Des Techniques Pour Soulager l’Anxiété, Gérer le Stress et Éliminer la Pensée Négative",9.45,"CE QUE VOUS ALLEZ APPRENDRE POURRAIT VOUS CHANGER POUR TOUJOURS
Comment arrêter de trop penser : le livre qui met un frein à la pensée envahissante !
Combien de fois avez-vous eu l’occasion, après une longue journée, de vous mettre au lit et de ne pas pouvoir dormir parce que votre esprit était plein de pensées ?
C’est une des choses les plus frustrantes, n’est-ce pas ?
Si vous êtes impatient que cela se produise, j’ai le livre pour vous !
Avec ""Comment arrêter de trop penser"", vous apprendrez le fonctionnement de votre esprit et les petites astuces que vous pouvez mettre en pratique immédiatement pour améliorer votre qualité de vie.",979-8847704298,https://m.media-amazon.com/images/I/61BJ+Eye9rL._SY522_.jpg,Independently published (22 août 2022),Adam Tusco,Depression
When the Body Says No: The Cost of Hidden Stress,16.12,"Can a person literally die of loneliness? Is there a connection between the ability to express emotions and Alzheimer&#39s disease? Is there such a thing as a &#39cancer personality&#39?

With compassion, warmth and empathy, Dr Gabor Maté draws on deep scientific research and his acclaimed clinical work to provide the answers to critical questions about the mind-body link - and illuminates the role that stress and our emotional makeup play in an array of common diseases.

When the Body Says No:

- Explores the role of the mind-body link in conditions and diseases such as arthritis, cancer, diabetes, heart disease, irritable bowel syndrome and multiple sclerosis.
- Shares dozens of enlightening case studies and personal and moving stories, including those of people such as Lou Gehrig (ALS), Betty Ford (breast cancer), Ronald Reagan (Alzheimer&#39s), Gilda Radner (ovarian cancer) and Lance Armstrong (testicular cancer)
- Reveals &#39The Seven A&#39s of Healing&#39: principles in healing and the prevention of illness from hidden stress",978-1785042225,https://m.media-amazon.com/images/I/81PvAO9G+HL._SY522_.jpg,Vermilion; 1er édition (3 janvier 2019),Gabor Maté,Depression
