Nom,Prix,Description,Isbn,Photo,Editeur,Auteur
Claire au matcha dans ma cuisine !: 70 recettes gourmandes et bluffantes quel que soit le temps dont vous disposez,11.22,"Plus de 70 recettes faciles et gourmandes conçues par une nutritionniste pas comme les autres !
Claire au matcha s’invite dans votre cuisine et, soyez prévenu, son envie de bien manger et sa gourmandise légendaire sont contagieuses ! Chacune de ses recettes est un délice à lire, à réaliser et à déguster.
Vous rentrez tard du travail et avez peu de temps devant vous ? Vous aimez recevoir mais vous n’avez pas envie de passer des heures en cuisine ? Ou au contraire, vous avez tout l’après-midi devant vous pour réaliser un dîner dingue ? Dans ce livre généreux, Claire vous propose plus de 70 recettes bluffantes et inratables. En vous partageant toutes ses astuces étonnantes, ses coups de coeur et ses « essentiels », elle devient votre meilleure alliée pour mettre de la légèreté et de la joie dans votre quotidien. Vous allez aussi adorer comprendre comment vous maintenir chaque jour en bonne santé, sans compromettre votre gourmandise, grâce à de nombreux conseils nutritionnels. Découvrez ses petits plats salés cultes et ses recettes sucrées favorites.",978-2416012563,https://m.media-amazon.com/images/I/81DInX70vWL._SY522_.jpg,EYROLLES; Illustrated édition (2 novembre 2023),Claire Kalchman
"RECETTES MINCEUR AU COOKEO: +100 recettes gourmandes, faciles et rapides pour cuisiner au quotidien",13.28,"Le livre de ""recettes minceur au Cookeo"" est un guide pratique pour ceux qui cherchent à manger sainement et à perdre du poids en utilisant leur multicuiseur Cookeo. Ce livre de plus de 100 recettes contient une variété de plats équilibrés et savoureux, qui sont faciles à préparer et sains pour le corps.
Les recettes comprennent des entrées légères, des soupes et des salades fraîches, des plats principaux à base de viande maigre ou de poisson, des accompagnements à base de légumes, et des desserts faibles en calories. Les instructions de chaque recette sont claires et détaillées, permettant aux cuisiniers de tous niveaux de compétence de réussir chaque plat.
Les recettes sont conçues pour être rapides et faciles à préparer, en utilisant des ingrédients simples et abordables. Les plats sont également personnalisables, permettant aux cuisiniers de modifier les ingrédients pour répondre à leurs préférences personnelles. Les informations nutritionnelles sont fournies pour chaque plat, permettant aux utilisateurs de suivre leur consommation de calories et de macronutriments.",979-8378272891,https://m.media-amazon.com/images/I/61ntddwSUtL._SY522_.jpg,Independently published (21 février 2023),Nobel CUISINE
Mes recettes healthy sucrées: BOUM ! 130 recettes ultra gourmandes pour te faire plaisir,16.9,"Thibault Geoffray vous propose une véritable bible de 130 recettes healthy sucrées calibrées spécialement pour éviter le mauvais sucre et le mauvais gras.
Vous trouverez également de multiples variantes de vos recettes préférées pour s’adapter à toutes les saisons et toutes les envies !",978-2501165891,https://m.media-amazon.com/images/I/716FaezM6gL._SY522_.jpg,Marabout; Illustrated édition (7 septembre 2022),Thibault Geoffray
Je cuisine IG bas pour toute ma famille: Une méthode pour réduire le sucre. Des recettes ultra-simples et des idées de menus,17.9,"Réduire sa consommation de sucre, mieux contrôler son appétit et ses fringales, faire grimper sa jauge d'énergie, réguler son poids, améliorer son bien-être général et sa santé... On ne compte plus les bienfaits d'une alimentation à indice glycémique bas ! Pourtant, on pense parfois, à tort, qu'il est compliqué de concilier ce type d'alimentation et une vie de famille bien remplie...
Albane Reclus nous démontre le contraire ! Les recettes qu'elle propose dans ce livre sont parfaitement adaptées à tous les membres de la famille, quel que soit leur âge. Simples à réaliser et très gourmandes, elles font appel à des produits nutritifs, bruts et de saison : Velouté de poireaux et pois cassés, salade de lentilles aux figues fraîches, poulet façon mafé, crumble de légumes d'été, fondant aux pommes, clafoutis aux myrtilles...",978-2226480934,https://m.media-amazon.com/images/I/71BplLKnYRL._SY522_.jpg,Albin Michel; Illustrated édition (12 avril 2023),Albane Reclus
,18.3,,978-2011356901,,Hachette Pratique; Illustrated édition (14 octobre 2016),
Vapeur douce: Nouvelles recettes gourmandes au Vitaliseur,18.95,"La cuisson douce, votre atout santé. 60 DÉLICIEUSES RECETTES À FAIRE EN UN TOUR DE MAIN AVEC VOTRE VITALISEUR !
Découvrez 60 nouvelles recettes inédites de Jennifer Martin du compte Instagram @Des_papilles_qui_pétillent, réalisées au Vitaliseur de Marion®.

Des entrées, des plats, des desserts faciles et gourmands pour régaler toute la famille au quotidien et sans prise de tête !

Le livre indispensable pour tous les adeptes de ce mode cuisson à basse température.",978-2755673593,https://m.media-amazon.com/images/I/71ON+YeSjYL._SY522_.jpg,Hugo Image; Illustrated édition (10 avril 2024),Jennifer Martin
Recettes T12S,19.95,"Grâce à cet ouvrage, (re)découvrez le plaisir de bien manger tout en préservant votre santé et sans vous priver ! 80 recettes faciles et délicieuses pour tous les jours !Fini les régimes, apprenez à écouter votre corps, cuisinez de produits simples et frais, c’est notre recette pour votre santé !

Jessica Mellet et Alexandre Mallier, coachs diplômés d’État, auteurs du best-seller T12S : une méthode qui allie l’entraînement physique à une alimentation variée et équilibrée.",978-2036053984,https://m.media-amazon.com/images/I/81EDpOsvSSL._SY522_.jpg,Larousse; Illustrated édition (20 septembre 2023),Jessica Mellet
LES RECETTES IG BAS LES + FACILES DU MONDE,19.06,"Dans cet ouvrage, JFM s’est amusé avec tous les produits à faible IG (quinoa, avocat, oléagineux, tofu, aubergine, betterave, lentilles…) pour vous concocter 45 recettes gourmandes, savoureuses et compatibles avec le régime IG bas.

Et en plus, c’est simplissime en cuisine !!!

Quelques exemples de recettes : guacamole épicé, dhal de lentilles, houmous de betterave, salade de lentilles, soupe miso au sarrasin.

Des recettes lues en un coup d’œil, réalisées en un tour de main !
4 à 6 ingrédients par recettes, présentés visuellement.",978-2017259282,https://m.media-amazon.com/images/I/61Iwxo3++uL._SY522_.jpg,Hachette Pratique; Illustrated édition (6 mars 2024),Jean-François Mallet
Jestatouille 2: Exercices et recettes pour être en forme - 100 % recettes inédites,19.15,"Zéro culpabilité, un maximum de plaisir !

Vous vous souvenez de Jesta Hillmann ? Après sa grossesse, elle s’était mise à la cuisine afin de rééquilibrer son alimentation. Une page installera, un livre et un autre enfant plus tard, elle est de retour !
Et elle revient avec un nouveau livre : 100 % de nouvelles recettes, toujours aussi saines et gourmandes pour se faire plaisir sans culpabiliser. Mais cette fois-ci, elle n’est pas seule : son mari Benoît l’accompagne. Ancien footballeur professionnel, il intervient dans le livre pour donner ses conseils sport et santé, ainsi que quelques exercices pour que chacun puisse constituer sa routine santé alimentation et sport.
55 recettes de soupes, salades, tapas, boissons, plats légers et desserts, pour se faire plaisir sans culpabilité",978-2019463571,https://m.media-amazon.com/images/I/71BWfcBuR7L._SY522_.jpg,Hachette Pratique; Illustrated édition (4 mai 2022),Jesta Hillmann
L'équilibre dans l'assiette: Une méthode simple et ludique pour retrouver du plaisir à manger,19.9,"Dites stop à la dictature des régimes et laissez-vous guider par Myriam Moussier, diététicienne nutritionniste, @mydiet_moussier. Elle propose une méthode ludique et simple pour équilibrer votre alimentation sans restriction et sans avoir le nez sur le compteur à calories. Composez votre assiette équilibrée en suivant le code de couleurs associées aux cinq familles d'aliments (légumes/fruits, produits laitiers ou équivalents végétaux, pain/féculents, viandes/poissons/oeufs/alternatives végétales, matières grasses) classifiés en fonction des principaux nutriments essentiels à la composition d'une journée équilibrée (protéines animales et végétales, lipides, glucides, fibres, vitamines, minéraux et eau). Des menus pour 8 semaines sont proposés, soit plus de 100 recettes savoureuses, pour retrouver l'autonomie et reprendre la main sur sa santé. Il y en a pour toute la famille afin que chacun trouve ce qui lui convient selon ses habitudes et envies (flexitarien, végétarien) et reprenne plaisir à se faire du bien.",978-2080275981,https://m.media-amazon.com/images/I/61-rVXyAjIL._SY522_.jpg,FLAMMARION; Illustrated édition (21 septembre 2022),Myriam Moussier
365 recettes & conseils pour bien manger au naturel: 120 recettes pour adopter une alimentation saine tout au long de l année,16.26,"Angèle Ferreux-Maeght applique les principes de la naturopathie à sa vie quotidienne. Elle transmet dans ce livre tous ses secrets pour bien manger et prendre soin de soi 365 jours par an.
Mois par mois, Angèle propose :
Des recettes de saison, saines et gourmandes, pour varier son alimentation au fil de l’année : purée de butternut œuf poché et granola, poêlée de poivrons tomates sarrasin et parmesan, samoussa aux petits pois et chutney de menthe, chou-fleur épicé au lait de coco, tarte salée au potimarron chèvre frais & graines…
Des conseils simples pour bien attaquer chaque saison, prendre soin de son corps, gérer son énergie, soigner les rhumes saisonniers…
Le compagnon indispensable pour votre cuisine de tous les jours",978-2501172325,https://m.media-amazon.com/images/I/71WRS5KccWL._SY522_.jpg,Marabout; Illustrated édition (28 septembre 2022),Angèle Ferreux-Maeght
Recettes au cuit vapeur,16.64,"De l'apéritif au dessert, cuisinez à la vapeur ! côte salé : camembert aux pistaches et au miel en papillotes, boulettes de boeuf épicées à la tomate, moules au curry, raviolis chinois aux légumes... Côte sucré : yaourts maison, petites crèmes choco-café, compote de fruits rouges, papillotes exotiques, banana bread, cake marbré... Grâce à votre cuit vapeur, confectionnez de délicieuses recettes sans effort et en un temps record !",978-2035986061,https://m.media-amazon.com/images/I/81jy5doJhlL._SY522_.jpg,Larousse; Illustrated édition (4 mars 2020),Noémie Strouk
"Les Pâtes Gourmandes c'est permis!: OUI au plaisir, NON aux kilos!",19.9,"Les Pâtes Gourmandes, c’est permis !
Vous aimez les pâtes ?
Vous raffolez de leurs sauces et de leurs accompagnements généreux ?
Et en même temps, vous voulez garder votre poids de forme ?
Alors cet ouvrage est fait pour vous.
OUI, cet ouvrage s’adresse à tous les amateurs des pâtes qui veulent garder la ligne !
Au fil des pages, découvrez :
cannellonis, lasagnes, tagliatelles, gnocchis, linguines, spaghettis, parpadelles, crozets, rigatonis, farfalles, orecchiettes, bucatinis et autres pâtes gourmandes…
50 recettes exclusives",978-2492579530,https://m.media-amazon.com/images/I/81n+cjmRaJL._SY522_.jpg,Editions Comme J'aime; Illustrated édition (30 août 2023),COMME JAIME
