Nom,Prix,Description,Isbn,Photo,Editeur,Auteur
"Jestatouille: Zéro culpabilité, un maximum de plaisir",24.95,"Zéro culpabilité, un maximum de plaisir !

Après sa grossesse, et 28 kilos supplémentaires, Jesta Hillmann a voulu se mettre à la cuisine afin de rééquilibrer son alimentation.

Elle a vite compris qu’elle n’était pas la seule et a décidé de partager son expérience et ses recettes avec les gens qui la suivent. Poisson aux agrumes, tarte épinards-chèvre, toast aux figues, blueberry bowl, salade sucrée-salée, cookies de falafels… Elle publie régulièrement sur Instagram ses idées de bons petits plats hyper simples à réaliser, sans ingrédients complexes et, surtout, sains et équilibrés. Le partage (de recettes, d’expériences, de conseils et de bonne humeur), c’est ce qui fait vivre sa communauté.",978-2017138068,https://m.media-amazon.com/images/I/71p8jH99lcL._SY522_.jpg,Hachette Pratique; Illustrated édition (17 février 2021),Jesta Hillmann
Manuel gourmand de la ménopause,18.64,"On le sait, l’alimentation joue un rôle crucial sur la santé et le bien-être. A fortiori quand on passe la quarantaine, puis à la cinquantaine, quand pré-ménopause et ménopause s’installent. Or, curieusement, les livres de recettes existants sont pleins de restrictions, ce sont toujours des livres de régime. Le Manuel gourmand de la ménopause est le premier livre de cuisine ― une cuisine joyeuse, saine, gourmande ―, qui réponde aux problématiques spécifiques aux femmes de 40 à 60 ans. Il a été conçu par Elvira Masson et Jennifer Hart-Smith, et ça change tout. La chroniqueuse culinaire et la pâtissière naturopathe ont associé leurs talents pour proposer 120 recettes et astuces délicieuses à base d’ingrédients qui font du bien. Chaque recette est accompagnée d’explications sur ses bienfaits. Des focus sur les grands thèmes liés à la ménopause les complètent. Qu’en est-il des céréales, des laits végétaux, de la reminéralisation, du tofu et des œstrogènes par exemple ? Enfin, parce que ce livre est aussi une ouverture sur le monde, des cheffes et des chroniqueuses racontent ce qui se fait dans leurs pays respectifs : Japon, Inde, Chine, Moyen-Orient.",978-2021525854,https://m.media-amazon.com/images/I/81dY6-A1kGL._SY522_.jpg,SEUIL; Illustrated édition (20 octobre 2023),Jennifer Hart-Smith
"Ma Cuisine Gourmande sans grossir: OUI au plaisir, NON aux kilos!",19.58,"Ma Cuisine Gourmande sans grossir
Vous voulez manger sain et équilibré ?
Vous voulez maintenir votre poids de forme durablement ?
Vous voulez vous faire plaisir à table, en cuisinant tout ce que vous aimez ?
Alors cet ouvrage est fait pour vous !
Spécialiste du rééquilibrage alimentaire, Comme J’aime a déjà permis à plus de 500 000 personnes de retrouver leur poids de forme. Aujourd’hui, Comme J’aime lance sa maison d’édition pour accompagner tous ceux qui le souhaitent vers une vie plus saine. Son premier ouvrage de cuisine est LA bible des gourmands qui gardent la ligne.",978-2492579486,https://m.media-amazon.com/images/I/81-kllbJtQL._SY522_.jpg,Editions Comme J'aime; Illustrated édition (5 octobre 2022),COMME JAIME
Le guide de la cuisine sous vide et de la cuisson basse température,49.9,"Le guide ultime de la cuisine sous vide et de la cuisson à basse température pour amateurs débutants et professionnels
- Plus de 150 recettes étape par étape
- Plus de 500 combinaisons temps & température testées et validées
- Des conseils sur la qualité des produits utilisés
- Des photographies exclusives montrant les ingrédients à différents stades de cuisson, et permettant de choisir la texture idéale et le goût parfait.",978-2812321580,https://m.media-amazon.com/images/I/61ktFROJGML._SY522_.jpg,Editions du Chêne; Illustrated - Enlarged édition (3 janvier 2024),Karsten Tanggaard
"Diabète de type 2: Mangez bien, vivez mieux : Maintenez un IG Bas avec une multitude de recettes accessibles pour gérer le diabète de type 2 grâce à un plan de repas flexible de 60 jours",14.55,"⭕️ Prêt à transformer votre approche de la cuisine diabétique en une aventure exquise qui marie plaisir et santé?
Embarquez dans un voyage culinaire où chaque plat est une célébration du goût sans compromettre votreéquilibre glycémique.

Le Guide Ultime de la Cuisine Diabétique vous ouvre les portes d'un univers où la gestion de votre diabète devient une source d'inspiration pour des repas innovants et savoureux.

Voici pourquoi ce livre va révolutionner votre table:",979-8877210196,https://m.media-amazon.com/images/I/71A0jXEDI5L._SY522_.jpg,Independently published (25 janvier 2024),Adélie Adam
Zoé cuisine,18.95,"Découvrez plus de 50 recettes gourmandes pour vous faire plaisir en cuisine tout en prenant soin de votre santé. Des plats pour toutes les saisons, des desserts réconfortants, mais aussi des petits déjeuners et collations rassasiants…

Avec Zoé, vous pouvez tout manger !

Zoé Vrignaud, diététicienne nutritionniste, vous guide pour comprendre l’équilibre nutritionnel de base ! Déconstruisez les préjugés alimentaires au fil des pages et rééquilibrez votre assiette grâce à de nombreux conseils thématiques. Avec ce livre, apprenez à alléger vos plats préférés sans perdre en gourmandise, et à adapter vos menus quotidiens à toutes vos envies !",978-2036064164,https://m.media-amazon.com/images/I/61F+10XGItL._SY522_.jpg,Larousse; Illustrated édition (17 avril 2024),Zoé Vrignaud
"Mes petites recettes magiques - Smoothies minceur et jus détox: 100 jus, cocktails, boissons magiques : la minceur dans le mixeur",6.9,"Après avoir ""mangé avec une fourchette"", la nouvelle tendance, c'est la paille ! Pour preuve, les ventes de mixeurs, blenders, etc, en pleine progression ! Normal : quoi de plus facile pour mincir et se faire plaisir qu'un smoothie minceur ? Il suffit de mélanger les bons ingrédients ensemble : 5 fruits et légumes par jour, c'est facile ! Même pas besoin de mâcher : les saveurs explosent dans la bouche ! A l'apéritif, pour se désaltérer, à la place d'un repas, en guise d'en-cas, ou pour se faire plaisir à n'importe quel moment de la journée. Dans ce livre : 50 ingrédients minceur dans le mixeur : d'Agar-agar à Yaourt au soja, fruits, légumes, herbes aromatiques, laits, sauces, yaourts, eaux, thés, sorbets… Tous les conseils pratiques : matériel, frais ou surgelés ?, etc. 100 recettes de boissons minceur : tutti frutti, tutti légumi, boissons magiques, plats complets, chauds ou glacés, thé addicts, ""spéciaux"" (en plus d'être minceur, ils sont aphrodisiaques, antistress, antioxydants…) : il y en a pour tous les goûts et toutes les occasions ! la coverture peut differe!",979-1028504496,https://m.media-amazon.com/images/I/71VoHYZY4aL._SY522_.jpg,LEDUC; Illustrated édition (17 novembre 2017),Anne Dufour
Le livre santé de la cuisine végétale: 160 recettes créatives et gourmandes,8.21,"Et si vous mettiez du Bon Sens dans votre assiette ? Et si vous appreniez à bien manger sans savoir cuisiner et à vous faire plaisir sainement et simplement, tout en vous familiarisant avec les bases de l'alimentation et de la digestion ? Faciles et rapides à préparer, découvrez : - Les bienfaits et les vertus thérapeutiques de 160 recettes délicieusement équilibrées, du petit-déjeuner au dîner - sans oublier les mises en bouche et les sauces - Des aliments originaux faciles à préparer, qui revitalisent votre corps : des bouillons et veloutés réconfortants pour l'hiver aux salades pleines de vitalité pour l'été, en passant par des tartes colorées et des desserts appétissants pour toutes les saisons. - Des recettes qui s'adaptent à tous les types de régimes (carnés, végétariens, végétaliens...) et à toutes les cultures. Que vous soyez une personne experte en cuisine à la recherche de nouvelles inspirations ou totalement novice, lancez-vous dans ces recettes du Bon Sens, à la fois gourmandes et bénéfiques pour votre santé. Ces préparations sont un véritable outil d'apprentissage pour toute personne désireuse d'avoir une alimentation équilibrée et énergisante. Et pour répondre plus précisément à vos besoins de santé, vous trouverez en fin d'ouvrage un index thérapeutique des recettes.",978-2716318310,https://m.media-amazon.com/images/I/71DyEkvpL7L._SY522_.jpg,DAUPHIN; Illustrated édition (18 janvier 2024),Nina Voit
Ma cuisine en équilibre: 1 aliment = 6 recettes,20.9,"Pour son second livre, Myriam Moussier, diététicienne nutritionniste, propose une déclinaison de 27 aliments (fruits, légumes et protéines), présentés selon sa méthode de couleurs qui illustre la bonne répartition des nutriments dans l'assiette, sur une journée. Six recettes sont proposées pour chaque aliment, afin de le cuisiner sous toutes les coutures, le découvrir ou le redécouvrir, l'associer, le déguster et surtout afin de continuer de manger sainement et équilibré. Que l'on soit végétarien, bec sucré, en solo ou en famille, les 162 recettes offrent le choix nécessaire pour satisfaire chaque appétit et chaque envie tout en se faisant du bien.",978-2080439741,https://m.media-amazon.com/images/I/61Rcrl60nBL._SY522_.jpg,FLAMMARION; Illustrated édition (14 février 2024),Myriam Moussier
"Le Régime Anti-Inflammatoire: Découvrez des astuces simples pour purifier votre corps, renforcer votre système immunitaire tout en retrouvant une silhouette uniforme.",17.8,"⭕️ Vous souffrez d’inflammation chronique? Vous avez tout essayé sans succès?

⭕️ Vous aspirez à retrouver un confort de vie avec des méthodes simples et naturelles?

⭕️ Vous voulez améliorer votre santé et commencer ainsi une vie plus saine?

Si vous avez répondu à une ou plusieurs de ces questions, le livre ""Le Régime Anti-Inflammatoire"" va vous apporter des solutions simples et naturelles qui changeront votre vie durablement voire définitivement.",979-8321901403,https://m.media-amazon.com/images/I/71l+y395dGL._SY522_.jpg,Independently published (5 avril 2024),Martine Voclain
Obsessions végétales,19.64,"""Les légumes sont toujours le point central de mes plats. Je jette mon dévolu sur l'un d'entre eux et immédiatement, les idées fusent dans ma tête. J'adore associer les saveurs, travailler les modes de cuisson, jouer avec les textures.""

Natacha adore les légumes et, avec ce livre, vous allez les adorer aussi !

Curry vert de haricots verts à la citronnelle, soupe de fenouil aux pois chiches, pâtes à la crème de courgette express, croquettes de potimarron au chèvre, quiche aux oignons et au chèvre frais, steak de chou-fleur et sauce au poivre, frites de patate douce sur crème de feta au tahini, tomates farcies au riz et aux herbes fraîches... Découvrez les obsessions végétales de Natacha en 75 recettes délicieuses autour de 19 légumes de tous les jours.

Pour chaque légume, vous trouverez plusieurs déclinaisons classiques ou plus originales pour plaire à tous les goûts et tous les palais. À vous de tester, modifier et vous approprier les recettes. Vous ne verrez plus jamais les légumes de la même façon.",978-2017259107,https://m.media-amazon.com/images/I/91ZxGqkQBXL._SY522_.jpg,Hachette Pratique; Illustrated édition (28 février 2024),Natacha Comar
"500 recettes antidiabète - édition 2023: De l’entrée au dessert, LES MEILLEURES RECETTES À FAIBLE INDEX GLYCÉMIQUE",19.89,"Muesli antifringales, Crème de brocolis aux noisettes, Taboulé de quinoa aux crevettes, Parmentier de volaille aux deux pommes, Moules au fenouil et à la tomate, Cookies aux flocons d'avoine et à la noix de coco, bentos, pizzas, plateaux-repas… de l'entrée au dessert, retrouvez dans cet ouvrage plus de 500 recettes variées, délicieuses, ultra-rapides… et antidiabète !
Avec ce livre :
Contrôlez votre glycémie.
Protégez votre coeur et votre cerveau.
Affinez votre silhouette.
Redécouvrez le bonheur de préparer des plats simples et savoureux.
Prenez plaisir à inviter des amis pour partager votre cuisine.",979-1028527440,https://m.media-amazon.com/images/I/717bCaypb5L._SY522_.jpg,LEDUC; 1er édition (29 août 2023),Dr Pierre Nys
Gourmandises IG Bas: Recettes plaisir pour des Goûters et Desserts IG Bas faciles,17.3,"Qui a dit que la cuisine IG bas interdisait le plaisir ? Avec nos recettes de desserts IG bas, régalez-vous avec de délicieux cookies et gourmandises à faible index glycémique, qui limiteront votre glycémie tout en enchantant vos papilles !

❌ Vous cherchez à garder la ligne, mais vous ne savez pas comment vous passer du sucre et vous faire plaisir malgré tout ?
❌ Vous pratiquez déjà le régime IG bas, et vous pensez ne plus pouvoir déguster un dessert digne de ce nom sans casser votre détox sucre ?

Dites enfin adieu à la frustration : avec « Gourmandises IG Bas », de délicieuses recettes sucrées et gourmandes vous attendent",979-8421839132,https://m.media-amazon.com/images/I/61YAdKmwd-L._SY522_.jpg,Independently published (23 février 2022),IGFacile
Carnet de liaison Nounou à remplir 300 jours de suivi: Cahier de transmission Assistante maternelle - Parents pour suivre son bébé ou son enfant pendant une année,16.81,"Cahier de liaison à remplir pour accompagner son bébé ou son enfant lors des jours de garde chez sa nounou.
Outil idéal pour faciliter les transmissions entre la Famille et l'Assistante Maternelle.
Points forts de ce Carnet à remplir:
Peut être commencé à n'importe quel moment de l'année
300 jours de Suivi soit 1 an de garde avec l'essentiel
(date & horaires, humeur du jour, activité(s),repas, biberons,siestes,changes)
Clair, facile à remplir et joliment illustré
Par une professionnelle de la Petite enfance dans le respect des familles et du secret médical
Autorisations préremplies (droit à l'image, transport en voiture destinations de transport autorisées)",979-8667336570,https://m.media-amazon.com/images/I/61srMc6giFL._SY522_.jpg,Independently published (18 juillet 2020),Dix ptits doigts
"L'assiette du sportif: Recettes équilibrées avant/pendant et après l'effort, Conseils nutritionnels pour être au top, Idéa",22.0,"Oubliez les préparations hyper-protéinées, les barres énergétiques industrielles, les tristes plats de pâtes avant l'effort ou les boissons de récupération trop chimiques. Voici enfin le livre de cuisine saine et gourmande spécialement adapté à tous types de sportifs, amateurs et aguerris.

Comment bien s'alimenter pour rester en forme et performant ?
Quelle est l'alimentation idéale du sportif ?
Que manger avant, pendant ou après l'effort ?
Quel programme alimentaire avant une compétition ?

Sport d'endurance, de combat, de glisse : musculation, cardio ou souplesse... Voici tous les conseils et recettes pour garder un vrai confort digestif et améliorer sa performance.",978-2011356246,https://m.media-amazon.com/images/I/81qVjUGH8KL._SY522_.jpg,Hachette Pratique; Illustrated édition (27 avril 2016),Coralie Ferreira
365 recettes pour bébé: De 4 mois à 3 ans,14.9,"La diversification alimentaire de votre bébé débute !
Mais quels repas lui préparer en fonction de son âge et de ses aptitudes ? Quels légumes, fruits, féculents introduire pour l’éveiller au goût et aux textures en toute confiance et bienveillance ?

365 recettes pour bébé conçu par Dr Christine Zalejski, la fondatrice de Cubes et Petits pois, vous propose 1 an de recettes classées :
-par âge de 4 à 36 mois pour tenir compte des besoins spécifiques de chaque bébé (quantité, type d’aliments, texture)
-par saison en fonction de ce que vous trouvez sur le marché pour proposer des aliments frais, lorsqu’ils ont la meilleure saveur et qu’ils sont au meilleur prix.

En complément des recettes :
-de multiples variantes sont proposées pour inspirer les parents désireux de cuisiner des petits plats ‘faits maison » et pour multiplier les idées de menus.
-des astuces pour gagner du temps en cuisine, pour un batchcooking au top
-des informations sur les qualités nutritionnels des aliments permettent de compléter l’ou

Une année de recettes simples, saines et équilibrées pour initier les tout-petits au goût des bonnes choses.

Ce livre a été conçu par",978-2035928429,https://m.media-amazon.com/images/I/81AUntg96nL._SY522_.jpg,Larousse; Illustrated édition (4 janvier 2017),Christine Zalejski
Mes recettes healthy #2: BAM ! 80 recettes fitfightforever pour te transformer,16.9,"Mincir grâce aux 80 nouvelles recettes de Thibault Geoffray, le coach sportif n°1 d’Instagram ! Des recettes toujours aussi simples, rapides et délicieuses et toutes les clés pour transformer sa silhouette tout en prenant soin de sa santé !
Toasts de patate douce et œuf poché, mini burgers thon courgette, bowl veggie quinoa, douceurs glacées au peanut butter ou smoothie purple… Le secret de ses recettes ? Ultra faciles, peu d’ingrédients (seulement les meilleurs) avec une place toujours essentielle donnée aux fruits et légumes !

Grâce à ce nouveau livre de Thibault Geoffray, commencez ou continuez votre prise en main tout en vous régalant sans jamais vous priver !",978-2501154550,https://m.media-amazon.com/images/I/71VpoLVAgOL._SY522_.jpg,Marabout; Illustrated édition (30 septembre 2020),Thibault Geoffray
"So Good: The instant #1 Sunday Times bestseller: Food you want to eat, designed by a nutritionist",29.02,"THE NUMBER 1 SUNDAY TIMES BESTSELLER

Delicious recipes. Nutritionally balanced. So Good.

When we think of nutrition and eating well, so many of us jump to the words 'diet', 'unenjoyable', and 'sacrifice'. Sometimes we see healthy eating as something we should do, rather than something we want to do.

This is the book to help you kickstart healthy eating as an enjoyable lifelong habit rather than a fad for a week. A perfect collection of over 80 vibrant, tasty and easy recipes all steeped in nutritional science, So Good explains the principles of healthy eating in a fun and relatable way.

With recipes including...

Fluffy Ricotta Lemon Pancakes
Hot Honey Halloumi Avocado Toast
Mango And Crunchy Chickpea Salad, With Jalapeno Dressing.
Chicken And Spicy Guacamole Lunch Time Tacos
Garlic Crumbed Salmon With Courgettes And Yoghurt
Creamy Parmesan Chickpeas With Pickled Chillies
Greek Yoghurt Roasted Strawberry Eton Mess

Food should be a celebration, a memory, a moment. It's not about counting calories; it's about making every meal count. Let every meal you make nourish your body and bring you joy with every bite.

Number 1 Sunday Times bestseller, May 2024",978-1399620055,https://m.media-amazon.com/images/I/71-rJ9rZ6jL._SY522_.jpg,Seven Dials (9 mai 2024),Emily English
Mon Agenda Minceur 365 Jours: Joli Cahier de Rééquilibrage Alimentaire et de Suivi de Régime Journalier et d’activités Sportives- Meilleure Idée De Cadeau Pour Femme,17.08,"Nous savons tous combien c’est frustrant d’avoir essayé un régime particulier afin de perdre du poids mais l’avoir abandonné rapidement du moment que les résultats obtenus ne se lèvent pas à nos attentes et à nos espérances.
Pour atteindre votre objectif d’un corps idéal vous devez savoir que la perte de poids ne se résume pas au suivi d’un régime alimentaire particulier mais elle consiste surtout sur le changement et l’amélioration de votre mode de vie en sa totalité.
Vous devez adopter une approche globale visant à améliorer plusieurs aspects de votre vie quotidienne : votre besoin en sommeil, nourriture, activités physiques, hydratation, suppression de mauvaises habitudes, motivations, spiritualité ……etc.",,https://m.media-amazon.com/images/I/61vFlhOjQ6L._SY522_.jpg,Independently published (27 mars 2023),Livres Sanitaires Editions
Anti-inflammatoire - Kitchen Thérapie: Conseils et recettes d'une naturopathe,18.9,"Découvrez 60 recettes et les multiples conseils de Julie Pradines, naturopathe, pour adopter l'alimentation anti-inflammatoire au quotidien
Gluten, sucres raffinés, lactose sont mal tolérés par votre corps et vous ne comprenez pas pourquoi ? Vous souffrez d'inconfort digestif, articulaire, d'endométriose, votre microbiote est sens dessus dessous et vous voulez retrouver un rapport apaisé à votre alimentation ?
Décryptez 60 recettes qui vous feront reprendre le contrôle et retrouver le plaisir de manger, grâce aux précieux conseils de Julie Pradines, naturopathe.
Comprendre l'inflammation et son impact sur la santé
Les gestes à adopter pour réduire l'inflammation
Des focus sur les aliments anti inflammatoires : curcuma, oeuf, vitamine C, gingembre, zinc...
Des zooms sur les aliments inflammatoires : gluten, lactose, sucres raffinés
60 recettes anti inflammatoires, simples et goûteuses pour reprendre votre quotidien en main",978-2263187469,https://m.media-amazon.com/images/I/61XQpI3sHkL._SY522_.jpg,Solar; Illustrated édition (7 mai 2024),Julie Pradines
Objectif minceur,6.95,"Des recettes lues en un coup d'oeil, réalisées en un tour de main !

1/ 2 à 6 ingrédients max
2/ Une recette courte, claire et précise
3/ Une belle photo explicite
4/ Temps de préparation réduit.

Super bon, Super rapide, Sans vaisselle (ou presque)",978-2017089452,https://m.media-amazon.com/images/I/71oRnUi3l7L._SY522_.jpg,Hachette Pratique; Illustrated édition (29 janvier 2020),Jean-François Mallet
"Plus de 100 idées de recettes sans gluten et sans lactose: bonnes, simples, testées et approuvées",9.71,"Vous souhaitez évoluer vers une meilleure alimentation, en adoptant un régime sans gluten et/ou sans lactose ?
ou
Vous êtes ou vous avez un(e) de vos proches qui se trouve dans le cas de figure suivant ?
intolérant(e) au gluten et/ou au lactose,
présentant le syndrome de l’intestin irritable
allergique au blé et/ou aux protéines de lait
atteint(e) d’une maladie inflammatoire de l’intestin (maladie cœliaque ou maladie de Crohn),
adepte d’un régime pauvre en FODMAPs
Vous êtes sur la bonne voie, ce livre est là pour vous aider. Il comprend :
Plus de 100 idées de recettes sans gluten et sans lactose, avec illustration",979-8860626904,https://m.media-amazon.com/images/I/61P2v25PohL._SY522_.jpg,Independently published (8 septembre 2023),Eatzee
Les recettes cultes de Big Will,19.9,"Envie d'atteindre vos objectifs sportifs en vous faisant plaisir et en prenant soin de votre santé ? Big Will est là ! Grâce à ses 150 recettes diet mais ultragourmandes, accompagnées d'astuces et de conseils, la nutrition n'aura plus de secret pour vous...
Big Will vous propose 150 recettes gourmandes allégées en gras et en calories. Parfaites pour les sportifs, ces recettes sont en version "" masse "" pour prendre du muscle ou en version
"" sèche "" pour perdre du gras.

Au menu des en-cas salés tels le ""breakfast wrap"" ou les frites au cheddar, des plaisirs sucrés comme le pain perdu ou le carrot cake... avec des grands classiques inspirés de la cuisine industrielle en version maison, plus saine, mais aussi des préparations super complètes, super gourmandes mais super diet.

Toutes les recettes sont accompagnées de conseils et d'infos nutrition pour comprendre qu'il n'est pas nécessaire de manger des choses fades pour atteindre ses objectifs.",978-2263161278,https://m.media-amazon.com/images/I/41NjjdPVjBL.jpg,Solar; Illustrated édition (3 octobre 2019),Willy Trussardi
"Miam-ô-5, Miam-ô-fruit: 80 recettes dynamisantes, faciles et pas chères",15.9,"Voici une manière révolutionnaire de présenter des recettes qui nous font du bien. Jusque-là, nous parlions de vitamines, sels minéraux ou gluten. Grâce aux travaux récents sur l'alimentation, nous découvrons que les Miam-Ô-Fruit et Miam-Ô-5, recettes phares de la Méthode France Guillain, traditionnelles et universelles, activent et soutiennent en permanence nos 5 systèmes de défense naturels, à savoir l'angiogenèse, la régénération cellulaire, le microbiome, la protection de l'ADN, et l'immunité ! Chacun de ces repas contient tous les éléments nécessaires et indispensables aux 5 systèmes. Nous tenons là une manière de nous régaler tout en nous maintenant en pleine forme, sans nous «prendre la tête ».Ce sont les recettes de deux navigatrices à la voile et au long cours autour du monde, recettes simples, friandes et vite faites.France Guillain apporte les explications concernant la qualité des repas, Aïmata Guillain les recettes de tous les jours, sans oublier les jours de fête. Une manière de réjouir ses papilles tout en se faisant le plus grand bien !",978-2268105253,https://m.media-amazon.com/images/I/81hy8JFbMuL._SY522_.jpg,Editions du Rocher; Illustrated édition (14 avril 2021),France Guillain
