Nom,Prix,Description,Isbn,Photo,Editeur,Auteur
Anxiété - Livre de coloriage pour adultes et adolescents pour réduire stress et pensées anxiogènes,16.04,"Tu te sens stressée et anxieuse ces derniers temps ? Tu cherches à te relaxer et te détendre ? Alors tu vas adorer ces citations inspirantes qui vont t’aider à évacuer toute cette pression que tu te mets sur les épaules, à reprendre confiance en toi et à calmer ton anxiété. Le coloriage est une activité formidable pour se détendre et se soulager du stress. Alors attrape ce livre de coloriage pour les grands, prends tes crayons de couleur et tes feutres préférés et lance-toi !",978-1646086993,https://m.media-amazon.com/images/I/71p17uVB9NL._SY522_.jpg,Cloud Forest Press (12 août 2021),June & Lucy
LA PENSÉE POSITIVE: Comment atteindre vos objectifs et mener une vie positive à travers le pouvoir de la pensée,9.99,"Changez votre vie et commencez à penser positivement!
Savez-vous que la pensée positive fonctionne mais que vous ne savez pas comment la mettre en pratique?
Vous vous sentez triste? Découragé? Tout le monde vous semble heureux?

Tout semble aller mal et la malchance vous suit?

Apprenez l'art de la pensée positive. Apprenez des stratégies, et changez totalement votre vie en lui donnant une toute nouvelle empreinte! Enfin, vous saurez comment utiliser la pensée positive et quels sont ses avantages! Vous allez découvrir un nouveau monde! Dans chaque situation, vous serez en mesure de garder la sérénité, d'affronter les choses de la bonne façon, d'analyser et de faire les meilleurs coups. Grâce à quelques conseils simples, la pensée positive améliorera votre estime de soi, votre santé et vous portera chance!

Dans ce manuel utile, vous apprendrez...",979-8621428907,https://m.media-amazon.com/images/I/61vPdMfXVCL._SY522_.jpg,Independently published (4 mars 2020),Marcello Borelli
LA PENSÉE POSITIVE: Comment atteindre vos objectifs et mener une vie positive à travers le pouvoir de la pensée,9.99,"Changez votre vie et commencez à penser positivement!
Savez-vous que la pensée positive fonctionne mais que vous ne savez pas comment la mettre en pratique?
Vous vous sentez triste? Découragé? Tout le monde vous semble heureux?

Tout semble aller mal et la malchance vous suit?

Apprenez l'art de la pensée positive. Apprenez des stratégies, et changez totalement votre vie en lui donnant une toute nouvelle empreinte! Enfin, vous saurez comment utiliser la pensée positive et quels sont ses avantages! Vous allez découvrir un nouveau monde! Dans chaque situation, vous serez en mesure de garder la sérénité, d'affronter les choses de la bonne façon, d'analyser et de faire les meilleurs coups. Grâce à quelques conseils simples, la pensée positive améliorera votre estime de soi, votre santé et vous portera chance!

Dans ce manuel utile, vous apprendrez...",979-8621428907,https://m.media-amazon.com/images/I/61vPdMfXVCL._SY522_.jpg,Independently published (4 mars 2020),Marcello Borelli
"L'essentiel, et rien d'autre",19.9,"L'art du minimalisme pour retrouver sa liberté d'être
Best-seller international sur le minimalisme à la japonaise, vendu à + de 250,000 ex. au Japon.",978-2813215659,https://m.media-amazon.com/images/I/51x0ARcsakL._SY522_.jpg,Les éditions Trédaniel; Illustrated édition (27 octobre 2017),Fumio Sasaki
"Why Has Nobody Told Me This Before?: The Sunday Times bestseller, with over 1 million copies sold",13.59,"Give your mind the one thing it needs in 2024 with the book everyone is STILL talking about, from clinical psychologist and TikTok sensation Dr Julie Smith

'A brilliant book' Steven Bartlett, Diary of a CEO podcast

'Full of sound, helpful advice with life skills, from building confidence to managing stress' Sunday Times

AS FEATURED IN THE OBSERVER, STYLIST, EVENING STANDARD, WOMEN'S HEALTH, MARIE CLAIRE AND GRAZIA
________

Drawing on years of experience as a clinical psychologist, online sensation Dr Julie Smith shares all the skills you need to get through life's ups and downs.

Filled with secrets from a therapist's toolkit, this is a must-have handbook for optimising your mental health. Dr Julie's simple but expert advice and powerful coping techniques will help you stay resilient no matter what life throws your way.

Written in short, bite-sized entries, you can turn straight to the section you need depending on the challenge you're facing - and immediately find the appropriate tools to help with . . .

- Managing anxiety
- Dealing with criticism
- Battling low mood
- Building self-confidence
- Finding motivation
- Learning to forgive yourself",978-0241529713,https://m.media-amazon.com/images/I/61vdz+IbbKL._SY522_.jpg,Michael Joseph; 1er édition (6 janvier 2022),Julie Smith
Comment dominer le stress et les soucis,13.0,Comment dominer le stress et les soucis,978-2080687104,https://m.media-amazon.com/images/I/71TSz+hflLL._SY522_.jpg,FLAMMARION (30 mars 2005),Dale Carnegie
"Lamaste - Journal de Gratitude pour enfants: Carnet pour cultiver le bonheur, développer la confiance en soi et la pensée positive en 5 minutes par jour",16.27,"Vous aimeriez que votre enfant prenne davantage conscience de tous les « petits bonheurs » du quotidien?

Aidez votre enfant à devenir le jardinier de son propre bonheur en commençant à semer les graines de la gratitude avec ce journal destiné aux plus jeunes !
Ce Journal a été spécialement conçu pour aider les enfants (garçon ou fille, de 5 à 12 ans) à adopter cette habitude saine dès le plus jeune âge.",979-8686582903,https://m.media-amazon.com/images/I/61BLAHWx6nL._SY522_.jpg,Independently published (15 septembre 2020),Erika Rossi
Détox de dopamine: Guide pratique pour éliminer les distractions et accomplir vos tâches clés,13.45,"Retrouvez votre concentration en 48 heures voire moins.
Procrastinez-vous continuellement ? Vous sentez-vous agité et incapable de vous
concentrer sur votre travail ? Avez-vous du mal à vous motiver pour des objectifs
importants ?

Si oui, vous pourriez avoir besoin d’une détoxification de dopamine.

Dans le monde actuel, où les distractions sont omniprésentes, notre capacité de
concentration se raréfie. Nous sommes constamment stimulés, agités, sans savoir
pourquoi.

Quand vient le temps de travailler, nous trouvons souvent pléthore d’autres choses à faire.
Au lieu de travailler pour atteindre nos objectifs, nous sortons faire un tour, nous prenons
un café ou nous consultons nos courriels. Tout semble être une excellente idée ; tout sauf
ce que nous devrions faire.

Vous reconnaissez-vous dans la situation ci-dessus ?

Si oui, ne vous inquiétez pas. Vous êtes tout simplement trop stimulé.
Dopamine Detox vous aidera à réduire un excès de stimulation et à retrouver votre
concentration en 48 heures voire moins afin que vous puissiez vous consacrer à vos
tâches clés.

Plus précisément, dans ce livre, vous découvrirez :",979-8878194594,https://m.media-amazon.com/images/I/61mWA0pYTsL._SY522_.jpg,Independently published (9 février 2024),Thibaut Meurisse
TENNIS: Vous êtes bien meilleurs que vous ne le croyez !,17.04,"Il y a des années, en écrivant – Pensez comme un champion - (Amphora), j’ai cherché à répondre à cette question : comment penser pour être performant sur un court de tennis ?
Je ne renie rien de cet ouvrage, et demeure convaincu que quiconque en applique les enseignements devient vite un bon compétiteur. Cependant, il faut aussi comprendre pourquoi le tennis s’avère être un jeu compliqué pour une majorité de joueurs.
Ce livre est pour eux :
Pourquoi certains deviennent-ils des champions, alors qu’avec deux bras, deux jambes, et la même neurologie, rien ne les distingue, fondamentalement, de l’ensemble de la population ? Et pourquoi est-ce si ardu pour d’autres ?
Où est la différence ? S’agit-il juste de temps de travail et de talent ?

La réponse se trouve entre nos deux oreilles. Chaque joueur a dans la tête des croyances à propos de lui-même et du tennis, un jeu intérieur qui détermine le niveau qu’il va atteindre.
le jeu intérieur des champions favorise l’apprentissage et la performance. Celui des joueurs amateurs est le plus souvent limitant.",979-8878197854,https://m.media-amazon.com/images/I/61KFYiDJG-L._SY522_.jpg,Independently published (1 février 2024),Jean-Philippe Vaillant
LA PENSÉE POSITIVE: Comment atteindre vos objectifs et mener une vie positive à travers le pouvoir de la pensée,9.99,"Changez votre vie et commencez à penser positivement!
Savez-vous que la pensée positive fonctionne mais que vous ne savez pas comment la mettre en pratique?
Vous vous sentez triste? Découragé? Tout le monde vous semble heureux?

Tout semble aller mal et la malchance vous suit?

Apprenez l'art de la pensée positive. Apprenez des stratégies, et changez totalement votre vie en lui donnant une toute nouvelle empreinte! Enfin, vous saurez comment utiliser la pensée positive et quels sont ses avantages! Vous allez découvrir un nouveau monde! Dans chaque situation, vous serez en mesure de garder la sérénité, d'affronter les choses de la bonne façon, d'analyser et de faire les meilleurs coups. Grâce à quelques conseils simples, la pensée positive améliorera votre estime de soi, votre santé et vous portera chance!

Dans ce manuel utile, vous apprendrez...",979-8621428907,https://m.media-amazon.com/images/I/61vPdMfXVCL._SY522_.jpg,Independently published (4 mars 2020),Marcello Borelli
LA PENSÉE POSITIVE: Comment atteindre vos objectifs et mener une vie positive à travers le pouvoir de la pensée,9.99,"Changez votre vie et commencez à penser positivement!
Savez-vous que la pensée positive fonctionne mais que vous ne savez pas comment la mettre en pratique?
Vous vous sentez triste? Découragé? Tout le monde vous semble heureux?

Tout semble aller mal et la malchance vous suit?

Apprenez l'art de la pensée positive. Apprenez des stratégies, et changez totalement votre vie en lui donnant une toute nouvelle empreinte! Enfin, vous saurez comment utiliser la pensée positive et quels sont ses avantages! Vous allez découvrir un nouveau monde! Dans chaque situation, vous serez en mesure de garder la sérénité, d'affronter les choses de la bonne façon, d'analyser et de faire les meilleurs coups. Grâce à quelques conseils simples, la pensée positive améliorera votre estime de soi, votre santé et vous portera chance!

Dans ce manuel utile, vous apprendrez...",979-8621428907,https://m.media-amazon.com/images/I/61vPdMfXVCL._SY522_.jpg,Independently published (4 mars 2020),Marcello Borelli
