Nom,Prix,Description,Isbn,Photo,Editeur,Auteur,Categorie
Le Guide de l&#39homéopathie: Nouvelle édition,31.0,"Un guide complet pour prendre soin de sa santé, avec les 138 principaux médicaments homéopathiques de la pharmacie familiale, leur composition, les principales indications et la posologie. Médecin homéopathe et acupuncteur, Bernard Chemouny exerce en région parisienne. Il est l&#39auteur du Dictionnaire de l&#39homéopathie et du Guide de l&#39homéopathie pour l&#39enfant, aux Éditions Odile Jacob.",978-2738122124,https://m.media-amazon.com/images/I/41NtV4-J2QL.jpg,Odile Jacob; Revised édition (16 octobre 2008),Bernard Chemouny,Homéopathie
Le dictionnaire Médisite de l&#39homéopathie,5.7,"Un guide pratico pratique pour soi et les autres, la famille. Dans une automédication raisonnable, un guide pour traiter par soi même des problèmes de santé simples et un dictionnaire des médicaments pour mieux comprendre ces petits tubes ronds parfois mystérieux.
Un guide pratico pratique pour soi et les autres, la famille. Dans une automédication raisonnable, un guide pour traiter par soi même des problèmes de santé simples et un dictionnaire des médicaments pour mieux comprendre ces petits tubes ronds parfois mystérieux. Avec une introduction qui résume l&#39historique et les grands principes de cette médecine qui repose sur la similitude et sur les dilutions, un guide par maladie de acné à zona et un dictionnaire des médicaments de aconit à zincum. Le guide ne remplace pas le médecin, mais rend responsable de sa santé et de son bien être par l&#39utilisation facile de médicaments totalement dépourvus d&#39effets indésirables et totalement sûrs. Le dictionnaire permet de préciser, de comprendre l&#39action de chaque médicament, et lorsqu&#39on sort de chez son homéopathe, de décrypter l&#39ordonnance qu&#39il nous a délivré. Dans un style direct mais précis qui tire le lecteur vers l&#39expertise en homéopathie, une vraie façon de devenir un patient éclairé coté granules.",979-1097380038,https://m.media-amazon.com/images/I/61van4BaTjL._SY522_.jpg,Medisite; Illustrated édition (5 septembre 2019),Daniel Scimeca,Homéopathie
Pédiatrie,14.11,"Nous avons conçu «Les dossiers de l&#39expert» pour apporter des solutions adaptées aux professionnels de santé : pharmaciens et équipes officinales, médecins généralistes, spécialistes. Du nouveau-né à l&#39adolescent, l&#39enfant est bien souvent celui par qui l&#39homéopathie entre dans la famille. Pouvoir conseiller ou prescrire un traitement adapté en homéopathie constitue un réel atout pour les professionnels de santé. - Quelles pathologies pour quels médicaments homéopathiques ? - Quels médicaments homéopathiques pour quels symptômes ? - Quels traitements homéopathiques pour quelle symptomatologie ? Chaque pathologie est accompagnée d&#39un rappel de physiologie et d&#39un arbre décisionnel qui vous guideront des symptômes à la prescription. De nombreux cas cliniques viennent également illustrer nos propositions.",979-1090018594,https://m.media-amazon.com/images/I/51ItIXmt+oL._SY522_.jpg,Le Moniteur des pharmacies (2 avril 2015),Michèle Boiron,Homéopathie
,13.55,,,,,,Homéopathie
Homéopathie et Loi d&#39analogie - Essai sur les essences autoguérisseuses,7.4,"Le Postulat des Authentiques tente de réconcilier tous ceux qui, au service d&#39un même Art, s&#39affrontent quotidiennement sur les lois qui le régissent. Médecine des Contraires ou allopathie, et Médecine des Semblables ou homéopathie, s&#39appuient en fait sur un même mécanisme d&#39autorégulation induit par des Essences ancestrales produites par le cerveau reptilien. Imprégné des connaissances actuelles sur la physiologie et la biochimie humaines, et anticipant sur les découvertes à venir en matière de physique quantique et d&#39épigénétique, l&#39auteur, riche de son expérience clinique, revisite non seulement la médecine moderne mais aussi celle d&#39Hahnemann, l&#39inventeur de l&#39homéopathie en 1796. En filigrane du Postulat des Authentiques se profile ce que l&#39auteur a appelé la Palette des Couleurs. Cette doctrine proche de celle des Signatures de Paracelse (selon laquelle la forme et l&#39aspect des plantes est à rapprocher de leurs propriétés thérapeutiques) est ici abordée sans a priori ni tabou.",978-2733913529,https://m.media-amazon.com/images/I/41bVeOdt5qL._SY522_.jpg,GRANCHER (3 novembre 2015),Baudouin Caironi,Homéopathie
Homéopathie : Petits remèdes retrouvés,19.02,"Le docteur Barbier reste encore dans les mémoires un des pères de l&#39homéopathie en France. Tous ceux qui ont eu la chance d&#39entendre ses cours se souviennent de ses présentations lumineuses et pleine d&#39humour, comme ce livre. Il permet à la lecture de retenir de façon indélébile des notions parfois arides. Broché 16 x 24 - 270 pages",978-2872110872,https://m.media-amazon.com/images/I/51naW0vCIkL._SY522_.jpg,Marco Pietteur (15 janvier 2003),Dr Pierre Barbier,Homéopathie
Homéopathie familiale: Guide pratique et ses 40 cartes détachables,19.66,"Vous voulez prévenir ou soulager traumatismes, brûlures, infections, fièvre, migraines, douleurs diverses grâce à l&#39homéopathie ? Vous souhaitez éviter d&#39avoir systématiquement recours à l&#39allopathie pour guérir les maux quotidiens de votre famille ? Alors ce livre est fait pour vous ! br/ br/ Le docteur François Choffat propose ici de comprendre l&#39homéopathie par l&#39expérimentation : son guide prend la forme d&#39un jeu d&#39observation des symptômes du malade menant au choix de la juste carte-remède. Il offre des solutions simples et efficaces aux multiples petits problèmes de la vie courante, en limitant le nombre de remèdes homéopathiques aux plus fréquents. br/ br/ Découvrez avec curiosité les outils à votre portée, ayez confiance, lancez-vous et soignez-vous, vous et votre entourage, avec l&#39aide de ce guide pratique aux multiples conseils et illustré d&#39images reflétant l&#39aspect essentiel de chaque remède. br/ br/ br/ En bonus : un cahier détachable de 40 cartes à utiliser sous forme de jeu pour mieux retenir les différents remèdes. Glissez-les dans votre trousse d&#39homéopathie !",978-2889530984,https://m.media-amazon.com/images/I/41v5EZW9qZL.jpg,JOUVENCE; Illustrated édition (13 novembre 2018),François Choffat,Homéopathie
Homéopathie et physique quantique,17.0,"Leurs liens et leurs fondements communs
Depuis toujours, l&#39homéopathie s&#39exerce avec des remèdes de nature immatérielle et si elle reste peu expliquée, elle démontre son indéniable efficacité par ses succès thérapeutiques. Depuis peu, la physique quantique oriente le scientifique vers un plan i",978-2853274913,https://m.media-amazon.com/images/I/617DEd7-StL._SY522_.jpg,Medicis (28 novembre 2014),Kaici Moulay,Homéopathie
Thérapeutique homéopathique T.1,14.24,"Cet ouvrage est un véritable recueil d’ordonnances types pour plus de 800 maladies, étant bien entendu que chacune de ces ordonnances devra être adaptée à chaque malade et modifiée selon chaque cas, en vertu du vieil adage : « Il n’y a pas des maladies mais des malades. » Vous y trouverez, pour chaque affection une ou plusieurs ordonnances homéopathiques complètes, avec tous les dosages, ainsi que d’autres prescriptions à base de gemmothérapie, d’organothérapie et d’oligo-éléments. Broché 15 x 21 - 368 pages",978-2703302988,https://m.media-amazon.com/images/I/81jYWGf74EL._SY522_.jpg,Dangles (21 décembre 1999),Claude Binet,Homéopathie
