Nom,Prix,Description,Isbn,Photo,Editeur,Auteur,Categorie
Color Grading 101,15.28,"Written both for students and working professionals, this book walks readers step-by-step through the foundations of color grading for projects of any size, from music videos and commercials to full-length features.
In this clear, practical, and software-agnostic guide, author Charles Haine introduces readers to the technical and artistic side of color grading and color correction. Color Grading 101 balances technical chapters like color-matching, mastering, and compression with artistic chapters like contrast/affinity, aesthetic trends, and building a color plan. The book also includes more business-focused chapters detailing best practices and expert advice on working with clients, managing a team, working with VFX, and building a business. An accompanying eResource offers downloadable footage and project files to help readers work through the exercises and examples in the book.",978-0367140052,https://m.media-amazon.com/images/I/7106BGzxZvL._SY522_.jpg,Routledge (21 octobre 2019),Charles Haine,Radio
The art of batman,15.5,"The Art of Batman est le livre officiel illustré sur les coulisses du film très attendu « The Batman » de Matt Reeves (Cloverfield, Dawn of the Planet of the Apes, War for the Planet of the Apes), qui sortira en salles le 4 mars 2022. Après avoir passé deux ans à arpenter les rues en tant que Batman, semant la terreur dans le cœur des criminels, Bruce Wayne s&#39est enfoncé dans l&#39ombre de Gotham City. Alors que les preuves entourant une série de crimes commencent à se rapprocher de la maison et que l&#39ampleur des plans de l&#39auteur devient claire, Batman doit forger de nouvelles relations, démasquer le coupable et rendre justice à l&#39abus de pouvoir et à la corruption qui sévissent depuis longtemps à Gotham City. Les lecteurs pourront découvrir de l&#39intérieur le processus de conception et de production de The Batman, avec notamment des interviews perspicaces de l&#39équipe de tournage et des acteurs ; des peintures conceptuelles et des photos de plateau inédites explorant cette nouvelle version de Gotham City ; des comparaisons plan par plan entre le film et les story-boards ; et un examen plus approfondi de la conception des costumes, des véhicules, des gadgets, des énigmes, etc. James Field travaille dans l&#39industrie cinématographique depuis 2006. Lauréat international du Nickelodeon Writing Program 2016/17, Field a depuis partagé son temps entre le marketing et l&#39écriture pour le cinéma, la télévision et l&#39audio. Il a travaillé comme agent de liaison de production pour The Batman et The Flash. Il vit au Royaume-Uni avec sa compagne et ses enfants.",978-1419762109,https://m.media-amazon.com/images/I/51gwAMElvzL._SY522_.jpg,Abrams; 1er édition (28 avril 2022),Field James,Radio
Cinematography: Theory and Practice For Cinematographers and Directors,17.36,"This book covers both the artistry and craftsmanship of cinematography and visual storytelling. Few art forms are as tied to their tools and technology as is cinematography. Take your mastery of these new tools, techniques, and roles to the next level with this cutting-edge roadmap from author and filmmaker Blain Brown.
This 4th edition has been thoroughly updated throughout to include detailed information on the latest lighting and camera equipment, as well as expanded and updated discussion on the following areas: shooting on a budget, color spaces with emphasis on the new UHD standards, the decision-making process in choosing what lights and equipment to use, considerations concerning power issues, safety and what electrical supply is needed for various types of lights, an examination of the cinematographer&#39s role in preproduction, and much more.",978-0367373450,https://m.media-amazon.com/images/I/81c3FhzbfjL._SY522_.jpg,Routledge; 4e édition (28 septembre 2021),Blain Brown,Radio
L&#39Arme la plus meurtrière: Affaire Matzneff : le silence imposé,12.67,"L’Affaire Matzneff, énorme scandale il y a quelques mois encore, a finalement accouché de… rien. Le procès qui devait s’ouvrir le 28 septembre 2021, n’aura pas lieu (le tribunal correctionnel de Paris a invalidé la citation pour apologie de la pédocriminalité) et son annulation, suite à l’erreur de procédure commise par un avocat, n’a suscité aucun commentaire. Quant à l’enquête pour viols sur mineurs, ouverte elle aussi en janvier 2020, rien n’indique qu’elle pourrait aboutir.

J’ai choisi cette date du 28 septembre, celle d’un procès annulé, pour publier L’arme la plus meurtrière, un récit longtemps étouffé, et qui aura eu bien du mal à voir le jour.

Dès 2004 j’ai tenté de corriger l’image élogieuse que donnaient de Gabriel Matzneff les médias, mais on m’a empêchée de publier mon livre alors intitulé Le crocodile.

L’arme la plus meurtrière est le dernier état de ce travail. J’y dresse le portrait de l’homme privé, mais aussi celui du personnage public. Au-delà du témoignage personnel, je fais revivre un homme, un milieu, des pratiques, sans rien dissimuler des connivences et des pistons qui lui ont permis d’exister, et de durer.",979-1069977938,https://m.media-amazon.com/images/I/61oMRG2IAbL._SY522_.jpg,La bocca della verita (28 septembre 2021),Francesca Gee,Radio
