Nom,Prix,Description,Isbn,Photo,Editeur,Auteur
Revolution anti-technologie: Pourquoi et comment,19.0,"La société dans laquelle nous vivons semble de plus en plus hors de contrôle. Mais il ne s'agit pas d'une simple impression, nous explique Theodore Kaczynski, histoire et sciences dures à l'appui. En effet, plus un système se complexifie, plus son instabilité augmente. Toute gestion rationnelle de son développement devient alors impossible?, de même qu'en matière de prédictions économiques ou météorologiques, dès que l'on dépasse le très court terme, «?l'échec est la norme?». D'où l'importance de mettre fin au développement technologique qui ravage actuellement les systèmes sociaux et biologiques mondiaux et menace de détruire l'essentiel de la vie sur Terre. Au travers d'un examen des organisations révolutionnaires du passé permettant d'identifier les erreurs à éviter, Kaczynski formule les règles objectives et les principes organisationnels que devrait suivre tout mouvement souhaitant sérieusement endiguer la catastrophe sociale et écologique en cours.",978-2490403288,https://m.media-amazon.com/images/I/61FzQ-q48+L._SY522_.jpg,Editions Libre (24 septembre 2021),Theodore Kaczynski
L' Effondrement du Systeme Technologique: Unabomber l'Œuvre Complete,11.22,"Theodore John Kaczynski, alias Unabomber, est le prisonnier le plus célèbre des États-Unis. Pour faire publier son manifeste, La société industrielle et son avenir, il n'hésita pas à commettre des attentats meurtriers. Emprisonné à vie, Kaczynski a poursuivi son travail intellectuel au travers d'essais ainsi que d'une abondante correspondance. Il s'attache dans ses écrits à saper les fondements d'une société suicidaire, qu'il juge incapable de se réformer. Seule la révolution, soutient-il, pourra mettre fin à notre course à l'abîme programmée. Derrière des actions extrêmes et condamnables, Kaczynski affiche une pensée rationnelle et une érudition impressionnante. Il se réfère à des classiques de la critique de la modernité tels que George Orwell, Ivan Illich ou Jacques Ellul. Si sa pensée inspire des groupes anarchistes ou des mouvements altermondialistes radicaux, elle constitue aussi une mise en garde précoce contre la dérive consumériste industrielle. Ses vues sur le "" progrès "", jadis si marginales qu'il dut les imposer à l'explosif, font aujourd'hui presque partie de l'"" écologiquement correct "". Ce livre rassemble ses principaux essais, la plupart inédits, un entretien très personnel ainsi que ses lettres les plus importantes. Il ne s'agit pas d'un programme terroriste mais d'un ouvrage qui touche à l'anthropologie, à la philosophie et à la sociologie. Sa lecture est indispensable à quiconque réfléchit sur l'évolution des sociétés humaines et aux enjeux du développement technologique.",978-2888921233,https://m.media-amazon.com/images/I/51WuYK7XaUL._SY522_.jpg,Xenia Éditions; 1er édition (18 mai 2011),Theodore Kaczynski
Prouver et gouverner: Une analyse politique des statistiques publiques,14.31,"Aujourd’hui, les statistiques sont partout. Chacun ressent confusément que, certes, elles fournissent des données utiles sur la société, mais qu’elles servent aussi d’instruments de pouvoir. Dans ces conditions, comment respecter les informations qu’elles apportent et en même temps les envisager comme politiques ? C’est à cette question clé que ce livre entend répondre, en proposant une méthode permettant de bien comprendre l’ambivalence inhérente aux données quantitatives. En douze scènes historiques concernant le gouvernement néolibéral, les institutions internationales ou les rapports entre quantification et sciences sociales, le lecteur apprendra ainsi à faire le tri dans le déferlement quotidien de chiffres. Alain Desrosières est prématurément décédé alors qu’il mettait la dernière main, avec l’aide d’Emmanuel Didier, à la rédaction de ce livre, qui devrait faire date, au même titre que La Politique des grands nombres (La Découverte, 1993), devenu un classique et traduit dans le monde entier. Il avait successivement travaillé avec Pierre Bourdieu puis avec la ronde des pragmatistes français, soit deux des environnements les plus innovants intellectuellement en France depuis les années 1980. Il est le fondateur de la sociohistoire de la statistique, une discipline à la croisée de la sociologie, de la science politique, de l’histoire, de l’économie et des statistiques elles-mêmes, qui se développe aujourd’hui très rapidement, en France comme à l’étranger. Ce livre très accessible et d’une grande portée politique peut être considéré comme son testament intellectuel.",978-2707178954,https://m.media-amazon.com/images/I/71sFdUMfAIL._SY522_.jpg,La Découverte (3 avril 2014),Alain Desrosières
"Richesse, énergie et valeurs humaines",7.15,"Richesse, énergie et valeurs humaines",978-2823119985,https://m.media-amazon.com/images/I/8103dWp1LHL._SY522_.jpg,Persée (21 juin 2017),Jean-Paul Devos
L'Illusion identitaire,7.39,"Dans le contexte du néolibéralisme, et sous la pression idéologique de l’extrême-droite, l’identité s’est imposée comme l’horizon indépassable des démocraties. Il en résulte une sourde angoisse : le marché, la globalisation, l’immigration menaceraient notre identité, notre culture. Or, cet essai mordant démontre que l’une et l’autre sont des illusions. Il n’est que des actes d’identification, politiquement construits, historiquement situés, socialement contradictoires, culturellement polémiques. La culture n’a jamais rien expliqué : elle n’est pas la cause de l’action des hommes, mais son effet. Elle n’est pas une donnée, mais une production permanente.
Les conflits dits identitaires déchirent les cultures plutôt qu’ils ne les opposent les unes aux autres. Comment penser les raisons culturelles du politique sans être ni culturaliste ni identitariste ? Une contribution majeure à la réflexion sur le sujet.


Jean-François Bayart, spécialiste de sociologie historique du politique, est titulaire de la chaire Yves Oltramare « Religion et politique dans le monde contemporain », à l’IHEID de Genève.",978-2818505649,https://m.media-amazon.com/images/I/71IGCEJuLtL._SY522_.jpg,Fayard/Pluriel (30 mai 2018),Jean-François Bayart
Guide de sociologie politique,24.5,"Cet ouvrage doit son nom de Guide au fait qu’il renseigne le lecteur, à travers ses neuf cents entrées, sur les chercheurs, leurs objets et leurs travaux, les institutions et les revues qui structurent la discipline, ou encore les concepts et les techniques utilisés et le rapport aux disciplines voisines. Il ne s’agit donc pas d’un manuel.
C’est un ouvrage francophone, mais qui réserve une large place aux chercheurs étrangers et aux travaux publiés en d’autres langues que le français.
C’est un ouvrage de science politique, mais qui rend compte des apports considérables des disciplines voisines à la connaissance scientifique du politique.
Sans être un dictionnaire, il porte un intérêt particulier aux enjeux de définition et de dénomination.
Destiné notamment aux étudiants de premier cycle en science politique, cet ouvrage sera également utile aux étudiants plus avancés, mais aussi à ceux d’autres disciplines, ou encore aux lycéens en fin d’études secondaires. Au-delà des publics universitaire et scolaire, ce Guide de sociologie politique pourra intéresser tout citoyen désirant en savoir un peu plus sur une discipline scientifique qui ne peut pas être réduite à la publication de résultats d’enquêtes sur les intentions de vote ou la popularité des politiciens.",978-2340009240,https://m.media-amazon.com/images/I/41Ogkd-ErVL._SY522_.jpg,ELLIPSES (9 février 2016),Paul Bacot
Psychopolitique: Le néolibéralisme et les nouvelles techniques de pouvoir,15.0,"Après son best-seller La société de la fatigue, le philosophe berlinois Byung-Chul Han poursuit avec ferveur sa critique du néolibéralisme. Il explique de manière pertinente la technique de domination et de pouvoir du régime néolibéral qui, contrairement à la biopolitique de Foucault, considère la psyché comme une force productive. Han décrit sous toutes ses facettes cette psychopolitique néolibérale qui nous mène à une crise de la liberté.",978-2842424206,https://m.media-amazon.com/images/I/51sJJUyeLjL._SY522_.jpg,Circé (20 octobre 2016),Byung-Chul Han
Les Métamorphoses de la cité,12.0,"Pour Pierre Manent, la cité est la source du développement occidental. Avant cette invention, les hommes vivaient selon l'ordre relativement immobile des familles, encore prégnant dans bien des régions du monde. Avec la cité, l'humanité s'engage dans ce nouvel élément qu'est le politique entendu comme gouvernement de la chose commune. L'histoire de l'Occident devient alors celle de ses quatre grandes formes politiques : la cité, puis l'empire, l'Eglise et la nation. Chaque nouvelle forme résulte de la précédente qui, parvenant au bout de ses possibilités, suscite la nouvelle. Mais la nation à son tour s'est détruite, dans les guerres ""hyperboliques"" du XXe siècle, et nous sommes aujourd'hui à la recherche d'une nouvelle forme politique et d'une réponse à l'éternelle question : comment nous gouverner nous-mêmes ? Cette histoire raisonnée des formes politiques est donc aussi une recherche de philosophie politique.",978-2081270923,https://m.media-amazon.com/images/I/711QDkngw7L._SY522_.jpg,FLAMMARION (13 octobre 2012),Pierre Manent
A nos amis,10.0,"À ceux pour qui la fin d'une civilisation n'est pas la fin du monde ; À ceux qui voient l'insurrection comme une brèche, d'abord, dans le règne organisé de la bêtise, du mensonge et de la confusion ; À ceux qui devinent, derrière l'épais brouillard de « la crise », un théâtre d'opérations, des manœuvres, des stratégies ? et donc la possibilité d'une contre-attaque ; À ceux qui portent des coups ; À ceux qui guettent le moment propice ; À ceux qui cherchent des complices ; À ceux qui désertent ; À ceux qui tiennent bon ; À ceux qui s'organisent ; À ceux qui veulent construire une force révolutionnaire, révolutionnaire parce que sensible ; Cette modeste contribution à l'intelligence de ce temps.",978-2358720625,https://m.media-amazon.com/images/I/71GvEdYymlL._SY522_.jpg,La Fabrique Editions; 1er édition (21 octobre 2014),Comité invisible
Penser en Chine,11.0,"Est-il encore permis de penser tout haut, ou de penser tout court, dans un pays qui fait tant parler de lui sans qu'il soit possible d'y prendre la parole librement ? Comment, dans la furieuse déferlante de nouvelles qui nous arrivent quotidiennement de et sur la Chine, distinguer d'autres voix que celles des médias et des puissants de ce monde ? À quel moment avons-nous pu entendre les analyses de connaisseurs de la Chine dans la durée et, a fortiori, les discours quasi inaudibles des intellectuels chinois eux-mêmes ?Le but de cet ouvrage collectif est de nous situer par rapport à une Chine qui a envahi notre horizon du fait de sa vertigineuse montée en puissance économique, mais aussi géopolitique et militaire, accréditant ainsi la thèse, devenue un thème central de la propagande officielle, d'un retour en force de son passé impérial.Après des décennies de régime maoïste, nul n'imaginait la Chine être un jour en mesure de se projeter à l'échelle de la planète. Or, force est de constater qu'aujourd'hui les élites intellectuelles chinoises se sentent assez sûres d'elles-mêmes pour se proclamer sans ambages détentrices de valeurs universelles qui ne doivent rien à celles des Lumières européennes. Mais qu'en est-il en réalité ?Contributions de Séverine Arsène, Chu Xiaoquan, Magnus Fiskesjö, Ruth Gamble, Ge Zhaoguang, Ji Zhe, Frédéric Keck, Anne Kerlan, John Makeham, Damien Morier-Genoud, David Ownby, Qin Hui, Marshall Sahlins, Nathan Sperber, Isabelle Thireau, Sebastian Veg.",978-2072870927,https://m.media-amazon.com/images/I/71f6z-jU9dL._SY522_.jpg,Folio (4 février 2021),Collectifs
Le Rappel à l'ordre (nouvelle édition): Enquête sur les nouveaux réactionnaires,11.8,"Publié il y a quatorze ans, cet essai avait révélé l’émergence, alors diffuse, d’une culture « néo-réactionnaire » dans le paysage intellectuel français. Cette réédition montre à quel point Daniel Lindenberg avait vu juste. Depuis, la parole s’est libérée, les analyses se sont décomplexées. Et ceux-là mêmes qui avaient protesté contre leur assimilation à un qualificatif jugé péjoratif se réjouissent aujourd’hui publiquement du « grand retournement » qu’ils ont provoqué dans le monde des idées.
Le Rappel à l’ordre est un livre prémonitoire, nécessaire à notre compréhension du présent. Une postface inédite de l’auteur souligne les nouveaux contours de la galaxie des personnalités et des œuvres qui, au-delà de leurs différences, orchestrent une révolution conservatrice au cœur de la vie intellectuelle et politique. Toute notre démocratie s’en trouve ébranlée.",978-2021312140,https://m.media-amazon.com/images/I/515ktGX6mvL._SY522_.jpg,SEUIL (21 janvier 2016),Daniel Lindenberg
Le communautarisme : la République divisible ?,8.8,"La République française, composée d’un peuple unique, repose depuis deux siècles sur un triple fondement, l’unité, l’égalité et l’universalité. Si l’unité de la France revêt une importance tant juridique que symbolique, ce schéma est aujourd’hui mis à mal par l’émergence de communautés, religieuses, régionales ou bien de mœurs, qui revendiquent leurs spécificités.
Leurs attentes sont d’ores et déjà en partie satisfaites. La lutte contre toutes les formes de discrimination n’a cessée d’être renforcée. Les premiers exemples de discrimination positive apparaissent. Des législations qui favorisent l’expression de particularismes sont adoptées, pour substituer une égalité statistique à une égalité abstraite. Le communautarisme, opposé à l’universalisme, conduit toutefois à une conception déterministe de l’être humain, l’individu étant réduit à ses origines ou à ses choix.
L’unité de la République et la laïcité doivent donc résister, car les solutions alternatives testées à l’étranger n’ont pas permis d’obtenir des résultats satisfaisants.

 ",978-2729834067,https://m.media-amazon.com/images/I/41X39eDeV6L._SY522_.jpg,ELLIPSES (12 juillet 2007),Agnès Rabagny-Lagoa
Vous avez dit conservateur ?,22.0,"Le conservateur, en France, est comme l'enfer : c'est l'autre, et plus encore un autre qui suscite l'incrédulité, provoque la dérision et soulève le coeur. Autant son contraire, le progressiste, est auréolé de toutes les vertus, autant lui est suspecté de tous les vices. Pourquoi cette réduction obligée du conservatisme à un méli-mélo contradictoire de réaction politique, d'ordre moral et de libéralisme économique ? Pourquoi cette ignorance délibérée du fait que le conservatisme a structuré la vie politique et intellectuelle pendant au moins deux siècles, outre-Manche et outre-Atlantique ? Pourquoi la tradition conservatrice est-elle inexistante chez nous ? Quelle vision du monde recouvre-t-elle ? Cette vision n'aurait-elle pas désormais un avenir dans notre pays ? Autant de questions auxquelles répond Laetitia Strauch-Bonart dans cet essai brillant qui tient autant de l'analyse que du plaidoyer, et qui s'appuie sur une vaste enquête menée auprès de grands intellectuels français, comme Chantal Delsol, Philippe Bénéton, Jean-Pierre Le Goff ou Jean Clair. Repenser le rôle de la société civile, renforcer notre méfiance envers les systèmes politiques et notre confiance envers les liens humains et reconnaître la différence entre le temps qu'il faut pour construire et l'instant qui suffit à détruire : ce livre de savoir et de conviction est aussi un livre d'éveil et de réveil. Laetitia Strauch-Bonart a été chercheuse dans un think tank français. Elle vit à Londres où elle prépare un PhD en histoire sur les penseurs conservateurs et les questions morales après 1945. Elle collabore aussi au magazine Le Point. Vous avez dit conservateur ? est son premier essai.",978-2204104357,https://m.media-amazon.com/images/I/61JXah3Z70L._SY522_.jpg,Les éditions du Cerf (25 mars 2016),Laetitia Strauch-Bonart
S'émerveiller,7.23,"« Parfois le silence règne, nous sommes paisibles et concentrés, la lumière est belle et notre regard vigilant : alors l’émerveillement nous saisit. D’où vient ce sentiment fugitif ? Il ne résulte pas forcément de la nature grandiose de la situation ou du spectacle. Souvent c’est un état intérieur favorable qui nous permet de percevoir une dimension secrète et poétique du monde. Soudain on vit pleinement, ici et maintenant, dans le pur présent. Cette disposition intime est une conséquence du désir de vivre et de la faculté de joie.
Le risque de l’enténèbrement a frappé notre époque mais il faut d’autant plus persister à évoquer l’émerveillement. Car la construction du bonheur, le respect de chaque vie précaire, précieuse et susceptible d’accueillir les plaisirs en même temps que le labeur, sont la marque de notre conception de l’existence. Ici est notre séjour, y porter un regard attentif est le plus sûr remède contre le nihilisme. »",978-2234080362,https://m.media-amazon.com/images/I/81NXlj8j8AL._SY522_.jpg,Stock; Illustrated édition (2 janvier 2017),Belinda Cannone
"Havre Créatif Crânes en Sucre Livre de Coloriage: Page De Coloriage Sugar Skull, Dessins Complexes Inspirés Du Jour Des Morts",17.01,"Havre Créatif Crânes en Sucre Livre de Coloriage Page De Coloriage Sugar Skull, Dessins Complexes Inspirés Du Jour Des Morts",979-8322952688,https://m.media-amazon.com/images/I/71JaDbBvgXL._SY522_.jpg,Independently published (15 avril 2024),Jenny Wheeler
De la démocratie en Amérique,6.98,""" J'avoue que dans l'Amérique j'ai vu plus que l'Amérique ; j'y ai cherché une image de la démocratie elle-même, de ses penchants, de son caractère, de ses préjugés, de ses passions "". La gloire de Tocqueville n'est pas seulement celle d'un analyste politique exceptionnel ; c'est aussi, depuis la récente redécouverte de son oeuvre, celle d'un philosophe politique qui serait en même temps un classique de la sociologie, et qui pourrait aider à comprendre les problèmes qui se posent constamment dans les démocraties modernes. L'égalité des conditions, l'individualisme, le despotisme démocratique, les relations entre maîtres et serviteurs, l'esprit de liberté et l'esprit de religion, autant de notions qui dessinent aujourd'hui encore les contours d'une philosophie de la démocratie.",978-2081220874,https://m.media-amazon.com/images/I/71DjPGuYPyL._SY522_.jpg,FLAMMARION (10 mars 2010),Alexis de Tocqueville
"Le loup dans la bergerie: Droit, libéralisme et vie commune",8.0,"""Au rythme où progresse le brave new world libéral, si aucun mouvement populaire autonome (j'entends par là : non soumis à l'hégémonie de ces mouvements progressistes qui ne défendent plus que les seuls intérêts culturels des nouvelles classes moyennes des grandes métropoles du globe, soit un peu moins de 15 % de l'humanité), capable d'agir collectivement à l'échelle mondiale, ne se dessine rapidement à l'horizon, alors le jour n'est malheureusement plus très éloigné où il ne restera presque rien à protéger des griffes du loup dans la vieille bergerie humaine. Mais n'est-ce pas, au fond, ce que Marx lui-même soulignait déjà dans le célèbre chapitre du Capital consacré à la journée de travail ? Dans sa pulsion aveugle et démesurée, écrivait-il, dans sa fringale de surtravail digne d'un loup-garou, le Capital ne doit pas seulement transgresser toutes les limites morales, mais également les limites naturelles les plus extrêmes. Les intellectuels de gauche n'ont désormais plus aucune excuse.""",978-2081452053,https://m.media-amazon.com/images/I/61UBVtJKt-L._SY522_.jpg,FLAMMARION (11 septembre 2019),Jean-Claude Michéa
POLITIQUE DE L'OXYMORE,9.54,"Les démocraties modernes possèdent-elles les ressorts nécessaires pour prévenir et affronter la catastrophe écologique due au réchauffement climatique? Comme l'explique Bertrand Méheust, ce n'est pas de l'écologie libérale et du ""développement durable"" que viendra la réponse: ces discours consistent à graver dans l'esprit du public l'idée que l'écologie est compatible avec la croissance et même mieux qu'elle la réclame afin de masquer l'incompatibilité entre la société globalisée dirigée par le marché et la préservation de la biosphère. Un univers mental ne renonce jamais à lui-même si des forces extérieures ne l'y contraignent pas. Le système a saturé tout l'espace disponible et est à l'origine de tensions de plus en plus fortes. Pour les masquer, ceux qui nous gouvernent pratiquent la politique de l'oxymore. Forgés artificiellement pour paralyser les oppositions potentielles, les oxymores font fusionner deux réalités contradictoires: ""développement durable"", ""agriculture raisonnée"", ""marché civilisationnel "", ""flexisécurité "", ""moralisation du capitalisme"", ""mal propre"", etc. Ils favorisent la destruction des esprits, deviennent des facteurs de pathologie et des outils de mensonge. Plus l'on produit d'oxymores et plus les gens sont désorientés et inaptes à penser. Utilisés à doses massives, ils rendent fou. Ainsi, si le pouvoir de Sarkozy fait rupture, c'est par la production et l'usage cynique, sans précédent dans la démocratie française, d'oxymores à grande échelle.",978-2707157300,https://m.media-amazon.com/images/I/51hHtv7dYNL._SY522_.jpg,La Découverte (5 mars 2009),BERTRAND MEHEUST
Inde : la démocratie par la caste: Histoire d'une mutation socio-politique (1885-2005),28.06,"L'lnde se présente comme « la plus grande démocratie du monde » ; de fait, cet autre empire du milliard qui organise des élections libres depuis plus d’un demi-siècle a pris l’habitude de l’alternance depuis 1977, jouit d’une presse libre et connaît une justice au moins aussi indépendante que sous nos latitudes.Longtemps cette démocratie a été conservatrice. L'influence de Gandhi — réformateur moins radical que ne le dit l’hagiographie occidentale — et la sociologie très élitiste des dirigeants du Congrès, le parti dominant au lendemain de l’indépendance, ont beaucoup contribué au statu quo. Mais les vraies racines du mal étaient ailleurs, dans l’agencement vertical d’une société de caste qui permettait depuis des siècles à une minorité d’hommes bien nés de gouverner sans partage.Cet ordre hiérarchique a été ébranlé, dès l’époque coloniale, non seulement par la pénétration des idées d’égalité et de liberté, mais aussi et surtout par les politiques de discrimination positive mises en oeuvre par les Britanniques en faveur des intouchables et des basses castes.Après l’indépendance, le Congrès s’est efforcé de circonscrire ces mesures au maximum, mais les basses castes y ont trouvé un objectif de mobilisation collective qui leur a finalement permis de former un front uni à partir de 1990.Désormais, les castes ne font plus système ; elles sont une collection de groupes d’intérêt en concurrence pour une part du pouvoir. La vieille logique clientéliste s’effondre, qui amenait la paysannerie ou les ouvriers endettés à voter pour des notables ruraux ou des magnats locaux du Congrès.À la place, des partis de basse caste prennent leur essor et s’emparent du pouvoir à travers toute l’Inde du Nord. C’est une véritable révolution silencieuse, unique en son genre : une révolution sans effusion de sang, aussi légaliste que l’ont toujours été les leaders de basse caste à l’instar de leur modèle à tous, Ambedkar.L'lnde accède à une démocratie enfin digne de ce nom, et ce, paradoxalement, par la caste car celle-ci, point d’application des mesures de discrimination positive, aura été le cadre et le levier des mobilisations de la plèbe indienne, la structure collective qui a permis d’agréger les intérêts du grand nombre.",978-2213624266,https://m.media-amazon.com/images/I/51eZshhlxkL._SY522_.jpg,Fayard (11 mai 2005),Christophe Jaffrelot
Dernières nouvelles du mensonge,14.0,"S'il y a toujours eu des mensonges dans le discours public, ceux-ci occupent aujourd'hui un nouvel espace, notamment à la faveur des réseaux sociaux. La volonté de contrôler les outils l'emporte de plus en plus sur une réflexion de fond quant à l'effacement des frontières qui séparent le mensonge de la vérité. On tend à organiser la surveillance d'internet au risque de réduire les libertés de tous, alors qu'il faudrait rechercher les racines d'une confusion essentiellement politique et philosophique. La classe dirigeante n'hésite pas à instrumentaliser la lutte contre les fake news pour se maintenir au pouvoir. Elle cherche ainsi à faire oublier sa responsabilité dans l'installation du mensonge au coeur de la vie publique et dans l'avènement d'un monde où il importe surtout de mieux mentir que l'adversaire. Ce dévoiement de la politique transforme encore plus l'électeur en spectateur et impose des formes de vérités indiscutables, voire une vérité officielle. Pour reconstituer l'espace public démocratique, il devient impératif de réaffirmer la place de l'humain en tant qu'être pensant capable d'exercer sa faculté de jugement.",978-2895963714,https://m.media-amazon.com/images/I/41owDB1Qu3L.jpg,Lux Editeur (18 février 2021),Anne-Cécile Robert
