Nom,Prix,Description,Isbn,Photo,Editeur,Auteur
Investir en Bourse avec les ETF: Construire et développer son patrimoine sur le long terme. Une stratégie simple et efficace.,10.12,"Le Guide complet pour une stratégie gagnante sur ETF !

Si…
Vous avez du mal à définir votre stratégie d’investissement ?
Vous ne savez pas comment investir en bourse ?
Vous n’arrivez pas à choisir les meilleurs ETF ?
Vous voulez comprendre précisément comment fonctionne un ETF ?
… alors, ce livre est fait pour vous.
Vous apprendrez…
Comment fonctionne la bourse,
Pourquoi il est nécessaire d’investir,
Quelles stratégies existent pour investir en bourse,",979-8324298654,https://m.media-amazon.com/images/I/61LytftTi8L._SY522_.jpg,Independently published (30 mai 2024),Le Prince desETF
LA PUISSANCE DE L'AUTO ÉDUCATION: DÉMARCHE PSYCHO-MÉTAPHYSIQUE POUR UN SUCCÈ S RESPONSABLE,19.05,"On peut être riche sans faire du bien aux autres mais de toutes mes recherches il me revient sans cesse de conclure qu'on ne peut pas être pauvre sans faire du mal à soi-même et aux autres.
Si l'argent que vous désirez est pour faire le bien, améliorer les conditions de vie des humains, permettre un vivre ensemble harmonieux entre humains, peu importe le montant, réjouissez-vous car vos désires sont déjà exaucés à 80% par Dieu et toutes les puissantes bienveillantes de la Nature. Pour les 20% restants, c'est de vous mettre en action aujourd'hui, commencer maintenant ce qui vous tient à cœur, ce que vous aimez vraiment et votre biographie sera digne d'être lue.",979-8880001569,https://m.media-amazon.com/images/I/71-i3OEq6QL._SY522_.jpg,Independently published (2 mars 2024),SIMON OUEDRAOGO
Futures Thinking in Asia and the Pacific: Why Foresight Matters for Policy Makers,28.01,"This handbook shows how the Asian Development Bank (ADB) piloted futures thinking and foresight to understand entry points to support transformational change and ﬁnance the future of Asia and the Paciﬁc.
Futures thinking and foresight is a powerful planning approach that can help the region meet economic, political, social, and environmental and climate change challenges. The publication compiles lessons from an ADB initiative to apply futures and foresight tools in Armenia, Cambodia, Kazakhstan, Mongolia, the People's Republic of China, the Philippines, and Timor-Leste. Futures terminology is introduced as are specific tools such as emerging issues analysis, scenario planning, and backcasting. It also describes how futures and foresight tools were applied in the countries.",978-9292621810,https://m.media-amazon.com/images/I/61BimtSvylL._SY522_.jpg,Asian Development Bank (30 juin 2020),Asian Development Bank
Planificateur de Menu et liste de Courses avec suivi du budget: Carnet en couleur pour planifier les repas et les courses avec suivi budgétaire ... En bonus recettes de base et astuces cuisine,9.9,"Ce planificateur de menus et courses tout en couleurs deviendra rapidement votre indispensable.
Ce carnet va vous permettre d’optimiser votre temps et vos dépenses alimentaires en un rien de temps, il est conçu pour que tout ce dont vous avez besoin pour composer vos menus soit dedans.
A l'intérieur de votre carnet prêt à remplir vous trouverez :
Le budget annuel
Le placard de base
Comment ranger son frigo
Légumes et fruits de saison
Pour chaque semaine : l'inventaire, le menu, la liste de courses, le budget avec optimisation",979-8840276372,https://m.media-amazon.com/images/I/61r61dE3eFL._SY522_.jpg,Independently published (9 juillet 2022),Virginie BORDET
"De la blockchain à crypto-investisseur: Comprendre la technologie blockchain et investir stratégiquement dans le Bitcoin, l'Ethereum, le Ripple & Co.",15.07,"Apprenez-en plus sur la technologie blockchain et investissez stratégiquement dans les crypto-monnaies !
Votre guide étape par étape sur le monde crypto de demain.
«Le Bitcoin est meilleur que les monnaies [actuelles] [...] La technologie bitcoin est la clé.» ~Bill Gates
Les bitcoins, la technologie blockchain et les contrats intelligents sont les mots-clés de la révolution numérique dans nous nous trouvons actuellement. Soi-disant insidieuse, encombrante et ouvertement contestée par les banques, cette nouvelle technologie de la décentralisation intègre de plus en plus notre quotidien. Celui qui pense que ce sujet ne révolutionne le secteur bancaire fait fausse route : la nouvelle ère de la blockchain est en route et va profondément changer tous les domaines de la vie. Ceux qui comprennent les crypto-monnaies aujourd’hui seront l’un des gagnants de demain !",978-3947061532,https://m.media-amazon.com/images/I/61jMvs4eHBL._SY522_.jpg,GbR C. Klein & J. Helbig (3 juillet 2019),Jens Helbig
LA PENSÉE POSITIVE: 5 LIVRES EN 1:Libérez-vous des Pensées Excessives en Vivant dans le Présent grâce à l'Intelligence Émotionnelle| Améliorer la Communication Renforcer l'Estime de Soi & la Disipline,15.87,"⭐ 3° ÉDITION 2024 "" 5 LIVRES EN 1 "", +75.000 EXEMPLAIRES VENDUS EN 2022-23 ⭐

- Un sentiment oppressant d'anxiété permanente vous empêche-t-il d'être serein ?
- Combien de fois avez-vous pris des décisions que vous avez regrettées par la suite ?
- Cherchez-vous un plan d'action pour réduire les conflits mentaux et les comportements négatifs ?

QU'EST-CE QUE LA PSYCHOLOGIE POSITIVE ?

Ces dernières années, les réponses les plus banales ont été données à cette question. ""La psychologie positive dit qu'il faut toujours penser au meilleur, quoi qu'il arrive. ""La psychologie positive dit qu'être heureux est un choix, et non un hasard.",979-8856511450,https://m.media-amazon.com/images/I/71IRC7NykbL._SY522_.jpg,Independently published (8 août 2023),Viktor McBrown
Hacking Growth: How Today's Fastest-Growing Companies Drive Breakout Success,19.8,"'a compelling methodology... to increase market share quickly' -- Eric Ries, bestselling author of THE LEAN STARTUP

'a must-read for anyone in business' -- James Currier, managing partner, NFX Guild

'will teach you how to think like a marketer of tomorrow' -- Josh Elman, partner, Greylock Partners


Growth is now the first thing that investors, shareholders and market analysts look for in assessing and valuing companies.

HACKING GROWTH is a highly accessible, practical, method for growth that involves cross-functional teams and continuous testing and iteration. Hacking Growth does for marketshare growth what THE LEAN STARTUP does for product development and BUSINESS MODEL GENERATION does for strategy. HACKING GROWTH focuses on",978-0753545379,https://m.media-amazon.com/images/I/81qcGYaWynL._SY522_.jpg,Virgin Books; 1er édition (27 avril 2017),Morgan Brown
"Trading en Ligne: Guide étape par étape pour Découvrir les Principales Stratégies, Outils et Techniques de Trading pour Commencer avec la Bonne Approche de ce Business.",5.75,"Vous avez entendu parler du potentiel lucratif du trading, mais vous ne savez pas par où commencer?
Vous souhaitez diversifier vos revenus, mais craignez les erreurs coûteuses?
Ne cherchez plus, cette guida est faite pour vous.
Le monde du trading est vasto et en constante évolution. À la différence de ce que certains peuvent dire, le marché change, et il est essentiel d'être bien informé et préparé.
Que vous soyez un débutant désireux de lancer votre propre entreprise ou un parent cherchant à apporter un revenu supplémentaire à la maison, ce livre est votre compagnon idéal.",979-8356848735,https://m.media-amazon.com/images/I/61nInQ4zJeL._SY522_.jpg,Independently published (7 octobre 2022),Stefano Pascal
A Culture of Growth: The Origins of the Modern Economy,23.17,"Why Enlightenment culture sparked the Industrial Revolution
During the late eighteenth century, innovations in Europe triggered the Industrial Revolution and the sustained economic progress that spread across the globe. While much has been made of the details of the Industrial Revolution, what remains a mystery is why it took place at all. Why did this revolution begin in the West and not elsewhere, and why did it continue, leading to today's unprecedented prosperity? In this groundbreaking book, celebrated economic historian Joel Mokyr argues that a culture of growth specific to early modern Europe and the European Enlightenment laid the foundations for the scientific advances and pioneering inventions that would instigate explosive technological and economic development. Bringing together economics, the history of science and technology, and models of cultural evolution, Mokyr demonstrates that culture--the beliefs, values, and preferences in society that are capable of changing behavior--was a deciding factor in societal transformations.",978-0691180960,https://m.media-amazon.com/images/I/91sTpGRXWaL._SY522_.jpg,Princeton University Press; Reprint édition (12 juin 2018),Joel Mokyr
The Rough Guide to Economics,9.88,"The financial crisis and resulting global problems have dramatically demonstrated the importance of economics to everyday life. The Rough Guide to Economics explains the basics of the subject in an engaging, accessible, yet rigorous way and demonstrates the power of economic models when explaining the activities of consumers, businesses, governments, and the economy in general.
Learn all you need to know about supply and demand, equilibrium, inflation, growth, and international trade, as well as markets, competition, and the development of economic thought with The Rough Guide to Economics.",978-1409363972,https://m.media-amazon.com/images/I/81Iw3oIrLXL._SY522_.jpg,Rough Guides (31 mars 2014),Rough Guides
"30 défis épargne: livre de défis épargne petit salaire, petit budget pour faire des économies | suivi des challenges et tracker intégré | cahier en couleur",13.15,"📈 30 défis épargne et 3 défis personnalisables sont à réaliser dans ce livre. 📈
Faire des économies sur son budget familial de façon ludique devient ultra simple ! 💰💰💰

Vous pensez qu'épargner n'est pas possible avec votre budget ? Ce livre de défis épargne vous guide pour vous aider à savoir économiser et vous constituer de l'épargne sous forme de jeux malgré des revenus modestes/moyens. Votre routine de budget hebdomadaire va devenir un réel plaisir. ♥️

Contenu du livre :
suivi des défis épargne avec le ""Recap tracker""
30 défis originaux avec des thèmes comme le parc d'attraction, défi de la plus grosse pièce, vente internet, le parc animalier, défi pour moi, Relie les points, défi déco maison...",979-8355718862,https://m.media-amazon.com/images/I/61cp0GcwiML._SY522_.jpg,Independently published (2 octobre 2022),Adeline Legrand
"The Economics of Microfinance, second edition",51.04,"An accessible analysis of the global expansion of financial markets in poor communities, incorporating the latest thinking and evidence.
The microfinance revolution has allowed more than 150 million poor people around the world to receive small loans without collateral, build up assets, and buy insurance. The idea that providing access to reliable and affordable financial services can have powerful economic and social effects has captured the imagination of policymakers, activists, bankers, and researchers around the world; the 2006 Nobel Peace Prize went to microfinance pioneer Muhammed Yunis and Grameen Bank of Bangladesh. This book offers an accessible and engaging analysis of the global expansion of financial markets in poor communities. It introduces readers to the key ideas driving microfinance, integrating theory with empirical data and addressing a range of issues, including savings and insurance, the role of women, impact measurement, and management incentives. This second edition has been updated throughout to reflect the latest data. A new chapter on commercialization describes the rapid growth in investment in microfinance institutions and the tensions inherent in the efforts to meet both social and financial objectives. The chapters on credit contracts, savings and insurance, and gender have been expanded substantially; a new section in the chapter on impact measurement describes the growing importance of randomized controlled trials; and the chapter on managing microfinance offers a new perspective on governance issues in transforming institutions. Appendixes and problem sets cover technical material.",978-0262513982,https://m.media-amazon.com/images/I/71bc+mXlxYL._SY522_.jpg,The MIT Press; second edition (23 avril 2010),Beatriz Armendariz
LES 7 CLÉS POUR GAGNER VOS MARCHES PUBLICS: La méthode gagnante pour garantir le succès de vos réponses,5.0,"Fort d'une expérience de 20 ans dans les marchés publics, l'auteur développe une méthode très opérationnelle pour répondre de manière efficace aux marchés publics. L'ouvrage s'adresse aux personnes débutantes ou expérimentées dans les marchés publics en faisant partager des bonnes pratiques. Répondre à un marché public est un acte commercial, en maîtrisant les 7 clés présentées, non seulement vous prendrez du plaisir à répondre aux marchés mais vous augmenterez vos taux de succès.",979-8879491524,https://m.media-amazon.com/images/I/51zY13F05gL._SY522_.jpg,Independently published (24 février 2024),Olivier DEMILLY
La Base: Comment maitriser ses finances personelles: En moins de 10 minutes par mois,7.99,"Vous ne savez pas comment épargner efficacement ? 😰
Vous ne parvenez pas à mettre de l'argent de côté ?
Vous dilapidez l’épargne que vous avez économisée ? 😔
Vous voulez partir en retraite plus tôt que les autres ?
Pire, vous êtes endetté et ne savez plus comment faire pour vous en sortir ? 😪
STOP ! Si vous ne faites rien maintenant, dans 6 mois, vous serez toujours au même point, la peur et l'anxiété continueront à vous hanter.
Découvrez Antoine ROUSSEAUX, l'auteur du livre révolutionnaire “La base : Comment maîtriser ses finances personnelles en moins de 10 minutes par mois” ! Conçu pour ceux qui cherchent à dompter leurs finances, ce livre innovant propose trois systèmes simples et efficaces pour transformer votre relation avec l'argent.",979-8388699022,https://m.media-amazon.com/images/I/51pXcq1K4TL._SY522_.jpg,Independently published (27 mars 2023),Antoine Rousseaux
Yugoslavia: Self-management Socialism and the Challenge of Development,5.64,,978-0801822636,https://m.media-amazon.com/images/I/61gpCquy8fL._SY522_.jpg,Johns Hopkins University Press (1 septembre 1979),Martin Schrenk
Asia's Next Giant: South Korea and Late Industrialization,22.68,"While much attention has been focused on Japan's meteoric rise as an economic power, South Korea has been quietly emerging as the next industrial giant to penetrate the world market. South Korea is one of a series of countries (ranging from Taiwan, India, Brazil, and Turkey, to Mexico, and including Japan) to have succeeded through borrowing foreign technology rather than by generating new products or processes. Describing such countries as `late-industrializers,' Amsden demonstrates why South Korea has become the most successful of this group.",978-0195076035,https://m.media-amazon.com/images/I/81DFtiahIpL._SY522_.jpg,Oxford University Press; Reprint édition (25 juin 1992),Alice H. Amsden
Blue Ocean Strategy: How to Create Uncontested Market Space and Make the Competition Irrelevant.,7.89,"OVER 4 MILLION COPIES SOLD
WALL STREET JOURNAL AND BUSINESSWEEK BESTSELLER
RECOGNIZED AS ONE OF THE MOST ICONIC AND IMPACTFUL STRATEGY BOOKS EVER WRITTEN
The global phenomenon that has sold over 4 million copies, is published in a record-breaking 49 languages and is a bestseller across five continents--now updated and expanded with new content. Named by Fast Company as one of the most influential leadership books in its Leadership Hall of Fame. A strategy classic.
In this perennial bestseller, embraced by organizations and industries worldwide, globally preeminent management thinkers W. Chan Kim and Renée Mauborgne challenge everything you thought you knew about the requirements for strategic success. Recognized as one of the most iconic and impactful strategy books ever written,",978-1625274496,https://m.media-amazon.com/images/I/91YCWH4jFdL._SY522_.jpg,Harvard Business School Press; Expanded édition (20 janvier 2015),W. Chan Kim
Divided Isles: Solomon Islands and the China Switch,12.0,"In 2019, Solomon Islands made international headlines when the country severed its decades-old alliance with Taiwan in exchange for a partnership with Beijing. The decision prompted international condemnation and terrified security experts, who feared Australia’s historical Pacific advantage would come unstuck. This development was framed as another example of China’s inevitable capture of the region – but this misrepresents how and why the decision was made, and how Solomon Islanders have skilfully leveraged global angst over China to achieve extraordinary gains. Despite Solomon Islands’ strategic importance, most outsiders know little about the country, a fragile island-nation stretching over a thousand islands and speaking seventy indigenous languages. In Divided Isles, Edward Cavanough explains how the switch played out on the ground and considers its extraordinary potential consequences. He speaks with the dissidents and politicians who shape Solomon Islands’ politics, and to the ordinary people whose lives have been upended by a decision that has changed the country – and the region – forever.",978-1526178350,https://m.media-amazon.com/images/I/91HuoXJtLvL._SY522_.jpg,Manchester University Press (9 avril 2024),Edward Acton Cavanough
How to Spend $50 Billion to Make the World a Better Place,20.92,"Edited by Bjørn Lomborg, this abridged version of the highly acclaimed Global Crises, Global Solutions provides a serious yet accessible springboard for debate and discussion on the world's most serious problems, and what we can do to solve them. In a world fraught with problems and challenges, we need to gauge how to achieve the greatest good with our money. This unique book provides a rich set of dialogs examining ten of the most serious challenges facing the world today: climate change, the spread of communicable diseases, conflicts and arms proliferation, access to education, financial instability, governance and corruption, malnutrition and hunger, migration, sanitation and access to clean water, and subsidies and trade barriers. Each problem is introduced by a world-renowned expert who defines the scale of the issue and examines a range of policy options.",978-0521685719,https://m.media-amazon.com/images/I/61O4r7cbnWL._SY522_.jpg,Cambridge University Press (6 juillet 2006),Bjorn Lomborg
"Trackers budget à découper thème Papillon: Tout en couleurs, adaptés aux pochettes budgétaires et classeurs A6 Couvertures de présentation et différents trackers de suivi",7.73,"Vous utilisez ou souhaitez utiliser la méthode des enveloppes pour gérez votre budget ?
Ces trackers prêts à être découpés sont parfaitement adaptés aux classeurs et pochettes A6
Vous pourrez maîtriser vos dépenses en affectant un budget pour chaque catégorie

Tous les trackers sont différents, ils sont en couleurs et décorés sur le thème des papillons.

A l'intérieur de ce carnet vous retrouverez :
30 trackers de suivi des dépenses",,https://m.media-amazon.com/images/I/61i1QYavynL._SY522_.jpg,Independently published (22 mars 2023),Virginie BORDET
Direct Democracy TODAY,6.61,"Important Notice. Gregory’s book on Direct Democracy is available in two formats:

Direct Democracy TODAY (Standard book size) You are currently looking at the standard book size.

Direct Democracy NOW (A4 size – large print)

📢 Unveiling ""Direct Democracy TODAY: Have Our Politicians Sold Out?""

Are our politicians truly serving the people, or has the trust in representative democracy been compromised? In this groundbreaking book, we delve into the pressing questions surrounding political transparency, accountability, and genuine representation. ""Direct Democracy NOW"" challenges conventional wisdom and explores a radical approach to address the shortcomings of our current political systems.

🔍 Key Questions Explored:

Is there a need for greater political transparency and accountability?
Are citizens authentically represented, and if not, why?
Could Direct Democracy offer a more effective alternative?
How does Direct Democracy function, and what lessons can we draw to fortify democracy against erosion?

📘 Inside the Book:

Understanding the concept of ""delegated authority"" and its implications.
Examining the Swiss model: What sets it apart, and what lessons can we extract?
Exploring the conditions ripe for comprehensive political reform through increased use of referendums and citizens' initiatives.

🔍 Nuanced Insights into Representative Democracy:

""Direct Democracy TODAY"" meticulously dissects the complexities of representative democracy, spotlighting its deviations from the lofty ideals it was built upon. By shedding light on the Swiss model, we unveil a unique perspective on how, for example the rotational presidency model fosters a balanced distribution of power and cultivates a culture of consensus and compromise.

🌐 Empowering Citizens:

Discover how the Swiss political system is anchored in the principle of ""popular sovereignty,"" emphasizing that ultimate authority rests with the people. Direct democratic tools emerge as potent mechanisms, empowering citizens to engage directly in decision-making processes. The book investigates how this approach acts as a robust safeguard for free speech, promoting inclusivity, evidence-based decision-making, public deliberation, and counterbalancing special interests.

⚖️ A Call for Reform:

""Direct Democracy TODAY"" sounds a clarion call for reform, advocating for increased use of referendums and citizens' initiatives as powerful tools to revitalize and strengthen democracy. Join us in exploring innovative solutions to the challenges facing our political systems.

Embark on a thought-provoking journey with ""Direct Democracy TODAY"" – ""Beyond the Ballot: Unveiling the Forces Shaping Democracy""",979-8883867544,https://m.media-amazon.com/images/I/71YjMbhfAfL._SY522_.jpg,Independently published (18 mars 2024),Simon Gregory
We Are Not Able to Live in the Sky: The Seductive Promise of Microfinance,31.04,"In 2005, pop star Bono proclaimed, “Give a man a fish, he’ll eat for a day. Give a woman microcredit, she, her husband, her children and her extended family will eat for a lifetime.” By the mid-2000s, it had become international development dogma that microfinance - very small, high-interest loans - was the way to end poverty. The UN had dubbed 2005 the year of microcredit. A year later, when Muhammad Yunus won the Nobel Peace Prize for his work on microfinance, he proclaimed that tiny loans would “put poverty in museums.” It was a beautiful vision. But there was just one problem: microfinance doesn’t work – at least not as promised. Mara Kardas-Nelson's We Are Not Able to Live in the Sky is a story about unintended consequences, blind optimism, and the decades-long ramifications of seemingly small policy choices that reverberate around the world. It is a story of poor women doing their best to make ends meet under the toughest circumstances, and of international development workers, funders and advocates - from Bono to Bill Gates to Bill Clinton - who promise a brighter future with a quick-fix solution that may ultimately trap poor people in poverty. The book is deeply rooted in the deeply immersive narratives of women who take out microfinance loans in Sierra Leone; their stories are set against a detailed history of the meteoric rise of Muhammad Yunus’ lofty vision and the gradual shift from a small non-profit program to a booming for-profit industry. We Are Not Able to Live in the Sky puts in harsh relief the questions we all should have been asking for decades: who makes money off microfinance - and more importantly, who, and what, gets left behind?",978-1250817228,https://m.media-amazon.com/images/I/91eBrlHtY0L._SY522_.jpg,St Martin's Press (15 juillet 2024),Mara Kardas-Nelson
Quand l'entreprise transforme les mutations en opportunités: Développer une stratégie durable et réaliste dans un environnement incertain,29.99,"L'environnement de plus en plus complexe et fluctuant est anxiogène pour les entreprises qui auraient tendances à y répondre par une multiplication des projets sans cohérence globale. Or, il est temps que les entreprises réalisent que cet environnement incertain est aussi plus malléable et qu'il est propice à la création de nouvelles valeurs environnementales, économiques et sociétales. Alors, comment construire une entreprise solide sur le long terme, au sein d'un tel environnement ? Et si la solution était de ne pas faire face à ces discontinuités, mais de surfer avec pour retrouver du sens ?

Au travers d'exemples concrets et d'études qui appuient ses propos, Maximilien Brabec propose au lecteur des outils et des approches pour créer ces nouvelles valeurs. Il encourage pour cela les dirigeants et les décideurs à se poser au mieux la question stratégique à laquelle l'entreprise doit répondre à long terme, à expérimenter, à s'étonner, à être agiles et à amplifier l'engagement collectif. Ils pourront alors mettre en place une stratégie durable dans leur entreprise, en créant des projets en lien avec sa raison d'être.",978-2804734619,https://m.media-amazon.com/images/I/61R18IAQsmL._SY522_.jpg,Mardaga; 1er édition (13 décembre 2023),Maximilien Brabec
