Nom,Prix,Description,Isbn,Photo,Editeur,Auteur,Categorie
Soignez votre enfant par l&#39homéopathie: L&#39approche uniciste,4.95,Ce petit précis d&#39homéopathie uniciste - c&#39est-à-dire basée sur l&#39administration d&#39un seul remède à la fois - s&#39adresse à tous les parents soucieux de trouver des alternatives à l&#39allopathie pour soigner leur enfant. br/ br/ L&#39homéopathie deviendra un véritable allié au service de la santé de la famille !,978-2889114887,https://m.media-amazon.com/images/I/61M-GZ6H8CL._SY522_.jpg,JOUVENCE (10 mars 2014),Françoise Berthoud,Homéopathie
La bible de l&#39homéopathie et des traitements naturels,22.5,"Pour soigner les maladies courantes et émergentes
Médecin homéopathe, acupuncteur et ostéopathe pendant plus de trente ans, le docteur Alain Paul s&#39est élevé contre certaines préconisations et prescriptions médicales qu&#39il jugeait déraisonnables en matière de santé - toxicité alimentaire, excès de produits laitiers, médicaments dangereux, transformation de certaines normes (cholestérol, glycémie, tension artérielle, thyroïde, ostéoporose) entraînant des traitements inutiles, abusifs, voire dangereux. Ce guide médical de référence - présenté sous la forme d&#39un répertoire homéopathique -, décline pour chaque maladie : les symptômes, pour bien reconnaître la maladie en question . les causes, pour éviter la récidive . les traitements classiques allopathiques . les traitements homéopathiques - homéo simplex, un traitement simple pour les néophytes, homéo sapiens, un traitement plus adapté pour les médecins . les traitements naturels associés ainsi que des conseils pour améliorer son capital santé.",978-2702917251,https://m.media-amazon.com/images/I/51NhdKfmyFL._SY522_.jpg,Courrier du Livre; 4e édition (10 mars 2020),Alain Paul,Homéopathie
L&#39esprit du remède homéopathique: Ce que le mal a dit,17.15,"Quelle est la signification de la maladie ? Nos maux surviennent-ils par hasard ou sont-ils la résultante d’une logique dont il nous reste à déceler le sens caché ?
Grâce à cet ouvrage qui s’adresse à la fois aux professionnels de la santé et au grand public, le Docteur Didier Grandgeorge nous permet de découvrir le fil conducteur qui relie la souffrance physique à nos problèmes psychiques inconscients. En nous révélant l’esprit de quelques 277 remèdes homéopathiques, il nous offre la clef qui nous ouvre les portes de notre inconscient.
La première édition de L’esprit du remède homéopathique - Ce que le mal a dit a été publiée il y a plusieurs dizaine d’années. Cet ouvrage a connu un succès considérable, tant en France qu’à l’étranger, où il a été traduit en neuf langues. Depuis lors, le Dr Didier Grandgeorge, avec le concours de son équipe, a continué inlassablement à étudier la matière médicale homéopathique pour dégager l’esprit de nouveaux remèdes par la synthèse de leurs nombreux symptômes issus des expérimentations de la pathogénésie. De plus, en se tenant à l’écoute du travail d’autres équipes dans le monde entier, qui œuvrent également dans cette même voie, le Dr Grandgeorge a enrichi sa pratique de nombreux remèdes qui sont d’une grande utilité pour les malades concernés et d’un grand profit pour tous. La découverte de l’esprit du remède permet une prescription sûre, profonde et efficace. Chaque remède nouveau est comme une nouvelle étoile dans le ciel d’un marin.
Cette nouvelle édition enrichie est également augmentée de 27 remèdes et bénéficie de toutes les nouvelles avancées, fruits de ses années fécondes passées au chevet des malades.

Né en 1950, Didier Grandgeorge est l’un des chefs de file de l’homéopathie française. Il termine ses études de médecine en 1980 et étudie l’homéopathie à l’École Hahnemannienne du Dauphine-Savoie et est depuis, le président de l’École Hahnemannienne de Fréjus. Il est chargé de l’enseignement de l’homéopathie à la faculté de médecine de Marseille.
Pédiatre homéopathe, fort de plus de trente années d’expérience, il est l’auteur de plusieurs livres sur l’homéopathie, parmi lesquels « Homéopathie chemin de vie – Grandir sous le regard d’un pédiatre homéopathe » et « Guérir par l’homéopathie – L’homéopathie dans les cas aigus ».",978-3955821036,https://m.media-amazon.com/images/I/91oLIFBb2qL._SY522_.jpg,Editions Narayana; Enlarged édition (8 mars 2016),Didier Grandgeorge,Homéopathie
"La bible Homéopathique: Le livre de référence pour se soigner naturellement, guérir tout les maux de la famille et vivre plus sainement au quotidien I Plus de 100 remèdes pour tout les tracas !",17.33,"Découvrez comment vous guérir facilement à la maison avec plus de 100 remèdes !

Et si, au lieu d’une attente longue et coûteuse chez le médecin, vous pouviez vous soigner, vous et votre famille, à la maison, de manière sûre et efficace, pour des maladies courantes telles que le rhume, les infections, les otites et même les intoxications alimentaires ? Si c’est ce que vous recherchez, alors ce livre est fait pour vous !

Qui n’a jamais souffert d’un mauvais rhume ou d’une horrible grippe à l’étranger ? Rien ne peut plus gâcher des vacances que d’être coincé dans une chambre d’hôtel loin de chez soi, en train de vomir. Mais si vous savez comment utiliser efficacement et en toute sécurité ces",979-8429097732,https://m.media-amazon.com/images/I/611fxpXWBwL._SY522_.jpg,Independently published (8 mars 2022),Hervé Larrant,Homéopathie
"La bible Homéopathique: Le livre de référence pour se soigner naturellement, guérir tout les maux de la famille et vivre plus sainement au quotidien I Plus de 100 remèdes pour tout les tracas !",16.7,"Découvrez comment vous guérir facilement à la maison avec plus de 100 remèdes !

Et si, au lieu d’une attente longue et coûteuse chez le médecin, vous pouviez vous soigner, vous et votre famille, à la maison, de manière sûre et efficace, pour des maladies courantes telles que le rhume, les infections, les otites et même les intoxications alimentaires ? Si c’est ce que vous recherchez, alors ce livre est fait pour vous !

Qui n’a jamais souffert d’un mauvais rhume ou d’une horrible grippe à l’étranger ? Rien ne peut plus gâcher des vacances que d’être coincé dans une chambre d’hôtel loin de chez soi, en train de vomir. Mais si vous savez comment utiliser efficacement et en toute sécurité ces",979-8429097732,https://m.media-amazon.com/images/I/611fxpXWBwL._SY522_.jpg,Independently published (8 mars 2022),Hervé Larrant,Homéopathie
Vademecum de la prescription en homéopathie: Fiches pratiques par maladies et par médicament classées de A à Z,53.5,"Les médecins praticiens trouveront dans cet ouvrage l&#39essentiel de ce qu&#39il faut savoir pour prescrire avec succès des médicaments homéopathiques.


Organisé comme une ""fusée à trois étages"" ce livre s&#39adresse :


au médecin intéressé par l&#39homéopathie sans la connaître vraiment et qui avant d&#39aller plus loin veut s&#39essayer à quelques prescriptions ;


au médecin qui voulant acquérir l&#39essentiel de la méthode a besoin de connaître",978-2294770500,https://m.media-amazon.com/images/I/71GXfPHLvNL._SY522_.jpg,Elsevier Masson; 2e édition (13 juin 2019),Alain Horvilleur,Homéopathie
Vivre avec l&#39homéopathie,6.92,"L&#39homéopathie s&#39explique-t-elle ? Oui, répond Bernard Long, qui s&#39inscrit tout à la fois dans la pure lignée de Samuel Hahnemann, le fondateur de la discipline, et dans un empirisme novateur issu de trente années de pratique et de recherche au contact des patients et des fameux granules. Après avoir dégagé les grands principes - similitude, globalité, individualisation - qui fondent cette médecine, Bernard Long en énumère la matière médicale - les cent cinquante médicaments les plus utilisés - puis propose, pour les principales maladies, une thérapeutique précise, s&#39appuyant sur sa profonde connaissance des ouvrages classiques. Ainsi son livre, sans renier le rôle essentiel de la consultation avec le médecin traitant, se présente-t-il comme un manuel d&#39information homéopathique, s&#39adressant aussi bien aux soignants qu&#39à un public de plus en plus incité à une automédication sans danger, compte tenu des difficultés actuelles de prise en charge tutélaire de la santé. Ce grand soignant, qui introduit par ailleurs l&#39homéopathie en milieu tibétain, est convaincu, qu&#39au-delà de symptômes avérés, on peut utiliser l&#39homéopathie tout au long de sa vie, avec profit et conscience.",978-2911939624,https://m.media-amazon.com/images/I/81QSm2-xyPL._SY522_.jpg,Indigène Editions (22 février 2008),Bernard Long,Homéopathie
L&#39homéopathie de A à Z,11.36,"Découvrez toutes les propriétés de cette thérapeutique.

Ce livre rassemble des conseils pratiques en homéopathie pour vous soigner en complément du suivi médical indispensable et en collaboration avec votre pharmacien. Toutes les rubriques sont classées par ordre alphabétique pour accéder immédiatement à l’information recherchée. Les principaux médicaments homéopathiques y sont présentés avec leurs indications cliniques et leur origine. L’auteur détaille également les pathologies ou les motifs de consultation les plus fréquents, accompagnés de conseils pour mieux observer les symptômes et trouver le traitement adéquat en attendant de consulter.",978-2501135535,https://m.media-amazon.com/images/I/71xgMffMnSL._SY522_.jpg,Marabout (30 janvier 2019),Dr Jean-Louis Masson,Homéopathie
Homéopathie pratique pour le soin de la dent,12.15,"De la douleur à l’allergie, en passant par l’abcès, l’herpès, les aphtes, la sécheresse de la bouche, l’inflammation des gencives, le lichen buccal, etc... Il est possible de trouver dans cet ouvrage la réponse homéopathique aux divers maux dont on peut souffrir au niveau des dents, de la bouche et même de la face. Ce livre est le fruit et le résumé de 25 années d’expérience de l’auteure, médecin stomalogue et homéopathe de renom. Broché 16 x 24 - 400 pages",978-2874610073,https://m.media-amazon.com/images/I/513Ja7MOkyL.jpg,TESTEZ (15 février 2007),Chantal Vulliez,Homéopathie
The Book of Herbal Wisdom: Using Plants as Medicines,24.17,"Hailed as a “classic” by leading herbalist Rosemary Gladstar, this botanical compendium provides a wide-ranging history of herbalism and useful guidance for healing with herbs
 
Matthew Wood is one of the United States’ most renowned herbalists and the author of Seven Herbs: Plants as Healers, a watershed book in teaching herbal healing as a part of total wellness. With The Book of Herbal Wisdom, he continues and expands this study, creating a must-read guide for anyone who works in the natural health field or is interested in self-healing with herbs.
 
Wood creates a vast and sweeping history of herbalism, drawing on Western botanical knowledge, homeopathy, Traditional Chinese medicine, and Native American shamanic botany. Detailing the history and use of more than forty plants, he shows how each tradition views a plant, as well as its use in cases drawn from his own herbal and homeopathic practice. An initial section describes signatures, similar, and patterns in these traditions, and elements, temperaments, and constitutions. Wood has two objectives: to demonstrate how herbal medicines are agents of healing and wisdom, and to give the reader a useful catalog of plants for medicinal uses. His clinical observations of his patients bear the wry wisdom of the country doctor; his love of plants is evident in lush botanical descriptions, which show the connection between remedies—whether homeopathic, Chinese, or Native American—and the plants from which they are derived.
 
An introduction to centuries of lore about healing from indigenous traditions,",978-1556432323,https://m.media-amazon.com/images/I/71pOlhYJiLL._SY522_.jpg,North Atlantic Books (15 septembre 1997),Matthew Wood,Homéopathie
"Myths, Miracles, and Truth: A Beginners Guide to Learning Homeopathy",13.7,"Making Homeopathy Make Sense!
Open this book, and homeopathy comes to life! Inside is an entire course designed for anyone who wants to learn about homeopathy but needs help figuring out where to start. This book is more than just some text on a page. It is a complete course with videos, quizzes, reference materials, and free lifetime access to our advanced remedy picker software - an app designed to help people pick the perfect remedy for optimal health outcomes.
Get ready to explore homeopathy&#39s history, discover how it has evolved, and what makes it work. Learn the basics, explore the vocabulary, and determine how to pick the best remedy for each specific health problem. Get healthy with homeopathy; holistic care can produce impressive results. Everything required to get started with homeopathy is inside this book.",979-8874142605,https://m.media-amazon.com/images/I/61g6DnvXWCL._SY522_.jpg,Independently published (7 février 2024),Glynis A. Kennedy,Homéopathie
"Traitement homéopathique, guérison de cancers et de tumeurs métastasées",13.58,"Comme tout homéopathe hahnemannien, le docteur Jens Wurster aborde le traitement du cancer d&#39une manière unique. Pour la première fois, des cancers guéris par homéopathie sont documentés en détail et de manière pratique. L&#39auteur décrit minutieusement la méthode de traitement homéopathique : le travail particulier d&#39anamnèse, la pratique du dosage, l&#39évaluation des réactions à l&#39administration du médicament, ainsi que de façon générale et pratique la prise en charge globale des malades. La compensation par l&#39homéopathie des effets secondaires de la chimiothérapie et de la radiothérapie est expliquée de manière concrète. De nombreuses études de cas parfaitement documentées viennent illustrer la capacité de l&#39homéopathie a traiter, et même guérir, les tumeurs métastasées. Tous les cas sont présentés avec des analyses et des répertorisations : bien détaillées, elles sont ainsi parfaitement compréhensibles. En révolutionnant le traitement homéopathique du cancer, la première édition de ce livre est devenue un classique dans toute l&#39Europe. Une édition française manquait cruellement. Grâce à une équipe de traducteurs issue de l&#39école ""Planète Homéopathie"", cet ouvrage est désormais accessible aux francophones. Dans cette nouvelle édition entièrement revue et augmentée, le parcours des patients est documenté sur une période de dix ans. De nouveaux acquis sur le traitement homéopathique du cancer pourront ainsi profiter à tous les lecteurs. Voilà de quoi donner de l&#39espoir à de nombreuses personnes qui semblent n&#39avoir plus aucune chance de guérison.",978-2322182640,https://m.media-amazon.com/images/I/61sj3F4QY7S._SY522_.jpg,BOOKS ON DEMAND; 1er édition (15 avril 2021),Jens Wurster,Homéopathie
Organon : de l&#39art de guérir,8.29,"Samuel Hahnemann voulait donner à ses contemporains une logique médicale, une méthode rationnelle basée sur l&#39observation et l&#39expérience. L&#39Organon expose et argumente la thèse de la méthode homéopathique pour le traitement des maladies, il constitue la référence initiale et le fondement historique indispensables à toute étude de cette méthode.",978-2842510725,https://m.media-amazon.com/images/I/31FL2NLPgbL.jpg,Editions Similia; 6e édition (4 mars 2017),Samuel Hahnemann,Homéopathie
Méthode pratique de radionique homéopathique,11.9,"Pour la première fois, un spécialiste de la radionique et un docteur en homéopathie et phytothérapie ont associé leurs connaissances pour réaliser ces planches. Elles permettent d’élaborer des remèdes artificiels homéopathiques et phytothérapiques. Ils favorisent et accélèrent l’auto-guérison et sont efficaces pour lutter contre de nombreux maux. Une thérapie révolutionnaire, mais sérieuse, qui a fait l’objet de nombreux tests concluants.",978-2841970674,https://m.media-amazon.com/images/I/51kFHeRBkML.jpg,TRAJECTOIRE (1 janvier 1998),Raphaël et Docteur Winsfield Dajafée,Homéopathie
A to Z Homeopathy: A Complete Course in Clinical Homeopathy,37.45,This publication exhibits a rare clarity of thinking and a precise and electric approach in explaining the complicated nuances of the difficult subject of homeopathy.,978-8131900444,https://m.media-amazon.com/images/I/81JKldlueCL._SY522_.jpg,B Jain Publishers Pvt Ltd; Large Print édition (21 novembre 2023),Jayasuriya Anto,Homéopathie
Encyclopedia Of Herbal Medicine: 550 Herbs and Remedies for Common Ailments,6.32,"If you&#39re in search of natural remedies for common ailments, this comprehensive guide has over 550 healing herbs to promote health and well-being.

Invite mother nature into your garden! Learn how to cultivate, harvest and make your own treatments with this definitive reference book for medicinal plants.

From ginger to lavender and thyme, and even the little dandelion - This book is a complete encyclopedia of herbs and plants and their healing properties. Learn about the chemistry of the plants and how they act as a medicine. Create alternative treatments for nearly 200 common health concerns in the comfort of your home.

Treat yourself with the most natural medicine and become your own herbalist. The helpful instructions are easy to follow so you can start your own medicinal garden with the best know-how. Create the ideal habitat for planting, practise careful cultivation, and know the best time to harvest.

The well thought out format of the book means you can look up information by plant names or by ailments. There are 550 essential herbs with a beautiful photographic plant index discussing their different uses. Learn how to safely and effectively process the correct parts of the plants to encourage holistic and healthy healing.",978-0241229446,https://m.media-amazon.com/images/I/91RZrutj+lL._SY522_.jpg,DK; 1er édition (1 juillet 2016),Andrew Chevallier,Homéopathie
Dr Barbara Bible: 10 in 1: The Most Complete Encyclopedia to Treat Any Disease by Harnessing the Power of Barbara O’Neill’s Natural Remedies,11.71,"Begin your fascinating journey in Dr. Barbara’s Magical Wisdom!
Have you ever been drawn into O&#39Neill&#39s teachings about natural remedies and holistic wellness?
Does her way of using natural remedies to enhance health and well-being align with your own beliefs?
In a world where traditional medical approaches frequently fall short and dependence on pharmaceuticals comes with many negative side effects, it’s time to make a choice.
This 10 books in 1 bible with more than 800 of the most effective natural remedies for the most common ailments, it’s the largest Encyclopedia inspired by Barbara O&#39Neill that has ever been created.",979-8323373123,https://m.media-amazon.com/images/I/61u-MHF7ZLL._SY522_.jpg,Independently published (19 avril 2024),Sarah Jones,Homéopathie
"Anamnèse Naturopathie fiches patients: Anamnèses et Bilans/ Carnet se suivi pour naturopathe et thérapeutes/ Bilan de santé, alimentaire et vitalité de votre patient/ Grand format A4 21 x 29,7cm",15.31,"Anamnèse Naturopathie
Mise à jour Septembre 2021 Contenu Enrichi!
Une Consultation de naturopathie ou tout autre domaine doit avant tout être structurée et bien conçue.
Pour vous faire gagner du temps et vous concentrez sur vos patients, ce carnet est spécialement conçu pour vos consultations de naturopathie. Il vous permettra de faire le Bilan et l&#39Anamnèse de votre patient lors de sa première visite au sein de votre cabinet. Vous retrouverez: son identité, son bilan de santé, son bilan vitalité et alimentaire.
Ce carnet contient:
Un sommaire",979-8588652612,https://m.media-amazon.com/images/I/71rAy4laOJL._SY522_.jpg,Independently published (30 décembre 2020),leïlla&#39s Editions,Homéopathie
Homéopathie et Parkinson,19.66,"La maladie de Parkinson est souvent traitée en tant que telle, en oubliant complètement le parkinsonien, le confort du malade. Dans ce livre, l’auteur démontre les différentes origines du syndrome parkinsonien (traumatiques, toxiques, iatrogéniques ou simplement alimentaires). Après un bref rappel des signes de la maladie de Parkinson ainsi que des traitements traditionnels allopathiques, vous trouverez un panorama toxicologique qui vous permettra de mieux comprendre certains traitements homéopathiques spécifiques à la maladie de Parkinson. ﻿L’homéopathe au service du malade parkinsonien ! 4 millions de malades recensés dans le monde ! Dans ce livre, est ensuite expliqué le mode d’action de certains médicaments à usage homéopathique conforté par des travaux (repris en bibliographie) ou résultats de travaux scientifiques que l’auteur a pu réaliser avec le concours d’autres groupes INSERM et universitaires. Nous découvrirons aussi les pathogénésies de certains médicaments homéopathiques de la maladie de Parkinson et du parkinsonien, complétées par quelques exemples de médicaments homéopathiques de terrain ; l’auteur n’oublie cependant de mentionner l’expérience de spécialistes neurologues aussi bien que celle de ses confrères homéopathes. Albert-Claude Quemoun est pharmacien, enseignant chargé de cours à la faculté de Médecine de Paris XIII, fondateur du laboratoire scientifique homéopathique Rocal, Président de l’IHS (Institut Homéopathique Scientifique) et Vice-président de la Société Française d’Homéopathie. Il a reçu le 10 avril 2010 le prix de recherche PRIM (Paris) pour l’ensemble de ses travaux scientifiques.",978-2874340505,https://m.media-amazon.com/images/I/51ARsdXa2SL._SY522_.jpg,M PIETTEUR (3 juin 2010),Albert-Claude Quemoun,Homéopathie
"La bible Homéopathique: Le livre de référence pour se soigner naturellement, guérir tout les maux de la famille et vivre plus sainement au quotidien I Plus de 100 remèdes pour tout les tracas !",16.32,"Découvrez comment vous guérir facilement à la maison avec plus de 100 remèdes !

Et si, au lieu d’une attente longue et coûteuse chez le médecin, vous pouviez vous soigner, vous et votre famille, à la maison, de manière sûre et efficace, pour des maladies courantes telles que le rhume, les infections, les otites et même les intoxications alimentaires ? Si c’est ce que vous recherchez, alors ce livre est fait pour vous !

Qui n’a jamais souffert d’un mauvais rhume ou d’une horrible grippe à l’étranger ? Rien ne peut plus gâcher des vacances que d’être coincé dans une chambre d’hôtel loin de chez soi, en train de vomir. Mais si vous savez comment utiliser efficacement et en toute sécurité ces",979-8429097732,https://m.media-amazon.com/images/I/611fxpXWBwL._SY522_.jpg,Independently published (8 mars 2022),Hervé Larrant,Homéopathie
"La bible Homéopathique: Le livre de référence pour se soigner naturellement, guérir tout les maux de la famille et vivre plus sainement au quotidien I Plus de 100 remèdes pour tout les tracas !",15.93,"Découvrez comment vous guérir facilement à la maison avec plus de 100 remèdes !

Et si, au lieu d’une attente longue et coûteuse chez le médecin, vous pouviez vous soigner, vous et votre famille, à la maison, de manière sûre et efficace, pour des maladies courantes telles que le rhume, les infections, les otites et même les intoxications alimentaires ? Si c’est ce que vous recherchez, alors ce livre est fait pour vous !

Qui n’a jamais souffert d’un mauvais rhume ou d’une horrible grippe à l’étranger ? Rien ne peut plus gâcher des vacances que d’être coincé dans une chambre d’hôtel loin de chez soi, en train de vomir. Mais si vous savez comment utiliser efficacement et en toute sécurité ces",979-8429097732,https://m.media-amazon.com/images/I/611fxpXWBwL._SY522_.jpg,Independently published (8 mars 2022),Hervé Larrant,Homéopathie
