Nom,Prix,Description,Isbn,Photo,Editeur,Auteur,Categorie
Les nouveaux guérisseurs magnétiseurs: 117 intentions de guérison non-religieuses pour soigner !,9.9,"Chers collègues,

Nous sommes nombreux à croire que les énergies naturelles peuvent être utilisées pour soulager les douleurs et guérir les maux de nos patients. En tant que praticiens et praticiennes expérimentés, vous connaissez déjà les passes et techniques de magnétisme. Vous savez également capter et canaliser les énergies, et vous utilisez certainement les intentions de guérison.

Ce livre est donc destiné à celles et ceux qui ont déjà une connaissance pratique des énergies naturelles et cherchant à améliorer leur pratique, en utilisant des intentions de guérison non-religieuses. En effet, bon nombre d&#39entre vous ont parfois du mal ou ressentent un malaise avec les prières de guérison à consonance religieuse.

Pourtant, les prières d&#39intentions sont des outils supplémentaires très puissants pour le renforcement et l&#39aide à la guérison.

Ce livre n&#39a donc pas pour objectif d&#39apprendre les",979-8379390686,https://m.media-amazon.com/images/I/71segkeU7nL._SY522_.jpg,Independently published (1 mars 2023),Gérard Bissman,Guerison
