Nom,Prix,Description,Isbn,Photo,Editeur,Auteur
AFFIRMATIONS POSITIVES: 1000+ Affirmations pour reformater le cerveau et booster l'estime de soi. Le moyen le plus rapide de développer la pensée positive et d'attirer tout ce que vous voulez.,14.17,"Nouveau : Version audio incluse avec la version brochée !

Vous êtes fatigué(e)s de la façon dont votre vie se déroule.
Vous aimeriez avoir un meilleur emploi, plus d'argent, être en meilleure santé et avoir de meilleures relations, mais peu importe les efforts que vous déployez, vous n'obtenez jamais les résultats escomptés. Vous avez entendu parler du pouvoir des affirmations positives, mais vous ne savez pas à quel point elles peuvent vous aider à améliorer votre vie.",979-8783077180,https://m.media-amazon.com/images/I/61InZNF2eUL._SY522_.jpg,Independently published (30 septembre 2022),Health and Wealth
Vaincre l'HYPERPHAGIE: Le Pouvoir de l'Hypnose et de l'Auto-Coaching,19.35,"Reprenez le contrôle de votre vie !
""Vaincre l'Hyperphagie : Le Pouvoir de l'Hypnose et de l'Auto-Coaching"" est un guide simple et pratique destiné à toute personne cherchant à surmonter les défis de l'hyperphagie. Cet ouvrage combine des techniques éprouvées d'hypnose avec des stratégies d'auto-coaching, offrant une approche holistique pour contrôler les pulsions alimentaires et recréer des habitudes alimentaires saines.
Retrouvez bien-être mental et physique : Découvrez comment l'hypnose pour l’hyperphagie peut transformer votre rapport à la nourriture, réguler votre appétit. Apprenez à concevoir vos séances, devenez autonome avec l’auto-hypnose expliquée dans ce livre.",979-8868238963,https://m.media-amazon.com/images/I/51fya0XMTRL._SY522_.jpg,Independently published (20 novembre 2023),Jean-Philippe Chéru
The Crystal Healing Book,5.34,"Judy Hall, author of the bestselling ""Crystal Bible,"" offers us a fresh way of looking at 12 master healing crystals in this key to opening your higher awareness.",978-1841812601,https://m.media-amazon.com/images/I/61AhLW2N06L._SY522_.jpg,Godsfield Press (15 juillet 2005),Judy Hall
"Se reconnecter aux saisons: Naturopathie, sophrologie, psychologie...une approche holistique du bien-être",22.9,"Laissez-vous porter par l'éclosion du printemps, le rayonnement de l'été, les couleurs de l'automne et la douceur de l'hiver.

La cadence trépidante de vos vies, le calendrier scolaire ou professionnel, les activités diverses et variées vous ont déconnecté du rythme, cyclique, de la nature ? Vous vous sentez perdu, pas vraiment aligné, vos idées sont confuses et vous avez l’impression de vivre à côté de votre corps, à côté de vous-même ? Ce bel ouvrage vous invite à intégrer la dynamique propre à chaque saison et ainsi à rééquilibrer votre vie. En vous reconnectant aux saisons, vous prendrez conscience que chacune d’entre elles est un cadeau que vous offre la nature, une occasion d’avancer sur votre chemin d’évolution, dans quatre univers différents, en respectant le cycle naturel de toutes choses. Un portrait complet du printemps, de l’été, de l’automne puis de l’hiver vous est présenté : les grands rendez-vous, les organes dont il faut prendre soin, l’alimentation à privilégier, les huiles essentielles, plantes aromatiques et fleurs de Bach à avoir dans son panier, l’état d’esprit induit par la saison en question, les exercices physiques et les activités qui vous permettront de vivre en lien avec le cycle de la nature… L’autrice vous confie tous ses secrets pour bien vivre chaque saison grâce à la naturopathie, la sophrologie, le yoga, la méditation, la médecine chinoise ou encore la psychologie. Laissez-vous porter par l’éclosion du printemps, le rayonnement de l’été, les couleurs de l’automne et la douceur de l’hiver ! ",978-2889534371,https://m.media-amazon.com/images/I/91jWojp4uML._SY522_.jpg,JOUVENCE; Illustrated édition (23 février 2021),Sabrina Romeo-Dussard
Médecine énergétique : Éveiller le guérisseur en vous,21.2,"Vous êtes un treillis d’énergies. Explorez et canalisez ces énergies pour votre santé et votre bien-être et vous constaterez à quel point les énergies dynamiques qui circulent en vous révèlent d’une façon extraordinaire le génie créateur de la nature. Ce livre est conçu pour vous permettre de développer votre pouvoir. Le corps veut guérir, et chaque cellule possède une intelligence et une force extraordinaires. Broché 18 x 23,5 - 408 pages - Abondamment illustré",978-2920987999,https://m.media-amazon.com/images/I/61U3UcdmHWL._SY522_.jpg,ARIANE (16 juin 2005),Donna Eden
"La méditation du guerrier: Le secret le mieux gardé du développement personnel, du perfectionnement cognitif et de la lutte contre le stress, enseigné par un maître dans quatre arts samouraïs",15.18,"Découvrez la forme de méditation originale, instinctive et non religieuse qui s’est perdue au fil du temps. Richard L. Haight, auteur primé de The Unbound Soul et maître de quatre arts martiaux samouraïs, partage le secret le mieux gardé au monde dans les domaines du développement personnel, du perfectionnement cognitif et du soulagement du stress, qu’il appelle la méditation du guerrier.
Pour tous les milieux, genres et âges.
Pour vous faire une représentation mentale de la méditation du guerrier, imaginez un champ de bataille sur lequel se trouve un seul samouraï entouré de multiples adversaires. L’attention d’un débutant passerait sans arrêt d’un adversaire à l’autre dans une tentative anxieuse de se défendre. Une telle stratégie fatigue rapidement le guerrier, qui sera vaincu. Un guerrier expérimenté repartira son attention de manière égale dans toutes les directions, mais il éprouvera quand même de l’anxiété pendant qu’il prépare mentalement ses tactiques. Ses pensées et son anxiété peuvent être sa perte si ses adversaires sont très habiles. L’attention d’un maître, comme celle de l’expert est répartie de manière égale, mais il demeure calme, il ne possède pas de plan d’action, son corps effectue les actions adéquates selon les besoins du moment.",978-1532333927,https://m.media-amazon.com/images/I/71dI5vYQX3L._SY522_.jpg,Independently Published (12 février 2020),Richard L Haight
,7.47,,,,,
Le Décodage dentaire - Comprendre le sens de nos problèmes de dents - ABC,11.68,"Savez-vous que vos dents entretiennent des liens avec votre inconscient ? C'est ce que vous dévoile cet ouvrage. Le décodage dentaire s'appuie sur le transgénérationnel, les charges émotionnelles refoulées ainsi que l'insconscient personnel et collectif pour donner un sens à la douleur, à la perte d'une dent, à une malposition, et même aux maladies parodontales ou aux aphtes. Car le décodage dentaire offre l'accès à l'identité vivante de l'individu ! Ce livre, écrit après plus de quatorze années de pratique, vous présente une lecture psychologique et symbolique de chaque dent afin d'expliquer certaines de leurs pathologies autrement qu'en vous culpabilisant. Car vous découvrirez qu'une carie n'est pas forcément la conséquence d'un mauvais brossage des dents ! Véritable grille de lecture de la psyché humaine, le décodage dentaire est un outil incomparable de rencontre et de connaissance de soi.",978-2733913307,https://m.media-amazon.com/images/I/51OlzOCDcXL._SY522_.jpg,GRANCHER; Illustrated édition (31 mars 2015),Christian Beyer
Anatomy of Voice: How to Enhance and Project Your Best Voice,8.72,"An illustrated guide to the dynamic physiological structures that create and individualize the voice

• Explores the structures of the vocal tract and their functional relationships to the entire musculoskeletal system with detailed drawings

• Examines the components of the larynx and pharynx, the effects of muscular tensions on the vocal cords, the importance of skeletal alignment, and the complex roles of the diaphragm, soft palate, lips, and tongue in vocalization

• Provides exercises and techniques for increased air flow, correct posture, proper tongue position, jaw relaxation, and toning of the soft palate to improve the voice

When we use the voice, we involve the entire body. Our internal balance, muscular tone, skeletal alignments, soft tissue flexibility, and even our eye movements are reflected in the voice we project to our audience, whether one person or thousands.

Using the signature anatomical style of Blandine Calais-Germain’s groundbreaking book",978-1620554197,https://m.media-amazon.com/images/I/71tcmEnrfhL._SY522_.jpg,Healing Arts Press; Reprint édition (1 janvier 2016),Blandine Calais-Germain
"La maladie cherche à me guérir, tome 2",5.56,Philippe Dransart consacre ce deuxième tome à nous faire réfléchir sur le pourquoi de la souffrance et comment mieux la comprendre afin de s'en libérer. Notre vie est-t'elle la répétition d'une douloureuse mémoire ou le rythme d'un désir caché qui n'a de cesse de nous en libérer ? Broché 14 x 22 - 238 pages,978-2913826182,https://m.media-amazon.com/images/I/41ud22OeiAL._SY522_.jpg,Le Mercure Dauphinois (27 février 1998),Docteur Philippe Dransart
"Aujourd'hui je danse enfin avec la vie !: Comment se libérer de nos croyances limitantes, avoir confiance en soi, et en finir avec le stress, ... (16 Bonus audio : Méditation, Hypnose - EFT)",15.43,"Aujourd’hui je danse enfin avec la vie !
Comment se libérer de nos croyances limitantes, avoir confiance en soi, et en finir avec le stress, l’anxiété et l’angoisse
⬇️⬇️⬇️
Ce livre, je l’ai écrit suite à une période de vie particulièrement douloureuse : stress post-traumatique, angoisses, anxiété généralisée, crises de panique jusqu’à la phobie d’impulsion. Je pensais que cette fois-ci, je ne me relèverais pas. Mais à ce moment-là, je n’avais pas conscience de la force de vie qui m’habitait. Aujourd’hui, je reprends mon pouvoir. Je m’autorise, de plus en plus, à être qui je suis.

Nous avons le droit d’être qui nous sommes, sans culpabilité, sans honte. Nous avons le droit d’être imparfait(e), vulnérable, et d’exprimer nos émotions. Crise d’angoisse, anxiété, burn-out, dépression, peu importe la période de vie que vous avez vécue ou que vous vivez. Comme dirait mon ami et mentor, François Lemay, nous ne sommes pas brisés, tout change tout le temps.

Et si ces phases étaient parfaites pour nous libérer et nous apprendre à danser avec la vie ? Si j’ai pu le faire, vous le pouvez aussi. Dans ce livre, je vous transmets toutes mes connaissances, mon expérience et de nombreux exercices pour vous aider à maîtriser ces enseignements.

J’ai à cœur de vous donner le maximum pour vous aider à vous libérer de vos croyances limitantes, de vos peurs, vos angoisses, de ces pensées anxiogènes qui sabotent qui vous êtes profondément. Je veux vous aider à créer la vie que vous souhaitez vraiment, celle qui fait briller vos yeux.",978-2958572907,https://m.media-amazon.com/images/I/61lclRoHEBL._SY522_.jpg,Terre Happy Zzzen Editions (19 novembre 2022),Manuela Rossell
"Racines familiales de la ""mal a dit""",19.0,"L'auteur nous démontre d'une part que la maladie est la solution biologique de survie du cerveau inconscient ; d'autre part que la maladie est un nouvel organe, zone de décharge d'un stress familial dans une traduction biologique. Elle cherche à résoudre un conflit précis vécu dans l'histoire des parents. Ce manifesté est le résultat d'un deuil non fait dans le vécu-ressenti d'un des parents et cette solution vient libérer le champ émotionnel de cette mémoire familiale. Chaque vie est la réparation, la sacralisation de la saga familiale. À travers ce labyrinthe de l'inconscient, Joseph utilise comme fil d'Ariane la biologie, c'est-à-dire les mécanismes physiologiques de chaque fonction cellulaire. Il permet ainsi à chacun de devenir lecteur créatif d'un texte particulier, celui de son existence.",978-2951846302,https://m.media-amazon.com/images/I/715M5lCWdJL._SY522_.jpg,Pictorus (30 novembre 2002),Gérard Athias
Écoute ton corps: L'argent et l'abondance,15.83,"Après son best-seller Écoute ton corps, qui a permis à des millions de personnes d'améliorer leur qualité de vie, Lise Bourbeau, pionnière du développement personnel, a donné des conférences, animé des ateliers dans le monde entier, et elle a reçu de nombreux courriers de lecteurs. Dans ce nouvel opus, elle répond à toutes les questions que vous pouvez vous poser au sujet de l'argent et de l'abondance dans votre vie. D'où vient la peur de manquer d'argent ? - Comment éviter le surendettement et la faillite ? - Qu'est-ce qui empêche l'abondance ? - Est-ce qu'il vaut mieux être dispendieux ou proche de ses sous ? - Comment ne plus manquer d'argent à chaque fin de mois ? - Pourquoi est-ce que mes amis me demandent toujours de l'argent ?",978-2290223222,https://m.media-amazon.com/images/I/51pmwTAS0nL._SY522_.jpg,J'AI LU (20 avril 2022),Lise Bourbeau
DIS-MOI OU TU AS MAL (Ed.2018): Les cris du corps sont des messages de l'âme. Eléments de psycho-énergétique,18.87,"600 000 exemplaires vendus - Un livre culte.
« Pour la médecine orientale, la maladie témoigne d'un obstacle à la réalisation du Chemin de Vie. La conscience exprime ainsi par des troubles énergétiques générateurs de maladie les entraves à son plein épanouissement. Il paraît donc logique de comprendre les mécanismes psychoénergétiques qui sous-tendent la maladie afin de retrouver l'état de santé.
À ce titre, ce livre représente un parfait manuel pratique à l'usage de tous ceux qui cherchent les clés afin de décoder le langage du corps. À sa lecture, peut-être apprendrons-nous alors à ne plus voir la maladie comme le fait du hasard ou de la fatalité, mais comme un message de notre conscience, de notre être intérieur. Peut-être serons-nous capables de découvrir derrière telle souffrance une maladie 'créatrice', un moyen de progression dans notre évolution.",978-2226439260,https://m.media-amazon.com/images/I/81sXLNLvqcL._SY522_.jpg,ALBIN MICHEL; Illustrated - Enlarged édition (31 octobre 2018),Michel Odoul
Herbal Antibiotics: What BIG Pharma Doesn’t Want You to Know - How to Pick and Use the 45 Most Powerful Herbal Antibiotics for Overcoming Any Ailment,17.47,"Boost Your Immune System with Nature’s Bounty!
Herbal antibiotics have been used throughout the centuries as natural treatments for hundreds of diseases and ailments, including wisdom teeth extraction, broken bones and even surgery—and like 98% of Americans, you’ve probably taken a course of synthetic antibiotics to help you recover.
While there’s nothing wrong with synthetic antibiotics, BIG Pharma’s running scared of the natural alternative to their expensive drugs (and profits)—while you can utilize natural remedies that leave less impact on the environment and your internal body chemistry.",978-1545334904,https://m.media-amazon.com/images/I/61Qtymjt5yL._SY522_.jpg,CreateSpace Independent Publishing Platform (12 avril 2017),Mary Jones
Bien choisir ses probiotiques : le guide pratique,19.74,"Bien choisir ses probiotiques : le guide pratique est destiné au grand public et se base entièrement sur les conclusions d’études scientifiques récentes. Ce qui en fait un travail de synthèse unique en son genre.
A travers cet ouvrage, vous trouverez des dizaines de pathologies pour lesquelles la prise de probiotiques a un intérêt. Se voulant avant tout pratique, ce guide vous propose, en fonction de la pathologie, la ou les souches probiotiques les plus recommandées ; ainsi que le dosage et la durée les plus appropriés pour potentialiser les effets sur votre santé.
Concis et rigoureux, ce livre vous permettra de tirer les plus grands bénéfices des probiotiques pour votre santé.

Titulaire d’un doctorat en médecine générale,",979-8851519161,https://m.media-amazon.com/images/I/61Gf-6CVjvL._SY522_.jpg,Independently published (14 juillet 2023),Benoit AKPEMADO
La détox holistique: Au-delà de l'alimentation une détox sur nos 7 plans d'existence,12.46,"Poisons, xénobiotiques, polluants invisibles, nous sommes aujourd'hui confrontés à mille et une nouvelles surcharges, encore ignorées il y a peu. Et si une lecture globale de l'humain pouvait répondre aux troubles liés à ces innombrables pollutions sur les plans physique, énergétique, émotionnel, mental, socioculturel, environnemental et spirituel ? br/ br/ Chacun de ces sept plans est intimement lié aux autres et possède sa propre physiologie, ses carences, ses surcharges et ses émonctoires spécifiques. Si, sur le plan physique, la cure de détox traditionnelle n'est aujourd'hui plus à démontrer, Daniel Kieffer prouve ici qu'il est possible de calquer la stratégie de détox du plan physique sur tous les autres plans. br/ br/ Un livre à la fois pédagogique, concis et pratique, pour vous aider à faire bon usage, au quotidien, des solutions naturopathiques et procéder à une véritable détox holistique ! br/ br/",978-2889532018,https://m.media-amazon.com/images/I/81IyhidOdpL._SY522_.jpg,JOUVENCE (12 juin 2019),Daniel Kieffer
GÉRER SON STRESS : Retrouvez l'Équilibre grâce à la Méthode OGS: Lutter contre le Stress | Stress Anxiété Angoisse | Gestion du stress,16.6,"GÉRER SON STRESS : Retrouvez l'Équilibre grâce à la Méthode OGS
1️⃣ Vous sentez-vous souvent submergé par le stress au quotidien ?
2️⃣ Êtes-vous à la recherche d'un guide efficace pour vous aider à surmonter le stress dans votre vie ?
3️⃣ Êtes-vous prêt à prendre en main votre bien-être émotionnel ?
Et si la Méthode OGS vous offrait une façon d'appréhender durablement le stress et de mieux le gérer ?
Fini les journées épuisantes et les nuits agitées ! Dans ce livre percutant, je vous présente une approche novatrice, la ""Méthode OGS"", qui repose sur 3 étapes essentielles basées sur la compréhension émotionnelle et la sérénité intérieure, pour enfin mettre le stress derrière",979-8860528642,https://m.media-amazon.com/images/I/61mXMalkLCL._SY522_.jpg,Independently published (8 septembre 2023),Marie Russo
Fleurs de Bach et lithothérapie pour les animaux,8.42,"Associez les fleurs de Bach aux élixirs minéraux pour la santé émotionnelle de vos compagnons.
Aidez-les à résoudre en douceur leurs troubles du comportement.
Les animaux sont des membres chéris de nos familles. Avec Les fleurs de Bach et Lithothérapie pour les animaux, plongez dans l’univers thérapeutique des élixirs floraux et minéraux. Découvrez comment ces approches naturelles peuvent améliorer la santé émotionnelle et le bien-être de vos compagnons.

Les fleurs de Bach et leurs propriétés vibratoires équilibrantes aident nos animaux à surmonter les défis du quotidien (peurs, anxiété, troubles du comportement, transitions difficiles…). Sur le même principe de résonance, l’énergie vibratoire des",979-8321104514,https://m.media-amazon.com/images/I/61H5Dl4EV5L._SY522_.jpg,Independently published (29 mars 2024),Stabby Lo Editions Collection Animalis
LES SECRETS DE LA SONOTHERAPIE: Un guide du son vers le bien-être,5.57,"Découvrez l'univers fascinant de la sonothérapie avec ce livre exhaustif et accessible. Couvrant l'histoire et les principes fondamentaux de la sonothérapie, ce guide vous offre une explication approfondie de cette pratique ancienne, dévoilant comment et pourquoi elle influence positivement notre bien-être.
Le livre met en lumière les bienfaits concrets de la sonothérapie, allant de la réduction du stress à l'amélioration du sommeil, en passant par son impact sur notre santé physique et mentale. Il explore également une gamme étendue d'instruments spécifiques utilisés en sonothérapie, comme les bols tibétains, les flûtes amérindiennes, et les diapasons thérapeutiques, détaillant leur rôle unique dans la création d'harmonies thérapeutiques.",978-2959035906,https://m.media-amazon.com/images/I/619OW7DXdcL._SY522_.jpg,,Mr Jean-Marc LE PREGASSIN
Médecin des trois corps,8.2,"Qui sont ces guérisseurs philippins qui, d'un tour de main, enlèvent un appendice sans laisser de cicatrice ? D'où viennent ces fragments de chair qu'ils extirpent prestement des entrailles de leurs patients ébahis ? Charlatanisme ou science authentique ? Après la mort de sa mère et la crise qui s'ensuivit, l'auteur, médecin anesthésiste à l'hôpital parisien Broussais, découvre d'autres médecines et se rend à Manille pour suivre l'enseignement d'un célèbre guérisseur, Tony Agpaoa. Le savoir exceptionnel des guérisseurs philippins permettra à Janine Fontaine d'accéder à une réalité invisible. Après une éprouvante initiation, elle observera l'existence de trois corps : physique, énergétique et spirituel. Un plaidoyer troublant pour une médecine globale.",978-2290348277,https://m.media-amazon.com/images/I/61Rg1iIRW1L._SY522_.jpg,J'ai lu (24 mai 2005),Janine Fontaine
"La méditation du guerrier: Le secret le mieux gardé du développement personnel, du perfectionnement cognitif et de la lutte contre le stress, enseigné par un maître dans quatre arts samouraïs",6.97,"Découvrez la forme de méditation originale, instinctive et non religieuse qui s’est perdue au fil du temps. Richard L. Haight, auteur primé de The Unbound Soul et maître de quatre arts martiaux samouraïs, partage le secret le mieux gardé au monde dans les domaines du développement personnel, du perfectionnement cognitif et du soulagement du stress, qu’il appelle la méditation du guerrier.
Pour tous les milieux, genres et âges.
Pour vous faire une représentation mentale de la méditation du guerrier, imaginez un champ de bataille sur lequel se trouve un seul samouraï entouré de multiples adversaires. L’attention d’un débutant passerait sans arrêt d’un adversaire à l’autre dans une tentative anxieuse de se défendre. Une telle stratégie fatigue rapidement le guerrier, qui sera vaincu. Un guerrier expérimenté repartira son attention de manière égale dans toutes les directions, mais il éprouvera quand même de l’anxiété pendant qu’il prépare mentalement ses tactiques. Ses pensées et son anxiété peuvent être sa perte si ses adversaires sont très habiles. L’attention d’un maître, comme celle de l’expert est répartie de manière égale, mais il demeure calme, il ne possède pas de plan d’action, son corps effectue les actions adéquates selon les besoins du moment.",978-1532333927,https://m.media-amazon.com/images/I/71dI5vYQX3L._SY522_.jpg,Independently Published (12 février 2020),Richard L Haight
"Myths, Miracles, and Truth: A Beginners Guide to Learning Homeopathy",8.05,"Making Homeopathy Make Sense!
Open this book, and homeopathy comes to life! Inside is an entire course designed for anyone who wants to learn about homeopathy but needs help figuring out where to start. This book is more than just some text on a page. It is a complete course with videos, quizzes, reference materials, and free lifetime access to our advanced remedy picker software - an app designed to help people pick the perfect remedy for optimal health outcomes.
Get ready to explore homeopathy's history, discover how it has evolved, and what makes it work. Learn the basics, explore the vocabulary, and determine how to pick the best remedy for each specific health problem. Get healthy with homeopathy; holistic care can produce impressive results. Everything required to get started with homeopathy is inside this book.",979-8874142605,https://m.media-amazon.com/images/I/61g6DnvXWCL._SY522_.jpg,Independently published (7 février 2024),Glynis A. Kennedy
Racines familiales de la mal a dit Tome 3,14.94,"C’est toujours en compagnie de Joseph, que l’auteur nous propose de poursuivre ses recherches sur la compréhension de la maladie. Joseph nous conduit cette fois dans différentes traditions comme la Kabbale et le Bouddhisme et fait un parallèle avec la biologie. Cette lecture des textes sacrés nous donne un mode d’emploi pour la compréhension des maladies, non plus dans notre histoire familiale mais plutôt dans notre histoire personnelle, afin de nous responsabiliser dans nos actes. Les portes d’entrée restent multiples : l’étymologie, le ressenti cellulaire et les lois biologiques, le but recherché étant de trouver l’Unité. La quête de Joseph vers L’homme éveillé passe par la biologie et la compréhension du sens de la maladie, afin d’échapper à la souffrance familiale. En effet, l’homme se croit entravé par ses conflits, dans un fatal enchaînement généalogique. Par différents chemins comme celui du sens de la maladie, Joseph nous propose de nous mener vers la délivrance en comprenant et en sortant des conditionnements familiaux. L’essentiel pour Joseph, n’est pas ce qui est enseigné, mais la libération et l’éveil qui sont proposés. Gérard Athias, docteur en médecine, travaille depuis plus de quinze ans sur l’interprétation des maladies.",978-2952514774,https://m.media-amazon.com/images/I/71+Vt75HaVL._SY522_.jpg,PICTORUS (10 juin 2010),Gérard Athias
