Nom,Prix,Description,Isbn,Photo,Editeur,Auteur
The New Scramble for Africa,14.37,"Once marginalized in the world economy, Africa today is a major global supplier of crucial raw materials like oil, uranium and coltan. China's part in this story has loomed particularly large in recent years, and the American military footprint on the continent has also expanded. But a new scramble for resources, markets and territory is now taking place in Africa involving not just state, but non state-actors, including Islamic fundamentalist and other rebel groups.
The second edition of Pádraig Carmody's popular book explores the dynamics of the new scramble for African resources, markets, and territory and the impact of current investment and competition on people, the environment, and political and economic development on the continent. Fully revised and updated throughout, its chapters explore old and new economic power interests in Africa; oil, minerals, timber, biofuels, land, food and fisheries; and the nature and impacts of Asian and South African investment in manufacturing and other sectors.",978-1509507078,https://m.media-amazon.com/images/I/61JpIYLnrCL._SY522_.jpg,Polity Press; 2e édition (23 septembre 2016),Padraig R. Carmody
Discrimination and Disparities,29.02,"Economic and other outcomes differ vastly among individuals, groups, and nations. Many explanations have been offered for the differences. Some believe that those with less fortunate outcomes are victims of genetics. Others believe that those who are less fortunate are victims of the more fortunate.

Discrimination and Disparities gathers a wide array of empirical evidence to challenge the idea that different economic outcomes can be explained by any one factor, be it discrimination, exploitation, or genetics. This revised and enlarged edition also analyzes the human consequences of the prevailing social vision of these disparities and the policies based on that vision--from educational disasters to widespread crime and violence.",978-1541645639,https://m.media-amazon.com/images/I/61gZID7H43L._SY522_.jpg,Basic Books; Enlarged édition (25 août 2022),Thomas Sowell
Wild Ride: A Short History of the Opening and Closing of the Chinese Economy,18.23,"How did China grow from an impoverished country to become the second largest economy in the world in just over four decades? And how did this economic miracle come to an end, as seems the case today?
To understand the story of China's rapid rise and equally rapid fall, author Anne Stevenson-Yang takes us back to the beginning, when Deng Xiaoping took over and opened its moribund economy to Western money and know-how. Stevenson-Yang, who lived and worked in China for a quarter of a century, traces each decade of China's tumultuous development, from the roaring 1980s to today's malaise.
In her first-hand account, Wild Ride, Stevenson-Yang concludes that China is returning to the poverty and isolation of the Mao era. What happened to the promise of the political change that would come with the opening of the economy? And the institutional reforms of the last four decades?",978-1739424312,https://m.media-amazon.com/images/I/51d1Lz5InOL._SY522_.jpg,BUI JONES Limited (11 janvier 2024),Anne Stevenson-Yang
Capital in the Twenty-first Century,9.54,"A New York Times #1 Bestseller
An Amazon #1 Bestseller
A Wall Street Journal #1 Bestseller
A USA Today Bestseller
A Sunday Times Bestseller
A Guardian Best Book of the 21st Century
Winner of the Financial Times and McKinsey Business Book of the Year Award
Winner of the British Academy Medal
Finalist, National Book Critics Circle Award
""It seems safe to say that Capital in the Twenty-First Century, the magnum opus of the French economist Thomas Piketty, will be the most important economics book of the year--and maybe of the decade.""
--Paul Krugman,",978-0674979857,https://m.media-amazon.com/images/I/61FuwnW2QeL._SY522_.jpg,The Belknap Press; Reprint édition (14 août 2017),Thomas Piketty
How Innovation Works,19.15,"‘Ridley is spot-on when it comes to the vital ingredients for success’ Sir James Dyson
Building on his bestseller The Rational Optimist, Matt Ridley chronicles the history of innovation, and how we need to change our thinking on the subject.
Innovation is the main event of the modern age, the reason we experience both dramatic improvements in our living standards and unsettling changes in our society. It is innovation that will shape the twenty-first century. Yet innovation remains a mysterious process, poorly understood by policy makers and businessmen alike.",978-0008334840,https://m.media-amazon.com/images/I/91IMhAh+hAL._SY522_.jpg,Fourth Estate Ltd; 1er édition (4 mars 2021),Matt Ridley
Segunda oportunidad,8.78,"Una guía en la cual el lector podrá comprender sobre finanzas personales y sabrá utilizar las herramientas tecnológicas de la actualidad en su beneficio.
Muchas personas tienen ideas millonarias. Confían en que su nuevo producto, servicio o innovación los hará ricos. ¿El problema? Muchas personas no saben cómo convertir su idea millonaria en millones.
Conoce a los Asesores de Padre Rico de Robert y Kim…y aprende por qué están entre sus activos más valiosos:
- Ken McElroy, Asesor en Bienes Raíces, Deuda y Recaudación de Capital
- Blair Singer, Asesor en Ventas y Formación de Equipos
- Garrett Sutton, Esq., Asesor en Protección Patrimonial y Planes de Negocios
-",978-8466356046,https://m.media-amazon.com/images/I/71TtjQV4xJL._SY522_.jpg,Debols¡llo; 001 édition (8 juillet 2021),Robert T. Kiyosaki
"Development Aid: The Good, the bad and the ugly. The real story of international aid for those who are perplexed.",12.75,"Development aid affects us all in one way or another

If you want to know what does and does not work with respect to international aid, this book will provide you with some answers to questions such as these:
What are the origins of development aid?
How much money does the rich world spend on aid?
Which countries get the most aid money?
How are aid needs assessed and the resulting aid distributed?
What are the main institutions and organisations involved in aid?
How much corruption is there associated with aid?
What is likely to be the future of aid?
Based on documentary evidence, this book is a warts-and-all exposure of the politics, successes and failures of much international aid.
Written by someone who has spent a lifetime working in the aid sector, this book pulls no punches and confirms suspicions that much, if not all, of the money spent on international aid is wasted.
This book challenges the UK’s legal commitment to spend 0.7% of its gross domestic product on aid, given that so much is wasted. Today, there are more poor people on the planet than ever before, despite the billions of dollars provided by rich-country taxpayers over the past 70 years. This book tells you what went wrong.

Inside these pages, you will find various answers to some fascinating questions, as well as observations about aid and how it affects every nation.",978-1913713720,https://m.media-amazon.com/images/I/612XUiJSVML._SY522_.jpg,Compass-Publishing UK (12 novembre 2021),Charles Bevan
Grand Transitions: How the Modern World Was Made,19.4,"From one of the world's leading experts on the history of energy, a rigorous examination of the transitions that structure our modern world--and the environmental reckoning that will mark its success or failure.

What makes the modern world work? The answer to this deceptively simple question lies in four ""grand transitions"" of civilization--in populations, agriculture, energy, and economics--which have transformed the way we live.

Societies that have undergone all four transitions emerge into an era of radically different population dynamics, food surpluses (and waste), abundant energy use, and expanding economic opportunities. Simultaneously, in other parts of the world, hundreds of millions remain largely untouched by these developments.

Through erudite storytelling, Vaclav Smil investigates the fascinating and complex interactions of these transitions. He argues that the moral imperative to share modernity's benefits has become more acute with increasing economic inequality, but addressing this imbalance would make it exceedingly difficult to implement the changes necessary for the long-term preservation of the environment. Thus, managing the fifth transition--environmental changes from natural-resource depletion, biodiversity loss, and global warming--will determine the success or eventual failure of the grand transitions that have made the world we live in today.",978-0197696750,https://m.media-amazon.com/images/I/51e7DO32wJL._SY522_.jpg,Oxford University Press Inc (5 décembre 2023),Vaclav Smil
Agenda 2024 Journalier: Planificateur Journalier Grand Format A4 | 1 Page Par Jour Avec Heure ( Janvier 2024 / Décembre 2024 ) | Français,15.93,"Agenda 2024 Journalier

Dans Cet Agenda, Vous Trouverez :

✔ Planificateur journalier 365 jours, 1 jour par page

chaque page contient :
les horaires de 7 h à 22 h
Espace pour les notes
Espace Objectifs
Espace To do list
✔ Infos personnelles
✔ Le calendrier annuel de l’année 2024
✔ Le calendrier des jours fériés.
✔ Des espaces pour noter les anniversaires
✔ Des espaces pour noter ses dates importants
✔ Des espaces pour noter ses mots de passe.
✔ Des espaces pour noter ses contacts.
✔ Un espace dédié à l’emploi du temps personnel.
✔ Des pages Notes
✔ 380 pages
✔ Format A4",,https://m.media-amazon.com/images/I/31s2eZDk1PL._SY522_.jpg,Independently published (25 mai 2023),Planifie Moi Fr
The Idealist: Jeffrey Sachs and the Quest to End Poverty,10.96,"NAMED ONE OF THE BEST BOOKS OF THE YEAR BY
Bloomberg • Forbes • The Spectator

Recipient of Foreign Policy's 2013 Albie Award


In 2006, Jeffrey Sachs—celebrated economist, special advisor to the Secretary General of the United Nations, and author of the influential bestseller The End of Poverty— launched the Millennium Villages Project, a daring, $120-million experiment designed to test his theories about ending poverty. For six years, Nina Munk shadowed Sachs on his trips to Africa, listened in on conversations with heads-of-state and humanitarian organizations, and immersed herself in the lives of people in two remote African villages.  Munk came to understand the real-life issues that challenge Sachs’s formula for ending global poverty.",978-0767929424,https://m.media-amazon.com/images/I/81vCtMfX8jL._SY522_.jpg,Knopf Doubleday Publishing Group; Reprint édition (7 octobre 2014),Nina Munk
Le Prix de Demain: Pourquoi la déflation est la clef d’un futur abondant,13.21,"Les avancées technologiques se produisent plus rapidement que notre capacité à les comprendre. Dans un monde qui évolue plus vite que nous ne pouvons l’imaginer, nous ne pouvons pas nous permettre de rester immobiles. Nous devons construire un nouveau cadre de pensée pour nos économies locales et mondiales, et vite, ou la même technologie qui a le pouvoir de nous apporter l’abondance, à nous ainsi qu’à notre monde, va au contraire le détruire.

Dans ce livre qui va à contre-courant de la pensée dominante, Jeff Booth, un penseur de premier plan et PDG dans le domaine du commerce en ligne et de la technologie depuis 20 ans, décrypte les réalités technologiques et économiques qui façonnent notre présent et notre avenir. Il décrit les différents choix auxquels nous sommes confrontés pour aller de l’avant – une situation potentiellement alarmante, mais profondément encourageante.

Jeff Booth propose une thèse fascinante fondée sur l’impact déflationniste du progrès technologique couplé à la facilité croissante du crédit. De manière audacieuse et fidèle à sa nature d’entrepreneur, il conclut son analyse par un appel à l’action. Les chefs d’entreprise, les entrepreneurs, les décideurs politiques et les jeunes qui s’engagent à œuvrer pour un avenir meilleur devraient lire ce livre.",978-9916697436,https://m.media-amazon.com/images/I/51W3s5nYlYL._SY522_.jpg,Konsensus Network (28 juillet 2022),Jeff Booth
"Le Sanglot de l'homme blanc: Tiers-monde, culpabilité, haine de soi",8.5,"Pascal Bruckner s’attaque avec vigueur au malaise qui consume les sociétés occidentales : le « tiers-mondisme » qui repose surtout, derrière la solidarité affichée, sur la haine de soi. Cette idéologie oppose un Sud radieux, peuplé d’agneaux et de martyrs, à un Nord rapace, habité de loups et de nantis. Une vision trop simpliste et culpabilisante qui trouve ici un lumineux contrepoint.
Né en 1948, Pascal Bruckner a écrit de nombreux romans et essais, dont La Tentation de l’innocence (prix Médicis de l’essai 1995) et Les Voleurs de beauté (prix Renaudot 1997). Il est également l’auteur de Lunes de fiel et co-auteur de La Plus Belle Histoire de l’amour, disponibles en Points.
« Un styliste qui cogne, un puncheur qui signe des pages étincelantes, servies par une culture historique et philosophique solide. »",978-2020551175,https://m.media-amazon.com/images/I/61bQkf3LcvL._SY522_.jpg,Seuil (3 avril 2002),Pascal Bruckner
Left Behind: Latin America and the False Promise of Populism,16.1,"The political and economic history of Latin America has been marked by great hopes and even greater disappointments. Despite abundant resources—and a history of productivity and wealth—in recent decades the region has fallen further and further behind developed nations, surpassed even by other developing economies in Southeast Asia and elsewhere.

In Left Behind, Sebastian Edwards explains why the nations of Latin America have failed to share in the fruits of globalization and forcefully highlights the dangers of the recent turn to economic populism in the region. He begins by detailing the many ways Latin American governments have stifled economic development over the years through excessive regulation, currency manipulation, and thoroughgoing corruption. He then turns to the neoliberal reforms of the early 1990s, which called for the elimination of deficits, lowering of trade barriers, and privatization of inefficient public enterprises—and which, Edwards argues, held the promise of freeing Latin America from the burdens of the past. Flawed implementation, however, meant the promised gains of globalization were never felt by the mass of citizens, and growing frustration with stalled progress has led to a resurgence of populism throughout the region, exemplified by the economic policies of Venezuela’sHugo Chávez. But such measures, Edwards warns, are a recipe for disaster; instead, he argues, the way forward for Latin America lies in further market reforms, more honestly pursued and fairly implemented. As an example of the promise of that approach, Edwards points to Latin America's giant, Brazil, which under the successful administration of President Luis Inácio da Silva (Lula) has finally begun to show signs of reaching its true economic potential.

As the global financial crisis has reminded us, the risks posed by failing economies extend far beyond their national borders. Putting Latin America back on a path toward sustained growth is crucial not just for the region but for the world, and",978-0226004662,https://m.media-amazon.com/images/I/71NhHYMgOdL._SY522_.jpg,University of Chicago Press; Reprint édition (22 octobre 2012),Sebastian Edwards
Poor Economics: The Surprising Truth about Life on Less Than $1 a Day,17.05,"FROM THE WINNERS OF THE 2019 NOBEL PRIZE IN ECONOMICS

'Refreshingly original, wonderfully insightful . . . an entirely new perspective' Guardian

Why would a man in Morocco who doesn't have enough to eat buy a television?
Why do the poorest people in India spend 7 percent of their food budget on sugar?
Does having lots of children actually make you poorer?

This eye-opening book overturns the myths about what it is like to live on very little, revealing the unexpected decisions that millions of people make every day. Looking at some of the most paradoxical aspects of life below the poverty line - why the poor need to borrow in order to save, why incentives that seem effective to us may not be for them, and why, despite being more risk-taking than high financiers, they start businesses but rarely grow them - Banerjee and Duflo offer a new understanding of the surprising way the world really works.",978-0718193669,https://m.media-amazon.com/images/I/71BhuFmXJkL._SY522_.jpg,Penguin; 1er édition (29 mars 2012),Abhijit V. Banerjee
The Cooperative Economy,10.56,"Societal grand challenges have taken a toll on humanity, which finds itself at a crossroads. The concentration of wealth and economic inequality, the dominance of Big Tech firms, the loss of privacy and free choice, and the overconsumption and abuse of natural resources have been reinforced by globalization. Regulation, legislation, international treaties, and government and corporate policies have fallen short of offering sufficient remedies. This book identifies the root cause of these problems and offers a bold solution: a new economic system, free from the design flaws that have contributed to these societal grand challenges.
The proposed cooperative economy is an ethical community-driven exchange system that relies on collective action to promote societal values while accounting for resource constraints. Unlike the modern economic system that is predominantly driven by opportunistic behavior, the cooperative economy moves away from a materialistic orientation and follows a more balanced perspective that leverages prosocial behavior. The book explains how this new system adopts design principles that promote self-sufficiency of communities, sustainability and entrepreneurship while limiting overconsumption and excessive profit-making. It enhances economic equality by leveraging price subsidization and by restricting salary differences. The book describes how the system serves the interests of consumers, vendors, and employees while preventing the accumulation of power by the platform owner who operates this system.",978-1032370651,https://m.media-amazon.com/images/I/81HmdTLVyYL._SY522_.jpg,Routledge (6 février 2023),Dovev Lavie
"La Boussole du Leader: Guide pratique pour développer: Sa communication, son charisme, son leadership, ses axes de réussite",6.53,"Être un leader c'est
Inspirer les autres : Vous saurez quoi et comment faire
Motiver: Vous connaitrez les moyens
Déléguer:Vous découvrirez les incontournables pour les meilleurs résultats
Communiquer et parler en public: Vous apprendrez à le faire avec impact
Inspirer confiance: Vous saurez les principes fondamentaux et les techniques qui fonctionnent
Être efficace pour plus de résultats : Vous le serez au moindre effort et avec moins de stress
Déterminer la meilleure stratégie pour vos projets comme pour votre attitude de meneur
Ce livre va vous surprendre. Certaines prises de conscience vous questionneront. Mais, mettant en pratique ses apports, vous transformerez votre vie professionnelle. Pour vous. Pour les autres. Pour votre société.
J'en ai expérimenté les différents contenus. Ils fonctionnent. Maintenant, à vous de jouer !",979-1094050064,https://m.media-amazon.com/images/I/61LlQjj8BhL._SY522_.jpg,9791094050064 (24 juin 2023),Laurent CAUDRON
Institutional Economics: An Introduction,44.71,"Why is it that some countries become rich while others remain poor? Do markets require regulation to function efficiently? If markets offer an efficient way of exchanging goods, why do individuals even create firms? How are economic transactions organized in the absence of a state that could enforce contracts and guarantee property rights? Institutional economics has allowed social scientists to answer many fundamental questions about the organization and functioning of societies. This introduction to institutional economics is concise, yet easy to understand. It not only caters to students of economics but to anybody interested in this topical research area and its specific subfields. Both formal and informal institutions (such as customs, habits, and traditions) are discussed with respect to their causes and consequences, highlighting the important part they play for economic growth and development.",978-1108461085,https://m.media-amazon.com/images/I/91lsJIriIKL._SY522_.jpg,Cambridge University Press (11 avril 2019),Stefan Voigt
,15.52,,,,,
"Havre Créatif Oiseaux en Vitrail Livre de Coloriage: Page De Coloriage D’Oiseaux En Vitrail, Dessins Vibrants Célébrant La Beauté Aviaire",12.48,"Havre Créatif Oiseaux en Vitrail Livre de Coloriage Page De Coloriage D’Oiseaux En Vitrail, Dessins Vibrants Célébrant La Beauté Aviaire",979-8322943761,https://m.media-amazon.com/images/I/71u+HuOL+jL._SY522_.jpg,Independently published (15 avril 2024),Muditha Kenn
"ISO 45001 Pour les Nuls: Guide simple et pratique, expliquant chaque chapitre de la norme ISO 45001:2018 Préparation à la mise en œuvre, la ... de la santé et de la sécurité au travail SST",14.47,"Guide pratique pour comprendre et mettre en œuvre la norme ISO 45001:2018. Avec des explications claires et des exemples concrets, ce livre vous accompagne étape par étape de la mise en place vers l'amélioration de votre système de management de la santé et de la sécurité au travail dans votre entreprise. Dans ce livre, vous trouverez :
1 Démarche SST
1.1 Historique
1.2 Application
1.3 Étapes
2 Normes, définitions, livres
2.1 Normes
2.2 Définitions
2.3 Livres
3 Approche processus
3.1 Processus
3.2 Cartographie des processus
3.3 Approche processus
4 Contexte
4.1 L’entreprise et son contexte
4.2 Parties intéressées
4.3 Domaine d’application
4.4 Système de management de la SST
5 Leadership
5.1 Leadership et engagement
5.2 Politique
5.3 Rôles, responsabilités et autorités
5.4 Consultation et participation
6 Planification
6.1 Actions face aux risques et opportunités
6.2 Objectifs SST
7 Support
7.1 Ressources
7.2 Compétences
7.3 Sensibilisation
7.4 Communication
7.5 Informations documentées
8 Réalisation
8.1 Planification et maîtrise opérationnelles
8.2 Situations d’urgence
9 Performance
9.1 Surveillance et mesure
9.2 Audit interne
9.3 Revue de direction
10 Amélioration
10.1 Généralités
10.2 Incident
10.3 Amélioration continue
Annexes:
Annexe 01 Le document unique d’évaluation des risques professionnels
Annexe 02 Plan de projet de certification
Annexe 03 Correspondances référentiels ISO 45001, ILO OSH 2001 et OHSAS 18001
Annexe 04 Revue de processus
Annexe 05 Processus spécifiques
(Identifier les dangers et évaluer les risques SST, Communiquer, Consulter les travailleurs, Evaluer la conformité, Enquêter sur un incident, Réaliser la revue de processus, Gérer les risques opérationnels, Anticiper les situations d'urgence, Acheter, Respecter les exigences légales et réglementaires, Gérer les modifications, Inspecter, Maîtriser les non-conformités, Tenir à jour la veille réglementaire)
Annexe 06 Glossaire
Annexe 07 Outils PRS
Annexe 08 Manuel Santé et Sécurité
Annexe 09 Liste de risques
Annexe 10 Niveau du risque
Annexe 11 Processus Gérer les risques
Annexe 12 Procédure Gestion des risques
Annexe 13 Plan d’action de réduction des risques
Annexe 14 Veille réglementaire
Annexe 15 Liste des informations documentées
Annexe 16 Signalisation santé et sécurité au travail
Annexe 17 Etiquetage et stockage de produits chimiques
Annexe 18 Support compte rendu Revue de Direction
Annexe 19 Bonnes pratiques
Annexe 20 Ecarts à éviter
Annexe 21 QCM ISO 45001
Annexe 22 Quiz ISO 45001
Annexe 23 Etudes de cas ISO 45001",979-8324453565,https://m.media-amazon.com/images/I/619zjBHdfDL._SY522_.jpg,Independently published (30 avril 2024),QHSE Editions
"Why Nations Fail: The Origins of Power, Prosperity and Poverty",7.57,"Shortlisted for the Financial Times and Goldman Sachs Business Book of the Year Award 2012.

Why are some nations more prosperous than others? Why Nations Fail sets out to answer this question, with a compelling and elegantly argued new theory: that it is not down to climate, geography or culture, but because of institutions. Drawing on an extraordinary range of contemporary and historical examples, from ancient Rome through the Tudors to modern-day China, leading academics Daron Acemoglu and James A. Robinson show that to invest and prosper, people need to know that if they work hard, they can make money and actually keep it - and this means sound institutions that allow virtuous circles of innovation, expansion and peace.

Based on fifteen years of research, and answering the competing arguments of authors ranging from Max Weber to Jeffrey Sachs and Jared Diamond, Acemoglu and Robinson step boldly into the territory of Francis Fukuyama and Ian Morris. They blend economics, politics, history and current affairs to provide a new, powerful and persuasive way of understanding wealth and poverty.",978-1846684302,https://m.media-amazon.com/images/I/71dCt9ImrDL._SY522_.jpg,Profile Books Ltd; Main édition (7 février 2013),Daron Acemoglu
