Nom,Prix,Description,Isbn,Photo,Editeur,Auteur,Categorie
Sauvés par la sieste: Petits sommes et grandes victoires sur la dette de sommeil,12.0,"Brisons d’emblée un mythe : la sieste n’est pas la marque des paresseux. Bien au contraire, elle est la solution pour une vie plus active, plus saine, plus créative et plus sereine. Les dernières études scientifiques ont révélé qu’elle nous permet de lutter contre la somnolence, la baisse de performances, la morosité, la douleur, la fragilité immunitaire, le stress, et de nous protéger du surpoids et du risque cardiovasculaire.
Quand les nuits se font trop courtes, la sieste devient notre meilleure alliée. L’objectif de ce livre est justement de nous familiariser avec cette “médecine de poche”, d’apprendre à lui réserver les moments les plus favorables de la journée, à lui consacrer les bonnes durées, à contourner ses petits obstacles, à optimiser ses avantages, et à comprendre l’intérêt majeur qu’il y a à la pratiquer.
Croissance, consolidation de la mémoire, régénération, nettoyage et protection de l’organisme… la sieste a les fonctions physiologiques et les vertus thérapeutiques d’un sommeil de nuit en miniature. La sieste ou l’art de retrouver et d’entretenir notre vitalité.",978-2330150495,https://m.media-amazon.com/images/I/41Dm3EW6SoL.jpg,Actes Sud (26 mai 2021),Brice Faraut,Troubles du sommeil
Sophrologie pour Enfants Hypersensibles: Comment Aider votre Enfant à Gérer son Stress,15.23,"1/ Résumé du Livre: Votre enfant hypersensible souffre de crises d’angoisses et de stress au quotidien ? Vous vous sentez démuni face à ses larmes et ses troubles du sommeil ? Ce livre est la solution ! Ce guide pratique offre des techniques de sophrologie adaptées aux besoins uniques des enfants hypersensibles, leur permettant de transformer leur sensibilité en une force. Grâce à des exercices simples, des histoires captivantes et des métaphores, ce livre est un outil précieux pour tout parent cherchant à soutenir son enfant dans un monde souvent accablant.

2/ Le Problème Traité dans le Livre: Les enfants hypersensibles font face à des défis uniques, se sentant souvent submergés par leurs émotions et l&#39environnement autour d&#39eux. Le stress et l&#39anxiété peuvent sérieusement affecter leur bien-être et leur développement. Ce livre aborde ces défis, en se concentrant sur la manière dont la sophrologie peut aider ces enfants à gérer leurs émotions intenses.",979-8876068422,https://m.media-amazon.com/images/I/61wym0btvyL._SY522_.jpg,Independently published (13 janvier 2024),Sacha DURAND,Troubles du sommeil
"Charlie n&#39a peur de rien ! (Même pas des fantômes): Histoires inspirantes pour les filles de 7 à 10 ans sur la confiance en soi, la bienveillance, la gratitude et la spiritualité !",12.16,"🎀Je m’appelle Charlie et c’est moi qui écris la préface, parce que je suis en âge d’écrire (j’ai bien grandi depuis le début de mon histoire !).🎀

J’habite dans une maison, dans laquelle il se passe des choses extraordinaires, mais que je suis la seule à savoir !
Je ne peux pas tout te raconter (sinon ce livre ne sert à rien), mais j’ai beaucoup appris sur la tolérance, le partage, la discrétion, la confiance en soi et même la spiritualité !

J’ai un pouvoir magique, un don, que je te laisse découvrir.
Tu peux lire mon histoire toute seule, si tu es assez forte en lecture, ou laisser un parent te la lire le soir, avant de te coucher 🌛
Tu peux prendre n’importe quelle histoire au hasard, ou commencer depuis le début !
Tu sauras ce qu’est un fantôme, une âme, un ange, un guide spirituel et tu verras que c’est très drôle de pouvoir leur parler (enfin... sauf aux fantômes!)

Je te laisse, j’ai d’autres aventures à vivre ! Bonne lecture à toi !

Charlie 🤗",979-8755435154,https://m.media-amazon.com/images/I/61ifGKlV9YL._SY522_.jpg,Independently published (28 octobre 2021),Alice Ferrat,Troubles du sommeil
The Interpretation of Dreams,14.54,"This groundbreaking new translation of The Interpretation of Dreams is the first to be based on the original text published in November 1899. It restores Freud&#39s original argument, unmodified by revisions he made following the book&#39s critical reception. Reading the first edition reveals Freud&#39s original emphasis on the use of words in dreams and on the difficulty of deciphering them and Joyce Crick captures with far greater immediacy and accuracy than previous translations by Strachey&#39s Freud&#39s emphasis and terminology. An accessible introduction by Ritchie Robertson summarizes and comments on Freud&#39s argument and relates it to his early work. Close annotation explains Freud&#39s many autobiographical, literary and historical allusions and makes this the first edition to present Freud&#39s early work in its full intellectual and cultural context. Published On: 2023-04-18",978-0199537587,https://m.media-amazon.com/images/I/71X8srp0UaL._SY522_.jpg,Oxford University Press (14 août 2008),Sigmund Freud,Troubles du sommeil
"Docteur, j&#39ai mal à mon sommeil: Pour dormir naturellement",21.9,"Pourquoi dormir est-il si important pour vivre longtemps et en bonne santé ?

Comment réussir à dormir ?

Comment réussir à dormir presque naturellement ?

Un livre qui va vous aider à retrouver le bon sommeil, le plus naturel possible.

Bien dormir sans médicaments, oui, c’est possible. Suivez le guide, tout est dans ce livre !",978-2738151537,https://m.media-amazon.com/images/I/71GYKW4hz1L._SY522_.jpg,Odile Jacob (3 février 2021),Patrick LEMOINE,Troubles du sommeil
Le sommeil du tout-petit. Une lecture pratique et scientifique,14.5,"Ce livre propose une lecture à la fois scientifique et pratique du sommeil des tout-petits. Il raconte la naissance des états de vigilance au cours de la période foetale, l&#39évolution de la structure du sommeil et l&#39installation du rythme jour/nuit au cours des toutes premières années de la vie. Il nous apprend à quoi sert le sommeil et à quoi rêvent les tout-petits. Il permet de comprendre pourquoi certains enfants réveillent leurs parents plusieurs fois par nuit, pourquoi ils s&#39endorment tard ; mais aussi pourquoi ces troubles sont la plupart du temps bénins. Il répond aux multiples questions qui trottent dans la tête des parents et des professionnels de la petite enfance: Ce bébé dort-il suffisamment? À quel moment est-il censé faire ses nuits ? Ses pleurs sont-ils normaux ou excessifs? S&#39agit-il d&#39un cauchemar ou d&#39une terreur nocturne ? Faut-il le laisser pleurer ou pas ? Quid de la sieste à la maison, en crèche ? Quelles-sont les conséquences d&#39un mauvais sommeil pour la mémoire, les apprentissages, les émotions du bébé et de ses parents ? Un livre qui permet aux parents et aux professionnels de la petite enfance d&#39être plus serein face aux difficultés de sommeil des tout-petits. Un livre pour l&#39aider et vous aider à passer les écueils des différentes étapes de la maturation de son sommeil et de ses émotions.",978-2490737239,https://m.media-amazon.com/images/I/61a4WaEE87L._SY522_.jpg,PHILIPPE DUVAL; Illustrated édition (19 novembre 2020),Marie-Josèphe Challamel,Troubles du sommeil
Réapprenez à dormir,8.4,"Quelle est la durée optimale d’une bonne nuit ? La grasse matinée nuit-elle à la santé ? Le CBD est-il bon pour s’endormir ? Que faire si, en télétravail, mon sommeil se dégrade ? Le sport aide-t-il vraiment à dormir ? Grâce aux dernières recherches scientifiques, l’auteur nous révèle les secrets et les trois piliers fondamentaux de la composante fondamentale de notre bien-être. Le Pr Pierre Philip, chef du service universitaire de médecine du sommeil au CHU de Bordeaux, est médecin, psychiatre et membre d’une unité au CNRS. Il dirige depuis plus de vingt ans une équipe de recherche spécialisée dans l’hygiène du sommeil et les troubles mentaux.

• Insomnie, apnée du sommeil, hypersomnie... : un GUIDE PRATIQUE sur les maladies du sommeil.
• Des SOLUTIONS CONCRETES au travers de routines personnalisées et adaptées à chaque âge de la vie
• De nombreuses FICHES PRATIQUES et des OUTILS SIMPLES pour s’autodiagnostiquer.",978-2253238775,https://m.media-amazon.com/images/I/61T9HcmspNL._SY522_.jpg,Le Livre de Poche (6 mars 2024),Pierre Philip,Troubles du sommeil
"Il tempo del corpo. Il sole, il sonno e il ritmo della vita",13.75,"Perché ci sentiamo sempre stanchi? Perché facciamo fatica ad addormentarci o ci svegliamo di continuo? Come possiamo aiutare il corpo a riposare? Antonella Viola ci introduce ai ritmi circadiani, ovvero le oscillazioni delle funzioni di tipo fisico e comportamentale che seguono il più antico e meraviglioso orologio del mondo: l&#39alternanza di luce e buio. Il sonno, la temperatura corporea, la fame, le difese immunitarie e persino il dolore sono tutti soggetti a questo ascendente. L&#39adattamento degli organismi all&#39ora del giorno, così come i loro cambiamenti ritmici, è stato documentato da molto tempo, ma solo recentemente la scienza ha iniziato a comprendere quanto i ritmi circadiani influiscano sul nostro benessere. Il sonno, così importante per la nostra salute, è regolato da un ritmo circadiano chiamato appunto ritmo sonno-veglia, strettamente legato all&#39alternanza di luce e buio. La sincronizzazione dei nostri orologi biologici è quindi necessaria per proteggere il sonno e tutte le attività ad esso legate, come il consolidamento della memoria, ossia quel processo che trasforma l&#39esperienza in ricordo. Ma non è solo la memoria del cervello a consolidarsi mentre dormiamo: anche la memoria immunologica, che ci permette di difenderci da virus e batteri, matura durante il riposo, e non a caso la perdita di sonno è associata a una maggiore suscettibilità alle infezioni. ""Il tempo del corpo"" ci svela la scienza dietro tutti questi meccanismi e Antonella Viola è la nostra guida d&#39eccezione che, con gli strumenti rigorosi, creativi e sorprendenti della ricerca scientifica, farà entrare nelle nostre vite il concetto di tempo biologico, aiutandoci a organizzare le giornate in modo da concedere al nostro corpo il tempo di cui ha felicemente bisogno. Il tempo narrato in questo libro è un tempo intimo, profondo, essenziale. Esistenziale. È il nostro tempo: il tempo del corpo che vibra in sintonia con il pianeta. È il tempo da proteggere per ritrovare l&#39equilibrio.",978-8807174391,https://m.media-amazon.com/images/I/71Owv-NwBuL._SY522_.jpg,Feltrinelli (14 mai 2024),Antonella Viola,Troubles du sommeil
Vos paupières sont lourdes: 12 contes pour bien dormir avec l&#39hypnose,16.01,"Vous avez des difficultés à vous endormir, vous souffrez de réveils nocturnes, précoces ou encore d’insomnies… ce livre est fait pour vous ! Il a pour but de vous réconcilier avec le sommeil en transformant le moment du coucher en un moment de plaisir et d’évasion.

En utilisant le langage hypnotique, Valérie Roumanoff a rédigé douze histoires traitant chacune d’une situation où il peut être difficile de trouver le sommeil. La construction des phrases, les termes choisis, la ponctuation sont autant d’éléments qui contribuent à créer rapidement une atmosphère particulière propice au sommeil.

En lisant les mots les uns à la suite des autres ou en écoutant les versions audio qui accompagnent chaque conte, vous allez vous sentir naturellement glisser dans les bras de Morphée. Vous pouvez vous endormir au milieu d’une histoire, ou en lire plusieurs à la file avant de sombrer dans un sommeil profond…

Nous vous souhaitons une bonne lecture et surtout… de très bonnes nuits !",978-2035976512,https://m.media-amazon.com/images/I/81vb76AV8UL._SY522_.jpg,Larousse (4 novembre 2020),Valérie Roumanoff,Troubles du sommeil
"Antifatigue: En 4 semaines, retrouvez 100% de votre énergie grâce au sommeil",5.65,"Le professeur Pierre Philip est reconnu en France et à l&#39étranger comme un expert du sommeil. Ses nombreuses publications scienti ques ont montré comment un meilleur sommeil permet de combattre la fatigue.
En trente ans, nous avons perdu 1h30 de sommeil. Anxiété, stress, bouleversement des rythmes de vie... Les conséquences sur notre santé sont désormais prouvées et sérieuses. Et c&#39est un véritable enjeu de santé publique.
La durée et la qualité de notre sommeil sont nos meilleurs atouts antifatigue. Elles apportent des bienfaits inouïs, aussi ef caces que le sport et toutes les vitamines ou compléments alimentaires. Cruciales pour notre organisme et notre mental.
Tout commence par une consultation personnalisée que vous offre ce livre. Grâce à votre agenda sommeil et votre programme en 4 semaines, nous allons vous aider à renforcer votre sommeil et votre énergie !",978-2226444998,https://m.media-amazon.com/images/I/71q+rWNnfyL._SY522_.jpg,Albin Michel (2 septembre 2020),Pierre Philip,Troubles du sommeil
"1, 2, 3, sommeil avec les étonnants mini-mouvements du Sounder Sleep System",21.8,"Pourquoi n’arrivez-vous pas à dormir ? Et surtout, comment résoudre votre cas personnel ?
Cet ouvrage concret et détaillé vous propose de découvrir le Sounder Sleep System™ inspiré de la Méthode Feldenkrais™, de la méditation et conforté par les avancées de la science du sommeil.
Cet ensemble de Mini-mouvements réalisés avec une qualité et dans un esprit particulier va vous permettre de construire votre solution :

1, les Mini-mouvements relaxants pour détendre le corps,
2, les Mini-mouvements calmants pour retrouver une respiration naturelle et un esprit serein,
3, les Mini-mouvements berceurs pour vous endormir le soir et vous rendormir la nuit.
L’auteur partage également le récit du parcours qui l’a mené à se débarrasser de son insomnie et à construire son système innovant.
Une solution originale, simple et efficace, pas seulement pour un sommeil de qualité mais aussi pour des journées apaisées.",978-2955012659,https://m.media-amazon.com/images/I/71A1PSbiQHL._SY522_.jpg,Kikekoidonou; Illustrated édition (3 décembre 2018),Michael Krugman,Troubles du sommeil
,5.3,,,,,,Troubles du sommeil
Mon p&#39tit cahier Sommeil,6.12,"Accompagner son enfant dans les bras de Morphée, c&#39est possible !
Un enfant qui ne veut pas aller au lit, des cauchemars qui réveillent en sursaut, des réveils difficiles... Vous ne savez plus à quoi ressemble une nuit entière de sommeil ? Essentiel à son bon développement, le sommeil agité d&#39un enfant se répercute sur le bien-être de toute la famille. Pourtant, il existe des méthodes douces et des astuces à la portée de tous pour renouer en douceur avec le sommeil. Un enfant qui dort bien est un enfant serein !
Au programme :
• Le sommeil de A à Z : le sommeil de l&#39enfant décrypté, les bienfaits sur son développement, les besoins âge par âge, les rêves.
•",978-2263163067,https://m.media-amazon.com/images/I/61uSkspsl+L._SY522_.jpg,Solar; Illustrated édition (6 février 2020),Auriane Hamon,Troubles du sommeil
1001 BB 185 - Le sommeil des bébés et des mères: Une histoire de cultures,16.0,"« Fait-il ses nuits ? » est une des premières questions posées aux parents d’un nouveau-né. Le sommeil n’est pas qu’un phénomène biologique, il est influencé par notre état psychique, la société, la culture et l’environnement dans lequel nous vivons. Bien que le sommeil soit universel, nous n’apprenons pas à dormir de la même façon.
Ce livre illustre la multi-dimensionnalité du sommeil. Chacun des auteurs, en fonction de sa formation initiale (anthropologue, artiste, psychologue neurologue spécialiste du sommeil) avait sa façon d’appréhender le sommeil. Mais leur rencontre a renouvelé leurs conceptions et leurs pratiques et a permis la réalisation d’un outil transdisciplinaire pour aborder le sommeil des mères et de leur bébé : les ateliers du sommeil. Ceux-ci, décrits précisément, font émerger certains faits saillants, comme l’influence de l’environnement nocturne, les peurs de la nuit et les rêves…, qui conduisent à une réflexion sur les enjeux sociétaux du sommeil et de ses représentations précoces.",978-2749276816,https://m.media-amazon.com/images/I/6199slfX+8L._SY522_.jpg,ERES (30 mars 2023),Arianna Cecconi,Troubles du sommeil
Pourquoi nous dormons,14.18,"Le sommeil est l&#39une des dimensions les plus importantes de notre vie et, paradoxalement, c&#39est aussi l&#39une des moins connues. Pourquoi dormons-nous ? Quelles sont les conséquences du manque de sommeil sur notre santé ? Et quelle est l&#39utilité du sommeil ?
En agissant sur notre cerveau, le sommeil favorise nos capacités à apprendre, à mémoriser et à prendre des décisions logiques et rationnelles. Il réajuste nos émotions, réapprovisionne notre système immunitaire et règle avec précision notre métabolisme. Quant aux rêves, ils apaisent nos souvenirs douloureux et créent un espace de réalité virtuelle favorable à la créativité.

Traduit dans une trentaine de langues, Pourquoi nous dormons",978-2266287234,https://m.media-amazon.com/images/I/51wxIlw5BwL._SY522_.jpg,Pocket (19 septembre 2019),Matthew R. Walker,Troubles du sommeil
14 jours pour bien dormir,7.16,"Faites de votre sommeil une priorité
Accéder enfin à un sommeil profond et réparateur pour être en bonne santé, perdre ses kilos en trop, être plus efficace au travail et plus épanoui dans sa vie personnelle : voici les grandes promesses que vous fait Shawn Stevenson.
Le sommeil est le troisième pilier de la santé avec l&#39alimentation et l&#39exercice physique. Et pourtant il est totalement négligé. Comment le renforcer et l&#39optimiser ? En améliorant sa qualité et pas seulement sa quantité.
Shawn Stevenson vous livre 21 stratégies qui ont fait leurs preuves, à mettre en pratique immédiatement. Ces stratégies inédites sont inspirées de travaux scientifiques et traduites en conseils simples et concrets.
Vous découvrirez :
• quelle heure du coucher est optimale pour vous ;
• que la lumière naturelle favorise les hormones du sommeil ;
• comment éviter que vos écrans perturbent vos cycles naturels ;
• quels exercices faire et à quel moment pour favoriser des nuits réparatrices ;
• comment vider son esprit avant d&#39aller au lit.
Un programme de 14 jours, à suivre pas à pas, va vous aider à prendre définitivement les bonnes habitudes.",978-2365492140,https://m.media-amazon.com/images/I/61ThdU5ZRYL._SY522_.jpg,Thierry Souccar; Illustrated édition (1 décembre 2016),Shawn Stevenson,Troubles du sommeil
"Mes Petits Sophro Contes: 29 histoires pour se sentir mieux, se relaxer et pratiquer la sophrologie avec mes enfants",15.4,"Les contes ont toujours été une source de fascination pour les enfants, captivant leur imagination et les transportant dans des mondes enchantés. Mais au-delà de leur aspect divertissant, les contes peuvent également être des outils puissants pour aider les enfants à développer leur équilibre émotionnel, leur estime de soi, leur confiance en soi et leur capacité à gérer le stress et les émotions.
C&#39est là que
Les contes ont toujours été une source de fascination pour les enfants, captivant leur imagination et les transportant dans des mondes enchantés. Mais au-delà de leur aspect divertissant, les contes peuvent également être des outils puissants pour aider les enfants à développer leur équilibre émotionnel, leur estime de soi, leur confiance en soi et leur capacité à gérer le stress et les émotions.",979-8863840369,https://m.media-amazon.com/images/I/71bQlNFfAlL._SY522_.jpg,Independently published (9 octobre 2023),Rachel Astier,Troubles du sommeil
Sleep: What Every Parent Needs to Know,15.94,"Sooner or later, most parents face challenges at bedtime. From infants and toddlers to school-aged kids and adolescents, sleep problems can affect everyone in the family. And no matter what a child&#39s difficulty may be--getting to sleep, staying asleep, bed-wetting, fears, or nightmares--it&#39s never too late to take steps to correct it. Sleep: What Every Parent Needs to Know , 2nd Edition, helps parents and caregivers better understand sleep, answering questions and examining conflicting theories to help parents make the best decisions for their family. Topics include The functions of sleep and how much your child needs Newborn sleep patterns Sleep theories and strategies for success Bedtime routines and rituals Coping with fears and nightmares Tips for solving common problems",978-1581107814,https://m.media-amazon.com/images/I/61JcgeXwG4L._SY522_.jpg,American Academy of Pediatrics; 2e édition (3 septembre 2013),Rachel Y. Moon,Troubles du sommeil
The Sensational Baby Sleep Plan: a practical guide to sleep-rich and stress-free parenting from recognised sleep guru Alison Scott-Wright,29.06,"Packed with tips, hints and reminders, case studies, at-a-glance charts and a daily journal to help you keep track of your baby&#39s progress, The Sensational Baby Sleep Plan is a step-by-step, must-have manual to ensure sleep for you and your baby. For over twenty-five years, recognised sleep guru Alison Scott-Wright has been working &#39hands-on&#39 with families, sharing her knowledge with her clients and, most importantly, bringing sleep to thousands of homes. Now she is sharing her expertise with you...

&#39I was so thankful for this book. It made a HUGE difference.&#39 -- Giovanna Fletcher
&#39I wish I had read this book sooner, I tell every new mum about it!&#39 -- Millie Mackintosh",978-0593062814,https://m.media-amazon.com/images/I/71108X8MVsL._SY522_.jpg,Bantam Press (8 janvier 2010),Alison Scott-Wright,Troubles du sommeil
Le livre qui vous endort,16.85,"Le Livre qui vous endort ne prétend pas être intéressant et vous n&#39y trouverez rien de stimulant pour votre cerveau. C&#39est un livre hors du commun qui vous permettra de vous endormir grâce à de nombreuses connaissances parfaitement inutiles. Retrouvez réunis en un seul volume le résumé de la crise politique belge (2007 à 2011), les développements récents en matière de taxonomie des mollusques, l&#39histoire des services postaux en Indonésie, l&#39almanach international du cornichon, ou encore la revue en lipogramme de la littérature lipogrammatique.",978-2501139731,https://m.media-amazon.com/images/I/71eO4RDY86L._SY522_.jpg,Marabout; Illustrated édition (6 février 2019),Pr K McCoy,Troubles du sommeil
Cet enfant qui ne dort pas,7.9,"La petite musique, les histoires, les doudous, les tétines, la lumière allumée ou la porte entre-ouverte… Pour endormir leur enfant, certains parents ont tout essayé, la douceur comme la fermeté. C’est à ces familles au bord de la crise de nerfs que Lyliane Nemet-Pier vient en aide dans cet ouvrage. Elle apporte son éclairage de psychologue clinicienne et psychanalyste sur les troubles du sommeil chez l’enfant âgé de 0 à 10 ans. Difficultés d’endormissement, cauchemars et terreurs nocturnes, insomnies... chaque cas est étudié dans sa spécificité et accompagné d’exemples de consultations. L’auteur balaye les idées reçues et propose des conseils adaptés, pour qu’enfants et parents retrouvent enfin le sommeil.",978-2253177081,https://m.media-amazon.com/images/I/61Izy9MRjjS._SY522_.jpg,Le Livre de Poche (15 octobre 2014),Lyliane Nemet-Pier,Troubles du sommeil
Je veux dormir !: 12 semaines pour retrouver votre sommeil et votre énergie,24.9,"Vous ne parvenez pas à vous endormir le soir ? Vous restez éveillé(e) la nuit beaucoup trop longtemps ? Vous vous réveillez bien trop tôt ? Pendant la journée, vous souffrez de fatigue, de manque d&#39énergie, de problèmes de concentration ? Vous avez le sentiment d&#39avoir tout essayé et vous craignez de ne jamais (re)trouver un sommeil de qualité? Alors ce livre est fait pour vous !

Si vous dormez mal trois fois par semaine et que vos activités diurnes en sont impactées, vous êtes insomniaque. Heureusement, ce n&#39est pas une fatalité ! Basé sur les neurosciences, cet ouvrage vous propose une approche novatrice qui, associée à votre motivation, vous permettra d&#39améliorer nettement votre qualité de sommeil.

Laissez-vous guider à chaque étape du programme et découvrez, entre autres, la durée adéquate du sommeil, les comportements qui alimentent l&#39insomnie et la manière de les modifier, les techniques de relaxation, le lâcher-prise, le contrôle des pensées nocturnes, les solutions en cas d&#39éveils nocturnes répétés, le bon usage de la lumière, la chambre à coucher idéale, ainsi que de nombreux conseils nutritionnels.

EN 12 SEMAINES, VOUS APPRENDREZ AINSI COMMENT PRENDRE SOIN DU POUVOIR RÉPARATEUR DE VOTRE SOMMEIL EN Y TRAVAILLANT PENDANT LA JOURNÉE DE MANIÈRE POSITIVE!

INGE DECLERCQ est médecin, neurologue, experte certifiée du sommeil. Avec son programme «SleepWell&StressLess», elle permet à de nombreuses personnes de retrouver une qualité de sommeil et d&#39éveil optimale source de bien-être et de résilience.",978-2380758955,https://m.media-amazon.com/images/I/71DNyTZVHLL._SY522_.jpg,Kennes les 3 As (1 mars 2023),Docteur Declercq Inge,Troubles du sommeil
