Nom,Prix,Description,Isbn,Photo,Editeur,Auteur,Categorie
"La bible Homéopathique: Le livre de référence pour se soigner naturellement, guérir tout les maux de la famille et vivre plus sainement au quotidien I Plus de 100 remèdes pour tout les tracas !",6.21,"Découvrez comment vous guérir facilement à la maison avec plus de 100 remèdes !

Et si, au lieu d’une attente longue et coûteuse chez le médecin, vous pouviez vous soigner, vous et votre famille, à la maison, de manière sûre et efficace, pour des maladies courantes telles que le rhume, les infections, les otites et même les intoxications alimentaires ? Si c’est ce que vous recherchez, alors ce livre est fait pour vous !

Qui n’a jamais souffert d’un mauvais rhume ou d’une horrible grippe à l’étranger ? Rien ne peut plus gâcher des vacances que d’être coincé dans une chambre d’hôtel loin de chez soi, en train de vomir. Mais si vous savez comment utiliser efficacement et en toute sécurité ces",979-8429097732,https://m.media-amazon.com/images/I/611fxpXWBwL._SY522_.jpg,Independently published (8 mars 2022),Hervé Larrant,Homéopathie
"La bible Homéopathique: Le livre de référence pour se soigner naturellement, guérir tout les maux de la famille et vivre plus sainement au quotidien I Plus de 100 remèdes pour tout les tracas !",8.98,"Découvrez comment vous guérir facilement à la maison avec plus de 100 remèdes !

Et si, au lieu d’une attente longue et coûteuse chez le médecin, vous pouviez vous soigner, vous et votre famille, à la maison, de manière sûre et efficace, pour des maladies courantes telles que le rhume, les infections, les otites et même les intoxications alimentaires ? Si c’est ce que vous recherchez, alors ce livre est fait pour vous !

Qui n’a jamais souffert d’un mauvais rhume ou d’une horrible grippe à l’étranger ? Rien ne peut plus gâcher des vacances que d’être coincé dans une chambre d’hôtel loin de chez soi, en train de vomir. Mais si vous savez comment utiliser efficacement et en toute sécurité ces",979-8429097732,https://m.media-amazon.com/images/I/611fxpXWBwL._SY522_.jpg,Independently published (8 mars 2022),Hervé Larrant,Homéopathie
"Guérir Son Corps, Soigner Son Esprit: ALIMENTATION, NUTRITION, HERBES, MÉDECINE NATURELLE ET PENSÉES POSITIVES POUR L&#39INTESTIN IRRITABLE, DÉTOX DU FOIE, HORMONES, ACNÉ, ANXIÉTÉ, DÉPRESSION ET STRESS",11.36,"Élu l’un des 43 meilleurs thérapeutes du monde, auteur de 5 best-sellers, naturopathe et psychothérapeute, le Dr Ameet vous aide à régler facilement vos problèmes de santé concernant vos intestins, votre foie, vos glandes surrénales, votre dépression, votre anxiété, votre humeur, votre poids, votre peau, vos hormones, vos inflammations ainsi que vos problèmes sexuels à l’aide de votre nutrition, d’une alimentation saine, d’une médecine naturelle, de thérapie holistiques et d’une guérison émotionnelle.
Votre santé est l’un des cadeaux les plus précieux que l’on puisse vous faire. Ce livre au pouvoir holistique intense vous permettra d’améliorer rapidement votre santé, votre bonheur et votre humeur en vous aidant à traiter l’origine des maladies de votre esprit et votre corps, lesquelles sont liées à :",979-8644439393,https://m.media-amazon.com/images/I/71JeSHlGXDL._SY522_.jpg,Independently published (9 mai 2020),Dr. Ameet Aggarwal ND,Homéopathie
Guide familial de l&#39homéopathie,8.9,"Ce guide complet destiné au grand public présente par ordre alphabétique les principaux médicaments homéopathiques et les différentes maladies que l’on peut traiter par cette thérapeutique douce et atoxique.
Il permet de :
• comprendre les principes théoriques de l’homéopathie ;
• décrypter les ordonnances du médecin ;
• pratiquer l’automédication pour les petites affections courantes avec le maximum de sécurité et d’efficacité : symptômes, traitements, usages.
Grâce à ses 1 000 rubriques ou entrées, il met à votre portée un savoir indispensable pour vous-même et votre famille.
Nouvelle édition entièrement remise à jour.",978-2253030768,https://m.media-amazon.com/images/I/61d3gDK20GL._SY522_.jpg,Le Livre de Poche (1 mars 2015),Alain Horvilleur,Homéopathie
Flourishing Against the Odds:: Homeopathy for our Rapidly Changing World,13.36,"Flourishing Against the Odds: Homeopathy for Our Rapidly Changing World, presents a homeopathic toolkit not only for professional homeopaths, but also one which will appeal to other therapeutic modalities. It is aimed at treating individuals facing the challenges arising from the impacts of major events in today’s rapidly changing world. These traumatising events include the manifold instances of population displacement from wars, toxic environmental pollution, the Covid-19 pandemic with the associated mental and emotional fallout from authoritarian lockdowns, as well as the growing threat of climate change and algorithmic media which has eroded trust and driven political and identity polarisation.
This new book offers a guide to practitioners working in contemporary times to support thriving in their patients, within a world of disarray and disconnection. A transgenerational practice model is presented in Part 1 and a Materia Medica of homeopathic remedies in Part 2, selected to help readers navigate their way in repairing and restoring the health of their patients to flourish against the odds.",978-1399976626,https://m.media-amazon.com/images/I/71M1eQmRzhL._SY522_.jpg,Fundamental (30 janvier 2024),Elizabeth Adalian MCH,Homéopathie
"Ma bible de l&#39homéopathie: De Abcès à Zona, tous les maux quotidiens et leurs solutions homéopathiques...",28.0,"Dans cette bible unique en son genre, Albert-Claude Quemoun réunit tout ce qu&#39il faut savoir sur l&#39homéopathie pour bien se soigner et mieux vivre au quotidien : Les grands principes de l&#39homéopathie : pourquoi et comment ça fonctionne ? Quels sont les différents types de médicaments (granules, crèmes et gels, gouttes buvables...) ? Des conseils adaptés à chacun et à chaque période de sa vie : femmes enceintes, bébés, enfants, seniors, animaux de compagnie, mais aussi beauté, bien-être... un savoir à la portée de chacun. L&#39abécédaire complet des médicaments homéopathiques et leurs propriétés. De Abattement à Zona, tous les maux et leurs solutions homéopathiques, pour soigner adultes comme enfants : anxiété, ballonnements, otite, ronflements... + Inclus, un cahier personnalisable 11x17.8 personnalisable et tout en couleurs, spécial enfants : 17 portraits d&#39enfants pour nous permettre de reconnaître le profil du notre.",979-1028514808,https://m.media-amazon.com/images/I/812CT9W8kTL._SY522_.jpg,LEDUC (15 mai 2019),Albert-Claude Quemoun,Homéopathie
"Homéopathie, le livre de référence pour se soig ner au naturel",24.9,"Le livre de référence pour se soigner au naturel
Voici un livre novateur sur l&#39homéopathie, attendu du grand public et des thérapeutes désirant une information sérieuse et complète sur le sujet. Il repose sur la très grande expérience du Dr Martine Gardénal, médecin homéopathe dont les quarante années de pratique et d&#39observation lui ont permis d&#39affiner sa compréhension de l&#39homéopathie, rendant ses prescriptions plus précises, plus justes et plus efficaces. Véritable ouvrage de référence, ce livre intègre les connaissances les plus actuelles mais aussi celles, plus anciennes, qui ont fait leurs preuves. Si l&#39homéopathie y tient une large part, la grande curiosité et l&#39intuition de Martine Gardénal l&#39ont poussée à explorer tout ce qui - de près ou de loin - peut améliorer la santé et la maintenir dans les meilleures conditions, le plus longtemps possible. Dans ce guide très pratique - à conserver et à consulter pour soigner toute la famille -, vous découvrirez un abécédaire incroyablement complet des maladies et des maux quotidiens, mais aussi tous les remèdes homéopathiques et les principales techniques naturelles complémentaires - alimentation, compléments alimentaires, plantes, huiles essentielles et huiles végétales, probiotiques, magnétisme, ozonothérapie, sports, techniques manuelles, pensée positive... Un guide précieux que toute personne s&#39intéressant à la santé et aux médecines naturelles devrait avoir chez elle.",978-2813216847,https://m.media-amazon.com/images/I/71bloAP4RAL._SY522_.jpg,Les éditions Trédaniel (22 mai 2018),Martine Gardenal,Homéopathie
"La bible Homéopathique: Le livre de référence pour se soigner naturellement, guérir tout les maux de la famille et vivre plus sainement au quotidien I Plus de 100 remèdes pour tout les tracas !",16.13,"Découvrez comment vous guérir facilement à la maison avec plus de 100 remèdes !

Et si, au lieu d’une attente longue et coûteuse chez le médecin, vous pouviez vous soigner, vous et votre famille, à la maison, de manière sûre et efficace, pour des maladies courantes telles que le rhume, les infections, les otites et même les intoxications alimentaires ? Si c’est ce que vous recherchez, alors ce livre est fait pour vous !

Qui n’a jamais souffert d’un mauvais rhume ou d’une horrible grippe à l’étranger ? Rien ne peut plus gâcher des vacances que d’être coincé dans une chambre d’hôtel loin de chez soi, en train de vomir. Mais si vous savez comment utiliser efficacement et en toute sécurité ces",979-8429097732,https://m.media-amazon.com/images/I/611fxpXWBwL._SY522_.jpg,Independently published (8 mars 2022),Hervé Larrant,Homéopathie
"IKIGAI ET PHILOSOPHIE JAPONAISE: 3 livres en 1 : Ikigai, Kaizen et Shinrin-yoku - Les secrets du bonheur et de la philosophie japonaise pour une vie longue et heureuse en trouvant le sens de la vie",11.99,"Avez-vous envie de trouver votre place dans le monde, en identifiant ce qui vous rend unique et mener une vie harmonieuse et riche de sens?
Souhaitez-vous découvrir comment vivre chaque jour pleinement, en poursuivant des objectifs qui résonnent véritablement avec qui vous êtes ?
Quel est le sens de ma vie ? Quelle est ma place dans ce monde ? Ces questionnements nous accompagnent durant des années et sont souvent laissés sans réponse.

Vivre chaque jour pleinement et sereinement est l’idéal auquel nous aspirons sans trop y croire. Atteindre ses objectifs semble impossible, les poursuivre requiert déjà suffisamment d’efforts. Les conseils et méthodes de développement personnel que nous avons maintes fois tenté d’appliquer ne se sont pas avérés convaincants – au point que mener une vie harmonieuse, riche de sens, épanouie, est maintenant considéré comme utopique.",979-8873946747,https://m.media-amazon.com/images/I/71dDQROVOjL._SY522_.jpg,Independently published (11 février 2024),TETSUGAKU GROUP,Homéopathie
,18.86,,,,,,Homéopathie
Homsham - L&#39homéopathie sensitive,18.11,"Il est urgent de réhabiliter nos propres moyens de guérison pour faire face en conscience aux bouleversements du monde actuel. L&#39accès illimité aux soins de santé et le droit de recourir aux thérapies non conventionnelles sont menacés de disparition. Apprendre à prendre soin de notre santé par nous-mêmes s&#39avèrera bientôt très utile. Grâce aux découvertes des neurosciences, on sait aujourd&#39hui qu&#39une capacité sensitive cérébrale est stimulée quand l&#39être humain fait appel aux compétences de la zone préfrontale et de l&#39hémisphère droit de son cerveau. Dans l&#39homéopathie sensitive, c&#39est un peu comme si « le principe actif » du remède émane du processus qu&#39effectue le cerveau pour le trouver et que l&#39esprit, l&#39âme et le corps du patient l&#39incorporent grâce aux vibrations qui se dégagent de ce processus et de la découverte du remède. La différence majeure entre L&#39HomSham et l&#39homéopathie classique est qu&#39il n&#39y a plus besoin de faire de souches de remèdes à partir d&#39êtres vivants ou morts... Les remèdes sont transmis de façon vibratoire sans aucun support. L&#39HomSham, moyen de bio-modulation sans substances ni machine, nous permet d&#39accéder à nos compétences inconscientes de guérison et de changement sans assistanat physico-chimique. Eduard Van den Bogaert a étudié la médecine à l&#39université libre de Bruxelles, pour pouvoir exercer une médecine douce, innovante, efficace et accessible à tous. À l&#39origine d&#39une nouvelle forme d&#39homoeopathie sensitive et évolutive, il parcourt le monde depuis 30 ans afin d&#39en accroître les possibilités thérapeutiques.",978-2358050937,https://m.media-amazon.com/images/I/61DAuO7ixnL._SY522_.jpg,QUINTESSENCE (13 novembre 2013),Eduard Van den Bogaert,Homéopathie
Le Petit Livre de l&#39homéopathie,19.89,"Le petit guide familial de l&#39homéopathie !
Ce petit livre propose un guide familial des remèdes homéopathiques classés par maladie, pour une utilisation simple et rapide. Pour soulager soi-même les petits maux du quotidien, ou pour patienter avant d&#39aller consulter.",978-2754087049,https://m.media-amazon.com/images/I/61JXGbpgEtL._SY522_.jpg,First (23 juin 2016),Daniel Scimeca,Homéopathie
Matière médicale,54.0,"On trouvera ici la substantifique moelle de 687 remèdes méthodiquement analysés et comparés. Loin de tout dogmatisme, Boericke élargit son observation aux autres thérapeutiques et tend notamment la main à l’allopathie. Chaque médecin homéopathe trouvera ici d’innombrables occasions de compléter son propre système de références et de symptomatologies et d’enrichir à son tour sa matière médicale, indispensable vade-mecum du praticien.",978-2904928994,https://m.media-amazon.com/images/I/51QFD7ZE2CL.jpg,Editions Similia; 9e éd. édition (18 janvier 1999),Boericke,Homéopathie
Mes 1000 ordonnances homéopathie,8.48,"De Acné à Zona en passant par Cholestérol, Digestion difficile, Rhumatismes… 1 000 ordonnances adaptées à chacun pour traiter chaque trouble avec précision. 1 000 façons de se soigner naturellement grâce à l&#39homéopathie.",979-1028519674,https://m.media-amazon.com/images/I/71GtvGdTz8L._SY522_.jpg,LEDUC; Illustrated édition (23 février 2021),Albert-Claude Quemoun,Homéopathie
L&#39homéopathie pour mes enfants,7.3,"L’homéopathie pour mes enfants est par excellence la médecine de l’enfance. Sans danger ni effets secondaires, elle est bien adaptée aux organismes délicats, dès le plus jeune âge.
Sous forme de dictionnaire, ce livre répond à toutes les questions que posent habituellement les parents au pédiatre ou à l’homéopathe.

Il traite, pour la période qui va de la naissance à l’adolescence :
• des problèmes de la vie courante : alimentation, hygiène, langage, sommeil, énurésie, dyslexie…
• des maladies infectieuses et des accidents, susceptibles ou non d’être soignés par l’homéopathie.

Nouvelle édition entièrement remise à jour.",978-2253051725,https://m.media-amazon.com/images/I/71IyazSN+nL._SY522_.jpg,Le Livre de Poche; Le Livre de Poche édition (26 février 2003),Alain Horvilleur,Homéopathie
"Science, homéopathie et physique des hautes dilutions - Les secrets de l&#39eau enfin dévoilés",19.0,"Le remède homéopathique n&#39est-il qu&#39un placebo?? Ou l&#39homéopathie est-elle la médecine nécessaire de demain?? Face au flou des informations médiatiques, qui mettent en avant tout et son inverse, on se rend compte que, finalement, le grand public sait peu de choses de cette pratique aujourd&#39hui. Pour autant, la science, et notamment la physique quantique, nous donne des explications et nous oriente vers des applications concrètes de cette pratique de santé. Le but de cet ouvrage est de proposer une explication du fonctionnement de l&#39homéopathie, en se fondant sur une démarche scientifique, étayée par des expériences, des résultats de recherches et des modèles mathématiques. Tout ceci à travers des entretiens avec différents médecins et scientifiques, spécialisés en physique quantique, en médecine bactériologique, en virologie et en homéopathie.",978-2491031497,https://m.media-amazon.com/images/I/61L-p-3F3mL._SY522_.jpg,EXUVIE; Illustrated édition (11 septembre 2023),Marc Henry,Homéopathie
Homéopathie et médecine chinoise,49.0,"Dans cette 3 e édition l&#39auteur ajoute aux 56 traitements homéopathiques exposés dans la précédente édition l&#39étude de 10 souches homéopathiques supplémentaires. Il couvre ainsi l&#39intégralité des 66 grands remèdes homéopathiques qui sont les plus importants de la matière médicale et les plus fréquemment prescrits.
La 1ère partie de l&#39ouvrage détaille les typologies de la théorie des cinq Éléments de la médecine chinoise et établit des parallèles avec les constitutions homéopathiques autrement appelées diathèses. La 2 e partie est consacrée à l&#39étude de chaque remède classé selon son appartenance à l&#39un des cinq Éléments chinois. Pour chaque traitement homéopathique sont décrits :",978-2294782442,https://m.media-amazon.com/images/I/51twvfvbsAL._SY522_.jpg,Elsevier Masson; 3e édition (4 janvier 2023),Docteur Vivien Hémond,Homéopathie
De l&#39ombre à la lumière un chemin de guérison: Déprogrammer le subconscient,19.9,"La vie de l&#39être humain passe d&#39un moment de lumière, d&#39extase, dans le ventre de maman à la dure réalité de la vie terrestre au moment de la naissance qui va faire apparaître en nous un imposteur qui deviendra notre partie ténèbre.
Accompagné de ce double, nous voguerons d&#39un état de bien-être à un sentiment de désolation faisant souvent le yoyo entre les deux.
Tout cela explique bien les problèmes que nous vivons dans notre existence : maladie psychique, physique, dégénérative.
La lumière peut vaincre les ténèbres nous permettant de passer de l&#39inconscient à l&#39un-conscient.
C&#39est l&#39histoire de ce livre, l&#39histoire de l&#39être humain et de son trépied physique, psychique, spirituel et les outils pour évoluer.",979-8853614222,https://m.media-amazon.com/images/I/61SFW2lb6mL._SY522_.jpg,Independently published (9 août 2023),Dr Michel Geeraert,Homéopathie
Les médicaments lithiques : Clinique homéopathique des roches diluées et dynamisées,7.99,"Parmi l&#39ensemble des médicaments homéopathiques, les médicaments lithiques ont une originalité d&#39action qui réside dans la notion de déchélation, de drainage des éléments minéraux chélatés au sein des tissus, empêchant leur fonctionnement optimal. Les docteurs Max Tétau et Daniel Scimeca font le point sur ces médicaments originaux qui utilisent les roches comme souche homéopathique, prélevées dans leur milieu naturel. Les différents constituants de la roche, à la ""synergie subtile... dans une conformation cristalline ou amorphe"", s&#39avèrent être de fantastiques agents thérapeutiques dans de nombreuses situations pathologiques – sans être jamais nocifs ni iatrogènes. Ils ont un effet remarquable sur les appareils nerveux, digestif, respiratoire, cardio-vasculaire ou endocrinien, et également en soins de support en cancérologie. L&#39ouvrage s&#39articule en deux temps : au répertoire des médicaments lithiques disponibles (formule et indications), succède une présentation des différentes régions symptomatologiques, les médicaments correspondants, un schéma de traitement et souvent, l&#39exemple d&#39un cas clinique. Car, on le sait, tout l&#39intérêt et l&#39originalité de ces médicaments est d&#39appréhender et de soigner l&#39homme dans sa totalité. On peut parler de génie de l&#39ensemble, de totum de la roche, celle-ci agissant sur les fonctions de l&#39individu de façon globale – et non sur une unique cible – tout en tenant compte de la spécificité de chacun, à savoir sa tendance pathologique, mais aussi sa diathèse et sa constitution.",978-2842510626,https://m.media-amazon.com/images/I/41FxjJPe3ML.jpg,Editions Similia (10 mars 2016),Max Tétau,Homéopathie
Soigner ses enfants avec l&#39homéopathie: De la naissance à l&#39adolescence les meilleurs conseils homéo pour prendre...,18.0,"Maladies infantiles, rhume, insomnie, poussées dentaires, coliques, accompagnement de la vaccination... L&#39homéopathie offre une solution aux maux quotidiens et évite dans bien des cas d&#39avoir recours à des traitements plus agressifs.",979-1028500023,https://m.media-amazon.com/images/I/81EfHbNdbZL._SY522_.jpg,LEDUC (19 août 2014),Sophie Pensa,Homéopathie
La medecine retrouvee ou les ambitions nouvelles de l&#39homéopathie,15.61,,978-2828904487,https://m.media-amazon.com/images/I/81RAaKb2GqL._SY522_.jpg,,,Homéopathie
Le guide Horvilleur de l&#39homéopathie,29.95,"Référence absolue de cette discipline, le docteur Horvilleur a reuni dans cet ouvrage tout ce qu&#39il faut savoir sur l&#39homéopathie.

Retrouvez :
Un test pour définir votre profil homéopathique et ainsi adapter les traitements de tous les membres de la famille
Les grands principes : y-a-t-il des dangers ? Quelles maladies peut-on soigner ? Quels sont les différents types de médicaments homéopathiques ?
Un dictionnaire de plus de 100 maladies et les traitements homéopathiques associés : anémie, brûlures, palpitations, otite, stérilité, stress, ronflements...
L&#39abécédaire complet des médicaments homéopathiques et leurs propriétés",978-2017165262,https://m.media-amazon.com/images/I/61zxXfAwFeL._SY522_.jpg,Hachette Pratique; Illustrated édition (10 août 2022),Docteur Alain Horvilleur,Homéopathie
TRAITEMENTS DE SUPPORT HOMEOPATHIQUES EN CANCEROLOGIE,13.09,"Jean-Claude Karp et François Roux analysent les effets indésirables des traitements oncologiques et proposent une prise en charge homéopathique associée. Dans l&#39esprit des deux éditions précédentes (2011, 2013), les auteurs, par leur travail méticuleux et complet de mise à jour ― 10 médicaments ont été ajoutés à t&#39ouvrage ― offrent un outil de référence précieux et actualisé.",978-2915668872,https://m.media-amazon.com/images/I/31WS1Es1O3L.jpg,CEDH (12 octobre 2018),Jean-Claude Karp,Homéopathie
Le guide de l&#39homéopathie familiale,19.95,"Découvrez un guide complet et très illustré pour soigner les maux de toute la famille avec l’homéopathie. Les trois auteurs experts (médecine, homéopathie, phytothérapie) ont rassemblé pour vous des informations ultra pratiques et actualisées pour une consultation et un usage simplifiés.

100 médicaments homéopathiques détaillés pour bien connaître leurs atouts et leurs spécificités d’utilisation (propriétés, formes disponibles, posologie…).

10 trousses pour parer aux problématiques principales : médicaments homéopathiques indispensables, trousses d’urgence ou de voyage, trousses classées par saisons ou par thématiques (maux féminins, enfant, adolescent).

75 troubles analysés et plus de 300 conseils homéopathiques proposés pour trouver la solution la plus adaptée à chacun des membres de la famille.",978-2317019784,https://m.media-amazon.com/images/I/91ttttLvhJL._SY522_.jpg,MANGO; Illustrated édition (18 octobre 2019),Antoine Demonceaux,Homéopathie
De la médecine naturelle à la médecine de l&#39individu,29.5,"D&#39après l&#39enseignement du Docteur Gérard Guéniot, avec le concours du Docteur Pierre Tondelier. Gérard Guéniot était un des rares médecins qui «osait» parler de l&#39âme, de l&#39esprit, de l&#39être intérieur qui est en chacun de nous et qui a, tout au long de la vie, un chemin à parcourir et des épreuves à vivre. L&#39homme n&#39est-il pas un tout ? Ardent et infatigable défenseur de l&#39Homéopathie et de l&#39Acupuncture, il s&#39est progressivement transformé en promoteur d&#39un concept de Médecine Naturelle. L&#39idée étant de synthétiser toutes les notions existantes et de fédérer ainsi toutes les pratiques de santé naturelles en leur donnant une base commune. Dans ce livre, il est décrit les aspects simples et élémentaires, mais fondamentaux, des lois naturelles qui régissent l&#39organisme et sur lesquelles il faut s&#39appuyer pour rétablir la santé du corps. Car la santé dépend de ces critères fondamentaux de fonctionnement de l&#39organisme, qui sont issus de la nature et dont les lois simples expliquent la physiologie des corps de matière dense. Conserver la santé consiste donc à réunir toutes les conditions indispensables au fonctionnement harmonieux de l&#39organisme. Ce livre s&#39adresse à tous les thérapeutes qui ont «la conscience des limites des choix actuels et l&#39urgence de changer. Il ne s&#39adresse pas à l&#39intellect du lecteur mais à son intuition qui, seule, peut lui permettre de savoir si les orientations développées sont vraies, car la Vérité est simple à condition qu&#39on veuille la chercher». Et aussi à tout lecteur «soucieux de gérer au mieux sa santé et qui a conscience que le corps est un noble don qui doit être protégé et maintenu en équilibre». Il trouvera dans ce livre «la connaissance du fonctionnement harmonieux des différents corps et le moyen de prendre en main sa santé, c&#39est-à-dire d&#39en être responsable».",978-2930353838,https://m.media-amazon.com/images/I/71-duKoH3gL._SY522_.jpg,Amyris; Édition classique (14 octobre 2010),Guéniot Gérard,Homéopathie
