Nom,Prix,Description,Isbn,Photo,Editeur,Auteur
Les secrets de la technique Nadeau - Méthode canadienne de régénération holistique,6.63,"Technique Nadeau :
l'exercice physique à la portée de tous

QUESTION DE BON SENS
Henri Nadeau a mis au point cette méthode dans les années 1970 au Canada après un très grave infarctus. Alors que les médecins l'avaient condamné, il recouvre la santé par lui-même grâce à des exercices simples et répétés. Henri Nadeau décide par la suite de partager son expérience et crée sa méthode. Colette Maher, professeure de yoga, va permettre la diffusion de cette méthode, d'abord au Canada, puis en Espagne ; et enfin en France, avec l'aide de Monique Filleau, formatrice des professeurs.

DES EXERCICES SIMPLES AUX BIENFAITS RECONNUS
Ce livre présente la méthode dans le détail mais va bien au-delà. Les trois mouvements sont détaillés avec précision (rotation du bassin, vague complète et natation). L'auteur insiste, c'est le premier secret, sur l'exécution précise des mouvements. Conseils et erreurs à éviter. Témoignages de pratiquants pour lever des difficultés. L'auteur nous fait ensuite comprendre les effets de la méthode sur notre colonne vertébrale, sur les systèmes nerveux et glandulaire et sur notre psychisme, en rentrant dans le détail du fonctionnement de ces grandes structures vitales.

Un livre complet, pratique, illustré, pour découvrir ou approfondir une méthode qui a démontré son efficacité auprès de milliers d'adeptes.

Jean-Michel Kensan Pierre enseigne la Technique Nadeau et la méditation zen à Toulouse où il réside. Il a publié aux Éditions Almora :",978-2351183663,https://m.media-amazon.com/images/I/51eOO4hpABL._SY522_.jpg,Almora; Illustrated édition (19 avril 2018),Jean-Michel Pierre
Le livre perdu de la médecine naturelle: Guérison rajeunie grâce à des recettes médicinales naturelles,9.23,"Dans une société saturée de médicaments et de médecines synthétiques, il reste un trésor caché de connaissances sur la guérison : le livre perdu de la médecine naturelle. Dans ses pages se trouvent les secrets de l'utilisation de la capacité intrinsèque de la nature à guérir et revitaliser le corps, l'esprit et l'âme.

Le Livre Perdu de la Médecine Naturelle plonge dans les connaissances intemporelles des médecines naturelles, fournissant une référence approfondie à vingt traitements curatifs puissants dérivés directement du sol. Des plantes médicinales aux méthodes de guérison traditionnelles, ce livre fournit un guide du bien-être holistique basé sur des traditions séculaires.

Découvrez les pouvoirs médicinaux des plantes et herbes utilisées pour guérir depuis l’Antiquité. Apprenez à utiliser l'aromathérapie pour réduire le stress et favoriser la relaxation, ou étudiez l'Ayurveda pour équilibrer l'énergie du corps et stimuler la vitalité.

Mais le livre enterré de la médecine naturelle ne s’arrête pas là ; il plonge également dans des thérapies moins connues comme l'acupuncture, l'homéopathie et la guérison énergétique, donnant un aperçu de leur efficacité et de leurs applications pratiques dans la vie contemporaine.

Que vous recherchiez un traitement contre des maladies chroniques, renforciez votre système immunitaire ou simplement renouez avec les bienfaits de la nature, The Lost Book of Natural Medicine offre un chemin vers un bien-être holistique qui va au-delà des restrictions de la médecine traditionnelle.

Rejoignez-nous dans un voyage de redécouverte alors que nous découvrons les secrets du livre ancien de la médecine naturelle et célébrons le pouvoir de guérison de la nature sous toutes ses formes magnifiques.",979-8326633552,https://m.media-amazon.com/images/I/61UPyNX-SCL._SY522_.jpg,Independently published (25 mai 2024),Alexandro Bokan
Actualités de la médecine fonctionnelle,14.09,"Après une ‘Introduction à la Médecine Fonctionnelle’ publiée en 2014, le besoin s’est fait pressant de publier cette suite intitulée ‘Les Actualités de la Médecine Fonctionnelle’. L’auteur qui nous avait déjà présenté son approche novatrice d’une médecine naturelle et holistique s’implique à nouveau, mais cette fois plutôt pour la défendre contre les attaques injustifiées de régulateurs, lesquels semblent bien plus motivés par la défense du paradigme ‘tout médicament’ que par la santé des patients… Pourquoi donc n’acceptent-ils pas que « prévenir vaut mieux que guérir » ? Dès 2017, l’auteur fut de plus en plus souvent positivement impressionné par la prolifération d’articles scientifiques de grande qualité, publiés par des revues médicales prestigieuses et revus par des pairs (peer-reviewed), fournissant une apologie de nombreux principes fondamentaux de la Médecine Fonctionnelle. Ces éloges qui émanent de médecins, biologistes et chercheurs du monde entier sont précisément ceux qui suscitaient des controverses depuis une éternité, et qui font encore l’objet d’anathèmes cinglants éructés par certains spécialistes. Dysbiose intestinale, hyperperméabilité muqueuse, rôle omniprésent de l’alimentation dans de multiples pathologies dégénératives et dans les affections cutanées, axe intestins-cerveau : à votre santé, bonnes gens !",978-2874341786,https://m.media-amazon.com/images/I/61SVOlfKBEL._SY522_.jpg,M PIETTEUR (9 novembre 2020),Georges Mouton
La Gemmothérapie simplifiée : Un Outil Incontournable pour Naturopathes et Thérapeutes: - Guide Pratique Complet,11.01,"Préface
Originaire de Marseille, j'ai débuté mon parcours dans le secteur paramédical, travaillant dans divers services hospitaliers.
Cette expérience m'a permis de développer une compréhension approfondie des besoins en santé et bien-être, m'ouvrant les portes vers des disciplines complémentaires telles que la naturopathie, la réflexologie, l'iridologie, et l’hypnose Ericksonienne, enrichies par l'énergétique traditionnelle chinoise.

Au fil des années, ma passion pour le bien-être holistique m'a conduit à Brignoles, où j'ai exercé mes activités de Naturopathe et géré mon propre magasin bio pendant plus de dix ans.

Parallèlement, j'ai créé une gamme de compléments alimentaires bio, se concentrant particulièrement sur la gemmothérapie.

Cette expérience m'a permis de former des professionnels de santé, m'amenant à constater la complexité de la gemmothérapie, surtout due à ses nombreuses possibilités d'association et de combinaison.

Ce livre est le fruit de cette expérience.

Il se veut un guide exhaustif et pratique, destiné aux naturopathes, aux revendeurs, et à toute personne s'intéressant à la gemmothérapie.

Son organisation systématique, abordant la gemmothérapie système par système, avec des indications spécifiques et un tableau indicatif par bourgeon, vous permet de cibler l'utilisation des bourgeons et de créer des systèmes personnalisés adaptés à chaque besoin.
Vous pouvez ainsi facilement élaborer vos propres complexes et synergies, adaptés à diverses conditions de santé.

Grâce à ce tableau, les lecteurs peuvent facilement créer des synergies efficaces, adaptées à diverses conditions de santé.

Mon objectif est de fournir un ouvrage de référence, une ""bible"" de la gemmothérapie, qui condense en un seul volume tout ce qu'il faut savoir pour conseiller et prescrire de manière professionnelle et efficace.

Je souhaite que ce livre soit un pilier pour ceux qui cherchent à approfondir leur compréhension et leur pratique de cette discipline fascinante, en offrant un accès direct et structuré à une mine d'informations essentielles.",979-8867268985,https://m.media-amazon.com/images/I/61fDxGN8xHL._SY522_.jpg,Independently published (11 novembre 2023),DANIELLE GARDET GENDRE
"Votre jeûne holistique en pratique - Purifier, regénérer et renforcer le corps et l'esprit",20.0,"Alors que les dysfonctionnements de notre système médical s'amplifient, il devient urgent de reprendre sa santé en main et d'acquérir des clés d'autonomie. La pratique du jeûne est un moyen efficace pour activer les voies de la détox, de l'autoréparation et, in fine, d'un programme santé prévenant les maladies de civilisation. Ce livre vous assistera dans chacune des étapes, de la préparation à la réalisation du jeûne puis à la reprise alimentaire, et vous guidera au quotidien dans les différentes pratiques corporelles, automassages et gymnastique douce, exercices respiratoires et relaxation. Il répond aux principales questions qui se posent durant un jeûne et vous indique également les astuces et les moyens pour pallier les éventuels inconforts. Différentes formes de jeûne sont abordées, avec leurs particularités et leurs objectifs respectifs. Alain et Sylvie animent des cures de jeûne depuis de nombreuses années et vous font ainsi bénéficier de leur riche expérience.",978-2360470884,https://m.media-amazon.com/images/I/71Z2pn5xjqL._SY522_.jpg,CHARIOT D'OR (21 avril 2021),Alain Huot
"Harmonie chez Soi, Vitalité en Soi: La santé par le Feng Shui : le guide pratique pour activer les super-pouvoirs de votre maison !",5.47,"Problèmes de sommeil, stress, manque d'énergie... Ces problématiques font-elles partie de votre quotidien ? 😞
Saviez-vous que l'environnement dans lequel vous évoluez peut réellement influencer votre vitalité et votre sérénité ? 😥
Un focus particulier doit être mis sur votre maison ou votre appartement !
STOP ! Si vous ne faites rien maintenant, dans 6 mois, vous serez toujours au même point. Votre espace vital continuera à vous voler votre vitalité, et votre bien-être restera hors de portée.
Transformez votre vie en activant les superpouvoirs de votre maison grâce au Feng Shui adapté à votre intérieur. Découvrez comment harmoniser vos énergies vitales et revitaliser votre quotidien",978-2958992408,https://m.media-amazon.com/images/I/61ms6R4LEXL._SY522_.jpg,Feng Shui Flow (2 novembre 2023),Aude Charreau
Enfant TDAH et famille épanouie: La méthode et les outils pour accompagner votre enfant TDAH dans la sérénité,14.45,"⚡ Le TDAH, une caractéristique unique à cultiver.

Découvrez, dans ce témoignage vibrant, la clé pour comprendre et soutenir votre enfant atteint d'un Trouble Déficit de l'Attention avec ou sans Hyperactivité (TDAH).

🌿 Votre parcours est parsemé d'angoisses et d'incertitudes ?
Comment aider mon enfant à canaliser son énergie ?
Comment apaiser ses souffrances causées par l'incompréhension de ses différences ?
Suis-je suffisamment équipé(e) pour répondre à ses besoins spécifiques ?
Ne vous inquiétez plus, une approche révolutionnaire vous attend !",979-8864761144,https://m.media-amazon.com/images/I/6166fZyw1rL._SY522_.jpg,Independently published (3 novembre 2023),Julia Martel
"Le Soigneur d'arbres, enquête du lieutenant Leclou T2: Roman initiatique, la rencontre avec Macha, journaliste",7.67,"Dans cet opus, le lieutenant Leclou, héros d'une série de plusieurs aventures extraordinaires, rencontre Macha la journaliste, avec qui il vivra ensuite de nombreuses péripéties.
Une histoire de rencontres, des personnages forts, une intrigue humaine.

L'HISTOIRE :
Macha, jeune journaliste auteure d'une chronique à succès, débarque dans le village de Mandinier pour faire le portrait du ""Soigneur d'arbres"", un métier peu connu qui prend en compte les besoins du végétal avant tout.
Mais l'homme ne cherche pas la lumière et n'est pas prêt à se livrer.
Quand, après un évènement tragique, elle finit enfin par le rencontrer, il décèle aussitôt ses failles et lui ouvre les portes d'un univers aux vertus insoupçonnées.

Autres titres de l'auteure : L'envers des corps, Code tattoo, Offre logement contre menus services, La jolie vie de Mélanie, Deuxième étage rayon hommes, Le dernier facteur, C'est comme ça Papa !, Avant qu'il n'en reste rien, L'atelier des coeurs égarés, Le chant de la baie, Page blanche, L'affaire LECLOU, Ceux de l'ubac, Où scintillent les roches, Francesca, Une formule vraiment magique",979-1096121182,https://m.media-amazon.com/images/I/71NhnVl4WGL._SY522_.jpg,Paquier (12 novembre 2018),Virginie Paquier
Vivre sans boulimie: Un chemin vers la libération,17.72,"Faire la paix avec l’alimentation et avec son corps : c’est possible !
Des compulsions alimentaires vous poussent à dévorer des quantités astronomiques ?
Vous êtes obnubilé par la nourriture et avez l'impression qu'une force démoniaque s'empare de vous, parfois ?
Vous êtes en guerre avec votre corps ?
Vous avez déjà essayé plusieurs approches, sans succès ?
J’ai connu tout cela pendant 28 années avant de parvenir à manger avec plaisir et insouciance, de ressentir la satiété et d’aimer mon corps.",978-2958744908,https://m.media-amazon.com/images/I/61YQfW9JfpL._SY522_.jpg,Aux Girafes en Paix (5 avril 2023),Sonia BORYS
The Complete Cookbook Inspired by Barbara O'Neill's Natural Recipes: Wholesome Plant-Based Cooking,15.63,"Introducing the globally acclaimed masterpiece, a culinary revelation that transcends borders— ""Barbara O'Neill's Natural Recipes: A Culinary Odyssey."" This international bestseller, now in its latest and enhanced edition for 2024, is more than just a cookbook; it's an indispensable guide to life-changing recipes inspired by the transformative teachings of Barbara O'Neill.

Step into a world where the art of wholesome, plant-based cooking takes center stage, inviting you to unleash the true potential of your well-being. Say goodbye to fleeting dieting fads and embrace a new approach to healthy eating that promises not only delicious meals but a profound transformation from within.

Every page of this culinary masterpiece opens a gateway to a realm where mouthwatering meals and holistic well-being coexist harmoniously. Crafted with precision,",979-8872857105,https://m.media-amazon.com/images/I/71M3OY+XePL._SY522_.jpg,Independently published (24 décembre 2023),Veronica Greenleaf
Yoga: THE PATH TO HOLISTIC HEALTH,7.14,"Around the world, increasing numbers of people are turning to yoga as a means of keeping fit and reducing stress. In this comprehensive and highly illustrated guide B.K.S. Iyengar, the world's leading teacher of yoga, shares his unique, holistic approach. For Iyengar, yoga is more than just a form of exercise; it is a holistic experience that benefits the body, mind, and spirit. He outlines the philosophy and ideals behind this ancient practice and explains how yoga can help to counter the stresses of modern living. Designed for every level of ability, age, and physical condition, there are detailed instructions for beginner, intermediate, and advanced students. Clearly illustrated, step-by-step instructions explain how to perform each yoga asana, or posture, correctly, while a unique 360-degree view of the final pose shows exactly how to position each part of the body. A special section introduces B.K.S. Iyengar's innovative use of props, enabling beginners or the less flexible to practice the classic yoga asanas more easily and effectively. A further section illustrates sequences of asanas to treat or prevent a wide range of ailments. In addition, there is a 20-week yoga course, personally formulated by B.K.S. Iyengar, which progresses from simple to more challenging postures. Without a doubt, Yoga: The Iyengar Way is the definitive guide to the practice of yoga by the master.",978-0789471659,https://m.media-amazon.com/images/I/71vA9DfadcL._SY522_.jpg,DK (31 janvier 2001),B.K.S. Iyengar
Les mystères de la dent,16.0,"Les dents recèlent nombre d'informations sur nous, notre histoire et nos origines. Elles sont semblables à un livre qui s'ouvre et qui se ferme, pour révéler ou dissimuler de mystérieux récits. Voici un travail original résultant de la collaboration entre Gérard Athias et Georges Lahy, chacun portant, en fonction de son art, un regard particulier et libre sur les dents. Il ne s'agit nullement d'un ouvrage médical d'orthodontie, mais plutôt d'une étude symbolique de chaque dent ou groupe de dents. Broché - 14,8 x 21 - 160 pages",978-2952514767,https://m.media-amazon.com/images/I/81SZi8Q6PYL._SY522_.jpg,PICTORUS (16 avril 2009),Georges Lahy
Régénération par la marche afghane,19.14,"La respiration au service de la santé
Ce coffret propose des exercices, simples mais puissants, e ration rythmique synchronisée sur la marche et qui vont véritablement révolutionner votre vie. Grâce à la formidable suroxygenation que procurent ces exercices, le métabolisme est revitalisé, le système immunitaire est renforcé, le processus de vieillissement est ralenti, les cellules se régénèrent... Pratiquée régulièrement, cette marche/respiration va enclencher le processus de détoxication dont le corps a besoin, transformant à son tour la chimie interne de celui-ci. Il s'en ressent un incroyable bien-être, une santé et une vitalité accrues. Vous deviendrez plus audacieux, plus ambitieux : en un mot plus performant ! Vous retrouverez une meilleure harmonie et vos rapports avec l'extérieur et les autres s'en trouveront facilités.",978-2813206312,https://m.media-amazon.com/images/I/51HNoD7TVNL._SY522_.jpg,Les éditions Trédaniel (1 novembre 2013),Corinne G. Stiegler
