Nom,Prix,Description,Isbn,Photo,Editeur,Auteur,Categorie
"Journal de mes douleurs chroniques: carnet de suivi de maladies chroniques avec symptômes, localisation et évolution de la douleur",9.93,"Journal de bord de douleurs chroniques
ce carnet sera l&#39outil idéal afin que vous puissiez noter jour après jour de manière détaillé les douleurs et maladies chroniques dont vous souffrez.
En effet, sur chaque page vous aurez à remplir :
Date, votre niveau d&#39énergie, d&#39activité et de sommeil sur une échelle de 1 à 5
Le détail de vos repas (petit-déjeuner, déjeuner, diner et encas)
Un schéma de corps humain vous permettra de localiser la douleur ainsi que son intensité sur une échelle de 1 à 10
Un tableau à compléter pour y noter l&#39heure, les symptômes et les déclencheurs
Un graphique à compléter afin d&#39indiquer l&#39évolution de la douleur tout au long de la journée",979-8698011958,https://m.media-amazon.com/images/I/51++5SnNVnL._SY522_.jpg,Independently published (15 octobre 2020),Les Papeteries Nouvelles,Gestion de la douleur
Spondylarthrite Journal de suivi: Carnet de bord spondyloarthrite à remplir / Idéal pour observer symptômes et douleurs / cahier d&#39autosurveillance ... à compléter / pelvispondylite rhumatismale,7.99,"Tout d&#39abord, pour avoir un aperçu de l&#39intérieur du livre, cliquez sur l&#39option ""feuilleter"" ou consultez la dernière de couverture.


Ce carnet, véritable outil de mémoire et de planification est destiné à toutes les personnes souffrant de la spondylarthrite. Très complet, il sera votre allié et votre compagnon de route dans le combat contre votre maladie inflammatoire chronique.


Grâce à ce cahier de suivi, vous pourrez noter quotidiennement toutes les données concernant votre spondyloarthrite (symptômes, douleurs, rendez-vous médicaux, traitements...).
Ainsi, toutes les informations relatives à votre maladie seront regroupées dans un endroit unique. Vous pourrez donc présenter aux professionnels de santé un historique précis de vos difficultés de santé pour qu&#39il puisse vous soigner plus précisément et efficacement.",,https://m.media-amazon.com/images/I/61+J37StBcL._SY522_.jpg,Independently published (9 juin 2022),Répertoire et Santé RT éditions,Gestion de la douleur
Cured: The Power of Our Immune System and the Mind-Body Connection,13.61,"&#39Ground-breaking. Everyone should read this book&#39 Bessel van der Kolk, author of The Body Keeps the Score

When it comes to understanding the connection between our mental and physical health, we should be looking at the exceptions, not the rules.

Dr Jeff Rediger, a world-leading Harvard psychiatrist, has spent the last fifteen years studying thousands of individuals from around the world, examining the stories behind extraordinary cases of recovery from terminal illness.

Observing the common denominators of people who have beaten the odds, Dr Rediger reveals the immense power of our immune system and unlocks the secrets of the mind-body connection. In",978-0241327593,https://m.media-amazon.com/images/I/71nM7QN5ouS._SY522_.jpg,Penguin Life (15 juillet 2021),Dr Jeff Rediger,Gestion de la douleur
"Mon journal de suivi des douleurs: Carnet de bord destiné aux personnes souffrant de douleurs chroniques (fibromyalgie, polymyalgie, fatigue ... cancer...). Format A4, 186 pages, broché.",5.14,"Ce journal de bord est destiné aux personnes souffrant de douleurs chroniques (fibromyalgie, polymyalgie, fatigue, cancer...) ou de douleurs postopératoires :intensité, localisation, symptômes, moyens de soulagement, repas, médicaments, qualité du sommeil, humeur et émotions.
Description produit :
1 page d’informations personnelles à remplir
1 planning mensuel de suivi de douleur
90 jours à compléter se composant d’une double page à renseigner lors de chaque douleur :
date, heure de début, durée et heure de fin de la douleur
Croquis anatomique (femme) pour marquer exactement l’endroit où la douleur se manifeste",979-8673962428,https://m.media-amazon.com/images/I/512tlyK52JL.jpg,Independently published (10 août 2020),ADO SANTE EDITIONS,Gestion de la douleur
"The MELT Method: A Breakthrough Self-Treatment System to Eliminate Chronic Pain, Erase the Signs of Aging, and Feel Fantastic in Just 10 Minutes a Day!",6.91,"Now available in paperback, this New York Times bestseller features a new foreword by the author, fully updated images throughout the text, and the latest scientific data that supports the effectiveness of the program.
In The MELT Method, therapist Sue Hitzmann offers a breakthrough self-treatment system to combat chronic pain and erase the effects of aging and active living—in as little as ten minutes a day.
With a focus on the body&#39s connective tissues and the role they play in pain, stress, weight gain, and overall health, Hitzmann&#39s life-changing program features techniques that can be done in your own home.
A nationally known manual therapist and educator, Hitzmann helps her clients find relief from pain and suffering by taking advantage of the body&#39s natural restorative properties.",978-0062065360,https://m.media-amazon.com/images/I/81fKzfw-GoL._SY522_.jpg,HarperOne; Reprint édition (27 septembre 2016),Sue Hitzmann,Gestion de la douleur
La Goutte Journal de suivi: Carnet de bord crise de goutte à remplir / Cahier d&#39autosurveillance arthropathie uratique ou goutteuse à compléter / ... des rois/acide urique,11.71,"Tout d&#39abord, pour avoir un aperçu de l&#39intérieur du livre, cliquez sur l&#39option ""feuilleter"" ou consultez la dernière de couverture.


Ce carnet, véritable outil de mémoire et de planification est destiné à toutes les personnes souffrant de la goutte. Très complet, il sera votre allié et votre compagnon de route dans le combat contre vos rhumatismes microcristallins.


Grâce à ce cahier de suivi, vous pourrez noter quotidiennement toutes les données concernant votre arthropathie uratique (symptômes, douleurs, rendez-vous médicaux, traitements...).
Ainsi, toutes les informations relatives à votre maladie seront regroupées dans un endroit unique. Vous pourrez donc présenter aux professionnels de santé un historique précis de votre maladie pour qu&#39il puisse vous soigner plus précisément et efficacement.",,https://m.media-amazon.com/images/I/61jIw05SNlL._SY522_.jpg,Independently published (6 juin 2022),Mémento et Santé RT éditions,Gestion de la douleur
"Carnet de suivi migraines: cahier de suivi des migraines, journal de suivi pour migraines chroniques à remplir, causes, intensité, localisation pour votre bilan médecin",10.65,"Journal de bord pour le suivi des migraines, localisation, causes, intensité, traitements. Aide pour faire votre bilan chez le médecin.

Détail du carnet :
- 100 fiches pré-remplies, à compléter en fonction
- Heure de début
- Heure de fin
- Date
- Durée
- Météo
- Type de douleur
- Intensité de la douleur
- Déclencheur présumé
- Mesures de soulagement
- Notes
- Intérieur noir et blanc
- Format a5 - 15.24 x 22.86 cm",979-8408104062,https://m.media-amazon.com/images/I/51y8TmQ4-ML._SY522_.jpg,Independently published (25 janvier 2022),suivi migraine Editions FR,Gestion de la douleur
Sin dolor/ Without pain: Un método revolucionario para detener el dolor crónico/ The Revolutionary Method to Combat Chronic Pain,17.16,"Basta ya. No tienes que vivir con dolor un día más. Éste es el mensaje central del revolucionario programa diseñado por Pete Egoscue, renombrado anatomista, todo un referente para los grandes atletas de nuestro tiempo, para eliminar el dolor crónico sin recurrir a medicamentos, cirugía o costosas sesiones de fisioterapia. Algunas de las cosas que aprenderás a aliviar son: padecimientos de cadera, ciática y rodillas, dolor de cabeza y migraña, cuello torcido, fatiga, vértigo, lesiones en los senos paranasales, DCM., síndrome del túnel carpiano (frecuentemente diagnosticado erróneamente como artritis).

Enough already, you do not have to live in pain one more day. This is the central message of this revolutionary program designed by Pete Egoscue, a renowned anatomist. He has served as a reference for the great athletes of our time, to eliminate chronic pain without resorting to medications, surgery, or expensive physical therapy sessions. This book provides quick and lasting relief such as lower back pain, hip problems, sciatica, bad knees, and many others. With this book in hand, you&#39re on your way to regaining the greatest gift of all: a pain-free body!",978-6075270487,https://m.media-amazon.com/images/I/61KasxGjR6L._SY522_.jpg,Editorial Oceano de Mexico (1 octobre 2017),Pete Egoscue,Gestion de la douleur
THE ULTIMATE GUIDE TO DICLOFENAC,13.34,"Diclofenac is used to treat arthritis-related pain, swelling (inflammation), and joint stiffness. Reducing these symptoms allows you to participate in more of your regular activities. This substance is referred to as a nonsteroidal anti-inflammatory drug (NSAID) (NSAID). This medication works by lowering pain and inflammation-causing chemicals in the body. Diclofenac is a medication that is used to treat mild to moderate pain, as well as the signs and symptoms of osteoarthritis and rheumatoid arthritis. Ankylosing spondylitis is another condition for which Voltaren is used. This medication is also used to treat menstrual cramps under the trade name Cataflam. Migraine headaches are treated with diclofenac powder (Cambia). GET YOUR COPY TODAY BY SCROLLING UP AND CLICKING BUY NOW TO GET YOUR COPY NOW IN ONE CLICK",978-1458309761,https://m.media-amazon.com/images/I/61MwDURZydL._SY522_.jpg,Lulu.com (31 mars 2022),Marik Bonder,Gestion de la douleur
Libérez-vous de la douleur: Par la méditation et l&#39ACT,9.7,"Comment soulager un mal de dos obsédant, des migraines récurrentes, une fibromyalgie terriblement douloureuse ? Que faire quand les médicaments sont inefficaces ou nocifs, que les médecins s’avouent impuissants ? La douleur chronique, ça n’est pas « dans la tête », mais on sait que la souffrance ressentie est augmentée par les émotions et les pensées négatives. Or, il est scientifiquement prouvé que nous avons le pouvoir d’agir sur la souffrance si nous nous entraînons à la vivre différemment.

Voici une approche innovante et efficace qui allie méditation de pleine conscience et ACT (thérapie d’acceptation et d’engagement). Grâce à sa méthode concrète et à des exercices
faciles à intégrer dans votre quotidien, vous allez cesser d’être l’esclave de votre douleur !



Frédérick Dionne, psychologue clinicien et chercheur spécialisé dans la douleur, est professeur de psychologie à l’Université du Québec à Trois-Rivières.",978-2228918220,https://m.media-amazon.com/images/I/41+zUfnIRmL._SY522_.jpg,Payot (21 juin 2017),Frédérick Dionne,Gestion de la douleur
L&#39adénomyose: Brisons les tabous,16.79,"🌸 Connaissez vous l&#39adénomyose ? Cette maladie gynécologique est souvent mal comprise et tabou, elle affecte pourtant 1 femme sur 10.
🌸 Si vous ou une personne que vous connaissez souffrez de douleurs menstruelles, de saignements abondants ou de fatigue chronique, cela pourrait être dû à l&#39adénomyose.

""L&#39Adénomyose : brisons les tabous"" saura vous expliquer clairement ce qu&#39est l&#39adénomyose, comment elle se manifeste et comment elle peut être diagnostiquée et traitée. Accessible à tous, ce livre vous aidera à mieux comprendre cette maladie complexe et à trouver des solutions.

📬 Commandez dès maintenant ""L&#39Adénomyose : brisons les tabous""",979-8388378590,https://m.media-amazon.com/images/I/51KqvlQBy5L._SY522_.jpg,Independently published (24 mars 2023),Marie Franklin,Gestion de la douleur
Trigger Point Therapy Workbook: Your Self-Treatment Guide for Pain Relief,27.04,"Trigger point therapy is one of the fastest-growing and most effective pain therapies in the world. Medical doctors, chiropractors, physical therapists, and massage therapists are all beginning to use this technique to relieve patients&#39 formerly undiagnosable muscle and joint pain, both conditions that studies have shown to be the cause of nearly 25 percent of all doctor visits.

This book addresses the problem of myofascial trigger points-tiny contraction knots that develop in a muscle when it is injured or overworked. Restricted circulation and lack of oxygen in these points cause referred pain. Massage of the trigger is the safest, most natural, and most effective form of pain therapy. Trigger points create pain throughout the body in predictable patterns characteristic to each muscle, producing discomfort ranging from mild to severe. Trigger point massage increases circulation and oxygenation in the area and often produces instant relief.",978-1608824946,https://m.media-amazon.com/images/I/81Ov7bgR1VL._SY522_.jpg,New Harbinger; Workbook édition (19 septembre 2013),Clair Davies,Gestion de la douleur
"Mon carnet de suivi de douleurs: cahier d&#39évaluation et de suivi de la douleur chronique quotidienne à compléter, journal de suivi avec 100 fiches de suivi santé pré-remplies",6.66,"Carnet de bord du suivi et de l&#39évaluation des symptômes de la douleur. Type de douleur, points douloureux, historique, causes, intensité, mesures de soulagement. Aide au bilan avec votre médecin.

Détail du carnet de suivi de la douleur :
- 100 pages pré-remplies, à compléter en fonction
- Date, heure de début, heure de fin, durée
- Météo : froid, sec, humide, pluie, doux, autre
- Qualité et durée du sommeil
- Points douloureux
- Type de douleur : somatique, mal de tête, arthrose, viscérale, bas du dos, autre
- Historique de la douleur : nouvelle douleur, moins de 3 mois, de 3 à 12 mois, plus d&#39un an
- Intensité de la douleur
- Symptômes
- Humeur
- Consommation eau et repas
- Déclencheurs présumés
- Mesures de soulagement
- Résultats et observations
- Notes
- 101 pages
- Intérieur noir et blanc
- Format a5 - pratique à transporter dans un sac ou sacoche",979-8408430970,https://m.media-amazon.com/images/I/51TgE3Ht9EL._SY522_.jpg,Independently published (26 janvier 2022),suivi douleur Editions FR,Gestion de la douleur
"Ending Male Pelvic Pain, A Man&#39s Manual: The Ultimate Self-Help Guide for Men Suffering with Prostatitis, Recovering from Prostatectomy, or Living with Pelvic or Sexual Pain",7.88,"Isa Herrera, MSPT, CSCS, Physiotherapist and men’s pelvic health expert, has written the ultimate self-help guide for men suffering from pelvic pain, sexual pain, or recovering from prostatectomy surgery. In this unique book, Ms. Herrera delivers the goods, sharing her trade secrets with you, putting you on the right track towards a pain-free lifestyle. This manual will teach you how to see and treat your pelvic floor muscles in a different way opening the door to health and well-being. Ending Male Pelvic Pain will awaken the healer within you, putting you on the road to a fast recovery. Ms. Herrera does not hold back, instead she empowers you with the knowledge you need to defeat your pain. The large selection of techniques in this book are based on Ms. Herrera’s real-life experience in treating men at her NYC based pelvic rehab healing center, Renew Physical Therapy. This multi-keyed book fuses yoga, Pilates, internal massage, visualizations, trigger point therapy, and self-care tools, ensuring that there is something for every man who has suffered long enough with pelvic pain, testicular pain, penile pain, and conditions relating to urinary leaking. In this book Ms. Herrera shows you how she helped countless men get on a path to self healing, ultimately breaking the cycle of pain. With this book Ms. Herrera is declaring a revolution, stating “I have given you the tools you need. Don’t hesitate to get started, end your pain and be the hero of your own story”. More information at www.RenewPT.com or www.EndingMalePelvicPain.com.",978-1492204428,https://m.media-amazon.com/images/I/41746rB0bHL.jpg,CreateSpace Independent Publishing Platform; Edition 1 (19 novembre 2013),Isa Herrera MSPT,Gestion de la douleur
Comprendre mes cycles féminins pour aborder au mieux les premières règles: Un outil de suivi et de compréhension pour les jeunes filles qui entrent dans la puberté,18.38,"Cahier de 100 pages, dont une grande partie à remplir. Son petit format (12,7 x 20,32 cm) permet de l&#39emporter partout et de toujours l&#39avoir avec soi !
Ce carnet permettra d&#39accompagner les jeunes filles dans leur transition en tant que femme, et ce dès leurs premières règles.

Contenu du carnet :
★ Plus de 20 pages à lire : Qu&#39est-ce que la puberté? Comment fonctionne un cycle menstruel, pourquoi j&#39ai mes règles? Qu&#39est-ce que c&#39est une IST? etc...
★ 1 page spécial souvenir, car l&#39arrivée des menstruations reste un jour gravé à vie dans la mémoire de chaque fille
★ Suivi de cycle orientées sur le ressenti (flux, spm, prévision du prochain cycle)
★ Faisons le point : les jeunes filles sont amenées à exprimer les inconforts qu&#39elles ont rencontrés et à",979-8484769049,https://m.media-amazon.com/images/I/61bK0yt-MiL._SY522_.jpg,Independently published (26 septembre 2021),Charlotte Saint Orphys,Gestion de la douleur
"Mon cahier de suivi de douleur: Cahier à Remplir Pour l’évaluation Et Le suivi De La Douleur , 120 Pages De suivi de symptômes De La Douleur Chronique.",7.74,"Ce carnet contient :
120 Pages d’évaluation de la douleur : des pages très détaillées et merveilleusement conçues qui seront utilisées pour enregistrer et suivre les douleurs chroniques. Ces pages comprennent :
Date et Temps de la douleur
Des croquis anatomiques pour marquer exactement l’endroit où la douleur se manifeste sur votre corps
Antécédents de douleur (s’agit-il d’une nouvelle douleur ou d’une douleur chronique/depuis combien de temps avez-vous cette douleur)
Échelle de la douleur (intensité de la douleur)
État d’âme et humeur
Qualité de sommeil",,https://m.media-amazon.com/images/I/61SJ+OJGBAL._SY522_.jpg,Independently published (21 juillet 2022),Raphael Brad,Gestion de la douleur
"Carnet de suivi Migraines: Cahier pour suivre ses migraines (localisation, causes, intensité, traitements....) | Aide pour migraines chroniques (avec aura ou non) et suivi chez le médecin | 120 pages",6.38,"Grâce à ce carnet, suivez vos migraines, analyser les déclencheurs, notez leur intensités, localisations, impact sur votre vie mais aussi vos traitements et leurs effets sur vos maux de tête.
Son contenu est spécialement conçu pour qu’à chaque migraine vous notiez la localisation, l’intensité, les causes probables et les moyens de soulagement.
Apprenez à combattre vos migraines !
Contenu du livre :
Suivi de vos traitements et médicaments
Information sur votre crise migraineuse (début, fin, sévérité, localisation, régularité...)",979-8735119630,https://m.media-amazon.com/images/I/61EGvN-Qp7L._SY522_.jpg,Independently published (8 avril 2021),Darwin Edition,Gestion de la douleur
The Vital Nerves: A Practical Guide for Physical Therapists,18.13,"A must-have book for understanding one of the most fundamental areas of physical therapy: the nervous system and its relationship to musculoskeletal pain
Osteopath, lecturer, and author John Gibbons offers an accessible introduction to the peripheral nervous system (PNS). Alongside real case studies and guidelines for hands-on work with clients and patients, The Vital Nerves demystifies and makes accessible everything from how to diagnose nerve conditions to understanding how our cells communicate.
Gibbons provides critical insights into the structure and functions of the PNS; the body&#39s response to stimuli and how it knows what to do; the sympathetic and parasympathetic nervous systems; understanding the stress response; and how reflex testing can aid in diagnosing conditions like Multiple Sclerosis, Parkinson&#39s Disease, and paresthesias.",978-1623175603,https://m.media-amazon.com/images/I/81srPKuJZ1L._SY522_.jpg,North Atlantic Books; 1er édition (12 janvier 2021),John Gibbons,Gestion de la douleur
True to Form: How to Use Foundation Training for Sustained Pain Relief and Everyday Fitness,6.59,"Foreword by Chris Hemsworth
A proven program that teaches you how to harness the body’s natural movement patterns in daily activities to get fit, healthy, and pain-free for life
Hunching over a keyboard, commuting long hours, slouching on the couch—poor postures resulting from our sedentary lifestyle have thrown our bodies out of balance, causing unnecessary stress and strain that compromise our joints, restrict organ function, and weaken our muscles.
Dr. Eric Goodman has spent years studying human physiology and movement. He’s helped people of all ages and occupations heal and correct lifelong debilitating pain with his revolutionary Foundation Training, a practical program that targets the posterior chain muscles—shoulders, back, butt, and legs—shifting the burden of support to where it belongs: the large muscle groups.",978-0062315328,https://m.media-amazon.com/images/I/81juchDltLL._SY522_.jpg,Harper Paperbacks; Reprint édition (18 décembre 2018),Eric Goodman,Gestion de la douleur
La Goutte Journal de suivi: Carnet de bord crise de goutte à remplir / Cahier d&#39autosurveillance arthropathie uratique ou goutteuse à compléter / ... des rois/acide urique,8.23,"Tout d&#39abord, pour avoir un aperçu de l&#39intérieur du livre, cliquez sur l&#39option ""feuilleter"" ou consultez la dernière de couverture.


Ce carnet, véritable outil de mémoire et de planification est destiné à toutes les personnes souffrant de la goutte. Très complet, il sera votre allié et votre compagnon de route dans le combat contre vos rhumatismes microcristallins.


Grâce à ce cahier de suivi, vous pourrez noter quotidiennement toutes les données concernant votre arthropathie uratique (symptômes, douleurs, rendez-vous médicaux, traitements...).
Ainsi, toutes les informations relatives à votre maladie seront regroupées dans un endroit unique. Vous pourrez donc présenter aux professionnels de santé un historique précis de votre maladie pour qu&#39il puisse vous soigner plus précisément et efficacement.",,https://m.media-amazon.com/images/I/61jIw05SNlL._SY522_.jpg,Independently published (6 juin 2022),Mémento et Santé RT éditions,Gestion de la douleur
"Le Guide de Réflexologie pour se soigner SEUL: Apprendre la Réflexologie plantaire, l’Acupression, le Massage des pieds, pour les débutants",6.88,"« Et si vous supprimiez n’importe quelle douleur avec une pression de doigt ? »
Cette phrase surprenante pourrait résumer toute la philosophie de la réflexologie.
Découvrez ce guide de réflexologie plantaire illustré pour les débutants. 🦶
Ce livre est conçu pour les gens qui veulent apprendre à se soigner SEUL ou à soigner leurs proches.
La réflexologie est une thérapie extraordinaire grâce à ses nombreux atouts : elle est naturelle, gratuite, sans effet secondaire néfaste, très simple à pratiquer n’importe où ou n’importe quand.",978-2958342623,https://m.media-amazon.com/images/I/61cu7Asf4nL._SY522_.jpg,Editions Santé en Autonomie (7 février 2023),Pascal OLIVIER,Gestion de la douleur
,6.45,,,,,,Gestion de la douleur
"The Way Out: A Revolutionary, Scientifically Proven Approach to Healing Chronic Pain",18.76,"A groundbreaking mind-body protocol to heal chronic pain, backed by new research.

Chronic pain is an epidemic. Fifty million Americans struggle with back pain, headaches, or some other pain that resists all treatment. Desperate pain sufferers are told again and again that there is no cure for chronic pain.

Alan Gordon, a psychotherapist and the founder of the Pain Psychology Center in Los Angeles, was in grad school when he started experiencing chronic pain and it completely derailed his life. He saw multiple doctors and received many diagnoses, but none of the medical treatments helped. Frustrated with conventional pain management, he developed Pain Reprocessing Therapy (PRT), a mind-body protocol that eliminated his own chronic pain and has transformed the lives of thousands of his patients.

PRT is rooted in neuroscience, which has shown that while chronic pain feels like it&#39s coming from the body, in most cases it&#39s generated by misfiring pain circuits in the brain. PRT is a system of psychological techniques that rewires the brain to break out of the cycle of chronic pain.

The University of Colorado-Boulder recently conducted a large randomized controlled study on PRT, and the results are remarkable. By the end of the study, the majority of patients were pain-free or nearly pain-free. What&#39s more, these dramatic changes held up over time.",978-0593086858,https://m.media-amazon.com/images/I/714NV4ZiTRL._SY522_.jpg,Penguin Publishing Group (23 août 2022),Alan Gordon,Gestion de la douleur
Craniosacral Therapy and the Energetic Body: An Overview of Craniosacral Biodynamics,18.28,"This useful book discusses craniosacral therapy’s history and present situation as well as its spiritual implications and practical contributions in the world of healthcare. Gilchrist demonstrates how the subtle patterns of this practice become a dynamic force in the body, and how this influences overall functioning. What most sets the book apart is Gilchrist’s discussion of the relationship of the craniosacral system and biodynamic functions to the human energy system. Though dealing with a complicated topic, the book provides a grounded, progressive approach that is both specific and insightful.",978-1556435805,https://m.media-amazon.com/images/I/61vdLitfMqL._SY522_.jpg,North Atlantic Books; 1er édition (11 août 2006),Roger Gilchrist,Gestion de la douleur
