Nom,Prix,Description,Isbn,Photo,Editeur,Auteur,Categorie
La phyto-énergétique : Stimulez vos points d&#39acupuncture par les huiles essentielles,22.9,"La phyto-énergétique permet d&#39établir des liens entre les huiles essentielles et les énergies connues en médecine traditionnelle chinoise. Les huiles essentielles contiennent, sous une forme particulièrement concentrée, les principes actifs des plantes et ont un réel pouvoir thérapeutique lorsqu&#39elles sont bien choisies et bien utilisées. L&#39intérêt de la phyto-énergétique, c&#39est d&#39utiliser les huiles essentielles non plus comme des médicaments pour traiter des symptômes, mais comme des aiguilles d&#39acupuncture qui envoient des informations chimiques et vibratoires à chaque cellule et agissent ainsi sur la zone concernée. Cette pratique permet à l&#39organisme de recouvrer son équilibre et d&#39améliorer jour après jour sa santé.",978-2702899021,https://m.media-amazon.com/images/I/81S5KLykRgL._SY522_.jpg,Albin Michel (2 juin 2004),Michel Odoul,Holistique
"Cheveu, parle-moi de moi: Le cheveu, fil de l&#39âme",12.7,"Le cheveu réagit à tout ce qui nous touche profondément : nos peurs, nos angoisses, le stress, etc. D&#39ailleurs, les vieux dictons et expressions du langage courant se révèlent bien souvent justes : "" Il se fait des cheveux blancs "" J&#39en ai les cheveux qui se dressent sur la tête "", etc. Antenne émettrice et réceptrice du corps humain, le cheveu en dit long, pour qui sait le décoder, sur l&#39énergie, les tensions, les souffrances ou les blessures que chacun de nous porte en lui. Pourquoi coupe-t-on ses cheveux longs ? Pourquoi change-t-on brutalement de style ou de couleur ? Pourquoi donne-t-on à sa coiffure un mouvement à droite ou à gauche, vers l&#39avant ou vers l&#39arrière ? Et que dire de tous les traitements que nous faisons subir à nos cheveux ? Ces façons de les contraindre peuvent-elles être transformées en des changements compris et acceptés, permettant ainsi l&#39embellissement de l&#39être ? Voilà autant de questions auxquelles cet ouvrage étonnant apporte un éclairage et des réponses claires et simples.",978-2226134172,https://m.media-amazon.com/images/I/71u+aCPmukL._SY522_.jpg,Albin Michel (3 juillet 2002),Michel Odoul,Holistique
"Acidose et mucose toxiques: Pour en finir avec les inflammations, douleurs et surcharges",19.16,"L&#39acidose et la mucose toxiques sont à l&#39origine métabolique de quasiment toutes nos maladies aigues (rhume, angine, goutte...), mais aussi chroniques (rhumatismes, sinusite...) ou de civilisation (cancer, maladies cardiovasculaires, diabète, Alzheimer...). Comprendre en détail l&#39origine de ces nuisances (alimentation, stress, pollutions, sédentarité, émonctoires...) permet de les éliminer et de voir disparaître les inflammations, douleurs, catarrhes, cristaux, dermatoses, et autres troubles dits de surcharge... Une clé essentielle pour une santé durable et responsable !",978-2889532513,https://m.media-amazon.com/images/I/41jzNJ5kSEL.jpg,JOUVENCE (19 novembre 2019),Daniel Kieffer,Holistique
Médecine énergétique : Éveiller le guérisseur en vous,21.2,"Vous êtes un treillis d’énergies. Explorez et canalisez ces énergies pour votre santé et votre bien-être et vous constaterez à quel point les énergies dynamiques qui circulent en vous révèlent d’une façon extraordinaire le génie créateur de la nature. Ce livre est conçu pour vous permettre de développer votre pouvoir. Le corps veut guérir, et chaque cellule possède une intelligence et une force extraordinaires. Broché 18 x 23,5 - 408 pages - Abondamment illustré",978-2920987999,https://m.media-amazon.com/images/I/61U3UcdmHWL._SY522_.jpg,ARIANE (16 juin 2005),Donna Eden,Holistique
AFFIRMATIONS POSITIVES: 1000+ Affirmations pour reformater le cerveau et booster l&#39estime de soi. Le moyen le plus rapide de développer la pensée positive et d&#39attirer tout ce que vous voulez.,7.74,"Nouveau : Version audio incluse avec la version brochée !

Vous êtes fatigué(e)s de la façon dont votre vie se déroule.
Vous aimeriez avoir un meilleur emploi, plus d&#39argent, être en meilleure santé et avoir de meilleures relations, mais peu importe les efforts que vous déployez, vous n&#39obtenez jamais les résultats escomptés. Vous avez entendu parler du pouvoir des affirmations positives, mais vous ne savez pas à quel point elles peuvent vous aider à améliorer votre vie.",979-8783077180,https://m.media-amazon.com/images/I/61InZNF2eUL._SY522_.jpg,Independently published (30 septembre 2022),Health and Wealth,Holistique
"Racines familiales de la ""mal a dit""",19.0,"L&#39auteur nous démontre d&#39une part que la maladie est la solution biologique de survie du cerveau inconscient ; d&#39autre part que la maladie est un nouvel organe, zone de décharge d&#39un stress familial dans une traduction biologique. Elle cherche à résoudre un conflit précis vécu dans l&#39histoire des parents. Ce manifesté est le résultat d&#39un deuil non fait dans le vécu-ressenti d&#39un des parents et cette solution vient libérer le champ émotionnel de cette mémoire familiale. Chaque vie est la réparation, la sacralisation de la saga familiale. À travers ce labyrinthe de l&#39inconscient, Joseph utilise comme fil d&#39Ariane la biologie, c&#39est-à-dire les mécanismes physiologiques de chaque fonction cellulaire. Il permet ainsi à chacun de devenir lecteur créatif d&#39un texte particulier, celui de son existence.",978-2951846302,https://m.media-amazon.com/images/I/715M5lCWdJL._SY522_.jpg,Pictorus (30 novembre 2002),Gérard Athias,Holistique
Vaincre l&#39HYPERPHAGIE: Le Pouvoir de l&#39Hypnose et de l&#39Auto-Coaching,11.19,"Reprenez le contrôle de votre vie !
""Vaincre l&#39Hyperphagie : Le Pouvoir de l&#39Hypnose et de l&#39Auto-Coaching"" est un guide simple et pratique destiné à toute personne cherchant à surmonter les défis de l&#39hyperphagie. Cet ouvrage combine des techniques éprouvées d&#39hypnose avec des stratégies d&#39auto-coaching, offrant une approche holistique pour contrôler les pulsions alimentaires et recréer des habitudes alimentaires saines.
Retrouvez bien-être mental et physique : Découvrez comment l&#39hypnose pour l’hyperphagie peut transformer votre rapport à la nourriture, réguler votre appétit. Apprenez à concevoir vos séances, devenez autonome avec l’auto-hypnose expliquée dans ce livre.",979-8868238963,https://m.media-amazon.com/images/I/51fya0XMTRL._SY522_.jpg,Independently published (20 novembre 2023),Jean-Philippe Chéru,Holistique
"La méditation du guerrier: Le secret le mieux gardé du développement personnel, du perfectionnement cognitif et de la lutte contre le stress, enseigné par un maître dans quatre arts samouraïs",14.71,"Découvrez la forme de méditation originale, instinctive et non religieuse qui s’est perdue au fil du temps. Richard L. Haight, auteur primé de The Unbound Soul et maître de quatre arts martiaux samouraïs, partage le secret le mieux gardé au monde dans les domaines du développement personnel, du perfectionnement cognitif et du soulagement du stress, qu’il appelle la méditation du guerrier.
Pour tous les milieux, genres et âges.
Pour vous faire une représentation mentale de la méditation du guerrier, imaginez un champ de bataille sur lequel se trouve un seul samouraï entouré de multiples adversaires. L’attention d’un débutant passerait sans arrêt d’un adversaire à l’autre dans une tentative anxieuse de se défendre. Une telle stratégie fatigue rapidement le guerrier, qui sera vaincu. Un guerrier expérimenté repartira son attention de manière égale dans toutes les directions, mais il éprouvera quand même de l’anxiété pendant qu’il prépare mentalement ses tactiques. Ses pensées et son anxiété peuvent être sa perte si ses adversaires sont très habiles. L’attention d’un maître, comme celle de l’expert est répartie de manière égale, mais il demeure calme, il ne possède pas de plan d’action, son corps effectue les actions adéquates selon les besoins du moment.",978-1532333927,https://m.media-amazon.com/images/I/71dI5vYQX3L._SY522_.jpg,Independently Published (12 février 2020),Richard L Haight,Holistique
"Aujourd&#39hui je danse enfin avec la vie !: Comment se libérer de nos croyances limitantes, avoir confiance en soi, et en finir avec le stress, ... (16 Bonus audio : Méditation, Hypnose - EFT)",16.53,"Aujourd’hui je danse enfin avec la vie !
Comment se libérer de nos croyances limitantes, avoir confiance en soi, et en finir avec le stress, l’anxiété et l’angoisse
⬇️⬇️⬇️
Ce livre, je l’ai écrit suite à une période de vie particulièrement douloureuse : stress post-traumatique, angoisses, anxiété généralisée, crises de panique jusqu’à la phobie d’impulsion. Je pensais que cette fois-ci, je ne me relèverais pas. Mais à ce moment-là, je n’avais pas conscience de la force de vie qui m’habitait. Aujourd’hui, je reprends mon pouvoir. Je m’autorise, de plus en plus, à être qui je suis.

Nous avons le droit d’être qui nous sommes, sans culpabilité, sans honte. Nous avons le droit d’être imparfait(e), vulnérable, et d’exprimer nos émotions. Crise d’angoisse, anxiété, burn-out, dépression, peu importe la période de vie que vous avez vécue ou que vous vivez. Comme dirait mon ami et mentor, François Lemay, nous ne sommes pas brisés, tout change tout le temps.

Et si ces phases étaient parfaites pour nous libérer et nous apprendre à danser avec la vie ? Si j’ai pu le faire, vous le pouvez aussi. Dans ce livre, je vous transmets toutes mes connaissances, mon expérience et de nombreux exercices pour vous aider à maîtriser ces enseignements.

J’ai à cœur de vous donner le maximum pour vous aider à vous libérer de vos croyances limitantes, de vos peurs, vos angoisses, de ces pensées anxiogènes qui sabotent qui vous êtes profondément. Je veux vous aider à créer la vie que vous souhaitez vraiment, celle qui fait briller vos yeux.",978-2958572907,https://m.media-amazon.com/images/I/61lclRoHEBL._SY522_.jpg,Terre Happy Zzzen Editions (19 novembre 2022),Manuela Rossell,Holistique
Fleurs de Bach et lithothérapie pour les animaux,15.07,"Associez les fleurs de Bach aux élixirs minéraux pour la santé émotionnelle de vos compagnons.
Aidez-les à résoudre en douceur leurs troubles du comportement.
Les animaux sont des membres chéris de nos familles. Avec Les fleurs de Bach et Lithothérapie pour les animaux, plongez dans l’univers thérapeutique des élixirs floraux et minéraux. Découvrez comment ces approches naturelles peuvent améliorer la santé émotionnelle et le bien-être de vos compagnons.

Les fleurs de Bach et leurs propriétés vibratoires équilibrantes aident nos animaux à surmonter les défis du quotidien (peurs, anxiété, troubles du comportement, transitions difficiles…). Sur le même principe de résonance, l’énergie vibratoire des",979-8321104514,https://m.media-amazon.com/images/I/61H5Dl4EV5L._SY522_.jpg,Independently published (29 mars 2024),Stabby Lo Editions Collection Animalis,Holistique
Bien choisir ses probiotiques : le guide pratique,8.51,"Bien choisir ses probiotiques : le guide pratique est destiné au grand public et se base entièrement sur les conclusions d’études scientifiques récentes. Ce qui en fait un travail de synthèse unique en son genre.
A travers cet ouvrage, vous trouverez des dizaines de pathologies pour lesquelles la prise de probiotiques a un intérêt. Se voulant avant tout pratique, ce guide vous propose, en fonction de la pathologie, la ou les souches probiotiques les plus recommandées ; ainsi que le dosage et la durée les plus appropriés pour potentialiser les effets sur votre santé.
Concis et rigoureux, ce livre vous permettra de tirer les plus grands bénéfices des probiotiques pour votre santé.

Titulaire d’un doctorat en médecine générale,",979-8851519161,https://m.media-amazon.com/images/I/61Gf-6CVjvL._SY522_.jpg,Independently published (14 juillet 2023),Benoit AKPEMADO,Holistique
Le Décodage dentaire - Comprendre le sens de nos problèmes de dents - ABC,12.19,"Savez-vous que vos dents entretiennent des liens avec votre inconscient ? C&#39est ce que vous dévoile cet ouvrage. Le décodage dentaire s&#39appuie sur le transgénérationnel, les charges émotionnelles refoulées ainsi que l&#39insconscient personnel et collectif pour donner un sens à la douleur, à la perte d&#39une dent, à une malposition, et même aux maladies parodontales ou aux aphtes. Car le décodage dentaire offre l&#39accès à l&#39identité vivante de l&#39individu ! Ce livre, écrit après plus de quatorze années de pratique, vous présente une lecture psychologique et symbolique de chaque dent afin d&#39expliquer certaines de leurs pathologies autrement qu&#39en vous culpabilisant. Car vous découvrirez qu&#39une carie n&#39est pas forcément la conséquence d&#39un mauvais brossage des dents ! Véritable grille de lecture de la psyché humaine, le décodage dentaire est un outil incomparable de rencontre et de connaissance de soi.",978-2733913307,https://m.media-amazon.com/images/I/51OlzOCDcXL._SY522_.jpg,GRANCHER; Illustrated édition (31 mars 2015),Christian Beyer,Holistique
"Se reconnecter aux saisons: Naturopathie, sophrologie, psychologie...une approche holistique du bien-être",22.9,"Laissez-vous porter par l&#39éclosion du printemps, le rayonnement de l&#39été, les couleurs de l&#39automne et la douceur de l&#39hiver.

La cadence trépidante de vos vies, le calendrier scolaire ou professionnel, les activités diverses et variées vous ont déconnecté du rythme, cyclique, de la nature ? Vous vous sentez perdu, pas vraiment aligné, vos idées sont confuses et vous avez l’impression de vivre à côté de votre corps, à côté de vous-même ? Ce bel ouvrage vous invite à intégrer la dynamique propre à chaque saison et ainsi à rééquilibrer votre vie. En vous reconnectant aux saisons, vous prendrez conscience que chacune d’entre elles est un cadeau que vous offre la nature, une occasion d’avancer sur votre chemin d’évolution, dans quatre univers différents, en respectant le cycle naturel de toutes choses. Un portrait complet du printemps, de l’été, de l’automne puis de l’hiver vous est présenté : les grands rendez-vous, les organes dont il faut prendre soin, l’alimentation à privilégier, les huiles essentielles, plantes aromatiques et fleurs de Bach à avoir dans son panier, l’état d’esprit induit par la saison en question, les exercices physiques et les activités qui vous permettront de vivre en lien avec le cycle de la nature… L’autrice vous confie tous ses secrets pour bien vivre chaque saison grâce à la naturopathie, la sophrologie, le yoga, la méditation, la médecine chinoise ou encore la psychologie. Laissez-vous porter par l’éclosion du printemps, le rayonnement de l’été, les couleurs de l’automne et la douceur de l’hiver ! ",978-2889534371,https://m.media-amazon.com/images/I/91jWojp4uML._SY522_.jpg,JOUVENCE; Illustrated édition (23 février 2021),Sabrina Romeo-Dussard,Holistique
Médecin des trois corps,8.2,"Qui sont ces guérisseurs philippins qui, d&#39un tour de main, enlèvent un appendice sans laisser de cicatrice ? D&#39où viennent ces fragments de chair qu&#39ils extirpent prestement des entrailles de leurs patients ébahis ? Charlatanisme ou science authentique ? Après la mort de sa mère et la crise qui s&#39ensuivit, l&#39auteur, médecin anesthésiste à l&#39hôpital parisien Broussais, découvre d&#39autres médecines et se rend à Manille pour suivre l&#39enseignement d&#39un célèbre guérisseur, Tony Agpaoa. Le savoir exceptionnel des guérisseurs philippins permettra à Janine Fontaine d&#39accéder à une réalité invisible. Après une éprouvante initiation, elle observera l&#39existence de trois corps : physique, énergétique et spirituel. Un plaidoyer troublant pour une médecine globale.",978-2290348277,https://m.media-amazon.com/images/I/61Rg1iIRW1L._SY522_.jpg,J&#39ai lu (24 mai 2005),Janine Fontaine,Holistique
Les mystères de la dent,16.0,"Les dents recèlent nombre d&#39informations sur nous, notre histoire et nos origines. Elles sont semblables à un livre qui s&#39ouvre et qui se ferme, pour révéler ou dissimuler de mystérieux récits. Voici un travail original résultant de la collaboration entre Gérard Athias et Georges Lahy, chacun portant, en fonction de son art, un regard particulier et libre sur les dents. Il ne s&#39agit nullement d&#39un ouvrage médical d&#39orthodontie, mais plutôt d&#39une étude symbolique de chaque dent ou groupe de dents. Broché - 14,8 x 21 - 160 pages",978-2952514767,https://m.media-amazon.com/images/I/81SZi8Q6PYL._SY522_.jpg,PICTORUS (16 avril 2009),Georges Lahy,Holistique
Fondements de biodynamique cranio-sacrée volume 1: Le souffle de vie et les compétences fondamentales,45.0,"La biodynamique crânio-sacrée a été développée par des ostéopathes et des thérapeutes manuels à partir des découvertes de William Garner Sutherland. Celui-ci réalisa que les os du crâne sont conçus pour un mouvement respiratoire qui est une propriété de tous les tissus et fluides du corps. La physiologie humaine est vivifiée et nourrie par des forces rythmiques présentes dans le monde naturel. Si les cellules et les tissus peuvent exprimer leur mouvement rythmique subtil, le plan fondamental de notre santé est en mesure de se manifester, et un ressenti de plénitude et de bien-être s&#39ensuit automatiquement. La thérapie biodynamique est fondée notamment sur l&#39aptitude du thérapeute à entrer dans un état de présence orienté vers la capacité inhérente du patient à se guérir. La formation comprend l&#39apprentissage de profondes aptitudes de perception et de centrage, de même que l&#39étude de l&#39anatomie, de la physiologie et de la dynamique de la respiration primaire. Dans Fondements de biodynamique crânio-sacrée, Franklyn Sills offre aux étudiants et aux praticiens un guide pour maîtriser les compétences perceptives et cliniques essentielles à l&#39approche biodynamique. Cela inclut la compréhension du champ relationnel, l&#39aptitude du praticien à s&#39installer dans un état d&#39être où son esprit est apaisé et orienté, le glissement holistique vers la plénitude et la respiration primaire, ainsi que le déploiement de ce que Rollin Becker appelait le plan de traitement inhérent. Il offre des analyses lumineuses de la théorie et de la pratique, ainsi qu&#39un vaste éventail d&#39exercices et d&#39explorations utilisés dans les formations.",978-2354322403,https://m.media-amazon.com/images/I/81g4okLggOL._SY522_.jpg,SULLY (24 septembre 2019),Franklyn Sills,Holistique
"Tu es le Chemin, la Vérité et la Vie: Manifeste ta vie de rêve avec la loi de l&#39assomption de Neville Goddard - Un livre sur le succès et la spiritualité",16.54,"Les principes de la manifestation dans un seul livre : &#39Tu es le Chemin&#39 vous guide étape par étape vers la réalisation de vos souhaits avec la Loi de l&#39Assomption selon Neville Goddard !

Je suis heureux que vous ayez trouvé votre chemin ici, car quelque chose en vous aspire à PLUS dans la vie - plus d&#39amour, plus de bonheur, plus d&#39accomplissement. Mais tant que ces choses restent juste un souhait, vous poursuivrez vos rêves indéfiniment. Ce dont vous avez besoin pour réaliser votre souhait, ce sont des techniques éprouvées de manifestation.

Vous êtes-vous déjà demandé pourquoi certaines personnes ont un &#39toucher en or&#39, tandis que d&#39autres sont constamment hantées par la malchance ? Si vous vous comptez dans la première catégorie, félicitations ! Vous êtes déjà plutôt bon pour créer des",979-8872803935,https://m.media-amazon.com/images/I/71T+s5YmivL._SY522_.jpg,Independently published (1 janvier 2024),Fabio Mantegna,Holistique
Harmonie Énergétique: Maîtriser l&#39art des soins énergétiques et émotionnels,18.61,"Harmonie Énergétique : Maîtriser l&#39Art des Soins Subtils
Introduction
Découvrez l&#39univers fascinant de l&#39hypno-magnétisme intégrative dans ""Harmonie Énergétique : Maîtriser l&#39Art des Soins Subtils"". Ce livre guide le lecteur à travers une approche holistique de la santé, mêlant connaissances ancestrales et techniques modernes.
Principes Fondamentaux
Le voyage commence par l&#39exploration des principes fondamentaux de l&#39hypno-magnétisme intégrative. Apprenez à détecter les déséquilibres énergétiques, à comprendre l&#39intelligence universelle, la conscience neurovégétative, et à maintenir l&#39homéostasie naturelle.",979-8877980679,https://m.media-amazon.com/images/I/61WWMnKHGRL._SY522_.jpg,Independently published (30 janvier 2024),Jean Angius,Holistique
"Le Soigneur d&#39arbres, enquête du lieutenant Leclou T2: Roman initiatique, la rencontre avec Macha, journaliste",11.47,"Dans cet opus, le lieutenant Leclou, héros d&#39une série de plusieurs aventures extraordinaires, rencontre Macha la journaliste, avec qui il vivra ensuite de nombreuses péripéties.
Une histoire de rencontres, des personnages forts, une intrigue humaine.

L&#39HISTOIRE :
Macha, jeune journaliste auteure d&#39une chronique à succès, débarque dans le village de Mandinier pour faire le portrait du ""Soigneur d&#39arbres"", un métier peu connu qui prend en compte les besoins du végétal avant tout.
Mais l&#39homme ne cherche pas la lumière et n&#39est pas prêt à se livrer.
Quand, après un évènement tragique, elle finit enfin par le rencontrer, il décèle aussitôt ses failles et lui ouvre les portes d&#39un univers aux vertus insoupçonnées.

Autres titres de l&#39auteure : L&#39envers des corps, Code tattoo, Offre logement contre menus services, La jolie vie de Mélanie, Deuxième étage rayon hommes, Le dernier facteur, C&#39est comme ça Papa !, Avant qu&#39il n&#39en reste rien, L&#39atelier des coeurs égarés, Le chant de la baie, Page blanche, L&#39affaire LECLOU, Ceux de l&#39ubac, Où scintillent les roches, Francesca, Une formule vraiment magique",979-1096121182,https://m.media-amazon.com/images/I/71NhnVl4WGL._SY522_.jpg,Paquier (12 novembre 2018),Virginie Paquier,Holistique
,8.44,,,,,,Holistique
"LA KINÉSIOLOGIE, Le Guide Complet: Explorer Le Langage Corporel Du Bien-Être",15.33,"Vous Voulez Comprendre En Profondeur Le Langage De Votre Corps Et Les Signaux Qu&#39il Vous Envoie En Permanence ? Vous Êtes Intrigué Par La Façon Dont Vos Émotions Et Votre Esprit Se Reflètent Dans Vos Mouvements Et Vos Postures ? Vous Aspirez À Améliorer Votre Bien-Être Et Votre Conscience De Soi Grâce À Une Compréhension Approfondie De La Kinésiologie ?
Si Vous Avez Répondu Oui, Alors Ce Guide Essentiel Est Parfait Pour Vous, Mais Avant De Vous Lancer Immédiatement Dans Cette Aventure Magique Et Fascinante, Laissez-Moi Vous Expliquer Pourquoi Ce Livre Transformera Votre Vie Presque Automatiquement Et D&#39une Manière Qui Répondra À Tous Vos Besoins, Presque Sans Que Vous Vous En Rendiez Compte.
Tout D&#39abord, Plus Vous Vous Plongerez Dans Cette Lecture Puissante, Plus Vous Comprendrez Le Lien Intime Qui Existe Entre Votre Esprit, Vos Émotions Et La Façon Dont Votre Corps S&#39exprime. Il Est Amusant De Constater Que Lorsque Vous Vous Plongez Dans Le Monde Du Langage Corporel, Vous Avez L&#39impression Que Chaque Chapitre Révèle Des Secrets Profonds Sur Votre Être.
Deuxièmement, En Comprenant La Biomécanique Et La Façon Dont Elle Façonne Notre Santé, Vous Obtiendrez Des Outils Pour Prendre Soin De Vous Et Comprendre L&#39état De Votre Bien-Être. Ce Guide Complet Et Actualisé Vous Permet De Décrypter Les Liens Entre Le Corps Et L&#39esprit Et La Façon Dont Ils Affectent Votre Santé Mentale, Votre Posture, Votre Estime De Soi Et Bien Plus Encore.
Troisièmement, De Manière À Répondre À Tous Vos Besoins, Il Vous Proposera Des Innovations En Kinésiologie, Allant De L&#39influence De La Technologie Aux Prédictions Et Perspectives D&#39avenir. Ainsi, Vous Serez Automatiquement Au Courant Des Développements Les Plus Contemporains Dans Ce Domaine.
Maintenant, Laissez-Moi Vous Dire Pourquoi Ce Livre Pourrait Ne Pas Vous Convenir :
1. Si Vous Attendez Des Résultats Rapides D&#39une Seule Lecture, Sans Vous Engager Dans La Pratique Et La Réflexion, Ce Guide Essentiel N&#39est Peut-Être Pas Votre Meilleur Choix. 2) Au Contraire, Si Vous N&#39avez Pas L&#39habitude De Terminer Ce Que Vous Commencez, Vous Vous Retrouverez Avec Un Ouvrage Qui Nécessitera Votre Engagement Et Votre Dévouement Pour En Tirer Le Meilleur Parti. 3) Si Vous N&#39êtes Pas Disposé À Ouvrir Votre Esprit À De Nouvelles Perspectives Et À Explorer La Profondeur De La Relation Entre Le Corps Et L&#39esprit, Vous Risquez De Ne Pas Tirer Le Meilleur Parti De Ce Trésor De Connaissances.
Cependant, Si Vous Êtes Quelqu&#39un Qui Accorde De L&#39importance Au Développement Personnel, Qui Cherche Des Réponses Et Qui Est Prêt À S&#39embarquer Dans Une Aventure Fascinante De Connaissance De Soi, Alors Ce Guide Essentiel Est Parfait Pour Vous.
Donc, Si Vous Êtes Prêt À Transformer Votre Compréhension De La Kinésiologie Et À Explorer Le Langage Corporel Du Bien-Être, Je Vous Invite À Vous Plonger Dans Cet Ouvrage. Plongez, Explorez Et Émerveillez-Vous À Chaque Page - Cliquez Maintenant Et Commencez Ce Voyage De Découverte !",979-8877206274,https://m.media-amazon.com/images/I/71QwTkWmNUL._SY522_.jpg,Independently published (23 janvier 2024),Antonio Jaimez,Holistique
