Nom,Prix,Description,Isbn,Photo,Editeur,Auteur,Categorie
"The Miracle Ball Method, Revised Edition: Relieve Your Pain, Reshape Your Body, Reduce Your Stress",12.58,"Break the cycle of pain with the Miracle Ball Method. ""After taking just one of Elaine’s ball therapy classes, I was asymptomatic for the first time in 15 years. I now recommend it to all of my patients.""–– Fred Jones, D.C., Sunshine Chiropractic and Wellness, Merrick, NY The Miracle Ball Method is a revolutionary program designed to help relieve your pain, reshape your body, and reduce your stress. Using controlled breathing, two squishy balls, and simple exercises of rolling and rotating, you can learn to heal everything from a bad knee to a stressed-out back. Made out of nontoxic PVC vinyl, the balls are sized to tuck under strategic parts of your body. Like magnets, they actually draw out pain and tension. Includes: ·Two durable Miracle Balls ·176-page illustrated book with 30 exercises ·Features routines for pain relief, reduced anxiety, and better sleep",978-1523510740,https://m.media-amazon.com/images/I/81ywe7Xv7FL._SY522_.jpg,Workman Adult; 2e édition (1 septembre 2020),Elaine Petrone,Gestion de la douleur
"No Grain, No Pain: A 30-Day Diet for Eliminating the Root Cause of Chronic Pain",14.11,"“A must-read book for anyone suffering from chronic pain” (Sara Gottfried, MD), No Grain, No Pain demonstrates the proven link between a gluten-heavy diet and chronic pain and discomfort—and offers a groundbreaking, 30-day, grain-free diet to help you heal yourself from the inside out.

More than 100 million Americans suffer from chronic pain, according to an Institute of Medicine report released in 2011. For many, chronic pain is part of an autoimmune disease, but all too often doctors turn to the same solution: painkilling drugs.

But all of this medication simply isn’t helping, and as Dr. Peter Osborne, the leading authority on gluten sensitivity and food allergies has found, the real solution often lies in what you eat. In",978-1501121692,https://m.media-amazon.com/images/I/71iGVg02cpL._SY522_.jpg,Atria; Reprint édition (1 novembre 2016),Peter Osborne,Gestion de la douleur
"Heal Pelvic Pain: A Proven Stretching, Strengthening, and Nutrition Program for Relieving Pain, Incontinence, I.B.S, and Other Symptoms Without Surgery",16.99,"Bronze Medal Winner of a 2009 National Health Information Award
Stop your pelvic pain . . . naturally!
If you suffer from an agonizing and emotionally stressful pelvic floor disorder, including pelvic pain, irritable bowel syndrome, endometriosis, prostatitis, incontinence, or discomfort during sex, urination, or bowel movements, it&#39s time to alleviate your symptoms and start healing--without drugs or surgery. Natural cures, in the form of exercise, nutrition, massage, and self-care therapy, focus on the underlying cause of your pain, heal your condition, and stop your pain forever.
The life-changing plan in this book gets to the root of your disorder with:",978-0071546560,https://m.media-amazon.com/images/I/61DMFTMqbyL._SY522_.jpg,McGraw-Hill Education (27 août 2008),Amy Stein,Gestion de la douleur
Mal de dos - Approches Naturelles: Prévenir et Soulager la Douleur | Exercices - Étirements - Lombaires | Top 10 des Remèdes Naturels,16.62,"Edition 2021. Livre mis à jour en 2021.
Les douleurs dorsales peuvent réellement être incapacitantes.
Le mal de dos peut être passager, ou devenir rapidement un combat de toute une vie en raison d&#39une blessure ou d&#39une maladie.
Heureusement, il existe des moyens naturels de soulager le mal de dos sans nécessairement avoir recours aux médicaments.
L&#39objectif de ce petit guide est de vous aider à améliorer votre qualité de vie avec une approche centrée sur la reconstruction : diminuer la douleur, contrôler l&#39inflammation, améliorer le sommeil et retrouver votre mobilité.
Ce que vous trouverez dans ce guide :",979-8581830246,https://m.media-amazon.com/images/I/61TpcrIeetL._SY522_.jpg,Independently published (17 décembre 2020),Pauline PATRY,Gestion de la douleur
Soulager la douleur: Cas concrets pour savoir pratiquer le Dien Chan - Tome 1,18.87,"Le Dien Chan est une méthode vietnamienne de multiréflexologie mise au point par le professeur Bùi Quôc Châu en 1980.Elle permet, par la simple stimulation de points sur le visage, ou sur le corps, de soulager bien des maux et d&#39améliorer notre santé.
Le livre ""soulager la douleur"" comprend 4 parties :
- Entretien du corps
- Soulager la douleur ( 51 cas concrets , les troubles courants)
- 45 Astuces du Dien Chan pour aider à résoudre des petits problèmes fréquents
- Les paroles au coeur du Dien Chan :
(philosophie, art et comportement du Dien Chan)
Ce livre vous aide à soulager la douleur ou la supprimer selon votre état.
Ce livre sert à tout le monde, la technique est facile à appliquer et le résultat est obtenu rapidement.
Essayez.",978-2954026039,https://m.media-amazon.com/images/I/31lb0LojYjL.jpg,Zys (Le Yen) (15 avril 2020),Le Yen Zys,Gestion de la douleur
"Becoming the Body: Embodiment Through Somatic Therapy: Exercises and Tools for Trauma, Stress, and Finding Mind-Body Connection",10.31,"Somatic Therapy Allows Us to Regain Control Over Our Emotions and Break Free From the Impact of Our Past.
When a traumatic event occurs, our body triggers its “fight or flight” response. In many scenarios, the emotional reactions of this response get trapped, disrupting the feedback loop between our mind and body, leading to an imbalance in our nervous system function. Over time this can cause chronic stress, pain, high blood pressure, and a weakened immune system. This, alongside regular triggers in our everyday life, will manifest into a disconnection between our mind and body and create a constant feeling of dissociation from our emotions, with minimal control over how we feel.",978-1998855025,https://m.media-amazon.com/images/I/51GV+Z0msNL._SY522_.jpg,Kenneth M Fornari (3 avril 2023),Ken Michaels,Gestion de la douleur
