Nom,Prix,Description,Isbn,Photo,Editeur,Auteur
Dessine ta vie !: 100 petits exercices d'art thérapie,10.95,"Alléger le poids des choses, lâcher prise, échapper à l’emprise du stress, reprendre confi ance, se réconcilier avec ses souvenirs… Et si c’était possible avec un simple carnet et quelques crayons ?

Ce livre vous propose 100 défis simples, ludiques, transgressifs ou joyeusement décalés qui libéreront votre potentiel créatif et vous redonneront confiance en vous :
- Dessiner les yeux fermés, découvrir l’écriture automatique
- Jouer avec les empreintes de doigts, détourner des objets
- Regarder d’un œil neuf son quotidien, dessiner en pleine conscience
- Libérer sa colère, prendre un bain de couleurs
- Faire le point sur ses envies, goûter au temps présent

Un carnet à emporter partout avec soi, pour dessiner sa vie au quotidien !",978-2295006868,https://m.media-amazon.com/images/I/91pJ2xkCD7L._SY522_.jpg,Dessain et Tolra; Illustrated édition (8 mars 2017),Filliette Cécile-Alma
100 Nouveaux coloriages Mystères,14.95,"Cultivez l'art de la concentration visuelle.

Avec de simples crayons ou feutres de couleur, coloriez chaque case numérotée pour découvrir un tableau inédit : animaux, paysages, personnages... Laissez-vous surprendre par la richesse des sujets et des associations de couleurs.
Chaque dessin constitue une agréable parenthèse dans votre emploi du temps et vous offre un support de détente immédiate.",978-2013968812,https://m.media-amazon.com/images/I/91exnY8v-iL._SY522_.jpg,Hachette Heroes; Illustrated édition (22 octobre 2014),Jérémy Mariez
"Esquisse Inachevée: 100 dessins à compléter, pour explorer votre imagination !",13.69,"Esquisse Inachevée, c'est un voyage artistique qui vous invite à éveiller votre créativité et à explorer votre imagination en complétant des illustrations originales.

Ce livre est une expérience insolite qui vous propose :
100 illustrations originales
Thérapie douce
Développer l’imaginaire
Pause bien être

Détendez-vous en vous reconnectant à votre âme d’artiste !

Que vous soyez novices ou experts en coloriage, ce livre offre une expérience inoubliable.",,https://m.media-amazon.com/images/I/61d44-5DC0L._SY522_.jpg,Independently published (28 mai 2024),Luty Berata
L'écologie de la vie humaine: Une approche pratique pour réconcilier l’Humain avec son quotidien,8.6,"L’écologie de la vie humaine
Une approche pratique pour réconcilier l’Humain avec son quotidien.

Ce livre est la conséquence d’années d’observation de l’être humain, et sur divers continents. De partout, de plus en plus d’humains vivent comme en décalage avec leurs besoins, toujours à la recherche de plus de ressources ou en subissant les contraintes de leur quotidien.

Différents pays, différentes situations économiques, sociales, familiales, différentes cultures, mais toujours des hommes et des femmes qui perdent leur alignement avec eux-mêmes.

La société évolue à un rythme fou, que l’humanité ne suit pas.
Et tout comme la planète c’est tout l’écosystème humain qui est menacé : insatisfaction, burn-out, anxiété, stress, tensions, épuisement…

L’être humain n’a jamais autant eu de ressources mais ne s’est jamais autant posé la question de son état de bien-être.
Comment reprendre le contrôle de notre écologie de vie ?
Comment faire en sorte d’être aligné avec son environnement et ses envies ?

Ce livre, c’est une piste de réflexion autour de notre quotidien. Un questionnement et des actions concrètes à mettre en place pour équilibrer la balance de notre écologie de vie.

Après lecture de ce livre, tu auras des pistes d’amélioration pour mieux utiliser tes ressources actuelles et pour les développer de manière exponentielle.

Tu sauras aussi observer et comprendre tes contraintes pour en tirer le maximum de bénéfices et éliminer ou réduire celles qui ne te permettent pas de t’épanouir.

Le concept d'écologie de vie a permis à de nombreux humains de s'épanouir d'avantage dans leur vie quotidienne, que ce soit dans les sphères personnelles, sociales, ou professionnelles; et il te servira sans aucun doute à toi désormais pour vivre de la manière la plus adaptée possible en fonction de qui tu es.

Ce livre est un livre de chevet que tu pourras reprendre et réutiliser à différentes étapes de ta vie.

Lucas Bourguignon

https://www.instagram.com/lucas_bourguignon_conferencier/",978-2959139703,https://m.media-amazon.com/images/I/61u8OvDu7lL._SY522_.jpg,,Lucas Bourguignon
La Méthode T.R.E pour se remettre d'un stress extrême,12.92,"Cet ouvrage présente une méthode simple de récupération après un stress intense, qui va vous surprendre. Elle se base sur une observation : les mammifères récupèrent d'une agression en tremblant le temps nécessaire à évacuer toute tension.
Cette méthode novatrice de libération des traumas baptisée T.R.E (Trauma Releasing Exercices), nous l'avons découverte lors d'une conférence internationale à Bruxelles et nous avons été surpris de ressentir un bien-être immédiat accompagné d'une grande sérénité.
Nous encourageons chaque personne à tenter cette expérience très simple sur une période de quelques semaines afin d'en ressentir pleinement les bénéfices. Les personnes exposées régulièrement à des situations difficiles ou témoins de traumatismes, tel le personnel soignant, accumulent jour après jour des tensions sans forcément en prendre conscience. Elles tireront un grand bénéfice des quelques minutes quotidiennes consacrées à la mise en pratique des exercices T.R.E.
Les thérapeutes spécialisés dans le stress post-traumatique trouveront ici un outil efficace pour libérer physiquement le corps de son stress en complément des techniques énergétiques qui, elles, s'adressent prioritairement au cerveau émotionnel.",978-2365490740,https://m.media-amazon.com/images/I/61cyH6E3sXL._SY522_.jpg,Thierry Souccar (20 mars 2014),David Berceli
LA PENSÉE POSITIVE: Comment atteindre vos objectifs et mener une vie positive à travers le pouvoir de la pensée,9.99,"Changez votre vie et commencez à penser positivement!
Savez-vous que la pensée positive fonctionne mais que vous ne savez pas comment la mettre en pratique?
Vous vous sentez triste? Découragé? Tout le monde vous semble heureux?

Tout semble aller mal et la malchance vous suit?

Apprenez l'art de la pensée positive. Apprenez des stratégies, et changez totalement votre vie en lui donnant une toute nouvelle empreinte! Enfin, vous saurez comment utiliser la pensée positive et quels sont ses avantages! Vous allez découvrir un nouveau monde! Dans chaque situation, vous serez en mesure de garder la sérénité, d'affronter les choses de la bonne façon, d'analyser et de faire les meilleurs coups. Grâce à quelques conseils simples, la pensée positive améliorera votre estime de soi, votre santé et vous portera chance!

Dans ce manuel utile, vous apprendrez...",979-8621428907,https://m.media-amazon.com/images/I/61vPdMfXVCL._SY522_.jpg,Independently published (4 mars 2020),Marcello Borelli
LA PENSÉE POSITIVE: Comment atteindre vos objectifs et mener une vie positive à travers le pouvoir de la pensée,9.99,"Changez votre vie et commencez à penser positivement!
Savez-vous que la pensée positive fonctionne mais que vous ne savez pas comment la mettre en pratique?
Vous vous sentez triste? Découragé? Tout le monde vous semble heureux?

Tout semble aller mal et la malchance vous suit?

Apprenez l'art de la pensée positive. Apprenez des stratégies, et changez totalement votre vie en lui donnant une toute nouvelle empreinte! Enfin, vous saurez comment utiliser la pensée positive et quels sont ses avantages! Vous allez découvrir un nouveau monde! Dans chaque situation, vous serez en mesure de garder la sérénité, d'affronter les choses de la bonne façon, d'analyser et de faire les meilleurs coups. Grâce à quelques conseils simples, la pensée positive améliorera votre estime de soi, votre santé et vous portera chance!

Dans ce manuel utile, vous apprendrez...",979-8621428907,https://m.media-amazon.com/images/I/61vPdMfXVCL._SY522_.jpg,Independently published (4 mars 2020),Marcello Borelli
Mandalas: 50 Coloriages Animaux pour Adultes Relaxant et Anti-Stress - Loisirs créatif,18.01,"Inspirant Mandala Animal : Ce livre de coloriage captivant offre une expérience artistique unique en son genre. Chaque page présente des motifs de style mandala, soigneusement conçus pour représenter divers animaux exotiques et familiers.
50 Pages de Détente Créative : Avec 50 pages prêtes à être coloriées, ce livre offre des heures de détente créative. Les mandalas d'animaux variés, allant des éléphants majestueux aux papillons délicats, offrent une grande diversité pour satisfaire tous les goûts.
Format Pratique A4 : Le format A4 pratique de ce livre de coloriage permet une manipulation facile et offre suffisamment d'espace pour les détails les plus minutieux.
Apaisant et Méditatif : Colorier ces mandalas animaux n'est pas seulement une",979-8862951950,https://m.media-amazon.com/images/I/81ry73Nqx-L._SY522_.jpg,Independently published (29 septembre 2023),CREATIVE Edition
Forge Gratitude: Gratitude Journal,13.38,"Forge Gratitude


Unlock the transformative power of gratitude with our Forge Gratitude Journal; a dynamic tool crafted for both men and women. This versatile journal extends beyond the realms of ordinary notebooks, serving as a key to joy and resilience, especially during challenging times.

Features
Uncover the extraordinary in daily life with insightful reflections.
Navigate mental health challenges using the journal's supportive prompts.",,https://m.media-amazon.com/images/I/51JiXnaFrzL._SY522_.jpg,Independently published (8 janvier 2024),Melissa Black
Allen Carr's Easy Way to Stop Smoking: Read this book and you'll never smoke a cigarette again,13.64,"MAKE 2023 THE YEAR YOU QUIT SMOKING, WITH THE HELP OF ALLEN CARR

'It didn't take any willpower. I didn't miss it at all and I was free' Ruby Wax

Read this book and you'll never smoke another cigarette again.
__________

Allen Carr has discovered a method of quitting that will enable any smoker to stop, easily, immediately and permanently.

As the world's bestselling book on how to stop smoking and with",978-1405923316,https://m.media-amazon.com/images/I/81miyVuJWVL._SY522_.jpg,Penguin; 1er édition (24 septembre 2015),Allen Carr
"MOI, BELLE ET GENIALE: Livre de développement personnel pour augmenter sa confiance en soi. Affirme toi et deviens la meilleure version de toi-même ! Comprends que tu es unique et extraordinaire.",12.39,"Révèle la Meilleure Version de Toi-même !

Plonge dans un voyage de développement personnel avec ce guide inspirant conçu spécialement pour toi, femme moderne en quête d'une vie épanouissante et équilibrée.

Découvre des stratégies puissantes pour renforcer ta confiance en toi, surmonter tes doutes et tes peurs, tout en cultivant ta créativité. Tu découvriras des exercices captivants conçus pour t'aider à identifier tes objectifs, à gérer le stress pour créer un équilibre harmonieux dans ta vie de femme.

Ce livre intègre des enseignements concrets, des citations inspirantes et des exercices pratiques et divertissants. De la gestion du temps à l'intelligence émotionnelle en passant par l'exploration de tes passions, chaque page t'encourage à t'épanouir et à vivre une vie qui résonne avec tes valeurs profondes.

Points Forts :",979-8857561317,https://m.media-amazon.com/images/I/614pWS6b8VL._SY522_.jpg,Independently published (15 août 2023),Alice Carter
Libéré de l'enfer intérieur: L'histoire pratique d'un survivant de la dépression et de l'anxiété,15.99,"Plongez dans l'histoire authentique d'un homme qui a navigué à travers les profondeurs déconcertantes de la dépression et de l'anxiété pour émerger, non seulement victorieux, mais également armé d'un savoir précieux. Ce récit sincère dépasse le simple partage d'expériences pour exposer avec une clarté perspicace un cheminement personnel. Ce n'est pas uniquement un récit : c'est un compagnon de route. Contrairement à beaucoup de récits similaires, ce livre est guidé par quelqu'un qui comprend véritablement, ayant lui-même traversé ces tourments.
En effet, ces pages ne se contentent pas de raconter, elles accompagnent. Elles offrent des perspectives, des leçons apprises et des techniques concrètes éprouvées. Ce livre, enrichi par une empathie fondée sur une expérience commune, offre bien plus qu'un simple aperçu. Il propose un éclairage authentique et un guide pratique, élaboré à partir d'une connaissance intime des difficultés, pour s'affranchir de cet enfermement mental.",979-8878375597,https://m.media-amazon.com/images/I/615jjulCWTL._SY522_.jpg,Independently published (3 février 2024),Freddy G
Forest Therapy / livre de coloriage relaxant pour adultes.: 50 coloriages uniques sur le thème de la forêt et ses animaux.,5.86,""" PLUS DE PHOTOS PLUS BAS DANS LA DESCRIPTION ""

RELAXEZ VOUS EN VOUS PROJETANT DANS LE CALME ET LA SERENITE DE NOS FORÊTS.
Partez à la rencontre des animaux et de la nature pour des heures de détente !!
Ce livre de coloriage contient une variété d'animaux tels que :
le loup, le renard, le cerf, le busard, le hibou etc. Dans leur environnement naturel.
Qualité et originalité / 50 dessins uniques et différents exécutés avec passion et le souci du détail vous garantissent une haute qualité de fabrication.
Diversité / chaque coloriage est différent. et garantit un grand potentiel d'inspiration et de variétés de couleurs",979-8850031022,https://m.media-amazon.com/images/I/71TCOJEomoL._SY522_.jpg,Independently published (27 juin 2023),Editions Therapycolors
"Mon Journal de Gratitude: 5 Minutes journal - Carnet de Gratitude Anti-Stress pour activer les pouvoirs de la Gratitude, développer les Pensées Positives, la Confiance en Soi et l’Estime de Soi",10.47,"« Mon journal de gratitude », l’outil LE plus PUISSANT pour activer les pouvoirs de la gratitude

Diverses études scientifiques ont prouvé que le fait de rédiger 3 gratitudes quotidiennement dans un carnet de gratitude, rallongerait l’espérance de vie de 7 ans ?

Incroyable non ?! Mais pas seulement !

En consacrant 5 minutes par jour, tous les matins et tous les soirs, pendant 180 jours, à compléter « Mon journal de gratitude » :

✅ Vous augmentez votre confiance en soi",,https://m.media-amazon.com/images/I/51ToC9JwqJL._SY522_.jpg,Independently published (18 août 2022),Marika Attirelepositif
Comment vas-tu ? (Vraiment !): Le journal d'écriture thérapie - 120 questions pour se reconnecter à soi,6.46,"Infos pratiques :
- Format A5
- 138 pages
- 120 questions (4 mois d'écriture et d'introspection)

L’écriture revêt un caractère thérapeutique qui s'avère être une excellente façon de s’investir dans son développement personnel. Ce livre et ces séances d'écriture introspective vont vous aider à vous reconnecter à votre inconscient, vous aligner avec vos besoins et vous connecter à vos émotions.
Découvrez ce que vous avez vraiment à dire, ce que vous avez oublié volontairement ou inconsciemment, et ce que vous préférez ne pas voir.",,https://m.media-amazon.com/images/I/611EMxJKEUL._SY522_.jpg,Independently published (12 décembre 2022),Papier Bohème
LA PENSÉE POSITIVE: Comment atteindre vos objectifs et mener une vie positive à travers le pouvoir de la pensée,9.99,"Changez votre vie et commencez à penser positivement!
Savez-vous que la pensée positive fonctionne mais que vous ne savez pas comment la mettre en pratique?
Vous vous sentez triste? Découragé? Tout le monde vous semble heureux?

Tout semble aller mal et la malchance vous suit?

Apprenez l'art de la pensée positive. Apprenez des stratégies, et changez totalement votre vie en lui donnant une toute nouvelle empreinte! Enfin, vous saurez comment utiliser la pensée positive et quels sont ses avantages! Vous allez découvrir un nouveau monde! Dans chaque situation, vous serez en mesure de garder la sérénité, d'affronter les choses de la bonne façon, d'analyser et de faire les meilleurs coups. Grâce à quelques conseils simples, la pensée positive améliorera votre estime de soi, votre santé et vous portera chance!

Dans ce manuel utile, vous apprendrez...",979-8621428907,https://m.media-amazon.com/images/I/61vPdMfXVCL._SY522_.jpg,Independently published (4 mars 2020),Marcello Borelli
LA PENSÉE POSITIVE: Comment atteindre vos objectifs et mener une vie positive à travers le pouvoir de la pensée,9.99,"Changez votre vie et commencez à penser positivement!
Savez-vous que la pensée positive fonctionne mais que vous ne savez pas comment la mettre en pratique?
Vous vous sentez triste? Découragé? Tout le monde vous semble heureux?

Tout semble aller mal et la malchance vous suit?

Apprenez l'art de la pensée positive. Apprenez des stratégies, et changez totalement votre vie en lui donnant une toute nouvelle empreinte! Enfin, vous saurez comment utiliser la pensée positive et quels sont ses avantages! Vous allez découvrir un nouveau monde! Dans chaque situation, vous serez en mesure de garder la sérénité, d'affronter les choses de la bonne façon, d'analyser et de faire les meilleurs coups. Grâce à quelques conseils simples, la pensée positive améliorera votre estime de soi, votre santé et vous portera chance!

Dans ce manuel utile, vous apprendrez...",979-8621428907,https://m.media-amazon.com/images/I/61vPdMfXVCL._SY522_.jpg,Independently published (4 mars 2020),Marcello Borelli
LA PENSÉE POSITIVE: Comment atteindre vos objectifs et mener une vie positive à travers le pouvoir de la pensée,9.99,"Changez votre vie et commencez à penser positivement!
Savez-vous que la pensée positive fonctionne mais que vous ne savez pas comment la mettre en pratique?
Vous vous sentez triste? Découragé? Tout le monde vous semble heureux?

Tout semble aller mal et la malchance vous suit?

Apprenez l'art de la pensée positive. Apprenez des stratégies, et changez totalement votre vie en lui donnant une toute nouvelle empreinte! Enfin, vous saurez comment utiliser la pensée positive et quels sont ses avantages! Vous allez découvrir un nouveau monde! Dans chaque situation, vous serez en mesure de garder la sérénité, d'affronter les choses de la bonne façon, d'analyser et de faire les meilleurs coups. Grâce à quelques conseils simples, la pensée positive améliorera votre estime de soi, votre santé et vous portera chance!

Dans ce manuel utile, vous apprendrez...",979-8621428907,https://m.media-amazon.com/images/I/61vPdMfXVCL._SY522_.jpg,Independently published (4 mars 2020),Marcello Borelli
LA PENSÉE POSITIVE: Comment atteindre vos objectifs et mener une vie positive à travers le pouvoir de la pensée,9.99,"Changez votre vie et commencez à penser positivement!
Savez-vous que la pensée positive fonctionne mais que vous ne savez pas comment la mettre en pratique?
Vous vous sentez triste? Découragé? Tout le monde vous semble heureux?

Tout semble aller mal et la malchance vous suit?

Apprenez l'art de la pensée positive. Apprenez des stratégies, et changez totalement votre vie en lui donnant une toute nouvelle empreinte! Enfin, vous saurez comment utiliser la pensée positive et quels sont ses avantages! Vous allez découvrir un nouveau monde! Dans chaque situation, vous serez en mesure de garder la sérénité, d'affronter les choses de la bonne façon, d'analyser et de faire les meilleurs coups. Grâce à quelques conseils simples, la pensée positive améliorera votre estime de soi, votre santé et vous portera chance!

Dans ce manuel utile, vous apprendrez...",979-8621428907,https://m.media-amazon.com/images/I/61vPdMfXVCL._SY522_.jpg,Independently published (4 mars 2020),Marcello Borelli
"Au coeur de la tourmente, la pleine conscience: MBSR, la réduction du stress basée sur la mindfulness : programme complet en 8 semaines",12.0,"Fondé sur le travail pionnier du Dr Jon Kabat-Zinn et son célèbre programme de réduction du stress, ce livre majeur nous montre comment utiliser des méthodes scientifiquement prouvées pour guérir le corps, l'âme et l'esprit.Ce programme unique a fait l'objet de recherches qui démontrent que les techniques de méditation ont des effets préventifs et thérapeutiques sur la maladie, le stress social et professionnel, les troubles du sommeil ou alimentaires, etc.En pratiquant les techniques de la pleine conscience, vous apprendrez non seulement à réduire la douleur physique ou émotionnelle, l'anxiété et les sentiments de panique, mais également à améliorer la qualité de votre vie et de vos relations.",978-2290054468,https://m.media-amazon.com/images/I/61I6QRpu4PL._SY522_.jpg,J'ai lu (21 avril 2012),Jon Kabat-Zinn
Livre de coloriage pour adultes: Mandalas d'animaux,10.85,"Découvre ces magnifiques et complexes mandalas et sens le stress et l’anxiété s’évaporer en coloriant ces superbes animaux. Que ce soit après une longue journée de travail stressante ou dans des situations où ton cerveau a l’impression de crouler sous cet afflux d’informations, les mandalas t’aideront à retrouver concentration et quiétude. Fais l’expérience de cet état de pleine conscience et de paix intérieure en coloriant cette magnifique collection de 50 mandalas pour adultes et ados sur le thème des animaux. Libère ton esprit tout en occupant tes mains et en apprenant plein de faits intéressants sur tes animaux préférés. Alors n’attends plus une seconde, attrape tes crayons de couleur et donne vie à ces chefs-d’œuvre !",978-1700817648,https://m.media-amazon.com/images/I/71IY3tZ626L._SY522_.jpg,Gray & Gold Publishing (16 février 2022),Papeterie Bleu
Harmonie Énergétique: Maîtriser l'art des soins énergétiques et émotionnels,16.9,"Harmonie Énergétique : Maîtriser l'Art des Soins Subtils
Introduction
Découvrez l'univers fascinant de l'hypno-magnétisme intégrative dans ""Harmonie Énergétique : Maîtriser l'Art des Soins Subtils"". Ce livre guide le lecteur à travers une approche holistique de la santé, mêlant connaissances ancestrales et techniques modernes.
Principes Fondamentaux
Le voyage commence par l'exploration des principes fondamentaux de l'hypno-magnétisme intégrative. Apprenez à détecter les déséquilibres énergétiques, à comprendre l'intelligence universelle, la conscience neurovégétative, et à maintenir l'homéostasie naturelle.",979-8877980679,https://m.media-amazon.com/images/I/61WWMnKHGRL._SY522_.jpg,Independently published (30 janvier 2024),Jean Angius
Un livre de coloriage inspirant pour adultes,18.24,"IDÉES CADEAUX – LIVRES DE COLORIAGE POUR ADULTES – ANTISTRESS
Entrez dans le monde inspirant et motivant de l’expression de soi de la Papeterie Bleu, grâce à la créativité du livre de coloriage relaxant pour adultes. À l’intérieur, vous trouverez 35 magnifiques pages qui vous apporteront bien-être, détente et introspection. Libérez l’artiste qui est en vous en coloriant ce livre de coloriage antistress thérapeutique qui s’utilisera avec feutres, crayons, crayons de couleurs, stylos gel ou aquarelles.
Bon coloriage !
Description du produit:
Couverture mate haute qualité",978-1640010956,https://m.media-amazon.com/images/I/718nxI-55XL._SY522_.jpg,Gray & Gold Publishing (1 juin 2017),Papeterie Bleu
Mandalas - Un livre de coloriage pour adultes,16.44,"IDÉES CADEAUX – LIVRES DE COLORIAGE POUR ADULTES – ANTISTRESS
Découvre ces magnifiques et complexes motifs et sens le stress et l’anxiété s’évaporer en coloriant ces superbes mandalas. Que ce soit après une longue journée de travail stressante ou dans des situations où ton cerveau a l’impression de crouler sous cet afflux d’informations, les mandalas t’aideront à retrouver concentration et quiétude. Fais l’expérience de cet état de pleine conscience et de paix intérieure en coloriant cette magnifique collection de 50 mandalas pour adultes et ados. Libère ton esprit tout en occupant tes mains et laisse les citations inspirantes élever ton esprit. Alors n’attends plus une seconde, attrape tes crayons de couleur et donne vie à ces chefs-d’œuvre !",978-1700817334,https://m.media-amazon.com/images/I/71p6mkVEvDS._SY522_.jpg,Gray & Gold Publishing (11 mai 2021),Papeterie Bleu
Renaître de ses cendres: Vous ne serez plus jamais la même personne,18.99,"Présentation
✔️ Vous n’en pouvez plus de cette vie que vous menez, où vous essayez tant bien que mal de sauver les apparences alors qu’au fond, ça ne va pas, il y a une terrible souffrance intérieure avec laquelle vous luttez 😟
✔️ Vous êtes au bord du gouffre, vous broyez du noir, et craignez d’exploser, de péter un câble, tellement vous êtes étouffé, dépassé, fatigué par les évènements qui s’enchaînent dans votre vie (décès d’un proche, divorce, perte de votre boulot, solitude, célibat chronique, la galère, la dèche…) 😤
✔️ Vous avez échoué, ou tout perdu 😧, et avez du mal à vous relever de vos échecs et souhaitez, vous reconstruire pas à pas mais vous ne savez pas pour où commencer",979-8772100929,https://m.media-amazon.com/images/I/61MhPD7IuQL._SY522_.jpg,Independently published (23 novembre 2021),Ronald P. FANOU
