Nom,Prix,Description,Isbn,Photo,Editeur,Auteur
L'imposture décoloniale: Science imaginaire et pseudo-antiracisme,21.0,"« Le chemin de la simple justice n'est pas facile à trouver entre les clameurs de la haine d'une part et les plaidoyers de la mauvaise conscience d'autre part », affirmait Camus en 1945. Ce constat reste d'actualité, quand des sectarismes menacent approches scientifiques et valeurs républicaines au nom du « décolonialisme » : essentialisation des identités minoritaires, qui racialise les questions sociales et politiques, communautarismes exclusifs qui divisent et opposent les citoyens, instrumentalisations cyniques de minorités supposées victimes d'une imaginaire « République blanche », attaques contre la liberté d'expression, les libertés académiques et la laïcité... L'imprégnation décoloniale a fait surgir un nouvel espace de l'extrémisme politique : « antiracistes » racistes visant les « Blancs », gauchistes violents, islamistes plus ou moins masqués, complotistes, néoféministes misandres... Des groupuscules identitaires extrémistes s'érigent en tribunaux d'inquisition, censurent des oeuvres et imposent des « déboulonnages ». Ces nouveaux épurateurs, mus par le ressentiment, invoquent un prétendu « antiracisme politique » pour étendre le champ de l'intimidation. Face à la prolifération de mémoires victimaires vindicatives et politiquement instrumentalisées, Pierre-André Taguieff dresse un état des lieux, analyse sans concession les discours décoloniaux et en esquisse une généalogie : autant d'éléments pour la discussion sérieuse d'une imposture de grande ampleur.",979-1032914144,https://m.media-amazon.com/images/I/41vNsu0CH7L._SY522_.jpg,L'OBSERVATOIRE (14 octobre 2020),Pierre-André Taguieff
La Dictature,11.9,"A l'origine, la dictature est une institution de la République romaine. Le dictateur reçoit la mission de rétablir l'ordre républicain dans un temps limité à six mois. La dictature ""souveraine"", spécifiquement moderne, est quant à elle illimitée et vise à créer un nouvel ordre. L'ouvrage de Schmitt n'est pas seulement une remarquable analyse historique des usages de cette institution destinée à faire face à l'état d'exception. Si l'expérience ultérieure du XXe siècle a disqualifié la notion de dictature, l'interrogation sur les situations où l'Etat de droit est confronté à ses limites n'a rien perdu de son actualité : les mesures ""antiterroristes"" aussi bien que les difficiles ""transitions"" consécutives au renversement d'autocraties militaires en attestent aujourd'hui.",978-2757851241,https://m.media-amazon.com/images/I/61dGbjlKSbL._SY522_.jpg,POINTS (12 mars 2015),Carl Schmitt
Le nouveau clivage,8.0,"Trump, Orban, Poutine : le décrypteur de l'Archipel français applique sa méthode aux grandes fractures du monde.
Quand l'avenir se devine aujourd'hui.
Dites adieu aux clivages gauche-droite, à l'opposition entre "" progressistes "" et "" conservateurs "", entre "" les partis de l'ouverture "" et "" les forces du repli "" ! Déchiffrant les tableaux, statistiques, graphiques et analyses de toutes sortes, Jérôme Fourquet dévoile dans ce livre unique les véritables lignes de fracture qui départagent gagnants et perdants de la mondialisation. À rebours de beaucoup de commentateurs de l'actualité, il prophétise ainsi la "" révolte des élites "" : la sécession des détenteurs de capital économique et culturel et la mise en danger à terme de la démocratie, non du fait des masses, mais des privilégiés.
Un ouvrage captivant, et dérangeant.",978-2204137928,https://m.media-amazon.com/images/I/61eE8jnw-pL._SY522_.jpg,Lexio (30 janvier 2020),Jérôme Fourquet
La pensée extrême. Comment des hommes ordinaires deviennent des fanatiques,19.0,"L'ouvrage explore la rationalité paradoxale de ceux qui s'abandonnent à la folie du fanatisme. Il défait un certain nombre d'idées reçues sur leur profil et leurs intentions. Il s'agit en fait d'une exploration d'un univers mental mal connu et qui, à juste titre fait peur. En convoquant les travaux les plus récents de la sociologie, des sciences politiques et de la psychologie cognitive, le texte dessine un portrait inédit d'un mal qui ronge les démocraties contemporaines : la radicalisation des esprits. S'appuyant sur de nombreux exemples et expérimentations de psychologie sociale, il propose un descriptif des étapes qui conduisent au fanatisme et quelques solutions pour aider à la déradicalisation.",978-2130733607,https://m.media-amazon.com/images/I/519DbJLx5rL._SY522_.jpg,PUF (6 janvier 2016),Gérald Bronner
Ces fous qui nous gouvernent: Comment la psychologie permet de comprendre les hommes politiques,18.72,"Comment la psychologie permet de comprendre les hommes politiques. "" Le pouvoir est une drogue qui rend fou quiconque y goûte "", confiait François Mitterrand. A moins qu'il ne faille être fou pour accéder au pouvoir ? Suffisamment mégalomane pour viser les sommets, un peu paranoïaque pour se jouer des trahisons, légèrement psychopathe pour éliminer ses adversaires... Pour les médias, l'affaire est entendue. G. W Bush est "" autiste "", Silvio Berlusconi "" mégalomane "", Nicolas Sarkozy un "" hyperactif maladif "". Qu'en est-il vraiment ? Depuis un demi-siècle, une discipline, née aux Etats-Unis, étudie la personnalité de ceux qui nous gouvernent : la psychologie politique. Au sein de la CIA, dans les coulisses des négociations internationales et parmi les équipes des présidentiables, des "" profileurs politiques "" observent à la loupe nos leaders. Ils dissèquent leurs discours, analysent les moindres de leurs gestes, interrogent leurs collaborateurs et recoupent leurs informations. Pascal de Sutter est allé à leur rencontre (Jerrold Post, Aubrey Immelman, David Winter). Il a aussi interrogé les meilleurs experts mondiaux de la psychologie (Antonio Damasio, Paul Ekman). Ce livre est le premier ouvrage en français consacré à la psychologie politique. Il analyse la personnalité et les humeurs de nos dirigeants. Pascal de Sutter révèle également les profils psychologiques de Nicolas Sarkozy et de Ségolène Royal, réalisés avec une équipe d'experts internationaux... Un livre surprenant et éclairant, accessible à tous.",978-2352040248,https://m.media-amazon.com/images/I/71LUoBkb1pL._SY522_.jpg,Editions Les Arènes (25 janvier 2007),Pascal de Sutter
Le Temps des humiliés NE,16.8,"L'humiliation est devenue l'ordinaire des relations internationales. Rabaisser un État, le mettre sous tutelle, le tenir à l'écart des lieux de décision, stigmatiser ses dirigeants : autant de pratiques diplomatiques qui se sont banalisées au fil du temps. De quoi ces diplomaties de l'humiliation sont-elles révélatrices ? Les réactions des humiliés - de la conférence de Bandung en 1955 aux Printemps arabes - n'invitent-elles pas à une autre gouvernance ? Convoquant l'histoire et la sociologie politique, Bertrand Badie remonte aux sources de l'humiliation : les conquêtes occidentales du xixe siècle, la montée des revanchismes dans l'entre-deux-guerres, une décolonisation mal maîtrisée. Il montre que sa banalisation consacre l'émergence dramatique des opinions publiques et des sociétés sur la scène internationale, mais qu'elle trahit aussi l'inadaptation des vieilles puissances et de leurs diplomaties à un monde de plus en plus globalisé. Dès lors, il devient urgent de reconstruire un ordre international dans lequel les humiliés et leurs sociétés trouveront toute leur place. La montée des populismes et l'élection de Trump en 2016, le durcissement des gouvernements autoritaires d'Erdogan et de Poutine ou les provocations de la Corée du Nord confirment le rôle structurel de l'humiliation dans les relations internationales, avec cette inversion inquiétante : l'humilié d'hier devient aussi l'humiliateur d'aujourd'hui.",978-2738147233,https://m.media-amazon.com/images/I/71mW-QjQ4nL._SY522_.jpg,Odile Jacob; Enlarged édition (30 janvier 2019),BADIE
Soros et la société ouverte : métapolitique du globalisme (édition revue et augmentée),28.0,"Georges Soros est l'une des personnalités les plus influentes de notre époque. L'activisme de George Soros, qui se considère lui-même comme « un chef d'État sans État », touche en fait tous les domaines et tous les continents. Durant les dernières décennies, peu de nations ont été épargnées par l'action ou l'influence de son ensemble de fondations : l'Open Society Foundations. Partout où la souveraineté politique et la stabilité sociale sont attaquées, on retrouve la trace de Georges Soros, de ses réseaux, de ses militants, de ses milliards. Que ce soit au travers de l'immigration de masse, de la dépénalisation des stupéfiants, des nouvelles normes sociétales, de la promotion des théories du genre ou des révolutions colorées. Dans chacun de ces domaines, Soros oeuvre avec une étonnante constance à la réalisation d un même objectif : l'avènement d'un nouvel ordre politique international fondé sur la notion de société ouverte et la fin des États-nations. L'auteur nous propose une radiographie détaillée de la méthodologie Soros et de ses divers champs d action partout dans le monde. Au travers d'exemples très documentés, cette étude expose au grand jour les rouages internes des réseaux Soros. Une entreprise de décomposition des nations dotée d'une puissance et de moyens inédits dans l'Histoire. Au-delà d'un travail d'enquête inédit, ce livre se propose d'exposer la philosophie politique qui anime cette action et d'en tracer la généalogie profonde. Le lecteur y découvrira comment la notion de société ouverte se rattache aux courants les plus puissants et les plus actifs de la subversion politique contemporaine / Cette nouvelle édition comprend : - Une longue préface d'Iurie Rosca (ancien vice-premier ministre moldave et aujourd'hui coordinateur des rencontres métapolitiques de Chisinau qui réunissent chaque année de nombreux intellectuels dissidents); - Une vingtaine de pages supplémentaires en lien avec la situation migratoire chaotique à la frontière gréco-turque dans le chapitre consacré aux ONG financées par G. Soros ; - Un essai supplémentaire de 80 pages dont le titre est : « La société ouverte contre la France ».",978-2491861063,https://m.media-amazon.com/images/I/71kYKvpKddL._SY522_.jpg,Culture & Racines; Enlarged édition (25 octobre 2020),Pierre-Antoine Plaquevent
La fin de la démocratie: Apogée et déclin d'une civilisation,16.85,"L’auteur plonge dans l’histoire des derniers siècles pour démontrer comment tout cela a commencé, comment le piège terrible s’est formé. Il souligne notamment la contradiction grandissante entre République et démocratie, devenue aujourd’hui explosive. Et de quelle manière les instruments de régulation censés nous sauver (le modèle de l’homo economicus ou le langage numérique) se sont transformés en remèdes pires que le mal.",979-1020907011,https://m.media-amazon.com/images/I/91KyvxklUHL._SY522_.jpg,Les Liens Qui Libèrent (1 juillet 2021),Jean-Claude Kaufmann
L'Humanitude au pouvoir: Comment les citoyens peuvent décider du bien commun,9.33,"Enfin une bonne nouvelle en politique : on peut se fier à la capacité des citoyens à raisonner et à décider dans l’intérêt public ! Ce livre explique pourquoi et comment…
« Humanitude ». C’est ainsi que l’auteur baptise l’étonnante capacité des simples citoyens à comprendre les enjeux, à réfléchir, à délibérer et à prendre des décisions au nom de l’intérêt commun de l’humanité. Cet état transitoire se manifeste chez les personnes invitées à constituer des jurys citoyens pour proposer une solution à un problème d’intérêt général. L’humanitude est une propriété générale des êtres humains largement confirmée par l’expérience répétée des conférences de citoyens réunies à l’occasion de controverses sociotechniques. Jacques Testart propose d’exploiter cette capacité pour en faire un outil privilégié d’orientation et de gestion des sociétés humaines. Un protocole rationalisé et reproductible pour ces procédures est disponible sous le nom de",978-2021219319,https://m.media-amazon.com/images/I/710htw64-7L._SY522_.jpg,SEUIL (15 janvier 2015),Jacques Testart
Le pain et le cirque,12.5,"« Cette folie, qui lançait les riches dans une surenchère de dons à la collectivité (chacun voulant se montrer plus magnifique que le voisin), porte un nom savant - l'évergétisme - et vient de trouver son historien. Paul Veyne a quelque chose de la prodigalité de ses héros, les évergètes. Il déverse sur ses lecteurs médusés les trésors de son information, les souvenirs de ses campagnes à travers l'érudition germanique et la sociologie anglo-saxonne, dépense en quelques pages la matière de vingt thèses et mobilise toutes les ressources d'un esprit follement ingénieux pour comprendre et faire comprendre ce que ces cadeaux en cascade étaient chargés d'entretenir. »
Mona Ozouf",978-2020254632,https://m.media-amazon.com/images/I/71HtebTPYEL._SY522_.jpg,Seuil (3 septembre 1995),Paul Veyne
Petit manuel antiraciste et féministe,10.0,"Dans ce Petit manuel, Djamila Ribeiro, philosophe et féministe brésilienne, aborde le racisme dans le milieu professionnel et culturel, parle de négritude, de blanchité, de désirs et affects. En dix chapitres courts et impactants, elle présente des pistes de réflexion pour reconnaître les discriminations, prendre conscience de certains privilèges, adopter des pratiques antiracistes et féministes et, ainsi, assumer la responsabilité de faire bouger les choses. C'est une pratique qui commence dans les attitudes quotidiennes, et nous concerne toutes et tous. Djamila Ribeiro, chercheuse en philosophie politique, est la référence du mouvement féministe noir, antiraciste, pro-LGBT et antimachiste au Brésil. Chroniqueuse pour la presse et la TV, elle donne des conférences dans le monde entier. Avec un demi-million de suiveurs sur les réseaux sociaux, c'est une activiste de poids.Préface de Françoise Vergès, militante féministe décoloniale et politologue. Pratique, direct et fort.",978-2490297061,https://m.media-amazon.com/images/I/71WmrAyG0uL._SY522_.jpg,Anacaona Editions (29 mai 2020),Djamila Ribeiro
"Comprendre l'islam politique: Une trajectoire de recherche sur l'altérité islamiste, 1973-2016",13.08,"De l'Algérie à la Syrie, en passant par la Tunisie, le Yémen, la Libye, l'Égypte et la France, l'un des grands spécialistes de l'islam politique restitue ses rencontres avec nombre d'acteurs de cette mouvance sur près de 40 ans. Il montre que leurs motivations sont plus banalement profanes et politiques que religieuses. Et donc très loin des explications essentialistes qui cherchent dans le Coran du VIIe siècle les introuvables clés de la "" radicalité islamiste "" d'aujourd'hui.
La tradition "" orientaliste "" des savants arabisants français, qui avaient accompagné l'entreprise coloniale au XIXe siècle, a progressivement laissé la place au XXe siècle à une génération de chercheurs résolument anticolonialistes, à l'image de Maxime Rodinson, Charles-André Julien, Jacques Berque ou Charles-Robert Ageron. Il revient aujourd'hui à leurs héritiers d'éclairer l'apparition, dans la période postcoloniale, d'un "" islam politique "" qui cristallise une très profonde défiance. C'est ce à quoi s'emploie François Burgat dans cet ouvrage, en replaçant ses analyses dans le parcours personnel qui les a nourries et l'environnement scientifique qui les a accueillies.
Depuis les années 1980, la répression des acteurs politiques musulmans par les régimes autoritaires et leur mise au ban par les États occidentaux ont contribué à alimenter frustrations, polarisations, violences, radicalisations, terrorisme... À rebours des explications simplistes ignorant trop souvent les racines historiques de ces évolutions, ce livre apporte une note dissonante. Son auteur raconte comment, pour décoder l'incomprise altérité islamiste, sa trajectoire de recherche l'a conduit à forger ses propres outils. De l'Algérie à la Syrie, en passant par la Tunisie, le Yémen, la Libye, l'Égypte, la Palestine et la France, il restitue ses rencontres avec nombre d'islamistes. Il montre que leurs motivations sont plus banalement profanes et politiques que religieuses. Et donc très loin des explications essentialistes qui s'obstinent à chercher dans le Coran du VIIe siècle les clés de l'islam politique contemporain.
L'auteur poursuit ici une démarche de recherche entamée depuis quatre décennies en confrontant ses premières hypothèses aux turbulences des "" printemps arabes "" et à l'affirmation djihadiste. En contextualisant ses observations sur le temps long, il offre un précieux éclairage sur les conditions du dépassement de ce "" défi islamiste "".",978-2707192134,https://m.media-amazon.com/images/I/6186fJuOVWL._SY522_.jpg,La Découverte (20 octobre 2016),François Burgat
L'illusion politique,15.67,"Dans la société occidentale, le verbalisme politique exprime une double illusion, en même temps qu'il lui donne naissance. Nous assistons au développement de l'illusion de l'homme politique qui croit maîtriser la machine de l'État, qui croit prendre des décisions politiques toujours efficaces, alors qu'il se trouve de plus en plus impuissant en face de la rigueur croissante des appareils étatiques. Or, cette impuissance de l'homme politique est voilée précisément par la puissance et l'efficacité des moyens d'action de l'État qui interviennent toujours plus profondément et exactement dans la vie de la nation, et dans celle des citoyens. Mais l'homme politique, fût-il dictateur, n'a finalement aucune maîtrise de ces moyens. Réciproquement, paraît l'illusion du citoyen, qui, vivant encore sur l'idéologie de la souveraineté populaire et des constitutions démocratiques, croit pouvoir contrôler la politique, l'orienter, participer à la fonction politique, alors que tout au plus il peut contrôler des hommes politiques sans pouvoir réel - et s'engage, sur cette double illusion, un dialogue d'impuissants. Dans cette difficile situation, n'y a-t-il aucun remède ? S'il en existait un, il serait, en tout cas, à la fois humble et héroïque.",978-2710388241,https://m.media-amazon.com/images/I/311vkpT9r-L.jpg,La Table Ronde (7 juin 2018),Jacques Ellul
La Démocratie des autres,5.1,"La notion de démocratie est si bien enracinée dans la culture européenne et nord-américaine, qu'elle est généralement considérée comme un concept purement occidental ; ainsi, la démocratie serait une valeur que l'Occident aurait pour mission de faire prévaloir et d'introduire dans des pays qui en auraient été jusque-là privés. Mais des difficultés inattendues, d'ordre militaire et politique, rencontrées par la coalition menée par les États-Unis durant la deuxième après-guerre irakienne, ont soulevé une vague de scepticisme sur les possibilités de faire adopter dans le pays, dans des délais relativement courts, un gouvernement démocratique. L'originalité de la pensée d' Amartya Sen, économiste et humaniste, est de démontrer la complexité du problème de la démocratie.",978-2743615772,https://m.media-amazon.com/images/I/71I7Iqd9aML._SY522_.jpg,Rivages (13 septembre 2006),Amartya Sen
Changer sa vie sans changer le monde: L’anarchisme contemporain entre émancipation individuelle et révolution sociale,14.0,"« Je ne peux que suivre Emma Goldman quand elle déclare ne pas vouloir d’une révolution où elle ne pourrait pas danser. Mais à tout le moins, elle voulait une révolution sociale, sans laquelle de telles fins esthétiques et psychologiques ne bénéficieraient qu’à quelques-uns. Or les objectifs révolutionnaires et sociaux de l’anarchisme aujourd’hui souffrent d’une telle dégradation que ce mot fera bientôt partie intégrante du vocabulaire chic bourgeois du siècle à venir : une chose quelque peu polissonne, rebelle, insouciante, mais délicieusement inoffensive. »
En 1995, Murray Bookchin étrille la perméabilité des anarchistes aux maux qui aﬀectent la société – individualisme forcené, goût de la posture , irrationalisme revendiqué –, qui les conduit à se détourner de leur héritage socialiste et à abandonner l’internationalisme, le confédéralisme, et l’esprit démocratique, antimilitariste et laïque qui le distinguaient d’autres mouvements. Le livre est un plaidoyer contre les obscurantismes de toutes sortes, pour la démocratie et l’humanisme rationaliste.",978-2748903997,https://m.media-amazon.com/images/I/61ZBF8Gn-6L._SY522_.jpg,Agone; 1er édition (11 septembre 2019),Murray Bookchin
Les Fossoyeurs de la République: Islamo-gauchisme : l'enquête inédite,16.75,"Dans cette enquête saisissante, Mohamed Sifaoui lève le voile sur l'islamo-gauchisme et ses adeptes, qui, des médias aux universités en passant par le monde politique et associatif, piétinent depuis un demi-siècle les valeurs de la République au profit d'une idéologie totalitaire. Un livre essentiel de réarmement intellectuel. Marches contre l'« islamophobie » en 2019, accusations non-fondées envers l'État à la suite de la dissolution du CCIF, refus de soutenir le monde enseignant soumis à la pression séparatiste... Non, l'islamo-gauchisme n'est pas une « injure rhétorique » que des intellectuels s'envoient à la figure pour disqualifier leurs contradicteurs. C'est une réalité politique et sociologique, véritable menace pour notre démocratie. Dans cet essai, fruit de longs mois d'enquête, Mohamed Sifaoui revient sur l'histoire de cette convergence entre l'islamisme et le gauchisme qui s'est affirmée, en France, à la fin des années 1970. Il en explique les fondements idéologiques et en décortique les différents comportements et discours. Il cible, de manière méthodique, les promoteurs de l'islamo-gauchisme, et démontre leur fonctionnement et leurs alliances, de ces élus locaux qui, dans certains quartiers populaires, misent par cynisme et par calcul sur des associations islamistes, aux militants tels Mediapart ou les Indigènes de la République et leurs alliés, en passant par La France insoumise.  Ceux qui se réclament sincèrement de la gauche doivent ouvrir les yeux sur ces renoncements au modèle républicain et laïque qui trahissent les valeurs universelles pour se complaire dans des compromissions plus que douteuses. Ce livre apporte une voix essentielle au débat.",979-1032909348,https://m.media-amazon.com/images/I/51FkCQjml+L._SY522_.jpg,L'OBSERVATOIRE (31 mars 2021),Mohamed Sifaoui
"Néo-fascisme et idéologie du désir : Mai 68, la contre-révolution libérale libertaire",13.14,"Pour Michel Clouscard, l’ensemble capitaliste se découpe séquentiellement en libéralisme classique, national-socialisme et néo-libéralisme. Chaque métamorphose correspond à une exigence pour sauver le capitalisme des crises et donc du communisme. Après le plan Marshall et Mai 1968, les idéologues des secteurs pilotes comme l’audiovisuel, la mode, les loisirs, vont promouvoir avec succès la consommation d’émancipation transgressive comme prétendu combat d’avant-garde contre le néo-capitalisme. Ce qui assurera de formidables nouveaux profits et la neutralisation de la lutte des classes. L’Anti-OEdipe de Deleuze/Guattari paru en 1972 en exprimera l’exaltation maximale. Michel Clouscard montre ici que la polémique avec ce dernier maillon des générations bourgeoises est la clé qui permet de révéler l’anthropologie bourgeoise totale. Il montre que l’idéologie transgressive, qui a pour fonction d’habiliter la consommation parasitaire et de prôner un activisme anti-étatique, est une transition vers une anthropologie néo-fasciste : l’opposition y est réduite à un spontanéisme groupusculaire et permet la destruction des institutions étatiques et la domination des trusts sur des masses schizophrénisées. Michel Clouscard démontre que toute l’anthropologie bourgeoise ne s’avère qu’une psychose – forclusion de la production, du producteur, du rapport immédiat au monde – et en dernière instance un sadisme – annexion acritique brutale de l’autre, des produits, du monde. Les « machines désirantes » autistiques fusionnent alors en une machine de mort. La terreur néo-fasciste commence. On peut mesurer aujourd’hui toute l’actualité de cette critique : FMI, UE, banques contre la Grèce, l’Irlande, le Portugal ; les opérations de l’OTAN en Yougoslavie, Afghanistan, Irak, Côte d’Ivoire, Libye, Syrie, etc.",978-2915854107,https://m.media-amazon.com/images/I/41AppCcjHqL.jpg,Editions Delga (4 avril 2008),Michel Clouscard
