Nom,Prix,Description,Isbn,Photo,Editeur,Auteur,Categorie
Skulls & Anatomy: Copyright Free Vintage Illustrations for Artists and Designers,20.0,"Do you want to make amazing artwork, take your creative practice to the next level and impress both your clients and peers?Skulls & Anatomy, Copyright Free Vintage Illustrations for Artists & Designers is a collection of 180 high quality, digitised, anatomical drawings for use in personal or commercial creative projects. This is an essential resource to take your art and design to the next level and give you a competitive advantage over your peers. Vault Editions&#39 team of designers and illustrators have spent a lifetime hunting and restoring vintage woodcuts and engravings from around the world to create amazing artwork with. Now, we are opening the vault of our archives to the public.Within this collection, you will find rare, high-quality images carefully curated by our team of professional artists and designers who have used this imagery to create book cover designs, gig-posters, logos, t-shirt designs and more. We have carefully restored the artwork and provided a download link within the publication where you will locate high-resolution files in JPEG format as well as TIFF files with backgrounds removed to speed up your workflow.By collaging multiple images together, you can create limitless impressive and dynamic designs in minutes that will impress everyone, no matter what your skill level is.Start creating amazing artwork today.",978-0648049760,https://m.media-amazon.com/images/I/81Hh-To7FsL._SY522_.jpg,Avenue House Press PTY LTD (6 mars 2019),Kale James,Radio
Skulls & Anatomy: Copyright Free Vintage Illustrations for Artists and Designers,11.11,"Do you want to make amazing artwork, take your creative practice to the next level and impress both your clients and peers?Skulls & Anatomy, Copyright Free Vintage Illustrations for Artists & Designers is a collection of 180 high quality, digitised, anatomical drawings for use in personal or commercial creative projects. This is an essential resource to take your art and design to the next level and give you a competitive advantage over your peers. Vault Editions&#39 team of designers and illustrators have spent a lifetime hunting and restoring vintage woodcuts and engravings from around the world to create amazing artwork with. Now, we are opening the vault of our archives to the public.Within this collection, you will find rare, high-quality images carefully curated by our team of professional artists and designers who have used this imagery to create book cover designs, gig-posters, logos, t-shirt designs and more. We have carefully restored the artwork and provided a download link within the publication where you will locate high-resolution files in JPEG format as well as TIFF files with backgrounds removed to speed up your workflow.By collaging multiple images together, you can create limitless impressive and dynamic designs in minutes that will impress everyone, no matter what your skill level is.Start creating amazing artwork today.",978-0648049760,https://m.media-amazon.com/images/I/81Hh-To7FsL._SY522_.jpg,Avenue House Press PTY LTD (6 mars 2019),Kale James,Radio
"The Vampire Diaries, tous les secrets de Mystic Falls / Nouvelle édition (broché)",24.95,"Depuis son lancement en 2009, The Vampire Diaries a mordu des millions de fans dans le monde entier. Subtil mélange de suspense, d&#39action et de romance, cette série a fait frissonner et haleter huit (incroyables) saisons durant. Interviews des acteurs, révélations de l&#39équipe, photographies de plateau et documents inédits retracent pour la première fois le journal de cette saga fantastique. Tous les secrets de Mystic Falls se dévoilent dans ce livre officiel, offrant l&#39éternité à cette série devenue culte. Préface de Ian Somerhalder et introduction de Paul Wesley.",978-2364809970,https://m.media-amazon.com/images/I/81WbDUufdCL._SY522_.jpg,HUGINN MUNINN (14 juin 2024),Huginn & Muninn,Radio
La femme invisible,16.0,"« J’ai chaud. Les dîners finissent plus tôt. Je bois moins. Je vieillis.
Ça peut couper les jambes, mais ça peut aussi porter, soulever, se faire s’envoler, exacerber l’envie et le goût pour les autres, l’enthousiasme, les tentatives, les échecs sans regrets et les petites réussites. Plus « rien à perdre », comme si cela avait été le cas un jour.
J’ai ressenti la cinquantaine comme une crise d’adolescence équipée d’un cerveau. Une libération. Une jubilation ! »
Finis les discours imposés ou les a priori, terminés les regards qui assignent encore et toujours : Maïtena Biraben nous livre son récit, brut, vrai et d’une sincérité désarmante. L’enfance entre quatre frères, les combats d’une jeune maman célibataire, l’amour, le sexe, le travail, le reflet dans le miroir, l’ovale du visage qui change et le premier tatouage. Elle renverse les poncifs et les croyances, part en guerre contre les images, celles de la fille, la sœur, la mère et l’épouse, de l’argent et du succès, qui inhibent et dissimulent, avec une joie féroce et beaucoup d’humour.
Une leçon de vie pour toutes les générations de femmes qui, passé 50 ans, se questionnent sur leur place.",978-2246817314,https://m.media-amazon.com/images/I/71wgocd59ZL._SY522_.jpg,Grasset (2 mai 2024),Maïtena Biraben,Radio
La vie m&#39a réservé bien des surprises: Faire des épreuves de la vie une force pour avancer sereinement !,18.0,"Véronika Loubry a affronté avec courage les changements et les épreuves, de l’arrêt de sa carrière d’animatrice pour se consacrer à ses enfants à la terrible nouvelle du cancer de son compagnon. Dans son livre, elle revisite les moments marquants de sa vie et se livre comme jamais auparavant.
À 55 ans, cette animatrice vedette s’est adaptée à son époque et a complètement réinventé sa vie. Suivie par des milliers d’abonnés sur ses réseaux sociaux, qu’elle considère comme ses « Instaamies », elle partage les clés de son bonheur et encourage chacun à accepter les surprises de la vie.
À travers des souvenirs et des anecdotes, elle dévoile sa philosophie qui lui permet d’avancer avec sérénité face aux défis de la vie.",979-1028530839,https://m.media-amazon.com/images/I/71Qz8Mh3WML._SY522_.jpg,LEDUC; 1er édition (26 mars 2024),Véronika Loubry,Radio
Dans l&#39oreille du cyclone,16.0,"C’est l’histoire d’une blague qui commence sur France Inter et finit à la police judiciaire, en passant par CNews et l’Assemblée nationale.
C&#39est l&#39histoire d’un clown pris dans la tourmente d’une polémique sans fin, entre insultes, menaces et pressions absurdes.
C’est l’histoire du lien entre notre époque et la pratique humoristique, à mi-chemin entre rire et sport de combat.
Dans ce journal de bord d’une tempête médiatique, Guillaume Meurice raconte comment les polémiques se fabriquent et se défont. Un texte, drôle et inquiétant, sur l’humour politique.
Guillaume Meurice est humoriste.",978-2021567823,https://m.media-amazon.com/images/I/715qxWo6NhL._SY522_.jpg,SEUIL (15 mars 2024),Guillaume Meurice,Radio
Jennifer Aniston: L&#39impossible bonheur,24.95,"Découvrez la fascinante histoire de l&#39une des actrices les plus emblématiques de notre époque. Plongez dans la vie d&#39une célébrité hors du commun : son parcours, ses succès et ses épreuves.

Cette biographie captivante retrace l&#39incroyable ascension de Jennifer Aniston, une « girl next door » californienne, enfant de la balle qui rêvait de faire mieux que ses parents. Légendaire Rachel de la série Friends, mariée un temps au sex-symbol de l&#39Amérique, Jennifer Aniston a gagné son statut d&#39icône et son étoile sur Hollywood boulevard.

Mais plus que l&#39actrice, c&#39est la femme qui mérite d&#39être connue. Son rêve de maternité brisé, son mariage ultra-compliqué avec Brad Pitt et les véritables raisons de leur rupture, ses relations jamais apaisées avec sa mère, sont autant d&#39épreuves qu&#39elle a su surmonter. Aux prises avec les démons de son ami Matthew Perry - c&#39est elle qui, la première, a deviné ses addictions - elle reste aujourd&#39hui le pilier de la famille de",978-2017234418,https://m.media-amazon.com/images/I/81DDkRmZFLL._SY522_.jpg,Hachette Pratique (15 mai 2024),Anaïs Maquiné Denecker,Radio
Scènes et Nature de Printemps: Livre de Coloriage Pour Adultes de 50 Dessins Inspirants de la Saison Printanière | Illustrations Anti-Stress à ... | Pour Adultes | 102 Pages | Grand Format |,17.1,"Découvrez ce livre de coloriage composé de 50 dessins à colorier variés et inspirants sur le thème du printemps pour accueillir cette nouvelle saison printanière, de renouveau et passer un moment serein et de zenitude !

Du coloriage grayscale, qui utilise différentes nuances de gris, au coloriage plus simple mais raffiné, la variété des 50 dessins proposé est idéale pour vous évader dans une parenthèse cosy et développer votre créativité.
Ce livre de Coloriage est idéal pour adultes et adolescents !

🪄 Découvrez des exemples de dessins à colorier tout en bas de la page !🌷🪻",979-8879087239,https://m.media-amazon.com/images/I/719za6pOzAL._SY522_.jpg,Independently published (9 février 2024),Golden Stephy,Radio
Bienvenue à L&#39Agence,24.5,"« De Majo, l’oeil de lynx malicieux de la famille, Olivier le père visionnaire, Sandrine la mère protectrice du clan, aux quatre frères – Martin l’aîné fonceur, Valentin à la pointe des tendances, Louis à la conquête de l’Espagne, et Raphaël à la relève – chacun se reconnaîtra dans les liens et la force des émotions qui nous unissent.

Au-delà de nos succès dans le monde incroyable de l’immobilier de luxe, nous avons accepté de raconter pour la première fois ce que l’on ne voit pas dans la série. Nous nous livrons sans caméra, avec spontanéité, sur notre vie de famille, nos débuts mouvementés, et révélons nos anecdotes jamais partagées à l’Agence.

Vous découvrirez notre histoire et la manière avec laquelle nous parvenons à vivre, travailler et réussir en famille : gérer la pression et les conflits, surmonter les épreuves de la vie, mais surtout croire en l’avenir, cultiver son émerveillement et ne jamais avoir de regrets.

La famille Kretz n’a pas fini de vous surprendre ! »",978-2213727103,https://m.media-amazon.com/images/I/812qF0PA8rL._SY522_.jpg,Fayard; Illustrated édition (27 mars 2024),Famille Kretz,Radio
"Moi, millionnaire ?",18.9,"L&#39incroyable destin de Bruno Hourcade, grand vainqueur des "" 12 Coups de Midi "" et recordman de victoires individuelles dans un jeu télé
Je n&#39étais, a priori, pas destiné aux paillettes des plateaux de télévision. Mais les livres, qui ont toujours été mes compagnons, ont guidé ma soif d&#39apprendre et de me cultiver. Une curiosité qui m&#39a propulsé, le 20 janvier 2021, sur le plateau des "" 12 Coups de Midi "", l&#39émission de jeu de culture générale la plus populaire de France, animée par le charismatique Jean-Luc Reichmann.

Neuf mois plus tard, je me retrouvais à la tête de plus d&#39un million d&#39euros. Un record en termes d&#39argent gagné, mais aussi de participations, deux-cent-cinquante-deux jours au total et une somme que je n&#39aurais jamais réussi à accumuler en toute une vie de travail.

Une aventure à peine imaginable que je vous propose de suivre à mes côtés en vous dévoilant au passage les coulisses de cette télévision qui a fait de moi un millionnaire.",978-2701404158,https://m.media-amazon.com/images/I/6149KCY9xWL._SY522_.jpg,Hors Collection (18 avril 2024),Bruno Hourcade,Radio
Incandescente pour toujours,19.0,"Professeure de chant de la Star Academy, Adeline Toniutti est LA révélation, sur TF1, de l&#39émission culte. Chaque semaine, sa flamboyance, son énergie, son expertise ont touché des millions de téléspectateurs. Derrière les feux des projecteurs, celle qu&#39on surnomme la « fille du facteur » ou la « soprano rock&#39n&#39roll » a réalisé un véritable parcours du combattant pour traverser les épreuves que la vie lui a infligées et pour retrouver le bonheur. Destinée à être chanteuse d&#39opéra, un accident domestique la prive de sa voix. Son compagnon se met alors à la maltraiter, les coups s&#39enchaînent, anorexie et chute sociale s&#39ensuivent. Cette vie, qui a pu la mener au bord du suicide, Adeline Toniutti nous la raconte dans Incandescente pour toujours. Intime, elle se livre, « l&#39âme dans la plume », à travers un récit poignant avec le ton et la force qu&#39on lui connaît, afin de nous rappeler : « Tant qu&#39on respire encore et qu&#39on ne nous a pas fermé les yeux, il faut se battre. »",978-2268110349,https://m.media-amazon.com/images/I/71L4QhM0B2L._SY522_.jpg,Editions du Rocher (3 avril 2024),Adeline Toniutti,Radio
Je m&#39appelais Franck,9.2,""" Je vais te raconter ma vie. Une vie de surprises, de chocs et de désillusions qui m&#39a fait prendre conscience de la fragilité de l&#39existence. Mais un parcours ponctué d&#39expériences plus ou moins heureuses dont j&#39ai toujours tiré une leçon. Et déjà, tu le sais, puisque c&#39est le titre du livre : avant d&#39être Vincent, je m&#39appelais Franck... ""
"" Je vais te raconter ma vie. Une vie de surprises, de chocs et de désillusions qui m&#39a fait prendre conscience de la fragilité de l&#39existence. Mais un parcours ponctué d&#39expériences plus ou moins heureuses dont j&#39ai toujours tiré une leçon. Et déjà, tu le sais, puisque c&#39est le titre du livre : avant d&#39être Vincent, je m&#39appelais Franck... ""

"" Vincent Lagaf&#39 est un survivant. """,978-2266340755,https://m.media-amazon.com/images/I/71ncSAwW-AL._SY522_.jpg,Pocket (4 avril 2024),Vincent Lagaf,Radio
La Légende de Paris Match,14.82,"Paris Match est le témoin privilégié de l&#39histoire des Français depuis 1949. Inventeur d&#39un certain style d&#39information, vif, illustré, proche, il a fait entrer chez nous l&#39intimité des grands de ce monde.
Ce sont des reportages iconiques, des portraits inoubliables : la conquête de l&#39Annapurna en 1950 ; le Mondial 1998 ; le couronnement d&#39Elizabeth II et la mort de Lady Di ; l&#39arrivée du rock dans les bagages de Johnny ; la plage de la Madrague où pose "" B.B. "" pour les photographes de Match seuls ; et aussi la dernière une du général de Gaulle et le scoop révélant le visage alors inconnu de la fille secrète du président Mitterrand.
Bien plus qu&#39une rétrospective, voici un hommage vibrant aux grandes signatures et aux valeurs qui ont façonné le magazine pendant plus de sept décennies : le courage, l&#39audace et, par-dessus tout, la passion.",978-2259317955,https://m.media-amazon.com/images/I/61Ev6qamibL._SY522_.jpg,Plon (25 avril 2024),Patrick Mahé,Radio
La Prochaine fois je vous l&#39écrirai...,22.0,""" Nommer ma dette ne suffit pas à la payer. Peut-être même cela l&#39aggrave-t-il. Après tout, comme le disait Victor Hugo : ""Il y a, dans l&#39admiration, je ne sais quoi de fortifiant.&#39 ""
Philippe Meyer n&#39est jamais meilleur qu&#39en admirant ceux dont il brosse le portrait. La galaxie épatante de ses amis donne le tournis : deux académiciens, deux cinéastes, un ancien Premier ministre, mais aussi des inconnus, comme un médecin luttant pour la dignité des malades mentaux, un jeune haut fonctionnaire pétri d&#39idéaux...
Parmi ceux qu&#39il a aimés, on retrouve les figures de Bertrand Tavernier, Cyril Collard, Annie Kriegel, Pierre Desproges, Michel Rocard, Frédéric Rossif, René de Obaldia, Charles Aznavour, Jean-Marie Domenach, Jean-François Revel, Claude Sautet, Jean d&#39Ormesson...
Parfois piquant, toujours tendre, avec son humour subtil et sa culture ébouriffante, Philippe Meyer rend grâce et c&#39est formidable.",979-1037511751,https://m.media-amazon.com/images/I/618DHBfWEzL._SY522_.jpg,Les Arènes (25 avril 2024),Philippe Meyer,Radio
Sans transition...: Autobiographie,20.5,"Pour la première fois, dans cette autobiographie sincère, émouvante et savoureuse, Dechavanne se raconte et dévoile, sans transition, des moments de vie et des facettes inconnues de son parcours, de sa jeunesse épique à Montmartre jusqu&#39au plateau de Quelle époque !, sans oublier C&#39est encore mieux l&#39après-midi, Ciel, mon mardi !, Coucou, c&#39est nous ! Et tout le reste...",978-2080435477,https://m.media-amazon.com/images/I/614jj8FITqL._SY522_.jpg,FLAMMARION; Illustrated édition (24 janvier 2024),Christophe Dechavanne,Radio
"Livre d&#39or: Bleu | Mariage, EVJF, PACS, Anniversaire, Départ à la retraite, Vernissage | 100 pages vierges à remplir |",7.68,"🧡 🧡 🧡 LIVRE D’OR 🧡🧡🧡
Ce livre d’or bleu et doré accueillera les mots de vos amis, de votre famille ou de vos collègues. Vous pourrez le relire pour revivre ces instants de bonheurs à travers les mots de vos invités.
Description du livre d’or :
🔸 Format carré souple, plus pratique à manipuler et à se passer de mains en mains
🔸Finition brillante pour un rendu élégant, raffiné et chic ;
🔸Dimension : 21,5 cm x 21,5 cm ;
🔸Papier blanc de qualité ;",,https://m.media-amazon.com/images/I/711WGGMxSlL._SY522_.jpg,Independently published (8 mai 2023),Emily Grayhill,Radio
Digital Signal Processing and Software Defined Radio: Theory and Construction of the T41-EP Software Defined Transceiver,14.24,"This book combines Digital Signal Processing (DSP) and Software Defined Radio (SDR) principles into a single, easy-to-read, book. The book discusses various DSP principles, explains their purpose and how they work. It then discusses circuit(s) that can be used to implement the DSP principle. However, the book is unique in that is proceeds to use those design principles and circuits to develop an actual circuit that you can build and use to build the T41-EP (as seen of the cover); a 20W, HF, 7 band, CW/SSB Software Defined Transceiver (SDT) with features not even found in commercial radios costing ten times as much (e.g., up to 192kHz spectrum display bandwidth, ALP CW decoder, Bode Plots). The T41-EP is a self-contain SDT that does not require an external PC, laptop, or tablet to use. The EP stands for Experimenter&#39s Platform because the T41-EP is designed around 5 small printed circuit boards. You can easily swap our PCBs for boards of you own design if you wish. The small board sizes (less then 100x100mm) allow you to take advantage of the special prices offered by most PCB fabricators. Because the T41-EP project is completely Open Source, you have complete access to the C source code that controls the T41-EP as well as the hardware schematics and Gerber files (for making your own PCBs). The latest (V12) PCBs are available for less than $5 each on the web site (https://groups.io/g/SoftwareControlledHamRadio). If you wish, pre-fabricated PCBs with all SMD devices already on the board are available as a semi-kit from 4SQRP (see http://www.4sqrp.com/index.php for details).

Anyone interested in practical DSP or SDR will want this volume in their library.",979-8323291762,https://m.media-amazon.com/images/I/61fy6UFOrJL._SY522_.jpg,Independently published (18 avril 2024),Albert F Peter AC8GY,Radio
Je reviens de loin,21.0,"L&#39animateur très aimé de La Carte aux Trésors et de Faut pas rêver a traversé l&#39épreuve d&#39une dépression finalement diagnostiquée comme bipolaire aigue.
Une confession intime et bouleversante :
Derrière le sourire enthousiaste de Sylvain Augier, tant aimé de millions de français, animateur de La Carte aux trésors, Faut pas rêver et La France vue du ciel, il y avait un secret bien caché : la bipolarité. Cette maladie psychique qui entraîne exaltation et dépression parfois jusqu&#39au suicide.
Dans son récit s&#39entremêlent succès et désespoir. La famille y apparait porteuse de joies et de souffrances. C&#39est un formidable message d&#39espoir : on peut revenir de loin.

Préface de Boris Cyrulnik.",978-2753304734,https://m.media-amazon.com/images/I/61uhG9nRB3L._SY522_.jpg,Telemaque (12 octobre 2023),Sylvain Augier,Radio
"Friends, mes amours et cette chose terrible",8.6,"""Salut, je m&#39appelle Matthew, mais vous me connaissez peut-être sous un autre nom. Mes amis m&#39appellent Matty. Et je devrais être mort."" Ainsi commence le captivant récit du célèbre Matthew Perry, acteur qui incarna le légendaire Chandler de Friends. Au fil de ses souvenirs, il évoque ses ambitions de jeunesse et son rapport à la célébrité, ses addictions et sa guérison après un grave problème de santé qui lui fit frôler la mort. Mais avant les cures de désintoxication et les séjours à l&#39hôpital, il y a le Matthew de 5 ans qui voyagea de Montréal à Los Angeles, ballotté entre des parents séparés ; celui de 14 ans, star du tennis au Canada ; celui de 24 ans qui décrocha le rôle le plus convoité des États-Unis pour le pilote d&#39une série appelée à l&#39époque Friends Like Us... Il revient sur l&#39aventure que fut Friends, nous livrant des anecdotes sur ses camarades de tournage et d&#39autres stars croisées sur la route. Avec l&#39humour et l&#39honnêteté qu&#39on lui connaît, Matthew Perry se met à nu et nous offre des Mémoires inoubliables.",978-2290390832,https://m.media-amazon.com/images/I/61LfK9cYLOL._SY522_.jpg,J&#39AI LU (8 novembre 2023),Matthew Perry,Radio
Le radioamateur: Prépapration à l&#39examen technique,12.52,"Le manuel de référence dans le domaine des radiocommunications.
Cet ouvrage, qui expose les bases de la transmission radio et de l’installation d’une station d’émission, est le fruit de nombreuses années d’expérience et d’enseignement. Tout particulièrement destiné aux candidats à l’examen de radioamateur, c’est un outil précieux pour le lecteur intéressé par les radiocommunications et désirant acquérir les connaissances techniques indispensables à l’installation et à la maintenance d’une station émettrice.",978-2710811978,https://m.media-amazon.com/images/I/41oXubn0cnL.jpg,TECHNIP; 5e édition (14 février 2023),Olivier Pilloud,Radio
Build Your Own Intelligent Amateur Radio Transceiver,6.92,"With the help of this sure-fire instruction guide, you can learn how to build a sophisticated, yet low-cost microprocessor-controlled radio transceiver as well as smaller devices such as a simple frequency synthesizer and a spectrum analyzer.
Filled with tested, hands-on projects that really work, this great reference features single-sided circuit boards that are easy to build, and includes detailed circuit-board layouts and extensive parts lists.
""Build Your Own Intelligent Amateur Radio Transceiver"" will enable you to:
Interface digital and analog circuitry
Keep digital switching noise out of sensitive analog circuits",978-0070282643,https://m.media-amazon.com/images/I/71XyFGLHABL._SY522_.jpg,"McGraw-Hill Inc.,US (19 décembre 1996)",Randolph L Henderson,Radio
Libertés sans expression,18.9,"Christine Kelly témoigne de son parcours, de sa vision du journalisme aujourd&#39hui au cœur des critiques, et surtout des attaques quotidiennes contre la liberté d&#39expression – toujours pour de "" bonnes raisons "".
Jamais je n&#39aurais pu penser que l&#39exercice du métier de journaliste me conduirait un jour à "" bénéficier "" d&#39une protection rapprochée. En France. En 2022. Qu&#39avais-je donc fait qui pût ainsi mettre ma vie en danger ? À moins que cette question ne soit le piège dans lequel il convient de ne pas tomber, car à chercher des raisons à la haine, on a tôt fait de lui trouver des excuses. Nous sommes à l&#39heure où l&#39inversion des valeurs abîme la société : se trouvent paradoxalement menacés ceux qui sont des remparts contre les différentes formes de censure. Et si l&#39on ne peut ni convertir la bêtise en intelligence ni interrompre ce désastre sous-estimé que sont les nouveaux intégrismes, au moins peut-on encore écrire des livres et publier un "" contredit "".",978-2749172194,https://m.media-amazon.com/images/I/61bG5SHdF-L._SY522_.jpg,Cherche Midi (9 juin 2022),Christine Kelly,Radio
Sur les routes du jazz,12.55,"Chroniques d&#39un passionné de musique

Savez-vous ce qui relie la mort de Robespierre à la naissance du jazz ? À quoi ressemblaient les vocalises des pharaons ? Quel est le rapport entre un moine allemand du xve siècle et Louis Armstrong ?
Après le succès de Sur les routes de la musique, adapté sur France Inter en 2022, André Manoukian nous livre de nouvelles chroniques qui retracent l’histoire du jazz. Un genre musical qui prend racine en Afrique, grandit aux Amériques avec les esclaves donnant naissance au gospel, au blues, et qui revient sous forme de rumba congolaise ou d’afro-beat. André Manoukian nous initie à cet art et dévoile par touches les petites histoires qui font la grande musique.",979-1033915355,https://m.media-amazon.com/images/I/71gl5E-N5nL._SY522_.jpg,HarperCollins (8 novembre 2023),André Manoukian,Radio
