Nom,Prix,Description,Isbn,Photo,Editeur,Auteur,Categorie
Courir un marathon pour les Nuls poche,19.02,"Objectif marathon !
Comment se préparer à un marathon de façon optimale ? Quel équipement choisir ? Comment gagner en endurance sans se décourager ? Faut-il suivre un régime particulier ? Comment ne pas se blesser ? Quels autres sports un coureur peut-il pratiquer pour compléter son entraînement ?

Pour tous ceux dont le but est de participer pour la première fois ou d&#39arriver en bonne place aux prochains marathons de Paris ou de New York, tous les conseils pour débuter et pour progresser sont réunis dans ce Nul poche, concis et pratique.",978-2754086882,https://m.media-amazon.com/images/I/61+WmRFx-ML._SY522_.jpg,Pour les nuls; Illustrated édition (12 mai 2016),Tere Stouffer Drenth,Marathon
24 semaines pour courir un marathon,14.68,"N’avez-vous jamais rêvé de pouvoir réaliser un défi que vous n’oublierez jamais ? Ce livre est fait pour vous si vous voulez devenir une marathonienne ou un marathonien !
Faites-vous confiance, n’hésitez plus et lancez-vous dans ce challenge qui vous changera à jamais.
Découvrez les bases de la course à pied ainsi que de nombreux conseils sur l’alimentation, l’équipement, les entraînements ou encore les erreurs à éviter pour préserver son corps et son mental. Ce guide en 24 semaines vous dévoilera tous les éléments pour vous permettre de réussir avec succès cette épreuve et ce, avec des témoignages de personnalités marquantes dans différents domaines.",979-8859627103,https://m.media-amazon.com/images/I/71k-v52-phL._SY522_.jpg,Independently published (2 mai 2024),Thomas Rigaux,Marathon
Petit guide du Marathon des Sables et autres ultras sablonneux,22.0,"Au travers de récits et de conseils, Cécile Bertin cherche avant tout à porter un regard réaliste et très pratique sur ces courses qui font rêver de nombreux coureurs amateurs. Sans jamais se départir de son sens de l&#39humour qui a fait sa réputation dans le petit monde fermé des courses extrêmes, elle prouve avant toute chose qu&#39avec un sac bien préparé et un niveau en sport modeste, on peut beaucoup si l&#39on a le courage d&#39aller chercher en soi les ressources insoupçonnées qui y sommeillent. Que ce soit pour traverser des déserts sablonneux, caillouteux ou gelés, pour affronter la jungle, on trouve dans cet ouvrage un maximum d&#39informations et de conseils simples mais très utiles lorsqu&#39il s&#39agit de faire tenir 8 jours de sa vie dans un simple sac à dos.",978-2490329069,https://m.media-amazon.com/images/I/41efFN-PQ6L.jpg,Outdoor éditions (12 avril 2019),Cécile Bertin,Marathon
Gobi et moi,7.2,"Coureur marathonien de l’extrême, Dion Leonard s’apprête à participer à une course d’endurance de 250 kilomètres au cœur des terres sauvages du désert de Gobi, en Chine. Une course redoutable, éprouvante. Le deuxième jour de l’épreuve, un petit chien se mêle aux coureurs sur la ligne de départ. Il semble avoir jeté son dévolu sur Dion, bien décidé à le suivre à chaque étape de la course…
Dion n’a pas du tout l’intention de courir ce marathon en binôme. Et pourtant, comment résister à cette petite boule de poils, endurante et courageuse, et qui ne le lâche pas d’une semelle ?

Traduit de l’anglais (Australie) par Z. Papillon",979-1033906834,https://m.media-amazon.com/images/I/71CwKbH2z9L._SY522_.jpg,HarperCollins; Illustrated édition (27 mai 2020),Dion Leonard,Marathon
"The Bomb Doctor: A Scientist&#39s Story of Bombers, Beakers, and Bloodhounds",7.99,"A rare peek behind the curtain into boots-on-the-ground, in-the-lab scientific bomb forensics--told with humanity, heart, and even a bit of humor.
This is not CSI. What you encounter as a true bomb detective--or ""Bomb Doctor,"" as some in the FBI call me--are fields of twisted metal containing soot-covered fragments intermingled with human remains. You have carnage and chaos. As you wade into that sea of wailing sirens and screaming survivors awash with the stench of diesel fuel and decaying bodies, your job is to ferret out forensic clues in a type of macabre scavenger hunt to ultimately reconstruct the scene and the explosive device and determine what happened and what the bomb looked like before it was torn asunder.
None of this happens overnight. Nor does it happen in a timeframe that can be neatly packaged in an hour-long made-for-TV drama. The scavenger hunt can take months--or, in the case of the infamous Collar Bomber, seven painstaking years. The work is worth every second and every horrific image that etches itself into your brain because it helps prevent new horrors. Not all, obviously. We are not superheroes. But unlike shooters, who often just ""snap"" or seem to act out in random ways, bombers almost always have a story--one that follows an arc.",979-8888452974,https://m.media-amazon.com/images/I/71pL39CZBpL._SY522_.jpg,Regalo Press (21 mai 2024),Kirk Yeager,Marathon
"Running, courir après un objectif et l&#39atteindre: avec la méthode S.M.A.R.T - 5km, 10km, Semi-marathon, Marathon... Lancez-vous à la conquête de ... grâce à ce livre sur la course à pied",8.05,"Vous souhaitez vous lancer dans le running❓
Vous êtes débutant en course à pied et voulez progresser❓
Vous êtes déjà un coureur aguerri mais aimeriez performer sur de nouvelles distances❓

Nous avons tous un objectif ou une raison propre qui nous motive à courir, que ce soit battre un chrono, boucler un marathon ou simplement réussir à courir plus pour sa santé. Malheureusement, sans méthode ni planification précise, il peut parfois s&#39avérer compliqué d&#39atteindre son but.

Si tel est votre cas, ne cherchez plus, voici le guide ultime pour la course à pied qu&#39il vous faut ! Précis, synthétique, complet et motivant. Que vous soyez un coureur débutant ou confirmé, ce livre vous offre toutes les connaissances et conseils pour optimiser au mieux votre expérience de course en fonction de",979-8857852767,https://m.media-amazon.com/images/I/61MK0k+kfqL._SY522_.jpg,Independently published (17 août 2023),Run Rise,Marathon
"Running, courir après un objectif et l&#39atteindre: avec la méthode S.M.A.R.T - 5km, 10km, Semi-marathon, Marathon... Lancez-vous à la conquête de ... grâce à ce livre sur la course à pied",19.89,"Vous souhaitez vous lancer dans le running❓
Vous êtes débutant en course à pied et voulez progresser❓
Vous êtes déjà un coureur aguerri mais aimeriez performer sur de nouvelles distances❓

Nous avons tous un objectif ou une raison propre qui nous motive à courir, que ce soit battre un chrono, boucler un marathon ou simplement réussir à courir plus pour sa santé. Malheureusement, sans méthode ni planification précise, il peut parfois s&#39avérer compliqué d&#39atteindre son but.

Si tel est votre cas, ne cherchez plus, voici le guide ultime pour la course à pied qu&#39il vous faut ! Précis, synthétique, complet et motivant. Que vous soyez un coureur débutant ou confirmé, ce livre vous offre toutes les connaissances et conseils pour optimiser au mieux votre expérience de course en fonction de",979-8857852767,https://m.media-amazon.com/images/I/61MK0k+kfqL._SY522_.jpg,Independently published (17 août 2023),Run Rise,Marathon
"Ma bible du running, du trail et du marathon",23.0,"Envie de préparer votre premier marathon ? D’améliorer votre temps au 10 km ? De vous lancer dans le trail ? La course se pratique sous de nombreuses formes, chacune avec des défis qui lui sont propres, et s’aborde différemment selon votre niveau et votre envie.
Dans cet ouvrage complet, Guillaume Adam, coureur de niveau international et cofondateur de l’application d’entraînement RunMotion Coach®, partage ses conseils avec vous.
Découvrez l’histoire du running de la naissance du marathon à nos jours, au travers des coureurs légendaires qui l’ont marquée, et des courses mythiques qui attirent des sportifs du monde entier.
Définissez votre objectif et mettez en place un programme d’entraînement complet et approprié :",979-1028527860,https://m.media-amazon.com/images/I/71vObDB0feL._SY522_.jpg,LEDUC; 1er édition (28 mars 2023),Guillaume Adam,Marathon
L&#39essentiel sur l&#39alimentation du sportif,12.18,"2e édition du livre L&#39essentiel sur l&#39alimentation du sportif. Pratique et complet, ce livre répond à la majorité des situations diététiques auxquelles sont confrontées les professionnels du sport et les sportifs attentifs à l&#39amélioration de leurs performances. Que peut faire la nutrition pour aider à la gestion du poids de forme, maximiser les capacités musculaires, améliorer les qualités d&#39endurance ? Comment les bons choix alimentaires avant, pendant, après l&#39effort peuvent-ils optimiser les programmes sportifs ? Comment la diététique peut-elle aider à lutter contre les fragilités métaboliques Quelle est la vraie place des compléments alimentaires ? Sportifs occasionnels ou sportifs confirmés trouveront là leurs réponses. L&#39enjeu de cet ouvrage est d&#39offrir une mise en application des avancées les plus récentes en matière de diététique sportive accessible, de la cuisine aux lieux d&#39entraînement ou de compétition. Des recettes simples, faciles, gourmandes complètent le menu des ravitaillements et de la table : le plaisir, le manger bien et bon sont autant d&#39éléments forts et indissociables de la pratique physique et sportive !",978-2494407046,https://m.media-amazon.com/images/I/71qZtghvJxL._SY522_.jpg,GARANCIERE; 2e édition (22 juin 2023),Dominique Poulain,Marathon
"The Highland Games: A Beginner&#39s Guide to History, Kilts & Throwing",15.56,"Are you looking for more information about the Highland Games? Learn more about this Scottish heritage today!The Highland Games, when and how did they get their start and how did they develop into the modern day Games? How many events are there? How can I find a Scottish clan that is associated with the various tartans? Gareth Ainsworth answers these questions and many more in The Highland Games, a beginner’s guide to history, kilts & throwing. Gareth is an multi-faceted man that loves to share his experiences in military and sports, particularly the Highland Games, on his podcast The Kilted Patriot and now this book.Inside, you’ll discover: - The history of the Highland Games.- An overview of the games, the basics, governing bodies for the Games, and the different classes.- How to get started.- Where should you buy a kilt, how you should by one, and what you wear under a kilt.- And more…This book also includes a 12-month game planning calendar as well as a 12-week training log to practice and prepare for the big day.Get The Highland Games, a beginner’s guide to history, kilts & throwing now to learn more about this part of Scottish history.",978-1735688565,https://m.media-amazon.com/images/I/71gC-fOxZtL._SY522_.jpg,"Pendragon Consulting, LLC (21 décembre 2020)",Gareth Ainsworth,Marathon
De arte gymnastica. Da Maratona ad Atene con le ali ai piedi,8.21,"E se provassimo per una volta a &#39correre come correvano i Greci&#39? Amanti del running oppure no, una cosa è certa. Tutto è cambiato dall&#39epoca di Filippide a oggi – la tecnologia, la politica, la scienza, la guerra, il modo di scrivere, di mangiare, di viaggiare, persino il clima –, ma due cose sono rimaste invariate: i nostri muscoli e quei maledettissimi 41,8 km che separano Maratona dall&#39acropoli di Atene. Proprio quelli che ho intenzione di correre. Perché corriamo? Perché tutto questo affannarsi e faticare? Cosa racconta di noi questa continua ricerca di muscoli e sudore? Ancora una volta dobbiamo risalire il tempo e tornare ai Greci, i primi che si chiesero perché mettiamo alla prova noi stessi misurandoci contro gli altri. Il famoso motto mens sana in corpore sano dice del valore che gli Antichi attribuivano a tali prove, tanto che le Olimpiadi erano l&#39unico periodo in cui le armi dovevano necessariamente tacere. Andrea Marcolongo, dopo anni trascorsi tra libri e grammatiche a provare a &#39pensare come pensavano i Greci&#39, ha cominciato ad allenarsi e ha provato a &#39correre come correvano i Greci&#39. E lo ha fatto utilizzando come strumento di accompagnamento il primo manuale di sport della storia, il De arte gymnastica del filosofo Filostrato. Fino al folle proposito finale: correre una maratona, anzi, la maratona, i 41,8 km che separano Maratona da Atene percorsi duemilacinquecento anni fa dal soldato Filippide, prima di stramazzare a terra per la troppa fatica.",978-8858152218,https://m.media-amazon.com/images/I/61LdKxdOBGL._SY522_.jpg,Laterza (7 juillet 2023),Andrea Marcolongo,Marathon
Un pas après l&#39autre: De l&#39anorexie aux marathons,18.0,"Alors qu&#39elle fête ses 18 ans, Romane n&#39est plus que l&#39ombre d&#39elle-même. La jeune femme pèse seulement 36 kilos ! Anorexique, cela fait des mois qu&#39elle ne s&#39alimente quasiment plus. Au point de frôler la mort et de devoir être hospitalisée. C&#39est enfin le déclic : se rendant compte qu&#39il est vital de réagir, Romane décide de se faire suivre par des médecins et un psychologue. Et peu à peu, elle remonte la pente, se remet à courir, sa passion depuis toujours. À force d&#39efforts, en deux années difficiles, la jeune femme devient une marathonienne d&#39exception et reprend goût à la vie. Dans ce livre, Romane raconte sa descente aux enfers, mais surtout son combat contre une maladie qui touche près de la moitié des adolescentes et conduit des milliers d&#39entre elles au suicide. Son récit est un témoignage d&#39espoir. Une formidable leçon de vie.",978-2824621494,https://m.media-amazon.com/images/I/81rAEM1iOeL._SY522_.jpg,City Edition (11 janvier 2023),Romane Lemière,Marathon
"Running, courir après un objectif et l&#39atteindre: avec la méthode S.M.A.R.T - 5km, 10km, Semi-marathon, Marathon... Lancez-vous à la conquête de ... grâce à ce livre sur la course à pied",10.81,"Vous souhaitez vous lancer dans le running❓
Vous êtes débutant en course à pied et voulez progresser❓
Vous êtes déjà un coureur aguerri mais aimeriez performer sur de nouvelles distances❓

Nous avons tous un objectif ou une raison propre qui nous motive à courir, que ce soit battre un chrono, boucler un marathon ou simplement réussir à courir plus pour sa santé. Malheureusement, sans méthode ni planification précise, il peut parfois s&#39avérer compliqué d&#39atteindre son but.

Si tel est votre cas, ne cherchez plus, voici le guide ultime pour la course à pied qu&#39il vous faut ! Précis, synthétique, complet et motivant. Que vous soyez un coureur débutant ou confirmé, ce livre vous offre toutes les connaissances et conseils pour optimiser au mieux votre expérience de course en fonction de",979-8857852767,https://m.media-amazon.com/images/I/61MK0k+kfqL._SY522_.jpg,Independently published (17 août 2023),Run Rise,Marathon
"Running, courir après un objectif et l&#39atteindre: avec la méthode S.M.A.R.T - 5km, 10km, Semi-marathon, Marathon... Lancez-vous à la conquête de ... grâce à ce livre sur la course à pied",7.14,"Vous souhaitez vous lancer dans le running❓
Vous êtes débutant en course à pied et voulez progresser❓
Vous êtes déjà un coureur aguerri mais aimeriez performer sur de nouvelles distances❓

Nous avons tous un objectif ou une raison propre qui nous motive à courir, que ce soit battre un chrono, boucler un marathon ou simplement réussir à courir plus pour sa santé. Malheureusement, sans méthode ni planification précise, il peut parfois s&#39avérer compliqué d&#39atteindre son but.

Si tel est votre cas, ne cherchez plus, voici le guide ultime pour la course à pied qu&#39il vous faut ! Précis, synthétique, complet et motivant. Que vous soyez un coureur débutant ou confirmé, ce livre vous offre toutes les connaissances et conseils pour optimiser au mieux votre expérience de course en fonction de",979-8857852767,https://m.media-amazon.com/images/I/61MK0k+kfqL._SY522_.jpg,Independently published (17 août 2023),Run Rise,Marathon
The Science of Running: How to find your limit and train to maximize your performance,16.94,"Reviews of The Science of Running:""The Science of Running sets the new standard for training theory and physiological data. Every veteran and beginner distance coach needs to have this on their book shelf.""-Alan WebbAmerican Record Holder-Mile 3:46.91 ""For anyone serious about running, The Science of Running offers the latest information and research for optimizing not only your understanding of training but also your performance. If you want to delve deeper into the world of running and training, this book is for you. You will never look at running the same.""-Jackie Areson, 15th at the 2013 World Championships in the 5k. 15:12 5,000m best If you are looking for how to finish your first 5k, this book isn’t for you. The Science of Running is written for those of us looking to maximize our performance, get as close to our limits as possible, and more than anything find out how good we can be, or how good our athletes can be. In The Science of Running, elite coach and exercise physiologist Steve Magness integrates the latest research with the training processes of the world’s best runners, to deliver an in depth look at how to maximize your performance. It is a unique book that conquers both the scientific and practical points of running in two different sections. The first is aimed at identifying what limits running performance from a scientific standpoint. You will take a tour through the inside of the body, learning what causes fatigue, how we produce energy to run, and how the brain functions to hold you back from super-human performance. In section two, we turn to the practical application of this information and focus on the process of training to achieve your goals. You will learn how to develop training plans and to look at training in a completely different way. The Science of Running does not hold back information and is sure to challenge you to become a better athlete, coach, or exercise scientist in covering such topics as:· What is fatigue? The latest research on looking at fatigue from a brain centered view.· Why VO2max is the most overrated and misunderstood concept in both the lab and on the track· Why “zone” training leads to suboptimal performance.· How to properly individualize training for your own unique physiology.· How to look at the training process in a unique way in terms of stimulus and adaptation.· Full sample training programs from 800m to the marathon.",978-0615942940,https://m.media-amazon.com/images/I/61mVQClMstL._SY522_.jpg,Origin Press; 1er édition (17 février 2014),Steve Magness,Marathon
Mon Album Souvenir Course à Pieds: Carnet pour Collectionner vos Photos de Courses & Dossards,9.83,"Chaque course est une aventure, c’est pourquoi il est important d’en garder des souvenirs.
Tout au long de vos courses, complétez votre carnet avec des anecdotes, des photos, vos dossards, afin de le transformer en un veritable album souvenir.

Si vous êtes un coureur passionné qui souhaite garder une trace des moments forts de sa progression, alors cet album est fait pour vous !

🏆 Que contient cet album ?
👟 Pour chaque course, une page vous guidera afin de retranscrire et immortaliser votre expérience",,https://m.media-amazon.com/images/I/61B-eSZNTLL._SY522_.jpg,Independently published (4 avril 2024),Lisa Dapon,Marathon
The Finishers The Barkley Marathons /anglais,55.86,"A glorious photographic record of the superhumans who have completed the Barkley Marathons, one of the most mythical running races on earth.

It is a race like no other: There is no website to take entries; participants are selected from those who find a way to submit written applications and a $1.60 entry fee; only around 40 people are chosen to run, with condolences from the race director. The course, based in the Cumberland Mountains of Tennessee, takes place amid unforgiving landscapes and harsh vegetation, often in horrendous conditions with poor visibility. Runners must complete five 20-mile loops - those who manage to complete only three laps are deemed to have achieved the &#39fun run&#39 - with a total elevation climb equal to two ascents of Mount Everest. Since 1986, only 15 people have ever finished. This exceptional publication celebrates their unbelievable achievements.

Until relatively recently, the event was known only by true insiders, but with the increasing popularity of trail running and the race&#39s inaccessibility to anyone except the participants and a handful of media, it has attained mythical status.

Thanks to ultrarunning photographer Alexis Berg and L&#39Équipe journalist Aurélien Delfosse, we now have a record of these superhumans - many of whom are unknown in sporting circles - who have completed the race. Crisscrossing the United States to meet each finisher, Berg and Delfosse travelled from New Hampshire to Oregon via New Mexico, Colorado, California and Utah, capturing stunning photographs and in-depth interviews with the finishers. These stories inspire awe, respect and reflection at the limit of the human spirit.",978-0500025079,https://m.media-amazon.com/images/I/81EKXkA5JAL._SY522_.jpg,Thames & Hudson Ltd; 1er édition (17 février 2022),Alexis Berg,Marathon
Zéro Blabla : Mon premier marathon,7.9,"Mon premier marathon - zéro blabla :
Programme en 12 semaines pour être prête le jour J
Les secrets d&#39une bonne récupération pour éviter les lendemains difficiles
Des conseils pour bien s&#39alimenter et avoir une hygiène de vie au top
Les 5 commandements de la future marathonienne (si, si, vous allez le faire !)
Comment choisir votre course et... vos chaussures ?
Des exercices de préparation mentale pour tenir jusqu&#39à la ligne d&#39arrivée
+ de l&#39info, des dessins, de l&#39humour !",978-2501140560,https://m.media-amazon.com/images/I/81vZTwVcvhL._SY522_.jpg,MARABOUT; Illustrated édition (10 avril 2019),Marie Paturel,Marathon
Niente può fermarti. Can&#39t hurt me. Domina la mente e sfida l&#39impossibile,8.56,"Quanto spesso subiamo gli eventi invece di fare delle scelte? Ci sentiamo vittime della routine, delle aspettative degli altri, della nostra inadeguatezza? Eppure tutti possiamo diventare i protagonisti della nostra vita. David Goggins, atleta e motivatore di fama internazionale considerato l&#39uomo più duro al mondo, lo ha fatto. Partito da circostanze difficilissime, ha iniziato il suo straordinario percorso di rinascita quando ha capito che il vero nemico non è fuori, ma dentro di noi. In questo libro scoprirai la sua incredibile avventura, le vittorie e le cadute, il successo guadagnato sfida dopo sfida. E soprattutto imparerai a riprogrammare la mente per sbloccare il tuo vero potenziale. Scopri anche tu che niente può fermarti! Pronto alla sfida? In questo libro troverai: Le 10 sfide per diventare invincibile; La regola del 40% per trovare il tuo vero potenziale; Il metodo del Barattolo dei biscotti per superare te stesso; Il sistema dello Specchio per potenziare la tua autodisciplina; L&#39After Action Report per trasformare i tuoi fallimenti nella chiave del tuo successo.",978-8855059176,https://m.media-amazon.com/images/I/61cFhPHMJrL._SY522_.jpg,Vallardi A.; 8e édition (25 avril 2023),David Goggins,Marathon
"Mes plus beaux dossards: Que chaque dossard collé raconte une histoire, et que chaque page tournée réveille en vous la passion de courir.",6.14,"Découvrez ""Mes Plus Beaux Dossards"" 📘, bien plus qu&#39un simple livre, c&#39est le compagnon idéal pour tous les passionnés de course à pied! 🏁
✨ Immortalisez vos Exploits : Collez vos dossards directement sur les pages dédiées et capturez les détails essentiels de chaque course – distance, lieu, temps, classement. 🌍🕰️🏆
📖 Un Journal Émotionnel : Exprimez vos ressentis et émotions à chaque page, créant ainsi un récit complet de votre parcours sportif. 💪📝
🔍 Une Exploration Chronologique : Feuilletez vos exploits au fil des années, revivant vos victoires et vos défis relevés. Un trésor personnel qui témoigne de votre détermination ! 📆🏞️",,https://m.media-amazon.com/images/I/51SHKK7lLWL._SY522_.jpg,Independently published (5 janvier 2024),Mme Héline de Souza,Marathon
"Running, courir après un objectif et l&#39atteindre: avec la méthode S.M.A.R.T - 5km, 10km, Semi-marathon, Marathon... Lancez-vous à la conquête de ... grâce à ce livre sur la course à pied",17.59,"Vous souhaitez vous lancer dans le running❓
Vous êtes débutant en course à pied et voulez progresser❓
Vous êtes déjà un coureur aguerri mais aimeriez performer sur de nouvelles distances❓

Nous avons tous un objectif ou une raison propre qui nous motive à courir, que ce soit battre un chrono, boucler un marathon ou simplement réussir à courir plus pour sa santé. Malheureusement, sans méthode ni planification précise, il peut parfois s&#39avérer compliqué d&#39atteindre son but.

Si tel est votre cas, ne cherchez plus, voici le guide ultime pour la course à pied qu&#39il vous faut ! Précis, synthétique, complet et motivant. Que vous soyez un coureur débutant ou confirmé, ce livre vous offre toutes les connaissances et conseils pour optimiser au mieux votre expérience de course en fonction de",979-8857852767,https://m.media-amazon.com/images/I/61MK0k+kfqL._SY522_.jpg,Independently published (17 août 2023),Run Rise,Marathon
