Nom,Prix,Description,Isbn,Photo,Editeur,Auteur
Le choc des civilisations,13.5,"Menacé par la puissance grandissante de l'islam et de la Chine, l'Occident parviendra-t-il à conjurer son déclin ? Saurons-nous apprendre rapidement à coexister ou bien nos différences nous pousseront-elles vers un nouveau type de conflit, plus violent que ceux que nous avons connus depuis un siècle ? Pour Samuel P. Huntington, les peuples se regroupent désormais en fonction de leurs affinités culturelles. Les frontières politiques comptent moins que les barrières religieuses, ethniques, intellectuelles. Au conflit entre les blocs idéologiques de naguère succède le choc des civilisations... Le livre qu'il faut lire pour comprendre le monde contemporain et les vraies menaces qui s'annoncent. ""Le livre le plus important depuis la fin de la guerre froide."" Henry Kissinger. ""Un tour de force intellectuel : une oeuvre fondatrice qui va révolutionner notre vision des affaires internationales."" Zbigniew Brzezinski. Samuel P. Huntington est professeur à l'Université Harvard où il dirige le John M. Olin Institute for Strategic Studies. Il a été expert auprès du Conseil national américain de sécurité, sous l'administration Carter. Il est le fondateur et l'un des directeurs de la revue Foreign Policy.",978-2738108395,https://m.media-amazon.com/images/I/71RWo59zrHL._SY522_.jpg,Odile Jacob (22 avril 2000),Samuel P. Huntington
La Société ingouvernable: Une généalogie du libéralisme autoritaire,20.0,"Dans ce livre, on apprendra notamment comment fut imaginé un nouveau « management des ressources humaines », imposé le « primat de la valeur actionnariale », formulé un « management stratégique de l’environnement social » sur fond de guerre aux « parties prenantes », remobilisée à des fins de dérégulation une « responsabilité sociale des entreprises » avec ses « codes de conduite », échafaudées, enfin, des stratégies invasives de « limitation de la démocratie » et de « détrônement de la politique », parmi lesquelles la « constitutionnalisation économique de la politique » et une « micropolitique de la privatisation ». Cette généalogie mettra aussi en lumière les racines intellectuelles méconnues d’un libéralisme autoritaire aux multiples facettes qui est à l’heure actuelle de plus en plus ostensiblement remis à l’ordre du jour.",978-2358721691,https://m.media-amazon.com/images/I/812FYQQ1DfL._SY522_.jpg,La Fabrique; 1er édition (19 octobre 2018),Gregoire Chamayou
L'Archipel français: Naissance d'une nation multiple et divisée,11.9,"L’archipel français
En quelques décennies, tout a changé. La France, à l’heure des gilets jaunes, n’a plus rien à voir avec cette nation une et indivisible structurée par un référentiel culturel commun. Or la dynamique de cette métamorphose révèle un archipel d’îles s’ignorant les unes les autres.
Le socle de la France d’autrefois, sa matrice catho-républicaine, s’est complètement disloqué. Jérôme Fourquet envisage d’abord les conséquences anthropologiques et culturelles de cette érosion. Mais, plus encore, ces mutations profondes de la nouvelle France induisent un effet d’« archipelisation » de la société tout entière : sécession des élites, autonomisation des catégories populaires, formation d’un réduit catholique, instauration d’une société multiculturelle de fait, dislocation des références culturelles communes.",978-2757886359,https://m.media-amazon.com/images/I/61xZCGnIU8L._SY522_.jpg,POINTS (8 octobre 2020),Jérôme Fourquet
Comment tout peut s'effondrer: Petit manuel de collapsologie à l'usage des générations présentes,9.9,"Est-ce la fin de notre civilisation ?
Et si notre civilisation s'effondrait ? Non pas dans plusieurs siècles, mais de notre vivant. Loin des prédictions Maya et autres eschatologies millénaristes, un nombre croissant d'auteurs, de scientifiques et d'institutions annoncent la fin de la civilisation industrielle, voire la fin des conditions propices à la vie telle que nous l'avons connue.

Pablo Servigne et Raphaël Stevens décortiquent les ressorts d'un possible effondrement et proposent un tour d'horizon pluridisciplinaire de ce sujet qu'ils nomment la « collapsologie ». Aujourd'hui, l'utopie a changé de camp : est utopiste celui qui croit que tout peut continuer comme avant. L'effondrement est l'horizon de notre génération, c'est le début de son avenir. Qu'y aura-t-il après ? Tout cela reste à penser, à imaginer, et à vivre...",978-2757868201,https://m.media-amazon.com/images/I/71iolEdat8L._SY522_.jpg,POINTS (20 mai 2021),Yves Cochet
Le savant et le politique,6.9,"La science, la politique : deux vocations profondément divergentes. L'une requiert modestie et disponibilité de l'esprit. L'autre, déchirée entre l'éthique de la conviction et l'éthique de la responsabilité, souffre d'une contradiction nécessaire qui toujours lui interdira la certitude scientifique. Telles sont les lignes directrices de cette profonde analyse, d'une urgence si actuelle à laquelle nous convie le plus grand sociologue allemand de ce siècle.",978-2264031594,https://m.media-amazon.com/images/I/61C5Gw07iqL._SY522_.jpg,10 X 18 (15 février 2002),Max Weber
Les ingénieurs du chaos,19.92,"Dans le monde de Donald Trump, Jair Bolsonaro et Matteo Salvini, chaque jour porte sa maladresse, sa polémique, son coup d'éclat. Aux yeux de leurs électeurs, les défauts des leaders populistes se muent en qualités. Leur inexpérience est la preuve qu'ils n'appartiennent pas au cercle corrompu des élites et leur incompétence, le gage de leur authenticité. Les tensions qu'ils produisent au niveau international sont l'illustration de leur indépendance et les théories du complot qui jalonnent leur propagande, la marque de leur liberté de penser. Pourtant, derrière les apparences débridées du carnaval populiste, se cache le travail acharné de spin-doctors, d'idéologues et d'experts du Big Data, sans lesquels ces leaders populistes ne seraient jamais parvenus au pouvoir. Dans ce livre, Giuliano da Empoli brosse le portrait de personnages presque tous inconnus du grand public, et qui sont pourtant en train de changer les règles du jeu politique et le visage de nos sociétés.",978-2073019240,https://m.media-amazon.com/images/I/61MPvEO7qqL._SY522_.jpg,FOLIO (16 mars 2023),Giuliano da Empoli
"La médiocratie: Précédé de Politique de l'extrême centre et suivi de ""Gouvernance"". Le management totalitaire",8.0,"Cette édition au format poche rassemble un inédit, Politique de l'extrême centre, en plus de La médiocratie et ""Gouvernance"", deux opus d'Alain Deneault qui traitent de la révolution anesthésiante à laquelle nous poussent les théories du management et la propension aux petits arrangements institutionnels qui caractérisent les dernières décennies. Parce que les glaciers fondent, parce que le désert avance, parce que les sols s'érodent, parce que les déchets nucléaires irradient, parce que la température planétaire augmente, parce qu'une majorité d'écosystèmes se délitent, parce que l'Etat social s'écroule, parce que l'économie réduite à la finance s'aliène, parce que les repères philosophiques se perdent, notre époque n'a plus le luxe de se laisser conduire à la petite semaine par les médiocres qui dominent.",978-2898331848,https://m.media-amazon.com/images/I/61N9jrWz1xL._SY522_.jpg,Lux Editeur (20 octobre 2016),Alain Deneault
Méthodologie de l'intervention en travail social. L'aide à la personne: Cette 7è edition remplace le 9782227476356,9.57,"Depuis 35 ans, par une approche globale qui prend en compte les dimensions individuelle, familiale et de groupe, ce manuel demeure la référence pour la formation aux méthodes du travail social. Traduit en plusieurs langues, il représente une contribution fondamentale à la construction internationale du travail social. Cette nouvelle édition a été révisée et actualisée en tenant compte des évolutions récentes des problématiques et des terminologies.
Parce qu'une profession n'existe pas sans un ensemble de connaissances transmissibles et un cadre conceptuel général intégrant la diversité des approches et des modèles, ce livre contient les éléments de base indispensables pour le savoir-faire professionnel (processus historique de construction de la méthodologie, liens entre travail social et sciences sociales, concepts et élaboration de la méthodologie d'intervention et étapes du processus d'intervention), tout en contribuant à la construction d'une professionnalité créative et impliquée.",978-2810906840,https://m.media-amazon.com/images/I/61Fmfkig4cL._SY522_.jpg,EHESP; 2e édition (28 juin 2018),Cristina de Robertis
Voyage en misarchie: Essai pour tout reconstruire,14.9,"Misarchie. n.f. : régime dont le principe est une réduction maximale des pouvoirs et des dominations.
Sébastien est professeur de droit. À la suite d’un accident d’avion, il se retrouve sur une terre inconnue qu’il va peu à peu découvrir et dont l’organisation politique est une forme radicale de démocratie, politique, économique et sociale : la misarchie. Une utopie politique pour penser autre société, plus libre, plus égalitaire, plus diverse.
PRÉSENTATION DE L’OUVRAGE
Emmanuel Dockès expose dans cet essai ses propositions pour repenser notre société dans tous ses aspects. Au fil de l’ouvrage, l’auteur mobilise les idées les plus progressistes et les plus audacieuses sur la monnaie, la démocratie participative, le partage du travail, la propriété d’usage, la rotation des familles, l’autogestion, la liberté d’entreprendre, les services publics, l’autodétermination…",979-1097079444,https://m.media-amazon.com/images/I/51QzNPeMEYL._SY522_.jpg,ED DETOUR (16 mai 2019),Emmanuel Dockès
La vie liquide,17.11,"La vie liquide est la vie prise dans le flux incessant de la mobilité et de la vitesse. Elle est le triomphe du consumérisme. Tout, y compris l’homme, devient objet de consommation, avec une date de péremption au-delà de laquelle il devient jetable.
Analysant les changements qui affectent l’individu, les nouveaux modes de la célébrité, les transformations de la culture ou encore la promotion de la sécurité comme valeur, l’auteur décrit ainsi la société en voie de liquéfaction avancée et avance des pistes pour imaginer un avenir plus vivable.
Ouvrage fondateur de la pensée de Zygmunt Bauman, La Vie liquide annonce les concepts qu’il déploie dans toute son œuvre et est considéré comme un livre majeur de la sociologie politique.

Zygmunt Bauman est né en Pologne en 1925. Il a enseigné la sociologie à l’université de Leeds, où il est professeur émérite. Sociologue de réputation mondiale, il a publié de nombreux ouvrages et, dans la collection « Pluriel »,",978-2818503096,https://m.media-amazon.com/images/I/81Y3FI+HZWL._SY522_.jpg,Fayard/Pluriel (16 janvier 2013),Zygmunt Bauman
Fenêtre sur l'Iran: Le cri d'un peuple bâillonné,18.69,"En novembre 2019, en réaction à une révolte populaire, les dirigeants de la République islamique coupent la connexion Internet du pays. Ils massacrent à huis clos, en trois jours, au moins 1 500 manifestants pacifiques. Depuis 1979, l'Iran est devenu l'un des pays les plus fermés au monde, et son régime l'un des plus dictatoriaux. L'économie est exsangue, les désastres écologiques accablent la population, par ailleurs ravagée par la Covid-19. La plupart des journalistes iraniens sont en prison et les femmes qui résistent à la domination religieuse sont réprimées. Privés de leurs droits fondamentaux, et en l'absence de libertés politiques, les Iraniens ont pour seul espace d'expression les réseaux sociaux. Le contrôle d'Internet est ainsi devenu un enjeu majeur pour les responsables politiques, obligés de s'en réapproprier les codes pour diviser la société. La mobilisation virtuelle annoncerait-elle un soulèvement populaire ? Mahnaz Shirali a mené l'enquête au cœur de ces réseaux sociaux. À la lumière de l'histoire et de la culture iraniennes, son analyse des réactions et des comportements des internautes révèle un peuple iranien bien différent de celui habituellement représenté dans les médias, et dont les récits semblent être autant d'appels à l'aide. Arrivée en France en 1994, Mahnaz Shirali est docteure en sociologie et HDR en sciences politiques. Elle a notamment publié La jeunesse iranienne : une génération en crise (PUF, 2001), La malédiction du religieux. La défaite de la pensée démocratique en Iran (François Bourin, 2012) et The Mystery of Contemporary Iran (Transaction Publishers, 2014).",979-1025205259,https://m.media-amazon.com/images/I/51eM9yGwHjL._SY522_.jpg,Les Pérégrines (22 avril 2021),Mahnaz Shirali
"Écopunk, Les punks, de la cause animale à l écologie radicale",12.47,"Le punk rock est un formidable élan de créativité et d'énergie artistique qui se décline dans de multiples sous-genres. Mais c'est aussi une constellation d'idées et de pratiques collectives qui forment depuis les années 1980 un puissant mouvement contestataire, notamment sur le plan écologique. Ce livre montre que la contre-culture punk, et en particulier son courant anarcho-punk, a eu, depuis plus de trente ans, une influence décisive dans la diffusion de représentations et de modes d'action politiques et environnementaux. Du véganisme à la permaculture, de la défense des animaux contre l'industrie agroalimentaire à celle de la nature face à la prédation techno-industriel, de la création de zones autonomes temporaires dans les villes à la recherche de l'autonomie collective en milieu rural, les punks ont su détecter et s'approprier avant l'heure de nouvelles formes de résistance à l'ordre néolibéral triomphant. L'extraordinaire vitalité de leur scène musicale en a permis la circulation auprès de tout un pan de la jeunesse révolutionnaire, et si une part de cette révolte semble avoir été absorbée par la culture dominante, sa forme peut-être la plus radicale lutte aujourd'hui pour inventer un autre monde dans les brèches du capitalisme.",978-2369350361,https://m.media-amazon.com/images/I/71oZ7+db9sL._SY522_.jpg,Le Passager Clandestin (18 octobre 2016),Fabien Hein
Néo-fascisme et idéologie du désir: Genèse du libéralisme libertaire,15.0,"Pour Michel Clouscard, l’ensemble capitaliste se découpe séquentiellement en libéralisme classique, national-socialisme et néo-libéralisme. Chaque métamorphose correspond à une exigence pour sauver le capitalisme des crises et donc du communisme. Après le plan Marshall et Mai 1968, les idéologues des secteurs pilotes comme l’audiovisuel, la mode, les loisirs, vont promouvoir avec succès la consommation d’émancipation transgressive comme prétendu combat d’avant-garde contre le néo-capitalisme. Ce qui assurera de formidables nouveaux profits et la neutralisation de la lutte des classes. L’Anti-OEdipe de Deleuze/Guattari paru en 1972 en exprimera l’exaltation maximale. Michel Clouscard montre ici que la polémique avec ce dernier maillon des générations bourgeoises est la clé qui permet de révéler l’anthropologie bourgeoise totale. Il montre que l’idéologie transgressive, qui a pour fonction d’habiliter la consommation parasitaire et de prôner un activisme anti-étatique, est une transition vers une anthropologie néo-fasciste : l’opposition y est réduite à un spontanéisme groupusculaire et permet la destruction des institutions étatiques et la domination des trusts sur des masses schizophrénisées. Michel Clouscard démontre que toute l’anthropologie bourgeoise ne s’avère qu’une psychose – forclusion de la production, du producteur, du rapport immédiat au monde – et en dernière instance un sadisme – annexion acritique brutale de l’autre, des produits, du monde. Les « machines désirantes » autistiques fusionnent alors en une machine de mort. La terreur néo-fasciste commence. On peut mesurer aujourd’hui toute l’actualité de cette critique : FMI, UE, banques contre la Grèce, l’Irlande, le Portugal ; les opérations de l’OTAN en Yougoslavie, Afghanistan, Irak, Côte d’Ivoire, Libye, Syrie, etc.",978-2915854534,https://m.media-amazon.com/images/I/51yizICR5GL.jpg,Editions Delga (10 septembre 2013),Michel Clouscard
Lutter ensemble: Les théories de l'action collective,19.47,"Selon quelle logique des individus en viennent-ils à s'unir pour la défense d'un projet commun ? Les théoriciens de la mobilisation ne sont pas d'accord sur la réponse à apporter à cette question. Pour certains, l'action collective est avant tout le fait d'acteurs irrationnels. Pour d'autres, au contraire, l'acteur calcule, évalue les coûts et les bénéfices de son action. D'autres enfin estiment que l'individu met avant tout en jeu son identité personnelle lorsqu'il rejoint un mouvement. Ce livre, qui se présente comme une revue critique des théories de la mobilisation, cherche à évaluer la portée explicative de chacune de ces réponses.",978-2738418883,https://m.media-amazon.com/images/I/61wrj862UTL._SY522_.jpg,Editions L'Harmattan (1 janvier 1985),Fillieule O.
La Fin du Mal,15.43,"Jamais dans toute l’histoire les circonstances n’ont été réunies contre le mal manifeste de la tyrannie et de l’esclavage, comme c’est le cas aujourd’hui.
Les rêves qui brûlent dans les cœurs de milliards de personnes sont devenus de plus en plus forts au cours des millénaires.
Nous devons aux enfants de ce monde une liberté de l’esclavage, que peu sont capables de concevoir.
C’est l’ère la plus passionnante de toute l’histoire humaine ; c’est l’aube de la liberté de l’humanité.

Les mots des lecteurs et lectrices :

«Les superlatifs me manquent quant à l’importance de ce livre, surtout à notre époque. Pour une meilleure compréhension du contexte mondial. »
« Un des livres les plus importants jamais écrit. Je suis si heureux de l’avoir dans ma librairie. »
« Une explication complète de la manière dont le « mal » contrôle le monde. Quiconque s’intéresse aux questions de liberté en général devrait lire ce livre. »
« Tout le monde devrait lire ce livre. Je l’ai acheté plusieurs fois pour le donner autour de moi. Il n’y a rien de plus à dire. »
« Un livre qui ouvre les yeux et qui aide à comprendre le monde qui nous entoure. »
« J’ai rarement lu un si bon livre. Le contenu a largement dépassé mes attentes. »
« Ce livre libère et donne de l’espoir. »
« Ce livre est incontournable pour tous ceux qui aiment la liberté, ou pour ceux qui ont le sentiment que quelque chose ne va pas, sans parvenir à le voir. La capacité de ce livre à rassembler autant de vérités en près de 120 pages est étonnante. »",978-2956903307,https://m.media-amazon.com/images/I/61blVFLrbqL._SY522_.jpg,ATMAN (22 mars 2021),Jeremy Locke
De l'humiliation,17.5,"Quel rapport entre les crimes abjects des djihadistes, le danger que représentent à certains égards les « réseaux sociaux » pour la démocratie et la civilité, la question de la liberté d’expression et du blasphème, le durcissement quasi-guerrier de la laïcité, les gilets jaunes, les majorités dangereuses qui ont porté Trump ou Erdogan au pouvoir, et qui poussent à nos portes ? Nous ne comprenons pas ce qui nous arrive, ces colères qui montent en miroir sans plus rien chercher à comprendre, nous ne savons et sentons plus ce que nous faisons. Je voudrais proposer ici une hypothèse. Nous avons globalement fait fausse route. Nous nous sommes enfoncés dans le déni de l’humiliation, de son importance, de sa gravité, de son existence même.

L’humiliation est partout dans nos sociétés, et nous ne la voyons pas. C’est qu’elle est difficile à mesurer, et semble subjective : ce qui humiliera l’un laissera l’autre indifférent. Elle est même souvent instrumentalisée par le machiavélisme politique, ou pire, le fanatisme religieux, quand elle n’est pas tout simplement une technique managériale. Et cela, d’autant plus que nous nous sommes enfoncés dans le déni de l’humiliation, de sa gravité, de son existence même. Nos sociétés sont sensibles aux violences et aux inégalités, mais insensibles à l’humiliation qui les empoisonne, et il nous faudrait enquêter sur les racines de cette insensibilité. Et pourtant l’humiliation est là : si les violences s’attaquent au corps de l’autre, l’humiliation s’attaque à son visage. L’humiliation fait taire le sujet parlant, elle lui fait honte de son expression, de ses croyances et de ses goûts, elle ruine sa confiance en soi, elle dévaste pour longtemps les circuits de la reconnaissance, et laisse derrière elle une parole dérisoire ou fanatique. Elle peut également atteindre des minorités langagières, sexuelles, raciales, religieuses, sociales, etc. Il arrive même qu’une majorité soit humiliée par une minorité dominante, et devienne une majorité « dangereuse ». L’humiliation du Traité de Versailles prépare la venue de Hitler au pouvoir. Beaucoup de nos sociétés jadis démocratiques sont rongées par ces manipulations de la peur et ces politiques du ressentiment, qu’attisent les « réseaux sociaux » et les médias où s’affichent librement les haines et les mépris. La barbarie pousse à nouveau aux portes de notre Histoire. C’est pourquoi il est urgent d’imaginer ce que serait une société dont les institutions (police, préfectures, administrations, prisons, hôpitaux, écoles, etc.) seraient exemplairement non-humiliantes. Dans l’état actuel de nos économies, il faudra un énorme effort pour obtenir une société plus juste, mais pourquoi ne pas essayer de mettre en œuvre une société moins humiliante ? C’est possible et urgent, faisons-le.",979-1020909770,https://m.media-amazon.com/images/I/51Xg9iRRofL._SY522_.jpg,Les Liens qui Libèrent (16 février 2022),Olivier Abel
Habiter le monde - Essai de politique relationnelle,19.58,"Habiter le monde, c'est se concevoir comme appartenant à un espace plus large que son groupe ethnique, sa nation... c'est pleinement habiter les histoires et les richesses des cultures plurielles de l'humanité. Repenser notre présence au monde est le défi de notre époque. Cet essai de politique relationnelle invite à renouveler les imaginaires de la relation que nous établissons avec nos semblables et le vivant. L'auteur y appelle à une réinvention du politique et du langage afin d'habiter l'infini du monde.",978-2897125196,https://m.media-amazon.com/images/I/51VRgmQX+hL._SY522_.jpg,MEMOIRE ENCRIER (12 février 2018),Felwine Sarr
La haine de la démocratie,13.0,"Nous vivons aujourd'hui dans des pays qui se baptisent « démocraties ». Le discours officiel chantait naguère les vertus de ce système, opposé à l'horreur totalitaire. Ce discours n'a plus cours aujourd'hui, même s'il arrive que des armées soient envoyées promouvoir la démocratie autour du monde. En France en particulier, un parti intellectuel auquel sa place dans les médias donne un pouvoir inconnu ailleurs n'en finit pas de dénoncer les méfaits de l'« individualisme démocratique » qui mine les bases de la vie civique en détruisant les valeurs collectives et les liens sociaux, et les ravages de l'« égalitarisme » qui mène droit vers un nouveau totalitarisme. D'autres découvrent dans la démocratie des penchants criminels, trouvant son origine dans la Terreur et son accomplissement dans l'extermination du peuple juif. Ces critiques contradictoires mais convergentes ont une cause commune : le caractère profondément scandaleux du « pouvoir du peuple ». La démocratie, gouvernement de tous, est le principe qui délégitime toute forme de pouvoir fondée sur les « qualités » propres de ceux qui gouvernent. Fondée sur l'égalité de n'importe qui avec n'importe qui, la démocratie n'est ni une forme de gouvernement qui permet à une oligarchie politico-financière guidée par ses experts de régner au nom du peuple, ni cette forme de société que règle le pouvoir de la marchandise. Elle n'est portée par aucune nécessité historique et n'en porte aucune. La chose a de quoi susciter de la peur, donc de la haine, chez ceux qui sont habitués à exercer le magistère de la pensée. Dans ce livre, Jacques Rancière décrit les liens complexes entre démocratie, politique, république et représentation et aide à retrouver, derrière les tièdes amours d'hier et les déchaînements haineux d'aujourd'hui, la puissance toujours neuve et subversive de l'idée démocratique.",978-2913372481,https://m.media-amazon.com/images/I/61Ib2dN-0+L._SY522_.jpg,La Fabrique éditions; 1er édition (22 septembre 2005),Jacques Rancière
Bureaucratie,6.55,Après le succès de “Dette : 5000 ans d’histoire” – vendu à près de 25 000 exemplaires – David Graeber revient avec un texte passionnant sur l’invasion de la bureaucratie dans notre quotidien qu'il voit comme un efficace bras armé du capitalisme financier.,978-2330076146,https://m.media-amazon.com/images/I/81Xa2g065IL._SY522_.jpg,Babel (5 avril 2017),David Graeber
