Nom,Prix,Description,Isbn,Photo,Editeur,Auteur,Categorie
"La méditation du guerrier: Le secret le mieux gardé du développement personnel, du perfectionnement cognitif et de la lutte contre le stress, enseigné par un maître dans quatre arts samouraïs",5.62,"Découvrez la forme de méditation originale, instinctive et non religieuse qui s’est perdue au fil du temps. Richard L. Haight, auteur primé de The Unbound Soul et maître de quatre arts martiaux samouraïs, partage le secret le mieux gardé au monde dans les domaines du développement personnel, du perfectionnement cognitif et du soulagement du stress, qu’il appelle la méditation du guerrier.
Pour tous les milieux, genres et âges.
Pour vous faire une représentation mentale de la méditation du guerrier, imaginez un champ de bataille sur lequel se trouve un seul samouraï entouré de multiples adversaires. L’attention d’un débutant passerait sans arrêt d’un adversaire à l’autre dans une tentative anxieuse de se défendre. Une telle stratégie fatigue rapidement le guerrier, qui sera vaincu. Un guerrier expérimenté repartira son attention de manière égale dans toutes les directions, mais il éprouvera quand même de l’anxiété pendant qu’il prépare mentalement ses tactiques. Ses pensées et son anxiété peuvent être sa perte si ses adversaires sont très habiles. L’attention d’un maître, comme celle de l’expert est répartie de manière égale, mais il demeure calme, il ne possède pas de plan d’action, son corps effectue les actions adéquates selon les besoins du moment.",978-1532333927,https://m.media-amazon.com/images/I/71dI5vYQX3L._SY522_.jpg,Independently Published (12 février 2020),Richard L Haight,Holistique
N’attendez pas de tomber (vraiment) malade !: Tous les conseils du Dr Yoni Assouly (@dr_yoni_assouly) pour rester naturellement en bonne santé,19.9,"Découvrez les lois naturelles de votre santé !
« Au début de ma carrière de médecin, j’ai constaté que les médicaments soulageaient les patients à court terme… mais que leurs problèmes de santé finissaient par réapparaître aussitôt le traitement terminé. »
Pourquoi ? Parce que la médecine moderne ne s’attaque souvent qu’aux symptômes, pas aux causes de la maladie.
Dans ce livre, le docteur Yoni Assouly révèle les lois naturelles de votre santé, pour prévenir et soigner :
les troubles digestifs,
le surpoids,
les troubles du sommeil,
la fatigue,",978-2807359604,https://m.media-amazon.com/images/I/71u9r21mkAL._SY522_.jpg,DE BOECK SUP; 1er édition (24 avril 2024),Yoni Assouly,Holistique
Stimuler la circulation de la lymphe: La guérison et le renforcement grâce à l’autotraitement holistique,10.26,"Le système lymphatique - la station d’épuration de notre corps
En tant que service de ramassage des déchets de l’organisme, le système lymphatique détruit les substances nocives et inutiles telles que les agents pathogènes, les déchets métaboliques, les toxines et les débris cellulaires.
Le système lymphatique est donc une partie très importante de la
défense immunitaire et de la désintoxication du corps.

La lymphe doit rester dans le flux
Le système lymphatique doit être nettoyé et détoxifié régulièrement pour rester dans son flux naturel. Cependant, si le système lymphatique est continuellement surchargé par trop de déchets, le flux s’arrête. La lymphe ne circule plus que très lentement et difficilement, jusqu’à ce qu’une congestion lymphatique finisse par s’installer. Par conséquent, toutes les substances problématiques ne peuvent plus être éliminées, ce qui peut entraîner le développement de nombreuses maladies chroniques.",979-8393631260,https://m.media-amazon.com/images/I/61a9JuwdKBL._SY522_.jpg,Independently published (5 mai 2023),Dr. Angela Fetzner,Holistique
Les Remèdes Naturels qu&#39ILS ne veulent pas que vous connaissiez,19.62,"Version Kindle ici : https://amzn.to/3GuJzGh
Site officiel : https://les-remedes-naturels.fr/

Ce livre est la traduction du célèbre livre «Natural Cures ""THEY"" don&#39t want you want you to know about», N°1 des Meilleures Ventes au New York Times (pendant 26 semaines d&#39affilée), qui s&#39est vendu à plus de 26 Millions d&#39exemplaires dans le monde et qui lève le voile sur Les Remèdes Naturels qu&#39«ILS» ne Veulent Pas que Vous Connaissiez.
Kevin Trudeau est un homme d&#39affaires américain, auteur à succès et défenseur des droits à la liberté d&#39expression. Il a décidé de quitter le milieu des initiés pour lever le rideau sur la vérité...

Êtes-vous conscient que l&#39écrasante majorité de ce que vous mangez chaque jour vous empoisonne? Saviez-vous que la profession médicale, en partenariat avec l&#39industrie pharmaceutique, a un énorme intérêt à vous garder malade plutôt qu&#39en bonne santé? Vous rendez-vous compte que le Gouvernement Fédéral fait tout ce qui est en son pouvoir pour garder tout cela secret?",979-8372085602,https://m.media-amazon.com/images/I/71RJoSnWhSL._SY522_.jpg,Independently published (15 décembre 2020),Kevin Trudeau,Holistique
L&#39art de l&#39intention: Optimiser votre pratique Reiki,13.93,"Avec ce guide essentiel, explorez le pouvoir de l’intention dans la pratique du Reiki. Ce livre regorge de milliers d’intentions pour plus de 150 sujets, offrant une boîte à outils complète pour optimiser votre pratique Reiki. Découvrez comment affiner vos intentions peut transformer radicalement votre approche de la guérison énergétique, vous permettant d’élever, d’harmoniser et d’enrichir chaque séance. Plongez dans cette exploration de la guérison holistique et laissez-vous inspirer par les possibilités infinies de l’intention.",978-1304374837,https://m.media-amazon.com/images/I/71eL5ElYsRL._SY522_.jpg,Lulu Press (15 mai 2024),Isabel S Churchill,Holistique
La Guérison des 5 blessures,18.65,"Voici la suite tant attendue des 5 blessures qui empêchent d&#39être soi-même, le livre best-seller de Lise Bourbeau.
Voici la suite tant attendue du best-seller de Lise Bourbeau, Les 5 blessures qui empêchent d&#39être soi-même.

De quels moyens concrets dispose-t-on pour guérir nos souffrances ? Comment apprendre à reconnaître nos blessures et mieux appréhender quand celles-ci se réveillent ?
En appliquant les conseils de Lise Bourbeau, vous prendrez conscience des innombrables occasions où l&#39ego dirige nos pensées, nos paroles et nos actes. Cette prise de conscience est non seulement une condition indispensable à la guérison, mais saura également vous aider à manifester les besoins essentiels de votre âme pour trouver la paix intérieure.

Lise BOURBEAU, auteur de nombreux best-sellers traduits dans le monde entier, est la fondatrice des éditions E.T.C. – Écoute Ton Corps –, devenues la plus grande école du développement personnel au Québec.

Tous les succès de Lise BOURBEAU sont chez Pocket",978-2266319157,https://m.media-amazon.com/images/I/61U5BbgKwWL._SY522_.jpg,Pocket (2 septembre 2021),Lise Bourbeau,Holistique
L&#39empreinte de naissance,16.02,"Ce livre met en évidence un cycle biologique cellulaire unique. C&#39est d&#39abord une relecture de la biologie totale issue des travaux de Claude Sabbah avec les principes de base de la bioanalogie. Cette relecture du sens biologique de la maladie au travers des notions d&#39espace et de temps ouvre un regard nouveau sur nos programmes de naissance, révélant ainsi une «Empreinte de naissance». Schémas N&B.",978-2913281332,https://m.media-amazon.com/images/I/61W2boLny5L._SY522_.jpg,QUINTESSENCE (4 mars 2004),Jean-Philippe Brébion,Holistique
"COURS DE PRATICIEN EN AYURVEDA, L&#39INTEGRALE: Anatomie et Physiologie Ayurvédiques. Le Diagnostic Ayurvédique. Les Principales Méthodes du Traitement Ayurvédique.",39.04,"Recommandé par plusieurs écoles d&#39Ayurvéda francophones, cet ouvrage livre d&#39une manière claire et détaillée bien plus que les fondements de la médecine traditionnelle indienne, médecine holistique et naturelle par essence. 🌿

Ce livre est organisé en Modules divisés eux-mêmes en chapitres.

🦴 Dans le 1er Module, vous découvrirez tout d&#39abord comment fonctionne le corps humain selon l&#39Ayurvéda. Les termes et les concepts de Doshas, sous-Doshas, Dhatus, Srotas, Malas, Agni, Ama... n&#39auront plus de secrets pour vous.

🩺 Ensuite, dans le 2ème Module,",978-1794351424,https://m.media-amazon.com/images/I/61bTutbBeRL._SY522_.jpg,Independently published (18 janvier 2019),Stéphane LE COLAS,Holistique
LaHoChi de la Treizième Octave. La Puissance des Archanges: Dela découverte à la Maîtrise,18.67,"Evolution stupéfiante du LaHoChi, le LaHoChi de la 13ème Octave vous place en résonance avec les plus hautes fréquences énergétiques disponibles actuellement.
Plongez dans un océan de sensations bienfaisantes et de découvertes vibrantes grâce à cette technique ultime de séances énergétiques. Que vous soyez novice ou initié, ce livre vous enseignera des méthodes simples et puissantes pour revitaliser votre corps, équilibrer votre esprit et nourrir votre âme., Le LaHoChi de la Treizième Octave, canalisé à l&#39origine par Linda Dillon va vous aider à renforcer votre conscience, à vous libérer du stress et à réveiller votre potentiel créatif et votre spiritualité. Que vous souhaitiez trouver un soulagement des tensions quotidiennes, arriver à des états de relaxation régénératrices, explorer de nouvelles dimensions de conscience, ce livre est votre passeport vers un bien-être global.",979-8850860301,https://m.media-amazon.com/images/I/71ALoZaX93L._SY522_.jpg,Independently published (3 juillet 2023),Eric Riquet,Holistique
DÉPENDANCE AFFECTIVE : La Méthode RLD pour une Guérison en Profondeur: Livre Dépendance Affective | Sortir de la Dépendance Affective | Vaincre la ... | Dépendance Affective et Relations Toxiques,7.1,"DÉPENDANCE AFFECTIVE : LA MÉTHODE RLD POUR UNE GUÉRISON EN PROFONDEUR ❤️

1️⃣ En avez-vous assez d&#39être dans des relations malsaines ?
2️⃣ Voulez-vous apprendre à être heureux tout seul ?
3️⃣ Êtes-vous prêt à prendre le contrôle de votre propre bonheur ?

Et si le moyen le plus efficace de se détacher de la dépendance affective était TOUT SIMPLEMENT de l&#39éviter ?

Oubliez les approches habituelles pour traiter de la dépendance affective, dans ce livre je vous dévoile une méthode différente (la ""méthode RLD"") reposant sur 3 étapes axées sur",979-8392685882,https://m.media-amazon.com/images/I/61XuKi14wOL._SY522_.jpg,Independently published (17 mai 2023),Marie Russo,Holistique
"La méditation du guerrier: Le secret le mieux gardé du développement personnel, du perfectionnement cognitif et de la lutte contre le stress, enseigné par un maître dans quatre arts samouraïs",15.33,"Découvrez la forme de méditation originale, instinctive et non religieuse qui s’est perdue au fil du temps. Richard L. Haight, auteur primé de The Unbound Soul et maître de quatre arts martiaux samouraïs, partage le secret le mieux gardé au monde dans les domaines du développement personnel, du perfectionnement cognitif et du soulagement du stress, qu’il appelle la méditation du guerrier.
Pour tous les milieux, genres et âges.
Pour vous faire une représentation mentale de la méditation du guerrier, imaginez un champ de bataille sur lequel se trouve un seul samouraï entouré de multiples adversaires. L’attention d’un débutant passerait sans arrêt d’un adversaire à l’autre dans une tentative anxieuse de se défendre. Une telle stratégie fatigue rapidement le guerrier, qui sera vaincu. Un guerrier expérimenté repartira son attention de manière égale dans toutes les directions, mais il éprouvera quand même de l’anxiété pendant qu’il prépare mentalement ses tactiques. Ses pensées et son anxiété peuvent être sa perte si ses adversaires sont très habiles. L’attention d’un maître, comme celle de l’expert est répartie de manière égale, mais il demeure calme, il ne possède pas de plan d’action, son corps effectue les actions adéquates selon les besoins du moment.",978-1532333927,https://m.media-amazon.com/images/I/71dI5vYQX3L._SY522_.jpg,Independently Published (12 février 2020),Richard L Haight,Holistique
"Dis-moi quand tu as mal, je te dirai pourquoi: Mythologies corporelles et cycles de vie",20.9,"Dans Dis-moi où tu as mal, je te dirai pourquoi, Michel Odoul a posé les bases d&#39une lecture de la maladie et du sens qui peut lui être associé. Devenu un best seller et un long seller (vingt ans déjà !), ce livre est toujours d&#39actualité et « parle » incroyablement au lecteur.
Michel Odoul nous propose ici un deuxième champ d&#39interrogation : celui du temps et des cycles. Pourquoi cet accident a-t-il eu lieu à 12 ans, cette maladie grave à 21 ou 28 ans, cet infarctus à 42 ans, cet AVC à 63 ans ? La question reste celle du sens et du pourquoi mais elle s&#39enrichit avec celle du moment : pourquoi cela m&#39arrive t-il maintenant, à ce moment-là de ma vie ?
En faisant référence aux grands cycles temporels décrits par la Médecine Traditionnelle Chinoise, la science occidentale et la mythologie, Michel Odoul propose une autre façon, non hasardeuse, fataliste ou déterminante, d&#39appréhender notre rapport au temps. Y a-t-il des cycles qui s&#39imposent à nous comme autant d&#39examens de passage sur le chemin de la vie ? De la réponse à cette question, émergera pour le lecteur une nouvelle conscience de ce qu&#39il est et de ce qu&#39il vit.",978-2226245748,https://m.media-amazon.com/images/I/71a20rSyXtL._SY522_.jpg,Albin Michel (29 mai 2013),Michel Odoul,Holistique
"Guérir Son Corps, Soigner Son Esprit: ALIMENTATION, NUTRITION, HERBES, MÉDECINE NATURELLE ET PENSÉES POSITIVES POUR L&#39INTESTIN IRRITABLE, DÉTOX DU FOIE, HORMONES, ACNÉ, ANXIÉTÉ, DÉPRESSION ET STRESS",16.4,"Élu l’un des 43 meilleurs thérapeutes du monde, auteur de 5 best-sellers, naturopathe et psychothérapeute, le Dr Ameet vous aide à régler facilement vos problèmes de santé concernant vos intestins, votre foie, vos glandes surrénales, votre dépression, votre anxiété, votre humeur, votre poids, votre peau, vos hormones, vos inflammations ainsi que vos problèmes sexuels à l’aide de votre nutrition, d’une alimentation saine, d’une médecine naturelle, de thérapie holistiques et d’une guérison émotionnelle.
Votre santé est l’un des cadeaux les plus précieux que l’on puisse vous faire. Ce livre au pouvoir holistique intense vous permettra d’améliorer rapidement votre santé, votre bonheur et votre humeur en vous aidant à traiter l’origine des maladies de votre esprit et votre corps, lesquelles sont liées à :",979-8644439393,https://m.media-amazon.com/images/I/71JeSHlGXDL._SY522_.jpg,Independently published (9 mai 2020),Dr. Ameet Aggarwal ND,Holistique
"La maladie cherche à me guérir, tome 1",23.0,"Par la maladie, nous nous parlons à nous-même, nous prenons notre corps à témoin, et la douleur, la lésion, sont l’exact reflet des émotions que nous ressentons. Nous souffrons sans savoir pourquoi, comme s’il nous manquait les clés. Ce livre nous donne les clés personnelles de nos maux qui contiennent les germes de notre propre guérison.",978-2913826014,https://m.media-amazon.com/images/I/718NrNTCN-L._SY522_.jpg,Le Mercure Dauphinois (1 novembre 1999),Docteur Philippe Dransart,Holistique
"Magnétisme en BD apprenez les secrets de l&#39énergie avec Anaïs, Ingrid et Jean: Une formation ludique et complète pour découvrir et maîtriser les techniques du magnétisme traditionnel et énergétique",6.77,"Vous rêvez de devenir magnétiseur ou de perfectionner vos compétences ? Suivez les aventures d&#39Anaïs, une jeune femme curieuse qui décide de s&#39initier au magnétisme avec l&#39aide de son amie Ingrid et de Jean, un formateur expérimenté. À travers des planches illustrées et des dialogues pédagogiques, vous apprendrez les bases du magnétisme, les principes de l&#39énergie, les gestes et les protocoles à respecter, ainsi que des techniques avancées pour soulager les maux du corps et de l&#39esprit. Cette bande dessinée est une méthode originale et efficace pour s&#39initier ou se perfectionner au magnétisme, quel que soit votre niveau.",979-8860982765,https://m.media-amazon.com/images/I/6157HWLIDCL._SY522_.jpg,Independently published (10 septembre 2023),M Jean Fidèle Angius,Holistique
Dis-moi pourquoi cela m&#39arrive maintenant: Les 12 étapes herculéennes de la croissance,15.9,"Les 12 travaux d&#39Hercule. Un parcours initiatique universel.

Cet ouvrage répond à la question du sens des expériences de la vie. Il établit un lien entre l&#39âge de la personne et les difficultés qu&#39elle rencontre dans une période donnée ou de façon répétitive et cyclique.

Pour cela, Michel Odoul nous propose une relecture du mythe fondateur d&#39Hercule et de ses 12 travaux, partant du constat que les épreuves de « ce héros qui se cache en nous » sont très proches de nos quotidiens et qu&#39elles illustrent de façon métaphorique l&#39évolution de chacun pour passer de l&#39enfant « brut et pulsionnel » à l&#39adulte « apaisé et droit ». Un cheminement vers soi qui conduit à l&#39épanouissement de l&#39être, tant physique que psychique.

Il s&#39agit de comprendre pourquoi telle maladie ou tel accident a eu lieu à telle période de notre vie, que ce soit à un âge précis ou à un mois précis de l&#39année.
Ce livre nous aide à comprendre sur quel domaine de notre vie nous bloquons ou échouons ou quelle est « l&#39épreuve » que nous n&#39arrivons pas à résoudre... Et sur quel thème nous devons donc travailler.

Un éclairage nouveau, une approche originale. Et un livre facile d&#39accès.",978-2226322210,https://m.media-amazon.com/images/I/81mV4LMu5vL._SY522_.jpg,Albin Michel (4 mai 2016),Michel Odoul,Holistique
"La méditation du guerrier: Le secret le mieux gardé du développement personnel, du perfectionnement cognitif et de la lutte contre le stress, enseigné par un maître dans quatre arts samouraïs",5.16,"Découvrez la forme de méditation originale, instinctive et non religieuse qui s’est perdue au fil du temps. Richard L. Haight, auteur primé de The Unbound Soul et maître de quatre arts martiaux samouraïs, partage le secret le mieux gardé au monde dans les domaines du développement personnel, du perfectionnement cognitif et du soulagement du stress, qu’il appelle la méditation du guerrier.
Pour tous les milieux, genres et âges.
Pour vous faire une représentation mentale de la méditation du guerrier, imaginez un champ de bataille sur lequel se trouve un seul samouraï entouré de multiples adversaires. L’attention d’un débutant passerait sans arrêt d’un adversaire à l’autre dans une tentative anxieuse de se défendre. Une telle stratégie fatigue rapidement le guerrier, qui sera vaincu. Un guerrier expérimenté repartira son attention de manière égale dans toutes les directions, mais il éprouvera quand même de l’anxiété pendant qu’il prépare mentalement ses tactiques. Ses pensées et son anxiété peuvent être sa perte si ses adversaires sont très habiles. L’attention d’un maître, comme celle de l’expert est répartie de manière égale, mais il demeure calme, il ne possède pas de plan d’action, son corps effectue les actions adéquates selon les besoins du moment.",978-1532333927,https://m.media-amazon.com/images/I/71dI5vYQX3L._SY522_.jpg,Independently Published (12 février 2020),Richard L Haight,Holistique
"LÂCHER PRISE - 31 Techniques Express: Se libérer en un clin d&#39œil - Rituels rapides pour trouver la paix intérieure n&#39importe où, n&#39importe quand",10.79,"Vous vous sentez souvent submergé par le stress et l&#39anxiété de la vie quotidienne ?
Vous luttez pour trouver des moments de calme et de sérénité ?
Vous avez du mal à lâcher prise et à profiter pleinement de l&#39instant présent ?

Découvrez ""LÂCHER PRISE 31 Techniques Express"", votre guide essentiel pour transformer votre vie en un havre de paix et de tranquillité. Ce livre révolutionnaire, spécialement conçu pour ceux qui cherchent à se libérer des chaînes du stress et de l&#39anxiété, offre des méthodes pratiques et efficaces pour atteindre un état de lâcher prise rapide et durable.",979-8876634047,https://m.media-amazon.com/images/I/71sFxsAvbnL._SY522_.jpg,Independently published (18 janvier 2024),Etienne Drouard,Holistique
,15.32,,,,,,Holistique
Origines et prévention des maladies : l&#39analyse psychosomatique et le décodage biologique,24.9,"Excellent ouvrage de médecine psychosomatique destiné au grand public. Il met en évidence que la maladie serait un transposé exact, au niveau du corps, d’un conflit psychologique conscient ou non. La psychogénéalogie étudie les rapports possibles entre l’état physique et mental d’aujourd’hui et l’histoire familiale de clan.",978-2913281165,https://m.media-amazon.com/images/I/61I-7ICvQ2L._SY522_.jpg,Quintessence (21 septembre 2008),Salomon Sellam,Holistique
Dis-moi où tu as mal : Le Lexique : Plus de 300 pathologies ou traumatismes décodés,18.8,"« Pour la médecine orientale, la maladie témoigne d&#39un obstacle à la réalisation du Chemin de Vie. La conscience exprime ainsi par des troubles énergétiques générateurs de maladies, les entraves à son plein épanouissement. »

Michel Odoul nous propose, dans la continuité de Dis-moi où tu as mal, je te dirai pourquoi, ce Lexique, véritable dictionnaire de plus de 300 maladies et traumatismes. Près de 20 ans d&#39expérience, plusieurs milliers de stagiaires et plus de 8 000 consultations individuelles lui ont permis d&#39établir et de vérifier la nature des liens existant entre le corps et l&#39esprit. La maladie ou les accidents ne sont alors plus des fatalités. Chacun peut redevenir « l&#39acteur » de sa vie et s&#39approprier à nouveau le pouvoir de changer, s&#39il le veut, ce qui est à l&#39origine de sa souffrance.
Ce livre est destiné à tous ceux qui veulent en savoir plus. Son écriture simple le rend accessible à tous et en fait un ouvrage de référence pour ceux qui cherchent un sens à leurs souffrances. Par la qualité de ses informations il représente aussi un excellent outil de travail pour tous les praticiens de santé (acupuncteurs, praticiens Shiatsu, psychothérapeutes, ostéopathes, médecins, personnel soignant, etc.).",978-2226133243,https://m.media-amazon.com/images/I/71TxmZWaH6L._SY522_.jpg,Albin Michel (8 janvier 2003),Michel Odoul,Holistique
Écoute ton corps: Ton plus grand ami sur la Terre,19.25,"Parce que tout ce qui se passe dans notre corps est un reflet de notre esprit, Lise Bourbeau nous invite à nous réconcilier avec nous-mêmes sur les plans physique, émotionnel, mental ou spirituel, et à être davantage conscients de ce qui se passe en nous.À travers les enseignements contenus dans ce livre et les nombreux exercices proposés, elle nous aide à atteindre ce à quoi nous aspirons tous : la joie, la paix, la sérénité, la santé, la réalisation de nos rêves et de nos aspirations.Cette méthode simple et concrète permettra à chacun de s&#39accepter et de vivre en paix avec lui-même et, surtout, de s&#39aimer et de mieux aimer les autres. Puisque l&#39on récolte toujours ce que l&#39on sème, en aimant, nous récolterons l&#39amour !Car, en somme, n&#39est-ce pas ce que nous recherchons tous ?",978-2290223178,https://m.media-amazon.com/images/I/61-JfDraJvL._SY522_.jpg,J&#39ai lu (10 juin 2020),Lise Bourbeau,Holistique
"La maladie cherche à me guérir, tome 2",11.74,Philippe Dransart consacre ce deuxième tome à nous faire réfléchir sur le pourquoi de la souffrance et comment mieux la comprendre afin de s&#39en libérer. Notre vie est-t&#39elle la répétition d&#39une douloureuse mémoire ou le rythme d&#39un désir caché qui n&#39a de cesse de nous en libérer ? Broché 14 x 22 - 238 pages,978-2913826182,https://m.media-amazon.com/images/I/41ud22OeiAL._SY522_.jpg,Le Mercure Dauphinois (27 février 1998),Docteur Philippe Dransart,Holistique
Lithothérapie pour les animaux,11.34,"Découvrez comment le pouvoir de guérison des minéraux est utilisé pour aider à améliorer le bien-être et le bonheur de vos animaux.

La pratique de la lithothérapie nous permet de jouer un rôle actif dans la santé de nos compagnons et d’approfondir le lien si particulier qui nous lie à eux pour mieux les comprendre.

Que vous soyez amoureux des animaux, lithothérapeute ou simplement curieux de cette connexion profonde entre les mondes minéral et animal, Lithothérapie pour les animaux vous offre une ressource riche et passionnante pour élargir vos connaissances et offrir à vos compagnons le meilleur de la nature.",979-8856484983,https://m.media-amazon.com/images/I/61W5FMGgrML._SY522_.jpg,Independently published (8 août 2023),Stabby Lo Editions Collection Animalis,Holistique
