Nom,Prix,Description,Isbn,Photo,Editeur,Auteur,Categorie
Anatomy of Voice: How to Enhance and Project Your Best Voice,6.85,"An illustrated guide to the dynamic physiological structures that create and individualize the voice

• Explores the structures of the vocal tract and their functional relationships to the entire musculoskeletal system with detailed drawings

• Examines the components of the larynx and pharynx, the effects of muscular tensions on the vocal cords, the importance of skeletal alignment, and the complex roles of the diaphragm, soft palate, lips, and tongue in vocalization

• Provides exercises and techniques for increased air flow, correct posture, proper tongue position, jaw relaxation, and toning of the soft palate to improve the voice

When we use the voice, we involve the entire body. Our internal balance, muscular tone, skeletal alignments, soft tissue flexibility, and even our eye movements are reflected in the voice we project to our audience, whether one person or thousands.

Using the signature anatomical style of Blandine Calais-Germain’s groundbreaking book",978-1620554197,https://m.media-amazon.com/images/I/71tcmEnrfhL._SY522_.jpg,Healing Arts Press; Reprint édition (1 janvier 2016),Blandine Calais-Germain,Holistique
Écoute ton corps: L&#39argent et l&#39abondance,11.52,"Après son best-seller Écoute ton corps, qui a permis à des millions de personnes d&#39améliorer leur qualité de vie, Lise Bourbeau, pionnière du développement personnel, a donné des conférences, animé des ateliers dans le monde entier, et elle a reçu de nombreux courriers de lecteurs. Dans ce nouvel opus, elle répond à toutes les questions que vous pouvez vous poser au sujet de l&#39argent et de l&#39abondance dans votre vie. D&#39où vient la peur de manquer d&#39argent ? - Comment éviter le surendettement et la faillite ? - Qu&#39est-ce qui empêche l&#39abondance ? - Est-ce qu&#39il vaut mieux être dispendieux ou proche de ses sous ? - Comment ne plus manquer d&#39argent à chaque fin de mois ? - Pourquoi est-ce que mes amis me demandent toujours de l&#39argent ?",978-2290223222,https://m.media-amazon.com/images/I/51pmwTAS0nL._SY522_.jpg,J&#39AI LU (20 avril 2022),Lise Bourbeau,Holistique
"La suite... Racines familales de la ""mal a dit""",22.0,"C&#39est au cours de mon second voyage initiatique dans la cellule, que j&#39ai poursuivi mon enseignement de psychobiologie auprès de Joseph. Cette fois, il a dépassé le monde biologique et m&#39a tendu la main, pour me guider dans une plus vaste dimension. Il nous démontre l&#39universalité du langage et des « maux », afin de nous libérer - aux mots près - des blocages qui font taire tout notre être. Il nous aide à reprendre le dialogue avec la cellule afin de libérer le potentiel énergétique du Tout. « Une fois la biologie et l&#39histoire généalogique assumée, il faut pénétrer dans la cellule porteuse des mémoires de l&#39humanité. » La guérison commence lorsqu&#39on accepte ce qui est, et non ce qui n&#39est pas. Et on sait que l&#39on a accepté ce qui est, quand on ne sent plus aucune souffrance intérieure. On s&#39épuise à écouter le reste du monde en oubliant de se taire pour s&#39écouter et se rencontrer.",978-2951846319,https://m.media-amazon.com/images/I/61PZLQAxtzL._SY522_.jpg,PICTORUS (31 décembre 2002),Gérard Athias,Holistique
La détox holistique: Au-delà de l&#39alimentation une détox sur nos 7 plans d&#39existence,19.65,"Poisons, xénobiotiques, polluants invisibles, nous sommes aujourd&#39hui confrontés à mille et une nouvelles surcharges, encore ignorées il y a peu. Et si une lecture globale de l&#39humain pouvait répondre aux troubles liés à ces innombrables pollutions sur les plans physique, énergétique, émotionnel, mental, socioculturel, environnemental et spirituel ? br/ br/ Chacun de ces sept plans est intimement lié aux autres et possède sa propre physiologie, ses carences, ses surcharges et ses émonctoires spécifiques. Si, sur le plan physique, la cure de détox traditionnelle n&#39est aujourd&#39hui plus à démontrer, Daniel Kieffer prouve ici qu&#39il est possible de calquer la stratégie de détox du plan physique sur tous les autres plans. br/ br/ Un livre à la fois pédagogique, concis et pratique, pour vous aider à faire bon usage, au quotidien, des solutions naturopathiques et procéder à une véritable détox holistique ! br/ br/",978-2889532018,https://m.media-amazon.com/images/I/81IyhidOdpL._SY522_.jpg,JOUVENCE (12 juin 2019),Daniel Kieffer,Holistique
Herbal Antibiotics: What BIG Pharma Doesn’t Want You to Know - How to Pick and Use the 45 Most Powerful Herbal Antibiotics for Overcoming Any Ailment,15.73,"Boost Your Immune System with Nature’s Bounty!
Herbal antibiotics have been used throughout the centuries as natural treatments for hundreds of diseases and ailments, including wisdom teeth extraction, broken bones and even surgery—and like 98% of Americans, you’ve probably taken a course of synthetic antibiotics to help you recover.
While there’s nothing wrong with synthetic antibiotics, BIG Pharma’s running scared of the natural alternative to their expensive drugs (and profits)—while you can utilize natural remedies that leave less impact on the environment and your internal body chemistry.",978-1545334904,https://m.media-amazon.com/images/I/61Qtymjt5yL._SY522_.jpg,CreateSpace Independent Publishing Platform (12 avril 2017),Mary Jones,Holistique
Actualités de la médecine fonctionnelle,16.16,"Après une ‘Introduction à la Médecine Fonctionnelle’ publiée en 2014, le besoin s’est fait pressant de publier cette suite intitulée ‘Les Actualités de la Médecine Fonctionnelle’. L’auteur qui nous avait déjà présenté son approche novatrice d’une médecine naturelle et holistique s’implique à nouveau, mais cette fois plutôt pour la défendre contre les attaques injustifiées de régulateurs, lesquels semblent bien plus motivés par la défense du paradigme ‘tout médicament’ que par la santé des patients… Pourquoi donc n’acceptent-ils pas que « prévenir vaut mieux que guérir » ? Dès 2017, l’auteur fut de plus en plus souvent positivement impressionné par la prolifération d’articles scientifiques de grande qualité, publiés par des revues médicales prestigieuses et revus par des pairs (peer-reviewed), fournissant une apologie de nombreux principes fondamentaux de la Médecine Fonctionnelle. Ces éloges qui émanent de médecins, biologistes et chercheurs du monde entier sont précisément ceux qui suscitaient des controverses depuis une éternité, et qui font encore l’objet d’anathèmes cinglants éructés par certains spécialistes. Dysbiose intestinale, hyperperméabilité muqueuse, rôle omniprésent de l’alimentation dans de multiples pathologies dégénératives et dans les affections cutanées, axe intestins-cerveau : à votre santé, bonnes gens !",978-2874341786,https://m.media-amazon.com/images/I/61SVOlfKBEL._SY522_.jpg,M PIETTEUR (9 novembre 2020),Georges Mouton,Holistique
GÉRER SON STRESS : Retrouvez l&#39Équilibre grâce à la Méthode OGS: Lutter contre le Stress | Stress Anxiété Angoisse | Gestion du stress,6.34,"GÉRER SON STRESS : Retrouvez l&#39Équilibre grâce à la Méthode OGS
1️⃣ Vous sentez-vous souvent submergé par le stress au quotidien ?
2️⃣ Êtes-vous à la recherche d&#39un guide efficace pour vous aider à surmonter le stress dans votre vie ?
3️⃣ Êtes-vous prêt à prendre en main votre bien-être émotionnel ?
Et si la Méthode OGS vous offrait une façon d&#39appréhender durablement le stress et de mieux le gérer ?
Fini les journées épuisantes et les nuits agitées ! Dans ce livre percutant, je vous présente une approche novatrice, la ""Méthode OGS"", qui repose sur 3 étapes essentielles basées sur la compréhension émotionnelle et la sérénité intérieure, pour enfin mettre le stress derrière",979-8860528642,https://m.media-amazon.com/images/I/61mXMalkLCL._SY522_.jpg,Independently published (8 septembre 2023),Marie Russo,Holistique
LES SECRETS DE LA SONOTHERAPIE: Un guide du son vers le bien-être,15.77,"Découvrez l&#39univers fascinant de la sonothérapie avec ce livre exhaustif et accessible. Couvrant l&#39histoire et les principes fondamentaux de la sonothérapie, ce guide vous offre une explication approfondie de cette pratique ancienne, dévoilant comment et pourquoi elle influence positivement notre bien-être.
Le livre met en lumière les bienfaits concrets de la sonothérapie, allant de la réduction du stress à l&#39amélioration du sommeil, en passant par son impact sur notre santé physique et mentale. Il explore également une gamme étendue d&#39instruments spécifiques utilisés en sonothérapie, comme les bols tibétains, les flûtes amérindiennes, et les diapasons thérapeutiques, détaillant leur rôle unique dans la création d&#39harmonies thérapeutiques.",978-2959035906,https://m.media-amazon.com/images/I/619OW7DXdcL._SY522_.jpg,,Mr Jean-Marc LE PREGASSIN,Holistique
"Vos sept centres d&#39énergie : Une approche holistique de la santé physique, émotionnelle et spirituelle",6.77,"Ce livre peut nous aider à développer l&#39intégralité de notre être en proposant des outils profonds et puissants qui se fondent sur le système énergétique du corps. Il puise à la sagesse des traditions spirituelles du monde pour nous montrer à nourrir notre âme tout au long de sept étapes de la croissance personnelle. On y trouvera également un aperçu de certaines techniques holistiques qui permettent de maintenir ou à retrouver l&#39équilibre énergétique du corps, qu&#39il s&#39agisse d&#39homéopathie, de vitamino-thérapie ou encore de méditation ou de visualisation par exemple.",978-2922136166,https://m.media-amazon.com/images/I/51GN1D7V0VL.jpg,Lumière d&#39El Morya (20 avril 2006),Elizabeth Clare Prophet,Holistique
"Harmonie chez Soi, Vitalité en Soi: La santé par le Feng Shui : le guide pratique pour activer les super-pouvoirs de votre maison !",6.18,"Problèmes de sommeil, stress, manque d&#39énergie... Ces problématiques font-elles partie de votre quotidien ? 😞
Saviez-vous que l&#39environnement dans lequel vous évoluez peut réellement influencer votre vitalité et votre sérénité ? 😥
Un focus particulier doit être mis sur votre maison ou votre appartement !
STOP ! Si vous ne faites rien maintenant, dans 6 mois, vous serez toujours au même point. Votre espace vital continuera à vous voler votre vitalité, et votre bien-être restera hors de portée.
Transformez votre vie en activant les superpouvoirs de votre maison grâce au Feng Shui adapté à votre intérieur. Découvrez comment harmoniser vos énergies vitales et revitaliser votre quotidien",978-2958992408,https://m.media-amazon.com/images/I/61ms6R4LEXL._SY522_.jpg,Feng Shui Flow (2 novembre 2023),Aude Charreau,Holistique
DIS-MOI OU TU AS MAL (Ed.2018): Les cris du corps sont des messages de l&#39âme. Eléments de psycho-énergétique,14.14,"600 000 exemplaires vendus - Un livre culte.
« Pour la médecine orientale, la maladie témoigne d&#39un obstacle à la réalisation du Chemin de Vie. La conscience exprime ainsi par des troubles énergétiques générateurs de maladie les entraves à son plein épanouissement. Il paraît donc logique de comprendre les mécanismes psychoénergétiques qui sous-tendent la maladie afin de retrouver l&#39état de santé.
À ce titre, ce livre représente un parfait manuel pratique à l&#39usage de tous ceux qui cherchent les clés afin de décoder le langage du corps. À sa lecture, peut-être apprendrons-nous alors à ne plus voir la maladie comme le fait du hasard ou de la fatalité, mais comme un message de notre conscience, de notre être intérieur. Peut-être serons-nous capables de découvrir derrière telle souffrance une maladie &#39créatrice&#39, un moyen de progression dans notre évolution.",978-2226439260,https://m.media-amazon.com/images/I/81sXLNLvqcL._SY522_.jpg,ALBIN MICHEL; Illustrated - Enlarged édition (31 octobre 2018),Michel Odoul,Holistique
Les secrets de la technique Nadeau - Méthode canadienne de régénération holistique,15.86,"Technique Nadeau :
l&#39exercice physique à la portée de tous

QUESTION DE BON SENS
Henri Nadeau a mis au point cette méthode dans les années 1970 au Canada après un très grave infarctus. Alors que les médecins l&#39avaient condamné, il recouvre la santé par lui-même grâce à des exercices simples et répétés. Henri Nadeau décide par la suite de partager son expérience et crée sa méthode. Colette Maher, professeure de yoga, va permettre la diffusion de cette méthode, d&#39abord au Canada, puis en Espagne ; et enfin en France, avec l&#39aide de Monique Filleau, formatrice des professeurs.

DES EXERCICES SIMPLES AUX BIENFAITS RECONNUS
Ce livre présente la méthode dans le détail mais va bien au-delà. Les trois mouvements sont détaillés avec précision (rotation du bassin, vague complète et natation). L&#39auteur insiste, c&#39est le premier secret, sur l&#39exécution précise des mouvements. Conseils et erreurs à éviter. Témoignages de pratiquants pour lever des difficultés. L&#39auteur nous fait ensuite comprendre les effets de la méthode sur notre colonne vertébrale, sur les systèmes nerveux et glandulaire et sur notre psychisme, en rentrant dans le détail du fonctionnement de ces grandes structures vitales.

Un livre complet, pratique, illustré, pour découvrir ou approfondir une méthode qui a démontré son efficacité auprès de milliers d&#39adeptes.

Jean-Michel Kensan Pierre enseigne la Technique Nadeau et la méditation zen à Toulouse où il réside. Il a publié aux Éditions Almora :",978-2351183663,https://m.media-amazon.com/images/I/51eOO4hpABL._SY522_.jpg,Almora; Illustrated édition (19 avril 2018),Jean-Michel Pierre,Holistique
La Gemmothérapie simplifiée : Un Outil Incontournable pour Naturopathes et Thérapeutes: - Guide Pratique Complet,16.74,"Préface
Originaire de Marseille, j&#39ai débuté mon parcours dans le secteur paramédical, travaillant dans divers services hospitaliers.
Cette expérience m&#39a permis de développer une compréhension approfondie des besoins en santé et bien-être, m&#39ouvrant les portes vers des disciplines complémentaires telles que la naturopathie, la réflexologie, l&#39iridologie, et l’hypnose Ericksonienne, enrichies par l&#39énergétique traditionnelle chinoise.

Au fil des années, ma passion pour le bien-être holistique m&#39a conduit à Brignoles, où j&#39ai exercé mes activités de Naturopathe et géré mon propre magasin bio pendant plus de dix ans.

Parallèlement, j&#39ai créé une gamme de compléments alimentaires bio, se concentrant particulièrement sur la gemmothérapie.

Cette expérience m&#39a permis de former des professionnels de santé, m&#39amenant à constater la complexité de la gemmothérapie, surtout due à ses nombreuses possibilités d&#39association et de combinaison.

Ce livre est le fruit de cette expérience.

Il se veut un guide exhaustif et pratique, destiné aux naturopathes, aux revendeurs, et à toute personne s&#39intéressant à la gemmothérapie.

Son organisation systématique, abordant la gemmothérapie système par système, avec des indications spécifiques et un tableau indicatif par bourgeon, vous permet de cibler l&#39utilisation des bourgeons et de créer des systèmes personnalisés adaptés à chaque besoin.
Vous pouvez ainsi facilement élaborer vos propres complexes et synergies, adaptés à diverses conditions de santé.

Grâce à ce tableau, les lecteurs peuvent facilement créer des synergies efficaces, adaptées à diverses conditions de santé.

Mon objectif est de fournir un ouvrage de référence, une ""bible"" de la gemmothérapie, qui condense en un seul volume tout ce qu&#39il faut savoir pour conseiller et prescrire de manière professionnelle et efficace.

Je souhaite que ce livre soit un pilier pour ceux qui cherchent à approfondir leur compréhension et leur pratique de cette discipline fascinante, en offrant un accès direct et structuré à une mine d&#39informations essentielles.",979-8867268985,https://m.media-amazon.com/images/I/61fDxGN8xHL._SY522_.jpg,Independently published (11 novembre 2023),DANIELLE GARDET GENDRE,Holistique
"Et s&#39il s&#39agissait d&#39autre chose ? Enfants autistes, hyperactifs, dyslexiques, dys...",20.0,"Enfants autistes, hyperactifs, dys... ?
En une trentaine d&#39années, le nombre de diagnostics d&#39autisme, toutes formes confondues, est passé de 1 pour 100 000 à 1 pour 300. Parallèlement, le nombre de jeunes diagnostiqués schizophrènes, atteints de troubles bipolaires... est en constante augmentation. Le syndrome d&#39hyperactivité, avec ou sans déficit d&#39attention, atteint des proportions qui frisent la pandémie. Quant aux troubles dys... ils fleurissent comme fleurs au printemps. A part la dyslexie devenue un grand classique, les autres formes de dys... étaient, jusque-là, réservées à des pathologies graves, souvent séquelles d&#39accidents. Que se passe-t-il ? La santé mentale de nos enfants, de nos jeunes, s&#39est-elle à ce point détériorée ? Existe-t-il encore des enfants ou des jeunes qui échappent à de tels diagnostics ? Et si, en réalité, il s&#39agissait de bien autre chose ? Et si tous ces troubles n&#39étaient que les révélateurs de quelque chose de beaucoup plus profond, à la fois résultante de certains de nos choix et émergence d&#39un paradigme nouveau ?",978-2361880088,https://m.media-amazon.com/images/I/514AA+gR-UL._SY522_.jpg,Exergue (6 septembre 2010),Marie-Françoise Neveu,Holistique
"Votre jeûne holistique en pratique - Purifier, regénérer et renforcer le corps et l&#39esprit",20.0,"Alors que les dysfonctionnements de notre système médical s&#39amplifient, il devient urgent de reprendre sa santé en main et d&#39acquérir des clés d&#39autonomie. La pratique du jeûne est un moyen efficace pour activer les voies de la détox, de l&#39autoréparation et, in fine, d&#39un programme santé prévenant les maladies de civilisation. Ce livre vous assistera dans chacune des étapes, de la préparation à la réalisation du jeûne puis à la reprise alimentaire, et vous guidera au quotidien dans les différentes pratiques corporelles, automassages et gymnastique douce, exercices respiratoires et relaxation. Il répond aux principales questions qui se posent durant un jeûne et vous indique également les astuces et les moyens pour pallier les éventuels inconforts. Différentes formes de jeûne sont abordées, avec leurs particularités et leurs objectifs respectifs. Alain et Sylvie animent des cures de jeûne depuis de nombreuses années et vous font ainsi bénéficier de leur riche expérience.",978-2360470884,https://m.media-amazon.com/images/I/71Z2pn5xjqL._SY522_.jpg,CHARIOT D&#39OR (21 avril 2021),Alain Huot,Holistique
"Myths, Miracles, and Truth: A Beginners Guide to Learning Homeopathy",18.99,"Making Homeopathy Make Sense!
Open this book, and homeopathy comes to life! Inside is an entire course designed for anyone who wants to learn about homeopathy but needs help figuring out where to start. This book is more than just some text on a page. It is a complete course with videos, quizzes, reference materials, and free lifetime access to our advanced remedy picker software - an app designed to help people pick the perfect remedy for optimal health outcomes.
Get ready to explore homeopathy&#39s history, discover how it has evolved, and what makes it work. Learn the basics, explore the vocabulary, and determine how to pick the best remedy for each specific health problem. Get healthy with homeopathy; holistic care can produce impressive results. Everything required to get started with homeopathy is inside this book.",979-8874142605,https://m.media-amazon.com/images/I/61g6DnvXWCL._SY522_.jpg,Independently published (7 février 2024),Glynis A. Kennedy,Holistique
The Crystal Healing Book,10.76,"Judy Hall, author of the bestselling ""Crystal Bible,"" offers us a fresh way of looking at 12 master healing crystals in this key to opening your higher awareness.",978-1841812601,https://m.media-amazon.com/images/I/61AhLW2N06L._SY522_.jpg,Godsfield Press (15 juillet 2005),Judy Hall,Holistique
"La méditation du guerrier: Le secret le mieux gardé du développement personnel, du perfectionnement cognitif et de la lutte contre le stress, enseigné par un maître dans quatre arts samouraïs",6.02,"Découvrez la forme de méditation originale, instinctive et non religieuse qui s’est perdue au fil du temps. Richard L. Haight, auteur primé de The Unbound Soul et maître de quatre arts martiaux samouraïs, partage le secret le mieux gardé au monde dans les domaines du développement personnel, du perfectionnement cognitif et du soulagement du stress, qu’il appelle la méditation du guerrier.
Pour tous les milieux, genres et âges.
Pour vous faire une représentation mentale de la méditation du guerrier, imaginez un champ de bataille sur lequel se trouve un seul samouraï entouré de multiples adversaires. L’attention d’un débutant passerait sans arrêt d’un adversaire à l’autre dans une tentative anxieuse de se défendre. Une telle stratégie fatigue rapidement le guerrier, qui sera vaincu. Un guerrier expérimenté repartira son attention de manière égale dans toutes les directions, mais il éprouvera quand même de l’anxiété pendant qu’il prépare mentalement ses tactiques. Ses pensées et son anxiété peuvent être sa perte si ses adversaires sont très habiles. L’attention d’un maître, comme celle de l’expert est répartie de manière égale, mais il demeure calme, il ne possède pas de plan d’action, son corps effectue les actions adéquates selon les besoins du moment.",978-1532333927,https://m.media-amazon.com/images/I/71dI5vYQX3L._SY522_.jpg,Independently Published (12 février 2020),Richard L Haight,Holistique
Racines familiales de la mal a dit Tome 3,19.04,"C’est toujours en compagnie de Joseph, que l’auteur nous propose de poursuivre ses recherches sur la compréhension de la maladie. Joseph nous conduit cette fois dans différentes traditions comme la Kabbale et le Bouddhisme et fait un parallèle avec la biologie. Cette lecture des textes sacrés nous donne un mode d’emploi pour la compréhension des maladies, non plus dans notre histoire familiale mais plutôt dans notre histoire personnelle, afin de nous responsabiliser dans nos actes. Les portes d’entrée restent multiples : l’étymologie, le ressenti cellulaire et les lois biologiques, le but recherché étant de trouver l’Unité. La quête de Joseph vers L’homme éveillé passe par la biologie et la compréhension du sens de la maladie, afin d’échapper à la souffrance familiale. En effet, l’homme se croit entravé par ses conflits, dans un fatal enchaînement généalogique. Par différents chemins comme celui du sens de la maladie, Joseph nous propose de nous mener vers la délivrance en comprenant et en sortant des conditionnements familiaux. L’essentiel pour Joseph, n’est pas ce qui est enseigné, mais la libération et l’éveil qui sont proposés. Gérard Athias, docteur en médecine, travaille depuis plus de quinze ans sur l’interprétation des maladies.",978-2952514774,https://m.media-amazon.com/images/I/71+Vt75HaVL._SY522_.jpg,PICTORUS (10 juin 2010),Gérard Athias,Holistique
Le livre perdu de la médecine naturelle: Guérison rajeunie grâce à des recettes médicinales naturelles,17.35,"Dans une société saturée de médicaments et de médecines synthétiques, il reste un trésor caché de connaissances sur la guérison : le livre perdu de la médecine naturelle. Dans ses pages se trouvent les secrets de l&#39utilisation de la capacité intrinsèque de la nature à guérir et revitaliser le corps, l&#39esprit et l&#39âme.

Le Livre Perdu de la Médecine Naturelle plonge dans les connaissances intemporelles des médecines naturelles, fournissant une référence approfondie à vingt traitements curatifs puissants dérivés directement du sol. Des plantes médicinales aux méthodes de guérison traditionnelles, ce livre fournit un guide du bien-être holistique basé sur des traditions séculaires.

Découvrez les pouvoirs médicinaux des plantes et herbes utilisées pour guérir depuis l’Antiquité. Apprenez à utiliser l&#39aromathérapie pour réduire le stress et favoriser la relaxation, ou étudiez l&#39Ayurveda pour équilibrer l&#39énergie du corps et stimuler la vitalité.

Mais le livre enterré de la médecine naturelle ne s’arrête pas là ; il plonge également dans des thérapies moins connues comme l&#39acupuncture, l&#39homéopathie et la guérison énergétique, donnant un aperçu de leur efficacité et de leurs applications pratiques dans la vie contemporaine.

Que vous recherchiez un traitement contre des maladies chroniques, renforciez votre système immunitaire ou simplement renouez avec les bienfaits de la nature, The Lost Book of Natural Medicine offre un chemin vers un bien-être holistique qui va au-delà des restrictions de la médecine traditionnelle.

Rejoignez-nous dans un voyage de redécouverte alors que nous découvrons les secrets du livre ancien de la médecine naturelle et célébrons le pouvoir de guérison de la nature sous toutes ses formes magnifiques.",979-8326633552,https://m.media-amazon.com/images/I/61UPyNX-SCL._SY522_.jpg,Independently published (25 mai 2024),Alexandro Bokan,Holistique
