Nom,Prix,Description,Isbn,Photo,Editeur,Auteur
LA PENSÉE POSITIVE: Comment atteindre vos objectifs et mener une vie positive à travers le pouvoir de la pensée,9.99,"Changez votre vie et commencez à penser positivement!
Savez-vous que la pensée positive fonctionne mais que vous ne savez pas comment la mettre en pratique?
Vous vous sentez triste? Découragé? Tout le monde vous semble heureux?

Tout semble aller mal et la malchance vous suit?

Apprenez l'art de la pensée positive. Apprenez des stratégies, et changez totalement votre vie en lui donnant une toute nouvelle empreinte! Enfin, vous saurez comment utiliser la pensée positive et quels sont ses avantages! Vous allez découvrir un nouveau monde! Dans chaque situation, vous serez en mesure de garder la sérénité, d'affronter les choses de la bonne façon, d'analyser et de faire les meilleurs coups. Grâce à quelques conseils simples, la pensée positive améliorera votre estime de soi, votre santé et vous portera chance!

Dans ce manuel utile, vous apprendrez...",979-8621428907,https://m.media-amazon.com/images/I/61vPdMfXVCL._SY522_.jpg,Independently published (4 mars 2020),Marcello Borelli
LA PENSÉE POSITIVE: Comment atteindre vos objectifs et mener une vie positive à travers le pouvoir de la pensée,9.99,"Changez votre vie et commencez à penser positivement!
Savez-vous que la pensée positive fonctionne mais que vous ne savez pas comment la mettre en pratique?
Vous vous sentez triste? Découragé? Tout le monde vous semble heureux?

Tout semble aller mal et la malchance vous suit?

Apprenez l'art de la pensée positive. Apprenez des stratégies, et changez totalement votre vie en lui donnant une toute nouvelle empreinte! Enfin, vous saurez comment utiliser la pensée positive et quels sont ses avantages! Vous allez découvrir un nouveau monde! Dans chaque situation, vous serez en mesure de garder la sérénité, d'affronter les choses de la bonne façon, d'analyser et de faire les meilleurs coups. Grâce à quelques conseils simples, la pensée positive améliorera votre estime de soi, votre santé et vous portera chance!

Dans ce manuel utile, vous apprendrez...",979-8621428907,https://m.media-amazon.com/images/I/61vPdMfXVCL._SY522_.jpg,Independently published (4 mars 2020),Marcello Borelli
Je vais aller mieux,6.85,"L’anxiété et le mal-être sont des choses qui te pourrissent la vie.
Tu imagines le pire dans chaque situation, tu ressasses le passé, tu appréhendes le futur, tu déprimes….
Bref, tu ne te sens jamais serein(e), alors que tu rêverais d’être heureux(se) comme les autres.

“Je vais aller mieux” est ton compagnon dans cette quête d’une vie meilleure. À l’intérieur, tu retrouveras:
- Des méthodes pour structurer tes pensées et tes émotions afin d’arrêter de te torturer l’esprit pour tout et rien.
-Des explications rassurantes et motivantes pour remplacer tes idées noires par des pensées plus sereines.",979-8321185742,https://m.media-amazon.com/images/I/41j8punDZrL._SY522_.jpg,Independently published (24 mars 2024),Capucine Marc
"Aujourd'hui je vais mal, Demain j'irai mieux.",17.44,"Dans ce livre, tu trouveras des conseils pour t'emmener sur le chemin de la guérison émotionnelle et de l'apaisement face au stress.

L'anxiété peut rendre la vie quotidienne difficile, envahir nos pensées, et nous empêcher d'être au meilleur de nous-mêmes. À travers des citations développées, des exercices pratiques, et des questions de développement personnel, ce livre est fait pour être un véritable soutien si tu traverses des périodes de déprime ou d'anxiété.

Chaque page, t'offre l'opportunité de mieux comprendre tes pensées, tes émotions et tes réactions.

Tu peux l'emporter partout avec toi afin de te donner un coup de main pour gérer ton stress. Utilise-le comme un véritable guide !",979-8858130598,https://m.media-amazon.com/images/I/41lYE+uGp8L._SY522_.jpg,Independently published (19 août 2023),Victoire Charlie
J'ai broyé du Noir pour voir la vie en Rose: Apaiser son anxiété pour éclairer le présent et préparer le futur,14.56,"Ce livre t'accompagne dans un parcours vers un mieux-être face à l'anxiété.

En combinant des mots sincères, des réflexions profondes, et des coloriages apaisants, il t'offre les outils pour explorer et comprendre tes émotions vers une vie moins anxieuse.

A travers des images fortes et des exemples parlants, tu seras guidé(e) à déchiffrer les messages cachés derrière tes angoisses, à reconnaître ses origines et à développer des stratégies pour une vie quotidienne plus sereine.

Et plus encore, ce livre t'encourage à examiner de près comment tes propres pensées et anticipations façonnent ton ressenti, te donnant les clés pour rebâtir une existence où l'anxiété ne prend plus le dessus.

C'est un pas vers la liberté intérieure, une invitation à cultiver la patience et l'acceptation de soi dans un monde qui peut souvent sembler accablant.",979-8878959872,https://m.media-amazon.com/images/I/61mp31C812L._SY522_.jpg,Independently published (8 février 2024),Célestine Leroi
LA PENSÉE POSITIVE: Comment atteindre vos objectifs et mener une vie positive à travers le pouvoir de la pensée,9.99,"Changez votre vie et commencez à penser positivement!
Savez-vous que la pensée positive fonctionne mais que vous ne savez pas comment la mettre en pratique?
Vous vous sentez triste? Découragé? Tout le monde vous semble heureux?

Tout semble aller mal et la malchance vous suit?

Apprenez l'art de la pensée positive. Apprenez des stratégies, et changez totalement votre vie en lui donnant une toute nouvelle empreinte! Enfin, vous saurez comment utiliser la pensée positive et quels sont ses avantages! Vous allez découvrir un nouveau monde! Dans chaque situation, vous serez en mesure de garder la sérénité, d'affronter les choses de la bonne façon, d'analyser et de faire les meilleurs coups. Grâce à quelques conseils simples, la pensée positive améliorera votre estime de soi, votre santé et vous portera chance!

Dans ce manuel utile, vous apprendrez...",979-8621428907,https://m.media-amazon.com/images/I/61vPdMfXVCL._SY522_.jpg,Independently published (4 mars 2020),Marcello Borelli
LA PENSÉE POSITIVE: Comment atteindre vos objectifs et mener une vie positive à travers le pouvoir de la pensée,9.99,"Changez votre vie et commencez à penser positivement!
Savez-vous que la pensée positive fonctionne mais que vous ne savez pas comment la mettre en pratique?
Vous vous sentez triste? Découragé? Tout le monde vous semble heureux?

Tout semble aller mal et la malchance vous suit?

Apprenez l'art de la pensée positive. Apprenez des stratégies, et changez totalement votre vie en lui donnant une toute nouvelle empreinte! Enfin, vous saurez comment utiliser la pensée positive et quels sont ses avantages! Vous allez découvrir un nouveau monde! Dans chaque situation, vous serez en mesure de garder la sérénité, d'affronter les choses de la bonne façon, d'analyser et de faire les meilleurs coups. Grâce à quelques conseils simples, la pensée positive améliorera votre estime de soi, votre santé et vous portera chance!

Dans ce manuel utile, vous apprendrez...",979-8621428907,https://m.media-amazon.com/images/I/61vPdMfXVCL._SY522_.jpg,Independently published (4 mars 2020),Marcello Borelli
Baume au Coeur | Recueil de Récits Réconfortants pour égayer ton esprit dans les Moments de Nécessité,19.85,"Ce recueil est pour ceux et celles qui ont besoin d'une pause réconfortante, dans un monde parfois trop rapide.
Que vous traversiez une journée difficile ou que vous recherchiez simplement un instant de répit, ouvrez ""Baume au Coeur"" à une page au hasard et laissez-vous emporter par le message qui s'offre à vous comme un signe. Ce recueil devient ainsi votre refuge personnel, rappelant que la vie, malgré ses vicissitudes, est une aventure riche en enseignements.
Offrez-vous le cadeau d'une source de réconfort bien nécessaire et plongez dans ce trésor littéraire qui saura éclairer votre chemin, page après page.",979-8877253896,https://m.media-amazon.com/images/I/41ya2gfoO1L._SY522_.jpg,Independently published (24 janvier 2024),Une Réflexion
Mon Journal Anti Anxiété et Anti Stress: Ton Guide Anti Anxiété Quotidien pour Calmer ton Stress et Guérir ton Anxiété – Exercices Anti Crises ... Pensées Positives et Cultiver ton Bien-Être,5.87,"Anxiété, Stress ou Crises d'Angoisse font parties de ta vie ?

Diverses études scientifiques ont prouvé que la pratique quotidienne du journaling (écrire dans un journal anti anxiété) diminue l’anxiété et le stress de 50% !

Incroyable non ? Mais pas seulement !


En complétant ""Mon Journal Anti Anxiété et Anti Stress"", chaque jour pendant 2 mois :

✅ Tu calmes ton anxiété jusqu’à la voir totalement disparaitre
✅ Tu dis ciao aux crises d’angoisse handicapantes et terrorisantes à vivre
✅ Tu",,https://m.media-amazon.com/images/I/51DTkrnYCuL._SY522_.jpg,Independently published (16 avril 2024),Marika Ciaoanxiete
"Le STOICISME en 40 Contes Philosophiques + Exercices Pratiques: Contes philosophiques et Exercices pour gagner en Sagesse, en Résilience et en Force mentale",16.61,"« Quelle personne seriez-vous si vous aviez la clé pour dompter vos émotions négatives, gérer stress anxiété angoisse, transcender la perte d’un être cher, et triompher sur les tracas du quotidien avec une philosophie de la vie quotidienne comme alliée ? Et si vous deveniez un ROC dans la tempête de la vie ? »
Ce que vous découvrirez dans ce livre :
Partie 1 : Contes Philosophiques Stoïciens
Plongez dans 40 contes spirituels captivants qui donnent vie à la sagesse stoïcienne, et qui vous feront réfléchir bien plus que vous ne pouvez l’imaginer
Chaque conte se termine par une analyse pertinente des principes abordés",979-8868348846,https://m.media-amazon.com/images/I/61WK1QDSNcL._SY522_.jpg,Independently published (20 novembre 2023),Lya Clark
Demain sera meilleur,7.17,"Dans un monde fait de défis et d’incertitudes, les personnes souffrant d’anxiété peuvent avoir beaucoup de mal à trouver un peu de calme et à profiter de leur vie.

Tu ne te fais pas confiance, tu as des pensées négatives qui reviennent en boucle dans ton esprit et tu as toujours le sentiment de ne pas être et de ne pas faire assez.... Résultat: tu es épuisé.

Dans le livre ""Demain sera meilleur"", tu retrouveras:

- Des explications pour comprendre les causes de ton anxiété et de ton mal-être.
- Des méthodes pour apprendre a mieux gérer tes émotions.
- Des questions d'introspection afin de pouvoir te confier, et faire un véritable travail sur toi.",979-8322624004,https://m.media-amazon.com/images/I/41BDDrB90xL._SY522_.jpg,Independently published (11 avril 2024),Lucie Vie
LA PENSÉE POSITIVE: Comment atteindre vos objectifs et mener une vie positive à travers le pouvoir de la pensée,9.99,"Changez votre vie et commencez à penser positivement!
Savez-vous que la pensée positive fonctionne mais que vous ne savez pas comment la mettre en pratique?
Vous vous sentez triste? Découragé? Tout le monde vous semble heureux?

Tout semble aller mal et la malchance vous suit?

Apprenez l'art de la pensée positive. Apprenez des stratégies, et changez totalement votre vie en lui donnant une toute nouvelle empreinte! Enfin, vous saurez comment utiliser la pensée positive et quels sont ses avantages! Vous allez découvrir un nouveau monde! Dans chaque situation, vous serez en mesure de garder la sérénité, d'affronter les choses de la bonne façon, d'analyser et de faire les meilleurs coups. Grâce à quelques conseils simples, la pensée positive améliorera votre estime de soi, votre santé et vous portera chance!

Dans ce manuel utile, vous apprendrez...",979-8621428907,https://m.media-amazon.com/images/I/61vPdMfXVCL._SY522_.jpg,Independently published (4 mars 2020),Marcello Borelli
"De rien à tout, de tout à rien",6.6,"Ce livre est un guide pour toutes celles qui luttent pour retrouver la liberté et la sérénité dans leur comportement alimentaire.

Tu n'es pas seule, mais tu es enfermée dans une relation exclusive avec la nourriture, et cela peut te faire ressentir beaucoup de solitude.

Que tu sois en quête de compréhension sur toi-même et sur tes comportements ou que tu cherches de l’aide pour sortir de tes complexes et retrouver le bien-être et la joie, ce livre est conçu pour t’aider à obtenir des réponses. Tu y trouveras des mots de soutien et de réconfort, une approche différente et éclairante sur les solutions à apporter, mais aussi des outils",979-8322404804,https://m.media-amazon.com/images/I/41RU+D2W5xL._SY522_.jpg,Independently published (9 avril 2024),Victoire Charlie
ANIMAUX SAUVAGES - Livre de Coloriages Mystères pour adulte - Coloriage par Numéro - Art-Thérapie - Anti-Stress: 20 animaux sauvages à colorier + 5 ... dessin apparaîtra ! Idée cadeau - 102 pages,8.12,"Livre de coloriages mystères d'animaux sauvages... pour adulte.
Vous allez adorer colorier les 20 dessins inédits d'animaux sauvages rassemblés dans ce livre de coloriage, ainsi que les 5 autres dessins ajoutés en bonus, qui sont issus d'autres livres de la même collection !
Le principe est simple : Des numéros sont inscrits dans les différentes zones du dessin. Coloriez chaque zone du dessin de la couleur indiquée par son numéro. Cela fera apparaître progressivement le dessin final !
Comptez environ 1 à 4 heures de coloriage par dessin.
Beaucoup de plaisir et d'amusement en perspective !",979-8872162803,https://m.media-amazon.com/images/I/71Z4oTxiejL._SY522_.jpg,Independently published (17 décembre 2023),Rosalin Paille
"Exercices Somatiques pour Débutants: Le Guide Complet de la Perte de Poids, du Soulagement du Stress et du Bien-Être Émotionnel",16.68,"Êtes-vous fatigués de vous sentir stressés, alourdis et piégés en mode survie ? Vous sentez-vous souvent épuisés ou vidés ?
Il est temps de changer ! Les 'Exercices somatiques pour débutants' représentent une nouvelle manière de bouger et de mieux comprendre notre corps. Ces exercices vous aident non seulement à rendre votre corps plus fort en favorisant une meilleur conscience de son fonctionnement mais vous aide également à le connecter à votre esprit.
Ici, vous trouverez :
+ de 30 Exercices Somatiques : illustrés avec des images faciles à suivre, rendant ainsi la pratique du mouvement somatique accessible même aux débutants.",979-8874480080,https://m.media-amazon.com/images/I/61iRovRrnpL._SY522_.jpg,Independently published (10 janvier 2024),Merton Corey
Maîtrisez vos émotions: Guide pratique pour vaincre la négativité et mieux gérer vos émotions,16.99,"Déjà plus de 300 000 ventes dans le monde

Voulez-vous surmonter vos émotions négatives ? Sentez-vous souvent que vous pourriez mieux faire ? Avez-vous besoin d’aide pour gérer votre stress ?
Avez-vous déjà été si absorbé par vos émotions négatives que vous pensiez qu’elles ne disparaîtraient jamais ?
La solution pour faire face à la négativité est de comprendre comment vos émotions fonctionnent et d’appliquer des techniques spécifiques pour vous assurer de les gérer efficacement.
Maîtrisez vos émotions est le manuel pratique que vos parents auraient dû vous donner à la naissance. En le lisant, vous apprendrez un processus étape par étape pour traiter les émotions négatives afin d'augmenter votre bien-être et mener une vie plus heureuse. Avec des exercices pratiques et des exemples personnels, vous explorerez des techniques qui déjouent les spirales drainantes de la négativité et qui apportent un soulagement immédiat.",979-8463595232,https://m.media-amazon.com/images/I/61lOrYzO9DL._SY522_.jpg,Independently published (19 novembre 2021),Thibaut Meurisse
LA PENSÉE POSITIVE: Comment atteindre vos objectifs et mener une vie positive à travers le pouvoir de la pensée,9.99,"Changez votre vie et commencez à penser positivement!
Savez-vous que la pensée positive fonctionne mais que vous ne savez pas comment la mettre en pratique?
Vous vous sentez triste? Découragé? Tout le monde vous semble heureux?

Tout semble aller mal et la malchance vous suit?

Apprenez l'art de la pensée positive. Apprenez des stratégies, et changez totalement votre vie en lui donnant une toute nouvelle empreinte! Enfin, vous saurez comment utiliser la pensée positive et quels sont ses avantages! Vous allez découvrir un nouveau monde! Dans chaque situation, vous serez en mesure de garder la sérénité, d'affronter les choses de la bonne façon, d'analyser et de faire les meilleurs coups. Grâce à quelques conseils simples, la pensée positive améliorera votre estime de soi, votre santé et vous portera chance!

Dans ce manuel utile, vous apprendrez...",979-8621428907,https://m.media-amazon.com/images/I/61vPdMfXVCL._SY522_.jpg,Independently published (4 mars 2020),Marcello Borelli
Guide Ultime pour Apprendre: Ce que l'école ne vous a jamais enseigné,17.78,"Transformez radicalement votre manière d'apprendre avec le ""Guide Ultime pour Apprendre""!
Avez-vous déjà senti que, malgré tous vos efforts, vous n'arrivez pas à apprendre aussi efficacement que vous le voudriez ? Vous êtes-vous déjà demandé pourquoi certaines personnes semblent absorber les connaissances comme une éponge, tandis que pour d'autres, c'est une lutte constante ?
La réponse ne réside pas dans le talent inné, mais dans la méthode d'apprentissage. Et c'est exactement ce que ""Le Guide Ultime pour Apprendre: ce que l'école ne vous a jamais enseigné"" est là pour révolutionner.
Pourquoi ce livre est différent ?
Contrairement aux méthodes traditionnelles, souvent répétitives et inefficaces, ce guide vous emmène dans un voyage à la découverte de techniques d'apprentissage prouvées scientifiquement.
Imaginez maîtriser de nouvelles compétences, langues ou concepts avec aisance, fluidité et, surtout, avec plaisir. C'est ce que propose notre guide, en s'appuyant sur les dernières découvertes en neurosciences et en psychologie cognitive.",979-8322865957,https://m.media-amazon.com/images/I/61dv3UeX5uL._SY522_.jpg,Independently published (14 avril 2024),Clément PICARD
The Power of Now: (20th Anniversary Edition),13.6,"**CHOSEN BY OPRAH AS ONE OF HER 'BOOKS THAT HELP ME THROUGH'**

The international bestselling spiritual book, now with a new look for its 20th anniversary. Eckhart Tolle demonstrates how to live a healthier, happier, mindful life by living in the present moment.

************

'I keep Eckhart's book at my bedside. I think it's essential spiritual teaching. It's one of the most valuable books I've ever read.'",978-0340733509,https://m.media-amazon.com/images/I/91ISbxU2b8L._SY522_.jpg,Yellow Kite; 1er édition (1 février 2001),Eckhart Tolle
"Sophrologie : 26 visualisations personnalisées, 1er, 2e, 3e, 4e degré",12.74,"Répondant à l'appel de ses lecteurs après ""27 exercices de relaxation dynamique"", "" 26 visualisations personnalisées"" est une compilation enrichissante de 26 sophronisations, couvrant les premier, deuxième, troisième et quatrième degré.

Chaque visualisation, soigneusement élaborée, invite à un voyage intérieur, de la relaxation basique aux explorations plus complexes. Destiné aux débutants comme aux praticiens expérimentés, ce livre fournit des clés pour une détente profonde, un apaisement et un équilibre émotionnel.

Avec ce livre, plongez dans un univers où chaque visualisation ouvre une voie vers une meilleure compréhension de soi et une harmonie intérieure, répondant ainsi aux besoins et aux aspirations de chacun.

Explorez des visualisations sur mesure :",978-2958909253,https://m.media-amazon.com/images/I/51oXw1ZIN9L._SY522_.jpg,David Chazelle édition (7 janvier 2024),David Chazelle
Cohérence cardiaque 3.6.5 - 2e édition,12.02,"Cohérence cardiaque 3.6.5, la méthode antistress la + simple du monde
Révélée par le Dr David Servan-Schreiber, la cohérence cardiaque est une pratique thérapeutique reconnue par la science et conseillée par les médecins. Cette pratique, gratuite comme l'air et inspirante, est basée sur une respiration rythmée.
Ce livre vous apprend à l'intégrer à votre quotidien pour qu'elle vous délivre tous ses bienfaits.
3.6.5 c'est...
3 fois par jour, 6 respirations par minute pendant 5 minutes
Les bénéfices de la cohérence cardiaque :
• Gestion du stress, de l'anxiété et de leurs conséquences
• Meilleur sommeil
• Diminution des fringales, perte des kilos émotionnels
• Mise à distance des émotions négatives
• Diminution du risque cardio-vasculaire
• Amélioration de l'apprentissage
• Aide à la prise de décision",978-2365493833,https://m.media-amazon.com/images/I/61RUPFYohWL._SY522_.jpg,Thierry Souccar; 2e édition (28 octobre 2019),David O'Hare
LA PENSÉE POSITIVE: Comment atteindre vos objectifs et mener une vie positive à travers le pouvoir de la pensée,9.99,"Changez votre vie et commencez à penser positivement!
Savez-vous que la pensée positive fonctionne mais que vous ne savez pas comment la mettre en pratique?
Vous vous sentez triste? Découragé? Tout le monde vous semble heureux?

Tout semble aller mal et la malchance vous suit?

Apprenez l'art de la pensée positive. Apprenez des stratégies, et changez totalement votre vie en lui donnant une toute nouvelle empreinte! Enfin, vous saurez comment utiliser la pensée positive et quels sont ses avantages! Vous allez découvrir un nouveau monde! Dans chaque situation, vous serez en mesure de garder la sérénité, d'affronter les choses de la bonne façon, d'analyser et de faire les meilleurs coups. Grâce à quelques conseils simples, la pensée positive améliorera votre estime de soi, votre santé et vous portera chance!

Dans ce manuel utile, vous apprendrez...",979-8621428907,https://m.media-amazon.com/images/I/61vPdMfXVCL._SY522_.jpg,Independently published (4 mars 2020),Marcello Borelli
LA PENSÉE POSITIVE: Comment atteindre vos objectifs et mener une vie positive à travers le pouvoir de la pensée,9.99,"Changez votre vie et commencez à penser positivement!
Savez-vous que la pensée positive fonctionne mais que vous ne savez pas comment la mettre en pratique?
Vous vous sentez triste? Découragé? Tout le monde vous semble heureux?

Tout semble aller mal et la malchance vous suit?

Apprenez l'art de la pensée positive. Apprenez des stratégies, et changez totalement votre vie en lui donnant une toute nouvelle empreinte! Enfin, vous saurez comment utiliser la pensée positive et quels sont ses avantages! Vous allez découvrir un nouveau monde! Dans chaque situation, vous serez en mesure de garder la sérénité, d'affronter les choses de la bonne façon, d'analyser et de faire les meilleurs coups. Grâce à quelques conseils simples, la pensée positive améliorera votre estime de soi, votre santé et vous portera chance!

Dans ce manuel utile, vous apprendrez...",979-8621428907,https://m.media-amazon.com/images/I/61vPdMfXVCL._SY522_.jpg,Independently published (4 mars 2020),Marcello Borelli
LA PENSÉE POSITIVE: Comment atteindre vos objectifs et mener une vie positive à travers le pouvoir de la pensée,9.99,"Changez votre vie et commencez à penser positivement!
Savez-vous que la pensée positive fonctionne mais que vous ne savez pas comment la mettre en pratique?
Vous vous sentez triste? Découragé? Tout le monde vous semble heureux?

Tout semble aller mal et la malchance vous suit?

Apprenez l'art de la pensée positive. Apprenez des stratégies, et changez totalement votre vie en lui donnant une toute nouvelle empreinte! Enfin, vous saurez comment utiliser la pensée positive et quels sont ses avantages! Vous allez découvrir un nouveau monde! Dans chaque situation, vous serez en mesure de garder la sérénité, d'affronter les choses de la bonne façon, d'analyser et de faire les meilleurs coups. Grâce à quelques conseils simples, la pensée positive améliorera votre estime de soi, votre santé et vous portera chance!

Dans ce manuel utile, vous apprendrez...",979-8621428907,https://m.media-amazon.com/images/I/61vPdMfXVCL._SY522_.jpg,Independently published (4 mars 2020),Marcello Borelli
