Nom,Prix,Description,Isbn,Photo,Editeur,Auteur,Categorie
Upgrade Your Brain: Unlock Your Life’s Full Potential,6.74,"Discover the 8 steps you can take to optimise your brain for better mood, memory, sleep and stress resilience.
The results are in: our mental health, memory and intelligence are deteriorating. One in six children is now diagnosed with mental health issues, anti-depressant prescriptions have sky-rocketed, and the incidence of Alzheimer&#39s and dementia, with are largely preventable, are on the rise. But we can take action to stop this decline in its tracks.
In Upgrade Your Brain, Patrick Holford, founder of the Good for the Brain Foundation, takes a deep dive into why this is happening, and more importantly, what you can do to improve your brain function.
Through his work at the foundation, Patrick has tested the cognitive function of nearly half a million people, assessing and improving their dementia risk, as well as interviewing world-leading professors and brain-health experts. In this book, he unravels how and why our modern diet and lifestyle have inevitable led to a brain-health meltdown.",978-0008661205,https://m.media-amazon.com/images/I/71v4Kr2p3tL._SY522_.jpg,Thorsons (25 avril 2024),Patrick Holford,Troubles du sommeil
Hypnocontes : 18 nouvelles pour trouver son apaisement intérieur - Les neurosciences au service de votre sommeil,16.9,"En s&#39appuyant sur l&#39hypnose et sur la compréhension de l&#39esprit humain que nous offrent les neurosciences, Solène Daoudal a imaginé 18 histoires qui vous permettront de retrouver le sommeil. Chacune propose une approche spécifique fondée sur des mécanismes profonds et méconnus de notre cerveau.
À leur lecture, vous oublierez les ruminations, les soucis qui vous agitent, vous apprendrez à vous servir de la rêverie, à modifier votre rapport à votre corps.
Chaque hypnoconte est suivi d&#39une présentation des ressources employées pour vous aider à changer le fonctionnement de votre esprit.",978-2221254295,https://m.media-amazon.com/images/I/61Fd5pnNW0L._SY522_.jpg,Robert Laffont (24 février 2022),Solène Daoudal,Troubles du sommeil
"Apnée du sommeil, et si la guérison était possible ?: Stop à la fatalité, une solution existe !",17.9,"« S&#39agissant de l’apnée obstructive du sommeil, le mot “guérison” semble un sujet tabou. Cela me pose un problème, car dans la grande majorité des cas, il est tout à fait possible de l’envisager. »
Votre sommeil est très bruyant et agité, ponctué de microréveils ? Vous vous réveillez fatigué et cette somnolence persiste toute la journée ? Vous avez pris du poids ? Votre morosité grimpe en flèche tandis que votre énergie est au plus bas ? Ne cherchez plus, vous êtes peut-être atteint d’apnée obstructive du sommeil, ou SAOS. Représentant un problème de santé publique majeur, ce syndrome est une maladie invalidante aux retentissements importants sur la santé. Si les solutions thérapeutiques habituellement proposées (aide à la respiration nocturne principalement) permettent d’en soulager les symptômes, elles ont un impact négatif sur la qualité de vie. Pourtant, il existe une alternative : une méthode pratiquée depuis des années et éprouvée au niveau international, qui permet à un grand nombre de patients de… guérir, tout simplement ! S’adressant aux personnes atteintes de cette maladie et à leur entourage, cet ouvrage a pour objectif d’expliquer dans un langage clair à la portée de tous ce que sont les apnées du sommeil et leurs conséquences sur la santé. Il fait le point sur les solutions traditionnellement mises en œuvre par le corps médical et les raisons de l’impasse thérapeutique qu’elles constituent, avant de détailler l’approche aussi simple qu’efficace que propose le Dr Solyom. Pour ne plus vivre « avec » un syndrome d’apnée du sommeil, mais définitivement « sans ».",978-2849392690,https://m.media-amazon.com/images/I/71zknaK7nZL._SY522_.jpg,MOSAIQUE SANTE; 1er édition (10 octobre 2023),Éric Dr Solyom,Troubles du sommeil
"50 clés pour aider un enfant qui ne veut pas dormir: Comprendre les besoins de l&#39enfant, prévenir les cauchemars et les terreurs nocturnes, mettre en place des rituels apaisants",14.9,"Un bébé doit-il « faire ses nuits » rapidement en dormant dix heures d&#39affilée ? Faut-il le laisser pleurer pour qu&#39il s&#39habitue à dormir seul ou au contraire l&#39apaiser ? Quelles sont les astuces pour endormir un petit plus facilement ? À quel âge et comment le passer dans sa chambre ? Le sommeil est une préoccupation majeure des parents, et pour cause... Essentiel à l&#39enfant, à son équilibre et à son développement, c&#39est rarement un long fleuve tranquille, pour les enfants comme pour les parents ! Ce guide, conçu par une spécialiste de la petite enfance formée aux questions du sommeil, vous permettra d&#39identifier les besoins de votre enfant selon son âge et d&#39y répondre en fonction des situations.
Il livre 50 CLÉS CONCRÈTES et précieuses - des Éclairages, des Conseils, des Activités - pour que vos nuits ne soient plus un cauchemar...",978-2416007453,https://m.media-amazon.com/images/I/61iXtRiW5fL._SY522_.jpg,EYROLLES (15 septembre 2022),Nadège Pétrel,Troubles du sommeil
,15.55,,,,,,Troubles du sommeil
,5.14,,,,,,Troubles du sommeil
Insomnie et autres poèmes,11.2,"Marina Tsvétaïéva (1892-1941) est aujourd&#39hui reconnue comme l&#39un des grands poètes du XXᵉ siècle. Femme de tous les paradoxes, à la fois russe et universelle, prosaïque et sublime, elle commence très jeune à écrire et à publier. Prise dans la tourmente révolutionnaire après l&#39écrasement de l&#39Armée blanche dans laquelle son mari s&#39est engagé comme officier, elle vit un douloureux exil de dix-sept ans à Berlin, à Prague, puis à Paris. De retour dans son pays natal en 1939, elle se suicide deux ans plus tard. Il est des talents si impétueux que les événements les plus dévastateurs de l&#39histoire ne sauraient les étouffer. Réduite à néant par la terreur stalinienne, Marina Tsvétaïéva ne cesse aujourd&#39hui de revivre et de rayonner. Cette ""danseuse de l&#39âme"", ainsi qu&#39elle se nommait, traverse, subit et transcende les malédictions de l&#39Histoire comme une comète fracassée. Par sa poésie, fulgurante, rétive et exaltée, elle fraternise d&#39emblée avec toutes les victimes. La singularité tragique de son itinéraire, d&#39une indestructible intégrité, garde aujourd&#39hui toute sa charge libératrice.",978-2070358748,https://m.media-amazon.com/images/I/71sbbkbRILL._SY522_.jpg,Gallimard (27 mai 2011),Marina Tsvétaïéva,Troubles du sommeil
Faire face aux ronflements et aux apnées du sommeil,19.94,"Un livre pour comprendre et agir, réalisé en collaboration avec une association de patients pour connaître au mieux vos problématiques. Un volet théorique , « savoir pour faire face » : Comprendre le fonctionnement, les causes et les conséquences des ronflements et des apnées du sommeil connaître les parcours de soin possibles. Un volet pratique : plus de 10 fiches d’exercices , illustrées par des vidéos , pour réduire ses symptômes et améliorer sa qualité de sommeil. Les + : - Un livre illustré en couleurs - Des vidéos pour accompagner les exercices Le public : Personnes atteintes de ronflements, d’apnées ou hypopnées obstructives du sommeil, avec ou sens appareillage ; le personnel soignant ayant des patients concernés par ces affections. Les auteurs : Jean-Arthur Micoulaud-Franchi est maître de conférence et praticien hospitalier au sein de la clinique du sommeil du CHU de Bordeaux et de l’Université de Bordeaux. Kelly Guichard est médecin du sommeil et psychiatre, et exerce au centre de référence des narcolepsies et hypersomnies rares de la clinique du sommeil du CHU de Bordeaux. Meryl Manoukian est kinésithérapeuthe au Pôle d’exploration des apnées du Sommeil (PEAS) à Bordeaux.",978-2340065550,https://m.media-amazon.com/images/I/51sRaaPq64L._SY522_.jpg,ELLIPSES; Illustrated édition (1 mars 2022),Kelly Guichard,Troubles du sommeil
Twelve Hours&#39 Sleep by Twelve Weeks Old: A Step-by-Step Plan for Baby Sleep Success,22.32,"There is no bigger issue for healthy infants than sleeping through the night. In this simple, straightforward book, Suzy Giordano presents her amazingly effective ""Limited- Crying Solution"" that will get any baby to sleep for twelve hours at night—and three hours in the day—by the age of twelve weeks old.
Giordano is the mother of five children and one of the most sought-after baby sleep specialists in the country. The Washington Post calls her a baby sleep ""guru"" and ""an underground legend in the Washington area for her ability to teach newborns how to achieve that parenting nirvana: sleeping through the night."" Her sleep plan has been tested with singletons, twins, triplets, babies with special needs, and colicky babies—and it has never failed.",978-0525949596,https://m.media-amazon.com/images/I/71Gg+vpjcZL._SY522_.jpg,TarcherPerigee (19 janvier 2006),Suzy Giordano,Troubles du sommeil
GUIDE THERAPEUTIQUE: Méthode MATHIS,9.19,"Soyez en sûr, si vous tenez ce livre entre vos mains, ce n’est pas un hasard. Voulez-vous vous sentir mieux dans votre vie ? Êtes-vous prêt à aller plus loin ? Alors, c’est peut-être le bon moment avec ce guide simple et efficace.
Ce guide thérapeutique, qui n’existe pas ailleurs, permet de comprendre très simplement les mécanismes inconscients qui vous soumettent, contre lesquels vous ne pouvez pas lutter « c’est plus fort que moi ». Ce guide vous aidera aussi à libérer vos croyances limitantes et vos émotions des moments difficiles de votre vie.
Bonne lecture, et surtout, bonne intégration !

Eric MATHIS est Hypnothérapeute et Praticien en Thérapies brèves. Il exerce depuis de nombreuses années en cabinet. Il est aussi Conférencier, formateur et écrivain.
Par son approche simple et accessible et sa technique du DMI il a permis la libération de milliers de personnes de leurs problèmes.",979-8373956147,https://m.media-amazon.com/images/I/61IdCL6ZJ5L._SY522_.jpg,Independently published (23 janvier 2023),Mr Eric MATHIS,Troubles du sommeil
Metabolismo Ultra Poderoso,14.56,"Metabolismo ultra poderoso reúne las últimas técnicas y descubrimientos para restaurar el metabolismo. El metabolismo es la fuente de la energía del cuerpo y esa energía que produce el metabolismo de las células de su cuerpo sirve principalmente para causar los movimientos que llamamos la vida y la salud. Con este libro podrá: conocer los factores que reducen su metabolismo; mejorar su calidad de sueño; alcanzar la talla de ropa que tanto desea; descubrir esos alimentos que no le dejan bajar su grasa abdominal, desatar el poder de su metabolismo; aumentar su energía y mejorar su salud. Únase a las cientos de miles de personas que han restaurado su metabolismo.",978-1732196506,https://m.media-amazon.com/images/I/618TG17Y8iL._SY522_.jpg,Free Choice Benelux B.V.; 1er édition (1 août 2018),Frank Suárez,Troubles du sommeil
The Mood Cure,21.05,"This is the food and nutritional answer to mood disorders – Patrick Holford, the founder of the Institute of Optimum Nutrition, praised it as &#39working better than any anti-depressant&#39. Written by one of the most successful names in nutrient therapy, The Mood Cure shows you how you can permanently lift dark moods and emotions in less than 24 hours.
Most mood problems are caused by biochemical imbalances, many of which don&#39t need Prozac or other drugs to cure them. Such drugs are often liberally prescribed despite the risk of side effects.
Julia Ross has been working with natural nutritional solutions at her clinic in California for over 15 years – and with dramatic results. She has developed an extremely successful nutritional plan using specific foods and supplements that can lift dark moods and emotions in less than 24 hours. It works by restoring the body&#39s natural chemical balance, thereby relieving mood-related symptoms, such as depression, PMS, stress, low self-esteem, irritability or SAD.",978-0007323692,https://m.media-amazon.com/images/I/61pciM4IM2L._SY522_.jpg,Thorsons (1 août 2009),Julia Ross,Troubles du sommeil
Destination sommeil: En finir avec les insomnies et retrouver le plaisir de dormir,29.99,"Des conseils et des outils pratiques pour retrouver le plaisir de dormir.
Vous redoutez le moment du coucher ? Votre réveil est une épreuve ? Vous êtes fatigué de mal dormir ? Rassurez-vous, l&#39insomnie n&#39est pas une fatalité ! Comprendre et apprivoiser son sommeil pour lui faire retrouver sa qualité et sa durée, c&#39est possible. Pour cela, Mireille Barreau nous plonge au coeur du fonctionnement du sommeil : elle en explicite les rouages et en expose les bienfaits. Accompagnant le lecteur pas à pas, elle lui apporte des conseils personnalisés mêlant découvertes scientifiques récentes, recommandations, exercices, audio de sophrologie et questionnaires. Elle l&#39entraîne ainsi vers une nouvelle ère de repos. Destiné à ceux qui dorment mal, à ceux qui souffrent d&#39insomnies, à ceux qui ne prennent plus le temps de dormir, ou encore à ceux qui accompagnent des personnes exposées aux insomnies (sophrologues, thérapeutes, médecins), Destination sommeil propose une boîte à outils complète et pratique pour retrouver le plaisir de dormir. Réconciliez-vous durablement avec votre sommeil !",978-2804709853,https://m.media-amazon.com/images/I/61IoshQeBlL._SY522_.jpg,Mardaga (25 novembre 2021),Mireille Barreau,Troubles du sommeil
L&#39oracle du sommeil,11.71,"Un oracle destiné aux enfants pour les aider à retrouver un sommeil réparateur, de jolis songes et un réveil en pleine forme !
Bien dormir est essentiel pour être en forme tout au long de la journée.

Avec ce coffret, Malory Malmasson fait appel à trois "" experts du sommeil "" afin d&#39aider les enfants à s&#39endormir paisiblement et faire du moment du coucher un véritable plaisir.
Ils retrouveront ainsi au fil des cartes Mireille Sommeil, l&#39adorable koala, Théo Dodo, le petit chat, et Gaston Roupillon, le mignon paresseux, qui dévoileront tous leurs secrets afin de passer une bonne nuit.

Chaque message de carte est ponctué d&#39une formule magique à prononcer avant de s&#39endormir, comme un mantra, et d&#39un rituel à pratiquer afin de mettre en place une routine de sommeil.

Faisant appel à l&#39imagination de l&#39enfant, cet oracle aidera les plus petits à se créer chaque soir une véritable bulle de douceur, à retrouver calme, réconfort et paix intérieure, pour rendre le coucher aussi merveilleux qu&#39agréable.",978-2849337011,https://m.media-amazon.com/images/I/61vIIiDowkL._SY522_.jpg,Contre-dires; Illustrated édition (6 octobre 2022),Malory Malmasson,Troubles du sommeil
,12.16,,,,,,Troubles du sommeil
"Healthy Sleep Habits, Happy Child, 5th Edition: A New Step-by-Step Guide for a Good Night&#39s Sleep",22.64,"The perennial favorite for parents who want to get their kids to sleep with ease—now in its fifth edition, fully revised and updated, with a new step-by-step guide for a good night’s sleep.

With more than 1.5 million copies in print, Dr. Marc Weissbluth’s step-by-step regimen for instituting beneficial habits within the framework of your child’s natural sleep cycles has long been the standard-setter in baby sleep books. Now with a new introduction and quick-start guide to getting your child to sleep, Healthy Sleep Habits, Happy Child has been totally rewritten and reorganized to give tired parents the information they need quickly and succinctly. This new edition also includes the very latest research on the importance of

• implementing bedtime routines
• practicing parental presence at bedtime
• recognizing drowsy signs
• the role of the father as an active partner in helping the child sleep better
• overcoming challenges families face to help their child sleep better
• different cultural sleep habits from around the world
• individualized and nonjudgmental approaches to sleep training

Sleep is vital to your child’s health, growth, and development. The fifth edition of",978-0593158548,https://m.media-amazon.com/images/I/81GYX7Ny6fL._SY522_.jpg,Ballantine Books; 5e édition (24 août 2021),Marc Weissbluth M.D.,Troubles du sommeil
L&#39ambidextrie des sentiments,9.2,"J’ai écrit la majorité de ce livre au détour d’une longue nuit faite de deux ou trois soleils, sur un bureau en bois gravé de mots doux, entouré d’une bouteille de Martini, d’un paquet fumant ou deux de Pall-Mall, d’une étagère de livres que j’ai oublié de lire, et d’un petit tas d’ouvrages qui m’ont marqué. Au loin sifflait le souffle apaisant d’un corps que j’ai amoureusement abandonné au sommeil, tout ça pour retrouver la solitude, tout ça, pour te retrouver, toi.",978-1073496471,https://m.media-amazon.com/images/I/312Uoj+aeFL.jpg,Independently published (13 juin 2019),Lucas Clavel,Troubles du sommeil
"The Oxygen Advantage: The simple, scientifically proven breathing technique that will revolutionise your health and fitness",9.93,"The secret to your health, fitness and overall wellbeing lies in the most basic and overlooked aspect of your workout: how you breathe. Developing body strength while ignoring breathing strength is counterproductive.

In The Oxygen Advantage, Patrick McKeown combines his successful breathing exercises with techniques designed to simulate high-altitude training in a highly successful programme that will significantly improve anyone&#39s health but will also empower athletes to improve their sports performance. These scientifically validated exercises have the potential to drastically improve your overall fitness, whether you are a habitual couch potato or an Ironman triathlon champion.

These easy-to-use techniques can help to reduce your breathlessness, improve your sleep as well as reduce anxiety and stress. Drawing on his own experiences as an ex-asthmatic and the work he has done to help athletes and asthma sufferers alike to achieve greater fitness, Patrick shows you the key to a healthier, fitter you.",978-0349406695,https://m.media-amazon.com/images/I/91shAJ6y-oL._SY522_.jpg,Piatkus (15 septembre 2015),Patrick McKeown,Troubles du sommeil
Petites méditations du soir: 40 exercices pour s&#39endormir en douceur,14.95,"Inspirez, expirez, méditez !

Cette boîte anti-stress contient 40 cartes proposant des exercices de relaxation et de méditation à pratiquer le soir. En dix minutes maximum, évacuez les tensions et faites le plein de sérénité pour améliorer votre sommeil !

Retrouvez :
- des exercices courts et très faciles à mettre en place au quotidien ;
- une notice détaillée pour profiter au mieux de tous leurs bienfaits ;
- des illustrations inspirantes pour faciliter le lâcher prise.",978-2016280379,https://m.media-amazon.com/images/I/71ao9RtVH+L._SY522_.jpg,Hachette Pratique (25 août 2021),Coelia Pelletier,Troubles du sommeil
,12.9,,,,,,Troubles du sommeil
Énergie !: Comment sortir du labyrinthe de la fatigue,24.5,"Vous avez l&#39impression de vivre au ralenti ? Vous souffrez d&#39un éventail de symptômes plus ou moins cohérents ? Vous sentez que quelque chose cloche, pourtant on vous répète que tout va bien… Spécialiste de médecine fonctionnelle et préventive, la docteure Anne Fleck a une façon d&#39enquêter sur les causes de la fatigue qui n&#39a pas sa pareille.
Tout comme la faim et la soif, la fatigue est un signal, un processus naturel qui protège le bon fonctionnement de votre organisme. Mais lorsque le sommeil n&#39est plus réparateur, c&#39est qu&#39un autre genre de fatigue vous a envahi : l&#39épuisement ou la fatigue chronique. Pourtant, ce “nouveau mal du siècle” est souvent négligé par ceux qui en souffrent et par ceux qui les soignent, faute de pouvoir en identifier précisément les causes. C&#39est à cette carence de prises en charge et de soins que remédie la
docteure Anne Fleck.
En se fondant sur plusieurs années de pratique et d&#39enquête médicales, elle débusque les “draineurs d&#39énergie” cachés : digestion qui déraille, mauvaise santé intestinale, intolérances alimentaires, inflammations silencieuses, virus sournois, infections ou dysfonctionnements métaboliques non détectés, crash cellulaire, maladies auto-immunes, ou encore pollution environnementale. Puis elle montre le chemin à prendre : en sachant observer et noter les indices ; en procédant, de concert avec votre médecin, à des analyses spécifiques en laboratoire ; en apprenant à détoxiquer votre organisme dans les règles de l&#39art ; en tirant parti d&#39une alimentation judicieuse ; en compensant des déséquilibres nutritionnels et en renforçant
votre système immunitaire par la prise de micronutriments appropriés ; et, bien sûr, en diminuant les facteurs de stress.
Cette stratégie est assortie d&#39un programme ÉNERGIE ! de 30 jours pour prendre de bonnes et saines habitudes : déceler les aliments énergivores, déterminer le meilleur moment pour manger, boire, faire de l&#39exercice, dormir… Bref, apprendre à développer pleinement votre potentiel.
L&#39approche médicale d&#39Anne Fleck a permis à des dizaines de milliers de personnes de sortir enfin du labyrinthe de la fatigue.",978-2330181574,https://m.media-amazon.com/images/I/51DYU1vU2qL._SY522_.jpg,Actes Sud (18 octobre 2023),Anne Fleck,Troubles du sommeil
"Sommeil, tout savoir et mieux dormir !: Récupération, horloge biologique, insomnie, rêves, cauchemars...",7.27,"Chaque nuit, notre corps et notre esprit s’isolent du monde extérieur. Ce temps à soi permet en journée de penser, rire, travailler, aimer, apprendre et échanger avec les autres.

Mais que se passe-t-il lorsque l’on dort ? Que sont les rêves ? Comment récupérer de la fatigue ? Comment dire adieu aux insomnies, éviter les cauchemars ou apaiser un sommeil trop agité ?

Ce guide très illustré vous fait découvrir le rôle du sommeil et vous donne toutes les clés pour l’apprivoiser. Chaque page vous aide à mieux connaître, comprendre et optimiser cette fonction essentielle à notre santé et notre bien-être.",978-2317023057,https://m.media-amazon.com/images/I/81NCn12K7WL._SY522_.jpg,MANGO (29 mai 2020),Isabelle Arnulf,Troubles du sommeil
"Journal de rêves: Journal de rêves à remplir - Pour ne pas oublier ses rêves - Cahier pratique pour noter, analyser et interpréter vos rêves - Pour ... de 3O rêves) - Papier crème - Cadeau original",15.41,"Nos nuits sont peuplées d&#39images, de lieux, de personnages, de symboles ... Ces rêves sont des messages d&#39une grande richesse qui nous guident vers une meilleure connaissance de soi.
Encore faut-il rapidement les noter pour que ces mystères de la nuit ne s&#39effacent pas doucement de notre mémoire.
C&#39est possible avec ce Journal de rêves.
Il va vous permettre de noter, d&#39 analyser et interpréter vos rêves les plus marquants, notamment ceux qui ont tendance à se répéter ou susciter de fortes émotions.
Il se présente sous la forme d&#39un cahier joliment décoré de 124 pages (plus de 60 rêves) au papier crème.
Vous pouvez aussi l&#39offrir à vos proches qui se feront un plaisir de le remplir.",979-8685902153,https://m.media-amazon.com/images/I/71U+CR76zxL._SY522_.jpg,Independently published (15 septembre 2020),Noé Riva,Troubles du sommeil
Why We Sleep: The New Science of Sleep and Dreams,13.64,"&#39Astonishing . . . an amazing book . . . absolutely chocker full of things that we need to know&#39 Chris Evans

&#39Matthew Walker is probably one of the most influential people on the planet&#39 Evening Standard

THE #1 SUNDAY TIMES BESTSELLER
TLS, OBSERVER, SUNDAY TIMES, FT, GUARDIAN, DAILY MAIL AND EVENING STANDARD BOOKS OF THE YEAR 2017

Sleep is one of the most important aspects of our life, health and longevity and yet it is increasingly neglected in twenty-first-century society, with devastating consequences: every major disease in the developed world - Alzheimer&#39s, cancer, obesity, diabetes - has very strong causal links to deficient sleep.

In this book, the first of its kind written by a scientific expert, Professor Matthew Walker explores twenty years of cutting-edge research to solve the mystery of why sleep matters. Looking at creatures from across the animal kingdom as well as major human studies,",978-0141983769,https://m.media-amazon.com/images/I/71hYRUt1rNL._SY522_.jpg,Penguin; 1er édition (4 janvier 2018),Matthew Walker,Troubles du sommeil
