Nom,Prix,Description,Isbn,Photo,Editeur,Auteur,Categorie
"Manuel d’auto-formation pour instruire de la méditation de pleine conscience: Organiser son activité de formation, contenu détaillé des 8 ateliers+journée, 170 questions fréquentes, méditations.",18.93,"En Extrait de l’introduction :
« Ce premier manuel d’auto-formation clefs en main pour instruire de la méditation de pleine conscience en français est à destination des professionnels qui ont déjà installé une pratique régulière donc acquis une certaine expérience - et une expérience certaine - et qui souhaitent intégrer la méditation dans leur activité professionnelle.

Que vous soyez professionnel de santé, psychologue, naturopathe, enseignante de yoga ou bien en pleine réflexion de reconversion, ce manuel vous donnera, je l’espère, le courage de vous lancer pour enseigner de la méditation de pleine conscience auprès d’adultes débutants, que cela soit pour en faire votre activité principale ou bien pour développer un complément d’activité, ou encore enrichir votre activité existante. Par vos interventions avec de la MPC, vous aiderez ainsi grandement à la prise en charge de la souffrance d’un public souffrant de douleurs, de douleurs chroniques, de maladies, de souffrances psychologiques, etc. : c’est- à-dire tout le monde.
Il vous est proposé ici le contenu complet du stage de 8 semaines que j’anime mais vous pouvez bien entendu l’adapter à votre contexte et à un format différent.
Je vous propose de découvrir pas à pas ce protocole dans cet ouvrage inédit en commençant avec tout ce qu’il y a à faire « avant le stage » pour organiser votre activité de formation et qui peut souvent paraître insurmontable et empêcher de se lancer : site Internet, organisme de formation, formation avec certification ou non, santé mentale des participants et du formateur, communication, publicité, offre commerciale, location d’une salle, définition des tarifs, gestion des inscriptions, outils de suivi, etc. Vous trouverez ensuite un chapitre pour chacun des 8 ateliers et la journée de stage avec de nombreux documents, outils, conseils, encadrés et analogies qui vous aideront à faire vôtres les notions et expériences à transmettre. Par exemple, de nombreux encadrés « Posture » vous guideront dans la recherche du « juste » positionnement. Ou encore, des encadrés « Pour en savoir plus » vous aideront à aller plus loin dans la connaissance et la compréhension de ce qui sous-tend le discours auprès des participants. Puis, à la fin de chaque chapitre, un encadré « À retenir » synthétisera les points clefs de l’atelier écoulé.
J’ai essayé de partager tout cela de manière à ce que vous puissiez vous approprier cette méthode simple et de bon sens. Il vous appartiendra de vivre intimement le discours, gage du succès de sa transmission auprès de vos stagiaires, et de vous laisser guider par l’inspiration.
Pour vous aider en cela, vous trouverez en annexes 170 questions fréquentes posées par les participants avec des propositions de réponses, les transcriptions des méditations proposées à chaque atelier ainsi que les courriels types pour chaque étape du processus. »

Cautions médicales
Le Docteur Anne DUMOLARD a écrit la préface de ce manuscrit. Elle est médecin rhumatologue et algologue de réputation nationale, autrice du livre Comprendre et reconnaître la fibromyalgie pour mieux la soulager, médecin du Centre de la douleur du CHU Grenoble Alpes.
Le Docteur Claire Cracowski du CHU de Grenoble, médecin référent du protocole fibromyalgie aux Thermes d’Allevard, établit en 2019, sur la base d’évaluations réalisées auprès des curistes, que l’activité d’enseignement de la méditation de pleine conscience participe à l’amélioration de la qualité de vie et à la satisfaction des curistes porteurs de fibromyalgie au détour d’une cure avec programme fibromyalgie (détails dans le manuscrit).
En 2022, le programme présenté dans ce manuscrit entre au CHU Grenoble Alpes dans le cadre d’une étude clinique réalisée par le Centre de la douleur du CHU sous la supervision du Docteur Caroline Maindet afin d’évaluer l’impact de la MPC dans la douleur chronique.

Aussi pour les particuliers qui souhaitent s’auto-former à la MPC.",979-8372416864,https://m.media-amazon.com/images/I/61OAHXxJc4L._SY522_.jpg,Independently published (3 janvier 2023),Mr Alexis LE CORNEC,Gestion de la douleur
Pain Free (Revised and Updated Second Edition): A Revolutionary Method for Stopping Chronic Pain,17.8,"Live pain free! Now fully updated and revised throughout, this million-copy bestseller will help you feel and move better.

“This book is extraordinary, and I am thrilled to recommend it to anyone who’s interested in dramatically increasing the quality of their physical health.”—Tony Robbins

With a new foreword by John Lynch, Hall of Fame NFL safety and general manager of the San Francisco 49ers

Can gentle exercise help with chronic pain? Yes! That is the revolutionary message of the Egoscue Method, a breakthrough system for eliminating musculoskeletal pain without drugs, surgery, or expensive physical therapy. Developed by Pete Egoscue, an internationally renowned physiologist and injury consultant to some of the most successful performers in all walks of life, the Egoscue Method has helped millions of people with an astounding success rate of over 90 percent. The Method uses a series of gentle exercises and carefully constructed stretches called “E-cises” to teach the body to return to its natural, pain-free state. Inside, you’ll find detailed photographs and step-by-step instructions for dozens of E-cises specifically designed to provide quick and lasting relief of

• joint discomfort, including back and neck pain; achy knees, hips, and shoulders; arthritis; and injured ankles.
• muscle and soft-tissue problems, including rotator cuff injuries, tendinitis, and common foot ailments.
• shooting pains, including sciatica and carpal tunnel syndrome.
• and much more, including headaches, vertigo, and fatigue.

With this book, you’re on your way to regaining the greatest gift of all: a pain-free body!",978-1101886649,https://m.media-amazon.com/images/I/71M7zEn5fQL._SY522_.jpg,Random House Publishing Group; Updated édition (16 novembre 2021),Pete Egoscue,Gestion de la douleur
This Book May Save Your Life: Everyday Health Hacks to Worry Less and Live Better,23.51,"THE #1 SUNDAY TIMES BESTSELLER

&#39When you want to sort medical fact from medical fiction, Dr Karan is your man. This is the only book that will have you laughing and learning in equal measure&#39 Dr Julie Smith, bestselling author of Why Has Nobody Told Me This Before

&#39Wonderfully comforting&#39 Chris van Tulleken, bestselling author of Ultra-Processed People

&#39In a world of charlatans and social media snake-oil salesmen, [Dr Karan] provides a voice of reason...his health hacks may save your life&#39 Mail on Sunday",978-1529136326,https://m.media-amazon.com/images/I/71v7NronpGL._SY522_.jpg,Century (28 décembre 2023),Dr Karan Rajan,Gestion de la douleur
"Fibromyalgie: Journal des symptômes: Cahier à remplir pour gérer la douleur chronique - Journal alimentaire, Agenda pour rendez-vous médicaux, Fiche d&#39évaluation quotidienne et des symptômes",11.64,"CARNET DE SUIVI FIBROMYALGIE À COMPLETER
Ce journal de la douleur est conçu pour les personnes souffrent de fibromyalgie et d&#39autres douleurs chroniques. Il vous permet d&#39identifier vos symptômes et de gérer votre style de vie au quotidien afin d&#39alléger la condition.
En remplissant le formulaire d&#39évaluation quotidienne, il sera possible de corréler et d&#39identifier les possibles facteurs déclenchants (par exemple, certains aliments ou conditions climatiques), ainsi que les activités et les habitudes qui, au contraire, aident à minimiser la douleur (l&#39activité physique, la méditation ou tout simplement une bonne qualité du sommeil).
Le journal peut également être un moyen efficace pour communiquer aux médecins et aux spécialistes qui vous suivent l&#39évolution des symptômes et l’impact d&#39éventuelles thérapies médicales en cours.",978-1676728474,https://m.media-amazon.com/images/I/619SEyi54AS._SY522_.jpg,Independently published (17 décembre 2019),Gina Papeterie,Gestion de la douleur
"La Santé de Deux Mains: Utilisez la médecine naturelle pour soigner vos douleurs et reprendre le contrôle de votre corps et de votre esprit quelque ... tête, grossesse, sommeil, pleurs du bébé...)",19.99,"Pensez votre santé autrement, pensez votre santé naturellement !
Découvrez une science récente au service de l&#39harmonie du corps, une science qui propose de remettre sa santé entre deux mains afin de retrouver puis de maintenir son équilibre vital : la chiropraxie.
À travers ce livre, Marine Garcin communique la beauté de son métier et ce qu&#39il est possible de faire pour aider le plus grand nombre. Elle ouvre également un champ de possibilité que beaucoup ignore avec des outils de développement personnel. Elle nous présente ce que l&#39on peut faire simplement pour améliorer sa qualité de vie.
C’est le moment pour vous de retrouver votre liberté de mouvement, de libérer les maux qui vous tenaillent depuis longtemps et de faire en sorte que votre corps et votre mental vous accompagnent le plus longtemps et aussi harmonieusement que possible !",978-2958361815,https://m.media-amazon.com/images/I/61nVA-vMz4L._SY522_.jpg,MG Éditions (18 février 2023),Marine Garcin D.C.,Gestion de la douleur
LE MAL DE DOS: Un guide complet pour le soulager,16.15,"Vous n’en pouvez plus de vivre avec des douleurs du dos persistantes qui affectent votre qualité de vie et votre mobilité ? 😔
Vous êtes frustré de ne pas comprendre la cause de votre douleur ? Et surtout, vous n’avez pas de solutions durables pour la soulager ?
Pire, vos douleurs s&#39aggravent avec le temps et limite encore plus vos activités quotidiennes?

STOP ! 🛑 Ne laissez pas ces douleurs prendre le contrôle de votre vie ! Si vous ne faites rien maintenant, dans quelques mois, vous risquez de subir des conséquences plus graves à long terme, comme des problèmes de mobilité et des douleurs articulaires, voire pire !

Avec cet ouvrage """,979-8854529556,https://m.media-amazon.com/images/I/61DP4zgLeiL._SY522_.jpg,Independently published (1 août 2023),Léa Vitaleco,Gestion de la douleur
Sophrologie pour la Gestion de la Douleur Chronique: Vaincre la Douleur Chronique,11.36,"1/ Résumé du livre: Dans ce guide innovant, découvrez comment la sophrologie peut transformer votre vie en apaisant la douleur chronique. Avec une approche holistique et des techniques éprouvées, ce livre est plus qu&#39un simple manuel – c&#39est un voyage vers une vie moins douloureuse et plus épanouie.

2/ Le problème traité dans le livre: La douleur chronique, souvent mal comprise et mal traitée, affecte des millions de personnes, entravant leur qualité de vie. Ce fléau, qui peut sembler insurmontable, est abordé ici avec compassion et expertise.

3/ La solution que propose le livre pour traiter ce problème: Grâce à la sophrologie, une méthode douce et efficace, ce livre offre des stratégies concrètes pour gérer et réduire la douleur. Il présente des techniques de relaxation, de respiration et de visualisation pour aider les lecteurs à reprendre le contrôle de leur bien-être.",979-8873022298,https://m.media-amazon.com/images/I/61ycOWte+fL._SY522_.jpg,Independently published (26 décembre 2023),Sophie LAROCHE,Gestion de la douleur
THE COMPLETE GUIDE TO USE TRAMADOL,14.24,"Tramadol is an pain medicine similar to an opioid. Tramadol is used to treat moderate to severe pain. The extended-release form of tramadol is for around-the-clock treatment of pain. Tramadol is also used by veterinarians commonly dispense to manage pain in dogs. Physicians also frequently prescribe tramadol for human aches and pains, and it is one of the few human painkillers that is safe to give to dogs under the guidance of a veterinarian. Scientifically speaking, tramadol is a member of the opioid family, which means it alters the transmission and perception of pain in humans and animals. In addition, tramadol inhibits the reuptake of norepinephrine and serotonin in the dog’s brain, which increases the level of these chemicals in the bloodstream, and creates that feeling of euphoria and well-being that human patients sometimes experience. tramadol is also used to treat acute and chronic pain of moderate to severe intensity",978-1387385263,https://m.media-amazon.com/images/I/61KKkNaWYOL._SY522_.jpg,Lulu.com (21 décembre 2022),Cornee Kolff,Gestion de la douleur
"Brustkrebs - Alles, was jetzt wichtig ist: Diagnose, Behandlung und Begleitung für Betroffene und Angehörige - Mit den neuesten wissenschaftlichen Erkenntnissen",15.2,,978-3442393701,https://m.media-amazon.com/images/I/71BKuiv3bZL._SY522_.jpg,Mosaik Verlag (23 novembre 2022),Nadia Harbeck,Gestion de la douleur
"Built from Broken: A Science-Based Guide to Healing Painful Joints, Preventing Injuries, and Rebuilding Your Body",7.52,"Heal painful joints, prevent injuries, and rebuild your body from the ground up.
(If mainstream fitness advice has left you broken down and beat up, it’s time for a new strategy.)

Most middle-aged fitness enthusiasts and athletes have been dragged down by joint pain, injuries, and other ailments commonly accepted as “part of getting older.”

But it doesn’t have to be this way.

In fact, anyone can conquer joint pain and rebuild their body.
It simply requires understanding the hidden causes and a road map (this book) that leads to the solution.",978-1735728506,https://m.media-amazon.com/images/I/91Y97oylPvL._SY522_.jpg,SaltWrap (7 juin 2021),Scott H Hogan,Gestion de la douleur
"8 Steps to a Pain-Free Back: Natural Posture Solutions for Pain in the Back, Neck, Shoulder, Hip, Knee, and Foot",33.95,"With a fresh approach to a common problem, this self-help guide to overcoming back pain advocates adopting the natural, healthy posture of athletes, young children, and people from traditional societies the world over. Arguing that most of what our culture has taught us about posture is misguided--even unhealthy--and exploring the current epidemic of back pain, many of the commonly cited reasons for the degeneration of spinal discs and the stress on muscles that leads to back pain are examined and debunked. The historical and anthropological roots of poor posture in Western cultures are studied as is the absence of back pain complaints in the cultures of Africa, Asia, South America, and rural Europe. Eight detailed chapters provide illustrated step-by-step instructions for making simple, powerful changes to seated, standing, and sleeping positions. No special equipment or exercise is required, and effects are often immediate.",978-0979303609,https://m.media-amazon.com/images/I/61tKMiXwXPL._SY522_.jpg,Pendo Press; Comme illustré. édition (1 avril 2008),Gokhale E,Gestion de la douleur
"DermoNeuroModulation: Therapie manuelle pour les nerfs peripheriques, notamment les nerfs cutanes",9.53,"La DermoNeuroModulation est une therapie manuelle structuree et interactive qui tient compte du systeme nerveux du patient depuis la cellule jusqu’au sentiment de soi. Les techniques sont lentes, legeres, douces, intelligentes, interactives et efficaces. On combine le positionnement à une tension du champ cutané là où le nerf surgit et se ramifie dans la peau. La manipulation du corps du patient n’est qu’un aspect du contexte thérapeutique à développer pour observer un changement. Bien qu’optionnelle, la thérapie manuelle optimise le rétablissement du patient.",978-2924352090,https://m.media-amazon.com/images/I/715DtmtVKWL._SY522_.jpg,Louise Tremblay (27 avril 2018),Diane Jacobs,Gestion de la douleur
Rebuilding Milo: A Lifter&#39s Guide to Fixing Common Injuries and Building a Strong Foundation for Enhancing Performance,11.11,"Every athlete who spends time in the weight room eventually deals with pain/injury that leaves them frustrated and unable to reach their highest potential. Every athlete ought to have the ability to take the first steps at addressing these minor injuries. They shouldn’t have to wait weeks for a doctor’s appointment, only to be prescribed pain medications and told to “take two weeks off lifting” or, even worse, to “stop lifting so heavy.” Dr. Aaron Horschig knows your pain and frustration. He’s been there. For over a decade, Dr. Horschig has been a competitive weightlifter, and he understands how discouraging it is to tweak your back three weeks out from a huge weightlifting competition, to have knee pain limit your ability to squat heavy for weeks, and to suffer from chronic shoulder issues that keep you from reaching your goals.",978-1628604221,https://m.media-amazon.com/images/I/91uJj2hVVcL._SY522_.jpg,Victory Belt Publishing; 1er édition (19 janvier 2021),Aaron Horschig,Gestion de la douleur
Live Longer and Stronger with Breast Cancer: A Step-By-Step Guide,9.14,"""I&#39M NOT READY TO DIE!"" You want to do everything you can to fight your cancer, prevent it from growing and ensure it doesn&#39t come back, especially when chemotherapy, radiation, and surgery just are not enough. It’s time to do everything you can to spend more time with your family and live a healthier longer life. This book is designed as a step-by-step guide, with current alternative therapies and nutrition in mind to help you fight your breast cancer more effectively, and see years past your given terminal date.As a Naturopathic Doctor, author Lori Bouchard has helped hundreds of patients fight their cancer more effectively and live longer.In this book you will learn:-How to live a longer and healthier life with your breast cancer diagnosis-How to keep your body strong and feeling well while fighting cancer -Which tests and assessments are critical, to fight your disease more effectively.-Which highly researched therapies can be life-enhancing for your cancer care plan.-Foods that will keep your body strong and fight cancer cells.-Easy to prepare and customized meal plans included.-Ways to keep the cancer from coming backCancer is clever and ever changing - this is your chance to get control of your disease.",979-8555955449,https://m.media-amazon.com/images/I/7101UZGC4FL._SY522_.jpg,Independently published (30 octobre 2020),Dr Lori Bouchard Naturopathic Doctor,Gestion de la douleur
Surmonter la rupture Amoureuse quand on aime encore: Accepter la fin de l’amour et vaincre la dépendance affective,5.37,"Comment surmonter une rupture ? comment oublier mon ex et le laisser partir après une séparation ? comment surmonter la dépendance affective et vivre heureux après la fin de l&#39amour ? comment se reconstruire après une séparation douloureuse ?
Après la fin d&#39une relation, plusieurs questions que l&#39on se pose sans trouver de réponses ? C&#39est pourquoi j&#39ai écrit ce livre afin d&#39aider tous ceux qui sont dans la souffrance d&#39une rupture amoureuse, à sortir de cette dépendance affective et de cette emprise émotionnelle après la fin de l&#39amour.

Une séparation ou une rupture est un événement très stressant et émotionnellement complexe. Elle est vécue comme une « perte », la perte d&#39un projet commun et de nombreuses illusions personnelles. Il n&#39est pas facile de surmonter une rupture, mais il est très important de savoir que cette perte émotionnelle et d&#39autres peuvent être surmontées. Pour gérer cette émotion intense et parfois accablante, vous devez la reconnaître , comprendre comment elle fonctionne et apprendre à la diriger , plutôt que de la laisser nous ou nous diriger.

La plupart des gens ont vécu ou traverseront, au moins une fois dans leur vie, l&#39expérience dévastatrice d&#39avoir le cœur brisé. Personne n&#39est à l&#39abri d&#39une rupture. Cela peut causer des dommages psychologiques qui nous impactent de multiples façons : dépression, insomnie, apathie, anxiété, pensées intrusives, etc. Et entre la morve et les chansons sentimentales tristes, vous réfléchissez à la manière de continuer votre vie. Et heureusement vous pouvez surmonter une rupture de couple dans lequel nous allons vous aider et vous donner quelques conseils clés pour savoir quoi faire pour surmonter une rupture de couple et vaincre la dépendance affective.",979-8455647833,https://m.media-amazon.com/images/I/6193cJXfmnL._SY522_.jpg,Independently published (13 août 2021),Laura Rosucci,Gestion de la douleur
Comment j’ai Vaincu l&#39Arthrose: Triomphez de l&#39arthrose au quotidien Des stratégies pratiques pour vivre sans douleur et reprendre le contrôle de votre vie,6.96,"Laura Borrel, auteure inspirante et rescapée de l&#39arthrose, partage son incroyable parcours de guérison dans ""Comment J&#39ai Vaincu l&#39Arthrose"". Ce livre offre bien plus qu&#39un simple récit personnel ; c&#39est un guide complet pour tous ceux qui cherchent à surmonter l&#39arthrose et à vivre une vie sans douleur.
L&#39arthrose peut sembler être une condamnation à vie de douleur et de limitations, mais Laura démontre que cela ne doit pas être le cas. Elle a relevé le défi et a exploré un large éventail de traitements conventionnels et alternatifs pour trouver ce qui fonctionne vraiment.
Dans cette œuvre, Laura partage avec humour et sincérité ses découvertes et ses expériences avec les différentes approches, Vous y trouverez des",979-8854621489,https://m.media-amazon.com/images/I/6111UJHa+rL._SY522_.jpg,Independently published (2 août 2023),Laura Borrel,Gestion de la douleur
Comprendre et surmonter le syndrome du jumeau perdu + Témoignage: Question / réponse et témoignage sur le syndrome du jumeau perdu,5.16,"Dans les méandres de la psyché humaine se cachent des expériences uniques et profondément complexes. L&#39un de ces phénomènes peu connus, mais d&#39une portée émotionnelle considérable, est le ""Syndrome du Jumeau Perdu"". Cette réalité méconnue englobe les émotions, les pensées et les questions qui surgissent lorsque l&#39on perd un jumeau identique avant ou peu après la naissance. Au-delà des apparences, un lien indéfectible unit les jumeaux, même lorsque l&#39un d&#39eux disparaît précocement.
Ce livre a pour ambition de jeter une lumière éclairante sur le Syndrome du Jumeau Perdu, en explorant ses ramifications psychologiques et émotionnelles, et en offrant des réponses claires et des perspectives uniques. À travers des questions et réponses approfondies, nous explorerons les nuances de cette expérience singulière, les défis qu&#39elle représente pour les jumeaux survivants et leurs familles, tout en mettant en lumière les ressources qui les aident à surmonter ce périple émotionnel.
Au-delà des concepts académiques, ce livre s&#39appuiera également sur des témoignages poignants de jumeaux survivants, qui ont généreusement partagé leurs histoires personnelles. Leurs récits sincères et touchants nous plongeront dans leur monde intérieur, mettant en évidence les tourments, les espoirs et les victoires qui ont marqué leur voyage à travers le deuil et la résilience.
Que vous soyez un jumeau survivant en quête de compréhension et d&#39acceptation, un parent cherchant à soutenir votre enfant, ou simplement curieux de découvrir la profondeur des liens humains, ce livre a été conçu pour éclairer votre chemin. En parcourant ses pages, nous espérons que vous trouverez des réponses, de l&#39empathie et des outils pour comprendre et surmonter le Syndrome du Jumeau Perdu, honorant ainsi ces liens invisibles qui transcendent la vie et la mort.",979-8853517455,https://m.media-amazon.com/images/I/61gZcX+0tzL._SY522_.jpg,Independently published (24 juillet 2023),Louis WEBER,Gestion de la douleur
"Carnet de Bord d&#39une fibro libérée: La Fibromyalgie, je m’en suis sortie, pourquoi pas vous ?",17.93,"En 2007, une rhumatologue m’a diagnostiqué une fibromyalgie, maladie particulièrement invalidante.
À 32 ans je n&#39avais pas envie d&#39être dépendante et un poids pour mon entourage.
Alors, durant plus de 13 ans, et encore aujourd’hui, j’ai testé, expérimenté, changé, modifié énormément de choses dans ma vie.
J’ai compris et réalisé que j’étais responsable de mon existence, de ma santé, de mes pensées.
Et un jour, je me suis dit qu’il serait dommage de garder pour moi tout ce processus qui m’a permis d’aller mieux.
Aujourd&#39hui, je suis heureuse de partager avec vous mon témoignage, afin que cela vous aide et vous fasse gagner du temps, ce qui est essentiel pour moi, l&#39ayant vécu.
Dans cet ouvrage, je retrace mon parcours et les causes qui ont déclenché cette maladie. Je vous explique comment j’ai réussi à reprendre ma vie en main, à être en bonne santé et épanouie !",979-8737331887,https://m.media-amazon.com/images/I/612f7XZirGS._SY522_.jpg,Independently published (22 avril 2021),Estelle GODART,Gestion de la douleur
